{"affine_scan_mode": "cpu_batch_prod_zz_zzz", "affine_scan_seconds": 0.015511, "backend": "metal", "budget_sec": 45, "bytes_per_target": 2.683818, "candidate_verification": "tag16_hash_filter_then_cpu_exact_key_equality", "commit": "f19bf60", "confirmation_index": 2, "confirmation_runs": 2, "confirmation_status": "keep", "cooldown_sec": 5.0, "correctness": true, "description": "Metal XYZZ affine DP scan with explicit tag16 hash filter on a 25M-target distinct-miss batch", "distance_tracking": "packet_distance_uint64", "dp_bits": 8, "dp_checksum": "0x9dba4a07ebbb8e14", "dp_count": 1057, "dp_distance_checksum": "0xf0dc88ed68b2ff64", "dp_query_count": 1057, "dp_tracking": "affine_x256_y_parity_cpu_batch", "exact_host_table_bytes": 1268635456, "experiment": "metal_jacobian_dynamic_dp_stream_xyzz_affine_scan_target_lookup_tag16_hash_filter25m", "filter_false_positive_count": 216, "filter_positive_count": 280, "gpu_ops_per_sec": 100673105.31053, "hit_count": 64, "injected_hits": 64, "iterations": 134217728, "jump_count": 16, "jump_histogram_max_bucket": 8394316, "jump_histogram_max_deviation_ppm": 759, "jump_histogram_min_bucket": 8382245, "jump_index": "power2_mask", "jump_mixer": "avalanche64", "jump_schedule": "power2", "lookup_engine": "gpu_filter16_hash", "lookup_engine_effective": "gpu_filter16_hash", "lookup_layout": "open_address_tag16_hash_filter_exact256", "lookup_max_threads_per_threadgroup": 1024, "lookup_query_mode": "distinct_misses", "lookup_repeat": 1024, "lookup_seconds": 0.021872, "lookup_thread_execution_width": 32, "lookup_threadgroup_limit": 512, "lookup_threads_per_threadgroup": 512, "lookups_per_sec": 49485620.536664, "machine": "macOS-26.5-arm64-arm-64bit-Mach-O", "max_threads_per_threadgroup": 1024, "min_ms": 500, "miss_count": 1082304, "operation": "jacobian_affine_scan_target_lookup_tag32", "ops_per_sec": 97927206.806094, "ops_per_sec_max": 112659946.729275, "ops_per_sec_min": 58218265.368221, "output_layout": "affine_dp_scan_target_lookup", "paired_baseline_ops_per_sec": 90575505.666126, "paired_baseline_ref": "main^", "paired_speedup": 1.081166548129109, "query_count": 1082368, "query_input": "hash64", "raw_status": "keep", "reason": "", "requested_hits": 64, "runner_sample_count": 3, "sample_count": 262144, "seconds": 1.333203, "skipped": false, "state_layout": "xyzz", "status": "keep", "steps_per_sample": 512, "target_bucket_bytes": 268435456, "target_count": 25005000, "target_filter_bucket_bytes": 67108864, "target_key": "x256_y_parity", "target_key_bytes": 1000200000, "target_lookup_checksum": "0x8b2568562837af7f", "target_query_hash_bytes": 8658944, "target_table_buckets": 33554432, "target_table_bytes": 67108864, "thread_execution_width": 32, "threadgroup_limit": 128, "threads_per_threadgroup": 128, "timestamp": "2026-06-26T21:10:53Z", "validation_seconds": 4.716184, "validation_workers": 8}
{"affine_scan_mode": "cpu_batch_prod_zz_zzz", "affine_scan_seconds": 0.018589, "backend": "metal", "budget_sec": 45, "bytes_per_target": 2.683818, "candidate_verification": "tag16_hash_filter_then_cpu_exact_key_equality", "commit": "1e2ca77", "confirmation_index": 1, "confirmation_runs": 2, "confirmation_status": "keep", "cooldown_sec": 5.0, "correctness": true, "description": "Metal XYZZ affine DP scan tag16 hash filter versus CPU lookup on a 25M-target distinct-miss batch", "distance_tracking": "packet_distance_uint64", "dp_bits": 8, "dp_checksum": "0x9dba4a07ebbb8e14", "dp_count": 1057, "dp_distance_checksum": "0xf0dc88ed68b2ff64", "dp_query_count": 1057, "dp_tracking": "affine_x256_y_parity_cpu_batch", "exact_host_table_bytes": 1268635456, "experiment": "metal_jacobian_dynamic_dp_stream_xyzz_affine_scan_target_lookup_tag16_hash_filter25m_cpu_gate", "filter_false_positive_count": 216, "filter_positive_count": 280, "gpu_ops_per_sec": 122605136.517791, "hit_count": 64, "injected_hits": 64, "iterations": 134217728, "jump_count": 16, "jump_histogram_max_bucket": 8394316, "jump_histogram_max_deviation_ppm": 759, "jump_histogram_min_bucket": 8382245, "jump_index": "power2_mask", "jump_mixer": "avalanche64", "jump_schedule": "power2", "lookup_engine": "gpu_filter16_hash", "lookup_engine_effective": "gpu_filter16_hash", "lookup_layout": "open_address_tag16_hash_filter_exact256", "lookup_max_threads_per_threadgroup": 1024, "lookup_query_mode": "distinct_misses", "lookup_repeat": 1024, "lookup_seconds": 0.018154, "lookup_thread_execution_width": 32, "lookup_threadgroup_limit": 512, "lookup_threads_per_threadgroup": 512, "lookups_per_sec": 59622965.038999, "machine": "macOS-26.5-arm64-arm-64bit-Mach-O", "max_threads_per_threadgroup": 1024, "min_ms": 500, "miss_count": 1082304, "operation": "jacobian_affine_scan_target_lookup_tag32", "ops_per_sec": 118623733.699262, "ops_per_sec_max": 119900450.032723, "ops_per_sec_min": 113999797.555627, "output_layout": "affine_dp_scan_target_lookup", "paired_baseline_ops_per_sec": 107559765.934095, "paired_baseline_ref": "main^", "paired_speedup": 1.102863442190328, "query_count": 1082368, "query_input": "hash64", "raw_status": "keep", "reason": "", "requested_hits": 64, "runner_sample_count": 3, "sample_count": 262144, "seconds": 1.094715, "skipped": false, "state_layout": "xyzz", "status": "keep", "steps_per_sample": 512, "target_bucket_bytes": 268435456, "target_count": 25005000, "target_filter_bucket_bytes": 67108864, "target_key": "x256_y_parity", "target_key_bytes": 1000200000, "target_lookup_checksum": "0x8b2568562837af7f", "target_query_hash_bytes": 8658944, "target_table_buckets": 33554432, "target_table_bytes": 67108864, "thread_execution_width": 32, "threadgroup_limit": 128, "threads_per_threadgroup": 128, "timestamp": "2026-06-26T21:21:50Z", "validation_seconds": 4.287983, "validation_workers": 8}
{"affine_scan_mode": "cpu_batch_prod_zz_zzz", "affine_scan_seconds": 0.015749, "backend": "metal", "budget_sec": 45, "bytes_per_target": 2.683818, "candidate_verification": "tag16_hash_filter_then_cpu_exact_key_equality", "commit": "1e2ca77", "confirmation_index": 2, "confirmation_runs": 2, "confirmation_status": "keep", "cooldown_sec": 5.0, "correctness": true, "description": "Metal XYZZ affine DP scan tag16 hash filter versus CPU lookup on a 25M-target distinct-miss batch", "distance_tracking": "packet_distance_uint64", "dp_bits": 8, "dp_checksum": "0x9dba4a07ebbb8e14", "dp_count": 1057, "dp_distance_checksum": "0xf0dc88ed68b2ff64", "dp_query_count": 1057, "dp_tracking": "affine_x256_y_parity_cpu_batch", "exact_host_table_bytes": 1268635456, "experiment": "metal_jacobian_dynamic_dp_stream_xyzz_affine_scan_target_lookup_tag16_hash_filter25m_cpu_gate", "filter_false_positive_count": 216, "filter_positive_count": 280, "gpu_ops_per_sec": 116058733.675937, "hit_count": 64, "injected_hits": 64, "iterations": 134217728, "jump_count": 16, "jump_histogram_max_bucket": 8394316, "jump_histogram_max_deviation_ppm": 759, "jump_histogram_min_bucket": 8382245, "jump_index": "power2_mask", "jump_mixer": "avalanche64", "jump_schedule": "power2", "lookup_engine": "gpu_filter16_hash", "lookup_engine_effective": "gpu_filter16_hash", "lookup_layout": "open_address_tag16_hash_filter_exact256", "lookup_max_threads_per_threadgroup": 1024, "lookup_query_mode": "distinct_misses", "lookup_repeat": 1024, "lookup_seconds": 0.039515, "lookup_thread_execution_width": 32, "lookup_threadgroup_limit": 512, "lookup_threads_per_threadgroup": 512, "lookups_per_sec": 27391261.524333, "machine": "macOS-26.5-arm64-arm-64bit-Mach-O", "max_threads_per_threadgroup": 1024, "min_ms": 500, "miss_count": 1082304, "operation": "jacobian_affine_scan_target_lookup_tag32", "ops_per_sec": 110765603.652636, "ops_per_sec_max": 116873623.792396, "ops_per_sec_min": 94156576.300225, "output_layout": "affine_dp_scan_target_lookup", "paired_baseline_ops_per_sec": 106798322.172981, "paired_baseline_ref": "main^", "paired_speedup": 1.03714741391938, "query_count": 1082368, "query_input": "hash64", "raw_status": "keep", "reason": "", "requested_hits": 64, "runner_sample_count": 3, "sample_count": 262144, "seconds": 1.156464, "skipped": false, "state_layout": "xyzz", "status": "keep", "steps_per_sample": 512, "target_bucket_bytes": 268435456, "target_count": 25005000, "target_filter_bucket_bytes": 67108864, "target_key": "x256_y_parity", "target_key_bytes": 1000200000, "target_lookup_checksum": "0x8b2568562837af7f", "target_query_hash_bytes": 8658944, "target_table_buckets": 33554432, "target_table_bytes": 67108864, "thread_execution_width": 32, "threadgroup_limit": 128, "threads_per_threadgroup": 128, "timestamp": "2026-06-26T21:21:50Z", "validation_seconds": 4.115145, "validation_workers": 8}
{"affine_scan_mode": "cpu_batch_prod_zz_zzz", "affine_scan_seconds": 0.042094, "backend": "metal", "budget_sec": 45, "bytes_per_target": 2.683818, "candidate_verification": "tag16_hash_filter_then_cpu_exact_key_equality", "commit": "43974c5", "confirmation_index": 1, "confirmation_runs": 2, "confirmation_status": "discard", "cooldown_sec": 5.0, "correctness": true, "description": "Auto lookup policy routing to tag16 hash filter on a 25M-target distinct-miss batch", "distance_tracking": "packet_distance_uint64", "dp_bits": 8, "dp_checksum": "0x9dba4a07ebbb8e14", "dp_count": 1057, "dp_distance_checksum": "0xf0dc88ed68b2ff64", "dp_query_count": 1057, "dp_tracking": "affine_x256_y_parity_cpu_batch", "exact_host_table_bytes": 1268635456, "experiment": "metal_jacobian_dynamic_dp_stream_xyzz_affine_scan_target_lookup_auto_tag16_hash25m", "filter_false_positive_count": 216, "filter_positive_count": 280, "gpu_ops_per_sec": 29935514.26892, "hit_count": 64, "injected_hits": 64, "iterations": 134217728, "jump_count": 16, "jump_histogram_max_bucket": 8394316, "jump_histogram_max_deviation_ppm": 759, "jump_histogram_min_bucket": 8382245, "jump_index": "power2_mask", "jump_mixer": "avalanche64", "jump_schedule": "power2", "lookup_engine": "auto", "lookup_engine_effective": "gpu_filter16_hash", "lookup_layout": "open_address_tag16_hash_filter_exact256", "lookup_max_threads_per_threadgroup": 1024, "lookup_query_mode": "distinct_misses", "lookup_repeat": 1024, "lookup_seconds": 0.037439, "lookup_thread_execution_width": 32, "lookup_threadgroup_limit": 512, "lookup_threads_per_threadgroup": 512, "lookups_per_sec": 28910044.927015, "machine": "macOS-26.5-arm64-arm-64bit-Mach-O", "max_threads_per_threadgroup": 1024, "min_ms": 500, "miss_count": 1082304, "operation": "jacobian_affine_scan_target_lookup_tag32", "ops_per_sec": 29413745.64962, "ops_per_sec_max": 52711019.28593, "ops_per_sec_min": 25462239.077181, "output_layout": "affine_dp_scan_target_lookup", "paired_baseline_ops_per_sec": 66400159.88788, "paired_baseline_ref": "main^", "paired_speedup": 0.44297703046629083, "query_count": 1082368, "query_input": "hash64", "raw_status": "discard", "reason": "", "requested_hits": 64, "runner_sample_count": 3, "sample_count": 262144, "seconds": 4.483562, "skipped": false, "state_layout": "xyzz", "status": "discard", "steps_per_sample": 512, "target_bucket_bytes": 268435456, "target_count": 25005000, "target_filter_bucket_bytes": 67108864, "target_key": "x256_y_parity", "target_key_bytes": 1000200000, "target_lookup_checksum": "0x8b2568562837af7f", "target_query_hash_bytes": 8658944, "target_table_buckets": 33554432, "target_table_bytes": 67108864, "thread_execution_width": 32, "threadgroup_limit": 128, "threads_per_threadgroup": 128, "timestamp": "2026-06-26T21:31:47Z", "validation_seconds": 17.434761, "validation_workers": 8}
{"affine_scan_mode": "cpu_batch_prod_zz_zzz", "affine_scan_seconds": 0.086238, "backend": "metal", "budget_sec": 45, "bytes_per_target": 2.683818, "candidate_verification": "tag16_hash_filter_then_cpu_exact_key_equality", "commit": "43974c5", "confirmation_index": 2, "confirmation_runs": 2, "confirmation_status": "discard", "cooldown_sec": 5.0, "correctness": true, "description": "Auto lookup policy routing to tag16 hash filter on a 25M-target distinct-miss batch", "distance_tracking": "packet_distance_uint64", "dp_bits": 8, "dp_checksum": "0x9dba4a07ebbb8e14", "dp_count": 1057, "dp_distance_checksum": "0xf0dc88ed68b2ff64", "dp_query_count": 1057, "dp_tracking": "affine_x256_y_parity_cpu_batch", "exact_host_table_bytes": 1268635456, "experiment": "metal_jacobian_dynamic_dp_stream_xyzz_affine_scan_target_lookup_auto_tag16_hash25m", "filter_false_positive_count": 216, "filter_positive_count": 280, "gpu_ops_per_sec": 32905458.883148, "hit_count": 64, "injected_hits": 64, "iterations": 134217728, "jump_count": 16, "jump_histogram_max_bucket": 8394316, "jump_histogram_max_deviation_ppm": 759, "jump_histogram_min_bucket": 8382245, "jump_index": "power2_mask", "jump_mixer": "avalanche64", "jump_schedule": "power2", "lookup_engine": "auto", "lookup_engine_effective": "gpu_filter16_hash", "lookup_layout": "open_address_tag16_hash_filter_exact256", "lookup_max_threads_per_threadgroup": 1024, "lookup_query_mode": "distinct_misses", "lookup_repeat": 1024, "lookup_seconds": 0.021024, "lookup_thread_execution_width": 32, "lookup_threadgroup_limit": 512, "lookup_threads_per_threadgroup": 512, "lookups_per_sec": 51481575.481717, "machine": "macOS-26.5-arm64-arm-64bit-Mach-O", "max_threads_per_threadgroup": 1024, "min_ms": 500, "miss_count": 1082304, "operation": "jacobian_affine_scan_target_lookup_tag32", "ops_per_sec": 32062314.332331, "ops_per_sec_max": 32444410.04459, "ops_per_sec_min": 26434795.804036, "output_layout": "affine_dp_scan_target_lookup", "paired_baseline_ops_per_sec": 36873396.429112, "paired_baseline_ref": "main^", "paired_speedup": 0.8695243030831141, "query_count": 1082368, "query_input": "hash64", "raw_status": "discard", "reason": "", "requested_hits": 64, "runner_sample_count": 3, "sample_count": 262144, "seconds": 4.078889, "skipped": false, "state_layout": "xyzz", "status": "discard", "steps_per_sample": 512, "target_bucket_bytes": 268435456, "target_count": 25005000, "target_filter_bucket_bytes": 67108864, "target_key": "x256_y_parity", "target_key_bytes": 1000200000, "target_lookup_checksum": "0x8b2568562837af7f", "target_query_hash_bytes": 8658944, "target_table_buckets": 33554432, "target_table_bytes": 67108864, "thread_execution_width": 32, "threadgroup_limit": 128, "threads_per_threadgroup": 128, "timestamp": "2026-06-26T21:31:47Z", "validation_seconds": 8.087639, "validation_workers": 8}
{"affine_scan_mode": "cpu_batch_prod_zz_zzz", "affine_scan_seconds": 0.030188, "backend": "metal", "budget_sec": 45, "bytes_per_target": 2.683818, "candidate_verification": "tag16_hash_filter_then_cpu_exact_key_equality", "commit": "87d8025", "confirmation_index": 1, "confirmation_runs": 2, "confirmation_status": "discard", "cooldown_sec": 5.0, "correctness": true, "description": "Sparse exact validation for integrated filter engines on a 25M-target tag16 hash lookup batch", "distance_tracking": "packet_distance_uint64", "dp_bits": 8, "dp_checksum": "0x9dba4a07ebbb8e14", "dp_count": 1057, "dp_distance_checksum": "0xf0dc88ed68b2ff64", "dp_query_count": 1057, "dp_tracking": "affine_x256_y_parity_cpu_batch", "exact_host_table_bytes": 1268635456, "experiment": "metal_jacobian_dynamic_dp_stream_xyzz_affine_scan_target_lookup_filter_sparse_validation25m", "filter_false_positive_count": 216, "filter_positive_count": 280, "gpu_ops_per_sec": 29916685.786447, "hit_count": 64, "injected_hits": 64, "iterations": 134217728, "jump_count": 16, "jump_histogram_max_bucket": 8394316, "jump_histogram_max_deviation_ppm": 759, "jump_histogram_min_bucket": 8382245, "jump_index": "power2_mask", "jump_mixer": "avalanche64", "jump_schedule": "power2", "lookup_engine": "gpu_filter16_hash", "lookup_engine_effective": "gpu_filter16_hash", "lookup_layout": "open_address_tag16_hash_filter_exact256", "lookup_max_threads_per_threadgroup": 1024, "lookup_query_mode": "distinct_misses", "lookup_repeat": 1024, "lookup_seconds": 0.042084, "lookup_thread_execution_width": 32, "lookup_threadgroup_limit": 512, "lookup_threads_per_threadgroup": 512, "lookups_per_sec": 25719101.093693, "machine": "macOS-26.5-arm64-arm-64bit-Mach-O", "max_threads_per_threadgroup": 1024, "min_ms": 500, "miss_count": 1082304, "operation": "jacobian_affine_scan_target_lookup_tag32", "ops_per_sec": 29442389.766506, "ops_per_sec_max": 31711763.503007, "ops_per_sec_min": 25976627.184562, "output_layout": "affine_dp_scan_target_lookup", "paired_baseline_ops_per_sec": 32451339.308134, "paired_baseline_ref": "main^", "paired_speedup": 0.9072781091388176, "query_count": 1082368, "query_input": "hash64", "raw_status": "discard", "reason": "", "requested_hits": 64, "runner_sample_count": 3, "sample_count": 262144, "seconds": 4.486384, "skipped": false, "state_layout": "xyzz", "status": "discard", "steps_per_sample": 512, "target_bucket_bytes": 268435456, "target_count": 25005000, "target_filter_bucket_bytes": 67108864, "target_key": "x256_y_parity", "target_key_bytes": 1000200000, "target_lookup_checksum": "0x8b2568562837af7f", "target_query_hash_bytes": 8658944, "target_table_buckets": 33554432, "target_table_bytes": 67108864, "thread_execution_width": 32, "threadgroup_limit": 128, "threads_per_threadgroup": 128, "timestamp": "2026-06-26T21:47:17Z", "validation_seconds": 6.891431, "validation_workers": 8}
{"affine_scan_mode": "cpu_batch_prod_zz_zzz", "affine_scan_seconds": 0.030367, "backend": "metal", "budget_sec": 45, "bytes_per_target": 2.683818, "candidate_verification": "tag16_hash_filter_then_cpu_exact_key_equality", "commit": "87d8025", "confirmation_index": 2, "confirmation_runs": 2, "confirmation_status": "discard", "cooldown_sec": 5.0, "correctness": true, "description": "Sparse exact validation for integrated filter engines on a 25M-target tag16 hash lookup batch", "distance_tracking": "packet_distance_uint64", "dp_bits": 8, "dp_checksum": "0x9dba4a07ebbb8e14", "dp_count": 1057, "dp_distance_checksum": "0xf0dc88ed68b2ff64", "dp_query_count": 1057, "dp_tracking": "affine_x256_y_parity_cpu_batch", "exact_host_table_bytes": 1268635456, "experiment": "metal_jacobian_dynamic_dp_stream_xyzz_affine_scan_target_lookup_filter_sparse_validation25m", "filter_false_positive_count": 216, "filter_positive_count": 280, "gpu_ops_per_sec": 27426054.656251, "hit_count": 64, "injected_hits": 64, "iterations": 134217728, "jump_count": 16, "jump_histogram_max_bucket": 8394316, "jump_histogram_max_deviation_ppm": 759, "jump_histogram_min_bucket": 8382245, "jump_index": "power2_mask", "jump_mixer": "avalanche64", "jump_schedule": "power2", "lookup_engine": "gpu_filter16_hash", "lookup_engine_effective": "gpu_filter16_hash", "lookup_layout": "open_address_tag16_hash_filter_exact256", "lookup_max_threads_per_threadgroup": 1024, "lookup_query_mode": "distinct_misses", "lookup_repeat": 1024, "lookup_seconds": 0.089683, "lookup_thread_execution_width": 32, "lookup_threadgroup_limit": 512, "lookup_threads_per_threadgroup": 512, "lookups_per_sec": 12068769.578879, "machine": "macOS-26.5-arm64-arm-64bit-Mach-O", "max_threads_per_threadgroup": 1024, "min_ms": 500, "miss_count": 1082304, "operation": "jacobian_affine_scan_target_lookup_tag32", "ops_per_sec": 26769370.789497, "ops_per_sec_max": 32408430.731836, "ops_per_sec_min": 23869758.937289, "output_layout": "affine_dp_scan_target_lookup", "paired_baseline_ops_per_sec": 33207078.010911, "paired_baseline_ref": "main^", "paired_speedup": 0.8061344867712018, "query_count": 1082368, "query_input": "hash64", "raw_status": "discard", "reason": "", "requested_hits": 64, "runner_sample_count": 3, "sample_count": 262144, "seconds": 4.893804, "skipped": false, "state_layout": "xyzz", "status": "discard", "steps_per_sample": 512, "target_bucket_bytes": 268435456, "target_count": 25005000, "target_filter_bucket_bytes": 67108864, "target_key": "x256_y_parity", "target_key_bytes": 1000200000, "target_lookup_checksum": "0x8b2568562837af7f", "target_query_hash_bytes": 8658944, "target_table_buckets": 33554432, "target_table_bytes": 67108864, "thread_execution_width": 32, "threadgroup_limit": 128, "threads_per_threadgroup": 128, "timestamp": "2026-06-26T21:47:17Z", "validation_seconds": 9.624156, "validation_workers": 8}
