{"backend": "metal", "budget_sec": 10, "commit": "604dd55", "correctness": true, "description": "Metal Jacobian jump-table walk with projective distinguished-point candidate flags", "distance_checksum": "0xa45f471493cace2f", "distance_tracking": "uint64", "dp_bits": 4, "dp_checksum": "0x30a7914972cba014", "dp_count": 1000, "dp_tracking": "projective_x_limb0", "experiment": "metal_jacobian_jump_walk_dp", "iterations": 2359296, "jump_count": 16, "machine": "macOS-26.5-arm64-arm-64bit-Mach-O", "max_threads_per_threadgroup": 1024, "min_ms": 50, "operation": "jacobian_affine_walk_jump_table", "ops_per_sec": 46781458.735324, "ops_per_sec_max": 48458990.526947, "ops_per_sec_min": 41301965.756239, "paired_baseline_ops_per_sec": 45497141.628023, "paired_baseline_ref": "main", "paired_speedup": 1.0282285229652748, "reason": "", "runner_sample_count": 5, "sample_count": 16384, "seconds": 0.050432, "skipped": false, "status": "keep", "steps_per_sample": 8, "thread_execution_width": 32, "threadgroup_limit": 256, "threads_per_threadgroup": 256, "timestamp": "2026-06-21T09:09:27Z"}
{"backend": "metal", "budget_sec": 10, "commit": "12261fd", "correctness": true, "description": "Metal Jacobian jump-table walk with projective distinguished-point candidate flags", "distance_checksum": "0xa45f471493cace2f", "distance_tracking": "uint64", "dp_bits": 4, "dp_checksum": "0x30a7914972cba014", "dp_count": 1000, "dp_tracking": "projective_x_limb0", "experiment": "metal_jacobian_jump_walk_dp", "iterations": 2228224, "jump_count": 16, "machine": "macOS-26.5-arm64-arm-64bit-Mach-O", "max_threads_per_threadgroup": 1024, "min_ms": 50, "operation": "jacobian_affine_walk_jump_table", "ops_per_sec": 43313091.164017, "ops_per_sec_max": 48094979.612577, "ops_per_sec_min": 31150164.917053, "paired_baseline_ops_per_sec": 34911331.312607, "paired_baseline_ref": "main", "paired_speedup": 1.2406599672804801, "reason": "", "runner_sample_count": 5, "sample_count": 16384, "seconds": 0.051445, "skipped": false, "status": "keep", "steps_per_sample": 8, "thread_execution_width": 32, "threadgroup_limit": 256, "threads_per_threadgroup": 256, "timestamp": "2026-06-21T09:21:33Z"}
{"backend": "metal", "budget_sec": 10, "commit": "12261fd", "correctness": true, "description": "Metal Jacobian jump-table walk with projective distinguished-point candidate flags", "distance_checksum": "0xa45f471493cace2f", "distance_tracking": "uint64", "dp_bits": 4, "dp_checksum": "0x30a7914972cba014", "dp_count": 1000, "dp_tracking": "projective_x_limb0", "experiment": "metal_jacobian_jump_walk_dp", "iterations": 2228224, "jump_count": 16, "machine": "macOS-26.5-arm64-arm-64bit-Mach-O", "max_threads_per_threadgroup": 1024, "min_ms": 50, "operation": "jacobian_affine_walk_jump_table", "ops_per_sec": 43163082.615191, "ops_per_sec_max": 52263473.907718, "ops_per_sec_min": 21894274.334563, "paired_baseline_ops_per_sec": 43781915.905634, "paired_baseline_ref": "main", "paired_speedup": 0.9858655502473483, "reason": "", "runner_sample_count": 5, "sample_count": 16384, "seconds": 0.051623, "skipped": false, "status": "discard", "steps_per_sample": 8, "thread_execution_width": 32, "threadgroup_limit": 256, "threads_per_threadgroup": 256, "timestamp": "2026-06-21T09:22:28Z"}
{"backend": "metal", "budget_sec": 10, "commit": "889a959", "correctness": true, "description": "Metal Jacobian jump-table walk with projective distinguished-point candidate flags", "distance_checksum": "0xa45f471493cace2f", "distance_tracking": "uint64", "dp_bits": 4, "dp_checksum": "0x30a7914972cba014", "dp_count": 1000, "dp_tracking": "projective_x_limb0", "experiment": "metal_jacobian_jump_walk_dp", "iterations": 1966080, "jump_count": 16, "machine": "macOS-26.5-arm64-arm-64bit-Mach-O", "max_threads_per_threadgroup": 1024, "min_ms": 50, "operation": "jacobian_affine_walk_jump_table", "ops_per_sec": 39023071.16421, "ops_per_sec_max": 52396097.499707, "ops_per_sec_min": 19663503.363022, "paired_baseline_ops_per_sec": 42888813.210105, "paired_baseline_ref": "main", "paired_speedup": 0.9098659590565635, "reason": "", "runner_sample_count": 5, "sample_count": 16384, "seconds": 0.050383, "skipped": false, "status": "discard", "steps_per_sample": 8, "thread_execution_width": 32, "threadgroup_limit": 256, "threads_per_threadgroup": 256, "timestamp": "2026-06-21T09:30:35Z"}
{"backend": "metal", "budget_sec": 10, "commit": "983c7c3", "correctness": true, "description": "Metal Jacobian jump-table walk with projective distinguished-point candidate flags", "distance_checksum": "0xa45f471493cace2f", "distance_tracking": "uint64", "dp_bits": 4, "dp_checksum": "0x30a7914972cba014", "dp_count": 1000, "dp_tracking": "projective_x_limb0", "experiment": "metal_jacobian_jump_walk_dp", "iterations": 1441792, "jump_count": 16, "machine": "macOS-26.5-arm64-arm-64bit-Mach-O", "max_threads_per_threadgroup": 1024, "min_ms": 50, "operation": "jacobian_affine_walk_jump_table", "ops_per_sec": 28385107.764488, "ops_per_sec_max": 39082350.357464, "ops_per_sec_min": 19382181.146026, "paired_baseline_ops_per_sec": 35725191.65411, "paired_baseline_ref": "main", "paired_speedup": 0.794540391534119, "reason": "", "runner_sample_count": 5, "sample_count": 16384, "seconds": 0.050794, "skipped": false, "status": "discard", "steps_per_sample": 8, "thread_execution_width": 32, "threadgroup_limit": 256, "threads_per_threadgroup": 256, "timestamp": "2026-06-21T09:35:24Z"}
{"backend": "metal", "budget_sec": 10, "commit": "b6eec70", "correctness": true, "description": "Metal Jacobian jump-table walk with projective distinguished-point candidate flags", "distance_checksum": "0xa45f471493cace2f", "distance_tracking": "uint64", "dp_bits": 4, "dp_checksum": "0x30a7914972cba014", "dp_count": 1000, "dp_tracking": "projective_x_limb0", "experiment": "metal_jacobian_jump_walk_dp", "iterations": 1572864, "jump_count": 16, "machine": "macOS-26.5-arm64-arm-64bit-Mach-O", "max_threads_per_threadgroup": 1024, "min_ms": 50, "operation": "jacobian_affine_walk_jump_table", "ops_per_sec": 30186670.513289, "ops_per_sec_max": 49482955.680513, "ops_per_sec_min": 19553865.166506, "paired_baseline_ops_per_sec": 44007021.060713, "paired_baseline_ref": "main", "paired_speedup": 0.6859512365457058, "reason": "", "runner_sample_count": 5, "sample_count": 16384, "seconds": 0.052105, "skipped": false, "status": "discard", "steps_per_sample": 8, "thread_execution_width": 32, "threadgroup_limit": 256, "threads_per_threadgroup": 256, "timestamp": "2026-06-21T09:40:15Z"}
{"backend": "metal", "budget_sec": 6, "commit": "b6eec70", "correctness": true, "description": "Metal secp256k1 field_square_mod_p correctness and throughput gate", "experiment": "metal_field_square", "iterations": 11534336, "machine": "macOS-26.5-arm64-arm-64bit-Mach-O", "max_threads_per_threadgroup": 1024, "min_ms": 50, "operation": "field_square_mod_p", "ops_per_sec": 180386765.233104, "ops_per_sec_max": 184172363.548494, "ops_per_sec_min": 168425525.280362, "paired_baseline_ops_per_sec": 134077365.700321, "paired_baseline_ref": "main", "paired_speedup": 1.3453931190465813, "reason": "", "runner_sample_count": 3, "sample_count": 1048576, "seconds": 0.063942, "skipped": false, "status": "keep", "thread_execution_width": 32, "threadgroup_limit": 256, "threads_per_threadgroup": 256, "timestamp": "2026-06-21T09:41:05Z"}
{"backend": "metal", "budget_sec": 6, "commit": "b6eec70", "correctness": true, "description": "Metal secp256k1 field_mul_mod_p correctness and throughput gate", "experiment": "metal_field_mul", "iterations": 9437184, "machine": "macOS-26.5-arm64-arm-64bit-Mach-O", "max_threads_per_threadgroup": 1024, "min_ms": 50, "operation": "field_mul_mod_p", "ops_per_sec": 159267402.459731, "ops_per_sec_max": 176342950.959247, "ops_per_sec_min": 114244856.696406, "paired_baseline_ops_per_sec": 133317305.054737, "paired_baseline_ref": "main", "paired_speedup": 1.1946491297160522, "reason": "", "runner_sample_count": 3, "sample_count": 1048576, "seconds": 0.059254, "skipped": false, "status": "keep", "thread_execution_width": 32, "threadgroup_limit": 256, "threads_per_threadgroup": 256, "timestamp": "2026-06-21T09:41:43Z"}
{"backend": "metal", "budget_sec": 10, "commit": "b6eec70", "correctness": true, "description": "Metal Jacobian jump-table walk with projective distinguished-point candidate flags", "distance_checksum": "0xa45f471493cace2f", "distance_tracking": "uint64", "dp_bits": 4, "dp_checksum": "0x30a7914972cba014", "dp_count": 1000, "dp_tracking": "projective_x_limb0", "experiment": "metal_jacobian_jump_walk_dp", "iterations": 1966080, "jump_count": 16, "machine": "macOS-26.5-arm64-arm-64bit-Mach-O", "max_threads_per_threadgroup": 1024, "min_ms": 50, "operation": "jacobian_affine_walk_jump_table", "ops_per_sec": 38297493.616744, "ops_per_sec_max": 53792305.851809, "ops_per_sec_min": 19810086.708614, "paired_baseline_ops_per_sec": 38246490.390202, "paired_baseline_ref": "main", "paired_speedup": 1.0013335400456786, "reason": "", "runner_sample_count": 5, "sample_count": 16384, "seconds": 0.051337, "skipped": false, "status": "discard", "steps_per_sample": 8, "thread_execution_width": 32, "threadgroup_limit": 256, "threads_per_threadgroup": 256, "timestamp": "2026-06-21T09:43:00Z"}
{"backend": "metal", "budget_sec": 10, "commit": "108737d", "correctness": true, "description": "Metal Jacobian jump-table walk with projective distinguished-point candidate flags", "distance_checksum": "0xa45f471493cace2f", "distance_tracking": "uint64", "dp_bits": 4, "dp_checksum": "0x30a7914972cba014", "dp_count": 1000, "dp_tracking": "projective_x_limb0", "experiment": "metal_jacobian_jump_walk_dp", "iterations": 1835008, "jump_count": 16, "machine": "macOS-26.5-arm64-arm-64bit-Mach-O", "max_threads_per_threadgroup": 256, "min_ms": 50, "operation": "jacobian_affine_walk_jump_table", "ops_per_sec": 35188997.363215, "ops_per_sec_max": 38374952.848159, "ops_per_sec_min": 19868739.396646, "paired_baseline_ops_per_sec": 41028548.928926, "paired_baseline_ref": "main", "paired_speedup": 0.8576710188842679, "reason": "", "runner_sample_count": 5, "sample_count": 16384, "seconds": 0.052147, "skipped": false, "status": "discard", "steps_per_sample": 8, "thread_execution_width": 32, "threadgroup_limit": 256, "threads_per_threadgroup": 256, "timestamp": "2026-06-21T09:47:49Z"}
{"backend": "metal", "budget_sec": 10, "commit": "7c1416e", "correctness": true, "description": "Metal Jacobian jump-table walk with projective distinguished-point candidate flags", "distance_checksum": "0xa45f471493cace2f", "distance_tracking": "uint64", "dp_bits": 4, "dp_checksum": "0x30a7914972cba014", "dp_count": 1000, "dp_tracking": "projective_x_limb0", "experiment": "metal_jacobian_jump_walk_dp", "iterations": 2228224, "jump_count": 16, "machine": "macOS-26.5-arm64-arm-64bit-Mach-O", "max_threads_per_threadgroup": 1024, "min_ms": 50, "operation": "jacobian_affine_walk_jump_table", "ops_per_sec": 42347381.165201, "ops_per_sec_max": 53330377.974621, "ops_per_sec_min": 20554133.379698, "paired_baseline_ops_per_sec": 45468279.36045, "paired_baseline_ref": "main", "paired_speedup": 0.9313609787054385, "reason": "", "runner_sample_count": 5, "sample_count": 16384, "seconds": 0.052618, "skipped": false, "status": "discard", "steps_per_sample": 8, "thread_execution_width": 32, "threadgroup_limit": 256, "threads_per_threadgroup": 256, "timestamp": "2026-06-21T09:52:04Z"}
{"backend": "metal", "budget_sec": 10, "commit": "a4939c6", "correctness": true, "description": "Metal Jacobian jump-table walk with projective distinguished-point candidate flags", "distance_checksum": "0xa45f471493cace2f", "distance_tracking": "uint64", "dp_bits": 4, "dp_checksum": "0x30a7914972cba014", "dp_count": 1000, "dp_tracking": "projective_x_limb0", "experiment": "metal_jacobian_jump_walk_dp", "iterations": 1835008, "jump_count": 16, "machine": "macOS-26.5-arm64-arm-64bit-Mach-O", "max_threads_per_threadgroup": 1024, "min_ms": 50, "operation": "jacobian_affine_walk_jump_table", "ops_per_sec": 35262056.952682, "ops_per_sec_max": 39028142.711575, "ops_per_sec_min": 18809803.350001, "paired_baseline_ops_per_sec": 30045324.607249, "paired_baseline_ref": "main", "paired_speedup": 1.1736287563414898, "reason": "", "runner_sample_count": 5, "sample_count": 16384, "seconds": 0.052039, "skipped": false, "status": "keep", "steps_per_sample": 8, "thread_execution_width": 32, "threadgroup_limit": 256, "threads_per_threadgroup": 256, "timestamp": "2026-06-21T10:01:54Z"}
{"backend": "metal", "budget_sec": 10, "commit": "a4939c6", "correctness": true, "description": "Metal Jacobian jump-table walk with projective distinguished-point candidate flags", "distance_checksum": "0xa45f471493cace2f", "distance_tracking": "uint64", "dp_bits": 4, "dp_checksum": "0x30a7914972cba014", "dp_count": 1000, "dp_tracking": "projective_x_limb0", "experiment": "metal_jacobian_jump_walk_dp", "iterations": 2752512, "jump_count": 16, "machine": "macOS-26.5-arm64-arm-64bit-Mach-O", "max_threads_per_threadgroup": 1024, "min_ms": 50, "operation": "jacobian_affine_walk_jump_table", "ops_per_sec": 54586707.150623, "ops_per_sec_max": 54873867.706849, "ops_per_sec_min": 40732406.880998, "paired_baseline_ops_per_sec": 47025523.46355, "paired_baseline_ref": "main", "paired_speedup": 1.160788931843231, "reason": "", "runner_sample_count": 5, "sample_count": 16384, "seconds": 0.050425, "skipped": false, "status": "keep", "steps_per_sample": 8, "thread_execution_width": 32, "threadgroup_limit": 256, "threads_per_threadgroup": 256, "timestamp": "2026-06-21T10:02:59Z"}
{"backend": "metal", "budget_sec": 10, "commit": "2a0d783", "correctness": true, "description": "Metal Jacobian jump-table walk with projective distinguished-point candidate flags", "distance_checksum": "0xa45f471493cace2f", "distance_tracking": "uint64", "dp_bits": 4, "dp_checksum": "0x30a7914972cba014", "dp_count": 1000, "dp_tracking": "projective_x_limb0", "experiment": "metal_jacobian_jump_walk_dp", "iterations": 2621440, "jump_count": 16, "machine": "macOS-26.5-arm64-arm-64bit-Mach-O", "max_threads_per_threadgroup": 1024, "min_ms": 50, "operation": "jacobian_affine_walk_jump_table", "ops_per_sec": 51269848.158566, "ops_per_sec_max": 59375277.953309, "ops_per_sec_min": 43450162.350382, "paired_baseline_ops_per_sec": 53225235.044224, "paired_baseline_ref": "main", "paired_speedup": 0.96326203380721, "reason": "", "runner_sample_count": 5, "sample_count": 16384, "seconds": 0.05113, "skipped": false, "status": "discard", "steps_per_sample": 8, "thread_execution_width": 32, "threadgroup_limit": 256, "threads_per_threadgroup": 256, "timestamp": "2026-06-21T10:11:39Z"}
{"backend": "metal", "budget_sec": 10, "commit": "2d1f373", "correctness": true, "description": "Metal Jacobian jump-table walk with projective distinguished-point candidate flags", "distance_checksum": "0xa45f471493cace2f", "distance_tracking": "uint64", "dp_bits": 4, "dp_checksum": "0x30a7914972cba014", "dp_count": 1000, "dp_tracking": "projective_x_limb0", "experiment": "metal_jacobian_jump_walk_dp", "iterations": 2752512, "jump_count": 16, "machine": "macOS-26.5-arm64-arm-64bit-Mach-O", "max_threads_per_threadgroup": 1024, "min_ms": 50, "operation": "jacobian_affine_walk_jump_table", "ops_per_sec": 53801243.066193, "ops_per_sec_max": 57187024.541969, "ops_per_sec_min": 33206766.756478, "paired_baseline_ops_per_sec": 57431762.259068, "paired_baseline_ref": "main", "paired_speedup": 0.936785516409924, "reason": "", "runner_sample_count": 5, "sample_count": 16384, "seconds": 0.051161, "skipped": false, "status": "discard", "steps_per_sample": 8, "thread_execution_width": 32, "threadgroup_limit": 256, "threads_per_threadgroup": 256, "timestamp": "2026-06-21T10:16:35Z"}
{"backend": "metal", "budget_sec": 10, "commit": "3a79ce6", "correctness": true, "description": "Metal Jacobian jump-table walk with projective distinguished-point candidate flags", "distance_checksum": "0xa45f471493cace2f", "distance_tracking": "uint64", "dp_bits": 4, "dp_checksum": "0x30a7914972cba014", "dp_count": 1000, "dp_tracking": "projective_x_limb0", "experiment": "metal_jacobian_jump_walk_dp", "iterations": 2490368, "jump_count": 16, "machine": "macOS-26.5-arm64-arm-64bit-Mach-O", "max_threads_per_threadgroup": 1024, "min_ms": 50, "operation": "jacobian_affine_walk_jump_table", "ops_per_sec": 49171211.386386, "ops_per_sec_max": 53074285.415468, "ops_per_sec_min": 40553998.240622, "paired_baseline_ops_per_sec": 38955739.382442, "paired_baseline_ref": "main", "paired_speedup": 1.2622327843313452, "reason": "", "runner_sample_count": 5, "sample_count": 16384, "seconds": 0.050647, "skipped": false, "status": "keep", "steps_per_sample": 8, "thread_execution_width": 32, "threadgroup_limit": 256, "threads_per_threadgroup": 256, "timestamp": "2026-06-21T10:23:20Z"}
{"backend": "metal", "budget_sec": 10, "commit": "3a79ce6", "correctness": true, "description": "Metal Jacobian jump-table walk with projective distinguished-point candidate flags", "distance_checksum": "0xa45f471493cace2f", "distance_tracking": "uint64", "dp_bits": 4, "dp_checksum": "0x30a7914972cba014", "dp_count": 1000, "dp_tracking": "projective_x_limb0", "experiment": "metal_jacobian_jump_walk_dp", "iterations": 2359296, "jump_count": 16, "machine": "macOS-26.5-arm64-arm-64bit-Mach-O", "max_threads_per_threadgroup": 1024, "min_ms": 50, "operation": "jacobian_affine_walk_jump_table", "ops_per_sec": 46633123.492816, "ops_per_sec_max": 48512009.779199, "ops_per_sec_min": 30165445.982421, "paired_baseline_ops_per_sec": 41583067.031963, "paired_baseline_ref": "main", "paired_speedup": 1.121445021286459, "reason": "", "runner_sample_count": 5, "sample_count": 16384, "seconds": 0.050593, "skipped": false, "status": "keep", "steps_per_sample": 8, "thread_execution_width": 32, "threadgroup_limit": 256, "threads_per_threadgroup": 256, "timestamp": "2026-06-21T10:24:25Z"}
{"backend": "metal", "budget_sec": 10, "commit": "f7cda6f", "correctness": true, "description": "Metal Jacobian jump-table walk with projective distinguished-point candidate flags", "distance_checksum": "0xa45f471493cace2f", "distance_tracking": "uint64", "dp_bits": 4, "dp_checksum": "0x30a7914972cba014", "dp_count": 1000, "dp_tracking": "projective_x_limb0", "experiment": "metal_jacobian_jump_walk_dp", "iterations": 1441792, "jump_count": 16, "machine": "macOS-26.5-arm64-arm-64bit-Mach-O", "max_threads_per_threadgroup": 1024, "min_ms": 50, "operation": "jacobian_affine_walk_jump_table", "ops_per_sec": 28602135.384033, "ops_per_sec_max": 38223100.207442, "ops_per_sec_min": 23054897.426298, "paired_baseline_ops_per_sec": 36034276.125311, "paired_baseline_ref": "main", "paired_speedup": 0.7937480215938746, "reason": "", "runner_sample_count": 5, "sample_count": 16384, "seconds": 0.050409, "skipped": false, "status": "discard", "steps_per_sample": 8, "thread_execution_width": 32, "threadgroup_limit": 256, "threads_per_threadgroup": 256, "timestamp": "2026-06-21T10:32:03Z"}
{"backend": "metal", "budget_sec": 10, "commit": "186669e", "correctness": true, "description": "Metal Jacobian jump-table walk with projective distinguished-point candidate flags", "distance_checksum": "0xa45f471493cace2f", "distance_tracking": "uint64", "dp_bits": 4, "dp_checksum": "0x30a7914972cba014", "dp_count": 1000, "dp_tracking": "projective_x_limb0", "experiment": "metal_jacobian_jump_walk_dp", "iterations": 1572864, "jump_count": 16, "machine": "macOS-26.5-arm64-arm-64bit-Mach-O", "max_threads_per_threadgroup": 1024, "min_ms": 50, "operation": "jacobian_affine_walk_jump_table", "ops_per_sec": 29906975.938509, "ops_per_sec_max": 37615515.206171, "ops_per_sec_min": 27273908.017071, "paired_baseline_ops_per_sec": 36536871.605632, "paired_baseline_ref": "main", "paired_speedup": 0.8185423279068854, "reason": "", "runner_sample_count": 5, "sample_count": 16384, "seconds": 0.052592, "skipped": false, "status": "discard", "steps_per_sample": 8, "thread_execution_width": 32, "threadgroup_limit": 256, "threads_per_threadgroup": 256, "timestamp": "2026-06-21T10:37:07Z"}
{"backend": "metal", "budget_sec": 10, "commit": "b8e1120", "correctness": true, "description": "Metal Jacobian jump-table walk with projective distinguished-point candidate flags", "distance_checksum": "0xa45f471493cace2f", "distance_tracking": "uint64", "dp_bits": 4, "dp_checksum": "0x30a7914972cba014", "dp_count": 1000, "dp_tracking": "projective_x_limb0", "experiment": "metal_jacobian_jump_walk_dp", "iterations": 1835008, "jump_count": 16, "machine": "macOS-26.5-arm64-arm-64bit-Mach-O", "max_threads_per_threadgroup": 1024, "min_ms": 50, "operation": "jacobian_affine_walk_jump_table", "ops_per_sec": 34425602.601131, "ops_per_sec_max": 35755207.085073, "ops_per_sec_min": 28762041.204197, "paired_baseline_ops_per_sec": 22144004.281751, "paired_baseline_ref": "main", "paired_speedup": 1.5546240943198035, "reason": "", "runner_sample_count": 5, "sample_count": 16384, "seconds": 0.053304, "skipped": false, "status": "keep", "steps_per_sample": 8, "thread_execution_width": 32, "threadgroup_limit": 256, "threads_per_threadgroup": 256, "timestamp": "2026-06-21T10:46:22Z"}
