{"affine_scan_mode": "cpu_batch_prod_zz_zzz", "affine_scan_seconds": 0.110531, "backend": "metal", "budget_sec": 45, "bytes_per_target": 2.683818, "candidate_verification": "tag16_hash_filter_then_cpu_exact_key_equality", "commit": "314e461", "confirmation_index": 1, "confirmation_runs": 2, "confirmation_status": "discard", "cooldown_sec": 5.0, "correctness": true, "description": "Default 128-thread Metal tag16 hash lookup cap versus the old 512-thread cap on a 25M-target distinct-miss batch", "distance_tracking": "packet_distance_uint64", "dp_bits": 8, "dp_checksum": "0x9dba4a07ebbb8e14", "dp_count": 1057, "dp_distance_checksum": "0xf0dc88ed68b2ff64", "dp_query_count": 1057, "dp_tracking": "affine_x256_y_parity_cpu_batch", "exact_host_table_bytes": 1268635456, "experiment": "metal_jacobian_dynamic_dp_stream_xyzz_affine_scan_target_lookup_tag16_hash_filter25m_tg128_default", "filter_false_positive_count": 216, "filter_positive_count": 280, "gpu_ops_per_sec": 30594406.29518, "hit_count": 64, "injected_hits": 64, "iterations": 134217728, "jump_count": 16, "jump_histogram_max_bucket": 8394316, "jump_histogram_max_deviation_ppm": 759, "jump_histogram_min_bucket": 8382245, "jump_index": "power2_mask", "jump_mixer": "avalanche64", "jump_schedule": "power2", "lookup_engine": "gpu_filter16_hash", "lookup_engine_effective": "gpu_filter16_hash", "lookup_layout": "open_address_tag16_hash_filter_exact256", "lookup_max_threads_per_threadgroup": 1024, "lookup_query_mode": "distinct_misses", "lookup_repeat": 1024, "lookup_seconds": 0.026368, "lookup_thread_execution_width": 32, "lookup_threadgroup_limit": 128, "lookup_threads_per_threadgroup": 128, "lookups_per_sec": 41048996.710332, "machine": "macOS-26.5-arm64-arm-64bit-Mach-O", "max_threads_per_threadgroup": 1024, "min_ms": 500, "miss_count": 1082304, "operation": "jacobian_affine_scan_target_lookup_tag32", "ops_per_sec": 29668582.04243, "ops_per_sec_max": 32156170.178906, "ops_per_sec_min": 27426397.449532, "output_layout": "affine_dp_scan_target_lookup", "paired_baseline_ops_per_sec": 26502836.838557, "paired_baseline_ref": "main^", "paired_speedup": 1.1194492960567675, "query_count": 1082368, "query_input": "hash64", "raw_status": "keep", "reason": "", "requested_hits": 64, "runner_sample_count": 3, "sample_count": 262144, "seconds": 4.387002, "skipped": false, "state_layout": "xyzz", "status": "discard", "steps_per_sample": 512, "target_bucket_bytes": 268435456, "target_count": 25005000, "target_filter_bucket_bytes": 67108864, "target_key": "x256_y_parity", "target_key_bytes": 1000200000, "target_lookup_checksum": "0x8b2568562837af7f", "target_query_hash_bytes": 8658944, "target_table_buckets": 33554432, "target_table_bytes": 67108864, "thread_execution_width": 32, "threadgroup_limit": 128, "threads_per_threadgroup": 128, "timestamp": "2026-06-26T21:59:38Z", "validation_seconds": 10.798022, "validation_workers": 8}
{"affine_scan_mode": "cpu_batch_prod_zz_zzz", "affine_scan_seconds": 0.027434, "backend": "metal", "budget_sec": 45, "bytes_per_target": 2.683818, "candidate_verification": "tag16_hash_filter_then_cpu_exact_key_equality", "commit": "314e461", "confirmation_index": 2, "confirmation_runs": 2, "confirmation_status": "discard", "cooldown_sec": 5.0, "correctness": true, "description": "Default 128-thread Metal tag16 hash lookup cap versus the old 512-thread cap on a 25M-target distinct-miss batch", "distance_tracking": "packet_distance_uint64", "dp_bits": 8, "dp_checksum": "0x9dba4a07ebbb8e14", "dp_count": 1057, "dp_distance_checksum": "0xf0dc88ed68b2ff64", "dp_query_count": 1057, "dp_tracking": "affine_x256_y_parity_cpu_batch", "exact_host_table_bytes": 1268635456, "experiment": "metal_jacobian_dynamic_dp_stream_xyzz_affine_scan_target_lookup_tag16_hash_filter25m_tg128_default", "filter_false_positive_count": 216, "filter_positive_count": 280, "gpu_ops_per_sec": 28431049.394251, "hit_count": 64, "injected_hits": 64, "iterations": 134217728, "jump_count": 16, "jump_histogram_max_bucket": 8394316, "jump_histogram_max_deviation_ppm": 759, "jump_histogram_min_bucket": 8382245, "jump_index": "power2_mask", "jump_mixer": "avalanche64", "jump_schedule": "power2", "lookup_engine": "gpu_filter16_hash", "lookup_engine_effective": "gpu_filter16_hash", "lookup_layout": "open_address_tag16_hash_filter_exact256", "lookup_max_threads_per_threadgroup": 1024, "lookup_query_mode": "distinct_misses", "lookup_repeat": 1024, "lookup_seconds": 0.025681, "lookup_thread_execution_width": 32, "lookup_threadgroup_limit": 128, "lookup_threads_per_threadgroup": 128, "lookups_per_sec": 42147398.686032, "machine": "macOS-26.5-arm64-arm-64bit-Mach-O", "max_threads_per_threadgroup": 1024, "min_ms": 500, "miss_count": 1082304, "operation": "jacobian_affine_scan_target_lookup_tag32", "ops_per_sec": 28114725.754939, "ops_per_sec_max": 29864181.920873, "ops_per_sec_min": 26955475.067208, "output_layout": "affine_dp_scan_target_lookup", "paired_baseline_ops_per_sec": 33063506.77077, "paired_baseline_ref": "main^", "paired_speedup": 0.8503249806458522, "query_count": 1082368, "query_input": "hash64", "raw_status": "discard", "reason": "", "requested_hits": 64, "runner_sample_count": 3, "sample_count": 262144, "seconds": 4.720815, "skipped": false, "state_layout": "xyzz", "status": "discard", "steps_per_sample": 512, "target_bucket_bytes": 268435456, "target_count": 25005000, "target_filter_bucket_bytes": 67108864, "target_key": "x256_y_parity", "target_key_bytes": 1000200000, "target_lookup_checksum": "0x8b2568562837af7f", "target_query_hash_bytes": 8658944, "target_table_buckets": 33554432, "target_table_bytes": 67108864, "thread_execution_width": 32, "threadgroup_limit": 128, "threads_per_threadgroup": 128, "timestamp": "2026-06-26T21:59:38Z", "validation_seconds": 10.99762, "validation_workers": 8}
{"backend": "metal", "budget_sec": 90, "commit": "d8f05f4", "confirmation_index": 1, "confirmation_runs": 2, "confirmation_status": "discard", "cooldown_sec": 10.0, "correctness": true, "description": "Default 512-thread Metal XYZZ 512-step packet cap versus the old 128-thread cap", "distance_tracking": "dp_stream_uint64", "dp_bits": 8, "dp_capacity": 524288, "dp_checksum": "0x390f891179fdcbea", "dp_count": 1976, "dp_distance_checksum": "0x7325bd945494b7be", "dp_stream_overflow": false, "dp_tracking": "projective_x_limb0", "emitted_records": 1976, "experiment": "metal_jacobian_dynamic_dp_stream_xyzz_steps512_tg512_default", "iterations": 268435456, "jump_count": 16, "jump_histogram_max_bucket": 16781828, "jump_histogram_max_deviation_ppm": 553, "jump_histogram_min_bucket": 16767939, "jump_index": "power2_mask", "jump_mixer": "avalanche64", "jump_schedule": "power2", "machine": "macOS-26.5-arm64-arm-64bit-Mach-O", "max_threads_per_threadgroup": 1024, "min_ms": 500, "operation": "jacobian_affine_walk_dynamic_dp_stream_xyzz", "ops_per_sec": 54922712.642899, "ops_per_sec_max": 56665166.826922, "ops_per_sec_min": 45126310.147314, "output_bytes_per_record": 20, "output_bytes_total": 39520, "output_layout": "dp_stream", "paired_baseline_ops_per_sec": 48229183.416788, "paired_baseline_ref": "main^", "paired_speedup": 1.138785870958393, "raw_status": "keep", "reason": "", "runner_sample_count": 3, "sample_count": 524288, "seconds": 4.887513, "skipped": false, "state_layout": "xyzz", "status": "discard", "steps_per_sample": 512, "thread_execution_width": 32, "threadgroup_limit": 512, "threads_per_threadgroup": 512, "timestamp": "2026-06-26T22:22:12Z", "validation_seconds": 22.665661, "validation_workers": 8}
{"backend": "metal", "budget_sec": 90, "commit": "d8f05f4", "confirmation_index": 2, "confirmation_runs": 2, "confirmation_status": "discard", "cooldown_sec": 10.0, "correctness": true, "description": "Default 512-thread Metal XYZZ 512-step packet cap versus the old 128-thread cap", "distance_tracking": "dp_stream_uint64", "dp_bits": 8, "dp_capacity": 524288, "dp_checksum": "0x390f891179fdcbea", "dp_count": 1976, "dp_distance_checksum": "0x7325bd945494b7be", "dp_stream_overflow": false, "dp_tracking": "projective_x_limb0", "emitted_records": 1976, "experiment": "metal_jacobian_dynamic_dp_stream_xyzz_steps512_tg512_default", "iterations": 268435456, "jump_count": 16, "jump_histogram_max_bucket": 16781828, "jump_histogram_max_deviation_ppm": 553, "jump_histogram_min_bucket": 16767939, "jump_index": "power2_mask", "jump_mixer": "avalanche64", "jump_schedule": "power2", "machine": "macOS-26.5-arm64-arm-64bit-Mach-O", "max_threads_per_threadgroup": 1024, "min_ms": 500, "operation": "jacobian_affine_walk_dynamic_dp_stream_xyzz", "ops_per_sec": 41442869.888584, "ops_per_sec_max": 42835215.83089, "ops_per_sec_min": 41122102.548926, "output_bytes_per_record": 20, "output_bytes_total": 39520, "output_layout": "dp_stream", "paired_baseline_ops_per_sec": 47356402.122712, "paired_baseline_ref": "main^", "paired_speedup": 0.8751270795698416, "raw_status": "discard", "reason": "", "runner_sample_count": 3, "sample_count": 524288, "seconds": 6.477241, "skipped": false, "state_layout": "xyzz", "status": "discard", "steps_per_sample": 512, "thread_execution_width": 32, "threadgroup_limit": 512, "threads_per_threadgroup": 512, "timestamp": "2026-06-26T22:22:12Z", "validation_seconds": 14.138567, "validation_workers": 8}
{"backend": "metal", "budget_sec": 120, "buffer_lifetime": "persistent", "bytes_per_target": 2.683818, "candidate_verification": "tag16_hash_filter_then_cpu_exact_key_equality", "commit": "ba4a706", "confirmation_index": 1, "confirmation_runs": 2, "confirmation_status": "discard", "cooldown_sec": 10.0, "correctness": true, "description": "Default 256-thread persistent Metal tag16 hash-filter lookup cap versus the old 512-thread cap on a 25M-target batch", "dispatch_lookups_per_sec": 430220016.2643, "dispatch_seconds": 0.680073, "exact_host_table_bytes": 1268635456, "exact_verify_seconds": 0.024364, "expected_hits": 64, "experiment": "metal_target_lookup_tag16_hash_filter_persistent_tg256_default", "filter_false_positive_count": 247, "filter_positive_count": 311, "hit_count": 64, "iterations": 303063040, "lookup_layout": "open_address_tag16_hash_filter_exact256", "lookups_per_sec": 384244831.768039, "lookups_per_sec_max": 407954010.210574, "lookups_per_sec_min": 333751958.00677, "machine": "macOS-26.5-arm64-arm-64bit-Mach-O", "max_threads_per_threadgroup": 1024, "metal_setup_seconds": 0.084286, "min_ms": 700, "miss_count": 1082304, "operation": "target_lookup_tag16_hash_filter_persistent_exact256", "ops_per_sec": 384244831.768039, "ops_per_sec_max": 407954010.210574, "ops_per_sec_min": 333751958.00677, "paired_baseline_ops_per_sec": 403094013.250482, "paired_baseline_ref": "main^", "paired_speedup": 0.9532387461415107, "query_count": 1082368, "query_input": "hash64", "raw_status": "discard", "reason": "", "runner_sample_count": 3, "sample_count": 1082368, "seconds": 0.788724, "skipped": false, "status": "discard", "target_bucket_bytes": 268435456, "target_count": 25005000, "target_filter_bucket_bytes": 67108864, "target_key": "x256_y_parity", "target_key_bytes": 1000200000, "target_lookup_checksum": "0x9b23e560b9fdfe29", "target_query_hash_bytes": 8658944, "target_table_buckets": 33554432, "target_table_bytes": 67108864, "thread_execution_width": 32, "threadgroup_limit": 256, "threads_per_threadgroup": 256, "timestamp": "2026-06-26T22:35:39Z"}
{"backend": "metal", "budget_sec": 120, "buffer_lifetime": "persistent", "bytes_per_target": 2.683818, "candidate_verification": "tag16_hash_filter_then_cpu_exact_key_equality", "commit": "ba4a706", "confirmation_index": 2, "confirmation_runs": 2, "confirmation_status": "discard", "cooldown_sec": 10.0, "correctness": true, "description": "Default 256-thread persistent Metal tag16 hash-filter lookup cap versus the old 512-thread cap on a 25M-target batch", "dispatch_lookups_per_sec": 101355281.76261, "dispatch_seconds": 0.610062, "exact_host_table_bytes": 1268635456, "exact_verify_seconds": 0.094748, "expected_hits": 64, "experiment": "metal_target_lookup_tag16_hash_filter_persistent_tg256_default", "filter_false_positive_count": 247, "filter_positive_count": 311, "hit_count": 64, "iterations": 71436288, "lookup_layout": "open_address_tag16_hash_filter_exact256", "lookups_per_sec": 23582491.610644, "lookups_per_sec_max": 452086788.298258, "lookups_per_sec_min": 20515997.65027, "machine": "macOS-26.5-arm64-arm-64bit-Mach-O", "max_threads_per_threadgroup": 1024, "metal_setup_seconds": 2.324398, "min_ms": 700, "miss_count": 1082304, "operation": "target_lookup_tag16_hash_filter_persistent_exact256", "ops_per_sec": 23582491.610644, "ops_per_sec_max": 452086788.298258, "ops_per_sec_min": 20515997.65027, "paired_baseline_ops_per_sec": 94876091.595852, "paired_baseline_ref": "main^", "paired_speedup": 0.24856095159462735, "query_count": 1082368, "query_input": "hash64", "raw_status": "discard", "reason": "", "runner_sample_count": 3, "sample_count": 1082368, "seconds": 3.029209, "skipped": false, "status": "discard", "target_bucket_bytes": 268435456, "target_count": 25005000, "target_filter_bucket_bytes": 67108864, "target_key": "x256_y_parity", "target_key_bytes": 1000200000, "target_lookup_checksum": "0x9b23e560b9fdfe29", "target_query_hash_bytes": 8658944, "target_table_buckets": 33554432, "target_table_bytes": 67108864, "thread_execution_width": 32, "threadgroup_limit": 256, "threads_per_threadgroup": 256, "timestamp": "2026-06-26T22:35:39Z"}
{"backend": "metal", "budget_sec": 120, "buffer_lifetime": "persistent", "bytes_per_target": 2.683818, "candidate_verification": "tag16_hash_filter_then_cpu_exact_key_equality", "commit": "3f502b5", "confirmation_index": 1, "confirmation_runs": 2, "confirmation_status": "discard", "cooldown_sec": 10.0, "correctness": true, "description": "Dispatch-only persistent Metal tag16 hash-filter lookup using prehashed query input versus in-kernel query hashing", "dispatch_lookups_per_sec": 460269790.53831, "dispatch_lookups_per_sec_max": 719000966.939707, "dispatch_lookups_per_sec_min": 288207572.949181, "dispatch_seconds": 0.674651, "exact_host_table_bytes": 1268635456, "exact_verify_seconds": 0.030827, "expected_hits": 64, "experiment": "metal_target_lookup_tag16_hash_filter_persistent_dispatch", "filter_false_positive_count": 247, "filter_positive_count": 311, "hit_count": 64, "iterations": 324710400, "lookup_layout": "open_address_tag16_hash_filter_exact256", "lookups_per_sec": 400884629.099025, "machine": "macOS-26.5-arm64-arm-64bit-Mach-O", "max_threads_per_threadgroup": 1024, "metal_setup_seconds": 0.104506, "min_ms": 700, "miss_count": 1082304, "operation": "target_lookup_tag16_hash_filter_persistent_exact256", "ops_per_sec": 460269790.53831, "ops_per_sec_max": 719000966.939707, "ops_per_sec_min": 288207572.949181, "paired_baseline_ops_per_sec": 412656845.592278, "paired_baseline_ref": "main^", "paired_speedup": 1.1153814493921557, "query_count": 1082368, "query_input": "hash64", "raw_status": "keep", "reason": "", "runner_sample_count": 3, "sample_count": 1082368, "seconds": 0.809985, "skipped": false, "status": "discard", "target_bucket_bytes": 268435456, "target_count": 25005000, "target_filter_bucket_bytes": 67108864, "target_key": "x256_y_parity", "target_key_bytes": 1000200000, "target_lookup_checksum": "0x9b23e560b9fdfe29", "target_query_hash_bytes": 8658944, "target_table_buckets": 33554432, "target_table_bytes": 67108864, "thread_execution_width": 32, "threadgroup_limit": 512, "threads_per_threadgroup": 512, "timestamp": "2026-06-26T22:50:17Z"}
{"backend": "metal", "budget_sec": 120, "buffer_lifetime": "persistent", "bytes_per_target": 2.683818, "candidate_verification": "tag16_hash_filter_then_cpu_exact_key_equality", "commit": "3f502b5", "confirmation_index": 2, "confirmation_runs": 2, "confirmation_status": "discard", "cooldown_sec": 10.0, "correctness": true, "description": "Dispatch-only persistent Metal tag16 hash-filter lookup using prehashed query input versus in-kernel query hashing", "dispatch_lookups_per_sec": 431249765.064511, "dispatch_lookups_per_sec_max": 664172287.062644, "dispatch_lookups_per_sec_min": 411689058.483747, "dispatch_seconds": 0.682901, "exact_host_table_bytes": 1268635456, "exact_verify_seconds": 0.017344, "expected_hits": 64, "experiment": "metal_target_lookup_tag16_hash_filter_persistent_dispatch", "filter_false_positive_count": 247, "filter_positive_count": 311, "hit_count": 64, "iterations": 301980672, "lookup_layout": "open_address_tag16_hash_filter_exact256", "lookups_per_sec": 366741060.966121, "machine": "macOS-26.5-arm64-arm-64bit-Mach-O", "max_threads_per_threadgroup": 1024, "metal_setup_seconds": 0.123171, "min_ms": 700, "miss_count": 1082304, "operation": "target_lookup_tag16_hash_filter_persistent_exact256", "ops_per_sec": 431249765.064511, "ops_per_sec_max": 664172287.062644, "ops_per_sec_min": 411689058.483747, "paired_baseline_ops_per_sec": 530756126.382268, "paired_baseline_ref": "main^", "paired_speedup": 0.8125196180098555, "query_count": 1082368, "query_input": "hash64", "raw_status": "discard", "reason": "", "runner_sample_count": 3, "sample_count": 1082368, "seconds": 0.823417, "skipped": false, "status": "discard", "target_bucket_bytes": 268435456, "target_count": 25005000, "target_filter_bucket_bytes": 67108864, "target_key": "x256_y_parity", "target_key_bytes": 1000200000, "target_lookup_checksum": "0x9b23e560b9fdfe29", "target_query_hash_bytes": 8658944, "target_table_buckets": 33554432, "target_table_bytes": 67108864, "thread_execution_width": 32, "threadgroup_limit": 512, "threads_per_threadgroup": 512, "timestamp": "2026-06-26T22:50:17Z"}
{"backend": "metal", "budget_sec": 120, "buffer_lifetime": "persistent", "bytes_per_target": 2.683818, "candidate_verification": "tag16_hash_filter_then_cpu_exact_key_equality", "commit": "d97bd05", "confirmation_index": 1, "confirmation_runs": 2, "confirmation_status": "keep", "cooldown_sec": 10.0, "correctness": true, "description": "GPU-dispatch-only persistent Metal tag16 hash-filter lookup using prehashed query input versus in-kernel query hashing", "dispatch_lookups_per_sec": 626273853.204133, "dispatch_seconds": 0.684717, "exact_host_table_bytes": 1268635456, "exact_verify_seconds": 0.016959, "expected_hits": 64, "experiment": "metal_target_lookup_tag16_hash_filter_persistent_dispatch", "filter_false_positive_count": 247, "filter_positive_count": 311, "gpu_dispatch_lookups_per_sec": 641785601.88993, "gpu_dispatch_lookups_per_sec_max": 763071554.926892, "gpu_dispatch_lookups_per_sec_min": 255244698.87911, "hit_count": 64, "iterations": 439441408, "lookup_layout": "open_address_tag16_hash_filter_exact256", "lookups_per_sec": 577213713.40062, "machine": "macOS-26.5-arm64-arm-64bit-Mach-O", "max_threads_per_threadgroup": 1024, "metal_setup_seconds": 0.059639, "min_ms": 700, "miss_count": 1082304, "operation": "target_lookup_tag16_hash_filter_persistent_exact256", "ops_per_sec": 641785601.88993, "ops_per_sec_max": 763071554.926892, "ops_per_sec_min": 255244698.87911, "paired_baseline_ops_per_sec": 40184259.839965, "paired_baseline_ref": "HEAD", "paired_speedup": 15.971069380047314, "query_count": 1082368, "query_input": "hash64", "raw_status": "keep", "reason": "", "runner_sample_count": 3, "sample_count": 1082368, "seconds": 0.761315, "skipped": false, "status": "keep", "target_bucket_bytes": 268435456, "target_count": 25005000, "target_filter_bucket_bytes": 67108864, "target_key": "x256_y_parity", "target_key_bytes": 1000200000, "target_lookup_checksum": "0x9b23e560b9fdfe29", "target_query_hash_bytes": 8658944, "target_table_buckets": 33554432, "target_table_bytes": 67108864, "thread_execution_width": 32, "threadgroup_limit": 512, "threads_per_threadgroup": 512, "timestamp": "2026-06-26T23:04:04Z"}
{"backend": "metal", "budget_sec": 120, "buffer_lifetime": "persistent", "bytes_per_target": 2.683818, "candidate_verification": "tag16_hash_filter_then_cpu_exact_key_equality", "commit": "d97bd05", "confirmation_index": 2, "confirmation_runs": 2, "confirmation_status": "keep", "cooldown_sec": 10.0, "correctness": true, "description": "GPU-dispatch-only persistent Metal tag16 hash-filter lookup using prehashed query input versus in-kernel query hashing", "dispatch_lookups_per_sec": 247349354.863205, "dispatch_seconds": 0.664852, "exact_host_table_bytes": 1268635456, "exact_verify_seconds": 0.035287, "expected_hits": 64, "experiment": "metal_target_lookup_tag16_hash_filter_persistent_dispatch", "filter_false_positive_count": 247, "filter_positive_count": 311, "gpu_dispatch_lookups_per_sec": 260477452.93458, "gpu_dispatch_lookups_per_sec_max": 729650827.297877, "gpu_dispatch_lookups_per_sec_min": 26255845.156527, "hit_count": 64, "iterations": 173178880, "lookup_layout": "open_address_tag16_hash_filter_exact256", "lookups_per_sec": 205227363.169975, "machine": "macOS-26.5-arm64-arm-64bit-Mach-O", "max_threads_per_threadgroup": 1024, "metal_setup_seconds": 0.1437, "min_ms": 700, "miss_count": 1082304, "operation": "target_lookup_tag16_hash_filter_persistent_exact256", "ops_per_sec": 260477452.93458, "ops_per_sec_max": 729650827.297877, "ops_per_sec_min": 26255845.156527, "paired_baseline_ops_per_sec": 22885559.03495, "paired_baseline_ref": "HEAD", "paired_speedup": 11.381738699797031, "query_count": 1082368, "query_input": "hash64", "raw_status": "keep", "reason": "", "runner_sample_count": 3, "sample_count": 1082368, "seconds": 0.843839, "skipped": false, "status": "keep", "target_bucket_bytes": 268435456, "target_count": 25005000, "target_filter_bucket_bytes": 67108864, "target_key": "x256_y_parity", "target_key_bytes": 1000200000, "target_lookup_checksum": "0x9b23e560b9fdfe29", "target_query_hash_bytes": 8658944, "target_table_buckets": 33554432, "target_table_bytes": 67108864, "thread_execution_width": 32, "threadgroup_limit": 512, "threads_per_threadgroup": 512, "timestamp": "2026-06-26T23:04:04Z"}
