{"backend": "metal", "budget_sec": 10, "commit": "959e118", "confirmation_index": 2, "confirmation_runs": 3, "confirmation_status": "discard", "correctness": true, "description": "Stable Metal Jacobian jump-table walk with projective distinguished-point candidate flags", "distance_checksum": "0xa45f471493cace2f", "distance_tracking": "uint64", "dp_bits": 4, "dp_checksum": "0x30a7914972cba014", "dp_count": 1000, "dp_tracking": "projective_x_limb0", "experiment": "metal_jacobian_jump_walk_dp_stable", "iterations": 4325376, "jump_count": 16, "machine": "macOS-26.5-arm64-arm-64bit-Mach-O", "max_threads_per_threadgroup": 1024, "min_ms": 200, "operation": "jacobian_affine_walk_jump_table", "ops_per_sec": 21584071.232321, "ops_per_sec_max": 25319465.069359, "ops_per_sec_min": 19627674.373959, "paired_baseline_ops_per_sec": 24120337.009421, "paired_baseline_ref": "main", "paired_speedup": 0.8948494883753335, "raw_status": "discard", "reason": "", "runner_sample_count": 3, "sample_count": 16384, "seconds": 0.200397, "skipped": false, "status": "discard", "steps_per_sample": 8, "thread_execution_width": 32, "threadgroup_limit": 256, "threads_per_threadgroup": 256, "timestamp": "2026-06-21T22:22:57Z"}
{"backend": "metal", "budget_sec": 10, "commit": "959e118", "confirmation_index": 3, "confirmation_runs": 3, "confirmation_status": "discard", "correctness": true, "description": "Stable Metal Jacobian jump-table walk with projective distinguished-point candidate flags", "distance_checksum": "0xa45f471493cace2f", "distance_tracking": "uint64", "dp_bits": 4, "dp_checksum": "0x30a7914972cba014", "dp_count": 1000, "dp_tracking": "projective_x_limb0", "experiment": "metal_jacobian_jump_walk_dp_stable", "iterations": 7340032, "jump_count": 16, "machine": "macOS-26.5-arm64-arm-64bit-Mach-O", "max_threads_per_threadgroup": 1024, "min_ms": 200, "operation": "jacobian_affine_walk_jump_table", "ops_per_sec": 36049762.974087, "ops_per_sec_max": 36861992.112739, "ops_per_sec_min": 28560628.64, "paired_baseline_ops_per_sec": 26280533.873813, "paired_baseline_ref": "main", "paired_speedup": 1.3717287155269118, "raw_status": "keep", "reason": "", "runner_sample_count": 3, "sample_count": 16384, "seconds": 0.203608, "skipped": false, "status": "discard", "steps_per_sample": 8, "thread_execution_width": 32, "threadgroup_limit": 256, "threads_per_threadgroup": 256, "timestamp": "2026-06-21T22:23:49Z"}
{"backend": "metal", "budget_sec": 10, "commit": "c6b63f4", "confirmation_index": 1, "confirmation_runs": 3, "confirmation_status": "discard", "correctness": true, "description": "Stable Metal Jacobian jump-table walk with projective distinguished-point candidate flags", "distance_checksum": "0xa45f471493cace2f", "distance_tracking": "uint64", "dp_bits": 4, "dp_checksum": "0x30a7914972cba014", "dp_count": 1000, "dp_tracking": "projective_x_limb0", "experiment": "metal_jacobian_jump_walk_dp_stable", "iterations": 4980736, "jump_count": 16, "machine": "macOS-26.5-arm64-arm-64bit-Mach-O", "max_threads_per_threadgroup": 1024, "min_ms": 200, "operation": "jacobian_affine_walk_jump_table", "ops_per_sec": 24434447.348253, "ops_per_sec_max": 42143591.835577, "ops_per_sec_min": 11742839.531021, "paired_baseline_ops_per_sec": 30631543.043649, "paired_baseline_ref": "main", "paired_speedup": 0.7976890786544665, "raw_status": "discard", "reason": "", "runner_sample_count": 3, "sample_count": 16384, "seconds": 0.203841, "skipped": false, "status": "discard", "steps_per_sample": 8, "thread_execution_width": 32, "threadgroup_limit": 256, "threads_per_threadgroup": 256, "timestamp": "2026-06-21T22:35:25Z"}
{"backend": "metal", "budget_sec": 10, "commit": "c6b63f4", "confirmation_index": 2, "confirmation_runs": 3, "confirmation_status": "discard", "correctness": true, "description": "Stable Metal Jacobian jump-table walk with projective distinguished-point candidate flags", "distance_checksum": "0xa45f471493cace2f", "distance_tracking": "uint64", "dp_bits": 4, "dp_checksum": "0x30a7914972cba014", "dp_count": 1000, "dp_tracking": "projective_x_limb0", "experiment": "metal_jacobian_jump_walk_dp_stable", "iterations": 7471104, "jump_count": 16, "machine": "macOS-26.5-arm64-arm-64bit-Mach-O", "max_threads_per_threadgroup": 1024, "min_ms": 200, "operation": "jacobian_affine_walk_jump_table", "ops_per_sec": 37153798.836518, "ops_per_sec_max": 38514857.209308, "ops_per_sec_min": 33775605.556518, "paired_baseline_ops_per_sec": 25713308.944324, "paired_baseline_ref": "main", "paired_speedup": 1.444924840943872, "raw_status": "keep", "reason": "", "runner_sample_count": 3, "sample_count": 16384, "seconds": 0.201086, "skipped": false, "status": "discard", "steps_per_sample": 8, "thread_execution_width": 32, "threadgroup_limit": 256, "threads_per_threadgroup": 256, "timestamp": "2026-06-21T22:37:42Z"}
{"backend": "metal", "budget_sec": 10, "commit": "c6b63f4", "confirmation_index": 3, "confirmation_runs": 3, "confirmation_status": "discard", "correctness": true, "description": "Stable Metal Jacobian jump-table walk with projective distinguished-point candidate flags", "distance_checksum": "0xa45f471493cace2f", "distance_tracking": "uint64", "dp_bits": 4, "dp_checksum": "0x30a7914972cba014", "dp_count": 1000, "dp_tracking": "projective_x_limb0", "experiment": "metal_jacobian_jump_walk_dp_stable", "iterations": 4456448, "jump_count": 16, "machine": "macOS-26.5-arm64-arm-64bit-Mach-O", "max_threads_per_threadgroup": 1024, "min_ms": 200, "operation": "jacobian_affine_walk_jump_table", "ops_per_sec": 22083985.875282, "ops_per_sec_max": 26546254.992651, "ops_per_sec_min": 17694414.328992, "paired_baseline_ops_per_sec": 31479540.172213, "paired_baseline_ref": "main", "paired_speedup": 0.701534576250753, "raw_status": "discard", "reason": "", "runner_sample_count": 3, "sample_count": 16384, "seconds": 0.201795, "skipped": false, "status": "discard", "steps_per_sample": 8, "thread_execution_width": 32, "threadgroup_limit": 256, "threads_per_threadgroup": 256, "timestamp": "2026-06-21T22:40:21Z"}
{"backend": "metal", "budget_sec": 10, "commit": "3311412", "confirmation_index": 1, "confirmation_runs": 3, "confirmation_status": "keep", "correctness": true, "description": "Stable Metal Jacobian jump-table walk with projective distinguished-point candidate flags", "distance_checksum": "0xa45f471493cace2f", "distance_tracking": "uint64", "dp_bits": 4, "dp_checksum": "0x30a7914972cba014", "dp_count": 1000, "dp_tracking": "projective_x_limb0", "experiment": "metal_jacobian_jump_walk_dp_stable", "iterations": 7471104, "jump_count": 16, "machine": "macOS-26.5-arm64-arm-64bit-Mach-O", "max_threads_per_threadgroup": 1024, "min_ms": 200, "operation": "jacobian_affine_walk_jump_table", "ops_per_sec": 37214816.732306, "ops_per_sec_max": 42876624.712439, "ops_per_sec_min": 14280434.969527, "paired_baseline_ops_per_sec": 31426318.476774, "paired_baseline_ref": "main", "paired_speedup": 1.1841926937706706, "raw_status": "keep", "reason": "", "runner_sample_count": 3, "sample_count": 16384, "seconds": 0.200756, "skipped": false, "status": "keep", "steps_per_sample": 8, "thread_execution_width": 32, "threadgroup_limit": 256, "threads_per_threadgroup": 256, "timestamp": "2026-06-21T22:51:21Z"}
{"backend": "metal", "budget_sec": 10, "commit": "3311412", "confirmation_index": 2, "confirmation_runs": 3, "confirmation_status": "keep", "correctness": true, "description": "Stable Metal Jacobian jump-table walk with projective distinguished-point candidate flags", "distance_checksum": "0xa45f471493cace2f", "distance_tracking": "uint64", "dp_bits": 4, "dp_checksum": "0x30a7914972cba014", "dp_count": 1000, "dp_tracking": "projective_x_limb0", "experiment": "metal_jacobian_jump_walk_dp_stable", "iterations": 8257536, "jump_count": 16, "machine": "macOS-26.5-arm64-arm-64bit-Mach-O", "max_threads_per_threadgroup": 1024, "min_ms": 200, "operation": "jacobian_affine_walk_jump_table", "ops_per_sec": 41211412.51155, "ops_per_sec_max": 42245796.515528, "ops_per_sec_min": 18843258.243275, "paired_baseline_ops_per_sec": 18724079.621712, "paired_baseline_ref": "main", "paired_speedup": 2.200984686251933, "raw_status": "keep", "reason": "", "runner_sample_count": 3, "sample_count": 16384, "seconds": 0.20037, "skipped": false, "status": "keep", "steps_per_sample": 8, "thread_execution_width": 32, "threadgroup_limit": 256, "threads_per_threadgroup": 256, "timestamp": "2026-06-21T22:52:26Z"}
{"backend": "metal", "budget_sec": 10, "commit": "3311412", "confirmation_index": 3, "confirmation_runs": 3, "confirmation_status": "keep", "correctness": true, "description": "Stable Metal Jacobian jump-table walk with projective distinguished-point candidate flags", "distance_checksum": "0xa45f471493cace2f", "distance_tracking": "uint64", "dp_bits": 4, "dp_checksum": "0x30a7914972cba014", "dp_count": 1000, "dp_tracking": "projective_x_limb0", "experiment": "metal_jacobian_jump_walk_dp_stable", "iterations": 7077888, "jump_count": 16, "machine": "macOS-26.5-arm64-arm-64bit-Mach-O", "max_threads_per_threadgroup": 1024, "min_ms": 200, "operation": "jacobian_affine_walk_jump_table", "ops_per_sec": 34887747.045498, "ops_per_sec_max": 37224976.659976, "ops_per_sec_min": 21815550.508513, "paired_baseline_ops_per_sec": 33376355.648299, "paired_baseline_ref": "main", "paired_speedup": 1.0452832961490817, "raw_status": "keep", "reason": "", "runner_sample_count": 3, "sample_count": 16384, "seconds": 0.202876, "skipped": false, "status": "keep", "steps_per_sample": 8, "thread_execution_width": 32, "threadgroup_limit": 256, "threads_per_threadgroup": 256, "timestamp": "2026-06-21T22:53:30Z"}
{"backend": "metal", "budget_sec": 10, "commit": "1a03888", "correctness": true, "description": "Metal dynamic Jacobian jump walk with compact distinguished-point candidate emission", "distance_checksum": "0x5c36c706ffa2cbaa", "distance_tracking": "uint64", "dp_bits": 4, "dp_checksum": "0xbfd3b2319760e774", "dp_count": 1017, "dp_tracking": "projective_x_limb0", "experiment": "metal_jacobian_dynamic_compact_dp", "iterations": 11010048, "jump_count": 16, "jump_histogram_max_bucket": 8336, "jump_histogram_max_deviation_ppm": 17578, "jump_histogram_min_bucket": 8082, "jump_index": "power2_mask", "jump_mixer": "avalanche64", "machine": "macOS-26.5-arm64-arm-64bit-Mach-O", "max_threads_per_threadgroup": 1024, "min_ms": 200, "operation": "jacobian_affine_walk_dynamic_dp_compact", "ops_per_sec": 54351372.121311, "ops_per_sec_max": 58936405.734283, "ops_per_sec_min": 41407648.422616, "output_bytes_per_sample": 17, "output_layout": "dp_compact", "reason": "", "runner_sample_count": 3, "sample_count": 16384, "seconds": 0.202572, "skipped": false, "status": "keep", "steps_per_sample": 8, "thread_execution_width": 32, "threadgroup_limit": 256, "threads_per_threadgroup": 256, "timestamp": "2026-06-22T02:48:24Z"}
{"backend": "metal", "budget_sec": 10, "commit": "f3599da", "correctness": true, "description": "Metal dynamic Jacobian jump walk with sparse distinguished-point stream emission", "distance_tracking": "dp_stream_uint64", "dp_bits": 4, "dp_capacity": 16384, "dp_checksum": "0xbfd3b2319760e774", "dp_count": 1017, "dp_distance_checksum": "0x19e43ca50eec2a74", "dp_stream_overflow": false, "dp_tracking": "projective_x_limb0", "emitted_records": 1017, "experiment": "metal_jacobian_dynamic_dp_stream", "iterations": 8388608, "jump_count": 16, "jump_histogram_max_bucket": 8336, "jump_histogram_max_deviation_ppm": 17578, "jump_histogram_min_bucket": 8082, "jump_index": "power2_mask", "jump_mixer": "avalanche64", "machine": "macOS-26.5-arm64-arm-64bit-Mach-O", "max_threads_per_threadgroup": 1024, "min_ms": 200, "operation": "jacobian_affine_walk_dynamic_dp_stream", "ops_per_sec": 41222124.404033, "ops_per_sec_max": 56276112.414753, "ops_per_sec_min": 32638499.393993, "output_bytes_per_record": 20, "output_bytes_total": 20340, "output_layout": "dp_stream", "reason": "", "runner_sample_count": 3, "sample_count": 16384, "seconds": 0.203498, "skipped": false, "status": "keep", "steps_per_sample": 8, "thread_execution_width": 32, "threadgroup_limit": 256, "threads_per_threadgroup": 256, "timestamp": "2026-06-22T03:03:24Z"}
{"backend": "metal", "budget_sec": 10, "commit": "0bf960d", "correctness": true, "description": "Metal dynamic Jacobian DP stream with runtime dp_bits=8 mask", "distance_tracking": "dp_stream_uint64", "dp_bits": 8, "dp_capacity": 16384, "dp_checksum": "0xab1c2cd29cd70a84", "dp_count": 61, "dp_distance_checksum": "0x822e141de4770a0b", "dp_stream_overflow": false, "dp_tracking": "projective_x_limb0", "emitted_records": 61, "experiment": "metal_jacobian_dynamic_dp_stream_dp8", "iterations": 7471104, "jump_count": 16, "jump_histogram_max_bucket": 8336, "jump_histogram_max_deviation_ppm": 17578, "jump_histogram_min_bucket": 8082, "jump_index": "power2_mask", "jump_mixer": "avalanche64", "machine": "macOS-26.5-arm64-arm-64bit-Mach-O", "max_threads_per_threadgroup": 1024, "min_ms": 200, "operation": "jacobian_affine_walk_dynamic_dp_stream", "ops_per_sec": 37013170.931979, "ops_per_sec_max": 61356369.208598, "ops_per_sec_min": 36486346.807153, "output_bytes_per_record": 20, "output_bytes_total": 1220, "output_layout": "dp_stream", "reason": "", "runner_sample_count": 3, "sample_count": 16384, "seconds": 0.20185, "skipped": false, "status": "keep", "steps_per_sample": 8, "thread_execution_width": 32, "threadgroup_limit": 256, "threads_per_threadgroup": 256, "timestamp": "2026-06-22T03:16:55Z"}
{"backend": "metal", "budget_sec": 10, "commit": "4b4014c", "correctness": true, "description": "Metal dynamic Jacobian DP count-only probe with runtime dp_bits=8 mask", "distance_tracking": "none", "dp_bits": 8, "dp_count": 61, "dp_tracking": "projective_x_limb0", "experiment": "metal_jacobian_dynamic_dp_count_dp8", "iterations": 10878976, "jump_count": 16, "jump_histogram_max_bucket": 8336, "jump_histogram_max_deviation_ppm": 17578, "jump_histogram_min_bucket": 8082, "jump_index": "power2_mask", "jump_mixer": "avalanche64", "machine": "macOS-26.5-arm64-arm-64bit-Mach-O", "max_threads_per_threadgroup": 1024, "min_ms": 200, "operation": "jacobian_affine_walk_dynamic_dp_count", "ops_per_sec": 53546106.476522, "ops_per_sec_max": 56088173.485608, "ops_per_sec_min": 30340248.668051, "output_bytes_total": 4, "output_layout": "dp_count", "reason": "", "runner_sample_count": 3, "sample_count": 16384, "seconds": 0.20317, "skipped": false, "status": "keep", "steps_per_sample": 8, "thread_execution_width": 32, "threadgroup_limit": 256, "threads_per_threadgroup": 256, "timestamp": "2026-06-22T03:33:05Z"}
{"backend": "metal", "budget_sec": 10, "commit": "4b4014c-dirty", "correctness": true, "description": "Metal dynamic Jacobian DP stream with runtime dp_bits=8 mask", "distance_tracking": "dp_stream_uint64", "dp_bits": 8, "dp_capacity": 16384, "dp_checksum": "0xab1c2cd29cd70a84", "dp_count": 61, "dp_distance_checksum": "0x822e141de4770a0b", "dp_stream_overflow": false, "dp_tracking": "projective_x_limb0", "emitted_records": 61, "experiment": "metal_jacobian_dynamic_dp_stream_dp8", "iterations": 7864320, "jump_count": 16, "jump_histogram_max_bucket": 8336, "jump_histogram_max_deviation_ppm": 17578, "jump_histogram_min_bucket": 8082, "jump_index": "power2_mask", "jump_mixer": "avalanche64", "machine": "macOS-26.5-arm64-arm-64bit-Mach-O", "max_threads_per_threadgroup": 1024, "min_ms": 200, "operation": "jacobian_affine_walk_dynamic_dp_stream", "ops_per_sec": 39287501.787886, "ops_per_sec_max": 40036781.483343, "ops_per_sec_min": 22269031.791864, "output_bytes_per_record": 20, "output_bytes_total": 1220, "output_layout": "dp_stream", "reason": "", "runner_sample_count": 3, "sample_count": 16384, "seconds": 0.200174, "skipped": false, "status": "keep", "steps_per_sample": 8, "thread_execution_width": 32, "threadgroup_limit": 256, "threads_per_threadgroup": 256, "timestamp": "2026-06-22T03:33:39Z"}
{"backend": "metal", "budget_sec": 10, "commit": "62c5298", "correctness": true, "description": "Metal dynamic Jacobian DP stream with runtime dp_bits=8 mask", "distance_tracking": "dp_stream_uint64", "dp_bits": 8, "dp_capacity": 16384, "dp_checksum": "0xab1c2cd29cd70a84", "dp_count": 61, "dp_distance_checksum": "0x822e141de4770a0b", "dp_stream_overflow": false, "dp_tracking": "projective_x_limb0", "emitted_records": 61, "experiment": "metal_jacobian_dynamic_dp_stream_dp8", "iterations": 11534336, "jump_count": 16, "jump_histogram_max_bucket": 8336, "jump_histogram_max_deviation_ppm": 17578, "jump_histogram_min_bucket": 8082, "jump_index": "power2_mask", "jump_mixer": "avalanche64", "machine": "macOS-26.5-arm64-arm-64bit-Mach-O", "max_threads_per_threadgroup": 1024, "min_ms": 200, "operation": "jacobian_affine_walk_dynamic_dp_stream", "ops_per_sec": 56977760.954224, "ops_per_sec_max": 57571900.124877, "ops_per_sec_min": 38851216.280614, "output_bytes_per_record": 20, "output_bytes_total": 1220, "output_layout": "dp_stream", "reason": "", "runner_sample_count": 3, "sample_count": 16384, "seconds": 0.202436, "skipped": false, "status": "keep", "steps_per_sample": 8, "thread_execution_width": 32, "threadgroup_limit": 256, "threads_per_threadgroup": 256, "timestamp": "2026-06-22T03:57:06Z"}
{"backend": "metal", "budget_sec": 10, "commit": "f878edc", "correctness": true, "description": "Metal dynamic Jacobian DP stream with runtime dp_bits=8 mask", "distance_tracking": "dp_stream_uint64", "dp_bits": 8, "dp_capacity": 16384, "dp_checksum": "0xab1c2cd29cd70a84", "dp_count": 61, "dp_distance_checksum": "0x822e141de4770a0b", "dp_stream_overflow": false, "dp_tracking": "projective_x_limb0", "emitted_records": 61, "experiment": "metal_jacobian_dynamic_dp_stream_dp8", "iterations": 11796480, "jump_count": 16, "jump_histogram_max_bucket": 8336, "jump_histogram_max_deviation_ppm": 17578, "jump_histogram_min_bucket": 8082, "jump_index": "power2_mask", "jump_mixer": "avalanche64", "machine": "macOS-26.5-arm64-arm-64bit-Mach-O", "max_threads_per_threadgroup": 1024, "min_ms": 200, "operation": "jacobian_affine_walk_dynamic_dp_stream", "ops_per_sec": 58596783.649305, "ops_per_sec_max": 63616563.008358, "ops_per_sec_min": 41535061.85493, "output_bytes_per_record": 20, "output_bytes_total": 1220, "output_layout": "dp_stream", "reason": "", "runner_sample_count": 3, "sample_count": 16384, "seconds": 0.201316, "skipped": false, "status": "keep", "steps_per_sample": 8, "thread_execution_width": 32, "threadgroup_limit": 256, "threads_per_threadgroup": 256, "timestamp": "2026-06-22T04:12:59Z"}
{"backend": "metal", "budget_sec": 10, "commit": "e412530-dirty", "correctness": true, "description": "Metal dynamic Jacobian DP stream with runtime dp_bits=8 mask", "distance_tracking": "dp_stream_uint64", "dp_bits": 8, "dp_capacity": 16384, "dp_checksum": "0xab1c2cd29cd70a84", "dp_count": 61, "dp_distance_checksum": "0x822e141de4770a0b", "dp_stream_overflow": false, "dp_tracking": "projective_x_limb0", "emitted_records": 61, "experiment": "metal_jacobian_dynamic_dp_stream_dp8", "iterations": 9699328, "jump_count": 16, "jump_histogram_max_bucket": 8336, "jump_histogram_max_deviation_ppm": 17578, "jump_histogram_min_bucket": 8082, "jump_index": "power2_mask", "jump_mixer": "avalanche64", "machine": "macOS-26.5-arm64-arm-64bit-Mach-O", "max_threads_per_threadgroup": 1024, "min_ms": 200, "operation": "jacobian_affine_walk_dynamic_dp_stream", "ops_per_sec": 48463423.411911, "ops_per_sec_max": 56335643.461168, "ops_per_sec_min": 29267546.773174, "output_bytes_per_record": 20, "output_bytes_total": 1220, "output_layout": "dp_stream", "reason": "", "runner_sample_count": 3, "sample_count": 16384, "seconds": 0.200137, "skipped": false, "status": "discard", "steps_per_sample": 8, "thread_execution_width": 32, "threadgroup_limit": 256, "threads_per_threadgroup": 256, "timestamp": "2026-06-22T04:19:40Z"}
{"backend": "metal", "budget_sec": 20, "commit": "27fde42-dirty", "correctness": true, "description": "Metal dynamic Jacobian DP stream with runtime dp_bits=8 mask", "distance_tracking": "dp_stream_uint64", "dp_bits": 8, "dp_capacity": 16384, "dp_checksum": "0xab1c2cd29cd70a84", "dp_count": 61, "dp_distance_checksum": "0x822e141de4770a0b", "dp_stream_overflow": false, "dp_tracking": "projective_x_limb0", "emitted_records": 61, "experiment": "metal_jacobian_dynamic_dp_stream_dp8", "iterations": 6553600, "jump_count": 16, "jump_histogram_max_bucket": 8336, "jump_histogram_max_deviation_ppm": 17578, "jump_histogram_min_bucket": 8082, "jump_index": "power2_mask", "jump_mixer": "avalanche64", "machine": "macOS-26.5-arm64-arm-64bit-Mach-O", "max_threads_per_threadgroup": 1024, "min_ms": 200, "operation": "jacobian_affine_walk_dynamic_dp_stream", "ops_per_sec": 32422230.207947, "ops_per_sec_max": 65260356.568942, "ops_per_sec_min": 28376163.880242, "output_bytes_per_record": 20, "output_bytes_total": 1220, "output_layout": "dp_stream", "paired_baseline_ops_per_sec": 60342525.488163, "paired_baseline_ref": "main", "paired_speedup": 0.5373031696246631, "reason": "", "runner_sample_count": 3, "sample_count": 16384, "seconds": 0.202133, "skipped": false, "status": "discard", "steps_per_sample": 8, "thread_execution_width": 32, "threadgroup_limit": 64, "threads_per_threadgroup": 64, "timestamp": "2026-06-22T04:27:33Z"}
