{"affine_scan_mode": "cpu_batch_prod_zz_zzz", "affine_scan_seconds": 0.014649, "backend": "metal", "budget_sec": 240, "bytes_per_target": 2.683818, "candidate_verification": "tag16_hash_filter_then_cpu_exact_key_equality", "commit": "bf0633e-dirty", "cooldown_sec": 10.0, "correctness": true, "description": "Fixed-round 25M target lookup with physical distinct-miss queries; scores setup-inclusive wall-clock kangaroo distance/sec", "distance_per_sec": 269579944612.91904, "distance_tracking": "packet_distance_uint64", "distinct_miss_source_seconds": 1.595191, "dp_bits": 6, "dp_checksum": "0x7f111e78c67b5c18", "dp_count": 4121, "dp_distance_checksum": "0x894123b96acf0de5", "dp_query_count": 4121, "dp_tracking": "affine_x256_y_parity_cpu_batch", "exact_host_table_bytes": 1068595456, "experiment": "metal_jacobian_dynamic_dp_stream_xyzz_affine_scan_target_lookup_tag16_hash_filter25m_rounds_distinct_misses_distance", "filter_false_positive_count": 882, "filter_positive_count": 1010, "gpu_distance_per_sec": 271177042718.54648, "gpu_lookup_lookups_per_sec": 130732178.815948, "gpu_ops_per_sec": 66206342.923579, "hit_count": 128, "injected_hits": 128, "iterations": 536870912, "jump_count": 16, "jump_histogram_max_bucket": 33562777, "jump_histogram_max_deviation_ppm": 249, "jump_histogram_min_bucket": 33546500, "jump_index": "power2_mask", "jump_mixer": "avalanche64", "jump_schedule": "power2", "lookup_buffer_seconds": 0.002401, "lookup_engine": "gpu_filter16_hash", "lookup_engine_effective": "gpu_filter16_hash", "lookup_exact_seconds": 0.001113, "lookup_gpu_seconds": 0.032279, "lookup_hash_seconds": 0.0, "lookup_layout": "open_address_tag16_hash_filter_exact256", "lookup_max_threads_per_threadgroup": 1024, "lookup_query_mode": "distinct_misses", "lookup_repeat": 1024, "lookup_seconds": 0.033392, "lookup_thread_execution_width": 32, "lookup_threadgroup_limit": 512, "lookup_threads_per_threadgroup": 512, "lookup_wall_seconds": 0.035793, "lookups_per_sec": 126373440.274449, "machine": "macOS-26.5-arm64-arm-64bit-Mach-O", "max_threads_per_threadgroup": 1024, "mean_jump_distance": 4095.9375, "min_ms": 0, "miss_count": 4219776, "operation": "jacobian_affine_scan_target_lookup_tag32_rounds", "ops_per_sec": 194258881234.91797, "ops_per_sec_max": 268362485318.49576, "ops_per_sec_min": 145446415013.6991, "output_layout": "affine_dp_scan_target_lookup", "physical_filter_positive_count": 1010, "physical_query_count": 4219904, "query_count": 4219904, "query_input": "hash64", "reason": "", "repeat_positive_index_encoding": "physical_query_index", "requested_hits": 64, "round_count": 2, "round_sample_build_seconds": 0.004398, "runner_sample_count": 3, "sample_count": 131072, "seconds": 8.109056, "setup_inclusive_distance_per_sec": 195445293908.32098, "setup_inclusive_ops_per_sec": 47716864.309653, "setup_inclusive_seconds": 11.251178, "setup_inclusive_wall_distance_per_sec": 194258881234.91797, "setup_inclusive_wall_distance_per_sec_max": 268362485318.49576, "setup_inclusive_wall_distance_per_sec_min": 145446415013.6991, "setup_inclusive_wall_ops_per_sec": 47427208.358262, "setup_inclusive_wall_seconds": 11.319893, "skipped": false, "state_layout": "xyzz", "status": "discard", "steps_per_sample": 2048, "target_bucket_bytes": 268435456, "target_build_seconds": 1.494492, "target_count": 25005000, "target_filter_bucket_bytes": 67108864, "target_filter_build_seconds": 0.0, "target_key": "x256_y_parity", "target_key_bytes": 800160000, "target_lookup_checksum": "0x5c90bdf7f12141b9", "target_query_hash_bytes": 33759232, "target_table_buckets": 33554432, "target_table_bytes": 67108864, "thread_execution_width": 32, "threadgroup_limit": 128, "threads_per_threadgroup": 128, "timestamp": "2026-07-01T22:17:15Z", "validation_seconds": 38.979763, "validation_workers": 8, "walk_buffer_seconds": 0.066314, "walk_wall_seconds": 8.17537}
{"affine_scan_mode": "cpu_batch_prod_zz_zzz", "affine_scan_seconds": 0.08176, "backend": "metal", "budget_sec": 240, "bytes_per_target": 2.683818, "candidate_verification": "tag16_hash_filter_then_cpu_exact_key_equality", "commit": "41f1aa0", "cooldown_sec": 10.0, "correctness": true, "description": "Fixed-round 25M target lookup with physical distinct-miss queries; scores setup-inclusive wall-clock kangaroo distance/sec", "distance_per_sec": 125976671567.82452, "distance_tracking": "packet_distance_uint64", "distinct_miss_source_seconds": 0.316358, "dp_bits": 6, "dp_checksum": "0x7f111e78c67b5c18", "dp_count": 4121, "dp_distance_checksum": "0x894123b96acf0de5", "dp_query_count": 4121, "dp_tracking": "affine_x256_y_parity_cpu_batch", "exact_host_table_bytes": 1068595456, "experiment": "metal_jacobian_dynamic_dp_stream_xyzz_affine_scan_target_lookup_tag16_hash_filter25m_rounds_distinct_misses_distance", "filter_false_positive_count": 873, "filter_positive_count": 1001, "gpu_distance_per_sec": 126996003271.75531, "gpu_lookup_lookups_per_sec": 73687106.427469, "gpu_ops_per_sec": 31005356.715466, "hit_count": 128, "injected_hits": 128, "iterations": 536870912, "jump_count": 16, "jump_histogram_max_bucket": 33562777, "jump_histogram_max_deviation_ppm": 249, "jump_histogram_min_bucket": 33546500, "jump_index": "power2_mask", "jump_mixer": "avalanche64", "jump_schedule": "power2", "lookup_buffer_seconds": 0.220927, "lookup_engine": "gpu_filter16_hash", "lookup_engine_effective": "gpu_filter16_hash", "lookup_exact_seconds": 0.001079, "lookup_gpu_seconds": 0.057268, "lookup_hash_seconds": 0.0, "lookup_layout": "open_address_tag16_hash_filter_exact256", "lookup_max_threads_per_threadgroup": 1024, "lookup_query_mode": "distinct_misses", "lookup_repeat": 1024, "lookup_seconds": 0.058347, "lookup_thread_execution_width": 32, "lookup_threadgroup_limit": 512, "lookup_threads_per_threadgroup": 512, "lookup_wall_seconds": 0.279274, "lookups_per_sec": 72324266.886044, "machine": "macOS-26.5-arm64-arm-64bit-Mach-O", "max_threads_per_threadgroup": 1024, "mean_jump_distance": 4095.9375, "min_ms": 0, "miss_count": 4219776, "operation": "jacobian_affine_scan_target_lookup_tag32_rounds", "ops_per_sec": 104571563857.38062, "ops_per_sec_max": 152950650811.8788, "ops_per_sec_min": 77644906700.51575, "output_layout": "affine_dp_scan_target_lookup", "physical_filter_positive_count": 1001, "physical_query_count": 4219904, "query_count": 4219904, "query_input": "hash64", "reason": "", "repeat_positive_index_encoding": "physical_query_index", "requested_hits": 64, "round_count": 2, "round_sample_build_seconds": 0.005256, "runner_sample_count": 3, "sample_count": 131072, "seconds": 17.315424, "setup_inclusive_distance_per_sec": 114078288217.36826, "setup_inclusive_ops_per_sec": 27851569.565543, "setup_inclusive_seconds": 19.276146, "setup_inclusive_wall_distance_per_sec": 104571563857.38062, "setup_inclusive_wall_distance_per_sec_max": 152950650811.8788, "setup_inclusive_wall_distance_per_sec_min": 77644906700.51575, "setup_inclusive_wall_ops_per_sec": 25530556.522745, "setup_inclusive_wall_seconds": 21.028563, "skipped": false, "state_layout": "xyzz", "status": "discard", "steps_per_sample": 2048, "target_bucket_bytes": 268435456, "target_build_seconds": 1.499, "target_count": 25005000, "target_filter_bucket_bytes": 67108864, "target_filter_build_seconds": 0.0, "target_key": "x256_y_parity", "target_key_bytes": 800160000, "target_lookup_checksum": "0x5c90bdf7f12141b9", "target_query_hash_bytes": 33759232, "target_table_buckets": 33554432, "target_table_bytes": 67108864, "thread_execution_width": 32, "threadgroup_limit": 128, "threads_per_threadgroup": 128, "timestamp": "2026-07-01T22:30:37Z", "validation_seconds": 58.771389, "validation_workers": 8, "walk_buffer_seconds": 1.53149, "walk_wall_seconds": 18.846915}
{"affine_scan_mode": "cpu_batch_prod_zz_zzz", "affine_scan_seconds": 0.012138, "backend": "metal", "budget_sec": 60, "bytes_per_target": 2.683818, "candidate_verification": "tag16_hash_filter_then_cpu_exact_key_equality", "commit": "c46140b-dirty", "cooldown_sec": 10.0, "correctness": true, "description": "Fixed-round 25M target lookup with physical distinct-miss queries; scores setup-inclusive wall-clock kangaroo distance/sec", "distance_per_sec": 485591603994.8401, "distance_tracking": "packet_distance_uint64", "distinct_miss_source_seconds": 0.000162, "dp_bits": 6, "dp_checksum": "0x7f111e78c67b5c18", "dp_count": 4121, "dp_distance_checksum": "0x894123b96acf0de5", "dp_query_count": 4121, "dp_tracking": "affine_x256_y_parity_cpu_batch", "exact_host_table_bytes": 1068595456, "experiment": "metal_jacobian_dynamic_dp_stream_xyzz_affine_scan_target_lookup_tag16_hash_filter25m_rounds_distinct_misses_distance", "filter_false_positive_count": 414, "filter_positive_count": 542, "gpu_distance_per_sec": 489514873895.9602, "gpu_lookup_lookups_per_sec": 176269397.228071, "gpu_ops_per_sec": 119512290.872593, "hit_count": 128, "injected_hits": 128, "iterations": 536870912, "jump_count": 16, "jump_histogram_max_bucket": 33562777, "jump_histogram_max_deviation_ppm": 249, "jump_histogram_min_bucket": 33546500, "jump_index": "power2_mask", "jump_mixer": "avalanche64", "jump_schedule": "power2", "lookup_buffer_seconds": 0.003179, "lookup_engine": "gpu_filter16_hash", "lookup_engine_effective": "gpu_filter16_hash", "lookup_exact_seconds": 0.000216, "lookup_gpu_seconds": 0.02394, "lookup_hash_seconds": 0.0, "lookup_layout": "open_address_tag16_hash_filter_exact256", "lookup_max_threads_per_threadgroup": 1024, "lookup_query_mode": "distinct_misses", "lookup_repeat": 1024, "lookup_seconds": 0.024156, "lookup_thread_execution_width": 32, "lookup_threadgroup_limit": 512, "lookup_threads_per_threadgroup": 512, "lookup_wall_seconds": 0.027335, "lookups_per_sec": 174693830.712611, "machine": "macOS-26.5-arm64-arm-64bit-Mach-O", "max_sample_spread_ratio": 1.5, "max_threads_per_threadgroup": 1024, "mean_jump_distance": 4095.9375, "min_ms": 0, "miss_count": 4219776, "operation": "jacobian_affine_scan_target_lookup_tag32_rounds", "ops_per_sec": 331146258782.56573, "ops_per_sec_max": 370325265986.5302, "ops_per_sec_min": 144478784627.95444, "output_layout": "affine_dp_scan_target_lookup", "paired_baseline_ops_per_sec": 251313212814.90247, "paired_baseline_ref": "main", "paired_order": "alternate", "paired_speedup": 1.3176635445206855, "physical_filter_positive_count": 542, "physical_query_count": 4219904, "query_count": 4219904, "query_input": "hash64_prefix_gpu_miss", "reason": "sample spread ratio 2.563181 exceeds max 1.500000", "repeat_positive_index_encoding": "physical_query_index", "requested_hits": 64, "round_count": 2, "round_sample_build_seconds": 0.006723, "runner_sample_count": 3, "sample_count": 131072, "sample_metric": "setup_inclusive_wall_distance_per_sec", "sample_metric_values": [370325265986.5302, 331146258782.56573, 144478784627.95444], "sample_spread_ratio": 2.563180933035603, "seconds": 4.492182, "setup_inclusive_distance_per_sec": 335722281650.603, "setup_inclusive_ops_per_sec": 81964698.350647, "setup_inclusive_seconds": 6.550026, "setup_inclusive_wall_distance_per_sec": 331146258782.56573, "setup_inclusive_wall_distance_per_sec_max": 370325265986.5302, "setup_inclusive_wall_distance_per_sec_min": 144478784627.95444, "setup_inclusive_wall_ops_per_sec": 80847488.220356, "setup_inclusive_wall_seconds": 6.640539, "skipped": false, "state_layout": "xyzz", "status": "discard", "steps_per_sample": 2048, "target_bucket_bytes": 268435456, "target_build_seconds": 2.014666, "target_count": 25005000, "target_filter_bucket_bytes": 67108864, "target_filter_build_seconds": 0.0, "target_key": "x256_y_parity", "target_key_bytes": 800160000, "target_lookup_checksum": "0x5c90bdf7f12141b9", "target_query_hash_bytes": 32968, "target_table_buckets": 33554432, "target_table_bytes": 67108864, "thread_execution_width": 32, "threadgroup_limit": 128, "threads_per_threadgroup": 128, "timestamp": "2026-07-02T22:30:01Z", "validation_seconds": 49.442204, "validation_workers": 8, "walk_buffer_seconds": 0.087334, "walk_round_mode": "independent", "walk_wall_seconds": 4.579516}
{"affine_scan_mode": "cpu_batch_prod_zz_zzz", "affine_scan_seconds": 0.008601, "backend": "metal", "budget_sec": 90, "bytes_per_target": 2.683818, "candidate_verification": "tag16_hash_filter_then_cpu_exact_key_equality", "commit": "7abb6a4", "cooldown_sec": 10.0, "correctness": true, "description": "Fixed-round 25M target lookup with physical distinct-miss queries; scores setup-inclusive wall-clock kangaroo distance/sec", "distance_per_sec": 467908855590.55334, "distance_tracking": "packet_distance_uint64", "distinct_miss_source_seconds": 1.7e-05, "dp_bits": 6, "dp_checksum": "0x7f111e78c67b5c18", "dp_count": 4121, "dp_distance_checksum": "0x894123b96acf0de5", "dp_normalization": "host_batch_affine", "dp_query_count": 4121, "dp_sampling": "packet_endpoint", "dp_tracking": "affine_x256_y_parity_cpu_batch", "exact_host_table_bytes": 1068595456, "experiment": "metal_jacobian_dynamic_dp_stream_xyzz_affine_scan_target_lookup_tag16_hash_filter25m_rounds_distinct_misses_distance", "filter_false_positive_count": 411, "filter_positive_count": 539, "gpu_distance_per_sec": 470883671119.00555, "gpu_lookup_lookups_per_sec": 201223696.794195, "gpu_ops_per_sec": 114963587.974427, "hit_count": 128, "injected_hits": 128, "iterations": 536870912, "jump_count": 16, "jump_histogram_max_bucket": 33562777, "jump_histogram_max_deviation_ppm": 249, "jump_histogram_min_bucket": 33546500, "jump_index": "power2_mask", "jump_mixer": "avalanche64", "jump_schedule": "power2", "lookup_buffer_seconds": 0.00167, "lookup_engine": "gpu_filter16_hash", "lookup_engine_effective": "gpu_filter16_hash", "lookup_exact_seconds": 0.000118, "lookup_gpu_seconds": 0.020971, "lookup_hash_seconds": 0.0, "lookup_layout": "open_address_tag16_hash_filter_exact256", "lookup_max_threads_per_threadgroup": 1024, "lookup_query_mode": "distinct_misses", "lookup_repeat": 1024, "lookup_seconds": 0.021089, "lookup_thread_execution_width": 32, "lookup_threadgroup_limit": 512, "lookup_threads_per_threadgroup": 512, "lookup_wall_seconds": 0.022759, "lookups_per_sec": 200097016.068346, "machine": "macOS-26.5-arm64-arm-64bit-Mach-O", "max_sample_spread_ratio": 1.5, "max_threads_per_threadgroup": 1024, "mean_jump_distance": 4095.9375, "min_ms": 0, "miss_count": 4219776, "operation": "jacobian_affine_scan_target_lookup_tag32_rounds", "ops_per_sec": 403818789921.0762, "ops_per_sec_max": 406190965735.08136, "ops_per_sec_min": 397892463063.5909, "output_layout": "affine_dp_scan_target_lookup", "physical_filter_positive_count": 539, "physical_query_count": 4219904, "query_count": 4219904, "query_input": "hash64_prefix_gpu_miss", "reason": "", "repeat_positive_index_encoding": "physical_query_index", "requested_hits": 64, "round_count": 2, "round_sample_build_seconds": 0.004212, "runner_sample_count": 3, "sample_count": 131072, "sample_metric": "setup_inclusive_wall_distance_per_sec", "sample_metric_values": [403818789921.0762, 397892463063.5909, 406190965735.08136], "sample_spread_ratio": 1.020856144415493, "seconds": 4.669921, "setup_inclusive_distance_per_sec": 408017842034.7118, "setup_inclusive_ops_per_sec": 99615250.973608, "setup_inclusive_seconds": 5.389445, "setup_inclusive_wall_distance_per_sec": 403818789921.0762, "setup_inclusive_wall_distance_per_sec_max": 406190965735.08136, "setup_inclusive_wall_distance_per_sec_min": 397892463063.5909, "setup_inclusive_wall_ops_per_sec": 98590076.12325, "setup_inclusive_wall_seconds": 5.445486, "skipped": false, "state_layout": "xyzz", "status": "discard", "steps_per_sample": 2048, "target_bucket_bytes": 268435456, "target_build_seconds": 0.685605, "target_count": 25005000, "target_filter_bucket_bytes": 67108864, "target_filter_build_seconds": 0.0, "target_key": "x256_y_parity", "target_key_bytes": 800160000, "target_lookup_checksum": "0x5c90bdf7f12141b9", "target_lookup_scope": "packet_endpoint_dp_keys", "target_query_hash_bytes": 32968, "target_setup_workers": 8, "target_table_buckets": 33554432, "target_table_bytes": 67108864, "thread_execution_width": 32, "threadgroup_limit": 128, "threads_per_threadgroup": 128, "timestamp": "2026-07-05T02:21:09Z", "validation_seconds": 15.225345, "validation_workers": 8, "walk_buffer_seconds": 0.054372, "walk_round_mode": "independent", "walk_wall_seconds": 4.724293}
{"affine_scan_mode": "cpu_batch_prod_zz_zzz", "affine_scan_seconds": 0.047983, "backend": "metal", "budget_sec": 120, "bytes_per_target": 2.683818, "candidate_verification": "tag16_hash_filter_then_cpu_exact_key_equality", "commit": "40bcebf-dirty", "cooldown_sec": 10.0, "correctness": true, "description": "Fixed-round 25M target lookup with physical distinct-miss queries; scores setup-inclusive wall-clock kangaroo distance/sec", "distance_per_sec": 276612793071.54663, "distance_tracking": "packet_distance_uint64", "distinct_miss_source_seconds": 0.000548, "dp_bits": 6, "dp_checksum": "0x7f111e78c67b5c18", "dp_count": 4121, "dp_distance_checksum": "0x894123b96acf0de5", "dp_normalization": "host_batch_affine", "dp_query_count": 4121, "dp_sampling": "packet_endpoint", "dp_tracking": "affine_x256_y_parity_cpu_batch", "exact_host_table_bytes": 1068595456, "experiment": "metal_jacobian_dynamic_dp_stream_xyzz_affine_scan_target_lookup_tag16_hash_filter25m_rounds_distinct_misses_distance", "filter_false_positive_count": 419, "filter_positive_count": 547, "gpu_distance_per_sec": 279763981191.14813, "gpu_lookup_lookups_per_sec": 104251682.924782, "gpu_ops_per_sec": 68302795.438443, "hit_count": 128, "injected_hits": 128, "iterations": 536870912, "jump_count": 16, "jump_histogram_max_bucket": 33562777, "jump_histogram_max_deviation_ppm": 249, "jump_histogram_min_bucket": 33546500, "jump_index": "power2_mask", "jump_mixer": "avalanche64", "jump_schedule": "power2", "lookup_buffer_seconds": 0.024191, "lookup_engine": "gpu_filter16_hash", "lookup_engine_effective": "gpu_filter16_hash", "lookup_exact_seconds": 0.001082, "lookup_gpu_seconds": 0.040478, "lookup_hash_seconds": 0.0, "lookup_layout": "open_address_tag16_hash_filter_exact256", "lookup_max_threads_per_threadgroup": 1024, "lookup_query_mode": "distinct_misses", "lookup_repeat": 1024, "lookup_seconds": 0.04156, "lookup_thread_execution_width": 32, "lookup_threadgroup_limit": 512, "lookup_threads_per_threadgroup": 512, "lookup_wall_seconds": 0.065752, "lookups_per_sec": 101536918.941763, "machine": "macOS-26.5-arm64-arm-64bit-Mach-O", "max_sample_spread_ratio": 1.5, "max_threads_per_threadgroup": 1024, "mean_jump_distance": 4095.9375, "min_ms": 0, "miss_count": 4219776, "operation": "jacobian_affine_scan_target_lookup_tag32_rounds", "ops_per_sec": 226271435558.65353, "ops_per_sec_max": 304005052211.04474, "ops_per_sec_min": 144958969785.81784, "output_layout": "affine_dp_scan_target_lookup", "physical_filter_positive_count": 547, "physical_query_count": 4219904, "query_count": 4219904, "query_input": "hash64_prefix_gpu_miss", "reason": "sample spread ratio 2.097180 exceeds max 1.500000", "repeat_positive_index_encoding": "physical_query_index", "requested_hits": 64, "round_count": 2, "round_sample_build_seconds": 0.003422, "runner_sample_count": 3, "sample_count": 131072, "sample_metric": "setup_inclusive_wall_distance_per_sec", "sample_metric_values": [144958969785.81784, 226271435558.65353, 304005052211.04474], "sample_spread_ratio": 2.097179999693867, "seconds": 7.86016, "setup_inclusive_distance_per_sec": 231982751506.45132, "setup_inclusive_ops_per_sec": 56637278.158285, "setup_inclusive_seconds": 9.479109, "setup_inclusive_wall_distance_per_sec": 226271435558.65353, "setup_inclusive_wall_distance_per_sec_max": 304005052211.04474, "setup_inclusive_wall_distance_per_sec_min": 144958969785.81784, "setup_inclusive_wall_ops_per_sec": 55242892.636583, "setup_inclusive_wall_seconds": 9.718371, "skipped": false, "state_layout": "xyzz", "status": "discard", "steps_per_sample": 2048, "target_bucket_bytes": 268435456, "target_build_seconds": 1.525436, "target_count": 25005000, "target_filter_bucket_bytes": 67108864, "target_filter_build_seconds": 0.0, "target_key": "x256_y_parity", "target_key_bytes": 800160000, "target_lookup_checksum": "0x5c90bdf7f12141b9", "target_lookup_scope": "packet_endpoint_dp_keys", "target_query_hash_bytes": 32968, "target_setup_workers": 8, "target_table_buckets": 33554432, "target_table_bytes": 67108864, "thread_execution_width": 32, "threadgroup_limit": 128, "threads_per_threadgroup": 128, "timestamp": "2026-07-05T10:36:38Z", "validation_seconds": 57.734188, "validation_workers": 8, "walk_buffer_seconds": 0.215071, "walk_round_mode": "independent", "walk_wall_seconds": 8.075231}
