{"backend": "metal", "budget_sec": 30, "buffer_lifetime": "persistent", "bytes_per_target": 2.683818, "candidate_verification": "tag16_hash_filter_then_cpu_exact_key_equality", "commit": "1a29d64", "confirmation_index": 1, "confirmation_runs": 2, "confirmation_status": "keep", "cooldown_sec": 0.0, "correctness": true, "description": "Persistent Metal tag16 filter lookup using prehashed query input with CPU exact verification of compact positives", "dispatch_lookups_per_sec": 651625642.066633, "dispatch_seconds": 0.676265, "exact_host_table_bytes": 1268635456, "exact_verify_seconds": 0.024688, "expected_hits": 64, "experiment": "metal_target_lookup_tag16_hash_filter_persistent", "filter_false_positive_count": 247, "filter_positive_count": 311, "hit_count": 64, "iterations": 456759296, "lookup_layout": "open_address_tag16_hash_filter_exact256", "lookups_per_sec": 587549574.555683, "lookups_per_sec_max": 653119231.685536, "lookups_per_sec_min": 37459130.353225, "machine": "macOS-26.5-arm64-arm-64bit-Mach-O", "max_threads_per_threadgroup": 1024, "metal_setup_seconds": 0.076443, "min_ms": 700, "miss_count": 1082304, "operation": "target_lookup_tag16_hash_filter_persistent_exact256", "ops_per_sec": 587549574.555683, "ops_per_sec_max": 653119231.685536, "ops_per_sec_min": 37459130.353225, "paired_baseline_ops_per_sec": 413622377.497074, "paired_baseline_ref": "main^", "paired_speedup": 1.420497551682487, "query_count": 1082368, "query_input": "hash64", "raw_status": "keep", "reason": "", "runner_sample_count": 3, "sample_count": 1082368, "seconds": 0.777397, "skipped": false, "status": "keep", "target_bucket_bytes": 268435456, "target_count": 25005000, "target_filter_bucket_bytes": 67108864, "target_key": "x256_y_parity", "target_key_bytes": 1000200000, "target_lookup_checksum": "0x9b23e560b9fdfe29", "target_query_hash_bytes": 8658944, "target_table_buckets": 33554432, "target_table_bytes": 67108864, "thread_execution_width": 32, "threadgroup_limit": 512, "threads_per_threadgroup": 512, "timestamp": "2026-06-26T20:23:30Z"}
{"backend": "metal", "budget_sec": 30, "buffer_lifetime": "persistent", "bytes_per_target": 2.683818, "candidate_verification": "tag16_hash_filter_then_cpu_exact_key_equality", "commit": "1a29d64", "confirmation_index": 2, "confirmation_runs": 2, "confirmation_status": "keep", "cooldown_sec": 0.0, "correctness": true, "description": "Persistent Metal tag16 filter lookup using prehashed query input with CPU exact verification of compact positives", "dispatch_lookups_per_sec": 715466255.586644, "dispatch_seconds": 0.678644, "exact_host_table_bytes": 1268635456, "exact_verify_seconds": 0.021789, "expected_hits": 64, "experiment": "metal_target_lookup_tag16_hash_filter_persistent", "filter_false_positive_count": 247, "filter_positive_count": 311, "hit_count": 64, "iterations": 501136384, "lookup_layout": "open_address_tag16_hash_filter_exact256", "lookups_per_sec": 679964381.462716, "lookups_per_sec_max": 692813594.809412, "lookups_per_sec_min": 626787813.776443, "machine": "macOS-26.5-arm64-arm-64bit-Mach-O", "max_threads_per_threadgroup": 1024, "metal_setup_seconds": 0.036571, "min_ms": 700, "miss_count": 1082304, "operation": "target_lookup_tag16_hash_filter_persistent_exact256", "ops_per_sec": 679964381.462716, "ops_per_sec_max": 692813594.809412, "ops_per_sec_min": 626787813.776443, "paired_baseline_ops_per_sec": 509095163.925694, "paired_baseline_ref": "main^", "paired_speedup": 1.3356331578941527, "query_count": 1082368, "query_input": "hash64", "raw_status": "keep", "reason": "", "runner_sample_count": 3, "sample_count": 1082368, "seconds": 0.737004, "skipped": false, "status": "keep", "target_bucket_bytes": 268435456, "target_count": 25005000, "target_filter_bucket_bytes": 67108864, "target_key": "x256_y_parity", "target_key_bytes": 1000200000, "target_lookup_checksum": "0x9b23e560b9fdfe29", "target_query_hash_bytes": 8658944, "target_table_buckets": 33554432, "target_table_bytes": 67108864, "thread_execution_width": 32, "threadgroup_limit": 512, "threads_per_threadgroup": 512, "timestamp": "2026-06-26T20:23:30Z"}
{"backend": "metal", "budget_sec": 30, "buffer_lifetime": "persistent", "bytes_per_target": 2.683818, "candidate_verification": "tag16_hash_filter_then_cpu_exact_key_equality", "commit": "5c64fd7", "confirmation_index": 1, "confirmation_runs": 2, "confirmation_status": "discard", "cooldown_sec": 0.0, "correctness": true, "description": "Persistent Metal tag16 filter lookup using prehashed query input with CPU exact verification of compact positives", "dispatch_lookups_per_sec": 63251637.741603, "dispatch_seconds": 0.69263, "exact_host_table_bytes": 1268635456, "exact_verify_seconds": 0.008966, "expected_hits": 64, "experiment": "metal_target_lookup_tag16_hash_filter_persistent", "filter_false_positive_count": 126, "filter_positive_count": 190, "hit_count": 64, "iterations": 44377088, "lookup_layout": "open_address_tag16_hash_filter_exact256", "lookups_per_sec": 55694532.796569, "lookups_per_sec_max": 79917040.13438, "lookups_per_sec_min": 50480761.906025, "machine": "macOS-26.5-arm64-arm-64bit-Mach-O", "max_threads_per_threadgroup": 1024, "metal_setup_seconds": 0.095198, "min_ms": 700, "miss_count": 1082304, "operation": "target_lookup_tag16_hash_filter_persistent_exact256", "ops_per_sec": 55694532.796569, "ops_per_sec_max": 79917040.13438, "ops_per_sec_min": 50480761.906025, "paired_baseline_ops_per_sec": 67118349.609301, "paired_baseline_ref": "main^", "paired_speedup": 0.8297959219910714, "query_count": 1082368, "query_input": "hash64", "raw_status": "discard", "reason": "", "runner_sample_count": 3, "sample_count": 1082368, "seconds": 0.796794, "skipped": false, "status": "discard", "target_bucket_bytes": 268435456, "target_count": 25005000, "target_filter_bucket_bytes": 67108864, "target_key": "x256_y_parity", "target_key_bytes": 1000200000, "target_lookup_checksum": "0x9b23e560b9fdfe29", "target_query_hash_bytes": 8658944, "target_table_buckets": 33554432, "target_table_bytes": 67108864, "thread_execution_width": 32, "threadgroup_limit": 512, "threads_per_threadgroup": 512, "timestamp": "2026-06-26T20:39:21Z"}
{"backend": "metal", "budget_sec": 30, "buffer_lifetime": "persistent", "bytes_per_target": 2.683818, "candidate_verification": "tag16_hash_filter_then_cpu_exact_key_equality", "commit": "5c64fd7", "confirmation_index": 2, "confirmation_runs": 2, "confirmation_status": "discard", "cooldown_sec": 0.0, "correctness": true, "description": "Persistent Metal tag16 filter lookup using prehashed query input with CPU exact verification of compact positives", "dispatch_lookups_per_sec": 56779920.001617, "dispatch_seconds": 0.702045, "exact_host_table_bytes": 1268635456, "exact_verify_seconds": 0.003268, "expected_hits": 64, "experiment": "metal_target_lookup_tag16_hash_filter_persistent", "filter_false_positive_count": 126, "filter_positive_count": 190, "hit_count": 64, "iterations": 40047616, "lookup_layout": "open_address_tag16_hash_filter_exact256", "lookups_per_sec": 52307280.624436, "lookups_per_sec_max": 587060852.783573, "lookups_per_sec_min": 48835138.769393, "machine": "macOS-26.5-arm64-arm-64bit-Mach-O", "max_threads_per_threadgroup": 1024, "metal_setup_seconds": 0.060309, "min_ms": 700, "miss_count": 1082304, "operation": "target_lookup_tag16_hash_filter_persistent_exact256", "ops_per_sec": 52307280.624436, "ops_per_sec_max": 587060852.783573, "ops_per_sec_min": 48835138.769393, "paired_baseline_ops_per_sec": 34515840.052179, "paired_baseline_ref": "main^", "paired_speedup": 1.5154572667320556, "query_count": 1082368, "query_input": "hash64", "raw_status": "keep", "reason": "", "runner_sample_count": 3, "sample_count": 1082368, "seconds": 0.765622, "skipped": false, "status": "discard", "target_bucket_bytes": 268435456, "target_count": 25005000, "target_filter_bucket_bytes": 67108864, "target_key": "x256_y_parity", "target_key_bytes": 1000200000, "target_lookup_checksum": "0x9b23e560b9fdfe29", "target_query_hash_bytes": 8658944, "target_table_buckets": 33554432, "target_table_bytes": 67108864, "thread_execution_width": 32, "threadgroup_limit": 512, "threads_per_threadgroup": 512, "timestamp": "2026-06-26T20:39:21Z"}
{"backend": "metal", "budget_sec": 30, "buffer_lifetime": "persistent", "bytes_per_target": 2.683818, "candidate_verification": "tag16_hash_filter_then_cpu_exact_key_equality", "commit": "43b5f4f", "confirmation_index": 1, "confirmation_runs": 2, "confirmation_status": "discard", "cooldown_sec": 5.0, "correctness": true, "description": "Same prehashed persistent Metal tag16 lookup with zero-only sentinel remap instead of tag parity folding", "dispatch_lookups_per_sec": 50057869.10475, "dispatch_seconds": 0.709024, "exact_host_table_bytes": 1268635456, "exact_verify_seconds": 0.004513, "expected_hits": 64, "experiment": "metal_target_lookup_tag16_hash_filter_entropy_remap", "filter_false_positive_count": 126, "filter_positive_count": 190, "hit_count": 64, "iterations": 35718144, "lookup_layout": "open_address_tag16_hash_filter_exact256", "lookups_per_sec": 45353378.397795, "lookups_per_sec_max": 87873323.964262, "lookups_per_sec_min": 38419478.340129, "machine": "macOS-26.5-arm64-arm-64bit-Mach-O", "max_threads_per_threadgroup": 1024, "metal_setup_seconds": 0.074015, "min_ms": 700, "miss_count": 1082304, "operation": "target_lookup_tag16_hash_filter_persistent_exact256", "ops_per_sec": 45353378.397795, "ops_per_sec_max": 87873323.964262, "ops_per_sec_min": 38419478.340129, "paired_baseline_ops_per_sec": 44244407.017188, "paired_baseline_ref": "3c3a4ce", "paired_speedup": 1.025064668177747, "query_count": 1082368, "query_input": "hash64", "raw_status": "keep", "reason": "", "runner_sample_count": 3, "sample_count": 1082368, "seconds": 0.787552, "skipped": false, "status": "discard", "target_bucket_bytes": 268435456, "target_count": 25005000, "target_filter_bucket_bytes": 67108864, "target_key": "x256_y_parity", "target_key_bytes": 1000200000, "target_lookup_checksum": "0x9b23e560b9fdfe29", "target_query_hash_bytes": 8658944, "target_table_buckets": 33554432, "target_table_bytes": 67108864, "thread_execution_width": 32, "threadgroup_limit": 512, "threads_per_threadgroup": 512, "timestamp": "2026-06-26T20:44:43Z"}
{"backend": "metal", "budget_sec": 30, "buffer_lifetime": "persistent", "bytes_per_target": 2.683818, "candidate_verification": "tag16_hash_filter_then_cpu_exact_key_equality", "commit": "43b5f4f", "confirmation_index": 2, "confirmation_runs": 2, "confirmation_status": "discard", "cooldown_sec": 5.0, "correctness": true, "description": "Same prehashed persistent Metal tag16 lookup with zero-only sentinel remap instead of tag parity folding", "dispatch_lookups_per_sec": 64480690.080206, "dispatch_seconds": 0.698898, "exact_host_table_bytes": 1268635456, "exact_verify_seconds": 0.00611, "expected_hits": 64, "experiment": "metal_target_lookup_tag16_hash_filter_entropy_remap", "filter_false_positive_count": 126, "filter_positive_count": 190, "hit_count": 64, "iterations": 45459456, "lookup_layout": "open_address_tag16_hash_filter_exact256", "lookups_per_sec": 53724312.532616, "lookups_per_sec_max": 346501153.113144, "lookups_per_sec_min": 42603534.330363, "machine": "macOS-26.5-arm64-arm-64bit-Mach-O", "max_threads_per_threadgroup": 1024, "metal_setup_seconds": 0.141153, "min_ms": 700, "miss_count": 1082304, "operation": "target_lookup_tag16_hash_filter_persistent_exact256", "ops_per_sec": 53724312.532616, "ops_per_sec_max": 346501153.113144, "ops_per_sec_min": 42603534.330363, "paired_baseline_ops_per_sec": 80314447.23932, "paired_baseline_ref": "3c3a4ce", "paired_speedup": 0.668924637836689, "query_count": 1082368, "query_input": "hash64", "raw_status": "discard", "reason": "", "runner_sample_count": 3, "sample_count": 1082368, "seconds": 0.846162, "skipped": false, "status": "discard", "target_bucket_bytes": 268435456, "target_count": 25005000, "target_filter_bucket_bytes": 67108864, "target_key": "x256_y_parity", "target_key_bytes": 1000200000, "target_lookup_checksum": "0x9b23e560b9fdfe29", "target_query_hash_bytes": 8658944, "target_table_buckets": 33554432, "target_table_bytes": 67108864, "thread_execution_width": 32, "threadgroup_limit": 512, "threads_per_threadgroup": 512, "timestamp": "2026-06-26T20:44:43Z"}
{"backend": "metal", "budget_sec": 30, "buffer_lifetime": "persistent", "bytes_per_target": 2.683818, "candidate_verification": "tag16_hash_filter_then_cpu_exact_key_equality", "commit": "95608d4", "confirmation_index": 1, "confirmation_runs": 2, "confirmation_status": "discard", "cooldown_sec": 5.0, "correctness": true, "description": "Same prehashed persistent Metal tag16 lookup with zero-only sentinel remap instead of tag parity folding", "dispatch_lookups_per_sec": 699134630.069418, "dispatch_seconds": 0.689517, "exact_host_table_bytes": 1268635456, "exact_verify_seconds": 0.011796, "expected_hits": 64, "experiment": "metal_target_lookup_tag16_hash_filter_entropy_remap", "filter_false_positive_count": 126, "filter_positive_count": 190, "hit_count": 64, "iterations": 490312704, "lookup_layout": "open_address_tag16_hash_filter_exact256", "lookups_per_sec": 648259973.315809, "lookups_per_sec_max": 714792237.959906, "lookups_per_sec_min": 30295378.84655, "machine": "macOS-26.5-arm64-arm-64bit-Mach-O", "max_threads_per_threadgroup": 1024, "metal_setup_seconds": 0.055038, "min_ms": 700, "miss_count": 1082304, "operation": "target_lookup_tag16_hash_filter_persistent_exact256", "ops_per_sec": 648259973.315809, "ops_per_sec_max": 714792237.959906, "ops_per_sec_min": 30295378.84655, "paired_baseline_ops_per_sec": 105861805.836167, "paired_baseline_ref": "3c3a4ce", "paired_speedup": 6.123643633276613, "query_count": 1082368, "query_input": "hash64", "raw_status": "keep", "reason": "", "runner_sample_count": 3, "sample_count": 1082368, "seconds": 0.756352, "skipped": false, "status": "discard", "target_bucket_bytes": 268435456, "target_count": 25005000, "target_filter_bucket_bytes": 67108864, "target_key": "x256_y_parity", "target_key_bytes": 1000200000, "target_lookup_checksum": "0x9b23e560b9fdfe29", "target_query_hash_bytes": 8658944, "target_table_buckets": 33554432, "target_table_bytes": 67108864, "thread_execution_width": 32, "threadgroup_limit": 512, "threads_per_threadgroup": 512, "timestamp": "2026-06-26T20:52:55Z"}
{"backend": "metal", "budget_sec": 30, "buffer_lifetime": "persistent", "bytes_per_target": 2.683818, "candidate_verification": "tag16_hash_filter_then_cpu_exact_key_equality", "commit": "95608d4", "confirmation_index": 2, "confirmation_runs": 2, "confirmation_status": "discard", "cooldown_sec": 5.0, "correctness": true, "description": "Same prehashed persistent Metal tag16 lookup with zero-only sentinel remap instead of tag parity folding", "dispatch_lookups_per_sec": 98632720.329227, "dispatch_seconds": 0.733028, "exact_host_table_bytes": 1268635456, "exact_verify_seconds": 0.002211, "expected_hits": 64, "experiment": "metal_target_lookup_tag16_hash_filter_entropy_remap", "filter_false_positive_count": 126, "filter_positive_count": 190, "hit_count": 64, "iterations": 72518656, "lookup_layout": "open_address_tag16_hash_filter_exact256", "lookups_per_sec": 93387661.680901, "lookups_per_sec_max": 448486571.252737, "lookups_per_sec_min": 60251120.713014, "machine": "macOS-26.5-arm64-arm-64bit-Mach-O", "max_threads_per_threadgroup": 1024, "metal_setup_seconds": 0.041294, "min_ms": 700, "miss_count": 1082304, "operation": "target_lookup_tag16_hash_filter_persistent_exact256", "ops_per_sec": 93387661.680901, "ops_per_sec_max": 448486571.252737, "ops_per_sec_min": 60251120.713014, "paired_baseline_ops_per_sec": 584292117.657674, "paired_baseline_ref": "3c3a4ce", "paired_speedup": 0.1598304321736805, "query_count": 1082368, "query_input": "hash64", "raw_status": "discard", "reason": "", "runner_sample_count": 3, "sample_count": 1082368, "seconds": 0.776534, "skipped": false, "status": "discard", "target_bucket_bytes": 268435456, "target_count": 25005000, "target_filter_bucket_bytes": 67108864, "target_key": "x256_y_parity", "target_key_bytes": 1000200000, "target_lookup_checksum": "0x9b23e560b9fdfe29", "target_query_hash_bytes": 8658944, "target_table_buckets": 33554432, "target_table_bytes": 67108864, "thread_execution_width": 32, "threadgroup_limit": 512, "threads_per_threadgroup": 512, "timestamp": "2026-06-26T20:52:55Z"}
{"affine_scan_mode": "cpu_batch_prod_zz_zzz", "affine_scan_seconds": 0.015445, "backend": "metal", "budget_sec": 45, "bytes_per_target": 2.683818, "candidate_verification": "tag16_hash_filter_then_cpu_exact_key_equality", "commit": "f19bf60", "confirmation_index": 1, "confirmation_runs": 2, "confirmation_status": "keep", "cooldown_sec": 5.0, "correctness": true, "description": "Metal XYZZ affine DP scan with explicit tag16 hash filter on a 25M-target distinct-miss batch", "distance_tracking": "packet_distance_uint64", "dp_bits": 8, "dp_checksum": "0x9dba4a07ebbb8e14", "dp_count": 1057, "dp_distance_checksum": "0xf0dc88ed68b2ff64", "dp_query_count": 1057, "dp_tracking": "affine_x256_y_parity_cpu_batch", "exact_host_table_bytes": 1268635456, "experiment": "metal_jacobian_dynamic_dp_stream_xyzz_affine_scan_target_lookup_tag16_hash_filter25m", "filter_false_positive_count": 216, "filter_positive_count": 280, "gpu_ops_per_sec": 113477333.846253, "hit_count": 64, "injected_hits": 64, "iterations": 134217728, "jump_count": 16, "jump_histogram_max_bucket": 8394316, "jump_histogram_max_deviation_ppm": 759, "jump_histogram_min_bucket": 8382245, "jump_index": "power2_mask", "jump_mixer": "avalanche64", "jump_schedule": "power2", "lookup_engine": "gpu_filter16_hash", "lookup_engine_effective": "gpu_filter16_hash", "lookup_layout": "open_address_tag16_hash_filter_exact256", "lookup_max_threads_per_threadgroup": 1024, "lookup_query_mode": "distinct_misses", "lookup_repeat": 1024, "lookup_seconds": 0.013176, "lookup_thread_execution_width": 32, "lookup_threadgroup_limit": 512, "lookup_threads_per_threadgroup": 512, "lookups_per_sec": 82146154.502936, "machine": "macOS-26.5-arm64-arm-64bit-Mach-O", "max_threads_per_threadgroup": 1024, "min_ms": 500, "miss_count": 1082304, "operation": "jacobian_affine_scan_target_lookup_tag32", "ops_per_sec": 110796227.32014, "ops_per_sec_max": 112564800.466368, "ops_per_sec_min": 96667873.861567, "output_layout": "affine_dp_scan_target_lookup", "paired_baseline_ops_per_sec": 97896085.677205, "paired_baseline_ref": "main^", "paired_speedup": 1.1317738248030769, "query_count": 1082368, "query_input": "hash64", "raw_status": "keep", "reason": "", "requested_hits": 64, "runner_sample_count": 3, "sample_count": 262144, "seconds": 1.182771, "skipped": false, "state_layout": "xyzz", "status": "keep", "steps_per_sample": 512, "target_bucket_bytes": 268435456, "target_count": 25005000, "target_filter_bucket_bytes": 67108864, "target_key": "x256_y_parity", "target_key_bytes": 1000200000, "target_lookup_checksum": "0x8b2568562837af7f", "target_query_hash_bytes": 8658944, "target_table_buckets": 33554432, "target_table_bytes": 67108864, "thread_execution_width": 32, "threadgroup_limit": 128, "threads_per_threadgroup": 128, "timestamp": "2026-06-26T21:10:53Z", "validation_seconds": 4.875751, "validation_workers": 8}
