{"affine_active_path": "all_active_fast", "affine_buffer": "resize_reuse", "affine_conversion": "batch", "affine_z_access": "const_ref", "architecture": "shared_tame", "avg_dp_count": 288.0, "backend": "macos_cpu", "budget_sec": 5, "candidate_verification": "full_point_collision", "commit": "e5bfc9b", "correctness": true, "description": "Apple Silicon CPU shared-tame tiny 16-target kangaroo benchmark", "dp_bits": 0, "dp_bucket_storage": "inline_first", "dp_hash": "partial_limb_mix", "dp_lookup": "open_address_linear", "dp_reserve": "bounded_range_estimate", "expected_private_key": "0x7", "experiment": "jacobian_kangaroo_multi16_small", "field_rhs_passing": "const_ref", "found_private_key": "0x7", "found_target_index": 15, "iterations": 680, "jacobian_step_passing": "const_ref", "jump_count": 8, "jump_index": "power2_mask", "jump_table": "precomputed", "last_dp_count": 288, "machine": "macOS-26.5-arm64-arm-64bit-Mach-O", "max_steps": 4096, "min_ms": 50, "operation": "jacobian_kangaroo_multi_small", "ops_per_sec": 13593.452578, "ops_per_sec_max": 13596.54403, "ops_per_sec_min": 12808.643089, "paired_baseline_ops_per_sec": 12788.213615, "paired_baseline_ref": "main", "paired_speedup": 1.0629672749644634, "point_passing": "const_ref", "range_bits": 8, "range_context": "precomputed", "reason": "", "runner_sample_count": 3, "sample_count": 1, "scratch": "reused", "seconds": 0.050024, "single_target_ops_per_sec": 29749.513297, "skipped": false, "speedup_vs_single": 0.45693, "start_scalar": "0x2", "status": "keep", "tame_states": 1, "target_count": 16, "target_throughput_vs_single": 7.310884, "timestamp": "2026-06-20T15:23:05Z", "wild_states": 16}
{"affine_active_path": "all_active_fast", "affine_buffer": "resize_reuse", "affine_conversion": "batch", "affine_z_access": "const_ref", "architecture": "shared_tame", "avg_dp_count": 288.0, "backend": "macos_cpu", "budget_sec": 5, "candidate_verification": "full_point_collision", "commit": "9f3ddb7", "correctness": true, "description": "Apple Silicon CPU shared-tame tiny 16-target kangaroo benchmark", "dp_bits": 0, "dp_bucket_storage": "inline_first", "dp_hash": "partial_limb_mix", "dp_key": "x_parity", "dp_lookup": "open_address_linear", "dp_reserve": "sqrt_range_estimate", "expected_private_key": "0x7", "experiment": "jacobian_kangaroo_multi16_small", "field_rhs_passing": "const_ref", "found_private_key": "0x7", "found_target_index": 15, "iterations": 694, "jacobian_step_passing": "const_ref", "jump_count": 8, "jump_index": "power2_mask", "jump_table": "precomputed", "last_dp_count": 288, "machine": "macOS-26.5-arm64-arm-64bit-Mach-O", "max_steps": 4096, "min_ms": 50, "operation": "jacobian_kangaroo_multi_small", "ops_per_sec": 13878.519717, "ops_per_sec_max": 13883.363288, "ops_per_sec_min": 13851.331283, "paired_baseline_ops_per_sec": 13679.019761, "paired_baseline_ref": "main", "paired_speedup": 1.0145843751588686, "point_passing": "const_ref", "range_bits": 8, "range_context": "precomputed", "reason": "", "runner_sample_count": 3, "sample_count": 1, "scratch": "reused", "seconds": 0.050005, "single_target_ops_per_sec": 29798.137616, "skipped": false, "speedup_vs_single": 0.465751, "start_scalar": "0x2", "status": "keep", "tame_states": 1, "target_count": 16, "target_throughput_vs_single": 7.45202, "timestamp": "2026-06-20T15:42:15Z", "wild_states": 16}
{"backend": "macos_cpu", "budget_sec": 5, "carry_impl": "clang_builtin", "checksum": "0x7b3367b10fefa500", "commit": "55dcf5c", "correctness": true, "description": "Apple Silicon CPU secp256k1 field_mul_mod_p benchmark against EcInt reference", "experiment": "cpu_field_mul", "iterations": 4980736, "machine": "macOS-26.5-arm64-arm-64bit-Mach-O", "min_ms": 50, "operation": "field_mul_mod_p", "ops_per_sec": 99603598.262218, "ops_per_sec_max": 99603598.262218, "ops_per_sec_min": 99603598.262218, "paired_baseline_ops_per_sec": 92781494.754415, "paired_baseline_ref": "main", "paired_speedup": 1.0735287087781948, "reason": "", "reference_backend": "ecint", "reference_ops_per_sec": 113143902.092739, "reference_seconds": 0.044021, "runner_sample_count": 1, "sample_count": 4096, "seconds": 0.050006, "skipped": false, "speedup_vs_ecint": 0.880327, "status": "keep", "timestamp": "2026-06-20T16:10:10Z"}
{"affine_active_path": "all_active_fast", "affine_buffer": "resize_reuse", "affine_conversion": "batch", "affine_z_access": "const_ref", "architecture": "shared_tame", "avg_dp_count": 288.0, "backend": "macos_cpu", "budget_sec": 5, "candidate_verification": "full_point_collision", "commit": "cdec95b", "correctness": true, "description": "Apple Silicon CPU shared-tame tiny 16-target kangaroo benchmark", "dp_bits": 0, "dp_bucket_storage": "inline_first", "dp_hash": "partial_limb_mix", "dp_key": "x_parity", "dp_lookup": "open_address_linear", "dp_reserve": "sqrt_range_estimate", "ecint_carry_impl": "clang_builtin", "expected_private_key": "0x7", "experiment": "jacobian_kangaroo_multi16_small", "field_rhs_passing": "const_ref", "found_private_key": "0x7", "found_target_index": 15, "iterations": 744, "jacobian_step_passing": "const_ref", "jump_count": 8, "jump_index": "power2_mask", "jump_table": "precomputed", "last_dp_count": 288, "machine": "macOS-26.5-arm64-arm-64bit-Mach-O", "max_steps": 4096, "min_ms": 50, "operation": "jacobian_kangaroo_multi_small", "ops_per_sec": 14877.433643, "ops_per_sec_max": 14881.546882, "ops_per_sec_min": 14743.548853, "paired_baseline_ops_per_sec": 13802.447979, "paired_baseline_ref": "main", "paired_speedup": 1.0778836961121359, "point_passing": "const_ref", "range_bits": 8, "range_context": "precomputed", "reason": "", "runner_sample_count": 3, "sample_count": 1, "scratch": "reused", "seconds": 0.050009, "single_target_ops_per_sec": 31065.140301, "skipped": false, "speedup_vs_single": 0.478911, "start_scalar": "0x2", "status": "keep", "tame_states": 1, "target_count": 16, "target_throughput_vs_single": 7.662574, "timestamp": "2026-06-20T16:22:16Z", "wild_states": 16}
{"affine_active_path": "all_active_fast", "affine_buffer": "resize_reuse", "affine_conversion": "batch", "affine_tail_update": "skip_final", "affine_z_access": "const_ref", "architecture": "shared_tame", "avg_dp_count": 288.0, "backend": "macos_cpu", "budget_sec": 5, "candidate_verification": "full_point_collision", "commit": "3740fd8", "correctness": true, "description": "Apple Silicon CPU shared-tame tiny 16-target kangaroo benchmark", "dp_bits": 0, "dp_bucket_storage": "inline_first", "dp_capacity": "max_load_2of3", "dp_clear": "empty_guard", "dp_hash": "partial_limb_mix", "dp_key": "x_parity", "dp_lookup": "open_address_linear", "dp_reserve": "sqrt_range_estimate", "ecint_carry_impl": "clang_builtin", "ecint_mul_final_sub": "single_conditional", "expected_private_key": "0x7", "experiment": "jacobian_kangaroo_multi16_small", "field_rhs_passing": "const_ref", "found_private_key": "0x7", "found_target_index": 15, "iterations": 610, "jacobian_step_passing": "const_ref", "jump_count": 8, "jump_index": "power2_mask", "jump_table": "precomputed", "last_dp_count": 288, "machine": "macOS-26.5-arm64-arm-64bit-Mach-O", "max_steps": 4096, "min_ms": 50, "operation": "jacobian_kangaroo_multi_small", "ops_per_sec": 12191.465974, "ops_per_sec_max": 14234.128422, "ops_per_sec_min": 12177.63559, "paired_baseline_ops_per_sec": 11278.965685, "paired_baseline_ref": "main", "paired_speedup": 1.080902834043865, "point_passing": "const_ref", "range_bits": 8, "range_context": "precomputed", "reason": "", "runner_sample_count": 3, "sample_count": 1, "scratch": "reused", "seconds": 0.050035, "single_target_ops_per_sec": 6879.375078, "skipped": false, "speedup_vs_single": 1.772176, "start_scalar": "0x2", "status": "keep", "tame_states": 1, "target_count": 16, "target_throughput_vs_single": 28.354822, "timestamp": "2026-06-20T17:27:42Z", "wild_states": 16}
{"affine_active_path": "all_active_fast", "affine_buffer": "resize_reuse", "affine_conversion": "batch", "affine_tail_update": "skip_final", "affine_z_access": "const_ref", "affine_z_check": "infinity_flag", "architecture": "shared_tame", "avg_dp_count": 288.0, "backend": "macos_cpu", "budget_sec": 5, "candidate_verification": "full_point_collision", "commit": "79327a1", "correctness": true, "description": "Apple Silicon CPU shared-tame tiny 16-target kangaroo benchmark", "dp_bits": 0, "dp_bucket_storage": "inline_first", "dp_capacity": "max_load_2of3", "dp_clear": "empty_guard", "dp_hash": "partial_limb_mix", "dp_key": "x_parity", "dp_lookup": "open_address_linear", "dp_reserve": "sqrt_range_estimate", "ecint_carry_impl": "clang_builtin", "ecint_mul_final_sub": "single_conditional", "expected_private_key": "0x7", "experiment": "jacobian_kangaroo_multi16_small", "field_rhs_passing": "const_ref", "found_private_key": "0x7", "found_target_index": 15, "iterations": 624, "jacobian_step_passing": "const_ref", "jump_count": 8, "jump_index": "power2_mask", "jump_table": "precomputed", "last_dp_count": 288, "machine": "macOS-26.5-arm64-arm-64bit-Mach-O", "max_steps": 4096, "min_ms": 50, "operation": "jacobian_kangaroo_multi_small", "ops_per_sec": 12475.207524, "ops_per_sec_max": 12527.368154, "ops_per_sec_min": 11870.997748, "paired_baseline_ops_per_sec": 11843.596619, "paired_baseline_ref": "main", "paired_speedup": 1.0533293158588957, "point_passing": "const_ref", "range_bits": 8, "range_context": "precomputed", "reason": "", "runner_sample_count": 3, "sample_count": 1, "scratch": "reused", "seconds": 0.050019, "single_target_ops_per_sec": 25341.120865, "skipped": false, "speedup_vs_single": 0.492291, "start_scalar": "0x2", "status": "keep", "tame_states": 1, "target_count": 16, "target_throughput_vs_single": 7.876657, "timestamp": "2026-06-20T19:10:16Z", "wild_states": 16}
{"affine_active_path": "all_active_fast", "affine_buffer": "resize_reuse", "affine_conversion": "batch", "affine_field_ops": "inplace", "affine_tail_update": "skip_final", "affine_z_access": "const_ref", "affine_z_check": "infinity_flag", "architecture": "shared_tame", "avg_dp_count": 288.0, "backend": "macos_cpu", "budget_sec": 5, "candidate_verification": "full_point_collision", "commit": "567a75d", "correctness": true, "description": "Apple Silicon CPU shared-tame tiny 16-target kangaroo benchmark", "dp_bits": 0, "dp_bucket_storage": "inline_first", "dp_capacity": "max_load_2of3", "dp_clear": "empty_guard", "dp_hash": "partial_limb_mix", "dp_key": "x_parity", "dp_lookup": "open_address_linear", "dp_reserve": "sqrt_range_estimate", "ecint_carry_impl": "clang_builtin", "ecint_mul_final_sub": "single_conditional", "expected_private_key": "0x7", "experiment": "jacobian_kangaroo_multi16_small", "field_rhs_passing": "const_ref", "found_private_key": "0x7", "found_target_index": 15, "iterations": 778, "jacobian_step_passing": "const_ref", "jump_count": 8, "jump_index": "power2_mask", "jump_table": "precomputed", "last_dp_count": 288, "machine": "macOS-26.5-arm64-arm-64bit-Mach-O", "max_steps": 4096, "min_ms": 50, "operation": "jacobian_kangaroo_multi_small", "ops_per_sec": 15544.196837, "ops_per_sec_max": 15586.971786, "ops_per_sec_min": 15542.165365, "paired_baseline_ops_per_sec": 15128.174911, "paired_baseline_ref": "main", "paired_speedup": 1.0274998093588608, "point_passing": "const_ref", "range_bits": 8, "range_context": "precomputed", "reason": "", "runner_sample_count": 3, "sample_count": 1, "scratch": "reused", "seconds": 0.050051, "single_target_ops_per_sec": 30776.999243, "skipped": false, "speedup_vs_single": 0.505059, "start_scalar": "0x2", "status": "keep", "tame_states": 1, "target_count": 16, "target_throughput_vs_single": 8.080942, "timestamp": "2026-06-20T19:18:48Z", "wild_states": 16}
{"affine_active_path": "all_active_fast", "affine_buffer": "resize_reuse", "affine_conversion": "batch", "affine_field_ops": "inplace", "affine_reverse_loop": "split_zero", "affine_tail_update": "skip_final", "affine_z_access": "const_ref", "affine_z_check": "infinity_flag", "architecture": "shared_tame", "avg_dp_count": 288.0, "backend": "macos_cpu", "budget_sec": 5, "candidate_verification": "full_point_collision", "commit": "1fc4376", "correctness": true, "description": "Apple Silicon CPU shared-tame tiny 16-target kangaroo benchmark", "dp_bits": 0, "dp_bucket_storage": "inline_first", "dp_capacity": "max_load_2of3", "dp_clear": "empty_guard", "dp_hash": "partial_limb_mix", "dp_key": "x_parity", "dp_lookup": "open_address_linear", "dp_reserve": "sqrt_range_estimate", "ecint_carry_impl": "clang_builtin", "ecint_mul_final_sub": "single_conditional", "expected_private_key": "0x7", "experiment": "jacobian_kangaroo_multi16_small", "field_rhs_passing": "const_ref", "found_private_key": "0x7", "found_target_index": 15, "iterations": 777, "jacobian_step_passing": "const_ref", "jump_count": 8, "jump_index": "power2_mask", "jump_table": "precomputed", "last_dp_count": 288, "machine": "macOS-26.5-arm64-arm-64bit-Mach-O", "max_steps": 4096, "min_ms": 50, "operation": "jacobian_kangaroo_multi_small", "ops_per_sec": 15523.054103, "ops_per_sec_max": 15532.557109, "ops_per_sec_min": 15137.136659, "paired_baseline_ops_per_sec": 14677.125632, "paired_baseline_ref": "main", "paired_speedup": 1.0576358404370167, "point_passing": "const_ref", "range_bits": 8, "range_context": "precomputed", "reason": "", "runner_sample_count": 3, "sample_count": 1, "scratch": "reused", "seconds": 0.050055, "single_target_ops_per_sec": 30460.80969, "skipped": false, "speedup_vs_single": 0.509607, "start_scalar": "0x2", "status": "keep", "tame_states": 1, "target_count": 16, "target_throughput_vs_single": 8.153718, "timestamp": "2026-06-20T19:51:12Z", "wild_states": 16}
{"backend": "metal", "budget_sec": 5, "commit": "bbde2c8", "correctness": true, "description": "Metal secp256k1 field_square_mod_p correctness and throughput gate", "experiment": "metal_field_square", "iterations": 6291456, "machine": "macOS-26.5-arm64-arm-64bit-Mach-O", "max_threads_per_threadgroup": 1024, "min_ms": 50, "operation": "field_square_mod_p", "ops_per_sec": 120182161.633272, "ops_per_sec_max": 120182161.633272, "ops_per_sec_min": 120182161.633272, "paired_baseline_ops_per_sec": 113980384.837718, "paired_baseline_ref": "main", "paired_speedup": 1.054410912933694, "reason": "", "runner_sample_count": 1, "sample_count": 1048576, "seconds": 0.052349, "skipped": false, "status": "keep", "thread_execution_width": 32, "threads_per_threadgroup": 256, "timestamp": "2026-06-20T21:23:38Z"}
{"backend": "metal", "budget_sec": 5, "commit": "bbde2c8", "correctness": true, "description": "Metal secp256k1 field_mul_mod_p correctness and throughput gate", "experiment": "metal_field_mul", "iterations": 6291456, "machine": "macOS-26.5-arm64-arm-64bit-Mach-O", "max_threads_per_threadgroup": 1024, "min_ms": 50, "operation": "field_mul_mod_p", "ops_per_sec": 110169933.604968, "ops_per_sec_max": 110169933.604968, "ops_per_sec_min": 110169933.604968, "paired_baseline_ops_per_sec": 97710635.676187, "paired_baseline_ref": "main", "paired_speedup": 1.127512198058675, "reason": "", "runner_sample_count": 1, "sample_count": 1048576, "seconds": 0.057107, "skipped": false, "status": "keep", "thread_execution_width": 32, "threads_per_threadgroup": 256, "timestamp": "2026-06-20T21:24:28Z"}
{"backend": "metal", "budget_sec": 5, "commit": "bbde2c8", "correctness": true, "description": "Metal fused secp256k1 field_square_mul_mod_p correctness and throughput gate", "experiment": "metal_field_square_mul", "iterations": 7340032, "machine": "macOS-26.5-arm64-arm-64bit-Mach-O", "max_threads_per_threadgroup": 1024, "min_ms": 50, "operation": "field_square_mul_mod_p", "ops_per_sec": 116411049.047869, "ops_per_sec_max": 116411049.047869, "ops_per_sec_min": 116411049.047869, "reason": "", "runner_sample_count": 1, "sample_count": 1048576, "seconds": 0.063053, "skipped": false, "status": "keep", "thread_execution_width": 32, "threads_per_threadgroup": 256, "timestamp": "2026-06-20T21:24:47Z"}
{"backend": "metal", "budget_sec": 5, "commit": "eade21c", "correctness": true, "description": "Metal secp256k1 field_mul_mod_p correctness and throughput gate", "experiment": "metal_field_mul", "iterations": 6291456, "machine": "macOS-26.5-arm64-arm-64bit-Mach-O", "max_threads_per_threadgroup": 1024, "min_ms": 50, "operation": "field_mul_mod_p", "ops_per_sec": 107181958.674, "ops_per_sec_max": 107181958.674, "ops_per_sec_min": 107181958.674, "paired_baseline_ops_per_sec": 102497841.396492, "paired_baseline_ref": "main", "paired_speedup": 1.0456996675606898, "reason": "", "runner_sample_count": 1, "sample_count": 1048576, "seconds": 0.058699, "skipped": false, "status": "keep", "thread_execution_width": 32, "threads_per_threadgroup": 256, "timestamp": "2026-06-20T21:29:05Z"}
{"backend": "metal", "budget_sec": 5, "commit": "07615a1", "correctness": true, "description": "Metal secp256k1 Jacobian plus affine add correctness and throughput gate", "experiment": "metal_jacobian_add", "iterations": 983040, "machine": "macOS-26.5-arm64-arm-64bit-Mach-O", "max_threads_per_threadgroup": 1024, "min_ms": 50, "operation": "jacobian_add_affine", "ops_per_sec": 18987732.357266, "ops_per_sec_max": 23145877.471189, "ops_per_sec_min": 16122729.006089, "reason": "", "runner_sample_count": 3, "sample_count": 65536, "seconds": 0.051772, "skipped": false, "status": "keep", "thread_execution_width": 32, "threadgroup_limit": 256, "threads_per_threadgroup": 256, "timestamp": "2026-06-20T22:13:58Z"}
{"backend": "metal", "budget_sec": 5, "commit": "74d6dad", "correctness": true, "description": "Metal fixed-step Jacobian plus affine walk correctness and throughput gate", "experiment": "metal_jacobian_walk", "iterations": 2228224, "machine": "macOS-26.5-arm64-arm-64bit-Mach-O", "max_threads_per_threadgroup": 1024, "min_ms": 50, "operation": "jacobian_affine_walk_fixed", "ops_per_sec": 43635268.698477, "ops_per_sec_max": 43712057.290467, "ops_per_sec_min": 39216303.440935, "reason": "", "runner_sample_count": 3, "sample_count": 16384, "seconds": 0.051065, "skipped": false, "status": "keep", "steps_per_sample": 8, "thread_execution_width": 32, "threadgroup_limit": 256, "threads_per_threadgroup": 256, "timestamp": "2026-06-20T22:45:27Z"}
{"backend": "metal", "budget_sec": 5, "commit": "2c2c9b5", "correctness": true, "description": "Metal Jacobian jump-table walk correctness and throughput gate", "experiment": "metal_jacobian_jump_walk", "iterations": 1572864, "jump_count": 16, "machine": "macOS-26.5-arm64-arm-64bit-Mach-O", "max_threads_per_threadgroup": 1024, "min_ms": 50, "operation": "jacobian_affine_walk_jump_table", "ops_per_sec": 29322230.463689, "ops_per_sec_max": 37278370.994648, "ops_per_sec_min": 24300650.024927, "reason": "", "runner_sample_count": 3, "sample_count": 16384, "seconds": 0.053641, "skipped": false, "status": "keep", "steps_per_sample": 8, "thread_execution_width": 32, "threadgroup_limit": 256, "threads_per_threadgroup": 256, "timestamp": "2026-06-20T23:05:15Z"}
{"backend": "metal", "budget_sec": 5, "commit": "c41c6d7", "correctness": true, "description": "Metal Jacobian jump-table walk correctness and throughput gate", "experiment": "metal_jacobian_jump_walk", "iterations": 1966080, "jump_count": 16, "machine": "macOS-26.5-arm64-arm-64bit-Mach-O", "max_threads_per_threadgroup": 1024, "min_ms": 50, "operation": "jacobian_affine_walk_jump_table", "ops_per_sec": 38210997.361683, "ops_per_sec_max": 39764446.199153, "ops_per_sec_min": 25910772.852663, "paired_baseline_ops_per_sec": 35711313.72301, "paired_baseline_ref": "main", "paired_speedup": 1.069996966733329, "reason": "", "runner_sample_count": 3, "sample_count": 16384, "seconds": 0.051453, "skipped": false, "status": "keep", "steps_per_sample": 8, "thread_execution_width": 32, "threadgroup_limit": 256, "threads_per_threadgroup": 256, "timestamp": "2026-06-20T23:10:10Z"}
{"backend": "metal", "budget_sec": 5, "commit": "1d8455d", "correctness": true, "description": "Metal Jacobian jump-table walk with scalar-distance accumulation gate", "distance_checksum": "0xa45f471493cace2f", "distance_tracking": "uint64", "experiment": "metal_jacobian_jump_walk_distance", "iterations": 1572864, "jump_count": 16, "machine": "macOS-26.5-arm64-arm-64bit-Mach-O", "max_threads_per_threadgroup": 1024, "min_ms": 50, "operation": "jacobian_affine_walk_jump_table", "ops_per_sec": 30127453.595735, "ops_per_sec_max": 37741158.058549, "ops_per_sec_min": 24629646.2944, "reason": "", "runner_sample_count": 3, "sample_count": 16384, "seconds": 0.052207, "skipped": false, "status": "keep", "steps_per_sample": 8, "thread_execution_width": 32, "threadgroup_limit": 256, "threads_per_threadgroup": 256, "timestamp": "2026-06-20T23:22:37Z"}
{"backend": "metal", "budget_sec": 5, "commit": "31c38cf", "correctness": true, "description": "Metal Jacobian jump-table walk with projective distinguished-point candidate flags", "distance_checksum": "0xa45f471493cace2f", "distance_tracking": "uint64", "dp_bits": 4, "dp_checksum": "0x30a7914972cba014", "dp_count": 1000, "dp_tracking": "projective_x_limb0", "experiment": "metal_jacobian_jump_walk_dp", "iterations": 1835008, "jump_count": 16, "machine": "macOS-26.5-arm64-arm-64bit-Mach-O", "max_threads_per_threadgroup": 1024, "min_ms": 50, "operation": "jacobian_affine_walk_jump_table", "ops_per_sec": 35573689.248061, "ops_per_sec_max": 36883132.89467, "ops_per_sec_min": 29957098.382191, "reason": "", "runner_sample_count": 3, "sample_count": 16384, "seconds": 0.051583, "skipped": false, "status": "keep", "steps_per_sample": 8, "thread_execution_width": 32, "threadgroup_limit": 256, "threads_per_threadgroup": 256, "timestamp": "2026-06-20T23:32:41Z"}
