{"affine_scan_mode": "cpu_batch_prod_zz_zzz", "affine_scan_seconds": 0.000811, "backend": "metal", "budget_sec": 90, "bytes_per_target": 4.0, "candidate_verification": "tag16_hash_filter_then_cpu_exact_key_equality", "commit": "e01d29c-dirty", "cooldown_sec": 5.0, "correctness": true, "description": "M3 large-target repeat-mode auto lookup routing versus explicit CPU lookup", "distance_tracking": "packet_distance_uint64", "dp_bits": 6, "dp_checksum": "0xbeb579944293c04a", "dp_count": 125, "dp_distance_checksum": "0xe3db79a4e83bd59d", "dp_query_count": 125, "dp_tracking": "affine_x256_y_parity_cpu_batch", "exact_host_table_bytes": 939524096, "experiment": "metal_jacobian_dynamic_dp_stream_xyzz_affine_scan_target_lookup_tag16_hash_filter_m3_auto_repeat", "filter_false_positive_count": 0, "filter_positive_count": 131072, "gpu_lookup_lookups_per_sec": 277913138.302903, "gpu_ops_per_sec": 59194187.275507, "hit_count": 131072, "injected_hits": 16, "iterations": 8388608, "jump_count": 16, "jump_histogram_max_bucket": 262877, "jump_histogram_max_deviation_ppm": 3475, "jump_histogram_min_bucket": 261233, "jump_index": "power2_mask", "jump_mixer": "avalanche64", "jump_schedule": "power2", "lookup_engine": "auto", "lookup_engine_effective": "gpu_filter16_hash_repeat", "lookup_exact_seconds": 0.002322, "lookup_gpu_seconds": 0.007369, "lookup_hash_seconds": 6e-06, "lookup_layout": "open_address_tag16_hash_filter_exact256", "lookup_max_threads_per_threadgroup": 1024, "lookup_query_mode": "repeat", "lookup_repeat": 8192, "lookup_seconds": 0.009697, "lookup_thread_execution_width": 32, "lookup_threadgroup_limit": 512, "lookup_threads_per_threadgroup": 512, "lookups_per_sec": 211203848.530127, "machine": "macOS-26.5-arm64-arm-64bit-Mach-O", "max_threads_per_threadgroup": 1024, "min_ms": 100, "miss_count": 892928, "operation": "jacobian_affine_scan_target_lookup_tag32", "ops_per_sec": 55107844.798467, "ops_per_sec_max": 69768702.574673, "ops_per_sec_min": 54365588.003818, "output_layout": "affine_dp_scan_target_lookup", "paired_baseline_ops_per_sec": 62701375.167676, "paired_baseline_ref": "HEAD", "paired_order": "alternate", "paired_speedup": 0.8788937188554098, "query_count": 1024000, "query_input": "hash64_repeat_indexed", "reason": "", "repeat_positive_index_encoding": "packed16_base_repeat", "requested_hits": 16, "round_count": 1, "runner_sample_count": 3, "sample_count": 8192, "seconds": 0.141713, "setup_inclusive_ops_per_sec": 13880052.331086, "setup_inclusive_seconds": 0.604364, "skipped": false, "state_layout": "xyzz", "status": "discard", "steps_per_sample": 512, "target_bucket_bytes": 268435456, "target_build_seconds": 0.401357, "target_count": 16777216, "target_filter_bucket_bytes": 67108864, "target_filter_build_seconds": 0.050786, "target_key": "x256_y_parity", "target_key_bytes": 671088640, "target_lookup_checksum": "0xb87fc40ba6652a4f", "target_query_hash_bytes": 1000, "target_table_buckets": 33554432, "target_table_bytes": 67108864, "thread_execution_width": 32, "threadgroup_limit": 128, "threads_per_threadgroup": 128, "timestamp": "2026-06-30T17:43:03Z", "validation_seconds": 0.124475, "validation_workers": 8}
{"affine_scan_mode": "cpu_batch_prod_zz_zzz", "affine_scan_seconds": 0.000549, "backend": "metal", "budget_sec": 90, "bytes_per_target": 4.0, "candidate_verification": "tag16_hash_filter_then_cpu_exact_key_equality", "commit": "e01d29c-dirty", "cooldown_sec": 5.0, "correctness": true, "description": "M3 large-target repeat-mode auto lookup routing versus explicit CPU lookup at 16M logical queries", "distance_tracking": "packet_distance_uint64", "dp_bits": 6, "dp_checksum": "0xbeb579944293c04a", "dp_count": 125, "dp_distance_checksum": "0xe3db79a4e83bd59d", "dp_query_count": 125, "dp_tracking": "affine_x256_y_parity_cpu_batch", "exact_host_table_bytes": 939524096, "experiment": "metal_jacobian_dynamic_dp_stream_xyzz_affine_scan_target_lookup_tag16_hash_filter_m3_auto_repeat", "filter_false_positive_count": 0, "filter_positive_count": 2097152, "gpu_lookup_lookups_per_sec": 2104847321.808532, "gpu_ops_per_sec": 66578918.181789, "hit_count": 2097152, "injected_hits": 16, "iterations": 8388608, "jump_count": 16, "jump_histogram_max_bucket": 262877, "jump_histogram_max_deviation_ppm": 3475, "jump_histogram_min_bucket": 261233, "jump_index": "power2_mask", "jump_mixer": "avalanche64", "jump_schedule": "power2", "lookup_engine": "auto", "lookup_engine_effective": "gpu_filter16_hash_repeat", "lookup_exact_seconds": 0.04122, "lookup_gpu_seconds": 0.015568, "lookup_hash_seconds": 2e-06, "lookup_layout": "open_address_tag16_hash_filter_exact256", "lookup_max_threads_per_threadgroup": 1024, "lookup_query_mode": "repeat", "lookup_repeat": 131072, "lookup_seconds": 0.056789, "lookup_thread_execution_width": 32, "lookup_threadgroup_limit": 512, "lookup_threads_per_threadgroup": 512, "lookups_per_sec": 577008073.675591, "machine": "macOS-26.5-arm64-arm-64bit-Mach-O", "max_threads_per_threadgroup": 1024, "min_ms": 100, "miss_count": 14286848, "operation": "jacobian_affine_scan_target_lookup_tag32", "ops_per_sec": 45756095.881506, "ops_per_sec_max": 46264065.044679, "ops_per_sec_min": 38515011.763169, "output_layout": "affine_dp_scan_target_lookup", "paired_baseline_ops_per_sec": 20155261.342318, "paired_baseline_ref": "HEAD", "paired_order": "alternate", "paired_speedup": 2.270181224861445, "query_count": 16384000, "query_input": "hash64_repeat_indexed", "reason": "", "repeat_positive_index_encoding": "logical_query_index", "requested_hits": 16, "round_count": 1, "runner_sample_count": 3, "sample_count": 8192, "seconds": 0.125995, "setup_inclusive_ops_per_sec": 17810677.611855, "setup_inclusive_seconds": 0.470988, "skipped": false, "state_layout": "xyzz", "status": "keep", "steps_per_sample": 512, "target_bucket_bytes": 268435456, "target_build_seconds": 0.26175, "target_count": 16777216, "target_filter_bucket_bytes": 67108864, "target_filter_build_seconds": 0.025904, "target_key": "x256_y_parity", "target_key_bytes": 671088640, "target_lookup_checksum": "0x86ec0110960785f8", "target_query_hash_bytes": 1000, "target_table_buckets": 33554432, "target_table_bytes": 67108864, "thread_execution_width": 32, "threadgroup_limit": 128, "threads_per_threadgroup": 128, "timestamp": "2026-06-30T17:49:11Z", "validation_seconds": 0.127577, "validation_workers": 8}
{"affine_scan_mode": "cpu_batch_prod_zz_zzz", "affine_scan_seconds": 0.000673, "backend": "metal", "budget_sec": 90, "bytes_per_target": 4.0, "candidate_verification": "tag16_hash_filter_then_cpu_exact_key_equality", "commit": "25a76bc-dirty", "cooldown_sec": 5.0, "correctness": true, "description": "M3 repeat-indexed tag16 hash filter sparse exact resolver versus full logical output materialization", "distance_tracking": "packet_distance_uint64", "dp_bits": 6, "dp_checksum": "0xbeb579944293c04a", "dp_count": 125, "dp_distance_checksum": "0xe3db79a4e83bd59d", "dp_query_count": 125, "dp_tracking": "affine_x256_y_parity_cpu_batch", "exact_host_table_bytes": 939524096, "experiment": "metal_jacobian_dynamic_dp_stream_xyzz_affine_scan_target_lookup_tag16_hash_filter_m3_sparse_repeat_exact", "filter_false_positive_count": 0, "filter_positive_count": 2097152, "gpu_lookup_lookups_per_sec": 2475953001.624542, "gpu_ops_per_sec": 72955969.176024, "hit_count": 2097152, "injected_hits": 16, "iterations": 8388608, "jump_count": 16, "jump_histogram_max_bucket": 262877, "jump_histogram_max_deviation_ppm": 3475, "jump_histogram_min_bucket": 261233, "jump_index": "power2_mask", "jump_mixer": "avalanche64", "jump_schedule": "power2", "lookup_engine": "auto", "lookup_engine_effective": "gpu_filter16_hash_repeat", "lookup_exact_seconds": 0.029869, "lookup_gpu_seconds": 0.013234, "lookup_hash_seconds": 2e-06, "lookup_layout": "open_address_tag16_hash_filter_exact256", "lookup_max_threads_per_threadgroup": 1024, "lookup_query_mode": "repeat", "lookup_repeat": 131072, "lookup_seconds": 0.043106, "lookup_thread_execution_width": 32, "lookup_threadgroup_limit": 512, "lookup_threads_per_threadgroup": 512, "lookups_per_sec": 760174819.793701, "machine": "macOS-26.5-arm64-arm-64bit-Mach-O", "max_threads_per_threadgroup": 1024, "min_ms": 100, "miss_count": 14286848, "operation": "jacobian_affine_scan_target_lookup_tag32", "ops_per_sec": 52838131.057009, "ops_per_sec_max": 55150626.825467, "ops_per_sec_min": 44630779.874277, "output_layout": "affine_dp_scan_target_lookup", "paired_baseline_ops_per_sec": 40899473.57202, "paired_baseline_ref": "HEAD", "paired_order": "alternate", "paired_speedup": 1.2919024731202513, "query_count": 16384000, "query_input": "hash64_repeat_indexed", "reason": "", "repeat_positive_index_encoding": "logical_query_index", "requested_hits": 16, "round_count": 1, "runner_sample_count": 3, "sample_count": 8192, "seconds": 0.114982, "setup_inclusive_ops_per_sec": 18023315.017654, "setup_inclusive_seconds": 0.465431, "skipped": false, "state_layout": "xyzz", "status": "keep", "steps_per_sample": 512, "target_bucket_bytes": 268435456, "target_build_seconds": 0.280254, "target_count": 16777216, "target_filter_bucket_bytes": 67108864, "target_filter_build_seconds": 0.026416, "target_key": "x256_y_parity", "target_key_bytes": 671088640, "target_lookup_checksum": "0x86ec0110960785f8", "target_query_hash_bytes": 1000, "target_table_buckets": 33554432, "target_table_bytes": 67108864, "thread_execution_width": 32, "threadgroup_limit": 128, "threads_per_threadgroup": 128, "timestamp": "2026-06-30T18:19:21Z", "validation_seconds": 0.142228, "validation_workers": 8}
{"affine_scan_mode": "cpu_batch_prod_zz_zzz", "affine_scan_seconds": 0.000782, "backend": "metal", "budget_sec": 180, "bytes_per_target": 4.0, "candidate_verification": "tag16_hash_filter_then_cpu_exact_key_equality", "commit": "95ac546-dirty", "confirmation_index": 1, "confirmation_runs": 2, "confirmation_status": "keep", "cooldown_sec": 5.0, "correctness": true, "description": "M3 repeat-indexed tag16 hash filter sparse exact resolver versus full logical output materialization", "distance_tracking": "packet_distance_uint64", "dp_bits": 6, "dp_checksum": "0xbeb579944293c04a", "dp_count": 125, "dp_distance_checksum": "0xe3db79a4e83bd59d", "dp_query_count": 125, "dp_tracking": "affine_x256_y_parity_cpu_batch", "exact_host_table_bytes": 939524096, "experiment": "metal_jacobian_dynamic_dp_stream_xyzz_affine_scan_target_lookup_tag16_hash_filter_m3_sparse_repeat_exact", "filter_false_positive_count": 0, "filter_positive_count": 2097152, "gpu_lookup_lookups_per_sec": 1416861823.153697, "gpu_ops_per_sec": 76886699.326786, "hit_count": 2097152, "injected_hits": 16, "iterations": 8388608, "jump_count": 16, "jump_histogram_max_bucket": 262877, "jump_histogram_max_deviation_ppm": 3475, "jump_histogram_min_bucket": 261233, "jump_index": "power2_mask", "jump_mixer": "avalanche64", "jump_schedule": "power2", "lookup_engine": "auto", "lookup_engine_effective": "gpu_filter16_hash_repeat", "lookup_exact_seconds": 0.008053, "lookup_gpu_seconds": 0.023127, "lookup_hash_seconds": 2e-06, "lookup_layout": "open_address_tag16_hash_filter_exact256", "lookup_max_threads_per_threadgroup": 1024, "lookup_query_mode": "repeat", "lookup_repeat": 131072, "lookup_seconds": 0.031182, "lookup_thread_execution_width": 32, "lookup_threadgroup_limit": 512, "lookup_threads_per_threadgroup": 512, "lookups_per_sec": 1050852836.603544, "machine": "macOS-26.5-arm64-arm-64bit-Mach-O", "max_threads_per_threadgroup": 1024, "min_ms": 100, "miss_count": 14286848, "operation": "jacobian_affine_scan_target_lookup_tag32", "ops_per_sec": 59464996.026491, "ops_per_sec_max": 68432345.004937, "ops_per_sec_min": 58453464.916659, "output_layout": "affine_dp_scan_target_lookup", "paired_baseline_ops_per_sec": 57490000.459859, "paired_baseline_ref": "HEAD", "paired_order": "alternate", "paired_speedup": 1.0343537232707276, "query_count": 16384000, "query_input": "hash64_repeat_indexed", "raw_status": "keep", "reason": "", "repeat_positive_index_encoding": "logical_query_index", "requested_hits": 16, "round_count": 1, "runner_sample_count": 3, "sample_count": 8192, "seconds": 0.109103, "setup_inclusive_ops_per_sec": 18332644.732498, "setup_inclusive_seconds": 0.457578, "skipped": false, "state_layout": "xyzz", "status": "keep", "steps_per_sample": 512, "target_bucket_bytes": 268435456, "target_build_seconds": 0.292941, "target_count": 16777216, "target_filter_bucket_bytes": 67108864, "target_filter_build_seconds": 0.023569, "target_key": "x256_y_parity", "target_key_bytes": 671088640, "target_lookup_checksum": "0x86ec0110960785f8", "target_query_hash_bytes": 1000, "target_table_buckets": 33554432, "target_table_bytes": 67108864, "thread_execution_width": 32, "threadgroup_limit": 128, "threads_per_threadgroup": 128, "timestamp": "2026-06-30T18:34:05Z", "validation_seconds": 0.113257, "validation_workers": 8}
{"affine_scan_mode": "cpu_batch_prod_zz_zzz", "affine_scan_seconds": 0.000617, "backend": "metal", "budget_sec": 180, "bytes_per_target": 4.0, "candidate_verification": "tag16_hash_filter_then_cpu_exact_key_equality", "commit": "95ac546-dirty", "confirmation_index": 2, "confirmation_runs": 2, "confirmation_status": "keep", "cooldown_sec": 5.0, "correctness": true, "description": "M3 repeat-indexed tag16 hash filter sparse exact resolver versus full logical output materialization", "distance_tracking": "packet_distance_uint64", "dp_bits": 6, "dp_checksum": "0xbeb579944293c04a", "dp_count": 125, "dp_distance_checksum": "0xe3db79a4e83bd59d", "dp_query_count": 125, "dp_tracking": "affine_x256_y_parity_cpu_batch", "exact_host_table_bytes": 939524096, "experiment": "metal_jacobian_dynamic_dp_stream_xyzz_affine_scan_target_lookup_tag16_hash_filter_m3_sparse_repeat_exact", "filter_false_positive_count": 0, "filter_positive_count": 2097152, "gpu_lookup_lookups_per_sec": 2138612475.95301, "gpu_ops_per_sec": 79150691.228991, "hit_count": 2097152, "injected_hits": 16, "iterations": 8388608, "jump_count": 16, "jump_histogram_max_bucket": 262877, "jump_histogram_max_deviation_ppm": 3475, "jump_histogram_min_bucket": 261233, "jump_index": "power2_mask", "jump_mixer": "avalanche64", "jump_schedule": "power2", "lookup_engine": "auto", "lookup_engine_effective": "gpu_filter16_hash_repeat", "lookup_exact_seconds": 0.005373, "lookup_gpu_seconds": 0.015322, "lookup_hash_seconds": 2e-06, "lookup_layout": "open_address_tag16_hash_filter_exact256", "lookup_max_threads_per_threadgroup": 1024, "lookup_query_mode": "repeat", "lookup_repeat": 131072, "lookup_seconds": 0.020697, "lookup_thread_execution_width": 32, "lookup_threadgroup_limit": 512, "lookup_threads_per_threadgroup": 512, "lookups_per_sec": 1583256368.139961, "machine": "macOS-26.5-arm64-arm-64bit-Mach-O", "max_threads_per_threadgroup": 1024, "min_ms": 100, "miss_count": 14286848, "operation": "jacobian_affine_scan_target_lookup_tag32", "ops_per_sec": 65898116.327166, "ops_per_sec_max": 70234119.368753, "ops_per_sec_min": 62718035.544343, "output_layout": "affine_dp_scan_target_lookup", "paired_baseline_ops_per_sec": 53650264.9714, "paired_baseline_ref": "HEAD", "paired_order": "alternate", "paired_speedup": 1.2282906032671994, "query_count": 16384000, "query_input": "hash64_repeat_indexed", "raw_status": "keep", "reason": "", "repeat_positive_index_encoding": "logical_query_index", "requested_hits": 16, "round_count": 1, "runner_sample_count": 3, "sample_count": 8192, "seconds": 0.105983, "setup_inclusive_ops_per_sec": 21892391.313519, "setup_inclusive_seconds": 0.383175, "skipped": false, "state_layout": "xyzz", "status": "keep", "steps_per_sample": 512, "target_bucket_bytes": 268435456, "target_build_seconds": 0.231945, "target_count": 16777216, "target_filter_bucket_bytes": 67108864, "target_filter_build_seconds": 0.023933, "target_key": "x256_y_parity", "target_key_bytes": 671088640, "target_lookup_checksum": "0x86ec0110960785f8", "target_query_hash_bytes": 1000, "target_table_buckets": 33554432, "target_table_bytes": 67108864, "thread_execution_width": 32, "threadgroup_limit": 128, "threads_per_threadgroup": 128, "timestamp": "2026-06-30T18:34:05Z", "validation_seconds": 0.12066, "validation_workers": 8}
{"affine_scan_mode": "cpu_batch_prod_zz_zzz", "affine_scan_seconds": 0.000793, "backend": "metal", "budget_sec": 180, "bytes_per_target": 4.0, "candidate_verification": "tag16_hash_filter_then_cpu_exact_key_equality", "commit": "e5892e2-dirty", "confirmation_index": 1, "confirmation_runs": 2, "confirmation_status": "discard", "cooldown_sec": 5.0, "correctness": true, "description": "M3 large-repeat auto lookup threadgroup 768 policy versus prior 512 default", "distance_tracking": "packet_distance_uint64", "dp_bits": 6, "dp_checksum": "0xbeb579944293c04a", "dp_count": 125, "dp_distance_checksum": "0xe3db79a4e83bd59d", "dp_query_count": 125, "dp_tracking": "affine_x256_y_parity_cpu_batch", "exact_host_table_bytes": 939524096, "experiment": "metal_jacobian_dynamic_dp_stream_xyzz_affine_scan_target_lookup_tag16_hash_filter_m3_auto_repeat_tg768", "filter_false_positive_count": 0, "filter_positive_count": 2097152, "gpu_lookup_lookups_per_sec": 1103482313.772879, "gpu_ops_per_sec": 74697009.952406, "hit_count": 2097152, "injected_hits": 16, "iterations": 8388608, "jump_count": 16, "jump_histogram_max_bucket": 262877, "jump_histogram_max_deviation_ppm": 3475, "jump_histogram_min_bucket": 261233, "jump_index": "power2_mask", "jump_mixer": "avalanche64", "jump_schedule": "power2", "lookup_engine": "auto", "lookup_engine_effective": "gpu_filter16_hash_repeat", "lookup_exact_seconds": 0.006129, "lookup_gpu_seconds": 0.029695, "lookup_hash_seconds": 7e-06, "lookup_layout": "open_address_tag16_hash_filter_exact256", "lookup_max_threads_per_threadgroup": 1024, "lookup_query_mode": "repeat", "lookup_repeat": 131072, "lookup_seconds": 0.035831, "lookup_thread_execution_width": 32, "lookup_threadgroup_limit": 768, "lookup_threads_per_threadgroup": 768, "lookups_per_sec": 914510080.556315, "machine": "macOS-26.5-arm64-arm-64bit-Mach-O", "max_threads_per_threadgroup": 1024, "min_ms": 100, "miss_count": 14286848, "operation": "jacobian_affine_scan_target_lookup_tag32", "ops_per_sec": 56327326.574853, "ops_per_sec_max": 59973443.013197, "ops_per_sec_min": 55891605.275585, "output_layout": "affine_dp_scan_target_lookup", "paired_baseline_ops_per_sec": 43890631.928539, "paired_baseline_ref": "HEAD", "paired_order": "alternate", "paired_speedup": 1.2833564726651223, "query_count": 16384000, "query_input": "hash64_repeat_indexed", "raw_status": "keep", "reason": "", "repeat_positive_index_encoding": "logical_query_index", "requested_hits": 16, "round_count": 1, "runner_sample_count": 3, "sample_count": 8192, "seconds": 0.112302, "setup_inclusive_ops_per_sec": 13214699.39086, "setup_inclusive_seconds": 0.634794, "skipped": false, "state_layout": "xyzz", "status": "discard", "steps_per_sample": 512, "target_bucket_bytes": 268435456, "target_build_seconds": 0.44981, "target_count": 16777216, "target_filter_bucket_bytes": 67108864, "target_filter_build_seconds": 0.036057, "target_key": "x256_y_parity", "target_key_bytes": 671088640, "target_lookup_checksum": "0x86ec0110960785f8", "target_query_hash_bytes": 1000, "target_table_buckets": 33554432, "target_table_bytes": 67108864, "thread_execution_width": 32, "threadgroup_limit": 128, "threads_per_threadgroup": 128, "timestamp": "2026-06-30T18:54:44Z", "validation_seconds": 0.1947, "validation_workers": 8}
