{"backend": "metal", "budget_sec": 10, "buffer_lifetime": "persistent", "bytes_per_target": 50.735271, "candidate_verification": "tag32_prefilter_then_exact_key_equality", "commit": "5a27649", "confirmation_index": 1, "confirmation_runs": 2, "confirmation_status": "keep", "cooldown_sec": 0.0, "correctness": true, "description": "Persistent Metal tag32 target lookup with the promoted 1024-thread large-table default against the old tg64 default", "dispatch_lookups_per_sec": 254672158.233199, "dispatch_seconds": 0.701257, "expected_hits": 64, "experiment": "metal_target_lookup_tag32_persistent_tg1024", "hit_count": 64, "iterations": 178590720, "lookup_layout": "open_address_tag32_index_exact256", "lookups_per_sec": 193850878.038308, "lookups_per_sec_max": 201389807.799559, "lookups_per_sec_min": 181346315.510114, "machine": "macOS-26.5-arm64-arm-64bit-Mach-O", "max_threads_per_threadgroup": 1024, "metal_setup_seconds": 0.220022, "min_ms": 700, "miss_count": 1082304, "operation": "target_lookup_tag32_persistent_exact256", "ops_per_sec": 193850878.038308, "ops_per_sec_max": 201389807.799559, "ops_per_sec_min": 181346315.510114, "paired_baseline_ops_per_sec": 184805207.139682, "paired_baseline_ref": "main^", "paired_speedup": 1.0489470564094494, "query_count": 1082368, "raw_status": "keep", "reason": "", "runner_sample_count": 3, "sample_count": 1082368, "seconds": 0.921279, "skipped": false, "status": "keep", "target_bucket_bytes": 268435456, "target_count": 25005000, "target_key": "x256_y_parity", "target_key_bytes": 1000200000, "target_lookup_checksum": "0x9b23e560b9fdfe29", "target_table_buckets": 33554432, "target_table_bytes": 1268635456, "thread_execution_width": 32, "threadgroup_limit": 1024, "threads_per_threadgroup": 1024, "timestamp": "2026-06-26T16:34:12Z"}
{"backend": "metal", "budget_sec": 10, "buffer_lifetime": "persistent", "bytes_per_target": 50.735271, "candidate_verification": "tag32_prefilter_then_exact_key_equality", "commit": "5a27649", "confirmation_index": 2, "confirmation_runs": 2, "confirmation_status": "keep", "cooldown_sec": 0.0, "correctness": true, "description": "Persistent Metal tag32 target lookup with the promoted 1024-thread large-table default against the old tg64 default", "dispatch_lookups_per_sec": 225125219.547898, "dispatch_seconds": 0.701946, "expected_hits": 64, "experiment": "metal_target_lookup_tag32_persistent_tg1024", "hit_count": 64, "iterations": 158025728, "lookup_layout": "open_address_tag32_index_exact256", "lookups_per_sec": 175132519.82051, "lookups_per_sec_max": 177222798.783391, "lookups_per_sec_min": 32752807.062851, "machine": "macOS-26.5-arm64-arm-64bit-Mach-O", "max_threads_per_threadgroup": 1024, "metal_setup_seconds": 0.200375, "min_ms": 700, "miss_count": 1082304, "operation": "target_lookup_tag32_persistent_exact256", "ops_per_sec": 175132519.82051, "ops_per_sec_max": 177222798.783391, "ops_per_sec_min": 32752807.062851, "paired_baseline_ops_per_sec": 169434696.493505, "paired_baseline_ref": "main^", "paired_speedup": 1.0336284329297536, "query_count": 1082368, "raw_status": "keep", "reason": "", "runner_sample_count": 3, "sample_count": 1082368, "seconds": 0.902321, "skipped": false, "status": "keep", "target_bucket_bytes": 268435456, "target_count": 25005000, "target_key": "x256_y_parity", "target_key_bytes": 1000200000, "target_lookup_checksum": "0x9b23e560b9fdfe29", "target_table_buckets": 33554432, "target_table_bytes": 1268635456, "thread_execution_width": 32, "threadgroup_limit": 1024, "threads_per_threadgroup": 1024, "timestamp": "2026-06-26T16:34:12Z"}
{"affine_scan_mode": "cpu_batch_prod_zz_zzz", "affine_scan_seconds": 0.0152, "backend": "metal", "budget_sec": 10, "bytes_per_target": 5.367636, "candidate_verification": "tag32_filter_then_cpu_exact_key_equality", "commit": "9a88e7e", "confirmation_index": 1, "confirmation_runs": 2, "confirmation_status": "discard", "cooldown_sec": 0.0, "correctness": true, "description": "Metal XYZZ affine DP scan with auto routing to GPU tag32 filter on a 25M-target distinct-miss batch", "distance_tracking": "packet_distance_uint64", "dp_bits": 8, "dp_checksum": "0x9dba4a07ebbb8e14", "dp_count": 1057, "dp_distance_checksum": "0xf0dc88ed68b2ff64", "dp_query_count": 1057, "dp_tracking": "affine_x256_y_parity_cpu_batch", "exact_host_table_bytes": 1268635456, "experiment": "metal_jacobian_dynamic_dp_stream_xyzz_affine_scan_target_lookup_tag32_auto_filter25m", "filter_false_positive_count": 0, "filter_positive_count": 64, "gpu_ops_per_sec": 123406680.679407, "hit_count": 64, "injected_hits": 64, "iterations": 134217728, "jump_count": 16, "jump_histogram_max_bucket": 8394316, "jump_histogram_max_deviation_ppm": 759, "jump_histogram_min_bucket": 8382245, "jump_index": "power2_mask", "jump_mixer": "avalanche64", "jump_schedule": "power2", "lookup_engine": "auto", "lookup_engine_effective": "gpu_filter", "lookup_layout": "open_address_tag32_filter_exact256", "lookup_max_threads_per_threadgroup": 1024, "lookup_query_mode": "distinct_misses", "lookup_repeat": 1024, "lookup_seconds": 0.032784, "lookup_thread_execution_width": 32, "lookup_threadgroup_limit": 64, "lookup_threads_per_threadgroup": 64, "lookups_per_sec": 33014835.275381, "machine": "macOS-26.5-arm64-arm-64bit-Mach-O", "max_threads_per_threadgroup": 1024, "min_ms": 500, "miss_count": 1082304, "operation": "jacobian_affine_scan_target_lookup_tag32", "ops_per_sec": 118192117.838356, "ops_per_sec_max": 121482261.791126, "ops_per_sec_min": 116860340.041955, "output_layout": "affine_dp_scan_target_lookup", "paired_baseline_ops_per_sec": 107945031.65148, "paired_baseline_ref": "main^", "paired_speedup": 1.0949287431769956, "query_count": 1082368, "raw_status": "keep", "reason": "", "requested_hits": 64, "runner_sample_count": 3, "sample_count": 262144, "seconds": 1.087605, "skipped": false, "state_layout": "xyzz", "status": "discard", "steps_per_sample": 512, "target_bucket_bytes": 268435456, "target_count": 25005000, "target_filter_bucket_bytes": 134217728, "target_key": "x256_y_parity", "target_key_bytes": 1000200000, "target_lookup_checksum": "0x8b2568562837af7f", "target_table_buckets": 33554432, "target_table_bytes": 134217728, "thread_execution_width": 32, "threadgroup_limit": 128, "threads_per_threadgroup": 128, "timestamp": "2026-06-26T17:32:42Z", "validation_seconds": 5.093106, "validation_workers": 8}
{"affine_scan_mode": "cpu_batch_prod_zz_zzz", "affine_scan_seconds": 0.016354, "backend": "metal", "budget_sec": 10, "bytes_per_target": 5.367636, "candidate_verification": "tag32_filter_then_cpu_exact_key_equality", "commit": "9a88e7e", "confirmation_index": 2, "confirmation_runs": 2, "confirmation_status": "discard", "cooldown_sec": 0.0, "correctness": true, "description": "Metal XYZZ affine DP scan with auto routing to GPU tag32 filter on a 25M-target distinct-miss batch", "distance_tracking": "packet_distance_uint64", "dp_bits": 8, "dp_checksum": "0x9dba4a07ebbb8e14", "dp_count": 1057, "dp_distance_checksum": "0xf0dc88ed68b2ff64", "dp_query_count": 1057, "dp_tracking": "affine_x256_y_parity_cpu_batch", "exact_host_table_bytes": 1268635456, "experiment": "metal_jacobian_dynamic_dp_stream_xyzz_affine_scan_target_lookup_tag32_auto_filter25m", "filter_false_positive_count": 0, "filter_positive_count": 64, "gpu_ops_per_sec": 66084961.482768, "hit_count": 64, "injected_hits": 64, "iterations": 134217728, "jump_count": 16, "jump_histogram_max_bucket": 8394316, "jump_histogram_max_deviation_ppm": 759, "jump_histogram_min_bucket": 8382245, "jump_index": "power2_mask", "jump_mixer": "avalanche64", "jump_schedule": "power2", "lookup_engine": "auto", "lookup_engine_effective": "gpu_filter", "lookup_layout": "open_address_tag32_filter_exact256", "lookup_max_threads_per_threadgroup": 1024, "lookup_query_mode": "distinct_misses", "lookup_repeat": 1024, "lookup_seconds": 0.039241, "lookup_thread_execution_width": 32, "lookup_threadgroup_limit": 64, "lookup_threads_per_threadgroup": 64, "lookups_per_sec": 27582491.582492, "machine": "macOS-26.5-arm64-arm-64bit-Mach-O", "max_threads_per_threadgroup": 1024, "min_ms": 500, "miss_count": 1082304, "operation": "jacobian_affine_scan_target_lookup_tag32", "ops_per_sec": 64324197.141042, "ops_per_sec_max": 78397282.149771, "ops_per_sec_min": 42962373.187433, "output_layout": "affine_dp_scan_target_lookup", "paired_baseline_ops_per_sec": 64245663.646454, "paired_baseline_ref": "main^", "paired_speedup": 1.0012223937014673, "query_count": 1082368, "raw_status": "discard", "reason": "", "requested_hits": 64, "runner_sample_count": 3, "sample_count": 262144, "seconds": 2.030987, "skipped": false, "state_layout": "xyzz", "status": "discard", "steps_per_sample": 512, "target_bucket_bytes": 268435456, "target_count": 25005000, "target_filter_bucket_bytes": 134217728, "target_key": "x256_y_parity", "target_key_bytes": 1000200000, "target_lookup_checksum": "0x8b2568562837af7f", "target_table_buckets": 33554432, "target_table_bytes": 134217728, "thread_execution_width": 32, "threadgroup_limit": 128, "threads_per_threadgroup": 128, "timestamp": "2026-06-26T17:32:42Z", "validation_seconds": 9.499157, "validation_workers": 8}
{"backend": "metal", "budget_sec": 10, "bytes_per_target": 5.367636, "candidate_verification": "tag32_filter_then_cpu_exact_key_equality", "commit": "feb9db3", "confirmation_index": 1, "confirmation_runs": 2, "confirmation_status": "keep", "cooldown_sec": 0.0, "correctness": true, "description": "Metal tag32-only target filter with CPU exact verification of compact positives", "exact_host_table_bytes": 1268635456, "exact_verify_seconds": 0.008929, "expected_hits": 64, "experiment": "metal_target_lookup_tag32_filter_exact256", "filter_false_positive_count": 0, "filter_positive_count": 64, "filter_seconds": 0.546642, "hit_count": 64, "iterations": 45459456, "lookup_layout": "open_address_tag32_filter_exact256", "lookups_per_sec": 81824789.519815, "lookups_per_sec_max": 93852276.29877, "lookups_per_sec_min": 73930170.128679, "machine": "macOS-26.5-arm64-arm-64bit-Mach-O", "max_threads_per_threadgroup": 1024, "min_ms": 500, "miss_count": 1082304, "operation": "target_lookup_tag32_filter_exact256", "ops_per_sec": 81824789.519815, "ops_per_sec_max": 93852276.29877, "ops_per_sec_min": 73930170.128679, "paired_baseline_ops_per_sec": 7906908.934311, "paired_baseline_ref": "main^", "paired_speedup": 10.34851801122269, "query_count": 1082368, "raw_status": "keep", "reason": "", "runner_sample_count": 3, "sample_count": 1082368, "seconds": 0.555571, "skipped": false, "status": "keep", "target_bucket_bytes": 268435456, "target_count": 25005000, "target_filter_bucket_bytes": 134217728, "target_key": "x256_y_parity", "target_key_bytes": 1000200000, "target_lookup_checksum": "0x9b23e560b9fdfe29", "target_table_buckets": 33554432, "target_table_bytes": 134217728, "thread_execution_width": 32, "threadgroup_limit": 64, "threads_per_threadgroup": 64, "timestamp": "2026-06-26T17:41:04Z"}
{"backend": "metal", "budget_sec": 10, "bytes_per_target": 5.367636, "candidate_verification": "tag32_filter_then_cpu_exact_key_equality", "commit": "feb9db3", "confirmation_index": 2, "confirmation_runs": 2, "confirmation_status": "keep", "cooldown_sec": 0.0, "correctness": true, "description": "Metal tag32-only target filter with CPU exact verification of compact positives", "exact_host_table_bytes": 1268635456, "exact_verify_seconds": 0.00099, "expected_hits": 64, "experiment": "metal_target_lookup_tag32_filter_exact256", "filter_false_positive_count": 0, "filter_positive_count": 64, "filter_seconds": 0.536993, "hit_count": 64, "iterations": 48706560, "lookup_layout": "open_address_tag32_filter_exact256", "lookups_per_sec": 90535388.113438, "lookups_per_sec_max": 91046185.893661, "lookups_per_sec_min": 83435668.837077, "machine": "macOS-26.5-arm64-arm-64bit-Mach-O", "max_threads_per_threadgroup": 1024, "min_ms": 500, "miss_count": 1082304, "operation": "target_lookup_tag32_filter_exact256", "ops_per_sec": 90535388.113438, "ops_per_sec_max": 91046185.893661, "ops_per_sec_min": 83435668.837077, "paired_baseline_ops_per_sec": 12925222.41617, "paired_baseline_ref": "main^", "paired_speedup": 7.004551658637178, "query_count": 1082368, "raw_status": "keep", "reason": "", "runner_sample_count": 3, "sample_count": 1082368, "seconds": 0.537984, "skipped": false, "status": "keep", "target_bucket_bytes": 268435456, "target_count": 25005000, "target_filter_bucket_bytes": 134217728, "target_key": "x256_y_parity", "target_key_bytes": 1000200000, "target_lookup_checksum": "0x9b23e560b9fdfe29", "target_table_buckets": 33554432, "target_table_bytes": 134217728, "thread_execution_width": 32, "threadgroup_limit": 64, "threads_per_threadgroup": 64, "timestamp": "2026-06-26T17:41:04Z"}
{"backend": "metal", "budget_sec": 10, "buffer_lifetime": "persistent", "bytes_per_target": 5.367636, "candidate_verification": "tag32_filter_then_cpu_exact_key_equality", "commit": "bf01557", "confirmation_index": 1, "confirmation_runs": 2, "confirmation_status": "keep", "cooldown_sec": 0.0, "correctness": true, "description": "Persistent Metal tag32 filter lookup with CPU exact verification of compact positives", "dispatch_lookups_per_sec": 374969747.91749, "dispatch_seconds": 0.700474, "exact_host_table_bytes": 1268635456, "exact_verify_seconds": 0.000957, "expected_hits": 64, "experiment": "metal_target_lookup_tag32_filter_persistent", "filter_false_positive_count": 0, "filter_positive_count": 64, "hit_count": 64, "iterations": 263015424, "lookup_layout": "open_address_tag32_filter_exact256", "lookups_per_sec": 336974086.813292, "lookups_per_sec_max": 418475150.776683, "lookups_per_sec_min": 314686903.489066, "machine": "macOS-26.5-arm64-arm-64bit-Mach-O", "max_threads_per_threadgroup": 1024, "metal_setup_seconds": 0.07909, "min_ms": 700, "miss_count": 1082304, "operation": "target_lookup_tag32_filter_persistent_exact256", "ops_per_sec": 336974086.813292, "ops_per_sec_max": 418475150.776683, "ops_per_sec_min": 314686903.489066, "paired_baseline_ops_per_sec": 56761507.658097, "paired_baseline_ref": "main^", "paired_speedup": 5.936665545303268, "query_count": 1082368, "raw_status": "keep", "reason": "", "runner_sample_count": 3, "sample_count": 1082368, "seconds": 0.780521, "skipped": false, "status": "keep", "target_bucket_bytes": 268435456, "target_count": 25005000, "target_filter_bucket_bytes": 134217728, "target_key": "x256_y_parity", "target_key_bytes": 1000200000, "target_lookup_checksum": "0x9b23e560b9fdfe29", "target_table_buckets": 33554432, "target_table_bytes": 134217728, "thread_execution_width": 32, "threadgroup_limit": 512, "threads_per_threadgroup": 512, "timestamp": "2026-06-26T17:56:15Z"}
{"backend": "metal", "budget_sec": 10, "buffer_lifetime": "persistent", "bytes_per_target": 5.367636, "candidate_verification": "tag32_filter_then_cpu_exact_key_equality", "commit": "bf01557", "confirmation_index": 2, "confirmation_runs": 2, "confirmation_status": "keep", "cooldown_sec": 0.0, "correctness": true, "description": "Persistent Metal tag32 filter lookup with CPU exact verification of compact positives", "dispatch_lookups_per_sec": 523596097.409498, "dispatch_seconds": 0.699725, "exact_host_table_bytes": 1268635456, "exact_verify_seconds": 0.001049, "expected_hits": 64, "experiment": "metal_target_lookup_tag32_filter_persistent", "filter_false_positive_count": 0, "filter_positive_count": 64, "hit_count": 64, "iterations": 366922752, "lookup_layout": "open_address_tag32_filter_exact256", "lookups_per_sec": 433107771.320567, "lookups_per_sec_max": 469588085.345324, "lookups_per_sec_min": 397789189.531183, "machine": "macOS-26.5-arm64-arm-64bit-Mach-O", "max_threads_per_threadgroup": 1024, "metal_setup_seconds": 0.146411, "min_ms": 700, "miss_count": 1082304, "operation": "target_lookup_tag32_filter_persistent_exact256", "ops_per_sec": 433107771.320567, "ops_per_sec_max": 469588085.345324, "ops_per_sec_min": 397789189.531183, "paired_baseline_ops_per_sec": 83397796.618923, "paired_baseline_ref": "main^", "paired_speedup": 5.193275948279606, "query_count": 1082368, "raw_status": "keep", "reason": "", "runner_sample_count": 3, "sample_count": 1082368, "seconds": 0.847186, "skipped": false, "status": "keep", "target_bucket_bytes": 268435456, "target_count": 25005000, "target_filter_bucket_bytes": 134217728, "target_key": "x256_y_parity", "target_key_bytes": 1000200000, "target_lookup_checksum": "0x9b23e560b9fdfe29", "target_table_buckets": 33554432, "target_table_bytes": 134217728, "thread_execution_width": 32, "threadgroup_limit": 512, "threads_per_threadgroup": 512, "timestamp": "2026-06-26T17:56:15Z"}
{"backend": "metal", "budget_sec": 30, "buffer_lifetime": "persistent", "bytes_per_target": 2.683818, "candidate_verification": "tag16_filter_then_cpu_exact_key_equality", "commit": "209a31c", "confirmation_index": 1, "confirmation_runs": 2, "confirmation_status": "keep", "cooldown_sec": 0.0, "correctness": true, "description": "Persistent Metal tag16 filter lookup with CPU exact verification of compact positives", "dispatch_lookups_per_sec": 533308898.021916, "dispatch_seconds": 0.684116, "exact_host_table_bytes": 1268635456, "exact_verify_seconds": 0.016073, "expected_hits": 64, "experiment": "metal_target_lookup_tag16_filter_persistent", "filter_false_positive_count": 247, "filter_positive_count": 311, "hit_count": 64, "iterations": 373416960, "lookup_layout": "open_address_tag16_filter_exact256", "lookups_per_sec": 484056946.155764, "lookups_per_sec_max": 534334304.142297, "lookups_per_sec_min": 448610727.821779, "machine": "macOS-26.5-arm64-arm-64bit-Mach-O", "max_threads_per_threadgroup": 1024, "metal_setup_seconds": 0.071243, "min_ms": 700, "miss_count": 1082304, "operation": "target_lookup_tag16_filter_persistent_exact256", "ops_per_sec": 484056946.155764, "ops_per_sec_max": 534334304.142297, "ops_per_sec_min": 448610727.821779, "paired_baseline_ops_per_sec": 452953236.815958, "paired_baseline_ref": "main^", "paired_speedup": 1.0686686986905094, "query_count": 1082368, "raw_status": "keep", "reason": "", "runner_sample_count": 3, "sample_count": 1082368, "seconds": 0.771432, "skipped": false, "status": "keep", "target_bucket_bytes": 268435456, "target_count": 25005000, "target_filter_bucket_bytes": 67108864, "target_key": "x256_y_parity", "target_key_bytes": 1000200000, "target_lookup_checksum": "0x9b23e560b9fdfe29", "target_table_buckets": 33554432, "target_table_bytes": 67108864, "thread_execution_width": 32, "threadgroup_limit": 512, "threads_per_threadgroup": 512, "timestamp": "2026-06-26T18:18:11Z"}
{"backend": "metal", "budget_sec": 30, "buffer_lifetime": "persistent", "bytes_per_target": 2.683818, "candidate_verification": "tag16_filter_then_cpu_exact_key_equality", "commit": "209a31c", "confirmation_index": 2, "confirmation_runs": 2, "confirmation_status": "keep", "cooldown_sec": 0.0, "correctness": true, "description": "Persistent Metal tag16 filter lookup with CPU exact verification of compact positives", "dispatch_lookups_per_sec": 506407302.927262, "dispatch_seconds": 0.683742, "exact_host_table_bytes": 1268635456, "exact_verify_seconds": 0.017308, "expected_hits": 64, "experiment": "metal_target_lookup_tag16_filter_persistent", "filter_false_positive_count": 247, "filter_positive_count": 311, "hit_count": 64, "iterations": 355016704, "lookup_layout": "open_address_tag16_filter_exact256", "lookups_per_sec": 480486002.881186, "lookups_per_sec_max": 495879399.237315, "lookups_per_sec_min": 463386652.442391, "machine": "macOS-26.5-arm64-arm-64bit-Mach-O", "max_threads_per_threadgroup": 1024, "metal_setup_seconds": 0.03782, "min_ms": 700, "miss_count": 1082304, "operation": "target_lookup_tag16_filter_persistent_exact256", "ops_per_sec": 480486002.881186, "ops_per_sec_max": 495879399.237315, "ops_per_sec_min": 463386652.442391, "paired_baseline_ops_per_sec": 381489141.634999, "paired_baseline_ref": "main^", "paired_speedup": 1.259501124519306, "query_count": 1082368, "raw_status": "keep", "reason": "", "runner_sample_count": 3, "sample_count": 1082368, "seconds": 0.73887, "skipped": false, "status": "keep", "target_bucket_bytes": 268435456, "target_count": 25005000, "target_filter_bucket_bytes": 67108864, "target_key": "x256_y_parity", "target_key_bytes": 1000200000, "target_lookup_checksum": "0x9b23e560b9fdfe29", "target_table_buckets": 33554432, "target_table_bytes": 67108864, "thread_execution_width": 32, "threadgroup_limit": 512, "threads_per_threadgroup": 512, "timestamp": "2026-06-26T18:18:11Z"}
