{"backend": "metal", "budget_sec": 10, "bytes_per_target": 56.0, "candidate_verification": "tag32_prefilter_then_exact_key_equality", "commit": "768b93a-dirty", "confirmation_index": 2, "confirmation_runs": 2, "confirmation_status": "discard", "cooldown_sec": 0.0, "correctness": true, "description": "Metal tag32 target lookup with redundant sentinel condition removed", "expected_hits": 4096, "experiment": "metal_target_lookup_tag32_sentinel_simplified_exact256", "hit_count": 4096, "iterations": 80740352, "lookup_layout": "open_address_tag32_index_exact256", "lookups_per_sec": 159995387.77754, "lookups_per_sec_max": 192083947.268676, "lookups_per_sec_min": 144505262.32838, "machine": "macOS-26.5-arm64-arm-64bit-Mach-O", "max_threads_per_threadgroup": 1024, "min_ms": 500, "miss_count": 1044480, "operation": "target_lookup_tag32_exact256", "ops_per_sec": 159995387.77754, "ops_per_sec_max": 192083947.268676, "ops_per_sec_min": 144505262.32838, "paired_baseline_ops_per_sec": 170733796.380747, "paired_baseline_ref": "HEAD~1", "paired_speedup": 0.9371043763399973, "query_count": 1048576, "raw_status": "discard", "reason": "", "runner_sample_count": 3, "sample_count": 1048576, "seconds": 0.504642, "skipped": false, "status": "discard", "target_bucket_bytes": 16777216, "target_count": 1048576, "target_key": "x256_y_parity", "target_key_bytes": 41943040, "target_lookup_checksum": "0x4f62d3a7170b250a", "target_table_buckets": 2097152, "target_table_bytes": 58720256, "thread_execution_width": 32, "threadgroup_limit": 64, "threads_per_threadgroup": 64, "timestamp": "2026-06-25T00:57:18Z"}
{"affine_scan_mode": "cpu_batch_prod_zz_zzz", "affine_scan_seconds": 0.015645, "backend": "metal", "budget_sec": 10, "bytes_per_target": 56.0, "candidate_verification": "tag32_prefilter_then_exact_key_equality", "commit": "436d252", "cooldown_sec": 0.0, "correctness": true, "description": "Metal XYZZ affine DP scan feeding exact tag32 multi-target lookup", "distance_tracking": "packet_distance_uint64", "dp_bits": 8, "dp_checksum": "0x9dba4a07ebbb8e14", "dp_count": 1057, "dp_distance_checksum": "0xf0dc88ed68b2ff64", "dp_query_count": 1057, "dp_tracking": "affine_x256_y_parity_cpu_batch", "experiment": "metal_jacobian_dynamic_dp_stream_xyzz_affine_scan_target_lookup_tag32", "gpu_ops_per_sec": 123665851.652341, "hit_count": 64, "injected_hits": 64, "iterations": 134217728, "jump_count": 16, "jump_histogram_max_bucket": 8394316, "jump_histogram_max_deviation_ppm": 759, "jump_histogram_min_bucket": 8382245, "jump_index": "power2_mask", "jump_mixer": "avalanche64", "jump_schedule": "power2", "lookup_layout": "open_address_tag32_index_exact256", "lookup_max_threads_per_threadgroup": 1024, "lookup_seconds": 0.000736, "lookup_thread_execution_width": 32, "lookup_threadgroup_limit": 64, "lookup_threads_per_threadgroup": 64, "lookups_per_sec": 1436629.28984, "machine": "macOS-26.5-arm64-arm-64bit-Mach-O", "max_threads_per_threadgroup": 1024, "min_ms": 500, "miss_count": 993, "operation": "jacobian_affine_scan_target_lookup_tag32", "ops_per_sec": 121827155.136391, "ops_per_sec_max": 123887745.866683, "ops_per_sec_min": 120643386.557275, "output_layout": "affine_dp_scan_target_lookup", "query_count": 1057, "reason": "", "requested_hits": 64, "runner_sample_count": 3, "sample_count": 262144, "seconds": 1.085326, "skipped": false, "state_layout": "xyzz", "status": "keep", "steps_per_sample": 512, "target_bucket_bytes": 16777216, "target_count": 1048576, "target_key": "x256_y_parity", "target_key_bytes": 41943040, "target_lookup_checksum": "0x25249bb63bf646d9", "target_table_buckets": 2097152, "target_table_bytes": 58720256, "thread_execution_width": 32, "threadgroup_limit": 128, "threads_per_threadgroup": 128, "timestamp": "2026-06-25T11:46:41Z", "validation_seconds": 3.835764, "validation_workers": 8}
{"affine_scan_mode": "cpu_batch_prod_zz_zzz", "affine_scan_seconds": 0.01709, "backend": "metal", "budget_sec": 10, "bytes_per_target": 56.0, "candidate_verification": "tag32_prefilter_then_exact_key_equality", "commit": "40b6387", "cooldown_sec": 0.0, "correctness": true, "description": "Metal XYZZ affine DP scan feeding exact tag32 multi-target lookup with a repeated real-DP query batch", "distance_tracking": "packet_distance_uint64", "dp_bits": 8, "dp_checksum": "0x9dba4a07ebbb8e14", "dp_count": 1057, "dp_distance_checksum": "0xf0dc88ed68b2ff64", "dp_query_count": 1057, "dp_tracking": "affine_x256_y_parity_cpu_batch", "experiment": "metal_jacobian_dynamic_dp_stream_xyzz_affine_scan_target_lookup_tag32_bulk1024", "gpu_ops_per_sec": 124159064.110985, "hit_count": 65536, "injected_hits": 64, "iterations": 134217728, "jump_count": 16, "jump_histogram_max_bucket": 8394316, "jump_histogram_max_deviation_ppm": 759, "jump_histogram_min_bucket": 8382245, "jump_index": "power2_mask", "jump_mixer": "avalanche64", "jump_schedule": "power2", "lookup_layout": "open_address_tag32_index_exact256", "lookup_max_threads_per_threadgroup": 1024, "lookup_repeat": 1024, "lookup_seconds": 0.003198, "lookup_thread_execution_width": 32, "lookup_threadgroup_limit": 64, "lookup_threads_per_threadgroup": 64, "lookups_per_sec": 338447087.311549, "lookups_per_sec_max": 619854011.588818, "lookups_per_sec_min": 228103021.990759, "machine": "macOS-26.5-arm64-arm-64bit-Mach-O", "max_threads_per_threadgroup": 1024, "min_ms": 500, "miss_count": 1016832, "operation": "jacobian_affine_scan_target_lookup_tag32", "ops_per_sec": 338447087.311549, "ops_per_sec_max": 619854011.588818, "ops_per_sec_min": 228103021.990759, "output_layout": "affine_dp_scan_target_lookup", "query_count": 1082368, "reason": "", "requested_hits": 64, "runner_sample_count": 3, "sample_count": 262144, "seconds": 1.081014, "skipped": false, "state_layout": "xyzz", "status": "keep", "steps_per_sample": 512, "target_bucket_bytes": 16777216, "target_count": 1048576, "target_key": "x256_y_parity", "target_key_bytes": 41943040, "target_lookup_checksum": "0x342aa518f1adaed1", "target_table_buckets": 2097152, "target_table_bytes": 58720256, "thread_execution_width": 32, "threadgroup_limit": 128, "threads_per_threadgroup": 128, "timestamp": "2026-06-25T13:19:59Z", "validation_seconds": 3.913102, "validation_workers": 8}
{"affine_scan_mode": "cpu_batch_prod_zz_zzz", "affine_scan_seconds": 0.021756, "backend": "metal", "budget_sec": 10, "bytes_per_target": 56.0, "candidate_verification": "tag32_prefilter_then_exact_key_equality", "commit": "49c539d", "cooldown_sec": 0.0, "correctness": true, "description": "Metal XYZZ affine DP scan feeding exact tag32 multi-target lookup with a distinct-miss bulk query batch", "distance_tracking": "packet_distance_uint64", "dp_bits": 8, "dp_checksum": "0x9dba4a07ebbb8e14", "dp_count": 1057, "dp_distance_checksum": "0xf0dc88ed68b2ff64", "dp_query_count": 1057, "dp_tracking": "affine_x256_y_parity_cpu_batch", "experiment": "metal_jacobian_dynamic_dp_stream_xyzz_affine_scan_target_lookup_tag32_distinct_misses1024", "gpu_ops_per_sec": 123629167.932232, "hit_count": 64, "injected_hits": 64, "iterations": 134217728, "jump_count": 16, "jump_histogram_max_bucket": 8394316, "jump_histogram_max_deviation_ppm": 759, "jump_histogram_min_bucket": 8382245, "jump_index": "power2_mask", "jump_mixer": "avalanche64", "jump_schedule": "power2", "lookup_layout": "open_address_tag32_index_exact256", "lookup_max_threads_per_threadgroup": 1024, "lookup_query_mode": "distinct_misses", "lookup_repeat": 1024, "lookup_seconds": 0.003253, "lookup_thread_execution_width": 32, "lookup_threadgroup_limit": 64, "lookup_threads_per_threadgroup": 64, "lookups_per_sec": 332746255.341113, "lookups_per_sec_max": 443464765.141918, "lookups_per_sec_min": 255305578.488029, "machine": "macOS-26.5-arm64-arm-64bit-Mach-O", "max_threads_per_threadgroup": 1024, "min_ms": 500, "miss_count": 1082304, "operation": "jacobian_affine_scan_target_lookup_tag32", "ops_per_sec": 332746255.341113, "ops_per_sec_max": 443464765.141918, "ops_per_sec_min": 255305578.488029, "output_layout": "affine_dp_scan_target_lookup", "query_count": 1082368, "reason": "", "requested_hits": 64, "runner_sample_count": 3, "sample_count": 262144, "seconds": 1.085648, "skipped": false, "state_layout": "xyzz", "status": "keep", "steps_per_sample": 512, "target_bucket_bytes": 16777216, "target_count": 1048576, "target_key": "x256_y_parity", "target_key_bytes": 41943040, "target_lookup_checksum": "0x8b2568562837af7f", "target_table_buckets": 2097152, "target_table_bytes": 58720256, "thread_execution_width": 32, "threadgroup_limit": 128, "threads_per_threadgroup": 128, "timestamp": "2026-06-25T13:56:14Z", "validation_seconds": 3.715095, "validation_workers": 8}
{"affine_scan_mode": "cpu_batch_prod_zz_zzz", "affine_scan_seconds": 0.015901, "backend": "metal", "budget_sec": 10, "bytes_per_target": 56.0, "candidate_verification": "tag32_prefilter_then_exact_key_equality", "commit": "0e045fe-dirty", "cooldown_sec": 0.0, "correctness": true, "cross_experiment_baseline": "metal_jacobian_dynamic_dp_stream_xyzz_affine_scan_target_lookup_tag32_distinct_misses1024", "cross_experiment_baseline_lookups_per_sec": 332746255.341113, "cross_experiment_speedup": 0.7968315683983864, "description": "Metal XYZZ affine DP scan feeding exact tag32 multi-target lookup with hits-only output on a distinct-miss bulk query batch", "distance_tracking": "packet_distance_uint64", "dp_bits": 8, "dp_checksum": "0x9dba4a07ebbb8e14", "dp_count": 1057, "dp_distance_checksum": "0xf0dc88ed68b2ff64", "dp_query_count": 1057, "dp_tracking": "affine_x256_y_parity_cpu_batch", "experiment": "metal_jacobian_dynamic_dp_stream_xyzz_affine_scan_target_lookup_tag32_hits_only_distinct_misses1024", "gpu_ops_per_sec": 122483576.715751, "hit_count": 64, "injected_hits": 64, "iterations": 134217728, "jump_count": 16, "jump_histogram_max_bucket": 8394316, "jump_histogram_max_deviation_ppm": 759, "jump_histogram_min_bucket": 8382245, "jump_index": "power2_mask", "jump_mixer": "avalanche64", "jump_schedule": "power2", "lookup_layout": "open_address_tag32_index_exact256", "lookup_max_threads_per_threadgroup": 1024, "lookup_output_mode": "hits_only", "lookup_query_mode": "distinct_misses", "lookup_repeat": 1024, "lookup_seconds": 0.004082, "lookup_thread_execution_width": 32, "lookup_threadgroup_limit": 64, "lookup_threads_per_threadgroup": 64, "lookups_per_sec": 265142720.522149, "lookups_per_sec_max": 272134116.001853, "lookups_per_sec_min": 215334137.876015, "machine": "macOS-26.5-arm64-arm-64bit-Mach-O", "max_threads_per_threadgroup": 1024, "min_ms": 500, "miss_count": 1082304, "operation": "jacobian_affine_scan_target_lookup_tag32", "ops_per_sec": 265142720.522149, "ops_per_sec_max": 272134116.001853, "ops_per_sec_min": 215334137.876015, "output_layout": "affine_dp_scan_target_lookup", "query_count": 1082368, "raw_status": "keep", "reason": "", "requested_hits": 64, "runner_sample_count": 3, "sample_count": 262144, "seconds": 1.095802, "skipped": false, "state_layout": "xyzz", "status": "discard", "steps_per_sample": 512, "target_bucket_bytes": 16777216, "target_count": 1048576, "target_key": "x256_y_parity", "target_key_bytes": 41943040, "target_lookup_checksum": "0xac3218a658be8cec", "target_table_buckets": 2097152, "target_table_bytes": 58720256, "thread_execution_width": 32, "threadgroup_limit": 128, "threads_per_threadgroup": 128, "timestamp": "2026-06-25T14:42:53Z", "validation_seconds": 4.055194, "validation_workers": 8}
{"backend": "metal", "budget_sec": 10, "commit": "f53621c", "cooldown_sec": 0.0, "correctness": true, "description": "Metal dynamic DP8 stream using XYZZ 512-step packets with the scaled4-balanced 4-jump schedule", "distance_tracking": "dp_stream_uint64", "dp_bits": 8, "dp_capacity": 524288, "dp_checksum": "0x564364b08c72a1da", "dp_count": 2060, "dp_distance_checksum": "0x3ea0b5a3cd958a70", "dp_stream_overflow": false, "dp_tracking": "projective_x_limb0", "emitted_records": 2060, "experiment": "metal_jacobian_dynamic_dp_stream_xyzz_scaled4_balanced", "iterations": 268435456, "jump_count": 4, "jump_histogram_max_bucket": 67116383, "jump_histogram_max_deviation_ppm": 170, "jump_histogram_min_bucket": 67097486, "jump_index": "power2_mask", "jump_mixer": "avalanche64", "jump_schedule": "scaled4_balanced", "machine": "macOS-26.5-arm64-arm-64bit-Mach-O", "max_threads_per_threadgroup": 1024, "min_ms": 500, "operation": "jacobian_affine_walk_dynamic_dp_stream_xyzz", "ops_per_sec": 117076522.598601, "ops_per_sec_max": 120401061.55884, "ops_per_sec_min": 112555382.413165, "output_bytes_per_record": 20, "output_bytes_total": 41200, "output_layout": "dp_stream", "reason": "", "runner_sample_count": 3, "sample_count": 524288, "seconds": 2.292821, "skipped": false, "state_layout": "xyzz", "status": "discard", "steps_per_sample": 512, "thread_execution_width": 32, "threadgroup_limit": 128, "threads_per_threadgroup": 128, "timestamp": "2026-06-25T19:55:01Z", "validation_seconds": 8.861612, "validation_workers": 8}
{"backend": "metal", "budget_sec": 10, "command_buffer_count": 2, "commit": "2cc50c2", "cooldown_sec": 10.0, "correctness": true, "description": "Metal XYZZ 512-step DP stream with persistent chained rounds, reused pipeline/buffers, and cumulative uint64 distances", "distance_tracking": "dp_stream_cumulative_uint64", "dp_bits": 8, "dp_capacity": 1048576, "dp_checksum": "0x950a1186dae66384", "dp_count": 4037, "dp_distance_checksum": "0x30e91a5edffed133", "dp_stream_overflow": false, "dp_tracking": "projective_x_limb0", "emitted_records": 4037, "experiment": "metal_jacobian_dynamic_dp_stream_xyzz_persistent_chain_steps512", "iterations": 536870912, "jump_count": 16, "jump_histogram_max_bucket": 33562777, "jump_histogram_max_deviation_ppm": 249, "jump_histogram_min_bucket": 33546500, "jump_index": "power2_mask", "jump_mixer": "avalanche64", "jump_schedule": "power2", "machine": "macOS-26.5-arm64-arm-64bit-Mach-O", "max_threads_per_threadgroup": 1024, "min_ms": 0, "operation": "jacobian_affine_walk_dynamic_dp_stream_xyzz_persistent_chain", "ops_per_sec": 124755147.554164, "ops_per_sec_max": 125359992.06916, "ops_per_sec_min": 119801503.881543, "output_bytes_per_record": 20, "output_bytes_total": 80740, "output_layout": "dp_stream", "packet_count": 4, "packets_per_round": 2, "reason": "", "round_count": 2, "runner_sample_count": 3, "sample_count": 262144, "seconds": 4.303397, "setup_mode": "reuse_pipeline_buffers", "skipped": false, "state_layout": "xyzz", "state_persistence": "round_cumulative_xyzz", "status": "keep", "steps_per_sample": 512, "stream_indexing": "round_packet_sample_u32", "thread_execution_width": 32, "threadgroup_limit": 128, "threads_per_threadgroup": 128, "timestamp": "2026-06-25T20:15:24Z", "validation_seconds": 19.335877, "validation_workers": 8}
{"backend": "metal", "budget_sec": 10, "command_buffer_count": 2, "commit": "d6a07ff", "cooldown_sec": 10.0, "correctness": true, "description": "Metal XYZZ 512-step DP stream with persistent chained rounds, reused pipeline/buffers, and cumulative uint64 distances", "distance_tracking": "dp_stream_cumulative_uint64", "dp_bits": 8, "dp_capacity": 1048576, "dp_checksum": "0x950a1186dae66384", "dp_count": 4037, "dp_distance_checksum": "0x30e91a5edffed133", "dp_stream_overflow": false, "dp_tracking": "projective_x_limb0", "emitted_records": 4037, "experiment": "metal_jacobian_dynamic_dp_stream_xyzz_persistent_chain_steps512", "iterations": 536870912, "jump_count": 16, "jump_histogram_max_bucket": 33562777, "jump_histogram_max_deviation_ppm": 249, "jump_histogram_min_bucket": 33546500, "jump_index": "power2_mask", "jump_mixer": "avalanche64", "jump_schedule": "power2", "machine": "macOS-26.5-arm64-arm-64bit-Mach-O", "max_threads_per_threadgroup": 1024, "min_ms": 0, "operation": "jacobian_affine_walk_dynamic_dp_stream_xyzz_persistent_chain", "ops_per_sec": 74788530.47831, "ops_per_sec_max": 127072185.005949, "ops_per_sec_min": 49079928.832533, "output_bytes_per_record": 20, "output_bytes_total": 80740, "output_layout": "dp_stream", "packet_count": 4, "packets_per_round": 2, "paired_baseline_ops_per_sec": 126396922.377779, "paired_baseline_ref": "main", "paired_speedup": 0.5916958187856801, "reason": "", "round_count": 2, "runner_sample_count": 3, "sample_count": 262144, "seconds": 7.178519, "setup_mode": "reuse_pipeline_buffers", "skipped": false, "state_layout": "xyzz", "state_persistence": "round_cumulative_xyzz", "status": "discard", "steps_per_sample": 512, "stream_indexing": "round_packet_sample_u32", "thread_execution_width": 32, "threadgroup_limit": 128, "threads_per_threadgroup": 128, "timestamp": "2026-06-25T20:20:28Z", "validation_seconds": 22.989029, "validation_workers": 8}
{"backend": "metal", "budget_sec": 10, "commit": "d4398d9", "cooldown_sec": 10.0, "correctness": true, "description": "Metal XYZZ 512-step DP stream with four device-resident chained packets and cumulative uint64 distances", "distance_tracking": "dp_stream_cumulative_uint64", "dp_bits": 8, "dp_capacity": 1048576, "dp_checksum": "0x950a1186dae66384", "dp_count": 4037, "dp_distance_checksum": "0x30e91a5edffed133", "dp_stream_overflow": false, "dp_tracking": "projective_x_limb0", "emitted_records": 4037, "experiment": "metal_jacobian_dynamic_dp_stream_xyzz_chain_packets4_steps512", "iterations": 536870912, "jump_count": 16, "jump_histogram_max_bucket": 33562777, "jump_histogram_max_deviation_ppm": 249, "jump_histogram_min_bucket": 33546500, "jump_index": "power2_mask", "jump_mixer": "avalanche64", "jump_schedule": "power2", "machine": "macOS-26.5-arm64-arm-64bit-Mach-O", "max_threads_per_threadgroup": 1024, "min_ms": 0, "operation": "jacobian_affine_walk_dynamic_dp_stream_xyzz_chain", "ops_per_sec": 92484157.517172, "ops_per_sec_max": 106583611.782554, "ops_per_sec_min": 86210119.607566, "output_bytes_per_record": 20, "output_bytes_total": 80740, "output_layout": "dp_stream", "packet_count": 4, "reason": "", "runner_sample_count": 3, "sample_count": 262144, "seconds": 5.805004, "skipped": false, "state_layout": "xyzz", "status": "keep", "steps_per_sample": 512, "stream_indexing": "packet_sample_u32", "thread_execution_width": 32, "threadgroup_limit": 128, "threads_per_threadgroup": 128, "timestamp": "2026-06-25T20:28:19Z", "validation_seconds": 21.098584, "validation_workers": 8}
{"affine_scan_mode": "cpu_batch_prod_zz_zzz", "affine_scan_seconds": 0.016012, "backend": "metal", "budget_sec": 10, "bytes_per_target": 56.0, "candidate_verification": "tag32_prefilter_then_exact_key_equality", "commit": "c916f3a", "cooldown_sec": 0.0, "correctness": true, "description": "Metal XYZZ affine DP scan feeding exact tag32 target lookup with a 512-thread lookup-only threadgroup cap", "distance_tracking": "packet_distance_uint64", "dp_bits": 8, "dp_checksum": "0x9dba4a07ebbb8e14", "dp_count": 1057, "dp_distance_checksum": "0xf0dc88ed68b2ff64", "dp_query_count": 1057, "dp_tracking": "affine_x256_y_parity_cpu_batch", "experiment": "metal_jacobian_dynamic_dp_stream_xyzz_affine_scan_target_lookup_tag32_lookup_tg512", "gpu_ops_per_sec": 123844645.056748, "hit_count": 64, "injected_hits": 64, "iterations": 134217728, "jump_count": 16, "jump_histogram_max_bucket": 8394316, "jump_histogram_max_deviation_ppm": 759, "jump_histogram_min_bucket": 8382245, "jump_index": "power2_mask", "jump_mixer": "avalanche64", "jump_schedule": "power2", "lookup_engine": "gpu", "lookup_engine_effective": "gpu", "lookup_layout": "open_address_tag32_index_exact256", "lookup_max_threads_per_threadgroup": 1024, "lookup_query_mode": "distinct_misses", "lookup_repeat": 1024, "lookup_seconds": 0.004105, "lookup_thread_execution_width": 32, "lookup_threadgroup_limit": 512, "lookup_threads_per_threadgroup": 512, "lookups_per_sec": 263692100.648384, "lookups_per_sec_max": 294625404.461812, "lookups_per_sec_min": 236813978.914094, "machine": "macOS-26.5-arm64-arm-64bit-Mach-O", "max_threads_per_threadgroup": 1024, "min_ms": 500, "miss_count": 1082304, "operation": "jacobian_affine_scan_target_lookup_tag32", "ops_per_sec": 263692100.648384, "ops_per_sec_max": 294625404.461812, "ops_per_sec_min": 236813978.914094, "output_layout": "affine_dp_scan_target_lookup", "query_count": 1082368, "reason": "", "requested_hits": 64, "runner_sample_count": 3, "sample_count": 262144, "seconds": 1.083759, "skipped": false, "state_layout": "xyzz", "status": "keep", "steps_per_sample": 512, "target_bucket_bytes": 16777216, "target_count": 1048576, "target_key": "x256_y_parity", "target_key_bytes": 41943040, "target_lookup_checksum": "0x8b2568562837af7f", "target_table_buckets": 2097152, "target_table_bytes": 58720256, "thread_execution_width": 32, "threadgroup_limit": 128, "threads_per_threadgroup": 128, "timestamp": "2026-06-26T16:06:55Z", "validation_seconds": 4.157493, "validation_workers": 8}
