{"affine_scan_mode": "cpu_batch_prod_zz_zzz", "affine_scan_seconds": 0.002448, "backend": "metal", "budget_sec": 240, "bytes_per_target": 4.0, "candidate_verification": "tag16_hash_filter_then_cpu_exact_key_equality", "commit": "56f4646-dirty", "confirmation_index": 2, "confirmation_runs": 2, "confirmation_status": "discard", "cooldown_sec": 3.0, "correctness": true, "description": "Medium fixed-round 1M target lookup with physical distinct-miss queries; fast falsifier for setup-inclusive wall-clock kangaroo distance/sec", "distance_per_sec": 500163906030.8632, "distance_tracking": "packet_distance_uint64", "distinct_miss_source_seconds": 4e-06, "dp_bits": 6, "dp_checksum": "0xbd17120591af6f74", "dp_count": 1053, "dp_distance_checksum": "0x9eca239fc5687305", "dp_normalization": "host_batch_affine", "dp_query_count": 1053, "dp_sampling": "packet_endpoint", "dp_tracking": "affine_x256_y_parity_cpu_batch", "exact_host_table_bytes": 16779264, "experiment": "metal_jacobian_dynamic_dp_stream_xyzz_affine_scan_target_lookup_tag16_hash_filter1m_rounds_distinct_misses_distance", "filter_false_positive_count": 28, "filter_positive_count": 92, "gpu_distance_per_sec": 503543376253.4773, "gpu_lookup_lookups_per_sec": 219696821.515892, "gpu_ops_per_sec": 122937270.467012, "hit_count": 64, "injected_hits": 64, "iterations": 134217728, "jump_count": 16, "jump_histogram_max_bucket": 8393138, "jump_histogram_max_deviation_ppm": 707, "jump_histogram_min_bucket": 8382675, "jump_index": "power2_mask", "jump_mixer": "avalanche64", "jump_schedule": "power2", "lookup_buffer_seconds": 0.000912, "lookup_engine": "gpu_filter16_hash", "lookup_engine_effective": "gpu_filter16_hash", "lookup_exact_seconds": 2e-05, "lookup_gpu_seconds": 0.004908, "lookup_hash_seconds": 0.0, "lookup_layout": "open_address_tag16_hash_filter_exact256", "lookup_max_threads_per_threadgroup": 1024, "lookup_query_mode": "distinct_misses", "lookup_repeat": 1024, "lookup_seconds": 0.004928, "lookup_thread_execution_width": 32, "lookup_threadgroup_limit": 512, "lookup_threads_per_threadgroup": 512, "lookup_wall_seconds": 0.005841, "lookups_per_sec": 218786681.402974, "machine": "macOS-26.5-arm64-arm-64bit-Mach-O", "max_sample_spread_ratio": 1.5, "max_threads_per_threadgroup": 1024, "mean_jump_distance": 4095.9375, "min_ms": 0, "miss_count": 1078208, "operation": "jacobian_affine_scan_target_lookup_tag32_rounds", "ops_per_sec": 463031178204.48444, "ops_per_sec_max": 465414494362.73663, "ops_per_sec_min": 461351369368.6518, "output_layout": "affine_dp_scan_target_lookup", "paired_baseline_ops_per_sec": 463415900839.4676, "paired_baseline_ref": "HEAD", "paired_order": "alternate", "paired_speedup": 0.9991698113200557, "physical_filter_positive_count": 92, "physical_query_count": 1078272, "query_count": 1078272, "query_input": "hash64_prefix_gpu_miss", "raw_status": "discard", "reason": "", "repeat_positive_index_encoding": "physical_query_index", "requested_hits": 32, "round_count": 2, "round_sample_build_seconds": 0.000621, "runner_sample_count": 3, "sample_count": 32768, "sample_metric": "setup_inclusive_wall_distance_per_sec", "sample_metric_values": [465414494362.73663, 463031178204.48444, 461351369368.6518], "sample_spread_ratio": 1.0088070075518474, "seconds": 1.091758, "setup_inclusive_distance_per_sec": 484204602710.1212, "setup_inclusive_ops_per_sec": 118215818.163759, "setup_inclusive_seconds": 1.135362, "setup_inclusive_wall_distance_per_sec": 463031178204.48444, "setup_inclusive_wall_distance_per_sec_max": 465414494362.73663, "setup_inclusive_wall_distance_per_sec_min": 461351369368.6518, "setup_inclusive_wall_ops_per_sec": 113046446.193206, "setup_inclusive_wall_seconds": 1.187279, "skipped": false, "state_layout": "xyzz", "status": "discard", "steps_per_sample": 2048, "target_bucket_bytes": 16777216, "target_build_seconds": 0.035602, "target_count": 1048576, "target_filter_bucket_bytes": 4194304, "target_filter_build_seconds": 0.0, "target_key": "x256_y_parity", "target_key_bytes": 2048, "target_lookup_checksum": "0xcb38405cd10f441d", "target_lookup_scope": "packet_endpoint_dp_keys", "target_query_hash_bytes": 8424, "target_setup_workers": 8, "target_table_buckets": 2097152, "target_table_bytes": 4194304, "thread_execution_width": 32, "threadgroup_limit": 128, "threads_per_threadgroup": 128, "timestamp": "2026-07-07T17:19:07Z", "validation_seconds": 3.773819, "validation_workers": 8, "walk_buffer_seconds": 0.051006, "walk_round_mode": "independent", "walk_wall_seconds": 1.142763}
{"affine_scan_mode": "cpu_batch_prod_zz_zzz", "affine_scan_seconds": 0.004367, "backend": "metal", "budget_sec": 240, "bytes_per_target": 2.0, "candidate_verification": "bloom64_hash_filter_then_cpu_exact_key_equality", "commit": "858355f-dirty", "confirmation_index": 1, "confirmation_runs": 2, "confirmation_status": "discard", "cooldown_sec": 3.0, "correctness": true, "description": "Medium fixed-round 1M physical distinct-miss A/B for Bloom64 hash filtering versus tag16; scores setup-inclusive wall-clock kangaroo distance/sec", "distance_per_sec": 497770593259.7607, "distance_tracking": "packet_distance_uint64", "distinct_miss_source_seconds": 4e-06, "dp_bits": 6, "dp_checksum": "0xbd17120591af6f74", "dp_count": 1053, "dp_distance_checksum": "0x9eca239fc5687305", "dp_normalization": "host_batch_affine", "dp_query_count": 1053, "dp_sampling": "packet_endpoint", "dp_tracking": "affine_x256_y_parity_cpu_batch", "exact_host_table_bytes": 16779264, "experiment": "metal_jacobian_dynamic_dp_stream_xyzz_affine_scan_target_lookup_bloom64_hash_filter1m_rounds_distinct_misses_distance", "filter_false_positive_count": 10075, "filter_positive_count": 10139, "gpu_distance_per_sec": 501543056354.7501, "gpu_lookup_lookups_per_sec": 371343124.033133, "gpu_ops_per_sec": 122448903.664851, "hit_count": 64, "injected_hits": 64, "iterations": 134217728, "jump_count": 16, "jump_histogram_max_bucket": 8393138, "jump_histogram_max_deviation_ppm": 707, "jump_histogram_min_bucket": 8382675, "jump_index": "power2_mask", "jump_mixer": "avalanche64", "jump_schedule": "power2", "lookup_buffer_seconds": 0.00095, "lookup_engine": "gpu_filter_bloom64_hash", "lookup_engine_effective": "gpu_filter_bloom64_hash", "lookup_exact_seconds": 0.001036, "lookup_gpu_seconds": 0.002904, "lookup_hash_seconds": 0.0, "lookup_layout": "blocked_bloom64_hash_filter_exact256", "lookup_max_threads_per_threadgroup": 1024, "lookup_query_mode": "distinct_misses", "lookup_repeat": 1024, "lookup_seconds": 0.00394, "lookup_thread_execution_width": 32, "lookup_threadgroup_limit": 512, "lookup_threads_per_threadgroup": 512, "lookup_wall_seconds": 0.00489, "lookups_per_sec": 273658649.492616, "machine": "macOS-26.5-arm64-arm-64bit-Mach-O", "max_sample_spread_ratio": 1.5, "max_threads_per_threadgroup": 1024, "mean_jump_distance": 4095.9375, "min_ms": 0, "miss_count": 1078208, "operation": "jacobian_affine_scan_target_lookup_tag32_rounds", "ops_per_sec": 459491148585.17725, "ops_per_sec_max": 466009828815.94025, "ops_per_sec_min": 404309969074.38983, "output_layout": "affine_dp_scan_target_lookup", "paired_baseline_ops_per_sec": 468383826713.7865, "paired_baseline_ref": "HEAD", "paired_order": "alternate", "paired_speedup": 0.9810141221335482, "physical_filter_positive_count": 10139, "physical_query_count": 1078272, "query_count": 1078272, "query_input": "hash64_prefix_gpu_miss", "raw_status": "discard", "reason": "", "repeat_positive_index_encoding": "physical_query_index", "requested_hits": 32, "round_count": 2, "round_sample_build_seconds": 0.001469, "runner_sample_count": 3, "sample_count": 32768, "sample_metric": "setup_inclusive_wall_distance_per_sec", "sample_metric_values": [404309969074.38983, 459491148585.17725, 466009828815.94025], "sample_spread_ratio": 1.152605338628685, "seconds": 1.096112, "setup_inclusive_distance_per_sec": 480558110241.72687, "setup_inclusive_ops_per_sec": 117325547.629017, "setup_inclusive_seconds": 1.143977, "setup_inclusive_wall_distance_per_sec": 459491148585.17725, "setup_inclusive_wall_distance_per_sec_max": 466009828815.94025, "setup_inclusive_wall_distance_per_sec_min": 404309969074.38983, "setup_inclusive_wall_ops_per_sec": 112182167.961591, "setup_inclusive_wall_seconds": 1.196427, "skipped": false, "state_layout": "xyzz", "status": "discard", "steps_per_sample": 2048, "target_bucket_bytes": 16777216, "target_build_seconds": 0.038085, "target_count": 1048576, "target_filter_bucket_bytes": 2097152, "target_filter_build_seconds": 0.0, "target_key": "x256_y_parity", "target_key_bytes": 2048, "target_lookup_checksum": "0xcb38405cd10f441d", "target_lookup_scope": "packet_endpoint_dp_keys", "target_query_hash_bytes": 8424, "target_setup_workers": 8, "target_table_buckets": 2097152, "target_table_bytes": 2097152, "thread_execution_width": 32, "threadgroup_limit": 128, "threads_per_threadgroup": 128, "timestamp": "2026-07-07T17:24:52Z", "validation_seconds": 3.618516, "validation_workers": 8, "walk_buffer_seconds": 0.0515, "walk_round_mode": "independent", "walk_wall_seconds": 1.147612}
{"affine_scan_mode": "cpu_batch_prod_zz_zzz", "affine_scan_seconds": 0.003448, "backend": "metal", "budget_sec": 240, "bytes_per_target": 2.0, "candidate_verification": "bloom64_hash_filter_then_cpu_exact_key_equality", "commit": "858355f-dirty", "confirmation_index": 2, "confirmation_runs": 2, "confirmation_status": "discard", "cooldown_sec": 3.0, "correctness": true, "description": "Medium fixed-round 1M physical distinct-miss A/B for Bloom64 hash filtering versus tag16; scores setup-inclusive wall-clock kangaroo distance/sec", "distance_per_sec": 496976437495.0093, "distance_tracking": "packet_distance_uint64", "distinct_miss_source_seconds": 4e-06, "dp_bits": 6, "dp_checksum": "0xbd17120591af6f74", "dp_count": 1053, "dp_distance_checksum": "0x9eca239fc5687305", "dp_normalization": "host_batch_affine", "dp_query_count": 1053, "dp_sampling": "packet_endpoint", "dp_tracking": "affine_x256_y_parity_cpu_batch", "exact_host_table_bytes": 16779264, "experiment": "metal_jacobian_dynamic_dp_stream_xyzz_affine_scan_target_lookup_bloom64_hash_filter1m_rounds_distinct_misses_distance", "filter_false_positive_count": 10075, "filter_positive_count": 10139, "gpu_distance_per_sec": 500062146513.75946, "gpu_lookup_lookups_per_sec": 395732452.51858, "gpu_ops_per_sec": 122087347.8938, "hit_count": 64, "injected_hits": 64, "iterations": 134217728, "jump_count": 16, "jump_histogram_max_bucket": 8393138, "jump_histogram_max_deviation_ppm": 707, "jump_histogram_min_bucket": 8382675, "jump_index": "power2_mask", "jump_mixer": "avalanche64", "jump_schedule": "power2", "lookup_buffer_seconds": 0.002289, "lookup_engine": "gpu_filter_bloom64_hash", "lookup_engine_effective": "gpu_filter_bloom64_hash", "lookup_exact_seconds": 0.000653, "lookup_gpu_seconds": 0.002725, "lookup_hash_seconds": 0.0, "lookup_layout": "blocked_bloom64_hash_filter_exact256", "lookup_max_threads_per_threadgroup": 1024, "lookup_query_mode": "distinct_misses", "lookup_repeat": 1024, "lookup_seconds": 0.003377, "lookup_thread_execution_width": 32, "lookup_threadgroup_limit": 512, "lookup_threads_per_threadgroup": 512, "lookup_wall_seconds": 0.005666, "lookups_per_sec": 319259362.99841, "machine": "macOS-26.5-arm64-arm-64bit-Mach-O", "max_sample_spread_ratio": 1.5, "max_threads_per_threadgroup": 1024, "mean_jump_distance": 4095.9375, "min_ms": 0, "miss_count": 1078208, "operation": "jacobian_affine_scan_target_lookup_tag32_rounds", "ops_per_sec": 467648911837.2607, "ops_per_sec_max": 471285835987.33234, "ops_per_sec_min": 454909941861.7572, "output_layout": "affine_dp_scan_target_lookup", "paired_baseline_ops_per_sec": 464426050563.57446, "paired_baseline_ref": "HEAD", "paired_order": "alternate", "paired_speedup": 1.0069394498215063, "physical_filter_positive_count": 10139, "physical_query_count": 1078272, "query_count": 1078272, "query_input": "hash64_prefix_gpu_miss", "raw_status": "discard", "reason": "", "repeat_positive_index_encoding": "physical_query_index", "requested_hits": 32, "round_count": 2, "round_sample_build_seconds": 0.000639, "runner_sample_count": 3, "sample_count": 32768, "sample_metric": "setup_inclusive_wall_distance_per_sec", "sample_metric_values": [471285835987.33234, 454909941861.7572, 467648911837.2607], "sample_spread_ratio": 1.035998101203406, "seconds": 1.099358, "setup_inclusive_distance_per_sec": 481091323643.5699, "setup_inclusive_ops_per_sec": 117455728.668606, "setup_inclusive_seconds": 1.142709, "setup_inclusive_wall_distance_per_sec": 467648911837.2607, "setup_inclusive_wall_distance_per_sec_max": 471285835987.33234, "setup_inclusive_wall_distance_per_sec_min": 454909941861.7572, "setup_inclusive_wall_ops_per_sec": 114173839.771056, "setup_inclusive_wall_seconds": 1.175556, "skipped": false, "state_layout": "xyzz", "status": "discard", "steps_per_sample": 2048, "target_bucket_bytes": 16777216, "target_build_seconds": 0.035882, "target_count": 1048576, "target_filter_bucket_bytes": 2097152, "target_filter_build_seconds": 0.0, "target_key": "x256_y_parity", "target_key_bytes": 2048, "target_lookup_checksum": "0xcb38405cd10f441d", "target_lookup_scope": "packet_endpoint_dp_keys", "target_query_hash_bytes": 8424, "target_setup_workers": 8, "target_table_buckets": 2097152, "target_table_bytes": 2097152, "thread_execution_width": 32, "threadgroup_limit": 128, "threads_per_threadgroup": 128, "timestamp": "2026-07-07T17:24:52Z", "validation_seconds": 4.14535, "validation_workers": 8, "walk_buffer_seconds": 0.030558, "walk_round_mode": "independent", "walk_wall_seconds": 1.129916}
{"affine_scan_mode": "cpu_batch_prod_zz_zzz", "affine_scan_seconds": 0.004195, "backend": "metal", "budget_sec": 240, "bytes_per_target": 2.0, "candidate_verification": "bloom64_hash_filter_then_cpu_exact_key_equality", "commit": "60873d8-dirty", "confirmation_index": 1, "confirmation_runs": 2, "confirmation_status": "discard", "cooldown_sec": 3.0, "correctness": true, "description": "Medium fixed-round 1M physical distinct-miss A/B for Bloom64 hash filtering versus tag16; scores setup-inclusive wall-clock kangaroo distance/sec", "distance_per_sec": 499026572088.02686, "distance_tracking": "packet_distance_uint64", "distinct_miss_source_seconds": 9e-06, "dp_bits": 6, "dp_checksum": "0xbd17120591af6f74", "dp_count": 1053, "dp_distance_checksum": "0x9eca239fc5687305", "dp_normalization": "host_batch_affine", "dp_query_count": 1053, "dp_sampling": "packet_endpoint", "dp_tracking": "affine_x256_y_parity_cpu_batch", "exact_host_table_bytes": 16779264, "experiment": "metal_jacobian_dynamic_dp_stream_xyzz_affine_scan_target_lookup_bloom64_hash_filter1m_rounds_distinct_misses_distance", "filter_false_positive_count": 5749, "filter_positive_count": 5813, "gpu_distance_per_sec": 502319333926.8712, "gpu_lookup_lookups_per_sec": 411168296.625419, "gpu_ops_per_sec": 122638427.448385, "hit_count": 64, "injected_hits": 64, "iterations": 134217728, "jump_count": 16, "jump_histogram_max_bucket": 8393138, "jump_histogram_max_deviation_ppm": 707, "jump_histogram_min_bucket": 8382675, "jump_index": "power2_mask", "jump_mixer": "avalanche64", "jump_schedule": "power2", "lookup_buffer_seconds": 0.000969, "lookup_engine": "gpu_filter_bloom64_hash", "lookup_engine_effective": "gpu_filter_bloom64_hash", "lookup_exact_seconds": 0.000404, "lookup_gpu_seconds": 0.002622, "lookup_hash_seconds": 0.0, "lookup_layout": "blocked_bloom64_hash_filter_exact256", "lookup_max_threads_per_threadgroup": 1024, "lookup_query_mode": "distinct_misses", "lookup_repeat": 1024, "lookup_seconds": 0.003027, "lookup_thread_execution_width": 32, "lookup_threadgroup_limit": 512, "lookup_threads_per_threadgroup": 512, "lookup_wall_seconds": 0.003996, "lookups_per_sec": 356232630.606606, "machine": "macOS-26.5-arm64-arm-64bit-Mach-O", "max_sample_spread_ratio": 1.5, "max_threads_per_threadgroup": 1024, "mean_jump_distance": 4095.9375, "min_ms": 0, "miss_count": 1078208, "operation": "jacobian_affine_scan_target_lookup_tag32_rounds", "ops_per_sec": 461315284181.5275, "ops_per_sec_max": 470839510770.93646, "ops_per_sec_min": 451393934794.2244, "output_layout": "affine_dp_scan_target_lookup", "paired_baseline_ops_per_sec": 468635337352.1353, "paired_baseline_ref": "HEAD", "paired_order": "alternate", "paired_speedup": 0.9843800657202522, "physical_filter_positive_count": 5813, "physical_query_count": 1078272, "query_count": 1078272, "query_input": "hash64_prefix_gpu_miss", "raw_status": "discard", "reason": "", "repeat_positive_index_encoding": "physical_query_index", "requested_hits": 32, "round_count": 2, "round_sample_build_seconds": 0.002166, "runner_sample_count": 3, "sample_count": 32768, "sample_metric": "setup_inclusive_wall_distance_per_sec", "sample_metric_values": [451393934794.2244, 461315284181.5275, 470839510770.93646], "sample_spread_ratio": 1.0430789482928622, "seconds": 1.094418, "setup_inclusive_distance_per_sec": 482088776251.45496, "setup_inclusive_ops_per_sec": 117699251.087561, "setup_inclusive_seconds": 1.140345, "setup_inclusive_wall_distance_per_sec": 461315284181.5275, "setup_inclusive_wall_distance_per_sec_max": 470839510770.93646, "setup_inclusive_wall_distance_per_sec_min": 451393934794.2244, "setup_inclusive_wall_ops_per_sec": 112627520.361707, "setup_inclusive_wall_seconds": 1.191696, "skipped": false, "state_layout": "xyzz", "status": "discard", "steps_per_sample": 2048, "target_bucket_bytes": 16777216, "target_build_seconds": 0.03653, "target_count": 1048576, "target_filter_bucket_bytes": 2097152, "target_filter_build_seconds": 0.0, "target_key": "x256_y_parity", "target_key_bytes": 2048, "target_lookup_checksum": "0xcb38405cd10f441d", "target_lookup_scope": "packet_endpoint_dp_keys", "target_query_hash_bytes": 8424, "target_setup_workers": 8, "target_table_buckets": 2097152, "target_table_bytes": 2097152, "thread_execution_width": 32, "threadgroup_limit": 128, "threads_per_threadgroup": 128, "timestamp": "2026-07-07T17:33:06Z", "validation_seconds": 3.652716, "validation_workers": 8, "walk_buffer_seconds": 0.050382, "walk_round_mode": "independent", "walk_wall_seconds": 1.1448}
