{"affine_scan_mode": "cpu_batch_prod_zz_zzz", "affine_scan_seconds": 0.005441, "backend": "metal", "budget_sec": 300, "bytes_per_target": 2.683818, "candidate_verification": "tag16_hash_filter_then_cpu_exact_key_equality", "commit": "5bd36bf-dirty", "confirmation_index": 2, "confirmation_runs": 2, "confirmation_status": "keep", "cooldown_sec": 10.0, "correctness": true, "description": "Metal XYZZ affine DP scan tag16 hash-filter 25M-target repeat-mode lookup with repeat-indexed GPU hash reads", "distance_tracking": "packet_distance_uint64", "dp_bits": 8, "dp_checksum": "0x9dba4a07ebbb8e14", "dp_count": 1057, "dp_distance_checksum": "0xf0dc88ed68b2ff64", "dp_query_count": 1057, "dp_tracking": "affine_x256_y_parity_cpu_batch", "exact_host_table_bytes": 1268635456, "experiment": "metal_jacobian_dynamic_dp_stream_xyzz_affine_scan_target_lookup_tag16_hash_filter25m_repeat_indexed2048", "filter_false_positive_count": 2048, "filter_positive_count": 133120, "gpu_lookup_lookups_per_sec": 168071196.343132, "gpu_ops_per_sec": 97931970.264467, "hit_count": 131072, "injected_hits": 64, "iterations": 134217728, "jump_count": 16, "jump_histogram_max_bucket": 8394316, "jump_histogram_max_deviation_ppm": 759, "jump_histogram_min_bucket": 8382245, "jump_index": "power2_mask", "jump_mixer": "avalanche64", "jump_schedule": "power2", "lookup_engine": "gpu_filter16_hash_repeat", "lookup_engine_effective": "gpu_filter16_hash_repeat", "lookup_exact_seconds": 0.00784, "lookup_gpu_seconds": 0.01288, "lookup_hash_seconds": 5.4e-05, "lookup_layout": "open_address_tag16_hash_filter_exact256", "lookup_max_threads_per_threadgroup": 1024, "lookup_query_mode": "repeat", "lookup_repeat": 2048, "lookup_seconds": 0.020774, "lookup_thread_execution_width": 32, "lookup_threadgroup_limit": 512, "lookup_threads_per_threadgroup": 512, "lookups_per_sec": 104205982.345402, "lookups_per_sec_max": 115672104.559816, "lookups_per_sec_min": 97955547.374252, "machine": "macOS-26.5-arm64-arm-64bit-Mach-O", "max_threads_per_threadgroup": 1024, "min_ms": 500, "miss_count": 2033664, "operation": "jacobian_affine_scan_target_lookup_tag32", "ops_per_sec": 104205982.345402, "ops_per_sec_max": 115672104.559816, "ops_per_sec_min": 97955547.374252, "output_layout": "affine_dp_scan_target_lookup", "paired_baseline_ops_per_sec": 52019102.782842, "paired_baseline_ref": "HEAD", "paired_order": "alternate", "paired_speedup": 2.003225291685987, "query_count": 2164736, "query_input": "hash64_repeat_indexed", "raw_status": "keep", "reason": "", "requested_hits": 64, "runner_sample_count": 3, "sample_count": 262144, "seconds": 1.37052, "skipped": false, "state_layout": "xyzz", "status": "keep", "steps_per_sample": 512, "target_bucket_bytes": 268435456, "target_count": 25005000, "target_filter_bucket_bytes": 67108864, "target_key": "x256_y_parity", "target_key_bytes": 1000200000, "target_lookup_checksum": "0x5b746bd07e35a252", "target_query_hash_bytes": 8456, "target_table_buckets": 33554432, "target_table_bytes": 67108864, "thread_execution_width": 32, "threadgroup_limit": 128, "threads_per_threadgroup": 128, "timestamp": "2026-06-28T19:35:30Z", "validation_seconds": 3.917797, "validation_workers": 8}
{"affine_scan_mode": "cpu_batch_prod_zz_zzz", "affine_scan_seconds": 0.004608, "backend": "metal", "budget_sec": 300, "bytes_per_target": 2.683818, "candidate_verification": "tag16_hash_filter_then_cpu_exact_key_equality", "commit": "b07d402-dirty", "confirmation_index": 1, "confirmation_runs": 2, "confirmation_status": "discard", "cooldown_sec": 10.0, "correctness": true, "description": "Metal XYZZ affine DP scan tag16 hash-filter 25M-target repeat-mode lookup with 2D repeat-indexed GPU hash reads", "distance_tracking": "packet_distance_uint64", "dp_bits": 8, "dp_checksum": "0x9dba4a07ebbb8e14", "dp_count": 1057, "dp_distance_checksum": "0xf0dc88ed68b2ff64", "dp_query_count": 1057, "dp_tracking": "affine_x256_y_parity_cpu_batch", "exact_host_table_bytes": 1268635456, "experiment": "metal_jacobian_dynamic_dp_stream_xyzz_affine_scan_target_lookup_tag16_hash_filter25m_repeat_indexed2048", "filter_false_positive_count": 2048, "filter_positive_count": 133120, "gpu_lookup_lookups_per_sec": 142448864.984977, "gpu_ops_per_sec": 96771526.252028, "hit_count": 131072, "injected_hits": 64, "iterations": 134217728, "jump_count": 16, "jump_histogram_max_bucket": 8394316, "jump_histogram_max_deviation_ppm": 759, "jump_histogram_min_bucket": 8382245, "jump_index": "power2_mask", "jump_mixer": "avalanche64", "jump_schedule": "power2", "lookup_engine": "gpu_filter16_hash_repeat", "lookup_engine_effective": "gpu_filter16_hash_repeat", "lookup_exact_seconds": 0.006563, "lookup_gpu_seconds": 0.015197, "lookup_hash_seconds": 2.5e-05, "lookup_layout": "open_address_tag16_hash_filter_exact256", "lookup_max_threads_per_threadgroup": 1024, "lookup_query_mode": "repeat", "lookup_repeat": 2048, "lookup_seconds": 0.021785, "lookup_thread_execution_width": 32, "lookup_threadgroup_limit": 512, "lookup_threads_per_threadgroup": 512, "lookups_per_sec": 99367810.533474, "lookups_per_sec_max": 110094182.43778, "lookups_per_sec_min": 97717143.929809, "machine": "macOS-26.5-arm64-arm-64bit-Mach-O", "max_threads_per_threadgroup": 1024, "min_ms": 500, "miss_count": 2033664, "operation": "jacobian_affine_scan_target_lookup_tag32", "ops_per_sec": 99367810.533474, "ops_per_sec_max": 110094182.43778, "ops_per_sec_min": 97717143.929809, "output_layout": "affine_dp_scan_target_lookup", "paired_baseline_ops_per_sec": 108781840.533811, "paired_baseline_ref": "HEAD", "paired_order": "alternate", "paired_speedup": 0.9134595447719881, "query_count": 2164736, "query_input": "hash64_repeat_indexed", "raw_status": "discard", "reason": "", "requested_hits": 64, "runner_sample_count": 3, "sample_count": 262144, "seconds": 1.386955, "skipped": false, "state_layout": "xyzz", "status": "discard", "steps_per_sample": 512, "target_bucket_bytes": 268435456, "target_count": 25005000, "target_filter_bucket_bytes": 67108864, "target_key": "x256_y_parity", "target_key_bytes": 1000200000, "target_lookup_checksum": "0x5b746bd07e35a252", "target_query_hash_bytes": 8456, "target_table_buckets": 33554432, "target_table_bytes": 67108864, "thread_execution_width": 32, "threadgroup_limit": 128, "threads_per_threadgroup": 128, "timestamp": "2026-06-28T19:46:29Z", "validation_seconds": 3.65867, "validation_workers": 8}
{"affine_scan_mode": "cpu_batch_prod_zz_zzz", "affine_scan_seconds": 0.011519, "backend": "metal", "budget_sec": 300, "bytes_per_target": 2.683818, "candidate_verification": "tag16_hash_filter_then_cpu_exact_key_equality", "commit": "b07d402-dirty", "confirmation_index": 2, "confirmation_runs": 2, "confirmation_status": "discard", "cooldown_sec": 10.0, "correctness": true, "description": "Metal XYZZ affine DP scan tag16 hash-filter 25M-target repeat-mode lookup with 2D repeat-indexed GPU hash reads", "distance_tracking": "packet_distance_uint64", "dp_bits": 8, "dp_checksum": "0x9dba4a07ebbb8e14", "dp_count": 1057, "dp_distance_checksum": "0xf0dc88ed68b2ff64", "dp_query_count": 1057, "dp_tracking": "affine_x256_y_parity_cpu_batch", "exact_host_table_bytes": 1268635456, "experiment": "metal_jacobian_dynamic_dp_stream_xyzz_affine_scan_target_lookup_tag16_hash_filter25m_repeat_indexed2048", "filter_false_positive_count": 2048, "filter_positive_count": 133120, "gpu_lookup_lookups_per_sec": 74408730.772536, "gpu_ops_per_sec": 94889095.866218, "hit_count": 131072, "injected_hits": 64, "iterations": 134217728, "jump_count": 16, "jump_histogram_max_bucket": 8394316, "jump_histogram_max_deviation_ppm": 759, "jump_histogram_min_bucket": 8382245, "jump_index": "power2_mask", "jump_mixer": "avalanche64", "jump_schedule": "power2", "lookup_engine": "gpu_filter16_hash_repeat", "lookup_engine_effective": "gpu_filter16_hash_repeat", "lookup_exact_seconds": 0.000432, "lookup_gpu_seconds": 0.029093, "lookup_hash_seconds": 1.1e-05, "lookup_layout": "open_address_tag16_hash_filter_exact256", "lookup_max_threads_per_threadgroup": 1024, "lookup_query_mode": "repeat", "lookup_repeat": 2048, "lookup_seconds": 0.029536, "lookup_thread_execution_width": 32, "lookup_threadgroup_limit": 512, "lookup_threads_per_threadgroup": 512, "lookups_per_sec": 73292478.204763, "lookups_per_sec_max": 109236080.743029, "lookups_per_sec_min": 25479185.092532, "machine": "macOS-26.5-arm64-arm-64bit-Mach-O", "max_threads_per_threadgroup": 1024, "min_ms": 500, "miss_count": 2033664, "operation": "jacobian_affine_scan_target_lookup_tag32", "ops_per_sec": 73292478.204763, "ops_per_sec_max": 109236080.743029, "ops_per_sec_min": 25479185.092532, "output_layout": "affine_dp_scan_target_lookup", "paired_baseline_ops_per_sec": 56780394.048385, "paired_baseline_ref": "HEAD", "paired_order": "alternate", "paired_speedup": 1.2908060860286976, "query_count": 2164736, "query_input": "hash64_repeat_indexed", "raw_status": "keep", "reason": "", "requested_hits": 64, "runner_sample_count": 3, "sample_count": 262144, "seconds": 1.414469, "skipped": false, "state_layout": "xyzz", "status": "discard", "steps_per_sample": 512, "target_bucket_bytes": 268435456, "target_count": 25005000, "target_filter_bucket_bytes": 67108864, "target_key": "x256_y_parity", "target_key_bytes": 1000200000, "target_lookup_checksum": "0x5b746bd07e35a252", "target_query_hash_bytes": 8456, "target_table_buckets": 33554432, "target_table_bytes": 67108864, "thread_execution_width": 32, "threadgroup_limit": 128, "threads_per_threadgroup": 128, "timestamp": "2026-06-28T19:46:29Z", "validation_seconds": 4.247281, "validation_workers": 8}
{"affine_scan_mode": "cpu_batch_prod_zz_zzz", "affine_scan_seconds": 0.007505, "backend": "metal", "budget_sec": 20, "bytes_per_target": 2.683818, "candidate_verification": "tag16_hash_filter_then_cpu_exact_key_equality", "commit": "8781d6a-dirty", "confirmation_index": 1, "confirmation_runs": 2, "confirmation_status": "discard", "cooldown_sec": 10.0, "correctness": true, "description": "Metal XYZZ affine DP scan tag16 repeat-indexed lookup with lazy logical-index materialization in the positive path", "distance_tracking": "packet_distance_uint64", "dp_bits": 8, "dp_checksum": "0x9dba4a07ebbb8e14", "dp_count": 1057, "dp_distance_checksum": "0xf0dc88ed68b2ff64", "dp_query_count": 1057, "dp_tracking": "affine_x256_y_parity_cpu_batch", "exact_host_table_bytes": 1268635456, "experiment": "metal_jacobian_dynamic_dp_stream_xyzz_affine_scan_target_lookup_tag16_hash_filter25m_repeat_lazy_index2048", "filter_false_positive_count": 2048, "filter_positive_count": 133120, "gpu_lookup_lookups_per_sec": 177591430.33666, "gpu_ops_per_sec": 68768184.415804, "hit_count": 131072, "injected_hits": 64, "iterations": 134217728, "jump_count": 16, "jump_histogram_max_bucket": 8394316, "jump_histogram_max_deviation_ppm": 759, "jump_histogram_min_bucket": 8382245, "jump_index": "power2_mask", "jump_mixer": "avalanche64", "jump_schedule": "power2", "lookup_engine": "gpu_filter16_hash_repeat", "lookup_engine_effective": "gpu_filter16_hash_repeat", "lookup_exact_seconds": 0.006582, "lookup_gpu_seconds": 0.012189, "lookup_hash_seconds": 1.6e-05, "lookup_layout": "open_address_tag16_hash_filter_exact256", "lookup_max_threads_per_threadgroup": 1024, "lookup_query_mode": "repeat", "lookup_repeat": 2048, "lookup_seconds": 0.018788, "lookup_thread_execution_width": 32, "lookup_threadgroup_limit": 512, "lookup_threads_per_threadgroup": 512, "lookups_per_sec": 115218567.00335, "lookups_per_sec_max": 204937368.141275, "lookups_per_sec_min": 54814429.514898, "machine": "macOS-26.5-arm64-arm-64bit-Mach-O", "max_threads_per_threadgroup": 1024, "min_ms": 500, "miss_count": 2033664, "operation": "jacobian_affine_scan_target_lookup_tag32", "ops_per_sec": 115218567.00335, "ops_per_sec_max": 204937368.141275, "ops_per_sec_min": 54814429.514898, "output_layout": "affine_dp_scan_target_lookup", "paired_baseline_ops_per_sec": 155764888.801967, "paired_baseline_ref": "main", "paired_order": "alternate", "paired_speedup": 0.739695369665972, "query_count": 2164736, "query_input": "hash64_repeat_indexed", "raw_status": "discard", "reason": "", "requested_hits": 64, "runner_sample_count": 3, "sample_count": 262144, "seconds": 1.951742, "skipped": false, "state_layout": "xyzz", "status": "discard", "steps_per_sample": 512, "target_bucket_bytes": 268435456, "target_count": 25005000, "target_filter_bucket_bytes": 67108864, "target_key": "x256_y_parity", "target_key_bytes": 1000200000, "target_lookup_checksum": "0x5b746bd07e35a252", "target_query_hash_bytes": 8456, "target_table_buckets": 33554432, "target_table_bytes": 67108864, "thread_execution_width": 32, "threadgroup_limit": 128, "threads_per_threadgroup": 128, "timestamp": "2026-06-28T21:23:12Z", "validation_seconds": 6.516132, "validation_workers": 8}
{"affine_scan_mode": "cpu_batch_prod_zz_zzz", "affine_scan_seconds": 0.015251, "backend": "metal", "budget_sec": 20, "bytes_per_target": 2.683818, "candidate_verification": "tag16_hash_filter_then_cpu_exact_key_equality", "commit": "8781d6a-dirty", "confirmation_index": 2, "confirmation_runs": 2, "confirmation_status": "discard", "cooldown_sec": 10.0, "correctness": true, "description": "Metal XYZZ affine DP scan tag16 repeat-indexed lookup with lazy logical-index materialization in the positive path", "distance_tracking": "packet_distance_uint64", "dp_bits": 8, "dp_checksum": "0x9dba4a07ebbb8e14", "dp_count": 1057, "dp_distance_checksum": "0xf0dc88ed68b2ff64", "dp_query_count": 1057, "dp_tracking": "affine_x256_y_parity_cpu_batch", "exact_host_table_bytes": 1268635456, "experiment": "metal_jacobian_dynamic_dp_stream_xyzz_affine_scan_target_lookup_tag16_hash_filter25m_repeat_lazy_index2048", "filter_false_positive_count": 2048, "filter_positive_count": 133120, "gpu_lookup_lookups_per_sec": 106345399.219452, "gpu_ops_per_sec": 58190289.303999, "hit_count": 131072, "injected_hits": 64, "iterations": 134217728, "jump_count": 16, "jump_histogram_max_bucket": 8394316, "jump_histogram_max_deviation_ppm": 759, "jump_histogram_min_bucket": 8382245, "jump_index": "power2_mask", "jump_mixer": "avalanche64", "jump_schedule": "power2", "lookup_engine": "gpu_filter16_hash_repeat", "lookup_engine_effective": "gpu_filter16_hash_repeat", "lookup_exact_seconds": 0.003755, "lookup_gpu_seconds": 0.020356, "lookup_hash_seconds": 1.4e-05, "lookup_layout": "open_address_tag16_hash_filter_exact256", "lookup_max_threads_per_threadgroup": 1024, "lookup_query_mode": "repeat", "lookup_repeat": 2048, "lookup_seconds": 0.024124, "lookup_thread_execution_width": 32, "lookup_threadgroup_limit": 512, "lookup_threads_per_threadgroup": 512, "lookups_per_sec": 89733396.716742, "lookups_per_sec_max": 102308043.749324, "lookups_per_sec_min": 65752728.95713, "machine": "macOS-26.5-arm64-arm-64bit-Mach-O", "max_threads_per_threadgroup": 1024, "min_ms": 500, "miss_count": 2033664, "operation": "jacobian_affine_scan_target_lookup_tag32", "ops_per_sec": 89733396.716742, "ops_per_sec_max": 102308043.749324, "ops_per_sec_min": 65752728.95713, "output_layout": "affine_dp_scan_target_lookup", "paired_baseline_ops_per_sec": 79942366.526497, "paired_baseline_ref": "main", "paired_order": "alternate", "paired_speedup": 1.122476111424594, "query_count": 2164736, "query_input": "hash64_repeat_indexed", "raw_status": "keep", "reason": "", "requested_hits": 64, "runner_sample_count": 3, "sample_count": 262144, "seconds": 2.306531, "skipped": false, "state_layout": "xyzz", "status": "discard", "steps_per_sample": 512, "target_bucket_bytes": 268435456, "target_count": 25005000, "target_filter_bucket_bytes": 67108864, "target_key": "x256_y_parity", "target_key_bytes": 1000200000, "target_lookup_checksum": "0x5b746bd07e35a252", "target_query_hash_bytes": 8456, "target_table_buckets": 33554432, "target_table_bytes": 67108864, "thread_execution_width": 32, "threadgroup_limit": 128, "threads_per_threadgroup": 128, "timestamp": "2026-06-28T21:23:12Z", "validation_seconds": 7.901981, "validation_workers": 8}
{"affine_scan_mode": "cpu_batch_prod_zz_zzz", "affine_scan_seconds": 0.007436, "backend": "metal", "budget_sec": 20, "bytes_per_target": 2.683818, "candidate_verification": "tag16_hash_filter_then_cpu_exact_key_equality", "commit": "f15e34d-dirty", "confirmation_index": 1, "confirmation_runs": 2, "confirmation_status": "discard", "cooldown_sec": 10.0, "correctness": true, "description": "Metal XYZZ affine DP scan tag16 repeat-indexed lookup with exact-grid bounds removed from the repeat 2D kernel", "distance_tracking": "packet_distance_uint64", "dp_bits": 8, "dp_checksum": "0x9dba4a07ebbb8e14", "dp_count": 1057, "dp_distance_checksum": "0xf0dc88ed68b2ff64", "dp_query_count": 1057, "dp_tracking": "affine_x256_y_parity_cpu_batch", "exact_host_table_bytes": 1268635456, "experiment": "metal_jacobian_dynamic_dp_stream_xyzz_affine_scan_target_lookup_tag16_hash_filter25m_repeat_nobounds2048", "filter_false_positive_count": 2048, "filter_positive_count": 133120, "gpu_lookup_lookups_per_sec": 49686232.767648, "gpu_ops_per_sec": 69716085.820415, "hit_count": 131072, "injected_hits": 64, "iterations": 134217728, "jump_count": 16, "jump_histogram_max_bucket": 8394316, "jump_histogram_max_deviation_ppm": 759, "jump_histogram_min_bucket": 8382245, "jump_index": "power2_mask", "jump_mixer": "avalanche64", "jump_schedule": "power2", "lookup_engine": "gpu_filter16_hash_repeat", "lookup_engine_effective": "gpu_filter16_hash_repeat", "lookup_exact_seconds": 0.001185, "lookup_gpu_seconds": 0.043568, "lookup_hash_seconds": 5e-06, "lookup_layout": "open_address_tag16_hash_filter_exact256", "lookup_max_threads_per_threadgroup": 1024, "lookup_query_mode": "repeat", "lookup_repeat": 2048, "lookup_seconds": 0.044758, "lookup_thread_execution_width": 32, "lookup_threadgroup_limit": 512, "lookup_threads_per_threadgroup": 512, "lookups_per_sec": 48365567.273739, "lookups_per_sec_max": 76358988.014551, "lookups_per_sec_min": 47182392.496139, "machine": "macOS-26.5-arm64-arm-64bit-Mach-O", "max_threads_per_threadgroup": 1024, "min_ms": 500, "miss_count": 2033664, "operation": "jacobian_affine_scan_target_lookup_tag32", "ops_per_sec": 48365567.273739, "ops_per_sec_max": 76358988.014551, "ops_per_sec_min": 47182392.496139, "output_layout": "affine_dp_scan_target_lookup", "paired_baseline_ops_per_sec": 119687116.861217, "paired_baseline_ref": "main", "paired_order": "alternate", "paired_speedup": 0.4041000279906585, "query_count": 2164736, "query_input": "hash64_repeat_indexed", "raw_status": "discard", "reason": "", "requested_hits": 64, "runner_sample_count": 3, "sample_count": 262144, "seconds": 1.925205, "skipped": false, "state_layout": "xyzz", "status": "discard", "steps_per_sample": 512, "target_bucket_bytes": 268435456, "target_count": 25005000, "target_filter_bucket_bytes": 67108864, "target_key": "x256_y_parity", "target_key_bytes": 1000200000, "target_lookup_checksum": "0x5b746bd07e35a252", "target_query_hash_bytes": 8456, "target_table_buckets": 33554432, "target_table_bytes": 67108864, "thread_execution_width": 32, "threadgroup_limit": 128, "threads_per_threadgroup": 128, "timestamp": "2026-06-28T21:34:25Z", "validation_seconds": 6.027699, "validation_workers": 8}
