{"affine_scan_mode": "cpu_batch_prod_zz_zzz", "affine_scan_seconds": 0.001833, "backend": "metal", "budget_sec": 180, "bytes_per_target": 4.0, "candidate_verification": "tag16_hash_filter_then_cpu_exact_key_equality", "commit": "a5cb61a-dirty", "confirmation_index": 2, "confirmation_runs": 2, "confirmation_status": "discard", "cooldown_sec": 5.0, "correctness": true, "description": "M3 auto repeat-indexed tag16 hash filter default 768-thread lookup cap versus previous auto default", "distance_tracking": "packet_distance_uint64", "dp_bits": 6, "dp_checksum": "0xbeb579944293c04a", "dp_count": 125, "dp_distance_checksum": "0xe3db79a4e83bd59d", "dp_query_count": 125, "dp_tracking": "affine_x256_y_parity_cpu_batch", "exact_host_table_bytes": 939524096, "experiment": "metal_jacobian_dynamic_dp_stream_xyzz_affine_scan_target_lookup_tag16_hash_filter_m3_auto_tg768_default", "filter_false_positive_count": 0, "filter_positive_count": 2097152, "gpu_lookup_lookups_per_sec": 576424437.525287, "gpu_ops_per_sec": 45753599.978183, "hit_count": 2097152, "injected_hits": 16, "iterations": 8388608, "jump_count": 16, "jump_histogram_max_bucket": 262877, "jump_histogram_max_deviation_ppm": 3475, "jump_histogram_min_bucket": 261233, "jump_index": "power2_mask", "jump_mixer": "avalanche64", "jump_schedule": "power2", "lookup_engine": "auto", "lookup_engine_effective": "gpu_filter16_hash_repeat", "lookup_exact_seconds": 0.003211, "lookup_gpu_seconds": 0.056847, "lookup_hash_seconds": 1e-05, "lookup_layout": "open_address_tag16_hash_filter_exact256", "lookup_max_threads_per_threadgroup": 1024, "lookup_query_mode": "repeat", "lookup_repeat": 131072, "lookup_seconds": 0.060069, "lookup_thread_execution_width": 32, "lookup_threadgroup_limit": 768, "lookup_threads_per_threadgroup": 768, "lookups_per_sec": 545510523.968119, "machine": "macOS-26.5-arm64-arm-64bit-Mach-O", "max_threads_per_threadgroup": 1024, "min_ms": 100, "miss_count": 14286848, "operation": "jacobian_affine_scan_target_lookup_tag32", "ops_per_sec": 34205080.912293, "ops_per_sec_max": 35735411.932767, "ops_per_sec_min": 26335316.135098, "output_layout": "affine_dp_scan_target_lookup", "paired_baseline_ops_per_sec": 40962800.191419, "paired_baseline_ref": "HEAD", "paired_order": "alternate", "paired_speedup": 0.8350278973227611, "query_count": 16384000, "query_input": "hash64_repeat_indexed", "raw_status": "discard", "reason": "", "repeat_positive_index_encoding": "base_query_index_repeated", "requested_hits": 16, "round_count": 1, "runner_sample_count": 3, "sample_count": 8192, "seconds": 0.183343, "setup_inclusive_ops_per_sec": 7492312.339865, "setup_inclusive_seconds": 1.119629, "skipped": false, "state_layout": "xyzz", "status": "discard", "steps_per_sample": 512, "target_bucket_bytes": 268435456, "target_build_seconds": 0.874384, "target_count": 16777216, "target_filter_bucket_bytes": 67108864, "target_filter_build_seconds": 0.0, "target_key": "x256_y_parity", "target_key_bytes": 671088640, "target_lookup_checksum": "0x86ec0110960785f8", "target_query_hash_bytes": 1000, "target_table_buckets": 33554432, "target_table_bytes": 67108864, "thread_execution_width": 32, "threadgroup_limit": 128, "threads_per_threadgroup": 128, "timestamp": "2026-06-30T19:51:32Z", "validation_seconds": 0.320151, "validation_workers": 8}
{"affine_scan_mode": "cpu_batch_prod_zz_zzz", "affine_scan_seconds": 0.000562, "backend": "metal", "budget_sec": 180, "bytes_per_target": 4.0, "candidate_verification": "tag16_hash_filter_then_cpu_exact_key_equality", "commit": "a5cb61a-dirty", "confirmation_index": 1, "confirmation_runs": 2, "confirmation_status": "keep", "cooldown_sec": 5.0, "correctness": true, "description": "M3 repeat-indexed tag16 hash filter GPU base-count positives versus repeated base-index positives", "distance_tracking": "packet_distance_uint64", "dp_bits": 6, "dp_checksum": "0xbeb579944293c04a", "dp_count": 125, "dp_distance_checksum": "0xe3db79a4e83bd59d", "dp_query_count": 125, "dp_tracking": "affine_x256_y_parity_cpu_batch", "exact_host_table_bytes": 939524096, "experiment": "metal_jacobian_dynamic_dp_stream_xyzz_affine_scan_target_lookup_tag16_hash_filter_m3_base_count_repeat", "filter_false_positive_count": 0, "filter_positive_count": 2097152, "gpu_lookup_lookups_per_sec": 1577505070.397271, "gpu_ops_per_sec": 81301472.056699, "hit_count": 2097152, "injected_hits": 16, "iterations": 8388608, "jump_count": 16, "jump_histogram_max_bucket": 262877, "jump_histogram_max_deviation_ppm": 3475, "jump_histogram_min_bucket": 261233, "jump_index": "power2_mask", "jump_mixer": "avalanche64", "jump_schedule": "power2", "lookup_engine": "auto", "lookup_engine_effective": "gpu_filter16_hash_repeat", "lookup_exact_seconds": 2.5e-05, "lookup_gpu_seconds": 0.020772, "lookup_hash_seconds": 7e-06, "lookup_layout": "open_address_tag16_hash_filter_exact256", "lookup_max_threads_per_threadgroup": 1024, "lookup_query_mode": "repeat", "lookup_repeat": 131072, "lookup_seconds": 0.020805, "lookup_thread_execution_width": 32, "lookup_threadgroup_limit": 512, "lookup_threads_per_threadgroup": 512, "lookups_per_sec": 1575037652.763223, "machine": "macOS-26.5-arm64-arm-64bit-Mach-O", "max_threads_per_threadgroup": 1024, "min_ms": 100, "miss_count": 14286848, "operation": "jacobian_affine_scan_target_lookup_tag32", "ops_per_sec": 67353853.133572, "ops_per_sec_max": 77135296.787026, "ops_per_sec_min": 37561884.51815, "output_layout": "affine_dp_scan_target_lookup", "paired_baseline_ops_per_sec": 53144408.728376, "paired_baseline_ref": "HEAD", "paired_order": "alternate", "paired_speedup": 1.2673742119857094, "query_count": 16384000, "query_input": "hash64_repeat_indexed", "raw_status": "keep", "reason": "", "repeat_positive_index_encoding": "base_query_count_repeated", "requested_hits": 16, "round_count": 1, "runner_sample_count": 3, "sample_count": 8192, "seconds": 0.103179, "setup_inclusive_ops_per_sec": 20808982.391127, "setup_inclusive_seconds": 0.403124, "skipped": false, "state_layout": "xyzz", "status": "keep", "steps_per_sample": 512, "target_bucket_bytes": 268435456, "target_build_seconds": 0.278579, "target_count": 16777216, "target_filter_bucket_bytes": 67108864, "target_filter_build_seconds": 0.0, "target_key": "x256_y_parity", "target_key_bytes": 671088640, "target_lookup_checksum": "0x86ec0110960785f8", "target_query_hash_bytes": 1000, "target_table_buckets": 33554432, "target_table_bytes": 67108864, "thread_execution_width": 32, "threadgroup_limit": 128, "threads_per_threadgroup": 128, "timestamp": "2026-06-30T19:58:56Z", "validation_seconds": 0.118414, "validation_workers": 8}
{"affine_scan_mode": "cpu_batch_prod_zz_zzz", "affine_scan_seconds": 0.000685, "backend": "metal", "budget_sec": 180, "bytes_per_target": 4.0, "candidate_verification": "tag16_hash_filter_then_cpu_exact_key_equality", "commit": "a5cb61a-dirty", "confirmation_index": 2, "confirmation_runs": 2, "confirmation_status": "keep", "cooldown_sec": 5.0, "correctness": true, "description": "M3 repeat-indexed tag16 hash filter GPU base-count positives versus repeated base-index positives", "distance_tracking": "packet_distance_uint64", "dp_bits": 6, "dp_checksum": "0xbeb579944293c04a", "dp_count": 125, "dp_distance_checksum": "0xe3db79a4e83bd59d", "dp_query_count": 125, "dp_tracking": "affine_x256_y_parity_cpu_batch", "exact_host_table_bytes": 939524096, "experiment": "metal_jacobian_dynamic_dp_stream_xyzz_affine_scan_target_lookup_tag16_hash_filter_m3_base_count_repeat", "filter_false_positive_count": 0, "filter_positive_count": 2097152, "gpu_lookup_lookups_per_sec": 2800544212.198657, "gpu_ops_per_sec": 80324620.470456, "hit_count": 2097152, "injected_hits": 16, "iterations": 8388608, "jump_count": 16, "jump_histogram_max_bucket": 262877, "jump_histogram_max_deviation_ppm": 3475, "jump_histogram_min_bucket": 261233, "jump_index": "power2_mask", "jump_mixer": "avalanche64", "jump_schedule": "power2", "lookup_engine": "auto", "lookup_engine_effective": "gpu_filter16_hash_repeat", "lookup_exact_seconds": 2.7e-05, "lookup_gpu_seconds": 0.011701, "lookup_hash_seconds": 6e-06, "lookup_layout": "open_address_tag16_hash_filter_exact256", "lookup_max_threads_per_threadgroup": 1024, "lookup_query_mode": "repeat", "lookup_repeat": 131072, "lookup_seconds": 0.011734, "lookup_thread_execution_width": 32, "lookup_threadgroup_limit": 512, "lookup_threads_per_threadgroup": 512, "lookups_per_sec": 2792459371.156353, "machine": "macOS-26.5-arm64-arm-64bit-Mach-O", "max_threads_per_threadgroup": 1024, "min_ms": 100, "miss_count": 14286848, "operation": "jacobian_affine_scan_target_lookup_tag32", "ops_per_sec": 71787238.321406, "ops_per_sec_max": 78453593.844731, "ops_per_sec_min": 64526222.589256, "output_layout": "affine_dp_scan_target_lookup", "paired_baseline_ops_per_sec": 69363382.005319, "paired_baseline_ref": "HEAD", "paired_order": "alternate", "paired_speedup": 1.0349443214274232, "query_count": 16384000, "query_input": "hash64_repeat_indexed", "raw_status": "keep", "reason": "", "repeat_positive_index_encoding": "base_query_count_repeated", "requested_hits": 16, "round_count": 1, "runner_sample_count": 3, "sample_count": 8192, "seconds": 0.104434, "setup_inclusive_ops_per_sec": 19809592.464486, "setup_inclusive_seconds": 0.423462, "skipped": false, "state_layout": "xyzz", "status": "keep", "steps_per_sample": 512, "target_bucket_bytes": 268435456, "target_build_seconds": 0.306608, "target_count": 16777216, "target_filter_bucket_bytes": 67108864, "target_filter_build_seconds": 0.0, "target_key": "x256_y_parity", "target_key_bytes": 671088640, "target_lookup_checksum": "0x86ec0110960785f8", "target_query_hash_bytes": 1000, "target_table_buckets": 33554432, "target_table_bytes": 67108864, "thread_execution_width": 32, "threadgroup_limit": 128, "threads_per_threadgroup": 128, "timestamp": "2026-06-30T19:58:56Z", "validation_seconds": 0.117895, "validation_workers": 8}
{"affine_scan_mode": "cpu_batch_prod_zz_zzz", "affine_scan_seconds": 0.000615, "backend": "metal", "budget_sec": 180, "bytes_per_target": 4.0, "candidate_verification": "tag16_hash_filter_then_cpu_exact_key_equality", "commit": "31518ad-dirty", "confirmation_index": 1, "confirmation_runs": 2, "confirmation_status": "discard", "cooldown_sec": 5.0, "correctness": true, "description": "M3 repeat-indexed tag16 hash filter base-count 2D threadgroup versus 1D threadgroup", "distance_tracking": "packet_distance_uint64", "dp_bits": 6, "dp_checksum": "0xbeb579944293c04a", "dp_count": 125, "dp_distance_checksum": "0xe3db79a4e83bd59d", "dp_query_count": 125, "dp_tracking": "affine_x256_y_parity_cpu_batch", "exact_host_table_bytes": 939524096, "experiment": "metal_jacobian_dynamic_dp_stream_xyzz_affine_scan_target_lookup_tag16_hash_filter_m3_base_count_tg2d", "filter_false_positive_count": 0, "filter_positive_count": 2097152, "gpu_lookup_lookups_per_sec": 2534351178.100508, "gpu_ops_per_sec": 85496694.953442, "hit_count": 2097152, "injected_hits": 16, "iterations": 8388608, "jump_count": 16, "jump_histogram_max_bucket": 262877, "jump_histogram_max_deviation_ppm": 3475, "jump_histogram_min_bucket": 261233, "jump_index": "power2_mask", "jump_mixer": "avalanche64", "jump_schedule": "power2", "lookup_engine": "auto", "lookup_engine_effective": "gpu_filter16_hash_repeat", "lookup_exact_seconds": 3.4e-05, "lookup_gpu_seconds": 0.01293, "lookup_hash_seconds": 8e-06, "lookup_layout": "open_address_tag16_hash_filter_exact256", "lookup_max_threads_per_threadgroup": 1024, "lookup_query_mode": "repeat", "lookup_repeat": 131072, "lookup_seconds": 0.012972, "lookup_thread_execution_width": 32, "lookup_threadgroup_limit": 512, "lookup_threads_per_threadgroup": 512, "lookups_per_sec": 2526145116.27491, "machine": "macOS-26.5-arm64-arm-64bit-Mach-O", "max_threads_per_threadgroup": 1024, "min_ms": 100, "miss_count": 14286848, "operation": "jacobian_affine_scan_target_lookup_tag32", "ops_per_sec": 75097791.714684, "ops_per_sec_max": 75602019.689366, "ops_per_sec_min": 69886673.076702, "output_layout": "affine_dp_scan_target_lookup", "paired_baseline_ops_per_sec": 73169519.919926, "paired_baseline_ref": "HEAD", "paired_order": "alternate", "paired_speedup": 1.0263534843042323, "query_count": 16384000, "query_input": "hash64_repeat_indexed", "raw_status": "keep", "reason": "", "repeat_positive_index_encoding": "base_query_count_repeated", "requested_hits": 16, "round_count": 1, "runner_sample_count": 3, "sample_count": 8192, "seconds": 0.098116, "setup_inclusive_ops_per_sec": 21585325.718462, "setup_inclusive_seconds": 0.388625, "skipped": false, "state_layout": "xyzz", "status": "discard", "steps_per_sample": 512, "target_bucket_bytes": 268435456, "target_build_seconds": 0.276923, "target_count": 16777216, "target_filter_bucket_bytes": 67108864, "target_filter_build_seconds": 0.0, "target_key": "x256_y_parity", "target_key_bytes": 671088640, "target_lookup_checksum": "0x86ec0110960785f8", "target_query_hash_bytes": 1000, "target_table_buckets": 33554432, "target_table_bytes": 67108864, "thread_execution_width": 32, "threadgroup_limit": 128, "threads_per_threadgroup": 128, "timestamp": "2026-06-30T20:10:57Z", "validation_seconds": 0.119162, "validation_workers": 8}
{"affine_scan_mode": "cpu_batch_prod_zz_zzz", "affine_scan_seconds": 0.000567, "backend": "metal", "budget_sec": 180, "bytes_per_target": 4.0, "candidate_verification": "tag16_hash_filter_then_cpu_exact_key_equality", "commit": "31518ad-dirty", "confirmation_index": 2, "confirmation_runs": 2, "confirmation_status": "discard", "cooldown_sec": 5.0, "correctness": true, "description": "M3 repeat-indexed tag16 hash filter base-count 2D threadgroup versus 1D threadgroup", "distance_tracking": "packet_distance_uint64", "dp_bits": 6, "dp_checksum": "0xbeb579944293c04a", "dp_count": 125, "dp_distance_checksum": "0xe3db79a4e83bd59d", "dp_query_count": 125, "dp_tracking": "affine_x256_y_parity_cpu_batch", "exact_host_table_bytes": 939524096, "experiment": "metal_jacobian_dynamic_dp_stream_xyzz_affine_scan_target_lookup_tag16_hash_filter_m3_base_count_tg2d", "filter_false_positive_count": 0, "filter_positive_count": 2097152, "gpu_lookup_lookups_per_sec": 2604364122.022979, "gpu_ops_per_sec": 81248647.346329, "hit_count": 2097152, "injected_hits": 16, "iterations": 8388608, "jump_count": 16, "jump_histogram_max_bucket": 262877, "jump_histogram_max_deviation_ppm": 3475, "jump_histogram_min_bucket": 261233, "jump_index": "power2_mask", "jump_mixer": "avalanche64", "jump_schedule": "power2", "lookup_engine": "auto", "lookup_engine_effective": "gpu_filter16_hash_repeat", "lookup_exact_seconds": 2.8e-05, "lookup_gpu_seconds": 0.012582, "lookup_hash_seconds": 8e-06, "lookup_layout": "open_address_tag16_hash_filter_exact256", "lookup_max_threads_per_threadgroup": 1024, "lookup_query_mode": "repeat", "lookup_repeat": 131072, "lookup_seconds": 0.012618, "lookup_thread_execution_width": 32, "lookup_threadgroup_limit": 512, "lookup_threads_per_threadgroup": 512, "lookups_per_sec": 2596959398.65427, "machine": "macOS-26.5-arm64-arm-64bit-Mach-O", "max_threads_per_threadgroup": 1024, "min_ms": 100, "miss_count": 14286848, "operation": "jacobian_affine_scan_target_lookup_tag32", "ops_per_sec": 72047891.025586, "ops_per_sec_max": 78475733.765092, "ops_per_sec_min": 70322386.07654, "output_layout": "affine_dp_scan_target_lookup", "paired_baseline_ops_per_sec": 73874758.19505, "paired_baseline_ref": "HEAD", "paired_order": "alternate", "paired_speedup": 0.9752707526346067, "query_count": 16384000, "query_input": "hash64_repeat_indexed", "raw_status": "discard", "reason": "", "repeat_positive_index_encoding": "base_query_count_repeated", "requested_hits": 16, "round_count": 1, "runner_sample_count": 3, "sample_count": 8192, "seconds": 0.103246, "setup_inclusive_ops_per_sec": 20128287.368189, "setup_inclusive_seconds": 0.416757, "skipped": false, "state_layout": "xyzz", "status": "discard", "steps_per_sample": 512, "target_bucket_bytes": 268435456, "target_build_seconds": 0.300326, "target_count": 16777216, "target_filter_bucket_bytes": 67108864, "target_filter_build_seconds": 0.0, "target_key": "x256_y_parity", "target_key_bytes": 671088640, "target_lookup_checksum": "0x86ec0110960785f8", "target_query_hash_bytes": 1000, "target_table_buckets": 33554432, "target_table_bytes": 67108864, "thread_execution_width": 32, "threadgroup_limit": 128, "threads_per_threadgroup": 128, "timestamp": "2026-06-30T20:10:57Z", "validation_seconds": 0.114918, "validation_workers": 8}
{"affine_scan_mode": "cpu_batch_prod_zz_zzz", "affine_scan_seconds": 0.000999, "backend": "metal", "budget_sec": 180, "bytes_per_target": 4.0, "candidate_verification": "tag16_mix_hash_filter_then_cpu_exact_key_equality", "commit": "31518ad-dirty", "confirmation_index": 1, "confirmation_runs": 2, "confirmation_status": "discard", "cooldown_sec": 5.0, "correctness": true, "description": "M3 repeat-indexed tag16-mix hash filter with fused setup and base-count positives versus standard tag16", "distance_tracking": "packet_distance_uint64", "dp_bits": 6, "dp_checksum": "0xbeb579944293c04a", "dp_count": 125, "dp_distance_checksum": "0xe3db79a4e83bd59d", "dp_query_count": 125, "dp_tracking": "affine_x256_y_parity_cpu_batch", "exact_host_table_bytes": 939524096, "experiment": "metal_jacobian_dynamic_dp_stream_xyzz_affine_scan_target_lookup_tag16_mix_filter_m3_base_count_repeat", "filter_false_positive_count": 0, "filter_positive_count": 2097152, "gpu_lookup_lookups_per_sec": 3000332006.95365, "gpu_ops_per_sec": 80048169.703103, "hit_count": 2097152, "injected_hits": 16, "iterations": 8388608, "jump_count": 16, "jump_histogram_max_bucket": 262877, "jump_histogram_max_deviation_ppm": 3475, "jump_histogram_min_bucket": 261233, "jump_index": "power2_mask", "jump_mixer": "avalanche64", "jump_schedule": "power2", "lookup_engine": "auto", "lookup_engine_effective": "gpu_filter16_mix_hash_repeat", "lookup_exact_seconds": 8e-06, "lookup_gpu_seconds": 0.010921, "lookup_hash_seconds": 8e-06, "lookup_layout": "open_address_tag16_mix_hash_filter_exact256", "lookup_max_threads_per_threadgroup": 1024, "lookup_query_mode": "repeat", "lookup_repeat": 131072, "lookup_seconds": 0.010937, "lookup_thread_execution_width": 32, "lookup_threadgroup_limit": 512, "lookup_threads_per_threadgroup": 512, "lookups_per_sec": 2996079897.170676, "machine": "macOS-26.5-arm64-arm-64bit-Mach-O", "max_threads_per_threadgroup": 1024, "min_ms": 100, "miss_count": 14286848, "operation": "jacobian_affine_scan_target_lookup_tag32", "ops_per_sec": 18925546.197068, "ops_per_sec_max": 20051780.232144, "ops_per_sec_min": 17578132.9358, "output_layout": "affine_dp_scan_target_lookup", "paired_baseline_ops_per_sec": 11411180.569817, "paired_baseline_ref": "HEAD", "paired_order": "alternate", "paired_speedup": 1.6585090456921503, "query_count": 16384000, "query_input": "hash64_repeat_indexed", "raw_status": "keep", "reason": "", "repeat_positive_index_encoding": "base_query_count_repeated", "requested_hits": 16, "round_count": 1, "runner_sample_count": 3, "sample_count": 8192, "seconds": 0.104795, "setup_inclusive_ops_per_sec": 18925546.197068, "setup_inclusive_ops_per_sec_max": 20051780.232144, "setup_inclusive_ops_per_sec_min": 17578132.9358, "setup_inclusive_seconds": 0.443243, "skipped": false, "state_layout": "xyzz", "status": "discard", "steps_per_sample": 512, "target_bucket_bytes": 268435456, "target_build_seconds": 0.326512, "target_count": 16777216, "target_filter_bucket_bytes": 67108864, "target_filter_build_seconds": 0.0, "target_key": "x256_y_parity", "target_key_bytes": 671088640, "target_lookup_checksum": "0x86ec0110960785f8", "target_query_hash_bytes": 1000, "target_table_buckets": 33554432, "target_table_bytes": 67108864, "thread_execution_width": 32, "threadgroup_limit": 128, "threads_per_threadgroup": 128, "timestamp": "2026-06-30T20:26:21Z", "validation_seconds": 0.125912, "validation_workers": 8}
