{"affine_scan_mode": "cpu_batch_prod_zz_zzz", "affine_scan_seconds": 0.000929, "backend": "metal", "budget_sec": 180, "bytes_per_target": 4.0, "candidate_verification": "tag16_hash_filter_then_cpu_exact_key_equality", "commit": "99581a8-dirty", "confirmation_index": 2, "confirmation_runs": 2, "confirmation_status": "keep", "cooldown_sec": 5.0, "correctness": true, "description": "M3 repeat-indexed tag16 hash filter sparse exact resolver with per-base positive counts", "distance_tracking": "packet_distance_uint64", "dp_bits": 6, "dp_checksum": "0xbeb579944293c04a", "dp_count": 125, "dp_distance_checksum": "0xe3db79a4e83bd59d", "dp_query_count": 125, "dp_tracking": "affine_x256_y_parity_cpu_batch", "exact_host_table_bytes": 939524096, "experiment": "metal_jacobian_dynamic_dp_stream_xyzz_affine_scan_target_lookup_tag16_hash_filter_m3_sparse_repeat_base_counts", "filter_false_positive_count": 0, "filter_positive_count": 2097152, "gpu_lookup_lookups_per_sec": 1245609926.349436, "gpu_ops_per_sec": 63265684.708295, "hit_count": 2097152, "injected_hits": 16, "iterations": 8388608, "jump_count": 16, "jump_histogram_max_bucket": 262877, "jump_histogram_max_deviation_ppm": 3475, "jump_histogram_min_bucket": 261233, "jump_index": "power2_mask", "jump_mixer": "avalanche64", "jump_schedule": "power2", "lookup_engine": "auto", "lookup_engine_effective": "gpu_filter16_hash_repeat", "lookup_exact_seconds": 0.002135, "lookup_gpu_seconds": 0.026307, "lookup_hash_seconds": 1.2e-05, "lookup_layout": "open_address_tag16_hash_filter_exact256", "lookup_max_threads_per_threadgroup": 1024, "lookup_query_mode": "repeat", "lookup_repeat": 131072, "lookup_seconds": 0.028453, "lookup_thread_execution_width": 32, "lookup_threadgroup_limit": 512, "lookup_threads_per_threadgroup": 512, "lookups_per_sec": 1151645185.316186, "machine": "macOS-26.5-arm64-arm-64bit-Mach-O", "max_threads_per_threadgroup": 1024, "min_ms": 100, "miss_count": 14286848, "operation": "jacobian_affine_scan_target_lookup_tag32", "ops_per_sec": 51789496.856066, "ops_per_sec_max": 53869357.178818, "ops_per_sec_min": 50753754.183599, "output_layout": "affine_dp_scan_target_lookup", "paired_baseline_ops_per_sec": 42452416.355267, "paired_baseline_ref": "HEAD", "paired_order": "alternate", "paired_speedup": 1.2199422624771408, "query_count": 16384000, "query_input": "hash64_repeat_indexed", "raw_status": "keep", "reason": "", "repeat_positive_index_encoding": "base_query_index_repeated", "requested_hits": 16, "round_count": 1, "runner_sample_count": 3, "sample_count": 8192, "seconds": 0.132593, "setup_inclusive_ops_per_sec": 13938038.712861, "setup_inclusive_seconds": 0.60185, "skipped": false, "state_layout": "xyzz", "status": "keep", "steps_per_sample": 512, "target_bucket_bytes": 268435456, "target_build_seconds": 0.439875, "target_count": 16777216, "target_filter_bucket_bytes": 67108864, "target_filter_build_seconds": 0.0, "target_key": "x256_y_parity", "target_key_bytes": 671088640, "target_lookup_checksum": "0x86ec0110960785f8", "target_query_hash_bytes": 1000, "target_table_buckets": 33554432, "target_table_bytes": 67108864, "thread_execution_width": 32, "threadgroup_limit": 128, "threads_per_threadgroup": 128, "timestamp": "2026-06-30T19:32:41Z", "validation_seconds": 0.266613, "validation_workers": 8}
{"affine_scan_mode": "cpu_batch_prod_zz_zzz", "affine_scan_seconds": 0.005469, "backend": "metal", "budget_sec": 180, "bytes_per_target": 4.0, "candidate_verification": "tag16_hash_filter_then_cpu_exact_key_equality", "commit": "a5cb61a-dirty", "confirmation_index": 1, "confirmation_runs": 2, "confirmation_status": "discard", "cooldown_sec": 5.0, "correctness": true, "description": "M3 repeat-indexed tag16 hash filter grouped threadgroup compaction for base-index positives", "distance_tracking": "packet_distance_uint64", "dp_bits": 6, "dp_checksum": "0xbeb579944293c04a", "dp_count": 125, "dp_distance_checksum": "0xe3db79a4e83bd59d", "dp_query_count": 125, "dp_tracking": "affine_x256_y_parity_cpu_batch", "exact_host_table_bytes": 939524096, "experiment": "metal_jacobian_dynamic_dp_stream_xyzz_affine_scan_target_lookup_tag16_hash_filter_m3_grouped_base_positive", "filter_false_positive_count": 0, "filter_positive_count": 2097152, "gpu_lookup_lookups_per_sec": 744422736.153392, "gpu_ops_per_sec": 46771408.219264, "hit_count": 2097152, "injected_hits": 16, "iterations": 4194304, "jump_count": 16, "jump_histogram_max_bucket": 262877, "jump_histogram_max_deviation_ppm": 3475, "jump_histogram_min_bucket": 261233, "jump_index": "power2_mask", "jump_mixer": "avalanche64", "jump_schedule": "power2", "lookup_engine": "auto", "lookup_engine_effective": "gpu_filter16_hash_repeat", "lookup_exact_seconds": 0.003443, "lookup_gpu_seconds": 0.022009, "lookup_hash_seconds": 3.3e-05, "lookup_layout": "open_address_tag16_hash_filter_exact256", "lookup_max_threads_per_threadgroup": 1024, "lookup_query_mode": "repeat", "lookup_repeat": 131072, "lookup_seconds": 0.025485, "lookup_thread_execution_width": 32, "lookup_threadgroup_limit": 512, "lookup_threads_per_threadgroup": 512, "lookups_per_sec": 642889032.816927, "machine": "macOS-26.5-arm64-arm-64bit-Mach-O", "max_threads_per_threadgroup": 1024, "min_ms": 100, "miss_count": 14286848, "operation": "jacobian_affine_scan_target_lookup_tag32", "ops_per_sec": 34769942.745748, "ops_per_sec_max": 37222677.428903, "ops_per_sec_min": 34671561.213249, "output_layout": "affine_dp_scan_target_lookup", "paired_baseline_ops_per_sec": 30439846.618968, "paired_baseline_ref": "HEAD", "paired_order": "alternate", "paired_speedup": 1.1422509180477205, "query_count": 16384000, "query_input": "hash64_repeat_indexed", "raw_status": "keep", "reason": "", "repeat_positive_index_encoding": "base_query_index_repeated", "requested_hits": 16, "round_count": 1, "runner_sample_count": 3, "sample_count": 8192, "seconds": 0.089677, "setup_inclusive_ops_per_sec": 2686187.184345, "setup_inclusive_seconds": 1.561434, "skipped": false, "state_layout": "xyzz", "status": "discard", "steps_per_sample": 512, "target_bucket_bytes": 268435456, "target_build_seconds": 1.440804, "target_count": 16777216, "target_filter_bucket_bytes": 67108864, "target_filter_build_seconds": 0.0, "target_key": "x256_y_parity", "target_key_bytes": 671088640, "target_lookup_checksum": "0x86ec0110960785f8", "target_query_hash_bytes": 1000, "target_table_buckets": 33554432, "target_table_bytes": 67108864, "thread_execution_width": 32, "threadgroup_limit": 128, "threads_per_threadgroup": 128, "timestamp": "2026-06-30T19:42:13Z", "validation_seconds": 0.605216, "validation_workers": 8}
{"affine_scan_mode": "cpu_batch_prod_zz_zzz", "affine_scan_seconds": 0.000632, "backend": "metal", "budget_sec": 180, "bytes_per_target": 4.0, "candidate_verification": "tag16_hash_filter_then_cpu_exact_key_equality", "commit": "a5cb61a-dirty", "confirmation_index": 2, "confirmation_runs": 2, "confirmation_status": "discard", "cooldown_sec": 5.0, "correctness": true, "description": "M3 repeat-indexed tag16 hash filter grouped threadgroup compaction for base-index positives", "distance_tracking": "packet_distance_uint64", "dp_bits": 6, "dp_checksum": "0xbeb579944293c04a", "dp_count": 125, "dp_distance_checksum": "0xe3db79a4e83bd59d", "dp_query_count": 125, "dp_tracking": "affine_x256_y_parity_cpu_batch", "exact_host_table_bytes": 939524096, "experiment": "metal_jacobian_dynamic_dp_stream_xyzz_affine_scan_target_lookup_tag16_hash_filter_m3_grouped_base_positive", "filter_false_positive_count": 0, "filter_positive_count": 2097152, "gpu_lookup_lookups_per_sec": 300765499.96491, "gpu_ops_per_sec": 50973686.662569, "hit_count": 2097152, "injected_hits": 16, "iterations": 4194304, "jump_count": 16, "jump_histogram_max_bucket": 262877, "jump_histogram_max_deviation_ppm": 3475, "jump_histogram_min_bucket": 261233, "jump_index": "power2_mask", "jump_mixer": "avalanche64", "jump_schedule": "power2", "lookup_engine": "auto", "lookup_engine_effective": "gpu_filter16_hash_repeat", "lookup_exact_seconds": 0.001759, "lookup_gpu_seconds": 0.054474, "lookup_hash_seconds": 0.000557, "lookup_layout": "open_address_tag16_hash_filter_exact256", "lookup_max_threads_per_threadgroup": 1024, "lookup_query_mode": "repeat", "lookup_repeat": 131072, "lookup_seconds": 0.056791, "lookup_thread_execution_width": 32, "lookup_threadgroup_limit": 512, "lookup_threads_per_threadgroup": 512, "lookups_per_sec": 288496843.403618, "machine": "macOS-26.5-arm64-arm-64bit-Mach-O", "max_threads_per_threadgroup": 1024, "min_ms": 100, "miss_count": 14286848, "operation": "jacobian_affine_scan_target_lookup_tag32", "ops_per_sec": 30022289.68389, "ops_per_sec_max": 41564182.064837, "ops_per_sec_min": 26820687.508147, "output_layout": "affine_dp_scan_target_lookup", "paired_baseline_ops_per_sec": 39907839.933016, "paired_baseline_ref": "HEAD", "paired_order": "alternate", "paired_speedup": 0.752290520716767, "query_count": 16384000, "query_input": "hash64_repeat_indexed", "raw_status": "discard", "reason": "", "repeat_positive_index_encoding": "base_query_index_repeated", "requested_hits": 16, "round_count": 1, "runner_sample_count": 3, "sample_count": 8192, "seconds": 0.082284, "setup_inclusive_ops_per_sec": 2925952.997026, "setup_inclusive_seconds": 1.433483, "skipped": false, "state_layout": "xyzz", "status": "discard", "steps_per_sample": 512, "target_bucket_bytes": 268435456, "target_build_seconds": 1.293777, "target_count": 16777216, "target_filter_bucket_bytes": 67108864, "target_filter_build_seconds": 0.0, "target_key": "x256_y_parity", "target_key_bytes": 671088640, "target_lookup_checksum": "0x86ec0110960785f8", "target_query_hash_bytes": 1000, "target_table_buckets": 33554432, "target_table_bytes": 67108864, "thread_execution_width": 32, "threadgroup_limit": 128, "threads_per_threadgroup": 128, "timestamp": "2026-06-30T19:42:13Z", "validation_seconds": 0.764746, "validation_workers": 8}
{"affine_scan_mode": "cpu_batch_prod_zz_zzz", "affine_scan_seconds": 0.006331, "backend": "metal", "budget_sec": 180, "bytes_per_target": 4.0, "candidate_verification": "tag16_hash_filter_then_cpu_exact_key_equality", "commit": "a5cb61a-dirty", "confirmation_index": 1, "confirmation_runs": 2, "confirmation_status": "keep", "cooldown_sec": 5.0, "correctness": true, "description": "M3 repeat-indexed tag16 hash filter lookup threadgroup 768 versus 512 after sparse base-count resolver", "distance_tracking": "packet_distance_uint64", "dp_bits": 6, "dp_checksum": "0xbeb579944293c04a", "dp_count": 125, "dp_distance_checksum": "0xe3db79a4e83bd59d", "dp_query_count": 125, "dp_tracking": "affine_x256_y_parity_cpu_batch", "exact_host_table_bytes": 939524096, "experiment": "metal_jacobian_dynamic_dp_stream_xyzz_affine_scan_target_lookup_tag16_hash_filter_m3_tg768_after_base_counts", "filter_false_positive_count": 0, "filter_positive_count": 2097152, "gpu_lookup_lookups_per_sec": 1217452973.055233, "gpu_ops_per_sec": 52458786.097868, "hit_count": 2097152, "injected_hits": 16, "iterations": 8388608, "jump_count": 16, "jump_histogram_max_bucket": 262877, "jump_histogram_max_deviation_ppm": 3475, "jump_histogram_min_bucket": 261233, "jump_index": "power2_mask", "jump_mixer": "avalanche64", "jump_schedule": "power2", "lookup_engine": "auto", "lookup_engine_effective": "gpu_filter16_hash_repeat", "lookup_exact_seconds": 0.003395, "lookup_gpu_seconds": 0.026915, "lookup_hash_seconds": 4.9e-05, "lookup_layout": "open_address_tag16_hash_filter_exact256", "lookup_max_threads_per_threadgroup": 1024, "lookup_query_mode": "repeat", "lookup_repeat": 131072, "lookup_seconds": 0.030359, "lookup_thread_execution_width": 32, "lookup_threadgroup_limit": 768, "lookup_threads_per_threadgroup": 768, "lookups_per_sec": 1079332663.581416, "machine": "macOS-26.5-arm64-arm-64bit-Mach-O", "max_threads_per_threadgroup": 1024, "min_ms": 100, "miss_count": 14286848, "operation": "jacobian_affine_scan_target_lookup_tag32", "ops_per_sec": 42668710.167312, "ops_per_sec_max": 46095748.349083, "ops_per_sec_min": 23605389.801588, "output_layout": "affine_dp_scan_target_lookup", "paired_baseline_ops_per_sec": 32556867.695592, "paired_baseline_ref": "HEAD", "paired_order": "alternate", "paired_speedup": 1.3105901515546927, "query_count": 16384000, "query_input": "hash64_repeat_indexed", "raw_status": "keep", "reason": "", "repeat_positive_index_encoding": "base_query_index_repeated", "requested_hits": 16, "round_count": 1, "runner_sample_count": 3, "sample_count": 8192, "seconds": 0.159909, "setup_inclusive_ops_per_sec": 9054094.102381, "setup_inclusive_seconds": 0.926499, "skipped": false, "state_layout": "xyzz", "status": "keep", "steps_per_sample": 512, "target_bucket_bytes": 268435456, "target_build_seconds": 0.7299, "target_count": 16777216, "target_filter_bucket_bytes": 67108864, "target_filter_build_seconds": 0.0, "target_key": "x256_y_parity", "target_key_bytes": 671088640, "target_lookup_checksum": "0x86ec0110960785f8", "target_query_hash_bytes": 1000, "target_table_buckets": 33554432, "target_table_bytes": 67108864, "thread_execution_width": 32, "threadgroup_limit": 128, "threads_per_threadgroup": 128, "timestamp": "2026-06-30T19:45:43Z", "validation_seconds": 0.401752, "validation_workers": 8}
{"affine_scan_mode": "cpu_batch_prod_zz_zzz", "affine_scan_seconds": 0.008629, "backend": "metal", "budget_sec": 180, "bytes_per_target": 4.0, "candidate_verification": "tag16_hash_filter_then_cpu_exact_key_equality", "commit": "a5cb61a-dirty", "confirmation_index": 2, "confirmation_runs": 2, "confirmation_status": "keep", "cooldown_sec": 5.0, "correctness": true, "description": "M3 repeat-indexed tag16 hash filter lookup threadgroup 768 versus 512 after sparse base-count resolver", "distance_tracking": "packet_distance_uint64", "dp_bits": 6, "dp_checksum": "0xbeb579944293c04a", "dp_count": 125, "dp_distance_checksum": "0xe3db79a4e83bd59d", "dp_query_count": 125, "dp_tracking": "affine_x256_y_parity_cpu_batch", "exact_host_table_bytes": 939524096, "experiment": "metal_jacobian_dynamic_dp_stream_xyzz_affine_scan_target_lookup_tag16_hash_filter_m3_tg768_after_base_counts", "filter_false_positive_count": 0, "filter_positive_count": 2097152, "gpu_lookup_lookups_per_sec": 1497218439.729145, "gpu_ops_per_sec": 51440052.742223, "hit_count": 2097152, "injected_hits": 16, "iterations": 4194304, "jump_count": 16, "jump_histogram_max_bucket": 262877, "jump_histogram_max_deviation_ppm": 3475, "jump_histogram_min_bucket": 261233, "jump_index": "power2_mask", "jump_mixer": "avalanche64", "jump_schedule": "power2", "lookup_engine": "auto", "lookup_engine_effective": "gpu_filter16_hash_repeat", "lookup_exact_seconds": 0.001794, "lookup_gpu_seconds": 0.010943, "lookup_hash_seconds": 0.000509, "lookup_layout": "open_address_tag16_hash_filter_exact256", "lookup_max_threads_per_threadgroup": 1024, "lookup_query_mode": "repeat", "lookup_repeat": 131072, "lookup_seconds": 0.013246, "lookup_thread_execution_width": 32, "lookup_threadgroup_limit": 768, "lookup_threads_per_threadgroup": 768, "lookups_per_sec": 1236882190.217593, "machine": "macOS-26.5-arm64-arm-64bit-Mach-O", "max_threads_per_threadgroup": 1024, "min_ms": 100, "miss_count": 14286848, "operation": "jacobian_affine_scan_target_lookup_tag32", "ops_per_sec": 40558867.257664, "ops_per_sec_max": 43643840.008701, "ops_per_sec_min": 36758471.847764, "output_layout": "affine_dp_scan_target_lookup", "paired_baseline_ops_per_sec": 35886127.078025, "paired_baseline_ref": "HEAD", "paired_order": "alternate", "paired_speedup": 1.1302102110233114, "query_count": 16384000, "query_input": "hash64_repeat_indexed", "raw_status": "keep", "reason": "", "repeat_positive_index_encoding": "base_query_index_repeated", "requested_hits": 16, "round_count": 1, "runner_sample_count": 3, "sample_count": 8192, "seconds": 0.081538, "setup_inclusive_ops_per_sec": 4068465.022069, "setup_inclusive_seconds": 1.03093, "skipped": false, "state_layout": "xyzz", "status": "keep", "steps_per_sample": 512, "target_bucket_bytes": 268435456, "target_build_seconds": 0.927518, "target_count": 16777216, "target_filter_bucket_bytes": 67108864, "target_filter_build_seconds": 0.0, "target_key": "x256_y_parity", "target_key_bytes": 671088640, "target_lookup_checksum": "0x86ec0110960785f8", "target_query_hash_bytes": 1000, "target_table_buckets": 33554432, "target_table_bytes": 67108864, "thread_execution_width": 32, "threadgroup_limit": 128, "threads_per_threadgroup": 128, "timestamp": "2026-06-30T19:45:43Z", "validation_seconds": 0.417534, "validation_workers": 8}
{"affine_scan_mode": "cpu_batch_prod_zz_zzz", "affine_scan_seconds": 0.002247, "backend": "metal", "budget_sec": 180, "bytes_per_target": 4.0, "candidate_verification": "tag16_hash_filter_then_cpu_exact_key_equality", "commit": "a5cb61a-dirty", "confirmation_index": 1, "confirmation_runs": 2, "confirmation_status": "discard", "cooldown_sec": 5.0, "correctness": true, "description": "M3 auto repeat-indexed tag16 hash filter default 768-thread lookup cap versus previous auto default", "distance_tracking": "packet_distance_uint64", "dp_bits": 6, "dp_checksum": "0xbeb579944293c04a", "dp_count": 125, "dp_distance_checksum": "0xe3db79a4e83bd59d", "dp_query_count": 125, "dp_tracking": "affine_x256_y_parity_cpu_batch", "exact_host_table_bytes": 939524096, "experiment": "metal_jacobian_dynamic_dp_stream_xyzz_affine_scan_target_lookup_tag16_hash_filter_m3_auto_tg768_default", "filter_false_positive_count": 0, "filter_positive_count": 2097152, "gpu_lookup_lookups_per_sec": 1642938617.932037, "gpu_ops_per_sec": 56371391.138377, "hit_count": 2097152, "injected_hits": 16, "iterations": 8388608, "jump_count": 16, "jump_histogram_max_bucket": 262877, "jump_histogram_max_deviation_ppm": 3475, "jump_histogram_min_bucket": 261233, "jump_index": "power2_mask", "jump_mixer": "avalanche64", "jump_schedule": "power2", "lookup_engine": "auto", "lookup_engine_effective": "gpu_filter16_hash_repeat", "lookup_exact_seconds": 0.002863, "lookup_gpu_seconds": 0.019945, "lookup_hash_seconds": 1.3e-05, "lookup_layout": "open_address_tag16_hash_filter_exact256", "lookup_max_threads_per_threadgroup": 1024, "lookup_query_mode": "repeat", "lookup_repeat": 131072, "lookup_seconds": 0.022821, "lookup_thread_execution_width": 32, "lookup_threadgroup_limit": 768, "lookup_threads_per_threadgroup": 768, "lookups_per_sec": 1435873049.85737, "machine": "macOS-26.5-arm64-arm-64bit-Mach-O", "max_threads_per_threadgroup": 1024, "min_ms": 100, "miss_count": 14286848, "operation": "jacobian_affine_scan_target_lookup_tag32", "ops_per_sec": 48244424.750858, "ops_per_sec_max": 49724389.293548, "ops_per_sec_min": 43045976.713927, "output_layout": "affine_dp_scan_target_lookup", "paired_baseline_ops_per_sec": 37811133.823592, "paired_baseline_ref": "HEAD", "paired_order": "alternate", "paired_speedup": 1.2759317130224808, "query_count": 16384000, "query_input": "hash64_repeat_indexed", "raw_status": "keep", "reason": "", "repeat_positive_index_encoding": "base_query_index_repeated", "requested_hits": 16, "round_count": 1, "runner_sample_count": 3, "sample_count": 8192, "seconds": 0.14881, "setup_inclusive_ops_per_sec": 9844678.128939, "setup_inclusive_seconds": 0.852096, "skipped": false, "state_layout": "xyzz", "status": "discard", "steps_per_sample": 512, "target_bucket_bytes": 268435456, "target_build_seconds": 0.678218, "target_count": 16777216, "target_filter_bucket_bytes": 67108864, "target_filter_build_seconds": 0.0, "target_key": "x256_y_parity", "target_key_bytes": 671088640, "target_lookup_checksum": "0x86ec0110960785f8", "target_query_hash_bytes": 1000, "target_table_buckets": 33554432, "target_table_bytes": 67108864, "thread_execution_width": 32, "threadgroup_limit": 128, "threads_per_threadgroup": 128, "timestamp": "2026-06-30T19:51:32Z", "validation_seconds": 0.659879, "validation_workers": 8}
