{"backend": "metal", "budget_sec": 120, "commit": "ac030a2-dirty", "correctness": true, "description": "Stable Metal Jacobian jump-table walk with projective distinguished-point candidate flags", "distance_checksum": "0xa45f471493cace2f", "distance_tracking": "uint64", "dp_bits": 4, "dp_checksum": "0x30a7914972cba014", "dp_count": 1000, "dp_tracking": "projective_x_limb0", "experiment": "metal_jacobian_jump_walk_dp_stable", "iterations": 6291456, "jump_count": 16, "machine": "macOS-26.5-arm64-arm-64bit-Mach-O", "max_threads_per_threadgroup": 1024, "min_ms": 200, "operation": "jacobian_affine_walk_jump_table", "ops_per_sec": 31361809.164586, "ops_per_sec_max": 39113304.638512, "ops_per_sec_min": 21258509.778944, "paired_baseline_ops_per_sec": 27944840.858156, "paired_baseline_ref": "main", "paired_speedup": 1.122275461283678, "reason": "", "runner_sample_count": 3, "sample_count": 16384, "seconds": 0.200609, "skipped": false, "status": "keep", "steps_per_sample": 8, "thread_execution_width": 32, "threadgroup_limit": 256, "threads_per_threadgroup": 256, "timestamp": "2026-06-22T12:45:12Z"}
{"backend": "metal", "budget_sec": 120, "commit": "ac030a2-dirty", "correctness": true, "description": "Stable Metal Jacobian jump-table walk with projective distinguished-point candidate flags", "distance_checksum": "0xa45f471493cace2f", "distance_tracking": "uint64", "dp_bits": 4, "dp_checksum": "0x30a7914972cba014", "dp_count": 1000, "dp_tracking": "projective_x_limb0", "experiment": "metal_jacobian_jump_walk_dp_stable", "iterations": 3932160, "jump_count": 16, "machine": "macOS-26.5-arm64-arm-64bit-Mach-O", "max_threads_per_threadgroup": 1024, "min_ms": 200, "operation": "jacobian_affine_walk_jump_table", "ops_per_sec": 19168913.507147, "ops_per_sec_max": 23559580.289984, "ops_per_sec_min": 19050547.70906, "paired_baseline_ops_per_sec": 20875904.079754, "paired_baseline_ref": "main", "paired_speedup": 0.9182315378493004, "reason": "", "runner_sample_count": 3, "sample_count": 16384, "seconds": 0.205132, "skipped": false, "status": "discard", "steps_per_sample": 8, "thread_execution_width": 32, "threadgroup_limit": 256, "threads_per_threadgroup": 256, "timestamp": "2026-06-22T12:47:22Z"}
{"backend": "metal", "budget_sec": 10, "commit": "30ff5d9-dirty", "confirmation_index": 1, "confirmation_runs": 2, "confirmation_status": "discard", "correctness": true, "description": "Stable Metal Jacobian jump-table walk with projective distinguished-point candidate flags", "distance_checksum": "0xa45f471493cace2f", "distance_tracking": "uint64", "dp_bits": 4, "dp_checksum": "0x30a7914972cba014", "dp_count": 1000, "dp_tracking": "projective_x_limb0", "experiment": "metal_jacobian_jump_walk_dp_stable", "iterations": 4194304, "jump_count": 16, "machine": "macOS-26.5-arm64-arm-64bit-Mach-O", "max_threads_per_threadgroup": 1024, "min_ms": 200, "operation": "jacobian_affine_walk_jump_table", "ops_per_sec": 20648220.182765, "ops_per_sec_max": 20686393.032057, "ops_per_sec_min": 20026122.962827, "paired_baseline_ops_per_sec": 42492028.562122, "paired_baseline_ref": "main", "paired_speedup": 0.4859316177992763, "raw_status": "discard", "reason": "", "runner_sample_count": 3, "sample_count": 16384, "seconds": 0.203132, "skipped": false, "status": "discard", "steps_per_sample": 8, "thread_execution_width": 32, "threadgroup_limit": 256, "threads_per_threadgroup": 256, "timestamp": "2026-06-22T13:01:29Z"}
{"backend": "metal", "budget_sec": 10, "commit": "30ff5d9-dirty", "confirmation_index": 2, "confirmation_runs": 2, "confirmation_status": "discard", "correctness": true, "description": "Stable Metal Jacobian jump-table walk with projective distinguished-point candidate flags", "distance_checksum": "0xa45f471493cace2f", "distance_tracking": "uint64", "dp_bits": 4, "dp_checksum": "0x30a7914972cba014", "dp_count": 1000, "dp_tracking": "projective_x_limb0", "experiment": "metal_jacobian_jump_walk_dp_stable", "iterations": 4456448, "jump_count": 16, "machine": "macOS-26.5-arm64-arm-64bit-Mach-O", "max_threads_per_threadgroup": 1024, "min_ms": 200, "operation": "jacobian_affine_walk_jump_table", "ops_per_sec": 21962885.587314, "ops_per_sec_max": 32717050.391766, "ops_per_sec_min": 20809010.472043, "paired_baseline_ops_per_sec": 30672067.959967, "paired_baseline_ref": "main", "paired_speedup": 0.7160549336282062, "raw_status": "discard", "reason": "", "runner_sample_count": 3, "sample_count": 16384, "seconds": 0.202908, "skipped": false, "status": "discard", "steps_per_sample": 8, "thread_execution_width": 32, "threadgroup_limit": 256, "threads_per_threadgroup": 256, "timestamp": "2026-06-22T13:01:55Z"}
{"backend": "metal", "budget_sec": 20, "commit": "5b608f8-dirty", "correctness": true, "description": "Metal dynamic Jacobian DP stream with runtime dp_bits=14 mask", "distance_tracking": "dp_stream_uint64", "dp_bits": 14, "dp_capacity": 16384, "dp_checksum": "0x252996ea8a0dca38", "dp_count": 1, "dp_distance_checksum": "0x9e3779b97f4b39c1", "dp_stream_overflow": false, "dp_tracking": "projective_x_limb0", "emitted_records": 1, "experiment": "metal_jacobian_dynamic_dp_stream_dp14", "iterations": 6946816, "jump_count": 16, "jump_histogram_max_bucket": 8336, "jump_histogram_max_deviation_ppm": 17578, "jump_histogram_min_bucket": 8082, "jump_index": "power2_mask", "jump_mixer": "avalanche64", "machine": "macOS-26.5-arm64-arm-64bit-Mach-O", "max_threads_per_threadgroup": 1024, "min_ms": 200, "operation": "jacobian_affine_walk_dynamic_dp_stream", "ops_per_sec": 34457601.167211, "ops_per_sec_max": 44057552.043881, "ops_per_sec_min": 34358055.162337, "output_bytes_per_record": 20, "output_bytes_total": 20, "output_layout": "dp_stream", "reason": "", "runner_sample_count": 3, "sample_count": 16384, "seconds": 0.201605, "skipped": false, "status": "keep", "steps_per_sample": 8, "thread_execution_width": 32, "threadgroup_limit": 256, "threads_per_threadgroup": 256, "timestamp": "2026-06-22T13:11:03Z"}
{"backend": "metal", "budget_sec": 20, "commit": "63bcf53-dirty", "confirmation_index": 1, "confirmation_runs": 2, "confirmation_status": "discard", "correctness": true, "description": "Metal dynamic Jacobian DP stream with runtime dp_bits=14 mask", "distance_tracking": "dp_stream_uint64", "dp_bits": 14, "dp_capacity": 16384, "dp_checksum": "0x252996ea8a0dca38", "dp_count": 1, "dp_distance_checksum": "0x9e3779b97f4b39c1", "dp_stream_overflow": false, "dp_tracking": "projective_x_limb0", "emitted_records": 1, "experiment": "metal_jacobian_dynamic_dp_stream_dp14", "iterations": 11010048, "jump_count": 16, "jump_histogram_max_bucket": 8336, "jump_histogram_max_deviation_ppm": 17578, "jump_histogram_min_bucket": 8082, "jump_index": "power2_mask", "jump_mixer": "avalanche64", "machine": "macOS-26.5-arm64-arm-64bit-Mach-O", "max_threads_per_threadgroup": 1024, "min_ms": 200, "operation": "jacobian_affine_walk_dynamic_dp_stream", "ops_per_sec": 54206138.22119, "ops_per_sec_max": 70063001.331025, "ops_per_sec_min": 44919115.951718, "output_bytes_per_record": 20, "output_bytes_total": 20, "output_layout": "dp_stream", "paired_baseline_ops_per_sec": 67608653.79627, "paired_baseline_ref": "main", "paired_speedup": 0.8017633124974392, "raw_status": "discard", "reason": "", "runner_sample_count": 3, "sample_count": 16384, "seconds": 0.203114, "skipped": false, "status": "discard", "steps_per_sample": 8, "thread_execution_width": 32, "threadgroup_limit": 256, "threads_per_threadgroup": 256, "timestamp": "2026-06-22T13:18:46Z"}
{"backend": "metal", "budget_sec": 20, "commit": "63bcf53-dirty", "confirmation_index": 2, "confirmation_runs": 2, "confirmation_status": "discard", "correctness": true, "description": "Metal dynamic Jacobian DP stream with runtime dp_bits=14 mask", "distance_tracking": "dp_stream_uint64", "dp_bits": 14, "dp_capacity": 16384, "dp_checksum": "0x252996ea8a0dca38", "dp_count": 1, "dp_distance_checksum": "0x9e3779b97f4b39c1", "dp_stream_overflow": false, "dp_tracking": "projective_x_limb0", "emitted_records": 1, "experiment": "metal_jacobian_dynamic_dp_stream_dp14", "iterations": 8912896, "jump_count": 16, "jump_histogram_max_bucket": 8336, "jump_histogram_max_deviation_ppm": 17578, "jump_histogram_min_bucket": 8082, "jump_index": "power2_mask", "jump_mixer": "avalanche64", "machine": "macOS-26.5-arm64-arm-64bit-Mach-O", "max_threads_per_threadgroup": 1024, "min_ms": 200, "operation": "jacobian_affine_walk_dynamic_dp_stream", "ops_per_sec": 44341838.079041, "ops_per_sec_max": 56850989.070698, "ops_per_sec_min": 29224121.773952, "output_bytes_per_record": 20, "output_bytes_total": 20, "output_layout": "dp_stream", "paired_baseline_ops_per_sec": 40366739.951844, "paired_baseline_ref": "main", "paired_speedup": 1.0984745890289664, "raw_status": "keep", "reason": "", "runner_sample_count": 3, "sample_count": 16384, "seconds": 0.201004, "skipped": false, "status": "discard", "steps_per_sample": 8, "thread_execution_width": 32, "threadgroup_limit": 256, "threads_per_threadgroup": 256, "timestamp": "2026-06-22T13:19:04Z"}
{"backend": "metal", "budget_sec": 10, "commit": "1c90057-dirty", "confirmation_index": 1, "confirmation_runs": 2, "confirmation_status": "keep", "correctness": true, "description": "Stable Metal Jacobian jump-table walk with projective distinguished-point candidate flags", "distance_checksum": "0xa45f471493cace2f", "distance_tracking": "uint64", "dp_bits": 4, "dp_checksum": "0x30a7914972cba014", "dp_count": 1000, "dp_tracking": "projective_x_limb0", "experiment": "metal_jacobian_jump_walk_dp_stable", "iterations": 10092544, "jump_count": 16, "machine": "macOS-26.5-arm64-arm-64bit-Mach-O", "max_threads_per_threadgroup": 1024, "min_ms": 200, "operation": "jacobian_affine_walk_jump_table", "ops_per_sec": 49947459.510319, "ops_per_sec_max": 52313558.201071, "ops_per_sec_min": 41826543.247817, "paired_baseline_ops_per_sec": 40143126.229418, "paired_baseline_ref": "main", "paired_speedup": 1.244234423220285, "raw_status": "keep", "reason": "", "runner_sample_count": 3, "sample_count": 16384, "seconds": 0.202063, "skipped": false, "status": "keep", "steps_per_sample": 8, "thread_execution_width": 32, "threadgroup_limit": 256, "threads_per_threadgroup": 256, "timestamp": "2026-06-22T13:24:17Z"}
{"backend": "metal", "budget_sec": 10, "commit": "1c90057-dirty", "confirmation_index": 2, "confirmation_runs": 2, "confirmation_status": "keep", "correctness": true, "description": "Stable Metal Jacobian jump-table walk with projective distinguished-point candidate flags", "distance_checksum": "0xa45f471493cace2f", "distance_tracking": "uint64", "dp_bits": 4, "dp_checksum": "0x30a7914972cba014", "dp_count": 1000, "dp_tracking": "projective_x_limb0", "experiment": "metal_jacobian_jump_walk_dp_stable", "iterations": 8388608, "jump_count": 16, "machine": "macOS-26.5-arm64-arm-64bit-Mach-O", "max_threads_per_threadgroup": 1024, "min_ms": 200, "operation": "jacobian_affine_walk_jump_table", "ops_per_sec": 41866424.025369, "ops_per_sec_max": 56581456.988356, "ops_per_sec_min": 31248338.608859, "paired_baseline_ops_per_sec": 37745918.748751, "paired_baseline_ref": "main", "paired_speedup": 1.1091642596924296, "raw_status": "keep", "reason": "", "runner_sample_count": 3, "sample_count": 16384, "seconds": 0.200366, "skipped": false, "status": "keep", "steps_per_sample": 8, "thread_execution_width": 32, "threadgroup_limit": 256, "threads_per_threadgroup": 256, "timestamp": "2026-06-22T13:24:35Z"}
{"backend": "metal", "budget_sec": 10, "commit": "1c90057-dirty", "confirmation_index": 1, "confirmation_runs": 3, "confirmation_status": "discard", "correctness": true, "description": "Stable Metal Jacobian jump-table walk with projective distinguished-point candidate flags", "distance_checksum": "0xa45f471493cace2f", "distance_tracking": "uint64", "dp_bits": 4, "dp_checksum": "0x30a7914972cba014", "dp_count": 1000, "dp_tracking": "projective_x_limb0", "experiment": "metal_jacobian_jump_walk_dp_stable", "iterations": 4587520, "jump_count": 16, "machine": "macOS-26.5-arm64-arm-64bit-Mach-O", "max_threads_per_threadgroup": 1024, "min_ms": 200, "operation": "jacobian_affine_walk_jump_table", "ops_per_sec": 22877460.988813, "ops_per_sec_max": 29131936.654574, "ops_per_sec_min": 19827152.0442, "paired_baseline_ops_per_sec": 31727592.666298, "paired_baseline_ref": "main", "paired_speedup": 0.7210588344798731, "raw_status": "discard", "reason": "", "runner_sample_count": 3, "sample_count": 16384, "seconds": 0.200526, "skipped": false, "status": "discard", "steps_per_sample": 8, "thread_execution_width": 32, "threadgroup_limit": 256, "threads_per_threadgroup": 256, "timestamp": "2026-06-22T13:25:46Z"}
{"backend": "metal", "budget_sec": 10, "commit": "1c90057-dirty", "confirmation_index": 2, "confirmation_runs": 3, "confirmation_status": "discard", "correctness": true, "description": "Stable Metal Jacobian jump-table walk with projective distinguished-point candidate flags", "distance_checksum": "0xa45f471493cace2f", "distance_tracking": "uint64", "dp_bits": 4, "dp_checksum": "0x30a7914972cba014", "dp_count": 1000, "dp_tracking": "projective_x_limb0", "experiment": "metal_jacobian_jump_walk_dp_stable", "iterations": 8388608, "jump_count": 16, "machine": "macOS-26.5-arm64-arm-64bit-Mach-O", "max_threads_per_threadgroup": 1024, "min_ms": 200, "operation": "jacobian_affine_walk_jump_table", "ops_per_sec": 41594633.574442, "ops_per_sec_max": 49998050.121701, "ops_per_sec_min": 23570911.794589, "paired_baseline_ops_per_sec": 63375595.846747, "paired_baseline_ref": "main", "paired_speedup": 0.6563194084206311, "raw_status": "discard", "reason": "", "runner_sample_count": 3, "sample_count": 16384, "seconds": 0.201675, "skipped": false, "status": "discard", "steps_per_sample": 8, "thread_execution_width": 32, "threadgroup_limit": 256, "threads_per_threadgroup": 256, "timestamp": "2026-06-22T13:26:06Z"}
{"backend": "metal", "budget_sec": 10, "commit": "1c90057-dirty", "confirmation_index": 3, "confirmation_runs": 3, "confirmation_status": "discard", "correctness": true, "description": "Stable Metal Jacobian jump-table walk with projective distinguished-point candidate flags", "distance_checksum": "0xa45f471493cace2f", "distance_tracking": "uint64", "dp_bits": 4, "dp_checksum": "0x30a7914972cba014", "dp_count": 1000, "dp_tracking": "projective_x_limb0", "experiment": "metal_jacobian_jump_walk_dp_stable", "iterations": 8126464, "jump_count": 16, "machine": "macOS-26.5-arm64-arm-64bit-Mach-O", "max_threads_per_threadgroup": 1024, "min_ms": 200, "operation": "jacobian_affine_walk_jump_table", "ops_per_sec": 40241782.753983, "ops_per_sec_max": 53187455.223822, "ops_per_sec_min": 34098652.296429, "paired_baseline_ops_per_sec": 41099735.021719, "paired_baseline_ref": "main", "paired_speedup": 0.9791251143764644, "raw_status": "discard", "reason": "", "runner_sample_count": 3, "sample_count": 16384, "seconds": 0.201941, "skipped": false, "status": "discard", "steps_per_sample": 8, "thread_execution_width": 32, "threadgroup_limit": 256, "threads_per_threadgroup": 256, "timestamp": "2026-06-22T13:26:26Z"}
{"affine_active_path": "all_active_fast", "affine_buffer": "resize_reuse", "affine_conversion": "batch", "affine_field_ops": "inplace", "affine_reverse_loop": "split_zero", "affine_tail_update": "skip_final", "affine_z_access": "const_ref", "affine_z_check": "infinity_flag", "architecture": "shared_tame", "avg_dp_count": 84.0, "backend": "macos_cpu", "budget_sec": 5, "candidate_verification": "full_point_collision", "commit": "b410166-dirty", "confirmation_index": 1, "confirmation_runs": 3, "confirmation_status": "discard", "correctness": true, "description": "Apple Silicon CPU shared-tame tiny multi-target kangaroo benchmark", "dp_bits": 0, "dp_bucket_storage": "inline_first", "dp_capacity": "max_load_2of3", "dp_clear": "empty_guard", "dp_hash": "partial_limb_mix", "dp_key": "x_parity", "dp_lookup": "open_address_linear", "dp_reserve": "sqrt_range_estimate", "ecint_carry_impl": "clang_builtin", "ecint_mul_final_sub": "single_conditional", "expected_private_key": "0x7", "experiment": "jacobian_kangaroo_multi_small", "field_rhs_passing": "const_ref", "found_private_key": "0x7", "found_target_index": 3, "iterations": 1660, "jacobian_step_passing": "const_ref", "jump_count": 8, "jump_index": "power2_mask", "jump_table": "precomputed", "last_dp_count": 84, "machine": "macOS-26.5-arm64-arm-64bit-Mach-O", "max_steps": 4096, "min_ms": 50, "operation": "jacobian_kangaroo_multi_small", "ops_per_sec": 33192.835658, "ops_per_sec_max": 33588.859919, "ops_per_sec_min": 31167.844541, "paired_baseline_ops_per_sec": 20529.829921, "paired_baseline_ref": "main", "paired_speedup": 1.616810065437853, "point_passing": "const_ref", "range_bits": 8, "range_context": "precomputed", "raw_status": "keep", "reason": "", "runner_sample_count": 3, "sample_count": 1, "scratch": "reused", "seconds": 0.050011, "single_target_ops_per_sec": 30517.761827, "skipped": false, "speedup_vs_single": 1.087656, "start_scalar": "0x2", "status": "discard", "tame_states": 1, "target_count": 4, "target_throughput_vs_single": 4.350625, "timestamp": "2026-06-22T14:31:18Z", "wild_starts": "precomputed", "wild_states": 4}
{"affine_active_path": "all_active_fast", "affine_buffer": "resize_reuse", "affine_conversion": "batch", "affine_field_ops": "inplace", "affine_reverse_loop": "split_zero", "affine_tail_update": "skip_final", "affine_z_access": "const_ref", "affine_z_check": "infinity_flag", "architecture": "shared_tame", "avg_dp_count": 84.0, "backend": "macos_cpu", "budget_sec": 5, "candidate_verification": "full_point_collision", "commit": "b410166-dirty", "confirmation_index": 2, "confirmation_runs": 3, "confirmation_status": "discard", "correctness": true, "description": "Apple Silicon CPU shared-tame tiny multi-target kangaroo benchmark", "dp_bits": 0, "dp_bucket_storage": "inline_first", "dp_capacity": "max_load_2of3", "dp_clear": "empty_guard", "dp_hash": "partial_limb_mix", "dp_key": "x_parity", "dp_lookup": "open_address_linear", "dp_reserve": "sqrt_range_estimate", "ecint_carry_impl": "clang_builtin", "ecint_mul_final_sub": "single_conditional", "expected_private_key": "0x7", "experiment": "jacobian_kangaroo_multi_small", "field_rhs_passing": "const_ref", "found_private_key": "0x7", "found_target_index": 3, "iterations": 1698, "jacobian_step_passing": "const_ref", "jump_count": 8, "jump_index": "power2_mask", "jump_table": "precomputed", "last_dp_count": 84, "machine": "macOS-26.5-arm64-arm-64bit-Mach-O", "max_steps": 4096, "min_ms": 50, "operation": "jacobian_kangaroo_multi_small", "ops_per_sec": 33942.067048, "ops_per_sec_max": 34245.217709, "ops_per_sec_min": 32276.557382, "paired_baseline_ops_per_sec": 33716.571699, "paired_baseline_ref": "main", "paired_speedup": 1.0066879678934464, "point_passing": "const_ref", "range_bits": 8, "range_context": "precomputed", "raw_status": "discard", "reason": "", "runner_sample_count": 3, "sample_count": 1, "scratch": "reused", "seconds": 0.050026, "single_target_ops_per_sec": 29385.307346, "skipped": false, "speedup_vs_single": 1.155069, "start_scalar": "0x2", "status": "discard", "tame_states": 1, "target_count": 4, "target_throughput_vs_single": 4.620277, "timestamp": "2026-06-22T14:31:18Z", "wild_starts": "precomputed", "wild_states": 4}
{"affine_active_path": "all_active_fast", "affine_buffer": "resize_reuse", "affine_conversion": "batch", "affine_field_ops": "inplace", "affine_reverse_loop": "split_zero", "affine_tail_update": "skip_final", "affine_z_access": "const_ref", "affine_z_check": "infinity_flag", "architecture": "shared_tame", "avg_dp_count": 84.0, "backend": "macos_cpu", "budget_sec": 5, "candidate_verification": "full_point_collision", "commit": "b410166-dirty", "confirmation_index": 3, "confirmation_runs": 3, "confirmation_status": "discard", "correctness": true, "description": "Apple Silicon CPU shared-tame tiny multi-target kangaroo benchmark", "dp_bits": 0, "dp_bucket_storage": "inline_first", "dp_capacity": "max_load_2of3", "dp_clear": "empty_guard", "dp_hash": "partial_limb_mix", "dp_key": "x_parity", "dp_lookup": "open_address_linear", "dp_reserve": "sqrt_range_estimate", "ecint_carry_impl": "clang_builtin", "ecint_mul_final_sub": "single_conditional", "expected_private_key": "0x7", "experiment": "jacobian_kangaroo_multi_small", "field_rhs_passing": "const_ref", "found_private_key": "0x7", "found_target_index": 3, "iterations": 1591, "jacobian_step_passing": "const_ref", "jump_count": 8, "jump_index": "power2_mask", "jump_table": "precomputed", "last_dp_count": 84, "machine": "macOS-26.5-arm64-arm-64bit-Mach-O", "max_steps": 4096, "min_ms": 50, "operation": "jacobian_kangaroo_multi_small", "ops_per_sec": 31808.178173, "ops_per_sec_max": 33877.854854, "ops_per_sec_min": 26794.679028, "paired_baseline_ops_per_sec": 33120.32123, "paired_baseline_ref": "main", "paired_speedup": 0.960382538324795, "point_passing": "const_ref", "range_bits": 8, "range_context": "precomputed", "raw_status": "discard", "reason": "", "runner_sample_count": 3, "sample_count": 1, "scratch": "reused", "seconds": 0.050019, "single_target_ops_per_sec": 25390.076542, "skipped": false, "speedup_vs_single": 1.25278, "start_scalar": "0x2", "status": "discard", "tame_states": 1, "target_count": 4, "target_throughput_vs_single": 5.01112, "timestamp": "2026-06-22T14:31:18Z", "wild_starts": "precomputed", "wild_states": 4}
