{"affine_scan_mode": "cpu_batch_prod_zz_zzz", "affine_scan_seconds": 0.008423, "backend": "metal", "budget_sec": 540, "bytes_per_target": 2.683818, "candidate_verification": "tag16_hash_filter_then_cpu_exact_key_equality", "commit": "d06499f-dirty", "confirmation_index": 2, "confirmation_runs": 2, "confirmation_status": "keep", "cooldown_sec": 10.0, "correctness": true, "description": "Fixed-round 25M target lookup with distinct round starts batched into one Metal walk dispatch", "distance_tracking": "packet_distance_uint64", "dp_bits": 6, "dp_checksum": "0x7f111e78c67b5c18", "dp_count": 4121, "dp_distance_checksum": "0x894123b96acf0de5", "dp_query_count": 4121, "dp_tracking": "affine_x256_y_parity_cpu_batch", "exact_host_table_bytes": 1268635456, "experiment": "metal_jacobian_dynamic_dp_stream_xyzz_affine_scan_target_lookup_tag16_hash_filter25m_rounds_batched_walk", "filter_false_positive_count": 0, "filter_positive_count": 131072, "gpu_lookup_lookups_per_sec": 14710486.148809, "gpu_ops_per_sec": 62154249.348561, "hit_count": 131072, "injected_hits": 128, "iterations": 536870912, "jump_count": 16, "jump_histogram_max_bucket": 33562777, "jump_histogram_max_deviation_ppm": 249, "jump_histogram_min_bucket": 33546500, "jump_index": "power2_mask", "jump_mixer": "avalanche64", "jump_schedule": "power2", "lookup_engine": "gpu_filter16_hash_repeat", "lookup_engine_effective": "gpu_filter16_hash_repeat", "lookup_exact_seconds": 0.025752, "lookup_gpu_seconds": 0.286864, "lookup_hash_seconds": 4.1e-05, "lookup_layout": "open_address_tag16_hash_filter_exact256", "lookup_max_threads_per_threadgroup": 1024, "lookup_query_mode": "repeat", "lookup_repeat": 1024, "lookup_seconds": 0.312656, "lookup_thread_execution_width": 32, "lookup_threadgroup_limit": 512, "lookup_threads_per_threadgroup": 512, "lookups_per_sec": 13496958.703008, "machine": "macOS-26.5-arm64-arm-64bit-Mach-O", "max_threads_per_threadgroup": 1024, "min_ms": 0, "miss_count": 4088832, "operation": "jacobian_affine_scan_target_lookup_tag32_rounds", "ops_per_sec": 59926669.794161, "ops_per_sec_max": 121142080.848209, "ops_per_sec_min": 49425113.032575, "output_layout": "affine_dp_scan_target_lookup", "paired_baseline_ops_per_sec": 52718596.332662, "paired_baseline_ref": "HEAD", "paired_order": "alternate", "paired_speedup": 1.1367273403110927, "physical_filter_positive_count": 131072, "physical_query_count": 4219904, "query_count": 4219904, "query_input": "hash64_repeat_indexed", "raw_status": "keep", "reason": "", "repeat_positive_index_encoding": "base_query_count_repeated", "requested_hits": 64, "round_count": 2, "runner_sample_count": 3, "sample_count": 131072, "seconds": 8.637719, "setup_inclusive_ops_per_sec": 54446948.269169, "setup_inclusive_seconds": 9.860441, "skipped": false, "state_layout": "xyzz", "status": "keep", "steps_per_sample": 2048, "target_bucket_bytes": 268435456, "target_build_seconds": 0.901643, "target_count": 25005000, "target_filter_bucket_bytes": 67108864, "target_filter_build_seconds": 0.0, "target_key": "x256_y_parity", "target_key_bytes": 1000200000, "target_lookup_checksum": "0x923b46f156f9d59b", "target_query_hash_bytes": 32968, "target_table_buckets": 33554432, "target_table_bytes": 67108864, "thread_execution_width": 32, "threadgroup_limit": 128, "threads_per_threadgroup": 128, "timestamp": "2026-06-30T21:49:39Z", "validation_seconds": 23.088652, "validation_workers": 8}
{"affine_scan_mode": "cpu_batch_prod_zz_zzz", "affine_scan_seconds": 0.005862, "backend": "metal", "budget_sec": 540, "bytes_per_target": 2.683818, "candidate_verification": "tag16_hash_filter_then_cpu_exact_key_equality", "commit": "147f940-dirty", "confirmation_index": 1, "confirmation_runs": 2, "confirmation_status": "keep", "cooldown_sec": 10.0, "correctness": true, "description": "Fixed-round 25M target lookup with distinct round starts batched into one Metal walk dispatch", "distance_tracking": "packet_distance_uint64", "dp_bits": 6, "dp_checksum": "0x7f111e78c67b5c18", "dp_count": 4121, "dp_distance_checksum": "0x894123b96acf0de5", "dp_query_count": 4121, "dp_tracking": "affine_x256_y_parity_cpu_batch", "exact_host_table_bytes": 1068595456, "experiment": "metal_jacobian_dynamic_dp_stream_xyzz_affine_scan_target_lookup_tag16_hash_filter25m_rounds_batched_walk", "filter_false_positive_count": 0, "filter_positive_count": 131072, "gpu_lookup_lookups_per_sec": 179990680.365321, "gpu_ops_per_sec": 121089996.922472, "hit_count": 131072, "injected_hits": 128, "iterations": 536870912, "jump_count": 16, "jump_histogram_max_bucket": 33562777, "jump_histogram_max_deviation_ppm": 249, "jump_histogram_min_bucket": 33546500, "jump_index": "power2_mask", "jump_mixer": "avalanche64", "jump_schedule": "power2", "lookup_engine": "gpu_filter16_hash_repeat", "lookup_engine_effective": "gpu_filter16_hash_repeat", "lookup_exact_seconds": 9e-06, "lookup_gpu_seconds": 0.023445, "lookup_hash_seconds": 2.3e-05, "lookup_layout": "open_address_tag16_hash_filter_exact256", "lookup_max_threads_per_threadgroup": 1024, "lookup_query_mode": "repeat", "lookup_repeat": 1024, "lookup_seconds": 0.023477, "lookup_thread_execution_width": 32, "lookup_threadgroup_limit": 512, "lookup_threads_per_threadgroup": 512, "lookups_per_sec": 179744712.403621, "machine": "macOS-26.5-arm64-arm-64bit-Mach-O", "max_threads_per_threadgroup": 1024, "min_ms": 0, "miss_count": 4088832, "operation": "jacobian_affine_scan_target_lookup_tag32_rounds", "ops_per_sec": 120293962.488858, "ops_per_sec_max": 126394094.214986, "ops_per_sec_min": 41202807.422387, "output_layout": "affine_dp_scan_target_lookup", "paired_baseline_ops_per_sec": 67114963.416265, "paired_baseline_ref": "HEAD", "paired_order": "alternate", "paired_speedup": 1.792356821276391, "physical_filter_positive_count": 131072, "physical_query_count": 4219904, "query_count": 4219904, "query_input": "hash64_repeat_indexed", "raw_status": "keep", "reason": "", "repeat_positive_index_encoding": "base_query_count_repeated", "requested_hits": 64, "round_count": 2, "runner_sample_count": 3, "sample_count": 131072, "seconds": 4.433652, "setup_inclusive_ops_per_sec": 95877029.312246, "setup_inclusive_seconds": 5.599578, "skipped": false, "state_layout": "xyzz", "status": "keep", "steps_per_sample": 2048, "target_bucket_bytes": 268435456, "target_build_seconds": 1.136587, "target_count": 25005000, "target_filter_bucket_bytes": 67108864, "target_filter_build_seconds": 0.0, "target_key": "x256_y_parity", "target_key_bytes": 800160000, "target_lookup_checksum": "0x923b46f156f9d59b", "target_query_hash_bytes": 32968, "target_table_buckets": 33554432, "target_table_bytes": 67108864, "thread_execution_width": 32, "threadgroup_limit": 128, "threads_per_threadgroup": 128, "timestamp": "2026-06-30T22:33:32Z", "validation_seconds": 17.835092, "validation_workers": 8}
{"affine_scan_mode": "cpu_batch_prod_zz_zzz", "affine_scan_seconds": 0.006095, "backend": "metal", "budget_sec": 540, "bytes_per_target": 2.683818, "candidate_verification": "tag16_hash_filter_then_cpu_exact_key_equality", "commit": "147f940-dirty", "confirmation_index": 2, "confirmation_runs": 2, "confirmation_status": "keep", "cooldown_sec": 10.0, "correctness": true, "description": "Fixed-round 25M target lookup with distinct round starts batched into one Metal walk dispatch", "distance_tracking": "packet_distance_uint64", "dp_bits": 6, "dp_checksum": "0x7f111e78c67b5c18", "dp_count": 4121, "dp_distance_checksum": "0x894123b96acf0de5", "dp_query_count": 4121, "dp_tracking": "affine_x256_y_parity_cpu_batch", "exact_host_table_bytes": 1068595456, "experiment": "metal_jacobian_dynamic_dp_stream_xyzz_affine_scan_target_lookup_tag16_hash_filter25m_rounds_batched_walk", "filter_false_positive_count": 0, "filter_positive_count": 131072, "gpu_lookup_lookups_per_sec": 179047526.107272, "gpu_ops_per_sec": 59826285.09789, "hit_count": 131072, "injected_hits": 128, "iterations": 536870912, "jump_count": 16, "jump_histogram_max_bucket": 33562777, "jump_histogram_max_deviation_ppm": 249, "jump_histogram_min_bucket": 33546500, "jump_index": "power2_mask", "jump_mixer": "avalanche64", "jump_schedule": "power2", "lookup_engine": "gpu_filter16_hash_repeat", "lookup_engine_effective": "gpu_filter16_hash_repeat", "lookup_exact_seconds": 3.1e-05, "lookup_gpu_seconds": 0.023569, "lookup_hash_seconds": 3.9e-05, "lookup_layout": "open_address_tag16_hash_filter_exact256", "lookup_max_threads_per_threadgroup": 1024, "lookup_query_mode": "repeat", "lookup_repeat": 1024, "lookup_seconds": 0.023638, "lookup_thread_execution_width": 32, "lookup_threadgroup_limit": 512, "lookup_threads_per_threadgroup": 512, "lookups_per_sec": 178522040.781792, "machine": "macOS-26.5-arm64-arm-64bit-Mach-O", "max_threads_per_threadgroup": 1024, "min_ms": 0, "miss_count": 4088832, "operation": "jacobian_affine_scan_target_lookup_tag32_rounds", "ops_per_sec": 59628720.52035, "ops_per_sec_max": 125514469.697855, "ops_per_sec_min": 46477794.265288, "output_layout": "affine_dp_scan_target_lookup", "paired_baseline_ops_per_sec": 58353738.362171, "paired_baseline_ref": "HEAD", "paired_order": "alternate", "paired_speedup": 1.0218491941384433, "physical_filter_positive_count": 131072, "physical_query_count": 4219904, "query_count": 4219904, "query_input": "hash64_repeat_indexed", "raw_status": "keep", "reason": "", "repeat_positive_index_encoding": "base_query_count_repeated", "requested_hits": 64, "round_count": 2, "runner_sample_count": 3, "sample_count": 131072, "seconds": 8.97383, "setup_inclusive_ops_per_sec": 51729122.776727, "setup_inclusive_seconds": 10.378504, "skipped": false, "state_layout": "xyzz", "status": "keep", "steps_per_sample": 2048, "target_bucket_bytes": 268435456, "target_build_seconds": 1.374942, "target_count": 25005000, "target_filter_bucket_bytes": 67108864, "target_filter_build_seconds": 0.0, "target_key": "x256_y_parity", "target_key_bytes": 800160000, "target_lookup_checksum": "0x923b46f156f9d59b", "target_query_hash_bytes": 32968, "target_table_buckets": 33554432, "target_table_bytes": 67108864, "thread_execution_width": 32, "threadgroup_limit": 128, "threads_per_threadgroup": 128, "timestamp": "2026-06-30T22:33:32Z", "validation_seconds": 23.066833, "validation_workers": 8}
{"affine_scan_mode": "cpu_batch_prod_zz_zzz", "affine_scan_seconds": 0.004647, "backend": "metal", "budget_sec": 540, "bytes_per_target": 2.683818, "candidate_verification": "tag16_hash_filter_then_cpu_exact_key_equality", "commit": "b5864aa-dirty", "confirmation_index": 1, "confirmation_runs": 2, "confirmation_status": "keep", "cooldown_sec": 10.0, "correctness": true, "description": "Fixed-round 25M target lookup setup-inclusive gate for compact target table build changes", "distance_tracking": "packet_distance_uint64", "dp_bits": 6, "dp_checksum": "0x7f111e78c67b5c18", "dp_count": 4121, "dp_distance_checksum": "0x894123b96acf0de5", "dp_query_count": 4121, "dp_tracking": "affine_x256_y_parity_cpu_batch", "exact_host_table_bytes": 1068595456, "experiment": "metal_jacobian_dynamic_dp_stream_xyzz_affine_scan_target_lookup_tag16_hash_filter25m_rounds_setup_inclusive", "filter_false_positive_count": 0, "filter_positive_count": 131072, "gpu_lookup_lookups_per_sec": 141015610.850081, "gpu_ops_per_sec": 127100656.575493, "hit_count": 131072, "injected_hits": 128, "iterations": 536870912, "jump_count": 16, "jump_histogram_max_bucket": 33562777, "jump_histogram_max_deviation_ppm": 249, "jump_histogram_min_bucket": 33546500, "jump_index": "power2_mask", "jump_mixer": "avalanche64", "jump_schedule": "power2", "lookup_engine": "gpu_filter16_hash_repeat", "lookup_engine_effective": "gpu_filter16_hash_repeat", "lookup_exact_seconds": 1.8e-05, "lookup_gpu_seconds": 0.029925, "lookup_hash_seconds": 2.9e-05, "lookup_layout": "open_address_tag16_hash_filter_exact256", "lookup_max_threads_per_threadgroup": 1024, "lookup_query_mode": "repeat", "lookup_repeat": 1024, "lookup_seconds": 0.029972, "lookup_thread_execution_width": 32, "lookup_threadgroup_limit": 512, "lookup_threads_per_threadgroup": 512, "lookups_per_sec": 140794875.216869, "machine": "macOS-26.5-arm64-arm-64bit-Mach-O", "max_threads_per_threadgroup": 1024, "min_ms": 0, "miss_count": 4088832, "operation": "jacobian_affine_scan_target_lookup_tag32_rounds", "ops_per_sec": 109975306.448799, "ops_per_sec_max": 111828363.95145, "ops_per_sec_min": 109217500.769233, "output_layout": "affine_dp_scan_target_lookup", "paired_baseline_ops_per_sec": 105596316.168534, "paired_baseline_ref": "HEAD", "paired_order": "alternate", "paired_speedup": 1.0414691576292874, "physical_filter_positive_count": 131072, "physical_query_count": 4219904, "query_count": 4219904, "query_input": "hash64_repeat_indexed", "raw_status": "keep", "reason": "", "repeat_positive_index_encoding": "base_query_count_repeated", "requested_hits": 64, "round_count": 2, "runner_sample_count": 3, "sample_count": 131072, "seconds": 4.223982, "setup_inclusive_ops_per_sec": 109975306.448799, "setup_inclusive_ops_per_sec_max": 111828363.95145, "setup_inclusive_ops_per_sec_min": 109217500.769233, "setup_inclusive_seconds": 4.881741, "skipped": false, "state_layout": "xyzz", "status": "keep", "steps_per_sample": 2048, "target_bucket_bytes": 268435456, "target_build_seconds": 0.623139, "target_count": 25005000, "target_filter_bucket_bytes": 67108864, "target_filter_build_seconds": 0.0, "target_key": "x256_y_parity", "target_key_bytes": 800160000, "target_lookup_checksum": "0x923b46f156f9d59b", "target_query_hash_bytes": 32968, "target_table_buckets": 33554432, "target_table_bytes": 67108864, "thread_execution_width": 32, "threadgroup_limit": 128, "threads_per_threadgroup": 128, "timestamp": "2026-06-30T22:58:05Z", "validation_seconds": 15.025038, "validation_workers": 8}
{"affine_scan_mode": "cpu_batch_prod_zz_zzz", "affine_scan_seconds": 0.011331, "backend": "metal", "budget_sec": 540, "bytes_per_target": 2.683818, "candidate_verification": "tag16_hash_filter_then_cpu_exact_key_equality", "commit": "b5864aa-dirty", "confirmation_index": 2, "confirmation_runs": 2, "confirmation_status": "keep", "cooldown_sec": 10.0, "correctness": true, "description": "Fixed-round 25M target lookup setup-inclusive gate for compact target table build changes", "distance_tracking": "packet_distance_uint64", "dp_bits": 6, "dp_checksum": "0x7f111e78c67b5c18", "dp_count": 4121, "dp_distance_checksum": "0x894123b96acf0de5", "dp_query_count": 4121, "dp_tracking": "affine_x256_y_parity_cpu_batch", "exact_host_table_bytes": 1068595456, "experiment": "metal_jacobian_dynamic_dp_stream_xyzz_affine_scan_target_lookup_tag16_hash_filter25m_rounds_setup_inclusive", "filter_false_positive_count": 0, "filter_positive_count": 131072, "gpu_lookup_lookups_per_sec": 275713858.693433, "gpu_ops_per_sec": 74909488.695854, "hit_count": 131072, "injected_hits": 128, "iterations": 536870912, "jump_count": 16, "jump_histogram_max_bucket": 33562777, "jump_histogram_max_deviation_ppm": 249, "jump_histogram_min_bucket": 33546500, "jump_index": "power2_mask", "jump_mixer": "avalanche64", "jump_schedule": "power2", "lookup_engine": "gpu_filter16_hash_repeat", "lookup_engine_effective": "gpu_filter16_hash_repeat", "lookup_exact_seconds": 4.1e-05, "lookup_gpu_seconds": 0.015305, "lookup_hash_seconds": 6.7e-05, "lookup_layout": "open_address_tag16_hash_filter_exact256", "lookup_max_threads_per_threadgroup": 1024, "lookup_query_mode": "repeat", "lookup_repeat": 1024, "lookup_seconds": 0.015413, "lookup_thread_execution_width": 32, "lookup_threadgroup_limit": 512, "lookup_threads_per_threadgroup": 512, "lookups_per_sec": 273784907.477736, "machine": "macOS-26.5-arm64-arm-64bit-Mach-O", "max_threads_per_threadgroup": 1024, "min_ms": 0, "miss_count": 4088832, "operation": "jacobian_affine_scan_target_lookup_tag32_rounds", "ops_per_sec": 62857296.634462, "ops_per_sec_max": 77897439.935564, "ops_per_sec_min": 53432634.085541, "output_layout": "affine_dp_scan_target_lookup", "paired_baseline_ops_per_sec": 55923899.198912, "paired_baseline_ref": "HEAD", "paired_order": "alternate", "paired_speedup": 1.123979149073441, "physical_filter_positive_count": 131072, "physical_query_count": 4219904, "query_count": 4219904, "query_input": "hash64_repeat_indexed", "raw_status": "keep", "reason": "", "repeat_positive_index_encoding": "base_query_count_repeated", "requested_hits": 64, "round_count": 2, "runner_sample_count": 3, "sample_count": 131072, "seconds": 7.166928, "setup_inclusive_ops_per_sec": 62857296.634462, "setup_inclusive_ops_per_sec_max": 77897439.935564, "setup_inclusive_ops_per_sec_min": 53432634.085541, "setup_inclusive_seconds": 8.541107, "skipped": false, "state_layout": "xyzz", "status": "keep", "steps_per_sample": 2048, "target_bucket_bytes": 268435456, "target_build_seconds": 1.347435, "target_count": 25005000, "target_filter_bucket_bytes": 67108864, "target_filter_build_seconds": 0.0, "target_key": "x256_y_parity", "target_key_bytes": 800160000, "target_lookup_checksum": "0x923b46f156f9d59b", "target_query_hash_bytes": 32968, "target_table_buckets": 33554432, "target_table_bytes": 67108864, "thread_execution_width": 32, "threadgroup_limit": 128, "threads_per_threadgroup": 128, "timestamp": "2026-06-30T22:58:05Z", "validation_seconds": 27.833574, "validation_workers": 8}
{"affine_scan_mode": "cpu_batch_prod_zz_zzz", "affine_scan_seconds": 0.004929, "backend": "metal", "budget_sec": 540, "bytes_per_target": 2.683818, "candidate_verification": "tag16_hash_filter_then_cpu_exact_key_equality", "commit": "6e8f49f-dirty", "confirmation_index": 1, "confirmation_runs": 2, "confirmation_status": "discard", "cooldown_sec": 10.0, "correctness": true, "description": "Fixed-round 25M target lookup setup-inclusive gate for compact target table build changes", "distance_tracking": "packet_distance_uint64", "dp_bits": 6, "dp_checksum": "0x7f111e78c67b5c18", "dp_count": 4121, "dp_distance_checksum": "0x894123b96acf0de5", "dp_query_count": 4121, "dp_tracking": "affine_x256_y_parity_cpu_batch", "exact_host_table_bytes": 1068595456, "experiment": "metal_jacobian_dynamic_dp_stream_xyzz_affine_scan_target_lookup_tag16_hash_filter25m_rounds_setup_inclusive", "filter_false_positive_count": 0, "filter_positive_count": 131072, "gpu_lookup_lookups_per_sec": 276239522.134032, "gpu_ops_per_sec": 127592260.631234, "hit_count": 131072, "injected_hits": 128, "iterations": 536870912, "jump_count": 16, "jump_histogram_max_bucket": 33562777, "jump_histogram_max_deviation_ppm": 249, "jump_histogram_min_bucket": 33546500, "jump_index": "power2_mask", "jump_mixer": "avalanche64", "jump_schedule": "power2", "lookup_engine": "gpu_filter16_hash_repeat", "lookup_engine_effective": "gpu_filter16_hash_repeat", "lookup_exact_seconds": 1.5e-05, "lookup_gpu_seconds": 0.015276, "lookup_hash_seconds": 0.000206, "lookup_layout": "open_address_tag16_hash_filter_exact256", "lookup_max_threads_per_threadgroup": 1024, "lookup_query_mode": "repeat", "lookup_repeat": 1024, "lookup_seconds": 0.015498, "lookup_thread_execution_width": 32, "lookup_threadgroup_limit": 512, "lookup_threads_per_threadgroup": 512, "lookups_per_sec": 272294331.316051, "machine": "macOS-26.5-arm64-arm-64bit-Mach-O", "max_threads_per_threadgroup": 1024, "min_ms": 0, "miss_count": 4088832, "operation": "jacobian_affine_scan_target_lookup_tag32_rounds", "ops_per_sec": 104431906.564908, "ops_per_sec_max": 110089271.927335, "ops_per_sec_min": 103308401.039545, "output_layout": "affine_dp_scan_target_lookup", "paired_baseline_ops_per_sec": 110311024.03291, "paired_baseline_ref": "HEAD", "paired_order": "alternate", "paired_speedup": 0.9467041710514079, "physical_filter_positive_count": 131072, "physical_query_count": 4219904, "query_count": 4219904, "query_input": "hash64_repeat_indexed", "raw_status": "discard", "reason": "", "repeat_positive_index_encoding": "base_query_count_repeated", "requested_hits": 64, "round_count": 2, "runner_sample_count": 3, "sample_count": 131072, "seconds": 4.207707, "setup_inclusive_ops_per_sec": 104431906.564908, "setup_inclusive_ops_per_sec_max": 110089271.927335, "setup_inclusive_ops_per_sec_min": 103308401.039545, "setup_inclusive_seconds": 5.140871, "skipped": false, "state_layout": "xyzz", "status": "discard", "steps_per_sample": 2048, "target_bucket_bytes": 268435456, "target_build_seconds": 0.912736, "target_count": 25005000, "target_filter_bucket_bytes": 67108864, "target_filter_build_seconds": 0.0, "target_key": "x256_y_parity", "target_key_bytes": 800160000, "target_lookup_checksum": "0x923b46f156f9d59b", "target_query_hash_bytes": 32968, "target_table_buckets": 33554432, "target_table_bytes": 67108864, "thread_execution_width": 32, "threadgroup_limit": 128, "threads_per_threadgroup": 128, "timestamp": "2026-06-30T23:20:10Z", "validation_seconds": 16.087013, "validation_workers": 8}
