{"all_keys_found": true, "backend": "macos_cpu", "budget_sec": 240, "candidate_verification": "prehashed_serial_vs_parallel_semantic_find_all_keys", "commit": "a9db816-dirty", "confirmation_index": 2, "confirmation_runs": 2, "confirmation_status": "keep", "cooldown_sec": 5.0, "correctness": true, "description": "Host setup benchmark testing RCK_VALIDATION_WORKERS=6 for 25M tag32 parallel insert on Apple Silicon", "experiment": "target_lookup_tag32_parallel_insert_workers6", "injected_count": 64, "iterations": 1, "lookup_layout": "open_address_tag32_index_exact256", "machine": "macOS-26.5-arm64-arm-64bit-Mach-O", "min_ms": 0, "operation": "target_lookup_tag32_parallel_insert_probe", "ops_per_sec": 26108366.758003, "ops_per_sec_max": 28948281.897936, "ops_per_sec_min": 15554842.655852, "paired_baseline_ops_per_sec": 17709310.747145, "paired_baseline_ref": "main", "paired_order": "alternate", "paired_speedup": 1.4742734559679038, "parallel_checksum": "0x94c84f7c9bd314a6", "parallel_seconds": 0.957739, "parallel_targets_per_sec": 26108366.758003, "parallel_targets_per_sec_max": 28948281.897936, "parallel_targets_per_sec_min": 15554842.655852, "raw_status": "keep", "reason": "", "runner_sample_count": 3, "sample_count": 25005000, "seconds": 0.957739, "serial_checksum": "0x0875f90b516f7503", "serial_seconds": 1.624425, "serial_targets_per_sec": 15393141.091258, "setup_phase": "host_tag32_parallel_insert_probe", "skipped": false, "speedup": 1.696104, "status": "keep", "target_bucket_bytes": 268435456, "target_count": 25005000, "target_key": "x256_y_parity", "target_key_bytes": 1000200000, "target_keys_equal": true, "target_table_buckets": 33554432, "target_table_bytes": 1268635456, "timestamp": "2026-06-29T14:28:45Z"}
{"affine_scan_mode": "cpu_batch_prod_zz_zzz", "affine_scan_seconds": 0.011451, "backend": "metal", "budget_sec": 480, "bytes_per_target": 2.683818, "candidate_verification": "tag16_hash_filter_then_cpu_exact_key_equality", "commit": "ffad75f-dirty", "confirmation_index": 1, "confirmation_runs": 2, "confirmation_status": "discard", "cooldown_sec": 10.0, "correctness": true, "description": "Metal XYZZ 1024-step dp7 25M-target setup gate with RCK_VALIDATION_WORKERS=6 versus default worker count", "distance_tracking": "packet_distance_uint64", "dp_bits": 7, "dp_checksum": "0x08b06faea04109e6", "dp_count": 1999, "dp_distance_checksum": "0x33b34eda684bc0e5", "dp_query_count": 1999, "dp_tracking": "affine_x256_y_parity_cpu_batch", "exact_host_table_bytes": 1268635456, "experiment": "metal_jacobian_dynamic_dp_stream_xyzz_affine_scan_target_lookup_tag16_hash_filter25m_steps1024_dp7_setup_workers6", "filter_false_positive_count": 0, "filter_positive_count": 65536, "gpu_lookup_lookups_per_sec": 72234314.348225, "gpu_ops_per_sec": 38681129.13012, "hit_count": 65536, "injected_hits": 64, "iterations": 268435456, "jump_count": 16, "jump_histogram_max_bucket": 16782744, "jump_histogram_max_deviation_ppm": 389, "jump_histogram_min_bucket": 16770687, "jump_index": "power2_mask", "jump_mixer": "avalanche64", "jump_schedule": "power2", "lookup_engine": "gpu_filter16_hash_repeat", "lookup_engine_effective": "gpu_filter16_hash_repeat", "lookup_exact_seconds": 0.025362, "lookup_gpu_seconds": 0.028338, "lookup_hash_seconds": 7.6e-05, "lookup_layout": "open_address_tag16_hash_filter_exact256", "lookup_max_threads_per_threadgroup": 1024, "lookup_query_mode": "repeat", "lookup_repeat": 1024, "lookup_seconds": 0.053776, "lookup_thread_execution_width": 32, "lookup_threadgroup_limit": 512, "lookup_threads_per_threadgroup": 512, "lookups_per_sec": 38064861.648319, "machine": "macOS-26.5-arm64-arm-64bit-Mach-O", "max_threads_per_threadgroup": 1024, "min_ms": 500, "miss_count": 1981440, "operation": "jacobian_affine_scan_target_lookup_tag32", "ops_per_sec": 25890541.312106, "ops_per_sec_max": 80136332.969525, "ops_per_sec_min": 22198149.568224, "output_layout": "affine_dp_scan_target_lookup", "paired_baseline_ops_per_sec": 34477728.50283, "paired_baseline_ref": "main", "paired_order": "alternate", "paired_speedup": 0.75093523954111, "query_count": 2046976, "query_input": "hash64_repeat_indexed", "raw_status": "discard", "reason": "", "repeat_positive_index_encoding": "packed16_base_repeat", "requested_hits": 64, "runner_sample_count": 3, "sample_count": 262144, "seconds": 6.939701, "setup_inclusive_ops_per_sec": 25890541.312106, "setup_inclusive_ops_per_sec_max": 80136332.969525, "setup_inclusive_ops_per_sec_min": 22198149.568224, "setup_inclusive_seconds": 10.36809, "skipped": false, "state_layout": "xyzz", "status": "discard", "steps_per_sample": 1024, "target_bucket_bytes": 268435456, "target_build_seconds": 3.309893, "target_count": 25005000, "target_filter_bucket_bytes": 67108864, "target_filter_build_seconds": 0.053269, "target_key": "x256_y_parity", "target_key_bytes": 1000200000, "target_lookup_checksum": "0x4bfc0bfe896fe3ad", "target_query_hash_bytes": 15992, "target_table_buckets": 33554432, "target_table_bytes": 67108864, "thread_execution_width": 32, "threadgroup_limit": 128, "threads_per_threadgroup": 128, "timestamp": "2026-06-29T14:39:46Z", "validation_seconds": 18.118181, "validation_workers": 6}
{"affine_scan_mode": "cpu_batch_prod_zz_zzz", "affine_scan_seconds": 0.005295, "backend": "metal", "budget_sec": 480, "bytes_per_target": 2.683818, "candidate_verification": "tag16_hash_filter_then_cpu_exact_key_equality", "commit": "ffad75f-dirty", "confirmation_index": 2, "confirmation_runs": 2, "confirmation_status": "discard", "cooldown_sec": 10.0, "correctness": true, "description": "Metal XYZZ 1024-step dp7 25M-target setup gate with RCK_VALIDATION_WORKERS=6 versus default worker count", "distance_tracking": "packet_distance_uint64", "dp_bits": 7, "dp_checksum": "0x08b06faea04109e6", "dp_count": 1999, "dp_distance_checksum": "0x33b34eda684bc0e5", "dp_query_count": 1999, "dp_tracking": "affine_x256_y_parity_cpu_batch", "exact_host_table_bytes": 1268635456, "experiment": "metal_jacobian_dynamic_dp_stream_xyzz_affine_scan_target_lookup_tag16_hash_filter25m_steps1024_dp7_setup_workers6", "filter_false_positive_count": 0, "filter_positive_count": 65536, "gpu_lookup_lookups_per_sec": 148040608.586384, "gpu_ops_per_sec": 91048555.70271, "hit_count": 65536, "injected_hits": 64, "iterations": 268435456, "jump_count": 16, "jump_histogram_max_bucket": 16782744, "jump_histogram_max_deviation_ppm": 389, "jump_histogram_min_bucket": 16770687, "jump_index": "power2_mask", "jump_mixer": "avalanche64", "jump_schedule": "power2", "lookup_engine": "gpu_filter16_hash_repeat", "lookup_engine_effective": "gpu_filter16_hash_repeat", "lookup_exact_seconds": 0.000616, "lookup_gpu_seconds": 0.013827, "lookup_hash_seconds": 1.1e-05, "lookup_layout": "open_address_tag16_hash_filter_exact256", "lookup_max_threads_per_threadgroup": 1024, "lookup_query_mode": "repeat", "lookup_repeat": 1024, "lookup_seconds": 0.014454, "lookup_thread_execution_width": 32, "lookup_threadgroup_limit": 512, "lookup_threads_per_threadgroup": 512, "lookups_per_sec": 141617586.522995, "machine": "macOS-26.5-arm64-arm-64bit-Mach-O", "max_threads_per_threadgroup": 1024, "min_ms": 500, "miss_count": 1981440, "operation": "jacobian_affine_scan_target_lookup_tag32", "ops_per_sec": 74730044.051988, "ops_per_sec_max": 91080148.692767, "ops_per_sec_min": 46746272.432604, "output_layout": "affine_dp_scan_target_lookup", "paired_baseline_ops_per_sec": 80588312.832022, "paired_baseline_ref": "main", "paired_order": "alternate", "paired_speedup": 0.9273062237666528, "query_count": 2046976, "query_input": "hash64_repeat_indexed", "raw_status": "discard", "reason": "", "repeat_positive_index_encoding": "packed16_base_repeat", "requested_hits": 64, "runner_sample_count": 3, "sample_count": 262144, "seconds": 2.948267, "setup_inclusive_ops_per_sec": 74730044.051988, "setup_inclusive_ops_per_sec_max": 91080148.692767, "setup_inclusive_ops_per_sec_min": 46746272.432604, "setup_inclusive_seconds": 3.592069, "skipped": false, "state_layout": "xyzz", "status": "discard", "steps_per_sample": 1024, "target_bucket_bytes": 268435456, "target_build_seconds": 0.592121, "target_count": 25005000, "target_filter_bucket_bytes": 67108864, "target_filter_build_seconds": 0.031931, "target_key": "x256_y_parity", "target_key_bytes": 1000200000, "target_lookup_checksum": "0x4bfc0bfe896fe3ad", "target_query_hash_bytes": 15992, "target_table_buckets": 33554432, "target_table_bytes": 67108864, "thread_execution_width": 32, "threadgroup_limit": 128, "threads_per_threadgroup": 128, "timestamp": "2026-06-29T14:39:46Z", "validation_seconds": 10.320273, "validation_workers": 6}
{"affine_scan_mode": "cpu_batch_prod_zz_zzz", "affine_scan_seconds": 0.003846, "backend": "metal", "budget_sec": 360, "bytes_per_target": 2.683818, "candidate_verification": "tag16_hash_filter_then_cpu_exact_key_equality", "commit": "1e00829-dirty", "cooldown_sec": 10.0, "correctness": true, "description": "Metal XYZZ 2048-step dp6 affine-scan target lookup versus accepted 1024-step dp7 setup gate", "distance_tracking": "packet_distance_uint64", "dp_bits": 6, "dp_checksum": "0x54ccada61fd1edbc", "dp_count": 2087, "dp_distance_checksum": "0xf31d7766e1607041", "dp_query_count": 2087, "dp_tracking": "affine_x256_y_parity_cpu_batch", "exact_host_table_bytes": 1268635456, "experiment": "metal_jacobian_dynamic_dp_stream_xyzz_affine_scan_target_lookup_tag16_hash_filter25m_steps2048_dp6_setup", "filter_false_positive_count": 0, "filter_positive_count": 65536, "gpu_lookup_lookups_per_sec": 549021179.476034, "gpu_ops_per_sec": 120697860.259055, "hit_count": 65536, "injected_hits": 64, "iterations": 268435456, "jump_count": 16, "jump_histogram_max_bucket": 16782260, "jump_histogram_max_deviation_ppm": 346, "jump_histogram_min_bucket": 16771410, "jump_index": "power2_mask", "jump_mixer": "avalanche64", "jump_schedule": "power2", "lookup_engine": "gpu_filter16_hash_repeat", "lookup_engine_effective": "gpu_filter16_hash_repeat", "lookup_exact_seconds": 0.00076, "lookup_gpu_seconds": 0.003893, "lookup_hash_seconds": 1.3e-05, "lookup_layout": "open_address_tag16_hash_filter_exact256", "lookup_max_threads_per_threadgroup": 1024, "lookup_query_mode": "repeat", "lookup_repeat": 1024, "lookup_seconds": 0.004665, "lookup_thread_execution_width": 32, "lookup_threadgroup_limit": 512, "lookup_threads_per_threadgroup": 512, "lookups_per_sec": 458090614.609252, "machine": "macOS-26.5-arm64-arm-64bit-Mach-O", "max_threads_per_threadgroup": 1024, "min_ms": 500, "miss_count": 2071552, "operation": "jacobian_affine_scan_target_lookup_tag32", "ops_per_sec": 89036615.161581, "ops_per_sec_max": 94290153.743703, "ops_per_sec_min": 65651630.986689, "output_layout": "affine_dp_scan_target_lookup", "paired_baseline_ops_per_sec": 80299073.391548, "paired_baseline_ref": "main", "paired_order": "alternate", "paired_speedup": 1.108812485636387, "query_count": 2137088, "query_input": "hash64_repeat_indexed", "reason": "", "repeat_positive_index_encoding": "packed16_base_repeat", "requested_hits": 64, "runner_sample_count": 3, "sample_count": 131072, "seconds": 2.224028, "setup_inclusive_ops_per_sec": 89036615.161581, "setup_inclusive_ops_per_sec_max": 94290153.743703, "setup_inclusive_ops_per_sec_min": 65651630.986689, "setup_inclusive_seconds": 3.014888, "skipped": false, "state_layout": "xyzz", "status": "keep", "steps_per_sample": 2048, "target_bucket_bytes": 268435456, "target_build_seconds": 0.759161, "target_count": 25005000, "target_filter_bucket_bytes": 67108864, "target_filter_build_seconds": 0.023188, "target_key": "x256_y_parity", "target_key_bytes": 1000200000, "target_lookup_checksum": "0x197ac7fed54a4156", "target_query_hash_bytes": 16696, "target_table_buckets": 33554432, "target_table_bytes": 67108864, "thread_execution_width": 32, "threadgroup_limit": 128, "threads_per_threadgroup": 128, "timestamp": "2026-06-29T14:49:12Z", "validation_seconds": 9.407366, "validation_workers": 8}
{"affine_scan_mode": "cpu_batch_prod_zz_zzz", "affine_scan_seconds": 0.00266, "backend": "metal", "budget_sec": 540, "bytes_per_target": 2.683818, "candidate_verification": "tag16_hash_filter_then_cpu_exact_key_equality", "commit": "1e00829-dirty", "confirmation_index": 1, "confirmation_runs": 2, "confirmation_status": "keep", "cooldown_sec": 10.0, "correctness": true, "description": "Metal XYZZ 2048-step dp6 affine-scan target lookup versus accepted 1024-step dp7 setup gate", "distance_tracking": "packet_distance_uint64", "dp_bits": 6, "dp_checksum": "0x54ccada61fd1edbc", "dp_count": 2087, "dp_distance_checksum": "0xf31d7766e1607041", "dp_query_count": 2087, "dp_tracking": "affine_x256_y_parity_cpu_batch", "exact_host_table_bytes": 1268635456, "experiment": "metal_jacobian_dynamic_dp_stream_xyzz_affine_scan_target_lookup_tag16_hash_filter25m_steps2048_dp6_setup", "filter_false_positive_count": 0, "filter_positive_count": 65536, "gpu_lookup_lookups_per_sec": 407125798.787169, "gpu_ops_per_sec": 92094992.322929, "hit_count": 65536, "injected_hits": 64, "iterations": 268435456, "jump_count": 16, "jump_histogram_max_bucket": 16782260, "jump_histogram_max_deviation_ppm": 346, "jump_histogram_min_bucket": 16771410, "jump_index": "power2_mask", "jump_mixer": "avalanche64", "jump_schedule": "power2", "lookup_engine": "gpu_filter16_hash_repeat", "lookup_engine_effective": "gpu_filter16_hash_repeat", "lookup_exact_seconds": 0.000684, "lookup_gpu_seconds": 0.005249, "lookup_hash_seconds": 1.3e-05, "lookup_layout": "open_address_tag16_hash_filter_exact256", "lookup_max_threads_per_threadgroup": 1024, "lookup_query_mode": "repeat", "lookup_repeat": 1024, "lookup_seconds": 0.005946, "lookup_thread_execution_width": 32, "lookup_threadgroup_limit": 512, "lookup_threads_per_threadgroup": 512, "lookups_per_sec": 359390873.529387, "machine": "macOS-26.5-arm64-arm-64bit-Mach-O", "max_threads_per_threadgroup": 1024, "min_ms": 500, "miss_count": 2071552, "operation": "jacobian_affine_scan_target_lookup_tag32", "ops_per_sec": 75814186.065546, "ops_per_sec_max": 75902185.126647, "ops_per_sec_min": 48514868.884448, "output_layout": "affine_dp_scan_target_lookup", "paired_baseline_ops_per_sec": 67936112.806331, "paired_baseline_ref": "main", "paired_order": "alternate", "paired_speedup": 1.1159629677616887, "query_count": 2137088, "query_input": "hash64_repeat_indexed", "raw_status": "keep", "reason": "", "repeat_positive_index_encoding": "packed16_base_repeat", "requested_hits": 64, "runner_sample_count": 3, "sample_count": 131072, "seconds": 2.914767, "setup_inclusive_ops_per_sec": 75814186.065546, "setup_inclusive_ops_per_sec_max": 75902185.126647, "setup_inclusive_ops_per_sec_min": 48514868.884448, "setup_inclusive_seconds": 3.540702, "skipped": false, "state_layout": "xyzz", "status": "keep", "steps_per_sample": 2048, "target_bucket_bytes": 268435456, "target_build_seconds": 0.595975, "target_count": 25005000, "target_filter_bucket_bytes": 67108864, "target_filter_build_seconds": 0.021353, "target_key": "x256_y_parity", "target_key_bytes": 1000200000, "target_lookup_checksum": "0x197ac7fed54a4156", "target_query_hash_bytes": 16696, "target_table_buckets": 33554432, "target_table_bytes": 67108864, "thread_execution_width": 32, "threadgroup_limit": 128, "threads_per_threadgroup": 128, "timestamp": "2026-06-29T14:53:40Z", "validation_seconds": 9.911904, "validation_workers": 8}
{"affine_scan_mode": "cpu_batch_prod_zz_zzz", "affine_scan_seconds": 0.00303, "backend": "metal", "budget_sec": 540, "bytes_per_target": 2.683818, "candidate_verification": "tag16_hash_filter_then_cpu_exact_key_equality", "commit": "1e00829-dirty", "confirmation_index": 2, "confirmation_runs": 2, "confirmation_status": "keep", "cooldown_sec": 10.0, "correctness": true, "description": "Metal XYZZ 2048-step dp6 affine-scan target lookup versus accepted 1024-step dp7 setup gate", "distance_tracking": "packet_distance_uint64", "dp_bits": 6, "dp_checksum": "0x54ccada61fd1edbc", "dp_count": 2087, "dp_distance_checksum": "0xf31d7766e1607041", "dp_query_count": 2087, "dp_tracking": "affine_x256_y_parity_cpu_batch", "exact_host_table_bytes": 1268635456, "experiment": "metal_jacobian_dynamic_dp_stream_xyzz_affine_scan_target_lookup_tag16_hash_filter25m_steps2048_dp6_setup", "filter_false_positive_count": 0, "filter_positive_count": 65536, "gpu_lookup_lookups_per_sec": 234343751.569446, "gpu_ops_per_sec": 85918509.184288, "hit_count": 65536, "injected_hits": 64, "iterations": 268435456, "jump_count": 16, "jump_histogram_max_bucket": 16782260, "jump_histogram_max_deviation_ppm": 346, "jump_histogram_min_bucket": 16771410, "jump_index": "power2_mask", "jump_mixer": "avalanche64", "jump_schedule": "power2", "lookup_engine": "gpu_filter16_hash_repeat", "lookup_engine_effective": "gpu_filter16_hash_repeat", "lookup_exact_seconds": 0.000709, "lookup_gpu_seconds": 0.009119, "lookup_hash_seconds": 1.6e-05, "lookup_layout": "open_address_tag16_hash_filter_exact256", "lookup_max_threads_per_threadgroup": 1024, "lookup_query_mode": "repeat", "lookup_repeat": 1024, "lookup_seconds": 0.009844, "lookup_thread_execution_width": 32, "lookup_threadgroup_limit": 512, "lookup_threads_per_threadgroup": 512, "lookups_per_sec": 217094585.445144, "machine": "macOS-26.5-arm64-arm-64bit-Mach-O", "max_threads_per_threadgroup": 1024, "min_ms": 500, "miss_count": 2071552, "operation": "jacobian_affine_scan_target_lookup_tag32", "ops_per_sec": 70379199.180135, "ops_per_sec_max": 95335135.867244, "ops_per_sec_min": 62271301.113076, "output_layout": "affine_dp_scan_target_lookup", "paired_baseline_ops_per_sec": 62540628.754942, "paired_baseline_ref": "main", "paired_order": "alternate", "paired_speedup": 1.1253356510998234, "query_count": 2137088, "query_input": "hash64_repeat_indexed", "raw_status": "keep", "reason": "", "repeat_positive_index_encoding": "packed16_base_repeat", "requested_hits": 64, "runner_sample_count": 3, "sample_count": 131072, "seconds": 3.124303, "setup_inclusive_ops_per_sec": 70379199.180135, "setup_inclusive_ops_per_sec_max": 95335135.867244, "setup_inclusive_ops_per_sec_min": 62271301.113076, "setup_inclusive_seconds": 3.814131, "skipped": false, "state_layout": "xyzz", "status": "keep", "steps_per_sample": 2048, "target_bucket_bytes": 268435456, "target_build_seconds": 0.653131, "target_count": 25005000, "target_filter_bucket_bytes": 67108864, "target_filter_build_seconds": 0.023822, "target_key": "x256_y_parity", "target_key_bytes": 1000200000, "target_lookup_checksum": "0x197ac7fed54a4156", "target_query_hash_bytes": 16696, "target_table_buckets": 33554432, "target_table_bytes": 67108864, "thread_execution_width": 32, "threadgroup_limit": 128, "threads_per_threadgroup": 128, "timestamp": "2026-06-29T14:53:41Z", "validation_seconds": 10.545486, "validation_workers": 8}
