{"backend": "metal", "budget_sec": 5, "commit": "99ea964", "correctness": true, "description": "Metal Jacobian jump-table walk with projective distinguished-point candidate flags", "distance_checksum": "0xa45f471493cace2f", "distance_tracking": "uint64", "dp_bits": 4, "dp_checksum": "0x30a7914972cba014", "dp_count": 1000, "dp_tracking": "projective_x_limb0", "experiment": "metal_jacobian_jump_walk_dp", "iterations": 1835008, "jump_count": 16, "machine": "macOS-26.5-arm64-arm-64bit-Mach-O", "max_threads_per_threadgroup": 1024, "min_ms": 50, "operation": "jacobian_affine_walk_jump_table", "ops_per_sec": 36056697.229186, "ops_per_sec_max": 38595363.397466, "ops_per_sec_min": 27685884.633058, "paired_baseline_ops_per_sec": 33537315.709809, "paired_baseline_ref": "main", "paired_speedup": 1.0751217402482849, "reason": "", "runner_sample_count": 3, "sample_count": 16384, "seconds": 0.050892, "skipped": false, "status": "keep", "steps_per_sample": 8, "thread_execution_width": 32, "threadgroup_limit": 256, "threads_per_threadgroup": 256, "timestamp": "2026-06-20T23:42:41Z"}
{"backend": "metal", "budget_sec": 5, "commit": "2ba6704", "correctness": true, "description": "Metal Jacobian jump-table walk with projective distinguished-point candidate flags", "distance_checksum": "0xa45f471493cace2f", "distance_tracking": "uint64", "dp_bits": 4, "dp_checksum": "0x30a7914972cba014", "dp_count": 1000, "dp_tracking": "projective_x_limb0", "experiment": "metal_jacobian_jump_walk_dp", "iterations": 1835008, "jump_count": 16, "machine": "macOS-26.5-arm64-arm-64bit-Mach-O", "max_threads_per_threadgroup": 1024, "min_ms": 50, "operation": "jacobian_affine_walk_jump_table", "ops_per_sec": 36123063.713799, "ops_per_sec_max": 46746041.618214, "ops_per_sec_min": 23157880.850366, "paired_baseline_ops_per_sec": 29592623.352879, "paired_baseline_ref": "main", "paired_speedup": 1.2206779805577685, "reason": "", "runner_sample_count": 3, "sample_count": 16384, "seconds": 0.050799, "skipped": false, "status": "keep", "steps_per_sample": 8, "thread_execution_width": 32, "threadgroup_limit": 256, "threads_per_threadgroup": 256, "timestamp": "2026-06-21T00:00:03Z"}
{"backend": "metal", "budget_sec": 5, "commit": "048c827", "correctness": true, "description": "Metal Jacobian jump-table walk with projective distinguished-point candidate flags", "distance_checksum": "0xa45f471493cace2f", "distance_tracking": "uint64", "dp_bits": 4, "dp_checksum": "0x30a7914972cba014", "dp_count": 1000, "dp_tracking": "projective_x_limb0", "experiment": "metal_jacobian_jump_walk_dp", "iterations": 1703936, "jump_count": 16, "machine": "macOS-26.5-arm64-arm-64bit-Mach-O", "max_threads_per_threadgroup": 1024, "min_ms": 50, "operation": "jacobian_affine_walk_jump_table", "ops_per_sec": 32951131.617042, "ops_per_sec_max": 39231627.754174, "ops_per_sec_min": 23577104.868518, "paired_baseline_ops_per_sec": 29806708.48027, "paired_baseline_ref": "main", "paired_speedup": 1.1054938064984061, "reason": "", "runner_sample_count": 3, "sample_count": 16384, "seconds": 0.051711, "skipped": false, "status": "keep", "steps_per_sample": 8, "thread_execution_width": 32, "threadgroup_limit": 256, "threads_per_threadgroup": 256, "timestamp": "2026-06-21T00:05:01Z"}
{"backend": "metal", "budget_sec": 5, "commit": "dc2d1dd", "correctness": true, "description": "Metal Jacobian jump-table walk with projective distinguished-point candidate flags", "distance_checksum": "0xa45f471493cace2f", "distance_tracking": "uint64", "dp_bits": 4, "dp_checksum": "0x30a7914972cba014", "dp_count": 1000, "dp_tracking": "projective_x_limb0", "experiment": "metal_jacobian_jump_walk_dp", "iterations": 1441792, "jump_count": 16, "machine": "macOS-26.5-arm64-arm-64bit-Mach-O", "max_threads_per_threadgroup": 1024, "min_ms": 50, "operation": "jacobian_affine_walk_jump_table", "ops_per_sec": 26896574.393133, "ops_per_sec_max": 27558986.411632, "ops_per_sec_min": 23151973.252512, "paired_baseline_ops_per_sec": 20301093.835039, "paired_baseline_ref": "main", "paired_speedup": 1.3248830142694292, "reason": "", "runner_sample_count": 3, "sample_count": 16384, "seconds": 0.053605, "skipped": false, "status": "keep", "steps_per_sample": 8, "thread_execution_width": 32, "threadgroup_limit": 256, "threads_per_threadgroup": 256, "timestamp": "2026-06-21T00:10:01Z"}
{"backend": "metal", "budget_sec": 5, "commit": "7acdc28", "correctness": true, "description": "Metal Jacobian jump-table walk with projective distinguished-point candidate flags", "distance_checksum": "0xa45f471493cace2f", "distance_tracking": "uint64", "dp_bits": 4, "dp_checksum": "0x30a7914972cba014", "dp_count": 1000, "dp_tracking": "projective_x_limb0", "experiment": "metal_jacobian_jump_walk_dp", "iterations": 1966080, "jump_count": 16, "machine": "macOS-26.5-arm64-arm-64bit-Mach-O", "max_threads_per_threadgroup": 1024, "min_ms": 50, "operation": "jacobian_affine_walk_jump_table", "ops_per_sec": 38243083.846592, "ops_per_sec_max": 42489642.760573, "ops_per_sec_min": 36303991.961639, "paired_baseline_ops_per_sec": 34828506.038031, "paired_baseline_ref": "main", "paired_speedup": 1.0980397437901142, "reason": "", "runner_sample_count": 3, "sample_count": 16384, "seconds": 0.05141, "skipped": false, "status": "keep", "steps_per_sample": 8, "thread_execution_width": 32, "threadgroup_limit": 256, "threads_per_threadgroup": 256, "timestamp": "2026-06-21T00:22:06Z"}
{"backend": "metal", "budget_sec": 5, "commit": "ed85c67", "correctness": true, "description": "Metal Jacobian jump-table walk with projective DP flags at steps=4", "distance_checksum": "0xb1541b7a21f2fdb4", "distance_tracking": "uint64", "dp_bits": 4, "dp_checksum": "0x1943a969ca1127a0", "dp_count": 1030, "dp_tracking": "projective_x_limb0", "experiment": "metal_jacobian_jump_walk_dp_steps4", "iterations": 1114112, "jump_count": 16, "machine": "macOS-26.5-arm64-arm-64bit-Mach-O", "max_threads_per_threadgroup": 1024, "min_ms": 50, "operation": "jacobian_affine_walk_jump_table", "ops_per_sec": 21861586.351139, "ops_per_sec_max": 23467683.40439, "ops_per_sec_min": 16544339.465934, "reason": "", "runner_sample_count": 3, "sample_count": 16384, "seconds": 0.050962, "skipped": false, "status": "keep", "steps_per_sample": 4, "thread_execution_width": 32, "threadgroup_limit": 256, "threads_per_threadgroup": 256, "timestamp": "2026-06-21T00:32:11Z"}
{"backend": "metal", "budget_sec": 5, "commit": "ba91503", "correctness": true, "description": "Metal Jacobian jump-table walk with projective distinguished-point candidate flags", "distance_checksum": "0xa45f471493cace2f", "distance_tracking": "uint64", "dp_bits": 4, "dp_checksum": "0x30a7914972cba014", "dp_count": 1000, "dp_tracking": "projective_x_limb0", "experiment": "metal_jacobian_jump_walk_dp", "iterations": 1966080, "jump_count": 16, "machine": "macOS-26.5-arm64-arm-64bit-Mach-O", "max_threads_per_threadgroup": 1024, "min_ms": 50, "operation": "jacobian_affine_walk_jump_table", "ops_per_sec": 36426708.294932, "ops_per_sec_max": 41279674.800365, "ops_per_sec_min": 24616405.367771, "paired_baseline_ops_per_sec": 30769379.44533, "paired_baseline_ref": "main", "paired_speedup": 1.1838622991943581, "reason": "", "runner_sample_count": 3, "sample_count": 16384, "seconds": 0.053974, "skipped": false, "status": "keep", "steps_per_sample": 8, "thread_execution_width": 32, "threadgroup_limit": 256, "threads_per_threadgroup": 256, "timestamp": "2026-06-21T00:38:28Z"}
{"backend": "metal", "budget_sec": 5, "commit": "68b8e3b", "correctness": true, "description": "Metal Jacobian jump-table walk with projective distinguished-point candidate flags", "distance_checksum": "0xa45f471493cace2f", "distance_tracking": "uint64", "dp_bits": 4, "dp_checksum": "0x30a7914972cba014", "dp_count": 1000, "dp_tracking": "projective_x_limb0", "experiment": "metal_jacobian_jump_walk_dp", "iterations": 1966080, "jump_count": 16, "machine": "macOS-26.5-arm64-arm-64bit-Mach-O", "max_threads_per_threadgroup": 1024, "min_ms": 50, "operation": "jacobian_affine_walk_jump_table", "ops_per_sec": 38249530.679262, "ops_per_sec_max": 45292938.764546, "ops_per_sec_min": 23407514.435039, "paired_baseline_ops_per_sec": 23474473.066685, "paired_baseline_ref": "main", "paired_speedup": 1.6294095535437505, "reason": "", "runner_sample_count": 3, "sample_count": 16384, "seconds": 0.051401, "skipped": false, "status": "keep", "steps_per_sample": 8, "thread_execution_width": 32, "threadgroup_limit": 256, "threads_per_threadgroup": 256, "timestamp": "2026-06-21T00:45:04Z"}
{"backend": "metal", "budget_sec": 5, "commit": "cbfff2e", "correctness": true, "description": "Metal Jacobian jump-table walk with projective distinguished-point candidate flags", "distance_checksum": "0xa45f471493cace2f", "distance_tracking": "uint64", "dp_bits": 4, "dp_checksum": "0x30a7914972cba014", "dp_count": 1000, "dp_tracking": "projective_x_limb0", "experiment": "metal_jacobian_jump_walk_dp", "iterations": 1310720, "jump_count": 16, "machine": "macOS-26.5-arm64-arm-64bit-Mach-O", "max_threads_per_threadgroup": 1024, "min_ms": 50, "operation": "jacobian_affine_walk_jump_table", "ops_per_sec": 25302152.15776, "ops_per_sec_max": 27091847.302376, "ops_per_sec_min": 19269715.464176, "paired_baseline_ops_per_sec": 24651050.122097, "paired_baseline_ref": "main", "paired_speedup": 1.0264127504685636, "reason": "", "runner_sample_count": 3, "sample_count": 16384, "seconds": 0.051803, "skipped": false, "status": "keep", "steps_per_sample": 8, "thread_execution_width": 32, "threadgroup_limit": 256, "threads_per_threadgroup": 256, "timestamp": "2026-06-21T00:48:52Z"}
{"backend": "metal", "budget_sec": 5, "commit": "c876663", "correctness": true, "description": "Metal Jacobian jump-table walk with projective distinguished-point candidate flags", "distance_checksum": "0xa45f471493cace2f", "distance_tracking": "uint64", "dp_bits": 4, "dp_checksum": "0x30a7914972cba014", "dp_count": 1000, "dp_tracking": "projective_x_limb0", "experiment": "metal_jacobian_jump_walk_dp", "iterations": 2097152, "jump_count": 16, "machine": "macOS-26.5-arm64-arm-64bit-Mach-O", "max_threads_per_threadgroup": 1024, "min_ms": 50, "operation": "jacobian_affine_walk_jump_table", "ops_per_sec": 40420143.199132, "ops_per_sec_max": 55671451.511221, "ops_per_sec_min": 28374309.720436, "paired_baseline_ops_per_sec": 25079930.894718, "paired_baseline_ref": "main", "paired_speedup": 1.6116528936546932, "reason": "", "runner_sample_count": 3, "sample_count": 16384, "seconds": 0.051884, "skipped": false, "status": "keep", "steps_per_sample": 8, "thread_execution_width": 32, "threadgroup_limit": 256, "threads_per_threadgroup": 256, "timestamp": "2026-06-21T00:56:08Z"}
{"backend": "metal", "budget_sec": 5, "commit": "b7122fb", "correctness": true, "description": "Metal Jacobian jump-table walk with projective distinguished-point candidate flags", "distance_checksum": "0xa45f471493cace2f", "distance_tracking": "uint64", "dp_bits": 4, "dp_checksum": "0x30a7914972cba014", "dp_count": 1000, "dp_tracking": "projective_x_limb0", "experiment": "metal_jacobian_jump_walk_dp", "iterations": 2228224, "jump_count": 16, "machine": "macOS-26.5-arm64-arm-64bit-Mach-O", "max_threads_per_threadgroup": 1024, "min_ms": 50, "operation": "jacobian_affine_walk_jump_table", "ops_per_sec": 43384425.365437, "ops_per_sec_max": 43685276.246207, "ops_per_sec_min": 25070894.921654, "paired_baseline_ops_per_sec": 42198113.596848, "paired_baseline_ref": "main", "paired_speedup": 1.028112909973246, "reason": "", "runner_sample_count": 3, "sample_count": 16384, "seconds": 0.05136, "skipped": false, "status": "keep", "steps_per_sample": 8, "thread_execution_width": 32, "threadgroup_limit": 256, "threads_per_threadgroup": 256, "timestamp": "2026-06-21T01:01:36Z"}
{"backend": "metal", "budget_sec": 5, "commit": "505a654", "correctness": true, "description": "Metal Jacobian jump-table walk with projective distinguished-point candidate flags", "distance_checksum": "0xa45f471493cace2f", "distance_tracking": "uint64", "dp_bits": 4, "dp_checksum": "0x30a7914972cba014", "dp_count": 1000, "dp_tracking": "projective_x_limb0", "experiment": "metal_jacobian_jump_walk_dp", "iterations": 1703936, "jump_count": 16, "machine": "macOS-26.5-arm64-arm-64bit-Mach-O", "max_threads_per_threadgroup": 1024, "min_ms": 50, "operation": "jacobian_affine_walk_jump_table", "ops_per_sec": 32889067.186241, "ops_per_sec_max": 36398807.719108, "ops_per_sec_min": 28617488.56227, "paired_baseline_ops_per_sec": 25877502.674679, "paired_baseline_ref": "main", "paired_speedup": 1.2709521316530585, "reason": "", "runner_sample_count": 3, "sample_count": 16384, "seconds": 0.051809, "skipped": false, "status": "keep", "steps_per_sample": 8, "thread_execution_width": 32, "threadgroup_limit": 256, "threads_per_threadgroup": 256, "timestamp": "2026-06-21T01:06:01Z"}
{"backend": "metal", "budget_sec": 5, "commit": "7feecd6", "correctness": true, "description": "Metal Jacobian jump-table walk with projective distinguished-point candidate flags", "distance_checksum": "0xa45f471493cace2f", "distance_tracking": "uint64", "dp_bits": 4, "dp_checksum": "0x30a7914972cba014", "dp_count": 1000, "dp_tracking": "projective_x_limb0", "experiment": "metal_jacobian_jump_walk_dp", "iterations": 1966080, "jump_count": 16, "machine": "macOS-26.5-arm64-arm-64bit-Mach-O", "max_threads_per_threadgroup": 1024, "min_ms": 50, "operation": "jacobian_affine_walk_jump_table", "ops_per_sec": 37830025.643327, "ops_per_sec_max": 38065009.331453, "ops_per_sec_min": 31418999.719122, "paired_baseline_ops_per_sec": 28696541.249467, "paired_baseline_ref": "main", "paired_speedup": 1.318278231319241, "reason": "", "runner_sample_count": 3, "sample_count": 16384, "seconds": 0.051971, "skipped": false, "status": "keep", "steps_per_sample": 8, "thread_execution_width": 32, "threadgroup_limit": 256, "threads_per_threadgroup": 256, "timestamp": "2026-06-21T01:16:06Z"}
{"backend": "metal", "budget_sec": 5, "commit": "e7b28c1", "correctness": true, "description": "Metal Jacobian jump-table walk with projective distinguished-point candidate flags", "distance_checksum": "0xa45f471493cace2f", "distance_tracking": "uint64", "dp_bits": 4, "dp_checksum": "0x30a7914972cba014", "dp_count": 1000, "dp_tracking": "projective_x_limb0", "experiment": "metal_jacobian_jump_walk_dp", "iterations": 1703936, "jump_count": 16, "machine": "macOS-26.5-arm64-arm-64bit-Mach-O", "max_threads_per_threadgroup": 1024, "min_ms": 50, "operation": "jacobian_affine_walk_jump_table", "ops_per_sec": 33349832.725909, "ops_per_sec_max": 37426626.285881, "ops_per_sec_min": 30558799.942895, "paired_baseline_ops_per_sec": 25793902.178919, "paired_baseline_ref": "main", "paired_speedup": 1.292934760106416, "reason": "", "runner_sample_count": 3, "sample_count": 16384, "seconds": 0.051093, "skipped": false, "status": "keep", "steps_per_sample": 8, "thread_execution_width": 32, "threadgroup_limit": 256, "threads_per_threadgroup": 256, "timestamp": "2026-06-21T01:22:38Z"}
{"backend": "metal", "budget_sec": 5, "commit": "f266242", "correctness": true, "description": "Metal Jacobian jump-table walk with projective distinguished-point candidate flags", "distance_checksum": "0xa45f471493cace2f", "distance_tracking": "uint64", "dp_bits": 4, "dp_checksum": "0x30a7914972cba014", "dp_count": 1000, "dp_tracking": "projective_x_limb0", "experiment": "metal_jacobian_jump_walk_dp", "iterations": 1966080, "jump_count": 16, "machine": "macOS-26.5-arm64-arm-64bit-Mach-O", "max_threads_per_threadgroup": 1024, "min_ms": 50, "operation": "jacobian_affine_walk_jump_table", "ops_per_sec": 38176865.912089, "ops_per_sec_max": 42261342.487773, "ops_per_sec_min": 17725221.967109, "paired_baseline_ops_per_sec": 34031160.092524, "paired_baseline_ref": "main", "paired_speedup": 1.1218208785211448, "reason": "", "runner_sample_count": 3, "sample_count": 16384, "seconds": 0.051499, "skipped": false, "status": "keep", "steps_per_sample": 8, "thread_execution_width": 32, "threadgroup_limit": 256, "threads_per_threadgroup": 256, "timestamp": "2026-06-21T01:29:32Z"}
{"backend": "metal", "budget_sec": 5, "commit": "4d1cc10", "correctness": true, "description": "Metal Jacobian jump-table walk with projective distinguished-point candidate flags", "distance_checksum": "0xa45f471493cace2f", "distance_tracking": "uint64", "dp_bits": 4, "dp_checksum": "0x30a7914972cba014", "dp_count": 1000, "dp_tracking": "projective_x_limb0", "experiment": "metal_jacobian_jump_walk_dp", "iterations": 1966080, "jump_count": 16, "machine": "macOS-26.5-arm64-arm-64bit-Mach-O", "max_threads_per_threadgroup": 1024, "min_ms": 50, "operation": "jacobian_affine_walk_jump_table", "ops_per_sec": 37756893.905525, "ops_per_sec_max": 39217770.951406, "ops_per_sec_min": 28708135.305072, "paired_baseline_ops_per_sec": 25763516.307986, "paired_baseline_ref": "main", "paired_speedup": 1.4655178840561207, "reason": "", "runner_sample_count": 3, "sample_count": 16384, "seconds": 0.052072, "skipped": false, "status": "keep", "steps_per_sample": 8, "thread_execution_width": 32, "threadgroup_limit": 256, "threads_per_threadgroup": 256, "timestamp": "2026-06-21T01:51:47Z"}
{"backend": "metal", "budget_sec": 10, "commit": "56302e5", "correctness": true, "description": "Metal Jacobian jump-table walk with projective distinguished-point candidate flags", "distance_checksum": "0xa45f471493cace2f", "distance_tracking": "uint64", "dp_bits": 4, "dp_checksum": "0x30a7914972cba014", "dp_count": 1000, "dp_tracking": "projective_x_limb0", "experiment": "metal_jacobian_jump_walk_dp", "iterations": 1572864, "jump_count": 16, "machine": "macOS-26.5-arm64-arm-64bit-Mach-O", "max_threads_per_threadgroup": 1024, "min_ms": 50, "operation": "jacobian_affine_walk_jump_table", "ops_per_sec": 30216489.417128, "ops_per_sec_max": 38643787.959196, "ops_per_sec_min": 15349856.802633, "paired_baseline_ops_per_sec": 30308267.513455, "paired_baseline_ref": "main", "paired_speedup": 0.9969718461708095, "reason": "", "runner_sample_count": 5, "sample_count": 16384, "seconds": 0.052053, "skipped": false, "status": "discard", "steps_per_sample": 8, "thread_execution_width": 32, "threadgroup_limit": 256, "threads_per_threadgroup": 256, "timestamp": "2026-06-21T02:22:56Z"}
{"backend": "metal", "budget_sec": 10, "commit": "5a8b985", "correctness": true, "description": "Metal Jacobian jump-table walk with projective distinguished-point candidate flags", "distance_checksum": "0xa45f471493cace2f", "distance_tracking": "uint64", "dp_bits": 4, "dp_checksum": "0x30a7914972cba014", "dp_count": 1000, "dp_tracking": "projective_x_limb0", "experiment": "metal_jacobian_jump_walk_dp", "iterations": 1441792, "jump_count": 16, "machine": "macOS-26.5-arm64-arm-64bit-Mach-O", "max_threads_per_threadgroup": 1024, "min_ms": 50, "operation": "jacobian_affine_walk_jump_table", "ops_per_sec": 26399879.312075, "ops_per_sec_max": 38972213.32807, "ops_per_sec_min": 20613125.76624, "paired_baseline_ops_per_sec": 36600758.926891, "paired_baseline_ref": "main", "paired_speedup": 0.7212932214003548, "reason": "", "runner_sample_count": 5, "sample_count": 16384, "seconds": 0.054614, "skipped": false, "status": "discard", "steps_per_sample": 8, "thread_execution_width": 32, "threadgroup_limit": 256, "threads_per_threadgroup": 256, "timestamp": "2026-06-21T02:29:16Z"}
{"backend": "metal", "budget_sec": 10, "commit": "d735b6d", "correctness": true, "description": "Metal Jacobian jump-table walk with projective distinguished-point candidate flags", "distance_checksum": "0xa45f471493cace2f", "distance_tracking": "uint64", "dp_bits": 4, "dp_checksum": "0x30a7914972cba014", "dp_count": 1000, "dp_tracking": "projective_x_limb0", "experiment": "metal_jacobian_jump_walk_dp", "iterations": 1048576, "jump_count": 16, "machine": "macOS-26.5-arm64-arm-64bit-Mach-O", "max_threads_per_threadgroup": 1024, "min_ms": 50, "operation": "jacobian_affine_walk_jump_table", "ops_per_sec": 20388792.013228, "ops_per_sec_max": 44135555.663969, "ops_per_sec_min": 19519118.041804, "paired_baseline_ops_per_sec": 22815429.774553, "paired_baseline_ref": "main", "paired_speedup": 0.8936404974482869, "reason": "", "runner_sample_count": 5, "sample_count": 16384, "seconds": 0.051429, "skipped": false, "status": "discard", "steps_per_sample": 8, "thread_execution_width": 32, "threadgroup_limit": 256, "threads_per_threadgroup": 256, "timestamp": "2026-06-21T09:02:48Z"}
{"backend": "metal", "budget_sec": 10, "commit": "604dd55", "correctness": true, "description": "Metal Jacobian jump-table walk with projective distinguished-point candidate flags", "distance_checksum": "0xa45f471493cace2f", "distance_tracking": "uint64", "dp_bits": 4, "dp_checksum": "0x30a7914972cba014", "dp_count": 1000, "dp_tracking": "projective_x_limb0", "experiment": "metal_jacobian_jump_walk_dp", "iterations": 2228224, "jump_count": 16, "machine": "macOS-26.5-arm64-arm-64bit-Mach-O", "max_threads_per_threadgroup": 1024, "min_ms": 50, "operation": "jacobian_affine_walk_jump_table", "ops_per_sec": 42692418.310915, "ops_per_sec_max": 61189326.927285, "ops_per_sec_min": 25133171.466188, "paired_baseline_ops_per_sec": 41388708.608987, "paired_baseline_ref": "main", "paired_speedup": 1.0314991635579787, "reason": "", "runner_sample_count": 5, "sample_count": 16384, "seconds": 0.052192, "skipped": false, "status": "keep", "steps_per_sample": 8, "thread_execution_width": 32, "threadgroup_limit": 256, "threads_per_threadgroup": 256, "timestamp": "2026-06-21T09:08:27Z"}
