{"backend": "metal", "budget_sec": 10, "commit": "33a9a83", "correctness": true, "description": "Metal Jacobian jump-table walk with projective distinguished-point candidate flags", "distance_checksum": "0xa45f471493cace2f", "distance_tracking": "uint64", "dp_bits": 4, "dp_checksum": "0x30a7914972cba014", "dp_count": 1000, "dp_tracking": "projective_x_limb0", "experiment": "metal_jacobian_jump_walk_dp", "iterations": 2097152, "jump_count": 16, "machine": "macOS-26.5-arm64-arm-64bit-Mach-O", "max_threads_per_threadgroup": 1024, "min_ms": 50, "operation": "jacobian_affine_walk_jump_table", "ops_per_sec": 40274694.606662, "ops_per_sec_max": 44045367.465404, "ops_per_sec_min": 12080795.33279, "paired_baseline_ops_per_sec": 44267553.613436, "paired_baseline_ref": "main", "paired_speedup": 0.9098016790889005, "reason": "", "runner_sample_count": 5, "sample_count": 16384, "seconds": 0.052071, "skipped": false, "status": "discard", "steps_per_sample": 8, "thread_execution_width": 32, "threadgroup_limit": 256, "threads_per_threadgroup": 256, "timestamp": "2026-06-21T15:26:15Z"}
{"backend": "metal", "budget_sec": 10, "commit": "90697f5", "correctness": true, "description": "Stable Metal Jacobian jump-table walk with projective distinguished-point candidate flags", "distance_checksum": "0xa45f471493cace2f", "distance_tracking": "uint64", "dp_bits": 4, "dp_checksum": "0x30a7914972cba014", "dp_count": 1000, "dp_tracking": "projective_x_limb0", "experiment": "metal_jacobian_jump_walk_dp_stable", "iterations": 8126464, "jump_count": 16, "machine": "macOS-26.5-arm64-arm-64bit-Mach-O", "max_threads_per_threadgroup": 1024, "min_ms": 200, "operation": "jacobian_affine_walk_jump_table", "ops_per_sec": 40350062.636594, "ops_per_sec_max": 51223692.73086, "ops_per_sec_min": 35453763.776512, "reason": "", "runner_sample_count": 3, "sample_count": 16384, "seconds": 0.201399, "skipped": false, "status": "keep", "steps_per_sample": 8, "thread_execution_width": 32, "threadgroup_limit": 256, "threads_per_threadgroup": 256, "timestamp": "2026-06-21T18:07:34Z"}
{"backend": "metal", "budget_sec": 5, "commit": "b6316fe", "correctness": true, "description": "Metal secp256k1 field_mul_mod_p correctness and throughput gate", "experiment": "metal_field_mul", "iterations": 5242880, "machine": "macOS-26.5-arm64-arm-64bit-Mach-O", "max_threads_per_threadgroup": 1024, "min_ms": 50, "operation": "field_mul_mod_p", "ops_per_sec": 84087327.209258, "ops_per_sec_max": 189824586.37306, "ops_per_sec_min": 78767504.475704, "paired_baseline_ops_per_sec": 83249704.275571, "paired_baseline_ref": "main", "paired_speedup": 1.0100615724821596, "reason": "", "runner_sample_count": 3, "sample_count": 1048576, "seconds": 0.06235, "skipped": false, "status": "keep", "thread_execution_width": 32, "threadgroup_limit": 256, "threads_per_threadgroup": 256, "timestamp": "2026-06-21T18:21:36Z"}
{"backend": "metal", "budget_sec": 5, "commit": "b6316fe", "correctness": true, "description": "Metal secp256k1 field_square_mod_p correctness and throughput gate", "experiment": "metal_field_square", "iterations": 8388608, "machine": "macOS-26.5-arm64-arm-64bit-Mach-O", "max_threads_per_threadgroup": 1024, "min_ms": 50, "operation": "field_square_mod_p", "ops_per_sec": 164356831.613348, "ops_per_sec_max": 238354285.787026, "ops_per_sec_min": 41236724.192283, "paired_baseline_ops_per_sec": 144975816.742231, "paired_baseline_ref": "main", "paired_speedup": 1.1336844675659024, "reason": "", "runner_sample_count": 3, "sample_count": 1048576, "seconds": 0.051039, "skipped": false, "status": "keep", "thread_execution_width": 32, "threadgroup_limit": 256, "threads_per_threadgroup": 256, "timestamp": "2026-06-21T18:22:31Z"}
{"backend": "metal", "budget_sec": 5, "commit": "b6316fe", "correctness": true, "description": "Metal fused secp256k1 field_square_mul_mod_p correctness and throughput gate", "experiment": "metal_field_square_mul", "iterations": 6291456, "machine": "macOS-26.5-arm64-arm-64bit-Mach-O", "max_threads_per_threadgroup": 1024, "min_ms": 50, "operation": "field_square_mul_mod_p", "ops_per_sec": 118354164.489191, "ops_per_sec_max": 208152672.820102, "ops_per_sec_min": 101658987.388548, "paired_baseline_ops_per_sec": 103833541.695033, "paired_baseline_ref": "main", "paired_speedup": 1.1398452037474187, "reason": "", "runner_sample_count": 3, "sample_count": 1048576, "seconds": 0.053158, "skipped": false, "status": "keep", "thread_execution_width": 32, "threadgroup_limit": 256, "threads_per_threadgroup": 256, "timestamp": "2026-06-21T18:23:27Z"}
{"backend": "metal", "budget_sec": 10, "commit": "b6316fe", "correctness": true, "description": "Stable Metal Jacobian jump-table walk with projective distinguished-point candidate flags", "distance_checksum": "0xa45f471493cace2f", "distance_tracking": "uint64", "dp_bits": 4, "dp_checksum": "0x30a7914972cba014", "dp_count": 1000, "dp_tracking": "projective_x_limb0", "experiment": "metal_jacobian_jump_walk_dp_stable", "iterations": 8388608, "jump_count": 16, "machine": "macOS-26.5-arm64-arm-64bit-Mach-O", "max_threads_per_threadgroup": 1024, "min_ms": 200, "operation": "jacobian_affine_walk_jump_table", "ops_per_sec": 41678166.91363, "ops_per_sec_max": 50066349.964299, "ops_per_sec_min": 20228171.398908, "paired_baseline_ops_per_sec": 31911471.202441, "paired_baseline_ref": "main", "paired_speedup": 1.3060559523950095, "reason": "", "runner_sample_count": 3, "sample_count": 16384, "seconds": 0.201271, "skipped": false, "status": "keep", "steps_per_sample": 8, "thread_execution_width": 32, "threadgroup_limit": 256, "threads_per_threadgroup": 256, "timestamp": "2026-06-21T18:24:18Z"}
{"backend": "metal", "budget_sec": 5, "commit": "b6316fe", "confirmation_index": 1, "confirmation_runs": 3, "confirmation_status": "discard", "correctness": true, "description": "Metal secp256k1 field_mul_mod_p correctness and throughput gate", "experiment": "metal_field_mul", "iterations": 5242880, "machine": "macOS-26.5-arm64-arm-64bit-Mach-O", "max_threads_per_threadgroup": 1024, "min_ms": 50, "operation": "field_mul_mod_p", "ops_per_sec": 83547267.091683, "ops_per_sec_max": 103772398.071717, "ops_per_sec_min": 19697795.167772, "paired_baseline_ops_per_sec": 81818723.760995, "paired_baseline_ref": "main", "paired_speedup": 1.0211265007718446, "raw_status": "keep", "reason": "", "runner_sample_count": 3, "sample_count": 1048576, "seconds": 0.062753, "skipped": false, "status": "discard", "thread_execution_width": 32, "threadgroup_limit": 256, "threads_per_threadgroup": 256, "timestamp": "2026-06-21T18:25:21Z"}
{"backend": "metal", "budget_sec": 5, "commit": "b6316fe", "confirmation_index": 2, "confirmation_runs": 3, "confirmation_status": "discard", "correctness": true, "description": "Metal secp256k1 field_mul_mod_p correctness and throughput gate", "experiment": "metal_field_mul", "iterations": 10485760, "machine": "macOS-26.5-arm64-arm-64bit-Mach-O", "max_threads_per_threadgroup": 1024, "min_ms": 50, "operation": "field_mul_mod_p", "ops_per_sec": 156513904.494988, "ops_per_sec_max": 172428655.147722, "ops_per_sec_min": 121860048.395494, "paired_baseline_ops_per_sec": 95029504.514979, "paired_baseline_ref": "main", "paired_speedup": 1.6470032680252218, "raw_status": "keep", "reason": "", "runner_sample_count": 3, "sample_count": 1048576, "seconds": 0.066996, "skipped": false, "status": "discard", "thread_execution_width": 32, "threadgroup_limit": 256, "threads_per_threadgroup": 256, "timestamp": "2026-06-21T18:26:00Z"}
{"backend": "metal", "budget_sec": 5, "commit": "b6316fe", "confirmation_index": 3, "confirmation_runs": 3, "confirmation_status": "discard", "correctness": true, "description": "Metal secp256k1 field_mul_mod_p correctness and throughput gate", "experiment": "metal_field_mul", "iterations": 8388608, "machine": "macOS-26.5-arm64-arm-64bit-Mach-O", "max_threads_per_threadgroup": 1024, "min_ms": 50, "operation": "field_mul_mod_p", "ops_per_sec": 147258334.734626, "ops_per_sec_max": 182362362.830312, "ops_per_sec_min": 117447669.104358, "paired_baseline_ops_per_sec": 164001228.582812, "paired_baseline_ref": "main", "paired_speedup": 0.8979099486457095, "raw_status": "discard", "reason": "", "runner_sample_count": 3, "sample_count": 1048576, "seconds": 0.056965, "skipped": false, "status": "discard", "thread_execution_width": 32, "threadgroup_limit": 256, "threads_per_threadgroup": 256, "timestamp": "2026-06-21T18:26:32Z"}
{"backend": "metal", "budget_sec": 5, "commit": "43bf724", "confirmation_index": 1, "confirmation_runs": 3, "confirmation_status": "discard", "correctness": true, "description": "Metal secp256k1 field_square_mod_p correctness and throughput gate", "experiment": "metal_field_square", "iterations": 9437184, "machine": "macOS-26.5-arm64-arm-64bit-Mach-O", "max_threads_per_threadgroup": 1024, "min_ms": 50, "operation": "field_square_mod_p", "ops_per_sec": 164118043.318389, "ops_per_sec_max": 196234692.931901, "ops_per_sec_min": 129055126.483319, "paired_baseline_ops_per_sec": 139794595.164081, "paired_baseline_ref": "main", "paired_speedup": 1.1739941957395337, "raw_status": "keep", "reason": "", "runner_sample_count": 3, "sample_count": 1048576, "seconds": 0.057502, "skipped": false, "status": "discard", "thread_execution_width": 32, "threadgroup_limit": 256, "threads_per_threadgroup": 256, "timestamp": "2026-06-21T18:29:06Z"}
{"backend": "metal", "budget_sec": 5, "commit": "43bf724", "confirmation_index": 2, "confirmation_runs": 3, "confirmation_status": "discard", "correctness": true, "description": "Metal secp256k1 field_square_mod_p correctness and throughput gate", "experiment": "metal_field_square", "iterations": 9437184, "machine": "macOS-26.5-arm64-arm-64bit-Mach-O", "max_threads_per_threadgroup": 1024, "min_ms": 50, "operation": "field_square_mod_p", "ops_per_sec": 168428657.47826, "ops_per_sec_max": 213958221.042083, "ops_per_sec_min": 122718909.859127, "paired_baseline_ops_per_sec": 188497312.881081, "paired_baseline_ref": "main", "paired_speedup": 0.8935334668909477, "raw_status": "discard", "reason": "", "runner_sample_count": 3, "sample_count": 1048576, "seconds": 0.056031, "skipped": false, "status": "discard", "thread_execution_width": 32, "threadgroup_limit": 256, "threads_per_threadgroup": 256, "timestamp": "2026-06-21T18:29:36Z"}
{"backend": "metal", "budget_sec": 5, "commit": "43bf724", "confirmation_index": 3, "confirmation_runs": 3, "confirmation_status": "discard", "correctness": true, "description": "Metal secp256k1 field_square_mod_p correctness and throughput gate", "experiment": "metal_field_square", "iterations": 11534336, "machine": "macOS-26.5-arm64-arm-64bit-Mach-O", "max_threads_per_threadgroup": 1024, "min_ms": 50, "operation": "field_square_mod_p", "ops_per_sec": 187146596.465752, "ops_per_sec_max": 207414631.575828, "ops_per_sec_min": 179136941.061346, "paired_baseline_ops_per_sec": 195153944.550519, "paired_baseline_ref": "main", "paired_speedup": 0.9589690687359171, "raw_status": "discard", "reason": "", "runner_sample_count": 3, "sample_count": 1048576, "seconds": 0.061633, "skipped": false, "status": "discard", "thread_execution_width": 32, "threadgroup_limit": 256, "threads_per_threadgroup": 256, "timestamp": "2026-06-21T18:30:06Z"}
{"backend": "metal", "budget_sec": 10, "commit": "85f9fdb", "confirmation_index": 1, "confirmation_runs": 3, "confirmation_status": "discard", "correctness": true, "description": "Stable Metal Jacobian jump-table walk with projective distinguished-point candidate flags", "distance_checksum": "0xa45f471493cace2f", "distance_tracking": "uint64", "dp_bits": 4, "dp_checksum": "0x30a7914972cba014", "dp_count": 1000, "dp_tracking": "projective_x_limb0", "experiment": "metal_jacobian_jump_walk_dp_stable", "iterations": 8388608, "jump_count": 16, "machine": "macOS-26.5-arm64-arm-64bit-Mach-O", "max_threads_per_threadgroup": 1024, "min_ms": 200, "operation": "jacobian_affine_walk_jump_table", "ops_per_sec": 41325489.856177, "ops_per_sec_max": 57655657.492783, "ops_per_sec_min": 24244042.017566, "paired_baseline_ops_per_sec": 46336900.254131, "paired_baseline_ref": "main", "paired_speedup": 0.8918483892865229, "raw_status": "discard", "reason": "", "runner_sample_count": 3, "sample_count": 16384, "seconds": 0.202989, "skipped": false, "status": "discard", "steps_per_sample": 8, "thread_execution_width": 32, "threadgroup_limit": 256, "threads_per_threadgroup": 256, "timestamp": "2026-06-21T18:44:51Z"}
{"backend": "metal", "budget_sec": 10, "commit": "85f9fdb", "confirmation_index": 2, "confirmation_runs": 3, "confirmation_status": "discard", "correctness": true, "description": "Stable Metal Jacobian jump-table walk with projective distinguished-point candidate flags", "distance_checksum": "0xa45f471493cace2f", "distance_tracking": "uint64", "dp_bits": 4, "dp_checksum": "0x30a7914972cba014", "dp_count": 1000, "dp_tracking": "projective_x_limb0", "experiment": "metal_jacobian_jump_walk_dp_stable", "iterations": 8519680, "jump_count": 16, "machine": "macOS-26.5-arm64-arm-64bit-Mach-O", "max_threads_per_threadgroup": 1024, "min_ms": 200, "operation": "jacobian_affine_walk_jump_table", "ops_per_sec": 42149439.554412, "ops_per_sec_max": 43137118.740724, "ops_per_sec_min": 32762137.215545, "paired_baseline_ops_per_sec": 36613910.989786, "paired_baseline_ref": "main", "paired_speedup": 1.1511864866381036, "raw_status": "keep", "reason": "", "runner_sample_count": 3, "sample_count": 16384, "seconds": 0.20213, "skipped": false, "status": "discard", "steps_per_sample": 8, "thread_execution_width": 32, "threadgroup_limit": 256, "threads_per_threadgroup": 256, "timestamp": "2026-06-21T18:45:24Z"}
{"backend": "metal", "budget_sec": 10, "commit": "85f9fdb", "confirmation_index": 3, "confirmation_runs": 3, "confirmation_status": "discard", "correctness": true, "description": "Stable Metal Jacobian jump-table walk with projective distinguished-point candidate flags", "distance_checksum": "0xa45f471493cace2f", "distance_tracking": "uint64", "dp_bits": 4, "dp_checksum": "0x30a7914972cba014", "dp_count": 1000, "dp_tracking": "projective_x_limb0", "experiment": "metal_jacobian_jump_walk_dp_stable", "iterations": 8912896, "jump_count": 16, "machine": "macOS-26.5-arm64-arm-64bit-Mach-O", "max_threads_per_threadgroup": 1024, "min_ms": 200, "operation": "jacobian_affine_walk_jump_table", "ops_per_sec": 44423592.132378, "ops_per_sec_max": 61220558.895744, "ops_per_sec_min": 32393699.221506, "paired_baseline_ops_per_sec": 42461929.693372, "paired_baseline_ref": "main", "paired_speedup": 1.0461981462729473, "raw_status": "keep", "reason": "", "runner_sample_count": 3, "sample_count": 16384, "seconds": 0.200634, "skipped": false, "status": "discard", "steps_per_sample": 8, "thread_execution_width": 32, "threadgroup_limit": 256, "threads_per_threadgroup": 256, "timestamp": "2026-06-21T18:46:01Z"}
{"backend": "metal", "budget_sec": 10, "commit": "373d008", "confirmation_index": 1, "confirmation_runs": 3, "confirmation_status": "discard", "correctness": true, "description": "Stable Metal Jacobian jump-table walk with projective distinguished-point candidate flags", "distance_checksum": "0xa45f471493cace2f", "distance_tracking": "uint64", "dp_bits": 4, "dp_checksum": "0x30a7914972cba014", "dp_count": 1000, "dp_tracking": "projective_x_limb0", "experiment": "metal_jacobian_jump_walk_dp_stable", "iterations": 6946816, "jump_count": 16, "machine": "macOS-26.5-arm64-arm-64bit-Mach-O", "max_threads_per_threadgroup": 1024, "min_ms": 200, "operation": "jacobian_affine_walk_jump_table", "ops_per_sec": 34338563.7866, "ops_per_sec_max": 52094107.083165, "ops_per_sec_min": 28582102.244415, "paired_baseline_ops_per_sec": 31255124.356075, "paired_baseline_ref": "main", "paired_speedup": 1.0986538845725526, "raw_status": "keep", "reason": "", "runner_sample_count": 3, "sample_count": 16384, "seconds": 0.202304, "skipped": false, "status": "discard", "steps_per_sample": 8, "thread_execution_width": 32, "threadgroup_limit": 256, "threads_per_threadgroup": 256, "timestamp": "2026-06-21T18:57:03Z"}
{"backend": "metal", "budget_sec": 10, "commit": "373d008", "confirmation_index": 2, "confirmation_runs": 3, "confirmation_status": "discard", "correctness": true, "description": "Stable Metal Jacobian jump-table walk with projective distinguished-point candidate flags", "distance_checksum": "0xa45f471493cace2f", "distance_tracking": "uint64", "dp_bits": 4, "dp_checksum": "0x30a7914972cba014", "dp_count": 1000, "dp_tracking": "projective_x_limb0", "experiment": "metal_jacobian_jump_walk_dp_stable", "iterations": 7077888, "jump_count": 16, "machine": "macOS-26.5-arm64-arm-64bit-Mach-O", "max_threads_per_threadgroup": 1024, "min_ms": 200, "operation": "jacobian_affine_walk_jump_table", "ops_per_sec": 35228007.654921, "ops_per_sec_max": 37277941.993256, "ops_per_sec_min": 28121694.129375, "paired_baseline_ops_per_sec": 37256248.676308, "paired_baseline_ref": "main", "paired_speedup": 0.9455597089495273, "raw_status": "discard", "reason": "", "runner_sample_count": 3, "sample_count": 16384, "seconds": 0.200916, "skipped": false, "status": "discard", "steps_per_sample": 8, "thread_execution_width": 32, "threadgroup_limit": 256, "threads_per_threadgroup": 256, "timestamp": "2026-06-21T18:57:35Z"}
{"backend": "metal", "budget_sec": 10, "commit": "373d008", "confirmation_index": 3, "confirmation_runs": 3, "confirmation_status": "discard", "correctness": true, "description": "Stable Metal Jacobian jump-table walk with projective distinguished-point candidate flags", "distance_checksum": "0xa45f471493cace2f", "distance_tracking": "uint64", "dp_bits": 4, "dp_checksum": "0x30a7914972cba014", "dp_count": 1000, "dp_tracking": "projective_x_limb0", "experiment": "metal_jacobian_jump_walk_dp_stable", "iterations": 8388608, "jump_count": 16, "machine": "macOS-26.5-arm64-arm-64bit-Mach-O", "max_threads_per_threadgroup": 1024, "min_ms": 200, "operation": "jacobian_affine_walk_jump_table", "ops_per_sec": 41645380.889454, "ops_per_sec_max": 58429124.395998, "ops_per_sec_min": 32343956.658585, "paired_baseline_ops_per_sec": 34635462.793144, "paired_baseline_ref": "main", "paired_speedup": 1.2023913506851593, "raw_status": "keep", "reason": "", "runner_sample_count": 3, "sample_count": 16384, "seconds": 0.201429, "skipped": false, "status": "discard", "steps_per_sample": 8, "thread_execution_width": 32, "threadgroup_limit": 256, "threads_per_threadgroup": 256, "timestamp": "2026-06-21T18:58:09Z"}
{"backend": "metal", "budget_sec": 10, "commit": "4fdac33", "confirmation_index": 1, "confirmation_runs": 3, "confirmation_status": "discard", "correctness": true, "description": "Stable Metal Jacobian jump-table walk with projective distinguished-point candidate flags", "distance_checksum": "0xa45f471493cace2f", "distance_tracking": "uint64", "dp_bits": 4, "dp_checksum": "0x30a7914972cba014", "dp_count": 1000, "dp_tracking": "projective_x_limb0", "experiment": "metal_jacobian_jump_walk_dp_stable", "iterations": 9568256, "jump_count": 16, "machine": "macOS-26.5-arm64-arm-64bit-Mach-O", "max_threads_per_threadgroup": 1024, "min_ms": 200, "operation": "jacobian_affine_walk_jump_table", "ops_per_sec": 47450397.857569, "ops_per_sec_max": 48732051.304226, "ops_per_sec_min": 46955768.180494, "paired_baseline_ops_per_sec": 42319163.979146, "paired_baseline_ref": "main", "paired_speedup": 1.1212508328602986, "raw_status": "keep", "reason": "", "runner_sample_count": 3, "sample_count": 16384, "seconds": 0.201648, "skipped": false, "status": "discard", "steps_per_sample": 8, "thread_execution_width": 32, "threadgroup_limit": 256, "threads_per_threadgroup": 256, "timestamp": "2026-06-21T19:04:20Z"}
{"backend": "metal", "budget_sec": 10, "commit": "4fdac33", "confirmation_index": 2, "confirmation_runs": 3, "confirmation_status": "discard", "correctness": true, "description": "Stable Metal Jacobian jump-table walk with projective distinguished-point candidate flags", "distance_checksum": "0xa45f471493cace2f", "distance_tracking": "uint64", "dp_bits": 4, "dp_checksum": "0x30a7914972cba014", "dp_count": 1000, "dp_tracking": "projective_x_limb0", "experiment": "metal_jacobian_jump_walk_dp_stable", "iterations": 8650752, "jump_count": 16, "machine": "macOS-26.5-arm64-arm-64bit-Mach-O", "max_threads_per_threadgroup": 1024, "min_ms": 200, "operation": "jacobian_affine_walk_jump_table", "ops_per_sec": 42851456.174199, "ops_per_sec_max": 63095547.170321, "ops_per_sec_min": 35585289.997091, "paired_baseline_ops_per_sec": 56065402.261514, "paired_baseline_ref": "main", "paired_speedup": 0.7643119365187238, "raw_status": "discard", "reason": "", "runner_sample_count": 3, "sample_count": 16384, "seconds": 0.201878, "skipped": false, "status": "discard", "steps_per_sample": 8, "thread_execution_width": 32, "threadgroup_limit": 256, "threads_per_threadgroup": 256, "timestamp": "2026-06-21T19:04:53Z"}
