{"affine_conversion": "batch", "architecture": "shared_tame", "avg_dp_count": 288.0, "backend": "macos_cpu", "budget_sec": 5, "commit": "e3328d0", "correctness": true, "description": "Apple Silicon CPU shared-tame tiny 16-target kangaroo benchmark", "dp_bits": 0, "dp_bucket_storage": "inline_first", "dp_lookup": "hash", "expected_private_key": "0x7", "experiment": "jacobian_kangaroo_multi16_small", "found_private_key": "0x7", "found_target_index": 15, "iterations": 302, "jump_count": 8, "jump_table": "precomputed", "last_dp_count": 288, "machine": "macOS-26.5-arm64-arm-64bit-Mach-O", "max_steps": 4096, "min_ms": 50, "operation": "jacobian_kangaroo_multi_small", "ops_per_sec": 6038.259049, "point_passing": "const_ref", "range_bits": 8, "range_context": "precomputed", "reason": "", "sample_count": 1, "scratch": "reused", "seconds": 0.050014, "single_target_ops_per_sec": 12987.856354, "skipped": false, "speedup_vs_single": 0.464916, "start_scalar": "0x2", "status": "discard", "tame_states": 1, "target_count": 16, "target_throughput_vs_single": 7.438652, "timestamp": "2026-06-20T01:06:51Z", "wild_states": 16}
{"affine_conversion": "batch", "architecture": "single_target", "avg_dp_count": 53.0, "backend": "macos_cpu", "budget_sec": 5, "commit": "e3328d0", "correctness": true, "description": "Apple Silicon CPU single-target tiny kangaroo benchmark", "dp_bits": 0, "dp_bucket_storage": "inline_first", "dp_lookup": "hash", "expected_private_key": "0x7", "experiment": "jacobian_kangaroo_small", "found_private_key": "0x7", "found_target_index": 0, "iterations": 669, "jump_count": 8, "jump_table": "precomputed", "last_dp_count": 53, "machine": "macOS-26.5-arm64-arm-64bit-Mach-O", "max_steps": 4096, "min_ms": 50, "operation": "jacobian_kangaroo_small", "ops_per_sec": 13379.36448, "point_passing": "const_ref", "range_bits": 8, "range_context": "precomputed", "reason": "", "sample_count": 1, "scratch": "reused", "seconds": 0.050002, "skipped": false, "start_scalar": "0x0", "status": "keep", "tame_states": 1, "target_count": 1, "timestamp": "2026-06-20T01:07:02Z", "wild_states": 1}
{"affine_conversion": "batch", "architecture": "shared_tame", "avg_dp_count": 84.0, "backend": "macos_cpu", "budget_sec": 5, "commit": "5e098c3", "correctness": true, "description": "Apple Silicon CPU shared-tame tiny multi-target kangaroo benchmark", "dp_bits": 0, "dp_bucket_storage": "inline_first", "dp_lookup": "hash", "expected_private_key": "0x7", "experiment": "jacobian_kangaroo_multi_small", "found_private_key": "0x7", "found_target_index": 3, "iterations": 613, "jump_count": 8, "jump_table": "precomputed", "last_dp_count": 84, "machine": "macOS-26.5-arm64-arm-64bit-Mach-O", "max_steps": 4096, "min_ms": 50, "operation": "jacobian_kangaroo_multi_small", "ops_per_sec": 12248.445551, "ops_per_sec_max": 13014.64331, "ops_per_sec_min": 11806.304687, "point_passing": "const_ref", "range_bits": 8, "range_context": "precomputed", "reason": "", "runner_sample_count": 3, "sample_count": 1, "scratch": "reused", "seconds": 0.050047, "single_target_ops_per_sec": 12359.382031, "skipped": false, "speedup_vs_single": 0.991024, "start_scalar": "0x2", "status": "discard", "tame_states": 1, "target_count": 4, "target_throughput_vs_single": 3.964096, "timestamp": "2026-06-20T01:24:18Z", "wild_states": 4}
{"affine_conversion": "batch", "architecture": "shared_tame", "avg_dp_count": 288.0, "backend": "macos_cpu", "budget_sec": 5, "commit": "5e098c3", "correctness": true, "description": "Apple Silicon CPU shared-tame tiny 16-target kangaroo benchmark", "dp_bits": 0, "dp_bucket_storage": "inline_first", "dp_lookup": "hash", "expected_private_key": "0x7", "experiment": "jacobian_kangaroo_multi16_small", "found_private_key": "0x7", "found_target_index": 15, "iterations": 247, "jump_count": 8, "jump_table": "precomputed", "last_dp_count": 288, "machine": "macOS-26.5-arm64-arm-64bit-Mach-O", "max_steps": 4096, "min_ms": 50, "operation": "jacobian_kangaroo_multi_small", "ops_per_sec": 4931.772226, "ops_per_sec_max": 4971.945448, "ops_per_sec_min": 4930.935264, "point_passing": "const_ref", "range_bits": 8, "range_context": "precomputed", "reason": "", "runner_sample_count": 3, "sample_count": 1, "scratch": "reused", "seconds": 0.050083, "single_target_ops_per_sec": 10676.289989, "skipped": false, "speedup_vs_single": 0.461937, "start_scalar": "0x2", "status": "discard", "tame_states": 1, "target_count": 16, "target_throughput_vs_single": 7.39099, "timestamp": "2026-06-20T01:24:35Z", "wild_states": 16}
{"affine_conversion": "batch", "backend": "macos_cpu", "batch_points": 17, "budget_sec": 5, "checksum": "0xd3a5f728854ef380", "commit": "57a12e8", "correctness": true, "description": "Apple Silicon CPU Jacobian batch-to-affine conversion benchmark", "experiment": "jacobian_batch_affine", "iterations": 12032, "machine": "macOS-26.5-arm64-arm-64bit-Mach-O", "min_ms": 50, "operation": "jacobian_batch_affine", "ops_per_sec": 237491.653892, "ops_per_sec_max": 237491.653892, "ops_per_sec_min": 237491.653892, "points_per_sec": 4037358.116156, "reason": "", "runner_sample_count": 1, "sample_count": 256, "seconds": 0.050663, "skipped": false, "status": "keep", "timestamp": "2026-06-20T01:47:52Z", "wild_points": 16}
{"affine_conversion": "batch", "architecture": "shared_tame", "avg_dp_count": 84.0, "backend": "macos_cpu", "budget_sec": 5, "commit": "2488297", "correctness": true, "description": "Apple Silicon CPU shared-tame tiny multi-target kangaroo benchmark", "dp_bits": 0, "dp_bucket_storage": "inline_first", "dp_hash": "partial_limb_mix", "dp_lookup": "hash", "expected_private_key": "0x7", "experiment": "jacobian_kangaroo_multi_small", "found_private_key": "0x7", "found_target_index": 3, "iterations": 1253, "jump_count": 8, "jump_index": "power2_mask", "jump_table": "precomputed", "last_dp_count": 84, "machine": "macOS-26.5-arm64-arm-64bit-Mach-O", "max_steps": 4096, "min_ms": 50, "operation": "jacobian_kangaroo_multi_small", "ops_per_sec": 25052.964126, "ops_per_sec_max": 25075.068737, "ops_per_sec_min": 24998.812556, "paired_baseline_ops_per_sec": 24802.514227, "paired_baseline_ref": "main", "paired_speedup": 1.0100977625376124, "point_passing": "const_ref", "range_bits": 8, "range_context": "precomputed", "reason": "", "runner_sample_count": 3, "sample_count": 1, "scratch": "reused", "seconds": 0.050014, "single_target_ops_per_sec": 24410.723925, "skipped": false, "speedup_vs_single": 1.02631, "start_scalar": "0x2", "status": "keep", "tame_states": 1, "target_count": 4, "target_throughput_vs_single": 4.105239, "timestamp": "2026-06-20T12:22:40Z", "wild_states": 4}
{"affine_conversion": "batch", "architecture": "shared_tame", "avg_dp_count": 288.0, "backend": "macos_cpu", "budget_sec": 5, "commit": "2488297", "correctness": true, "description": "Apple Silicon CPU shared-tame tiny 16-target kangaroo benchmark", "dp_bits": 0, "dp_bucket_storage": "inline_first", "dp_hash": "partial_limb_mix", "dp_lookup": "hash", "expected_private_key": "0x7", "experiment": "jacobian_kangaroo_multi16_small", "found_private_key": "0x7", "found_target_index": 15, "iterations": 562, "jump_count": 8, "jump_index": "power2_mask", "jump_table": "precomputed", "last_dp_count": 288, "machine": "macOS-26.5-arm64-arm-64bit-Mach-O", "max_steps": 4096, "min_ms": 50, "operation": "jacobian_kangaroo_multi_small", "ops_per_sec": 11234.326665, "ops_per_sec_max": 11307.081659, "ops_per_sec_min": 11208.68864, "paired_baseline_ops_per_sec": 10963.390463, "paired_baseline_ref": "main", "paired_speedup": 1.024712811507934, "point_passing": "const_ref", "range_bits": 8, "range_context": "precomputed", "reason": "", "runner_sample_count": 3, "sample_count": 1, "scratch": "reused", "seconds": 0.050025, "single_target_ops_per_sec": 24359.598836, "skipped": false, "speedup_vs_single": 0.461187, "start_scalar": "0x2", "status": "keep", "tame_states": 1, "target_count": 16, "target_throughput_vs_single": 7.37899, "timestamp": "2026-06-20T12:23:07Z", "wild_states": 16}
{"affine_conversion": "batch", "architecture": "shared_tame", "avg_dp_count": 84.0, "backend": "macos_cpu", "budget_sec": 5, "commit": "581cc34", "correctness": true, "description": "Apple Silicon CPU shared-tame tiny multi-target kangaroo benchmark", "dp_bits": 0, "dp_bucket_storage": "inline_first", "dp_hash": "partial_limb_mix", "dp_lookup": "hash", "dp_reserve": "bounded_range_estimate", "expected_private_key": "0x7", "experiment": "jacobian_kangaroo_multi_small", "found_private_key": "0x7", "found_target_index": 3, "iterations": 1282, "jump_count": 8, "jump_index": "power2_mask", "jump_table": "precomputed", "last_dp_count": 84, "machine": "macOS-26.5-arm64-arm-64bit-Mach-O", "max_steps": 4096, "min_ms": 50, "operation": "jacobian_kangaroo_multi_small", "ops_per_sec": 25632.374369, "ops_per_sec_max": 25706.247158, "ops_per_sec_min": 25037.183317, "paired_baseline_ops_per_sec": 24926.477386, "paired_baseline_ref": "main", "paired_speedup": 1.028319163276415, "point_passing": "const_ref", "range_bits": 8, "range_context": "precomputed", "reason": "", "runner_sample_count": 3, "sample_count": 1, "scratch": "reused", "seconds": 0.050015, "single_target_ops_per_sec": 24695.595787, "skipped": false, "speedup_vs_single": 1.037933, "start_scalar": "0x2", "status": "keep", "tame_states": 1, "target_count": 4, "target_throughput_vs_single": 4.151732, "timestamp": "2026-06-20T12:41:08Z", "wild_states": 4}
{"affine_conversion": "batch", "architecture": "shared_tame", "avg_dp_count": 288.0, "backend": "macos_cpu", "budget_sec": 5, "commit": "581cc34", "correctness": true, "description": "Apple Silicon CPU shared-tame tiny 16-target kangaroo benchmark", "dp_bits": 0, "dp_bucket_storage": "inline_first", "dp_hash": "partial_limb_mix", "dp_lookup": "hash", "dp_reserve": "bounded_range_estimate", "expected_private_key": "0x7", "experiment": "jacobian_kangaroo_multi16_small", "found_private_key": "0x7", "found_target_index": 15, "iterations": 581, "jump_count": 8, "jump_index": "power2_mask", "jump_table": "precomputed", "last_dp_count": 288, "machine": "macOS-26.5-arm64-arm-64bit-Mach-O", "max_steps": 4096, "min_ms": 50, "operation": "jacobian_kangaroo_multi_small", "ops_per_sec": 11614.870176, "ops_per_sec_max": 11623.543155, "ops_per_sec_min": 11539.403874, "paired_baseline_ops_per_sec": 11244.660484, "paired_baseline_ref": "main", "paired_speedup": 1.0329231542852513, "point_passing": "const_ref", "range_bits": 8, "range_context": "precomputed", "reason": "", "runner_sample_count": 3, "sample_count": 1, "scratch": "reused", "seconds": 0.050022, "single_target_ops_per_sec": 24633.943991, "skipped": false, "speedup_vs_single": 0.471499, "start_scalar": "0x2", "status": "keep", "tame_states": 1, "target_count": 16, "target_throughput_vs_single": 7.543978, "timestamp": "2026-06-20T12:41:25Z", "wild_states": 16}
{"affine_active_path": "all_active_fast", "affine_buffer": "resize_reuse", "affine_conversion": "batch", "affine_z_access": "const_ref", "backend": "macos_cpu", "batch_points": 17, "budget_sec": 5, "checksum": "0xc4b75de192d34a80", "commit": "937a58a", "correctness": true, "description": "Apple Silicon CPU Jacobian batch-to-affine conversion benchmark", "experiment": "jacobian_batch_affine", "field_rhs_passing": "const_ref", "iterations": 27904, "machine": "macOS-26.5-arm64-arm-64bit-Mach-O", "min_ms": 50, "operation": "jacobian_batch_affine", "ops_per_sec": 552688.523454, "ops_per_sec_max": 552688.523454, "ops_per_sec_min": 552688.523454, "paired_baseline_ops_per_sec": 534344.506097, "paired_baseline_ref": "main", "paired_speedup": 1.0343299447223473, "points_per_sec": 9395704.898713, "reason": "", "runner_sample_count": 1, "sample_count": 256, "seconds": 0.050488, "skipped": false, "status": "keep", "timestamp": "2026-06-20T13:12:39Z", "wild_points": 16}
{"avg_jump_distance": 4088.375562, "backend": "macos_cpu", "budget_sec": 5, "checksum": "0xd1d55292f4434aa7", "commit": "937a58a", "correctness": true, "description": "Apple Silicon CPU deterministic Jacobian jump-table walk benchmark with scalar-distance oracle", "experiment": "jacobian_jump_walk", "final_scalar": "0x34e6be7c", "iterations": 217088, "jacobian_step_passing": "const_ref", "jump_count": 16, "jump_index": "power2_mask", "machine": "macOS-26.5-arm64-arm-64bit-Mach-O", "min_ms": 50, "operation": "jacobian_jump_walk", "ops_per_sec": 4340776.119685, "ops_per_sec_max": 4340776.119685, "ops_per_sec_min": 4340776.119685, "paired_baseline_ops_per_sec": 4084327.054696, "paired_baseline_ref": "main", "paired_speedup": 1.062788572402434, "reason": "", "runner_sample_count": 1, "sample_count": 256, "scalar_distance": "0x34e6be7a", "seconds": 0.050011, "skipped": false, "start_scalar": "0x2", "status": "keep", "timestamp": "2026-06-20T13:13:02Z"}
{"affine_active_path": "all_active_fast", "affine_buffer": "resize_reuse", "affine_conversion": "batch", "affine_z_access": "const_ref", "architecture": "shared_tame", "avg_dp_count": 84.0, "backend": "macos_cpu", "budget_sec": 5, "commit": "937a58a", "correctness": true, "description": "Apple Silicon CPU shared-tame tiny multi-target kangaroo benchmark", "dp_bits": 0, "dp_bucket_storage": "inline_first", "dp_hash": "partial_limb_mix", "dp_lookup": "hash", "dp_reserve": "bounded_range_estimate", "expected_private_key": "0x7", "experiment": "jacobian_kangaroo_multi_small", "field_rhs_passing": "const_ref", "found_private_key": "0x7", "found_target_index": 3, "iterations": 1304, "jacobian_step_passing": "const_ref", "jump_count": 8, "jump_index": "power2_mask", "jump_table": "precomputed", "last_dp_count": 84, "machine": "macOS-26.5-arm64-arm-64bit-Mach-O", "max_steps": 4096, "min_ms": 50, "operation": "jacobian_kangaroo_multi_small", "ops_per_sec": 26061.517693, "ops_per_sec_max": 26067.335967, "ops_per_sec_min": 26018.0705, "paired_baseline_ops_per_sec": 25392.974272, "paired_baseline_ref": "main", "paired_speedup": 1.0263278895114378, "point_passing": "const_ref", "range_bits": 8, "range_context": "precomputed", "reason": "", "runner_sample_count": 3, "sample_count": 1, "scratch": "reused", "seconds": 0.050035, "single_target_ops_per_sec": 25117.781095, "skipped": false, "speedup_vs_single": 1.037572, "start_scalar": "0x2", "status": "keep", "tame_states": 1, "target_count": 4, "target_throughput_vs_single": 4.15029, "timestamp": "2026-06-20T13:13:19Z", "wild_states": 4}
{"affine_active_path": "all_active_fast", "affine_buffer": "resize_reuse", "affine_conversion": "batch", "affine_z_access": "const_ref", "architecture": "shared_tame", "avg_dp_count": 288.0, "backend": "macos_cpu", "budget_sec": 5, "commit": "937a58a", "correctness": true, "description": "Apple Silicon CPU shared-tame tiny 16-target kangaroo benchmark", "dp_bits": 0, "dp_bucket_storage": "inline_first", "dp_hash": "partial_limb_mix", "dp_lookup": "hash", "dp_reserve": "bounded_range_estimate", "expected_private_key": "0x7", "experiment": "jacobian_kangaroo_multi16_small", "field_rhs_passing": "const_ref", "found_private_key": "0x7", "found_target_index": 15, "iterations": 598, "jacobian_step_passing": "const_ref", "jump_count": 8, "jump_index": "power2_mask", "jump_table": "precomputed", "last_dp_count": 288, "machine": "macOS-26.5-arm64-arm-64bit-Mach-O", "max_steps": 4096, "min_ms": 50, "operation": "jacobian_kangaroo_multi_small", "ops_per_sec": 11958.694589, "ops_per_sec_max": 11988.830247, "ops_per_sec_min": 11947.455172, "paired_baseline_ops_per_sec": 11588.932569, "paired_baseline_ref": "main", "paired_speedup": 1.031906477822565, "point_passing": "const_ref", "range_bits": 8, "range_context": "precomputed", "reason": "", "runner_sample_count": 3, "sample_count": 1, "scratch": "reused", "seconds": 0.050005, "single_target_ops_per_sec": 25022.588782, "skipped": false, "speedup_vs_single": 0.477916, "start_scalar": "0x2", "status": "keep", "tame_states": 1, "target_count": 16, "target_throughput_vs_single": 7.646655, "timestamp": "2026-06-20T13:13:36Z", "wild_states": 16}
{"affine_active_path": "all_active_fast", "affine_buffer": "resize_reuse", "affine_conversion": "batch", "affine_z_access": "const_ref", "architecture": "shared_tame", "avg_dp_count": 84.0, "backend": "macos_cpu", "budget_sec": 5, "commit": "f4f7e27", "correctness": true, "description": "Apple Silicon CPU shared-tame tiny multi-target kangaroo benchmark", "dp_bits": 0, "dp_bucket_storage": "inline_first", "dp_hash": "partial_limb_mix", "dp_lookup": "open_address_linear", "dp_reserve": "bounded_range_estimate", "expected_private_key": "0x7", "experiment": "jacobian_kangaroo_multi_small", "field_rhs_passing": "const_ref", "found_private_key": "0x7", "found_target_index": 3, "iterations": 1333, "jacobian_step_passing": "const_ref", "jump_count": 8, "jump_index": "power2_mask", "jump_table": "precomputed", "last_dp_count": 84, "machine": "macOS-26.5-arm64-arm-64bit-Mach-O", "max_steps": 4096, "min_ms": 50, "operation": "jacobian_kangaroo_multi_small", "ops_per_sec": 26640.995912, "ops_per_sec_max": 26871.244274, "ops_per_sec_min": 26564.238906, "paired_baseline_ops_per_sec": 25935.007511, "paired_baseline_ref": "main", "paired_speedup": 1.0272214457890774, "point_passing": "const_ref", "range_bits": 8, "range_context": "precomputed", "reason": "", "runner_sample_count": 3, "sample_count": 1, "scratch": "reused", "seconds": 0.050036, "single_target_ops_per_sec": 25593.068373, "skipped": false, "speedup_vs_single": 1.040946, "start_scalar": "0x2", "status": "keep", "tame_states": 1, "target_count": 4, "target_throughput_vs_single": 4.163783, "timestamp": "2026-06-20T13:42:54Z", "wild_states": 4}
{"affine_active_path": "all_active_fast", "affine_buffer": "resize_reuse", "affine_conversion": "batch", "affine_z_access": "const_ref", "architecture": "shared_tame", "avg_dp_count": 288.0, "backend": "macos_cpu", "budget_sec": 5, "commit": "f4f7e27", "correctness": true, "description": "Apple Silicon CPU shared-tame tiny 16-target kangaroo benchmark", "dp_bits": 0, "dp_bucket_storage": "inline_first", "dp_hash": "partial_limb_mix", "dp_lookup": "open_address_linear", "dp_reserve": "bounded_range_estimate", "expected_private_key": "0x7", "experiment": "jacobian_kangaroo_multi16_small", "field_rhs_passing": "const_ref", "found_private_key": "0x7", "found_target_index": 15, "iterations": 638, "jacobian_step_passing": "const_ref", "jump_count": 8, "jump_index": "power2_mask", "jump_table": "precomputed", "last_dp_count": 288, "machine": "macOS-26.5-arm64-arm-64bit-Mach-O", "max_steps": 4096, "min_ms": 50, "operation": "jacobian_kangaroo_multi_small", "ops_per_sec": 12748.016864, "ops_per_sec_max": 12773.25138, "ops_per_sec_min": 12705.24083, "paired_baseline_ops_per_sec": 11918.013744, "paired_baseline_ref": "main", "paired_speedup": 1.0696427389520218, "point_passing": "const_ref", "range_bits": 8, "range_context": "precomputed", "reason": "", "runner_sample_count": 3, "sample_count": 1, "scratch": "reused", "seconds": 0.050047, "single_target_ops_per_sec": 25807.397216, "skipped": false, "speedup_vs_single": 0.493968, "start_scalar": "0x2", "status": "keep", "tame_states": 1, "target_count": 16, "target_throughput_vs_single": 7.903481, "timestamp": "2026-06-20T13:43:12Z", "wild_states": 16}
{"affine_conversion": "batch", "architecture": "single_target", "avg_dp_count": 53.0, "backend": "macos_cpu", "budget_sec": 5, "commit": "f4f7e27", "correctness": true, "description": "Apple Silicon CPU single-target tiny kangaroo benchmark", "dp_bits": 0, "dp_bucket_storage": "inline_first", "dp_hash": "partial_limb_mix", "dp_lookup": "open_address_linear", "dp_reserve": "bounded_range_estimate", "expected_private_key": "0x7", "experiment": "jacobian_kangaroo_small", "field_rhs_passing": "const_ref", "found_private_key": "0x7", "found_target_index": 0, "iterations": 1290, "jacobian_step_passing": "const_ref", "jump_count": 8, "jump_index": "power2_mask", "jump_table": "precomputed", "last_dp_count": 53, "machine": "macOS-26.5-arm64-arm-64bit-Mach-O", "max_steps": 4096, "min_ms": 50, "operation": "jacobian_kangaroo_small", "ops_per_sec": 25796.474654, "ops_per_sec_max": 25796.474654, "ops_per_sec_min": 25796.474654, "paired_baseline_ops_per_sec": 24968.951239, "paired_baseline_ref": "main", "paired_speedup": 1.0331420974425012, "point_passing": "const_ref", "range_bits": 8, "range_context": "precomputed", "reason": "", "runner_sample_count": 1, "sample_count": 1, "scratch": "reused", "seconds": 0.050007, "skipped": false, "start_scalar": "0x0", "status": "keep", "tame_states": 1, "target_count": 1, "timestamp": "2026-06-20T13:43:27Z", "wild_states": 1}
