{"affine_active_path": "all_active_fast", "affine_buffer": "resize_reuse", "affine_conversion": "batch", "affine_field_ops": "inplace", "affine_initial_conversion": "unit_z_copy", "affine_reverse_loop": "split_zero", "affine_tail_update": "skip_final", "affine_z_access": "const_ref", "affine_z_check": "infinity_flag", "architecture": "shared_tame", "avg_dp_count": 84.0, "backend": "macos_cpu", "budget_sec": 8, "candidate_verification": "full_point_collision", "commit": "ac0a8a0-dirty", "confirmation_index": 1, "confirmation_runs": 3, "confirmation_status": "discard", "cooldown_sec": 0.0, "correctness": true, "description": "Apple Silicon CPU shared-tame tiny multi-target kangaroo benchmark", "dp_bits": 0, "dp_bucket_storage": "inline_first", "dp_capacity": "max_load_2of3", "dp_clear": "empty_guard", "dp_hash": "partial_limb_mix", "dp_key": "x_parity", "dp_lookup": "open_address_linear", "dp_reserve": "sqrt_range_estimate", "ecint_carry_impl": "clang_builtin", "ecint_mul_final_sub": "single_conditional", "expected_private_key": "0x7", "experiment": "jacobian_kangaroo_multi_small", "field_rhs_passing": "const_ref", "found_private_key": "0x7", "found_target_index": 3, "iterations": 1788, "jacobian_step_passing": "const_ref", "jump_count": 8, "jump_index": "power2_mask", "jump_table": "precomputed", "last_dp_count": 84, "machine": "macOS-26.5-arm64-arm-64bit-Mach-O", "max_steps": 4096, "min_ms": 50, "operation": "jacobian_kangaroo_multi_small", "ops_per_sec": 35741.474479, "ops_per_sec_max": 35810.599718, "ops_per_sec_min": 33770.628651, "paired_baseline_ops_per_sec": 35646.157171, "paired_baseline_ref": "main", "paired_speedup": 1.0026739855166644, "point_passing": "const_ref", "range_bits": 8, "range_context": "precomputed", "raw_status": "discard", "reason": "", "runner_sample_count": 3, "sample_count": 1, "scratch": "reused", "seconds": 0.050026, "single_target_ops_per_sec": 31677.624178, "skipped": false, "speedup_vs_single": 1.128288, "start_scalar": "0x2", "status": "discard", "tame_states": 1, "target_count": 4, "target_throughput_vs_single": 4.513151, "timestamp": "2026-06-23T17:26:22Z", "wild_states": 4}
{"affine_active_path": "all_active_fast", "affine_buffer": "resize_reuse", "affine_conversion": "batch", "affine_field_ops": "inplace", "affine_initial_conversion": "unit_z_copy", "affine_reverse_loop": "split_zero", "affine_tail_update": "skip_final", "affine_z_access": "const_ref", "affine_z_check": "infinity_flag", "architecture": "shared_tame", "avg_dp_count": 84.0, "backend": "macos_cpu", "budget_sec": 8, "candidate_verification": "full_point_collision", "commit": "ac0a8a0-dirty", "confirmation_index": 2, "confirmation_runs": 3, "confirmation_status": "discard", "cooldown_sec": 0.0, "correctness": true, "description": "Apple Silicon CPU shared-tame tiny multi-target kangaroo benchmark", "dp_bits": 0, "dp_bucket_storage": "inline_first", "dp_capacity": "max_load_2of3", "dp_clear": "empty_guard", "dp_hash": "partial_limb_mix", "dp_key": "x_parity", "dp_lookup": "open_address_linear", "dp_reserve": "sqrt_range_estimate", "ecint_carry_impl": "clang_builtin", "ecint_mul_final_sub": "single_conditional", "expected_private_key": "0x7", "experiment": "jacobian_kangaroo_multi_small", "field_rhs_passing": "const_ref", "found_private_key": "0x7", "found_target_index": 3, "iterations": 1789, "jacobian_step_passing": "const_ref", "jump_count": 8, "jump_index": "power2_mask", "jump_table": "precomputed", "last_dp_count": 84, "machine": "macOS-26.5-arm64-arm-64bit-Mach-O", "max_steps": 4096, "min_ms": 50, "operation": "jacobian_kangaroo_multi_small", "ops_per_sec": 35763.697476, "ops_per_sec_max": 35764.76993, "ops_per_sec_min": 35732.22824, "paired_baseline_ops_per_sec": 35621.951782, "paired_baseline_ref": "main", "paired_speedup": 1.0039791669717444, "point_passing": "const_ref", "range_bits": 8, "range_context": "precomputed", "raw_status": "discard", "reason": "", "runner_sample_count": 3, "sample_count": 1, "scratch": "reused", "seconds": 0.050023, "single_target_ops_per_sec": 31832.095454, "skipped": false, "speedup_vs_single": 1.123511, "start_scalar": "0x2", "status": "discard", "tame_states": 1, "target_count": 4, "target_throughput_vs_single": 4.494043, "timestamp": "2026-06-23T17:26:22Z", "wild_states": 4}
{"affine_active_path": "all_active_fast", "affine_buffer": "resize_reuse", "affine_conversion": "batch", "affine_field_ops": "inplace", "affine_initial_conversion": "unit_z_copy", "affine_reverse_loop": "split_zero", "affine_tail_update": "skip_final", "affine_z_access": "const_ref", "affine_z_check": "infinity_flag", "architecture": "shared_tame", "avg_dp_count": 84.0, "backend": "macos_cpu", "budget_sec": 8, "candidate_verification": "full_point_collision", "commit": "ac0a8a0-dirty", "confirmation_index": 3, "confirmation_runs": 3, "confirmation_status": "discard", "cooldown_sec": 0.0, "correctness": true, "description": "Apple Silicon CPU shared-tame tiny multi-target kangaroo benchmark", "dp_bits": 0, "dp_bucket_storage": "inline_first", "dp_capacity": "max_load_2of3", "dp_clear": "empty_guard", "dp_hash": "partial_limb_mix", "dp_key": "x_parity", "dp_lookup": "open_address_linear", "dp_reserve": "sqrt_range_estimate", "ecint_carry_impl": "clang_builtin", "ecint_mul_final_sub": "single_conditional", "expected_private_key": "0x7", "experiment": "jacobian_kangaroo_multi_small", "field_rhs_passing": "const_ref", "found_private_key": "0x7", "found_target_index": 3, "iterations": 1784, "jacobian_step_passing": "const_ref", "jump_count": 8, "jump_index": "power2_mask", "jump_table": "precomputed", "last_dp_count": 84, "machine": "macOS-26.5-arm64-arm-64bit-Mach-O", "max_steps": 4096, "min_ms": 50, "operation": "jacobian_kangaroo_multi_small", "ops_per_sec": 35677.651697, "ops_per_sec_max": 35785.446775, "ops_per_sec_min": 35514.525081, "paired_baseline_ops_per_sec": 35216.624839, "paired_baseline_ref": "main", "paired_speedup": 1.0130911710053898, "point_passing": "const_ref", "range_bits": 8, "range_context": "precomputed", "raw_status": "keep", "reason": "", "runner_sample_count": 3, "sample_count": 1, "scratch": "reused", "seconds": 0.050003, "single_target_ops_per_sec": 31053.271998, "skipped": false, "speedup_vs_single": 1.148918, "start_scalar": "0x2", "status": "discard", "tame_states": 1, "target_count": 4, "target_throughput_vs_single": 4.595671, "timestamp": "2026-06-23T17:26:22Z", "wild_states": 4}
{"affine_active_path": "all_active_fast", "affine_buffer": "resize_reuse", "affine_conversion": "batch", "affine_field_ops": "inplace", "affine_initial_conversion": "unit_z_copy", "affine_reverse_loop": "split_zero", "affine_tail_update": "skip_final", "affine_z_access": "const_ref", "affine_z_check": "infinity_flag", "architecture": "shared_tame", "avg_dp_count": 84.0, "backend": "macos_cpu", "budget_sec": 8, "candidate_verification": "full_point_collision", "commit": "3317804-dirty", "confirmation_index": 1, "confirmation_runs": 3, "confirmation_status": "discard", "cooldown_sec": 0.0, "correctness": true, "description": "Apple Silicon CPU shared-tame tiny multi-target kangaroo benchmark", "dp_bits": 0, "dp_bucket_storage": "inline_first", "dp_capacity": "max_load_2of3", "dp_clear": "empty_guard", "dp_hash": "partial_limb_mix", "dp_key": "x_parity", "dp_lookup": "open_address_linear", "dp_reserve": "sqrt_range_estimate", "ecint_carry_impl": "clang_builtin", "ecint_mul_final_sub": "single_conditional", "expected_private_key": "0x7", "experiment": "jacobian_kangaroo_multi_small", "field_rhs_passing": "const_ref", "found_private_key": "0x7", "found_target_index": 3, "iterations": 1791, "jacobian_step_passing": "const_ref", "jump_count": 8, "jump_index": "power2_mask", "jump_table": "precomputed", "last_dp_count": 84, "machine": "macOS-26.5-arm64-arm-64bit-Mach-O", "max_steps": 4096, "min_ms": 50, "operation": "jacobian_kangaroo_multi_small", "ops_per_sec": 35804.664146, "ops_per_sec_max": 35828.355784, "ops_per_sec_min": 33571.13185, "paired_baseline_ops_per_sec": 35685.10147, "paired_baseline_ref": "main", "paired_speedup": 1.0033504928128203, "point_passing": "const_ref", "range_bits": 8, "range_context": "precomputed", "raw_status": "discard", "reason": "", "runner_sample_count": 3, "sample_count": 1, "scratch": "reused", "seconds": 0.050021, "single_target_ops_per_sec": 31706.15519, "skipped": false, "speedup_vs_single": 1.129265, "start_scalar": "0x2", "status": "discard", "tame_states": 1, "target_count": 4, "target_throughput_vs_single": 4.517062, "timestamp": "2026-06-23T17:31:33Z", "wild_states": 4}
{"affine_active_path": "all_active_fast", "affine_buffer": "resize_reuse", "affine_conversion": "batch", "affine_field_ops": "inplace", "affine_initial_conversion": "unit_z_copy", "affine_reverse_loop": "split_zero", "affine_tail_update": "skip_final", "affine_z_access": "const_ref", "affine_z_check": "infinity_flag", "architecture": "shared_tame", "avg_dp_count": 84.0, "backend": "macos_cpu", "budget_sec": 8, "candidate_verification": "full_point_collision", "commit": "3317804-dirty", "confirmation_index": 2, "confirmation_runs": 3, "confirmation_status": "discard", "cooldown_sec": 0.0, "correctness": true, "description": "Apple Silicon CPU shared-tame tiny multi-target kangaroo benchmark", "dp_bits": 0, "dp_bucket_storage": "inline_first", "dp_capacity": "max_load_2of3", "dp_clear": "empty_guard", "dp_hash": "partial_limb_mix", "dp_key": "x_parity", "dp_lookup": "open_address_linear", "dp_reserve": "sqrt_range_estimate", "ecint_carry_impl": "clang_builtin", "ecint_mul_final_sub": "single_conditional", "expected_private_key": "0x7", "experiment": "jacobian_kangaroo_multi_small", "field_rhs_passing": "const_ref", "found_private_key": "0x7", "found_target_index": 3, "iterations": 1789, "jacobian_step_passing": "const_ref", "jump_count": 8, "jump_index": "power2_mask", "jump_table": "precomputed", "last_dp_count": 84, "machine": "macOS-26.5-arm64-arm-64bit-Mach-O", "max_steps": 4096, "min_ms": 50, "operation": "jacobian_kangaroo_multi_small", "ops_per_sec": 35772.607233, "ops_per_sec_max": 35780.797162, "ops_per_sec_min": 23859.979958, "paired_baseline_ops_per_sec": 35712.827436, "paired_baseline_ref": "main", "paired_speedup": 1.0016739026644454, "point_passing": "const_ref", "range_bits": 8, "range_context": "precomputed", "raw_status": "discard", "reason": "", "runner_sample_count": 3, "sample_count": 1, "scratch": "reused", "seconds": 0.05001, "single_target_ops_per_sec": 31646.682443, "skipped": false, "speedup_vs_single": 1.130375, "start_scalar": "0x2", "status": "discard", "tame_states": 1, "target_count": 4, "target_throughput_vs_single": 4.521499, "timestamp": "2026-06-23T17:31:33Z", "wild_states": 4}
{"affine_active_path": "all_active_fast", "affine_buffer": "resize_reuse", "affine_conversion": "batch", "affine_field_ops": "inplace", "affine_initial_conversion": "unit_z_copy", "affine_reverse_loop": "split_zero", "affine_tail_update": "skip_final", "affine_z_access": "const_ref", "affine_z_check": "infinity_flag", "architecture": "shared_tame", "avg_dp_count": 84.0, "backend": "macos_cpu", "budget_sec": 8, "candidate_verification": "full_point_collision", "commit": "3317804-dirty", "confirmation_index": 3, "confirmation_runs": 3, "confirmation_status": "discard", "cooldown_sec": 0.0, "correctness": true, "description": "Apple Silicon CPU shared-tame tiny multi-target kangaroo benchmark", "dp_bits": 0, "dp_bucket_storage": "inline_first", "dp_capacity": "max_load_2of3", "dp_clear": "empty_guard", "dp_hash": "partial_limb_mix", "dp_key": "x_parity", "dp_lookup": "open_address_linear", "dp_reserve": "sqrt_range_estimate", "ecint_carry_impl": "clang_builtin", "ecint_mul_final_sub": "single_conditional", "expected_private_key": "0x7", "experiment": "jacobian_kangaroo_multi_small", "field_rhs_passing": "const_ref", "found_private_key": "0x7", "found_target_index": 3, "iterations": 1792, "jacobian_step_passing": "const_ref", "jump_count": 8, "jump_index": "power2_mask", "jump_table": "precomputed", "last_dp_count": 84, "machine": "macOS-26.5-arm64-arm-64bit-Mach-O", "max_steps": 4096, "min_ms": 50, "operation": "jacobian_kangaroo_multi_small", "ops_per_sec": 35827.520558, "ops_per_sec_max": 35831.639762, "ops_per_sec_min": 33528.740378, "paired_baseline_ops_per_sec": 35439.645604, "paired_baseline_ref": "main", "paired_speedup": 1.0109446623234917, "point_passing": "const_ref", "range_bits": 8, "range_context": "precomputed", "raw_status": "keep", "reason": "", "runner_sample_count": 3, "sample_count": 1, "scratch": "reused", "seconds": 0.050017, "single_target_ops_per_sec": 31663.060263, "skipped": false, "speedup_vs_single": 1.131524, "start_scalar": "0x2", "status": "discard", "tame_states": 1, "target_count": 4, "target_throughput_vs_single": 4.526097, "timestamp": "2026-06-23T17:31:33Z", "wild_states": 4}
{"affine_active_path": "all_active_fast", "affine_buffer": "resize_reuse", "affine_conversion": "batch", "affine_field_ops": "inplace", "affine_initial_conversion": "unit_z_copy", "affine_reverse_loop": "split_zero", "affine_tail_update": "skip_final", "affine_z_access": "const_ref", "affine_z_check": "infinity_flag", "architecture": "shared_tame", "avg_dp_count": 84.0, "backend": "macos_cpu", "budget_sec": 8, "candidate_verification": "full_point_collision", "commit": "3317804-dirty", "confirmation_index": 1, "confirmation_runs": 3, "confirmation_status": "discard", "cooldown_sec": 0.0, "correctness": true, "description": "Apple Silicon CPU shared-tame tiny multi-target kangaroo benchmark", "dp_bits": 0, "dp_bucket_storage": "inline_first", "dp_capacity": "max_load_2of3", "dp_clear": "empty_guard", "dp_hash": "partial_limb_mix", "dp_key": "x_parity", "dp_lookup": "open_address_linear", "dp_reserve": "sqrt_range_estimate", "ecint_carry_impl": "clang_builtin", "ecint_mul_final_sub": "single_conditional", "expected_private_key": "0x7", "experiment": "jacobian_kangaroo_multi_small", "field_rhs_passing": "const_ref", "found_private_key": "0x7", "found_target_index": 3, "iterations": 1780, "jacobian_step_passing": "const_ref", "jump_count": 8, "jump_index": "power2_mask", "jump_table": "precomputed", "last_dp_count": 84, "machine": "macOS-26.5-arm64-arm-64bit-Mach-O", "max_steps": 4096, "min_ms": 50, "operation": "jacobian_kangaroo_multi_small", "ops_per_sec": 35599.347108, "ops_per_sec_max": 35600.567786, "ops_per_sec_min": 34118.379377, "paired_baseline_ops_per_sec": 35729.817002, "paired_baseline_ref": "main", "paired_speedup": 0.9963484309479476, "point_passing": "const_ref", "range_bits": 8, "range_context": "precomputed", "raw_status": "discard", "reason": "", "runner_sample_count": 3, "sample_count": 1, "scratch": "reused", "seconds": 0.050001, "single_target_ops_per_sec": 32026.548849, "skipped": false, "speedup_vs_single": 1.111557, "start_scalar": "0x2", "status": "discard", "tame_states": 1, "target_count": 4, "target_throughput_vs_single": 4.44623, "timestamp": "2026-06-23T17:35:49Z", "wild_states": 4}
{"affine_active_path": "all_active_fast", "affine_buffer": "resize_reuse", "affine_conversion": "batch", "affine_field_ops": "inplace", "affine_initial_conversion": "unit_z_copy", "affine_reverse_loop": "split_zero", "affine_tail_update": "skip_final", "affine_z_access": "const_ref", "affine_z_check": "infinity_flag", "architecture": "shared_tame", "avg_dp_count": 84.0, "backend": "macos_cpu", "budget_sec": 8, "candidate_verification": "full_point_collision", "commit": "3317804-dirty", "confirmation_index": 2, "confirmation_runs": 3, "confirmation_status": "discard", "cooldown_sec": 0.0, "correctness": true, "description": "Apple Silicon CPU shared-tame tiny multi-target kangaroo benchmark", "dp_bits": 0, "dp_bucket_storage": "inline_first", "dp_capacity": "max_load_2of3", "dp_clear": "empty_guard", "dp_hash": "partial_limb_mix", "dp_key": "x_parity", "dp_lookup": "open_address_linear", "dp_reserve": "sqrt_range_estimate", "ecint_carry_impl": "clang_builtin", "ecint_mul_final_sub": "single_conditional", "expected_private_key": "0x7", "experiment": "jacobian_kangaroo_multi_small", "field_rhs_passing": "const_ref", "found_private_key": "0x7", "found_target_index": 3, "iterations": 1781, "jacobian_step_passing": "const_ref", "jump_count": 8, "jump_index": "power2_mask", "jump_table": "precomputed", "last_dp_count": 84, "machine": "macOS-26.5-arm64-arm-64bit-Mach-O", "max_steps": 4096, "min_ms": 50, "operation": "jacobian_kangaroo_multi_small", "ops_per_sec": 35606.706592, "ops_per_sec_max": 35672.65714, "ops_per_sec_min": 35497.3377, "paired_baseline_ops_per_sec": 35772.100805, "paired_baseline_ref": "main", "paired_speedup": 0.9953764467482189, "point_passing": "const_ref", "range_bits": 8, "range_context": "precomputed", "raw_status": "discard", "reason": "", "runner_sample_count": 3, "sample_count": 1, "scratch": "reused", "seconds": 0.050019, "single_target_ops_per_sec": 31630.985169, "skipped": false, "speedup_vs_single": 1.125691, "start_scalar": "0x2", "status": "discard", "tame_states": 1, "target_count": 4, "target_throughput_vs_single": 4.502763, "timestamp": "2026-06-23T17:35:49Z", "wild_states": 4}
{"affine_active_path": "all_active_fast", "affine_buffer": "resize_reuse", "affine_conversion": "batch", "affine_field_ops": "inplace", "affine_initial_conversion": "unit_z_copy", "affine_reverse_loop": "split_zero", "affine_tail_update": "skip_final", "affine_z_access": "const_ref", "affine_z_check": "infinity_flag", "architecture": "shared_tame", "avg_dp_count": 84.0, "backend": "macos_cpu", "budget_sec": 8, "candidate_verification": "full_point_collision", "commit": "3317804-dirty", "confirmation_index": 3, "confirmation_runs": 3, "confirmation_status": "discard", "cooldown_sec": 0.0, "correctness": true, "description": "Apple Silicon CPU shared-tame tiny multi-target kangaroo benchmark", "dp_bits": 0, "dp_bucket_storage": "inline_first", "dp_capacity": "max_load_2of3", "dp_clear": "empty_guard", "dp_hash": "partial_limb_mix", "dp_key": "x_parity", "dp_lookup": "open_address_linear", "dp_reserve": "sqrt_range_estimate", "ecint_carry_impl": "clang_builtin", "ecint_mul_final_sub": "single_conditional", "expected_private_key": "0x7", "experiment": "jacobian_kangaroo_multi_small", "field_rhs_passing": "const_ref", "found_private_key": "0x7", "found_target_index": 3, "iterations": 1777, "jacobian_step_passing": "const_ref", "jump_count": 8, "jump_index": "power2_mask", "jump_table": "precomputed", "last_dp_count": 84, "machine": "macOS-26.5-arm64-arm-64bit-Mach-O", "max_steps": 4096, "min_ms": 50, "operation": "jacobian_kangaroo_multi_small", "ops_per_sec": 35530.19935, "ops_per_sec_max": 35717.380487, "ops_per_sec_min": 35525.967243, "paired_baseline_ops_per_sec": 35747.875036, "paired_baseline_ref": "main", "paired_speedup": 0.9939108076835117, "point_passing": "const_ref", "range_bits": 8, "range_context": "precomputed", "raw_status": "discard", "reason": "", "runner_sample_count": 3, "sample_count": 1, "scratch": "reused", "seconds": 0.050014, "single_target_ops_per_sec": 31688.829688, "skipped": false, "speedup_vs_single": 1.121222, "start_scalar": "0x2", "status": "discard", "tame_states": 1, "target_count": 4, "target_throughput_vs_single": 4.484886, "timestamp": "2026-06-23T17:35:49Z", "wild_states": 4}
{"affine_active_path": "all_active_fast", "affine_buffer": "resize_reuse", "affine_conversion": "batch", "affine_field_ops": "inplace", "affine_initial_conversion": "unit_z_copy", "affine_reverse_loop": "split_zero", "affine_tail_update": "skip_final", "affine_z_access": "const_ref", "affine_z_check": "infinity_flag", "architecture": "shared_tame", "avg_dp_count": 7611.0, "backend": "macos_cpu", "budget_sec": 5, "candidate_verification": "full_point_collision", "commit": "2f23769-dirty", "cooldown_sec": 0.0, "correctness": true, "description": "Apple Silicon CPU shared-tame tiny 16-target kangaroo benchmark with the scaled4-balanced jump schedule", "dp_bits": 4, "dp_bucket_storage": "inline_first", "dp_capacity": "max_load_2of3", "dp_clear": "empty_guard", "dp_hash": "partial_limb_mix", "dp_key": "x_parity", "dp_lookup": "open_address_linear", "dp_reserve": "sqrt_range_estimate", "ecint_carry_impl": "clang_builtin", "ecint_mul_final_sub": "single_conditional", "expected_private_key": "0x7", "experiment": "jacobian_kangaroo_multi16_scaled4_balanced", "field_rhs_passing": "const_ref", "found_private_key": "0x7", "found_target_index": 15, "iterations": 2, "jacobian_step_passing": "const_ref", "jump_count": 4, "jump_index": "power2_mask", "jump_schedule": "scaled4_balanced", "jump_table": "precomputed", "last_dp_count": 7611, "machine": "macOS-26.5-arm64-arm-64bit-Mach-O", "max_steps": 500000, "min_ms": 50, "operation": "jacobian_kangaroo_multi_small", "ops_per_sec": 31.011318, "ops_per_sec_max": 31.490629, "ops_per_sec_min": 30.397081, "point_passing": "const_ref", "range_bits": 20, "range_context": "precomputed", "reason": "", "runner_sample_count": 3, "sample_count": 1, "scratch": "reused", "seconds": 0.064493, "single_target_ops_per_sec": 159.43467, "skipped": false, "speedup_vs_single": 0.194508, "start_scalar": "0x2", "status": "keep", "tame_states": 1, "target_count": 16, "target_throughput_vs_single": 3.112128, "timestamp": "2026-06-23T18:49:26Z", "wild_states": 16}
