{"backend": "metal", "budget_sec": 5, "commit": "2f23769-dirty", "cooldown_sec": 0.0, "correctness": true, "description": "Metal dynamic DP8 stream using XYZZ 512-step packets with the scaled4-balanced 4-jump schedule", "distance_tracking": "dp_stream_uint64", "dp_bits": 8, "dp_capacity": 524288, "dp_checksum": "0x564364b08c72a1da", "dp_count": 2060, "dp_distance_checksum": "0x3ea0b5a3cd958a70", "dp_stream_overflow": false, "dp_tracking": "projective_x_limb0", "emitted_records": 2060, "experiment": "metal_jacobian_dynamic_dp_stream_xyzz_scaled4_balanced", "iterations": 268435456, "jump_count": 4, "jump_histogram_max_bucket": 67116383, "jump_histogram_max_deviation_ppm": 170, "jump_histogram_min_bucket": 67097486, "jump_index": "power2_mask", "jump_mixer": "avalanche64", "jump_schedule": "scaled4_balanced", "machine": "macOS-26.5-arm64-arm-64bit-Mach-O", "max_threads_per_threadgroup": 1024, "min_ms": 500, "operation": "jacobian_affine_walk_dynamic_dp_stream_xyzz", "ops_per_sec": 123234598.455869, "ops_per_sec_max": 125570383.676342, "ops_per_sec_min": 122701927.161875, "output_bytes_per_record": 20, "output_bytes_total": 41200, "output_layout": "dp_stream", "reason": "", "runner_sample_count": 3, "sample_count": 524288, "seconds": 2.178247, "skipped": false, "state_layout": "xyzz", "status": "keep", "steps_per_sample": 512, "thread_execution_width": 32, "threadgroup_limit": 128, "threads_per_threadgroup": 128, "timestamp": "2026-06-23T18:50:17Z", "validation_seconds": 7.428948, "validation_workers": 8}
{"affine_active_path": "all_active_fast", "affine_buffer": "resize_reuse", "affine_conversion": "batch", "affine_field_ops": "inplace", "affine_initial_conversion": "unit_z_copy", "affine_reverse_loop": "split_zero", "affine_tail_update": "skip_final", "affine_z_access": "const_ref", "affine_z_check": "infinity_flag", "architecture": "shared_tame", "avg_dp_count": 7611.0, "backend": "macos_cpu", "budget_sec": 5, "candidate_verification": "full_point_collision", "commit": "2f23769-dirty", "cooldown_sec": 0.0, "correctness": true, "description": "Apple Silicon CPU shared-tame tiny 16-target kangaroo benchmark with the scaled4-balanced jump schedule", "dp_bits": 4, "dp_bucket_storage": "inline_first", "dp_capacity": "max_load_2of3", "dp_clear": "empty_guard", "dp_hash": "partial_limb_mix", "dp_key": "x_parity", "dp_lookup": "open_address_linear", "dp_reserve": "sqrt_range_estimate", "ecint_carry_impl": "clang_builtin", "ecint_mul_final_sub": "single_conditional", "expected_private_key": "0x7", "experiment": "jacobian_kangaroo_multi16_scaled4_balanced", "field_rhs_passing": "const_ref", "found_private_key": "0x7", "found_target_index": 15, "iterations": 2, "jacobian_step_passing": "const_ref", "jump_count": 4, "jump_index": "power2_mask", "jump_schedule": "scaled4_balanced", "jump_table": "precomputed", "last_dp_count": 7611, "machine": "macOS-26.5-arm64-arm-64bit-Mach-O", "max_steps": 500000, "min_ms": 50, "operation": "jacobian_kangaroo_multi_small", "ops_per_sec": 30.433391, "ops_per_sec_max": 30.953743, "ops_per_sec_min": 26.232203, "point_passing": "const_ref", "range_bits": 20, "range_context": "precomputed", "reason": "", "runner_sample_count": 3, "sample_count": 1, "scratch": "reused", "seconds": 0.065717, "single_target_ops_per_sec": 153.34422, "skipped": false, "speedup_vs_single": 0.198465, "start_scalar": "0x2", "status": "discard", "tame_states": 1, "target_count": 16, "target_throughput_vs_single": 3.175433, "timestamp": "2026-06-23T18:54:45Z", "wild_states": 16}
{"backend": "metal", "budget_sec": 5, "commit": "2f23769-dirty", "cooldown_sec": 0.0, "correctness": true, "description": "Metal dynamic DP8 stream using XYZZ 512-step packets with the scaled4-balanced 4-jump schedule", "distance_tracking": "dp_stream_uint64", "dp_bits": 8, "dp_capacity": 524288, "dp_checksum": "0x564364b08c72a1da", "dp_count": 2060, "dp_distance_checksum": "0x3ea0b5a3cd958a70", "dp_stream_overflow": false, "dp_tracking": "projective_x_limb0", "emitted_records": 2060, "experiment": "metal_jacobian_dynamic_dp_stream_xyzz_scaled4_balanced", "iterations": 268435456, "jump_count": 4, "jump_histogram_max_bucket": 67116383, "jump_histogram_max_deviation_ppm": 170, "jump_histogram_min_bucket": 67097486, "jump_index": "power2_mask", "jump_mixer": "avalanche64", "jump_schedule": "scaled4_balanced", "machine": "macOS-26.5-arm64-arm-64bit-Mach-O", "max_threads_per_threadgroup": 1024, "min_ms": 500, "operation": "jacobian_affine_walk_dynamic_dp_stream_xyzz", "ops_per_sec": 125874951.286111, "ops_per_sec_max": 126131772.182239, "ops_per_sec_min": 125055441.998099, "output_bytes_per_record": 20, "output_bytes_total": 41200, "output_layout": "dp_stream", "reason": "", "runner_sample_count": 3, "sample_count": 524288, "seconds": 2.132557, "skipped": false, "state_layout": "xyzz", "status": "keep", "steps_per_sample": 512, "thread_execution_width": 32, "threadgroup_limit": 128, "threads_per_threadgroup": 128, "timestamp": "2026-06-23T18:55:16Z", "validation_seconds": 8.075922, "validation_workers": 8}
{"backend": "metal", "budget_sec": 10, "command_buffer_count": 2, "commit": "7ceb57c", "cooldown_sec": 10.0, "correctness": true, "description": "Metal XYZZ persistent 512-step chain with runtime ProjectiveDpMask(dp_bits=12)", "distance_tracking": "dp_stream_cumulative_uint64", "dp_bits": 12, "dp_capacity": 524288, "dp_checksum": "0x62d6817b35ede52a", "dp_count": 132, "dp_distance_checksum": "0xe885b9216531a8b2", "dp_stream_overflow": false, "dp_tracking": "projective_x_limb0", "emitted_records": 132, "experiment": "metal_jacobian_dynamic_dp_stream_xyzz_persistent_chain_dp12_steps512", "iterations": 268435456, "jump_count": 16, "jump_histogram_max_bucket": 16782260, "jump_histogram_max_deviation_ppm": 346, "jump_histogram_min_bucket": 16771410, "jump_index": "power2_mask", "jump_mixer": "avalanche64", "jump_schedule": "power2", "machine": "macOS-26.5-arm64-arm-64bit-Mach-O", "max_threads_per_threadgroup": 1024, "min_ms": 0, "operation": "jacobian_affine_walk_dynamic_dp_stream_xyzz_persistent_chain", "ops_per_sec": 123851132.746183, "ops_per_sec_max": 124366353.036694, "ops_per_sec_min": 123076360.919518, "output_bytes_per_record": 20, "output_bytes_total": 2640, "output_layout": "dp_stream", "packet_count": 4, "packets_per_round": 2, "reason": "", "round_count": 2, "runner_sample_count": 3, "sample_count": 131072, "seconds": 2.167404, "setup_mode": "reuse_pipeline_buffers", "skipped": false, "state_layout": "xyzz", "state_persistence": "round_cumulative_xyzz", "status": "keep", "steps_per_sample": 512, "stream_indexing": "round_packet_sample_u32", "thread_execution_width": 32, "threadgroup_limit": 128, "threads_per_threadgroup": 128, "timestamp": "2026-06-23T22:34:06Z", "validation_seconds": 7.00369, "validation_workers": 8}
{"backend": "metal", "budget_sec": 10, "commit": "7ee5643", "cooldown_sec": 10.0, "correctness": true, "description": "Metal XYZZ 512-step DP stream with hardcoded dp_bits=12 mask", "distance_tracking": "dp_stream_uint64", "dp_bits": 12, "dp_capacity": 262144, "dp_checksum": "0x86abc2c890e57c88", "dp_count": 69, "dp_distance_checksum": "0x7d3a2fdc136996be", "dp_stream_overflow": false, "dp_tracking": "projective_x_limb0", "emitted_records": 69, "experiment": "metal_jacobian_dynamic_dp_stream_xyzz_dp12_steps512", "iterations": 134217728, "jump_count": 16, "jump_histogram_max_bucket": 8394316, "jump_histogram_max_deviation_ppm": 759, "jump_histogram_min_bucket": 8382245, "jump_index": "power2_mask", "jump_mixer": "avalanche64", "jump_schedule": "power2", "machine": "macOS-26.5-arm64-arm-64bit-Mach-O", "max_threads_per_threadgroup": 1024, "min_ms": 500, "operation": "jacobian_affine_walk_dynamic_dp_stream_xyzz", "ops_per_sec": 125987056.586718, "ops_per_sec_max": 126012896.972671, "ops_per_sec_min": 125830515.853641, "output_bytes_per_record": 20, "output_bytes_total": 1380, "output_layout": "dp_stream", "reason": "", "runner_sample_count": 3, "sample_count": 262144, "seconds": 1.06533, "skipped": false, "state_layout": "xyzz", "status": "keep", "steps_per_sample": 512, "thread_execution_width": 32, "threadgroup_limit": 128, "threads_per_threadgroup": 128, "timestamp": "2026-06-23T22:45:05Z", "validation_seconds": 3.56849, "validation_workers": 8}
{"backend": "metal", "budget_sec": 10, "command_buffer_count": 2, "commit": "88816b7", "cooldown_sec": 10.0, "correctness": true, "description": "Metal XYZZ persistent 512-step chain with hardcoded dp_bits=16 mask", "distance_tracking": "dp_stream_cumulative_uint64", "dp_bits": 16, "dp_capacity": 524288, "dp_checksum": "0xeb0822497a41aca2", "dp_count": 10, "dp_distance_checksum": "0xb1c940ae7864db0e", "dp_stream_overflow": false, "dp_tracking": "projective_x_limb0", "emitted_records": 10, "experiment": "metal_jacobian_dynamic_dp_stream_xyzz_persistent_chain_dp16_steps512", "iterations": 268435456, "jump_count": 16, "jump_histogram_max_bucket": 16782260, "jump_histogram_max_deviation_ppm": 346, "jump_histogram_min_bucket": 16771410, "jump_index": "power2_mask", "jump_mixer": "avalanche64", "jump_schedule": "power2", "machine": "macOS-26.5-arm64-arm-64bit-Mach-O", "max_threads_per_threadgroup": 1024, "min_ms": 0, "operation": "jacobian_affine_walk_dynamic_dp_stream_xyzz_persistent_chain", "ops_per_sec": 123257579.364915, "ops_per_sec_max": 123441127.302035, "ops_per_sec_min": 123215222.207105, "output_bytes_per_record": 20, "output_bytes_total": 200, "output_layout": "dp_stream", "packet_count": 4, "packets_per_round": 2, "reason": "", "round_count": 2, "runner_sample_count": 3, "sample_count": 131072, "seconds": 2.177841, "setup_mode": "reuse_pipeline_buffers", "skipped": false, "state_layout": "xyzz", "state_persistence": "round_cumulative_xyzz", "status": "keep", "steps_per_sample": 512, "stream_indexing": "round_packet_sample_u32", "thread_execution_width": 32, "threadgroup_limit": 128, "threads_per_threadgroup": 128, "timestamp": "2026-06-23T23:06:29Z", "validation_seconds": 7.606431, "validation_workers": 8}
{"affine_scan_mode": "cpu_batch_prod_zz_zzz", "affine_scan_seconds": 0.016172, "backend": "metal", "budget_sec": 10, "commit": "0b9a406", "cooldown_sec": 0.0, "correctness": true, "description": "Metal XYZZ 512-step packet walk with GPU per-walker distances and CPU batched affine DP scan", "distance_tracking": "packet_distance_uint64", "dp_bits": 8, "dp_checksum": "0x9dba4a07ebbb8e14", "dp_count": 1057, "dp_distance_checksum": "0xf0dc88ed68b2ff64", "dp_tracking": "affine_x_limb0_cpu_batch", "experiment": "metal_jacobian_dynamic_dp_stream_xyzz_affine_scan_steps512", "gpu_ops_per_sec": 126283290.989389, "iterations": 134217728, "jump_count": 16, "jump_histogram_max_bucket": 8394316, "jump_histogram_max_deviation_ppm": 759, "jump_histogram_min_bucket": 8382245, "jump_index": "power2_mask", "jump_mixer": "avalanche64", "jump_schedule": "power2", "machine": "macOS-26.5-arm64-arm-64bit-Mach-O", "max_threads_per_threadgroup": 1024, "min_ms": 500, "operation": "jacobian_affine_walk_dynamic_dp_stream_xyzz_affine_scan", "ops_per_sec": 124390543.442828, "ops_per_sec_max": 125536737.093264, "ops_per_sec_min": 122916540.587774, "output_layout": "affine_dp_scan", "reason": "", "runner_sample_count": 3, "sample_count": 262144, "seconds": 1.06283, "skipped": false, "state_layout": "xyzz", "status": "keep", "steps_per_sample": 512, "thread_execution_width": 32, "threadgroup_limit": 128, "threads_per_threadgroup": 128, "timestamp": "2026-06-24T11:44:58Z", "validation_seconds": 3.451572, "validation_workers": 8}
{"backend": "metal", "budget_sec": 10, "bytes_per_target": 96.0, "candidate_verification": "exact_key_equality", "commit": "2fe9034", "cooldown_sec": 0.0, "correctness": true, "description": "Metal exact x256+y-parity open-address target lookup gate for multi-target kangaroo DP joins", "expected_hits": 4096, "experiment": "metal_target_lookup_exact256", "hit_count": 4096, "iterations": 65011712, "lookup_layout": "open_address_exact256", "lookups_per_sec": 125616200.459179, "lookups_per_sec_max": 143301714.266811, "lookups_per_sec_min": 108509735.324471, "machine": "macOS-26.5-arm64-arm-64bit-Mach-O", "max_threads_per_threadgroup": 1024, "min_ms": 500, "miss_count": 1044480, "operation": "target_lookup_exact256", "ops_per_sec": 125616200.459179, "ops_per_sec_max": 143301714.266811, "ops_per_sec_min": 108509735.324471, "query_count": 1048576, "reason": "", "runner_sample_count": 3, "sample_count": 1048576, "seconds": 0.517542, "skipped": false, "status": "keep", "target_count": 1048576, "target_key": "x256_y_parity", "target_lookup_checksum": "0x4f62d3a7170b250a", "target_table_buckets": 2097152, "target_table_bytes": 100663296, "thread_execution_width": 32, "threadgroup_limit": 64, "threads_per_threadgroup": 64, "timestamp": "2026-06-24T20:34:41Z"}
{"backend": "metal", "budget_sec": 10, "bytes_per_target": 72.0, "candidate_verification": "hash64_prefilter_then_exact_key_equality", "commit": "de7323f", "cooldown_sec": 0.0, "correctness": true, "description": "Metal compact hash64+index target lookup with exact x256+y-parity verification", "expected_hits": 4096, "experiment": "metal_target_lookup_compact_exact256", "hit_count": 4096, "iterations": 79691776, "lookup_layout": "open_address_hash64_index_exact256", "lookups_per_sec": 156975200.176937, "lookups_per_sec_max": 159416087.646262, "lookups_per_sec_min": 153101277.578787, "machine": "macOS-26.5-arm64-arm-64bit-Mach-O", "max_threads_per_threadgroup": 1024, "min_ms": 500, "miss_count": 1044480, "operation": "target_lookup_compact_exact256", "ops_per_sec": 156975200.176937, "ops_per_sec_max": 159416087.646262, "ops_per_sec_min": 153101277.578787, "paired_baseline_ops_per_sec": 114033683.880847, "paired_baseline_ref": "main", "paired_speedup": 1.3765687017614838, "query_count": 1048576, "reason": "", "runner_sample_count": 3, "sample_count": 1048576, "seconds": 0.507671, "skipped": false, "status": "keep", "target_bucket_bytes": 33554432, "target_count": 1048576, "target_key": "x256_y_parity", "target_key_bytes": 41943040, "target_lookup_checksum": "0x4f62d3a7170b250a", "target_table_buckets": 2097152, "target_table_bytes": 75497472, "thread_execution_width": 32, "threadgroup_limit": 64, "threads_per_threadgroup": 64, "timestamp": "2026-06-24T21:34:41Z"}
{"backend": "metal", "budget_sec": 10, "bytes_per_target": 56.0, "candidate_verification": "tag32_prefilter_then_exact_key_equality", "commit": "1d0e147", "cooldown_sec": 0.0, "correctness": true, "description": "Metal tag32+index target lookup with exact x256+y-parity verification", "expected_hits": 4096, "experiment": "metal_target_lookup_tag32_exact256", "hit_count": 4096, "iterations": 102760448, "lookup_layout": "open_address_tag32_index_exact256", "lookups_per_sec": 201502401.315374, "lookups_per_sec_max": 232128339.039737, "lookups_per_sec_min": 142309882.030769, "machine": "macOS-26.5-arm64-arm-64bit-Mach-O", "max_threads_per_threadgroup": 1024, "min_ms": 500, "miss_count": 1044480, "operation": "target_lookup_tag32_exact256", "ops_per_sec": 201502401.315374, "ops_per_sec_max": 232128339.039737, "ops_per_sec_min": 142309882.030769, "paired_baseline_ops_per_sec": 152753533.069305, "paired_baseline_ref": "main", "paired_speedup": 1.3191341454861891, "query_count": 1048576, "reason": "", "runner_sample_count": 3, "sample_count": 1048576, "seconds": 0.509971, "skipped": false, "status": "keep", "target_bucket_bytes": 16777216, "target_count": 1048576, "target_key": "x256_y_parity", "target_key_bytes": 41943040, "target_lookup_checksum": "0x4f62d3a7170b250a", "target_table_buckets": 2097152, "target_table_bytes": 58720256, "thread_execution_width": 32, "threadgroup_limit": 64, "threads_per_threadgroup": 64, "timestamp": "2026-06-24T22:36:45Z"}
{"backend": "metal", "budget_sec": 10, "bytes_per_target": 56.0, "candidate_verification": "tag32_prefilter_then_exact_key_equality", "commit": "a48e913", "cooldown_sec": 0.0, "correctness": true, "description": "Metal packed tag32+index target lookup with exact x256+y-parity verification", "expected_hits": 4096, "experiment": "metal_target_lookup_tag32_packed_exact256", "hit_count": 4096, "iterations": 68157440, "lookup_layout": "open_address_tag32_packed_index_exact256", "lookups_per_sec": 135664964.776392, "lookups_per_sec_max": 170837157.42753, "lookups_per_sec_min": 131625808.648685, "machine": "macOS-26.5-arm64-arm-64bit-Mach-O", "max_threads_per_threadgroup": 1024, "min_ms": 500, "miss_count": 1044480, "operation": "target_lookup_tag32_packed_exact256", "ops_per_sec": 135664964.776392, "ops_per_sec_max": 170837157.42753, "ops_per_sec_min": 131625808.648685, "paired_baseline_ops_per_sec": 150200076.394806, "paired_baseline_ref": "HEAD~1", "paired_speedup": 0.9032283340508566, "query_count": 1048576, "reason": "", "runner_sample_count": 3, "sample_count": 1048576, "seconds": 0.502395, "skipped": false, "status": "discard", "target_bucket_bytes": 16777216, "target_count": 1048576, "target_key": "x256_y_parity", "target_key_bytes": 41943040, "target_lookup_checksum": "0x4f62d3a7170b250a", "target_table_buckets": 2097152, "target_table_bytes": 58720256, "thread_execution_width": 32, "threadgroup_limit": 64, "threads_per_threadgroup": 64, "timestamp": "2026-06-25T00:43:40Z"}
{"backend": "metal", "budget_sec": 10, "bytes_per_target": 61.333333, "candidate_verification": "tag32_prefilter_then_exact_key_equality", "commit": "f3527a5", "cooldown_sec": 0.0, "correctness": true, "description": "Metal tag32 target lookup with half-load buckets on a high-load non-power-of-two target shape", "expected_hits": 4096, "experiment": "metal_target_lookup_tag32_halfload_highload_exact256", "hit_count": 4096, "iterations": 69206016, "lookup_layout": "open_address_tag32_index_exact256", "lookups_per_sec": 137879070.930129, "lookups_per_sec_max": 154955587.061247, "lookups_per_sec_min": 132748597.41394, "machine": "macOS-26.5-arm64-arm-64bit-Mach-O", "max_threads_per_threadgroup": 1024, "min_ms": 500, "miss_count": 1044480, "operation": "target_lookup_tag32_exact256", "ops_per_sec": 137879070.930129, "ops_per_sec_max": 154955587.061247, "ops_per_sec_min": 132748597.41394, "paired_baseline_ops_per_sec": 152250947.577372, "paired_baseline_ref": "HEAD~1", "paired_speedup": 0.905604024960571, "query_count": 1048576, "reason": "", "runner_sample_count": 3, "sample_count": 1048576, "seconds": 0.501933, "skipped": false, "status": "discard", "target_bucket_bytes": 33554432, "target_count": 1572864, "target_key": "x256_y_parity", "target_key_bytes": 62914560, "target_lookup_checksum": "0xe2b09e38dc85a153", "target_table_buckets": 4194304, "target_table_bytes": 96468992, "thread_execution_width": 32, "threadgroup_limit": 64, "threads_per_threadgroup": 64, "timestamp": "2026-06-25T00:51:11Z"}
{"backend": "metal", "budget_sec": 10, "bytes_per_target": 56.0, "candidate_verification": "tag32_prefilter_then_exact_key_equality", "commit": "768b93a", "cooldown_sec": 0.0, "correctness": true, "description": "Metal tag32 target lookup with redundant sentinel condition removed", "expected_hits": 4096, "experiment": "metal_target_lookup_tag32_sentinel_simplified_exact256", "hit_count": 4096, "iterations": 126877696, "lookup_layout": "open_address_tag32_index_exact256", "lookups_per_sec": 245435616.929923, "lookups_per_sec_max": 261977833.801547, "lookups_per_sec_min": 204618989.921079, "machine": "macOS-26.5-arm64-arm-64bit-Mach-O", "max_threads_per_threadgroup": 1024, "min_ms": 500, "miss_count": 1044480, "operation": "target_lookup_tag32_exact256", "ops_per_sec": 245435616.929923, "ops_per_sec_max": 261977833.801547, "ops_per_sec_min": 204618989.921079, "paired_baseline_ops_per_sec": 240104595.314191, "paired_baseline_ref": "HEAD~1", "paired_speedup": 1.022202913729144, "query_count": 1048576, "reason": "", "runner_sample_count": 3, "sample_count": 1048576, "seconds": 0.516949, "skipped": false, "status": "keep", "target_bucket_bytes": 16777216, "target_count": 1048576, "target_key": "x256_y_parity", "target_key_bytes": 41943040, "target_lookup_checksum": "0x4f62d3a7170b250a", "target_table_buckets": 2097152, "target_table_bytes": 58720256, "thread_execution_width": 32, "threadgroup_limit": 64, "threads_per_threadgroup": 64, "timestamp": "2026-06-25T00:56:14Z"}
{"backend": "metal", "budget_sec": 10, "bytes_per_target": 56.0, "candidate_verification": "tag32_prefilter_then_exact_key_equality", "commit": "768b93a-dirty", "confirmation_index": 1, "confirmation_runs": 2, "confirmation_status": "discard", "cooldown_sec": 0.0, "correctness": true, "description": "Metal tag32 target lookup with redundant sentinel condition removed", "expected_hits": 4096, "experiment": "metal_target_lookup_tag32_sentinel_simplified_exact256", "hit_count": 4096, "iterations": 67108864, "lookup_layout": "open_address_tag32_index_exact256", "lookups_per_sec": 132157969.915871, "lookups_per_sec_max": 179547267.356277, "lookups_per_sec_min": 114969708.905935, "machine": "macOS-26.5-arm64-arm-64bit-Mach-O", "max_threads_per_threadgroup": 1024, "min_ms": 500, "miss_count": 1044480, "operation": "target_lookup_tag32_exact256", "ops_per_sec": 132157969.915871, "ops_per_sec_max": 179547267.356277, "ops_per_sec_min": 114969708.905935, "paired_baseline_ops_per_sec": 151969336.371076, "paired_baseline_ref": "HEAD~1", "paired_speedup": 0.8696357638436352, "query_count": 1048576, "raw_status": "discard", "reason": "", "runner_sample_count": 3, "sample_count": 1048576, "seconds": 0.507793, "skipped": false, "status": "discard", "target_bucket_bytes": 16777216, "target_count": 1048576, "target_key": "x256_y_parity", "target_key_bytes": 41943040, "target_lookup_checksum": "0x4f62d3a7170b250a", "target_table_buckets": 2097152, "target_table_bytes": 58720256, "thread_execution_width": 32, "threadgroup_limit": 64, "threads_per_threadgroup": 64, "timestamp": "2026-06-25T00:57:18Z"}
