{"affine_scan_mode": "cpu_batch_prod_zz_zzz", "affine_scan_seconds": 0.007285, "backend": "metal", "budget_sec": 20, "bytes_per_target": 2.683818, "candidate_verification": "tag16_hash_filter_then_cpu_exact_key_equality", "commit": "f15e34d-dirty", "confirmation_index": 2, "confirmation_runs": 2, "confirmation_status": "discard", "cooldown_sec": 10.0, "correctness": true, "description": "Metal XYZZ affine DP scan tag16 repeat-indexed lookup with exact-grid bounds removed from the repeat 2D kernel", "distance_tracking": "packet_distance_uint64", "dp_bits": 8, "dp_checksum": "0x9dba4a07ebbb8e14", "dp_count": 1057, "dp_distance_checksum": "0xf0dc88ed68b2ff64", "dp_query_count": 1057, "dp_tracking": "affine_x256_y_parity_cpu_batch", "exact_host_table_bytes": 1268635456, "experiment": "metal_jacobian_dynamic_dp_stream_xyzz_affine_scan_target_lookup_tag16_hash_filter25m_repeat_nobounds2048", "filter_false_positive_count": 2048, "filter_positive_count": 133120, "gpu_lookup_lookups_per_sec": 124651602.348481, "gpu_ops_per_sec": 52830129.256728, "hit_count": 131072, "injected_hits": 64, "iterations": 134217728, "jump_count": 16, "jump_histogram_max_bucket": 8394316, "jump_histogram_max_deviation_ppm": 759, "jump_histogram_min_bucket": 8382245, "jump_index": "power2_mask", "jump_mixer": "avalanche64", "jump_schedule": "power2", "lookup_engine": "gpu_filter16_hash_repeat", "lookup_engine_effective": "gpu_filter16_hash_repeat", "lookup_exact_seconds": 0.003631, "lookup_gpu_seconds": 0.017366, "lookup_hash_seconds": 3.8e-05, "lookup_layout": "open_address_tag16_hash_filter_exact256", "lookup_max_threads_per_threadgroup": 1024, "lookup_query_mode": "repeat", "lookup_repeat": 2048, "lookup_seconds": 0.021035, "lookup_thread_execution_width": 32, "lookup_threadgroup_limit": 512, "lookup_threads_per_threadgroup": 512, "lookups_per_sec": 102910335.958366, "lookups_per_sec_max": 109552797.502357, "lookups_per_sec_min": 35984249.77611, "machine": "macOS-26.5-arm64-arm-64bit-Mach-O", "max_threads_per_threadgroup": 1024, "min_ms": 500, "miss_count": 2033664, "operation": "jacobian_affine_scan_target_lookup_tag32", "ops_per_sec": 102910335.958366, "ops_per_sec_max": 109552797.502357, "ops_per_sec_min": 35984249.77611, "output_layout": "affine_dp_scan_target_lookup", "paired_baseline_ops_per_sec": 70879864.899926, "paired_baseline_ref": "main", "paired_order": "alternate", "paired_speedup": 1.4518980263811625, "query_count": 2164736, "query_input": "hash64_repeat_indexed", "raw_status": "keep", "reason": "", "requested_hits": 64, "runner_sample_count": 3, "sample_count": 262144, "seconds": 2.540553, "skipped": false, "state_layout": "xyzz", "status": "discard", "steps_per_sample": 512, "target_bucket_bytes": 268435456, "target_count": 25005000, "target_filter_bucket_bytes": 67108864, "target_key": "x256_y_parity", "target_key_bytes": 1000200000, "target_lookup_checksum": "0x5b746bd07e35a252", "target_query_hash_bytes": 8456, "target_table_buckets": 33554432, "target_table_bytes": 67108864, "thread_execution_width": 32, "threadgroup_limit": 128, "threads_per_threadgroup": 128, "timestamp": "2026-06-28T21:34:25Z", "validation_seconds": 11.043458, "validation_workers": 8}
{"affine_scan_mode": "cpu_batch_prod_zz_zzz", "affine_scan_seconds": 0.008664, "backend": "metal", "budget_sec": 20, "bytes_per_target": 2.683818, "candidate_verification": "tag16_hash_filter_then_cpu_exact_key_equality", "commit": "77a0000-dirty", "confirmation_index": 1, "confirmation_runs": 2, "confirmation_status": "keep", "cooldown_sec": 10.0, "correctness": true, "description": "Metal XYZZ affine DP scan tag16 repeat-indexed lookup with packed positive base/repeat indices for exact resolution", "distance_tracking": "packet_distance_uint64", "dp_bits": 8, "dp_checksum": "0x9dba4a07ebbb8e14", "dp_count": 1057, "dp_distance_checksum": "0xf0dc88ed68b2ff64", "dp_query_count": 1057, "dp_tracking": "affine_x256_y_parity_cpu_batch", "exact_host_table_bytes": 1268635456, "experiment": "metal_jacobian_dynamic_dp_stream_xyzz_affine_scan_target_lookup_tag16_hash_filter25m_repeat_packed_positive2048", "filter_false_positive_count": 2048, "filter_positive_count": 133120, "gpu_lookup_lookups_per_sec": 96498913.418997, "gpu_ops_per_sec": 43056535.837426, "hit_count": 131072, "injected_hits": 64, "iterations": 134217728, "jump_count": 16, "jump_histogram_max_bucket": 8394316, "jump_histogram_max_deviation_ppm": 759, "jump_histogram_min_bucket": 8382245, "jump_index": "power2_mask", "jump_mixer": "avalanche64", "jump_schedule": "power2", "lookup_engine": "gpu_filter16_hash_repeat", "lookup_engine_effective": "gpu_filter16_hash_repeat", "lookup_exact_seconds": 0.003426, "lookup_gpu_seconds": 0.022433, "lookup_hash_seconds": 2e-05, "lookup_layout": "open_address_tag16_hash_filter_exact256", "lookup_max_threads_per_threadgroup": 1024, "lookup_query_mode": "repeat", "lookup_repeat": 2048, "lookup_seconds": 0.025879, "lookup_thread_execution_width": 32, "lookup_threadgroup_limit": 512, "lookup_threads_per_threadgroup": 512, "lookups_per_sec": 83647823.749505, "lookups_per_sec_max": 92820976.239863, "lookups_per_sec_min": 57373002.622756, "machine": "macOS-26.5-arm64-arm-64bit-Mach-O", "max_threads_per_threadgroup": 1024, "min_ms": 500, "miss_count": 2033664, "operation": "jacobian_affine_scan_target_lookup_tag32", "ops_per_sec": 83647823.749505, "ops_per_sec_max": 92820976.239863, "ops_per_sec_min": 57373002.622756, "output_layout": "affine_dp_scan_target_lookup", "paired_baseline_ops_per_sec": 41714940.175022, "paired_baseline_ref": "main", "paired_order": "alternate", "paired_speedup": 2.005224588565789, "query_count": 2164736, "query_input": "hash64_repeat_indexed", "raw_status": "keep", "reason": "", "requested_hits": 64, "runner_sample_count": 3, "sample_count": 262144, "seconds": 3.117244, "skipped": false, "state_layout": "xyzz", "status": "keep", "steps_per_sample": 512, "target_bucket_bytes": 268435456, "target_count": 25005000, "target_filter_bucket_bytes": 67108864, "target_key": "x256_y_parity", "target_key_bytes": 1000200000, "target_lookup_checksum": "0x5b746bd07e35a252", "target_query_hash_bytes": 8456, "target_table_buckets": 33554432, "target_table_bytes": 67108864, "thread_execution_width": 32, "threadgroup_limit": 128, "threads_per_threadgroup": 128, "timestamp": "2026-06-28T21:49:53Z", "validation_seconds": 8.473856, "validation_workers": 8}
{"affine_scan_mode": "cpu_batch_prod_zz_zzz", "affine_scan_seconds": 0.023667, "backend": "metal", "budget_sec": 20, "bytes_per_target": 2.683818, "candidate_verification": "tag16_hash_filter_then_cpu_exact_key_equality", "commit": "77a0000-dirty", "confirmation_index": 2, "confirmation_runs": 2, "confirmation_status": "keep", "cooldown_sec": 10.0, "correctness": true, "description": "Metal XYZZ affine DP scan tag16 repeat-indexed lookup with packed positive base/repeat indices for exact resolution", "distance_tracking": "packet_distance_uint64", "dp_bits": 8, "dp_checksum": "0x9dba4a07ebbb8e14", "dp_count": 1057, "dp_distance_checksum": "0xf0dc88ed68b2ff64", "dp_query_count": 1057, "dp_tracking": "affine_x256_y_parity_cpu_batch", "exact_host_table_bytes": 1268635456, "experiment": "metal_jacobian_dynamic_dp_stream_xyzz_affine_scan_target_lookup_tag16_hash_filter25m_repeat_packed_positive2048", "filter_false_positive_count": 2048, "filter_positive_count": 133120, "gpu_lookup_lookups_per_sec": 257819217.032007, "gpu_ops_per_sec": 42495819.309606, "hit_count": 131072, "injected_hits": 64, "iterations": 134217728, "jump_count": 16, "jump_histogram_max_bucket": 8394316, "jump_histogram_max_deviation_ppm": 759, "jump_histogram_min_bucket": 8382245, "jump_index": "power2_mask", "jump_mixer": "avalanche64", "jump_schedule": "power2", "lookup_engine": "gpu_filter16_hash_repeat", "lookup_engine_effective": "gpu_filter16_hash_repeat", "lookup_exact_seconds": 0.003209, "lookup_gpu_seconds": 0.008396, "lookup_hash_seconds": 4.3e-05, "lookup_layout": "open_address_tag16_hash_filter_exact256", "lookup_max_threads_per_threadgroup": 1024, "lookup_query_mode": "repeat", "lookup_repeat": 2048, "lookup_seconds": 0.011648, "lookup_thread_execution_width": 32, "lookup_threadgroup_limit": 512, "lookup_threads_per_threadgroup": 512, "lookups_per_sec": 185840186.793453, "lookups_per_sec_max": 219666072.937827, "lookups_per_sec_min": 123563576.618304, "machine": "macOS-26.5-arm64-arm-64bit-Mach-O", "max_threads_per_threadgroup": 1024, "min_ms": 500, "miss_count": 2033664, "operation": "jacobian_affine_scan_target_lookup_tag32", "ops_per_sec": 185840186.793453, "ops_per_sec_max": 219666072.937827, "ops_per_sec_min": 123563576.618304, "output_layout": "affine_dp_scan_target_lookup", "paired_baseline_ops_per_sec": 70263768.598678, "paired_baseline_ref": "main", "paired_order": "alternate", "paired_speedup": 2.6448935276288266, "query_count": 2164736, "query_input": "hash64_repeat_indexed", "raw_status": "keep", "reason": "", "requested_hits": 64, "runner_sample_count": 3, "sample_count": 262144, "seconds": 3.158375, "skipped": false, "state_layout": "xyzz", "status": "keep", "steps_per_sample": 512, "target_bucket_bytes": 268435456, "target_count": 25005000, "target_filter_bucket_bytes": 67108864, "target_key": "x256_y_parity", "target_key_bytes": 1000200000, "target_lookup_checksum": "0x5b746bd07e35a252", "target_query_hash_bytes": 8456, "target_table_buckets": 33554432, "target_table_bytes": 67108864, "thread_execution_width": 32, "threadgroup_limit": 128, "threads_per_threadgroup": 128, "timestamp": "2026-06-28T21:49:53Z", "validation_seconds": 7.273571, "validation_workers": 8}
{"affine_scan_mode": "cpu_batch_prod_zz_zzz", "affine_scan_seconds": 0.030041, "backend": "metal", "budget_sec": 20, "bytes_per_target": 2.683818, "candidate_verification": "tag16_hash_filter_then_cpu_exact_key_equality", "commit": "3c18962-dirty", "confirmation_index": 1, "confirmation_runs": 2, "confirmation_status": "discard", "cooldown_sec": 10.0, "correctness": true, "description": "Metal XYZZ affine DP scan tag16 repeat-indexed lookup with base-once GPU filtering and logical positive expansion", "distance_tracking": "packet_distance_uint64", "dp_bits": 8, "dp_checksum": "0x9dba4a07ebbb8e14", "dp_count": 1057, "dp_distance_checksum": "0xf0dc88ed68b2ff64", "dp_query_count": 1057, "dp_tracking": "affine_x256_y_parity_cpu_batch", "exact_host_table_bytes": 1268635456, "experiment": "metal_jacobian_dynamic_dp_stream_xyzz_affine_scan_target_lookup_tag16_hash_filter25m_repeat_base_once2048", "filter_false_positive_count": 2048, "filter_positive_count": 133120, "gpu_lookup_lookups_per_sec": 94804574.964003, "gpu_ops_per_sec": 55309189.895688, "hit_count": 131072, "injected_hits": 64, "iterations": 134217728, "jump_count": 16, "jump_histogram_max_bucket": 8394316, "jump_histogram_max_deviation_ppm": 759, "jump_histogram_min_bucket": 8382245, "jump_index": "power2_mask", "jump_mixer": "avalanche64", "jump_schedule": "power2", "lookup_engine": "gpu_filter16_hash_repeat", "lookup_engine_effective": "gpu_filter16_hash_repeat", "lookup_exact_seconds": 0.004241, "lookup_gpu_seconds": 0.022834, "lookup_hash_seconds": 4.8e-05, "lookup_layout": "open_address_tag16_hash_filter_exact256", "lookup_max_threads_per_threadgroup": 1024, "lookup_query_mode": "repeat", "lookup_repeat": 2048, "lookup_seconds": 0.027123, "lookup_thread_execution_width": 32, "lookup_threadgroup_limit": 512, "lookup_threads_per_threadgroup": 512, "lookups_per_sec": 79812067.404552, "lookups_per_sec_max": 237733957.645029, "lookups_per_sec_min": 69955436.345716, "machine": "macOS-26.5-arm64-arm-64bit-Mach-O", "max_threads_per_threadgroup": 1024, "min_ms": 500, "miss_count": 2033664, "operation": "jacobian_affine_scan_target_lookup_tag32", "ops_per_sec": 79812067.404552, "ops_per_sec_max": 237733957.645029, "ops_per_sec_min": 69955436.345716, "output_layout": "affine_dp_scan_target_lookup", "paired_baseline_ops_per_sec": 36303815.503278, "paired_baseline_ref": "main", "paired_order": "alternate", "paired_speedup": 2.198448463284678, "query_count": 2164736, "query_input": "hash64_repeat_indexed", "raw_status": "keep", "reason": "", "repeat_positive_index_encoding": "base_once_logical_expand", "requested_hits": 64, "runner_sample_count": 3, "sample_count": 262144, "seconds": 2.42668, "skipped": false, "state_layout": "xyzz", "status": "discard", "steps_per_sample": 512, "target_bucket_bytes": 268435456, "target_count": 25005000, "target_filter_bucket_bytes": 67108864, "target_key": "x256_y_parity", "target_key_bytes": 1000200000, "target_lookup_checksum": "0x5b746bd07e35a252", "target_query_hash_bytes": 8456, "target_table_buckets": 33554432, "target_table_bytes": 67108864, "thread_execution_width": 32, "threadgroup_limit": 128, "threads_per_threadgroup": 128, "timestamp": "2026-06-28T22:11:38Z", "validation_seconds": 8.412345, "validation_workers": 8}
{"affine_scan_mode": "cpu_batch_prod_zz_zzz", "affine_scan_seconds": 0.013484, "backend": "metal", "budget_sec": 20, "bytes_per_target": 2.683818, "candidate_verification": "tag16_hash_filter_then_cpu_exact_key_equality", "commit": "3c18962-dirty", "confirmation_index": 2, "confirmation_runs": 2, "confirmation_status": "discard", "cooldown_sec": 10.0, "correctness": true, "description": "Metal XYZZ affine DP scan tag16 repeat-indexed lookup with base-once GPU filtering and logical positive expansion", "distance_tracking": "packet_distance_uint64", "dp_bits": 8, "dp_checksum": "0x9dba4a07ebbb8e14", "dp_count": 1057, "dp_distance_checksum": "0xf0dc88ed68b2ff64", "dp_query_count": 1057, "dp_tracking": "affine_x256_y_parity_cpu_batch", "exact_host_table_bytes": 1268635456, "experiment": "metal_jacobian_dynamic_dp_stream_xyzz_affine_scan_target_lookup_tag16_hash_filter25m_repeat_base_once2048", "filter_false_positive_count": 2048, "filter_positive_count": 133120, "gpu_lookup_lookups_per_sec": 220566026.162627, "gpu_ops_per_sec": 66637343.686971, "hit_count": 131072, "injected_hits": 64, "iterations": 134217728, "jump_count": 16, "jump_histogram_max_bucket": 8394316, "jump_histogram_max_deviation_ppm": 759, "jump_histogram_min_bucket": 8382245, "jump_index": "power2_mask", "jump_mixer": "avalanche64", "jump_schedule": "power2", "lookup_engine": "gpu_filter16_hash_repeat", "lookup_engine_effective": "gpu_filter16_hash_repeat", "lookup_exact_seconds": 0.007172, "lookup_gpu_seconds": 0.009814, "lookup_hash_seconds": 3.7e-05, "lookup_layout": "open_address_tag16_hash_filter_exact256", "lookup_max_threads_per_threadgroup": 1024, "lookup_query_mode": "repeat", "lookup_repeat": 2048, "lookup_seconds": 0.017023, "lookup_thread_execution_width": 32, "lookup_threadgroup_limit": 512, "lookup_threads_per_threadgroup": 512, "lookups_per_sec": 127166925.799653, "lookups_per_sec_max": 181828459.834319, "lookups_per_sec_min": 116459316.902443, "machine": "macOS-26.5-arm64-arm-64bit-Mach-O", "max_threads_per_threadgroup": 1024, "min_ms": 500, "miss_count": 2033664, "operation": "jacobian_affine_scan_target_lookup_tag32", "ops_per_sec": 127166925.799653, "ops_per_sec_max": 181828459.834319, "ops_per_sec_min": 116459316.902443, "output_layout": "affine_dp_scan_target_lookup", "paired_baseline_ops_per_sec": 157742708.556192, "paired_baseline_ref": "main", "paired_order": "alternate", "paired_speedup": 0.8061667443370472, "query_count": 2164736, "query_input": "hash64_repeat_indexed", "raw_status": "discard", "reason": "", "repeat_positive_index_encoding": "base_once_logical_expand", "requested_hits": 64, "runner_sample_count": 3, "sample_count": 262144, "seconds": 2.014152, "skipped": false, "state_layout": "xyzz", "status": "discard", "steps_per_sample": 512, "target_bucket_bytes": 268435456, "target_count": 25005000, "target_filter_bucket_bytes": 67108864, "target_key": "x256_y_parity", "target_key_bytes": 1000200000, "target_lookup_checksum": "0x5b746bd07e35a252", "target_query_hash_bytes": 8456, "target_table_buckets": 33554432, "target_table_bytes": 67108864, "thread_execution_width": 32, "threadgroup_limit": 128, "threads_per_threadgroup": 128, "timestamp": "2026-06-28T22:11:38Z", "validation_seconds": 17.879428, "validation_workers": 8}
{"backend": "metal", "budget_sec": 20, "command_buffer_count": 2, "commit": "f42ce81-dirty", "confirmation_index": 1, "confirmation_runs": 2, "confirmation_status": "discard", "cooldown_sec": 10.0, "correctness": true, "description": "Metal XYZZ persistent 512-step chain with hardcoded dp_bits=14 mask", "distance_tracking": "dp_stream_cumulative_uint64", "dp_bits": 14, "dp_capacity": 524288, "dp_checksum": "0xc662777588781698", "dp_count": 34, "dp_distance_checksum": "0x5cb70f4effb5ad6f", "dp_stream_overflow": false, "dp_tracking": "projective_x_limb0", "emitted_records": 34, "experiment": "metal_jacobian_dynamic_dp_stream_xyzz_persistent_chain_dp14_steps512", "iterations": 268435456, "jump_count": 16, "jump_histogram_max_bucket": 16782260, "jump_histogram_max_deviation_ppm": 346, "jump_histogram_min_bucket": 16771410, "jump_index": "power2_mask", "jump_mixer": "avalanche64", "jump_schedule": "power2", "machine": "macOS-26.5-arm64-arm-64bit-Mach-O", "max_threads_per_threadgroup": 1024, "min_ms": 0, "operation": "jacobian_affine_walk_dynamic_dp_stream_xyzz_persistent_chain", "ops_per_sec": 51417088.435783, "ops_per_sec_max": 120507956.981408, "ops_per_sec_min": 49588122.146901, "output_bytes_per_record": 20, "output_bytes_total": 680, "output_layout": "dp_stream", "packet_count": 4, "packets_per_round": 2, "paired_baseline_ops_per_sec": 116310256.764624, "paired_baseline_ref": "main", "paired_order": "baseline_first", "paired_speedup": 0.4420683941901641, "raw_status": "discard", "reason": "", "round_count": 2, "runner_sample_count": 3, "sample_count": 131072, "seconds": 5.220744, "setup_mode": "reuse_pipeline_buffers", "skipped": false, "state_layout": "xyzz", "state_persistence": "round_cumulative_xyzz", "status": "discard", "steps_per_sample": 512, "stream_indexing": "round_packet_sample_u32", "thread_execution_width": 32, "threadgroup_limit": 128, "threads_per_threadgroup": 128, "timestamp": "2026-06-28T22:26:40Z", "validation_seconds": 25.750166, "validation_workers": 8}
{"backend": "metal", "budget_sec": 20, "command_buffer_count": 2, "commit": "f42ce81-dirty", "confirmation_index": 2, "confirmation_runs": 2, "confirmation_status": "discard", "cooldown_sec": 10.0, "correctness": true, "description": "Metal XYZZ persistent 512-step chain with hardcoded dp_bits=14 mask", "distance_tracking": "dp_stream_cumulative_uint64", "dp_bits": 14, "dp_capacity": 524288, "dp_checksum": "0xc662777588781698", "dp_count": 34, "dp_distance_checksum": "0x5cb70f4effb5ad6f", "dp_stream_overflow": false, "dp_tracking": "projective_x_limb0", "emitted_records": 34, "experiment": "metal_jacobian_dynamic_dp_stream_xyzz_persistent_chain_dp14_steps512", "iterations": 268435456, "jump_count": 16, "jump_histogram_max_bucket": 16782260, "jump_histogram_max_deviation_ppm": 346, "jump_histogram_min_bucket": 16771410, "jump_index": "power2_mask", "jump_mixer": "avalanche64", "jump_schedule": "power2", "machine": "macOS-26.5-arm64-arm-64bit-Mach-O", "max_threads_per_threadgroup": 1024, "min_ms": 0, "operation": "jacobian_affine_walk_dynamic_dp_stream_xyzz_persistent_chain", "ops_per_sec": 52570949.918239, "ops_per_sec_max": 83770425.555704, "ops_per_sec_min": 47996744.373852, "output_bytes_per_record": 20, "output_bytes_total": 680, "output_layout": "dp_stream", "packet_count": 4, "packets_per_round": 2, "paired_baseline_ops_per_sec": 119890117.177222, "paired_baseline_ref": "main", "paired_order": "baseline_first", "paired_speedup": 0.4384927728490617, "raw_status": "discard", "reason": "", "round_count": 2, "runner_sample_count": 3, "sample_count": 131072, "seconds": 5.106156, "setup_mode": "reuse_pipeline_buffers", "skipped": false, "state_layout": "xyzz", "state_persistence": "round_cumulative_xyzz", "status": "discard", "steps_per_sample": 512, "stream_indexing": "round_packet_sample_u32", "thread_execution_width": 32, "threadgroup_limit": 128, "threads_per_threadgroup": 128, "timestamp": "2026-06-28T22:26:40Z", "validation_seconds": 16.623019, "validation_workers": 8}
