{"backend": "metal", "budget_sec": 120, "buffer_lifetime": "persistent", "bytes_per_target": 2.683818, "candidate_verification": "tag16_hash_filter_then_cpu_exact_key_equality", "commit": "af8096c", "confirmation_index": 1, "confirmation_runs": 2, "confirmation_status": "keep", "cooldown_sec": 10.0, "correctness": true, "description": "GPU-dispatch-only persistent Metal tag16 hash-filter lookup using prehashed query input versus in-kernel query hashing", "dispatch_lookups_per_sec": 38421955.150513, "dispatch_seconds": 0.723226, "exact_host_table_bytes": 1268635456, "exact_verify_seconds": 0.037379, "expected_hits": 64, "experiment": "metal_target_lookup_tag16_hash_filter_persistent_dispatch", "filter_false_positive_count": 247, "filter_positive_count": 311, "gpu_dispatch_lookups_per_sec": 40407764.739561, "gpu_dispatch_lookups_per_sec_max": 43323721.975114, "gpu_dispatch_lookups_per_sec_min": 30896026.265915, "hit_count": 64, "iterations": 29223936, "lookup_layout": "open_address_tag16_hash_filter_exact256", "lookups_per_sec": 27190801.591453, "machine": "macOS-26.5-arm64-arm-64bit-Mach-O", "max_threads_per_threadgroup": 1024, "metal_setup_seconds": 0.314168, "min_ms": 700, "miss_count": 1082304, "operation": "target_lookup_tag16_hash_filter_persistent_exact256", "ops_per_sec": 40407764.739561, "ops_per_sec_max": 43323721.975114, "ops_per_sec_min": 30896026.265915, "paired_baseline_ops_per_sec": 39265863.585433, "paired_baseline_ref": "HEAD", "paired_speedup": 1.029081269322996, "query_count": 1082368, "query_input": "hash64", "raw_status": "keep", "reason": "", "runner_sample_count": 3, "sample_count": 1082368, "seconds": 1.074773, "skipped": false, "status": "keep", "target_bucket_bytes": 268435456, "target_count": 25005000, "target_filter_bucket_bytes": 67108864, "target_key": "x256_y_parity", "target_key_bytes": 1000200000, "target_lookup_checksum": "0x9b23e560b9fdfe29", "target_query_hash_bytes": 8658944, "target_table_buckets": 33554432, "target_table_bytes": 67108864, "thread_execution_width": 32, "threadgroup_limit": 512, "threads_per_threadgroup": 512, "timestamp": "2026-06-26T23:18:43Z"}
{"backend": "metal", "budget_sec": 120, "buffer_lifetime": "persistent", "bytes_per_target": 2.683818, "candidate_verification": "tag16_hash_filter_then_cpu_exact_key_equality", "commit": "af8096c", "confirmation_index": 2, "confirmation_runs": 2, "confirmation_status": "keep", "cooldown_sec": 10.0, "correctness": true, "description": "GPU-dispatch-only persistent Metal tag16 hash-filter lookup using prehashed query input versus in-kernel query hashing", "dispatch_lookups_per_sec": 44422468.552441, "dispatch_seconds": 0.700019, "exact_host_table_bytes": 1268635456, "exact_verify_seconds": 0.006575, "expected_hits": 64, "experiment": "metal_target_lookup_tag16_hash_filter_persistent_dispatch", "filter_false_positive_count": 247, "filter_positive_count": 311, "gpu_dispatch_lookups_per_sec": 44839716.146274, "gpu_dispatch_lookups_per_sec_max": 46619052.056918, "gpu_dispatch_lookups_per_sec_min": 41683894.79476, "hit_count": 64, "iterations": 31388672, "lookup_layout": "open_address_tag16_hash_filter_exact256", "lookups_per_sec": 38211268.458059, "machine": "macOS-26.5-arm64-arm-64bit-Mach-O", "max_threads_per_threadgroup": 1024, "metal_setup_seconds": 0.114856, "min_ms": 700, "miss_count": 1082304, "operation": "target_lookup_tag16_hash_filter_persistent_exact256", "ops_per_sec": 44839716.146274, "ops_per_sec_max": 46619052.056918, "ops_per_sec_min": 41683894.79476, "paired_baseline_ops_per_sec": 36432369.467395, "paired_baseline_ref": "HEAD", "paired_speedup": 1.2307658492100855, "query_count": 1082368, "query_input": "hash64", "raw_status": "keep", "reason": "", "runner_sample_count": 3, "sample_count": 1082368, "seconds": 0.821451, "skipped": false, "status": "keep", "target_bucket_bytes": 268435456, "target_count": 25005000, "target_filter_bucket_bytes": 67108864, "target_key": "x256_y_parity", "target_key_bytes": 1000200000, "target_lookup_checksum": "0x9b23e560b9fdfe29", "target_query_hash_bytes": 8658944, "target_table_buckets": 33554432, "target_table_bytes": 67108864, "thread_execution_width": 32, "threadgroup_limit": 512, "threads_per_threadgroup": 512, "timestamp": "2026-06-26T23:18:43Z"}
{"affine_scan_mode": "cpu_batch_prod_zz_zzz", "affine_scan_seconds": 0.037558, "backend": "metal", "budget_sec": 120, "bytes_per_target": 2.683818, "candidate_verification": "tag16_hash_filter_then_cpu_exact_key_equality", "commit": "f74a2c5", "confirmation_index": 1, "confirmation_runs": 2, "confirmation_status": "discard", "cooldown_sec": 10.0, "correctness": true, "description": "Metal XYZZ affine DP scan tag16 hash-filter 25M-target GPU lookup threadgroup 256 versus 512", "distance_tracking": "packet_distance_uint64", "dp_bits": 8, "dp_checksum": "0x9dba4a07ebbb8e14", "dp_count": 1057, "dp_distance_checksum": "0xf0dc88ed68b2ff64", "dp_query_count": 1057, "dp_tracking": "affine_x256_y_parity_cpu_batch", "exact_host_table_bytes": 1268635456, "experiment": "metal_jacobian_dynamic_dp_stream_xyzz_affine_scan_target_lookup_tag16_hash_filter25m_tg256_gpu_lookup", "filter_false_positive_count": 216, "filter_positive_count": 280, "gpu_lookup_lookups_per_sec": 72371560.585994, "gpu_lookup_lookups_per_sec_max": 73844182.258615, "gpu_lookup_lookups_per_sec_min": 34069406.191473, "gpu_ops_per_sec": 59113664.527375, "hit_count": 64, "injected_hits": 64, "iterations": 134217728, "jump_count": 16, "jump_histogram_max_bucket": 8394316, "jump_histogram_max_deviation_ppm": 759, "jump_histogram_min_bucket": 8382245, "jump_index": "power2_mask", "jump_mixer": "avalanche64", "jump_schedule": "power2", "lookup_engine": "gpu_filter16_hash", "lookup_engine_effective": "gpu_filter16_hash", "lookup_exact_seconds": 0.004758, "lookup_gpu_seconds": 0.014956, "lookup_hash_seconds": 0.015635, "lookup_layout": "open_address_tag16_hash_filter_exact256", "lookup_max_threads_per_threadgroup": 1024, "lookup_query_mode": "distinct_misses", "lookup_repeat": 1024, "lookup_seconds": 0.035348, "lookup_thread_execution_width": 32, "lookup_threadgroup_limit": 256, "lookup_threads_per_threadgroup": 256, "lookups_per_sec": 30620165.225344, "machine": "macOS-26.5-arm64-arm-64bit-Mach-O", "max_threads_per_threadgroup": 1024, "min_ms": 500, "miss_count": 1082304, "operation": "jacobian_affine_scan_target_lookup_tag32", "ops_per_sec": 72371560.585994, "ops_per_sec_max": 73844182.258615, "ops_per_sec_min": 34069406.191473, "output_layout": "affine_dp_scan_target_lookup", "paired_baseline_ops_per_sec": 116195207.278346, "paired_baseline_ref": "HEAD", "paired_speedup": 0.6228446274262216, "query_count": 1082368, "query_input": "hash64", "raw_status": "discard", "reason": "", "requested_hits": 64, "runner_sample_count": 3, "sample_count": 262144, "seconds": 2.270503, "skipped": false, "state_layout": "xyzz", "status": "discard", "steps_per_sample": 512, "target_bucket_bytes": 268435456, "target_count": 25005000, "target_filter_bucket_bytes": 67108864, "target_key": "x256_y_parity", "target_key_bytes": 1000200000, "target_lookup_checksum": "0x8b2568562837af7f", "target_query_hash_bytes": 8658944, "target_table_buckets": 33554432, "target_table_bytes": 67108864, "thread_execution_width": 32, "threadgroup_limit": 128, "threads_per_threadgroup": 128, "timestamp": "2026-06-27T16:27:01Z", "validation_seconds": 8.316376, "validation_workers": 8}
{"affine_scan_mode": "cpu_batch_prod_zz_zzz", "affine_scan_seconds": 0.12769, "backend": "metal", "budget_sec": 120, "bytes_per_target": 2.683818, "candidate_verification": "tag16_hash_filter_then_cpu_exact_key_equality", "commit": "f74a2c5", "confirmation_index": 2, "confirmation_runs": 2, "confirmation_status": "discard", "cooldown_sec": 10.0, "correctness": true, "description": "Metal XYZZ affine DP scan tag16 hash-filter 25M-target GPU lookup threadgroup 256 versus 512", "distance_tracking": "packet_distance_uint64", "dp_bits": 8, "dp_checksum": "0x9dba4a07ebbb8e14", "dp_count": 1057, "dp_distance_checksum": "0xf0dc88ed68b2ff64", "dp_query_count": 1057, "dp_tracking": "affine_x256_y_parity_cpu_batch", "exact_host_table_bytes": 1268635456, "experiment": "metal_jacobian_dynamic_dp_stream_xyzz_affine_scan_target_lookup_tag16_hash_filter25m_tg256_gpu_lookup", "filter_false_positive_count": 216, "filter_positive_count": 280, "gpu_lookup_lookups_per_sec": 32413870.036723, "gpu_lookup_lookups_per_sec_max": 36330167.339536, "gpu_lookup_lookups_per_sec_min": 2736473.582699, "gpu_ops_per_sec": 45428420.193769, "hit_count": 64, "injected_hits": 64, "iterations": 134217728, "jump_count": 16, "jump_histogram_max_bucket": 8394316, "jump_histogram_max_deviation_ppm": 759, "jump_histogram_min_bucket": 8382245, "jump_index": "power2_mask", "jump_mixer": "avalanche64", "jump_schedule": "power2", "lookup_engine": "gpu_filter16_hash", "lookup_engine_effective": "gpu_filter16_hash", "lookup_exact_seconds": 0.003547, "lookup_gpu_seconds": 0.033392, "lookup_hash_seconds": 0.021119, "lookup_layout": "open_address_tag16_hash_filter_exact256", "lookup_max_threads_per_threadgroup": 1024, "lookup_query_mode": "distinct_misses", "lookup_repeat": 1024, "lookup_seconds": 0.058058, "lookup_thread_execution_width": 32, "lookup_threadgroup_limit": 256, "lookup_threads_per_threadgroup": 256, "lookups_per_sec": 18642794.090418, "machine": "macOS-26.5-arm64-arm-64bit-Mach-O", "max_threads_per_threadgroup": 1024, "min_ms": 500, "miss_count": 1082304, "operation": "jacobian_affine_scan_target_lookup_tag32", "ops_per_sec": 32413870.036723, "ops_per_sec_max": 36330167.339536, "ops_per_sec_min": 2736473.582699, "output_layout": "affine_dp_scan_target_lookup", "paired_baseline_ops_per_sec": 63839412.471301, "paired_baseline_ref": "HEAD", "paired_speedup": 0.507740732283441, "query_count": 1082368, "query_input": "hash64", "raw_status": "discard", "reason": "", "requested_hits": 64, "runner_sample_count": 3, "sample_count": 262144, "seconds": 2.954488, "skipped": false, "state_layout": "xyzz", "status": "discard", "steps_per_sample": 512, "target_bucket_bytes": 268435456, "target_count": 25005000, "target_filter_bucket_bytes": 67108864, "target_key": "x256_y_parity", "target_key_bytes": 1000200000, "target_lookup_checksum": "0x8b2568562837af7f", "target_query_hash_bytes": 8658944, "target_table_buckets": 33554432, "target_table_bytes": 67108864, "thread_execution_width": 32, "threadgroup_limit": 128, "threads_per_threadgroup": 128, "timestamp": "2026-06-27T16:27:01Z", "validation_seconds": 13.02016, "validation_workers": 8}
{"affine_scan_mode": "cpu_batch_prod_zz_zzz", "affine_scan_seconds": 0.051811, "backend": "metal", "budget_sec": 120, "bytes_per_target": 2.683818, "candidate_verification": "tag16_hash_filter_then_cpu_exact_key_equality", "commit": "e7a52db-dirty", "cooldown_sec": 10.0, "correctness": true, "description": "Metal XYZZ affine DP scan tag16 hash-filter 25M-target lookup with parallel host query-hash build", "distance_tracking": "packet_distance_uint64", "dp_bits": 8, "dp_checksum": "0x9dba4a07ebbb8e14", "dp_count": 1057, "dp_distance_checksum": "0xf0dc88ed68b2ff64", "dp_query_count": 1057, "dp_tracking": "affine_x256_y_parity_cpu_batch", "exact_host_table_bytes": 1268635456, "experiment": "metal_jacobian_dynamic_dp_stream_xyzz_affine_scan_target_lookup_tag16_hash_filter25m_parallel_hash", "filter_false_positive_count": 216, "filter_positive_count": 280, "gpu_lookup_lookups_per_sec": 91960546.535715, "gpu_ops_per_sec": 32248780.656435, "hit_count": 64, "injected_hits": 64, "iterations": 134217728, "jump_count": 16, "jump_histogram_max_bucket": 8394316, "jump_histogram_max_deviation_ppm": 759, "jump_histogram_min_bucket": 8382245, "jump_index": "power2_mask", "jump_mixer": "avalanche64", "jump_schedule": "power2", "lookup_engine": "gpu_filter16_hash", "lookup_engine_effective": "gpu_filter16_hash", "lookup_exact_seconds": 0.018425, "lookup_gpu_seconds": 0.01177, "lookup_hash_seconds": 0.053175, "lookup_layout": "open_address_tag16_hash_filter_exact256", "lookup_max_threads_per_threadgroup": 1024, "lookup_query_mode": "distinct_misses", "lookup_repeat": 1024, "lookup_seconds": 0.083371, "lookup_thread_execution_width": 32, "lookup_threadgroup_limit": 512, "lookup_threads_per_threadgroup": 512, "lookups_per_sec": 12982593.203088, "lookups_per_sec_max": 64651469.060514, "lookups_per_sec_min": 6931321.401037, "machine": "macOS-26.5-arm64-arm-64bit-Mach-O", "max_threads_per_threadgroup": 1024, "min_ms": 500, "miss_count": 1082304, "operation": "jacobian_affine_scan_target_lookup_tag32", "ops_per_sec": 12982593.203088, "ops_per_sec_max": 64651469.060514, "ops_per_sec_min": 6931321.401037, "output_layout": "affine_dp_scan_target_lookup", "paired_baseline_ops_per_sec": 28929781.596945, "paired_baseline_ref": "e7a52db", "paired_speedup": 0.4487622265513048, "query_count": 1082368, "query_input": "hash64", "reason": "", "requested_hits": 64, "runner_sample_count": 3, "sample_count": 262144, "seconds": 4.161947, "skipped": false, "state_layout": "xyzz", "status": "discard", "steps_per_sample": 512, "target_bucket_bytes": 268435456, "target_count": 25005000, "target_filter_bucket_bytes": 67108864, "target_key": "x256_y_parity", "target_key_bytes": 1000200000, "target_lookup_checksum": "0x8b2568562837af7f", "target_query_hash_bytes": 8658944, "target_table_buckets": 33554432, "target_table_bytes": 67108864, "thread_execution_width": 32, "threadgroup_limit": 128, "threads_per_threadgroup": 128, "timestamp": "2026-06-27T16:37:39Z", "validation_seconds": 24.361233, "validation_workers": 8}
{"affine_scan_mode": "cpu_batch_prod_zz_zzz", "affine_scan_seconds": 0.027644, "backend": "metal", "budget_sec": 120, "bytes_per_target": 2.683818, "candidate_verification": "tag16_fast_filter_then_cpu_exact_key_equality", "commit": "8ae72aa-dirty", "cooldown_sec": 10.0, "correctness": true, "description": "Metal XYZZ affine DP scan with explicit tag16 fast-key filter on a 25M-target distinct-miss batch", "distance_tracking": "packet_distance_uint64", "dp_bits": 8, "dp_checksum": "0x9dba4a07ebbb8e14", "dp_count": 1057, "dp_distance_checksum": "0xf0dc88ed68b2ff64", "dp_query_count": 1057, "dp_tracking": "affine_x256_y_parity_cpu_batch", "exact_host_table_bytes": 1268635456, "experiment": "metal_jacobian_dynamic_dp_stream_xyzz_affine_scan_target_lookup_tag16_fast_filter25m", "filter_false_positive_count": 249, "filter_positive_count": 313, "gpu_lookup_lookups_per_sec": 71913361.238456, "gpu_ops_per_sec": 53829181.398679, "hit_count": 64, "injected_hits": 64, "iterations": 134217728, "jump_count": 16, "jump_histogram_max_bucket": 8394316, "jump_histogram_max_deviation_ppm": 759, "jump_histogram_min_bucket": 8382245, "jump_index": "power2_mask", "jump_mixer": "avalanche64", "jump_schedule": "power2", "lookup_engine": "gpu_filter16_fast", "lookup_engine_effective": "gpu_filter16_fast", "lookup_exact_seconds": 9.7e-05, "lookup_gpu_seconds": 0.015051, "lookup_hash_seconds": 0.0, "lookup_layout": "open_address_tag16_fast_filter_exact256", "lookup_max_threads_per_threadgroup": 1024, "lookup_query_mode": "distinct_misses", "lookup_repeat": 1024, "lookup_seconds": 0.015148, "lookup_thread_execution_width": 32, "lookup_threadgroup_limit": 512, "lookup_threads_per_threadgroup": 512, "lookups_per_sec": 71452666.95194, "machine": "macOS-26.5-arm64-arm-64bit-Mach-O", "max_threads_per_threadgroup": 1024, "min_ms": 500, "miss_count": 1082304, "operation": "jacobian_affine_scan_target_lookup_tag32", "ops_per_sec": 52920937.13862, "ops_per_sec_max": 59802496.501619, "ops_per_sec_min": 42660666.289938, "output_layout": "affine_dp_scan_target_lookup", "paired_baseline_ops_per_sec": 59441584.43445, "paired_baseline_ref": "HEAD", "paired_speedup": 0.8903015900758713, "query_count": 1082368, "query_input": "key40_fast_hash", "reason": "", "requested_hits": 64, "runner_sample_count": 3, "sample_count": 262144, "seconds": 2.493401, "skipped": false, "state_layout": "xyzz", "status": "discard", "steps_per_sample": 512, "target_bucket_bytes": 268435456, "target_count": 25005000, "target_filter_bucket_bytes": 67108864, "target_key": "x256_y_parity", "target_key_bytes": 1000200000, "target_lookup_checksum": "0x8b2568562837af7f", "target_query_hash_bytes": 0, "target_table_buckets": 33554432, "target_table_bytes": 67108864, "thread_execution_width": 32, "threadgroup_limit": 128, "threads_per_threadgroup": 128, "timestamp": "2026-06-27T17:06:22Z", "validation_seconds": 7.663639, "validation_workers": 8}
{"affine_scan_mode": "cpu_batch_prod_zz_zzz", "affine_scan_seconds": 0.055901, "backend": "metal", "budget_sec": 120, "bytes_per_target": 2.683818, "candidate_verification": "tag16_fast_filter_then_cpu_exact_key_equality", "commit": "8ae72aa-dirty", "cooldown_sec": 10.0, "correctness": true, "description": "Lookup-only metric for explicit tag16 fast-key filter versus tag16 prehashed filter on a 25M-target distinct-miss batch", "distance_tracking": "packet_distance_uint64", "dp_bits": 8, "dp_checksum": "0x9dba4a07ebbb8e14", "dp_count": 1057, "dp_distance_checksum": "0xf0dc88ed68b2ff64", "dp_query_count": 1057, "dp_tracking": "affine_x256_y_parity_cpu_batch", "exact_host_table_bytes": 1268635456, "experiment": "metal_jacobian_dynamic_dp_stream_xyzz_affine_scan_target_lookup_tag16_fast_filter25m_lookup", "filter_false_positive_count": 249, "filter_positive_count": 313, "gpu_lookup_lookups_per_sec": 89776505.961638, "gpu_ops_per_sec": 61759519.464926, "hit_count": 64, "injected_hits": 64, "iterations": 134217728, "jump_count": 16, "jump_histogram_max_bucket": 8394316, "jump_histogram_max_deviation_ppm": 759, "jump_histogram_min_bucket": 8382245, "jump_index": "power2_mask", "jump_mixer": "avalanche64", "jump_schedule": "power2", "lookup_engine": "gpu_filter16_fast", "lookup_engine_effective": "gpu_filter16_fast", "lookup_exact_seconds": 0.000171, "lookup_gpu_seconds": 0.012056, "lookup_hash_seconds": 0.0, "lookup_layout": "open_address_tag16_fast_filter_exact256", "lookup_max_threads_per_threadgroup": 1024, "lookup_query_mode": "distinct_misses", "lookup_repeat": 1024, "lookup_seconds": 0.012228, "lookup_thread_execution_width": 32, "lookup_threadgroup_limit": 512, "lookup_threads_per_threadgroup": 512, "lookups_per_sec": 88517644.638092, "lookups_per_sec_max": 101248932.780938, "lookups_per_sec_min": 31488290.14955, "machine": "macOS-26.5-arm64-arm-64bit-Mach-O", "max_threads_per_threadgroup": 1024, "min_ms": 500, "miss_count": 1082304, "operation": "jacobian_affine_scan_target_lookup_tag32", "ops_per_sec": 88517644.638092, "ops_per_sec_max": 101248932.780938, "ops_per_sec_min": 31488290.14955, "output_layout": "affine_dp_scan_target_lookup", "paired_baseline_ops_per_sec": 26851353.739957, "paired_baseline_ref": "HEAD", "paired_speedup": 3.2965803324236322, "query_count": 1082368, "query_input": "key40_fast_hash", "reason": "", "requested_hits": 64, "runner_sample_count": 3, "sample_count": 262144, "seconds": 2.173231, "skipped": false, "state_layout": "xyzz", "status": "keep", "steps_per_sample": 512, "target_bucket_bytes": 268435456, "target_count": 25005000, "target_filter_bucket_bytes": 67108864, "target_key": "x256_y_parity", "target_key_bytes": 1000200000, "target_lookup_checksum": "0x8b2568562837af7f", "target_query_hash_bytes": 0, "target_table_buckets": 33554432, "target_table_bytes": 67108864, "thread_execution_width": 32, "threadgroup_limit": 128, "threads_per_threadgroup": 128, "timestamp": "2026-06-27T17:13:05Z", "validation_seconds": 15.565441, "validation_workers": 8}
