{"affine_scan_mode": "cpu_batch_prod_zz_zzz", "affine_scan_seconds": 0.006217, "backend": "metal", "budget_sec": 240, "commit": "b54ff56-dirty", "confirmation_index": 2, "confirmation_runs": 2, "confirmation_status": "discard", "cooldown_sec": 10.0, "correctness": true, "description": "Metal XYZZ 1024-step dp7 affine scan with 64-thread groups versus the default 128-thread cadence", "distance_tracking": "packet_distance_uint64", "dp_bits": 7, "dp_checksum": "0x08b06faea04109e6", "dp_count": 1999, "dp_distance_checksum": "0x33b34eda684bc0e5", "dp_tracking": "affine_x_limb0_cpu_batch", "experiment": "metal_jacobian_dynamic_dp_stream_xyzz_affine_scan_steps1024_dp7_tg64", "gpu_ops_per_sec": 60245464.695468, "iterations": 268435456, "jump_count": 16, "jump_histogram_max_bucket": 16782744, "jump_histogram_max_deviation_ppm": 389, "jump_histogram_min_bucket": 16770687, "jump_index": "power2_mask", "jump_mixer": "avalanche64", "jump_schedule": "power2", "machine": "macOS-26.5-arm64-arm-64bit-Mach-O", "max_threads_per_threadgroup": 1024, "min_ms": 500, "operation": "jacobian_affine_walk_dynamic_dp_stream_xyzz_affine_scan", "ops_per_sec": 60161520.073026, "ops_per_sec_max": 60775468.846468, "ops_per_sec_min": 48545433.197426, "output_layout": "affine_dp_scan", "paired_baseline_ops_per_sec": 105542058.430188, "paired_baseline_ref": "HEAD", "paired_speedup": 0.5700241303595621, "raw_status": "discard", "reason": "", "runner_sample_count": 3, "sample_count": 262144, "seconds": 4.455696, "skipped": false, "state_layout": "xyzz", "status": "discard", "steps_per_sample": 1024, "thread_execution_width": 32, "threadgroup_limit": 64, "threads_per_threadgroup": 64, "timestamp": "2026-06-28T18:41:27Z", "validation_seconds": 12.67178, "validation_workers": 8}
{"affine_scan_mode": "cpu_batch_prod_zz_zzz", "affine_scan_seconds": 0.008982, "backend": "metal", "budget_sec": 300, "bytes_per_target": 2.683818, "candidate_verification": "tag16_hash_filter_then_cpu_exact_key_equality", "commit": "88d6444-dirty", "confirmation_index": 1, "confirmation_runs": 2, "confirmation_status": "discard", "cooldown_sec": 10.0, "correctness": true, "description": "Metal XYZZ 1024/dp7 repeat-mode tag16 hash-filter 25M-target lookup threadgroup 256 versus 512", "distance_tracking": "packet_distance_uint64", "dp_bits": 7, "dp_checksum": "0x08b06faea04109e6", "dp_count": 1999, "dp_distance_checksum": "0x33b34eda684bc0e5", "dp_query_count": 1999, "dp_tracking": "affine_x256_y_parity_cpu_batch", "exact_host_table_bytes": 1268635456, "experiment": "metal_jacobian_dynamic_dp_stream_xyzz_affine_scan_target_lookup_tag16_hash_filter25m_steps1024_dp7_repeat1024_tg256_lookup", "filter_false_positive_count": 0, "filter_positive_count": 65536, "gpu_lookup_lookups_per_sec": 156740290.544927, "gpu_ops_per_sec": 46595008.950147, "hit_count": 65536, "injected_hits": 64, "iterations": 268435456, "jump_count": 16, "jump_histogram_max_bucket": 16782744, "jump_histogram_max_deviation_ppm": 389, "jump_histogram_min_bucket": 16770687, "jump_index": "power2_mask", "jump_mixer": "avalanche64", "jump_schedule": "power2", "lookup_engine": "gpu_filter16_hash", "lookup_engine_effective": "gpu_filter16_hash", "lookup_exact_seconds": 0.011263, "lookup_gpu_seconds": 0.01306, "lookup_hash_seconds": 0.001909, "lookup_layout": "open_address_tag16_hash_filter_exact256", "lookup_max_threads_per_threadgroup": 1024, "lookup_query_mode": "repeat", "lookup_repeat": 1024, "lookup_seconds": 0.026232, "lookup_thread_execution_width": 32, "lookup_threadgroup_limit": 256, "lookup_threads_per_threadgroup": 256, "lookups_per_sec": 78033668.777845, "lookups_per_sec_max": 84076086.012282, "lookups_per_sec_min": 51693487.912901, "machine": "macOS-26.5-arm64-arm-64bit-Mach-O", "max_threads_per_threadgroup": 1024, "min_ms": 500, "miss_count": 1981440, "operation": "jacobian_affine_scan_target_lookup_tag32", "ops_per_sec": 78033668.777845, "ops_per_sec_max": 84076086.012282, "ops_per_sec_min": 51693487.912901, "output_layout": "affine_dp_scan_target_lookup", "paired_baseline_ops_per_sec": 73736777.295463, "paired_baseline_ref": "HEAD", "paired_speedup": 1.058273383242183, "query_count": 2046976, "query_input": "hash64", "raw_status": "keep", "reason": "", "requested_hits": 64, "runner_sample_count": 3, "sample_count": 262144, "seconds": 5.761035, "skipped": false, "state_layout": "xyzz", "status": "discard", "steps_per_sample": 1024, "target_bucket_bytes": 268435456, "target_count": 25005000, "target_filter_bucket_bytes": 67108864, "target_key": "x256_y_parity", "target_key_bytes": 1000200000, "target_lookup_checksum": "0x4bfc0bfe896fe3ad", "target_query_hash_bytes": 16375808, "target_table_buckets": 33554432, "target_table_bytes": 67108864, "thread_execution_width": 32, "threadgroup_limit": 128, "threads_per_threadgroup": 128, "timestamp": "2026-06-28T18:52:47Z", "validation_seconds": 15.629203, "validation_workers": 8}
{"affine_scan_mode": "cpu_batch_prod_zz_zzz", "affine_scan_seconds": 0.018392, "backend": "metal", "budget_sec": 300, "bytes_per_target": 2.683818, "candidate_verification": "tag16_hash_filter_then_cpu_exact_key_equality", "commit": "88d6444-dirty", "confirmation_index": 2, "confirmation_runs": 2, "confirmation_status": "discard", "cooldown_sec": 10.0, "correctness": true, "description": "Metal XYZZ 1024/dp7 repeat-mode tag16 hash-filter 25M-target lookup threadgroup 256 versus 512", "distance_tracking": "packet_distance_uint64", "dp_bits": 7, "dp_checksum": "0x08b06faea04109e6", "dp_count": 1999, "dp_distance_checksum": "0x33b34eda684bc0e5", "dp_query_count": 1999, "dp_tracking": "affine_x256_y_parity_cpu_batch", "exact_host_table_bytes": 1268635456, "experiment": "metal_jacobian_dynamic_dp_stream_xyzz_affine_scan_target_lookup_tag16_hash_filter25m_steps1024_dp7_repeat1024_tg256_lookup", "filter_false_positive_count": 0, "filter_positive_count": 65536, "gpu_lookup_lookups_per_sec": 38043048.583754, "gpu_ops_per_sec": 42320151.951303, "hit_count": 65536, "injected_hits": 64, "iterations": 268435456, "jump_count": 16, "jump_histogram_max_bucket": 16782744, "jump_histogram_max_deviation_ppm": 389, "jump_histogram_min_bucket": 16770687, "jump_index": "power2_mask", "jump_mixer": "avalanche64", "jump_schedule": "power2", "lookup_engine": "gpu_filter16_hash", "lookup_engine_effective": "gpu_filter16_hash", "lookup_exact_seconds": 0.0087, "lookup_gpu_seconds": 0.053807, "lookup_hash_seconds": 0.01651, "lookup_layout": "open_address_tag16_hash_filter_exact256", "lookup_max_threads_per_threadgroup": 1024, "lookup_query_mode": "repeat", "lookup_repeat": 1024, "lookup_seconds": 0.079017, "lookup_thread_execution_width": 32, "lookup_threadgroup_limit": 256, "lookup_threads_per_threadgroup": 256, "lookups_per_sec": 25905527.445064, "lookups_per_sec_max": 86014015.868785, "lookups_per_sec_min": 25763140.674174, "machine": "macOS-26.5-arm64-arm-64bit-Mach-O", "max_threads_per_threadgroup": 1024, "min_ms": 500, "miss_count": 1981440, "operation": "jacobian_affine_scan_target_lookup_tag32", "ops_per_sec": 25905527.445064, "ops_per_sec_max": 86014015.868785, "ops_per_sec_min": 25763140.674174, "output_layout": "affine_dp_scan_target_lookup", "paired_baseline_ops_per_sec": 147194749.42191, "paired_baseline_ref": "HEAD", "paired_speedup": 0.17599491521813723, "query_count": 2046976, "query_input": "hash64", "raw_status": "discard", "reason": "", "requested_hits": 64, "runner_sample_count": 3, "sample_count": 262144, "seconds": 6.34297, "skipped": false, "state_layout": "xyzz", "status": "discard", "steps_per_sample": 1024, "target_bucket_bytes": 268435456, "target_count": 25005000, "target_filter_bucket_bytes": 67108864, "target_key": "x256_y_parity", "target_key_bytes": 1000200000, "target_lookup_checksum": "0x4bfc0bfe896fe3ad", "target_query_hash_bytes": 16375808, "target_table_buckets": 33554432, "target_table_bytes": 67108864, "thread_execution_width": 32, "threadgroup_limit": 128, "threads_per_threadgroup": 128, "timestamp": "2026-06-28T18:52:47Z", "validation_seconds": 25.923668, "validation_workers": 8}
{"affine_scan_mode": "cpu_batch_prod_zz_zzz", "affine_scan_seconds": 0.049463, "backend": "metal", "budget_sec": 300, "commit": "88b54b8-dirty", "confirmation_index": 1, "confirmation_runs": 2, "confirmation_status": "discard", "cooldown_sec": 10.0, "correctness": true, "description": "Metal XYZZ 2048-step packet walk with dp_bits=6 affine scan versus the accepted 1024-step dp7 cadence", "distance_tracking": "packet_distance_uint64", "dp_bits": 6, "dp_checksum": "0x53bb3a95a8af1270", "dp_count": 4121, "dp_distance_checksum": "0xc92fd9a5364bd81c", "dp_tracking": "affine_x_limb0_cpu_batch", "experiment": "metal_jacobian_dynamic_dp_stream_xyzz_affine_scan_steps2048_dp6", "gpu_ops_per_sec": 74322330.002248, "iterations": 536870912, "jump_count": 16, "jump_histogram_max_bucket": 33562777, "jump_histogram_max_deviation_ppm": 249, "jump_histogram_min_bucket": 33546500, "jump_index": "power2_mask", "jump_mixer": "avalanche64", "jump_schedule": "power2", "machine": "macOS-26.5-arm64-arm-64bit-Mach-O", "max_threads_per_threadgroup": 1024, "min_ms": 500, "operation": "jacobian_affine_walk_dynamic_dp_stream_xyzz_affine_scan", "ops_per_sec": 73816871.471887, "ops_per_sec_max": 125612968.785247, "ops_per_sec_min": 52056915.865445, "output_layout": "affine_dp_scan", "paired_baseline_ops_per_sec": 124567872.702391, "paired_baseline_ref": "HEAD", "paired_speedup": 0.5925835439788332, "raw_status": "discard", "reason": "", "runner_sample_count": 3, "sample_count": 262144, "seconds": 7.223548, "skipped": false, "state_layout": "xyzz", "status": "discard", "steps_per_sample": 2048, "thread_execution_width": 32, "threadgroup_limit": 128, "threads_per_threadgroup": 128, "timestamp": "2026-06-28T19:05:03Z", "validation_seconds": 28.499318, "validation_workers": 8}
{"affine_scan_mode": "cpu_batch_prod_zz_zzz", "affine_scan_seconds": 0.005647, "backend": "metal", "budget_sec": 300, "commit": "88b54b8-dirty", "confirmation_index": 2, "confirmation_runs": 2, "confirmation_status": "discard", "cooldown_sec": 10.0, "correctness": true, "description": "Metal XYZZ 2048-step packet walk with dp_bits=6 affine scan versus the accepted 1024-step dp7 cadence", "distance_tracking": "packet_distance_uint64", "dp_bits": 6, "dp_checksum": "0x53bb3a95a8af1270", "dp_count": 4121, "dp_distance_checksum": "0xc92fd9a5364bd81c", "dp_tracking": "affine_x_limb0_cpu_batch", "experiment": "metal_jacobian_dynamic_dp_stream_xyzz_affine_scan_steps2048_dp6", "gpu_ops_per_sec": 66943972.627422, "iterations": 536870912, "jump_count": 16, "jump_histogram_max_bucket": 33562777, "jump_histogram_max_deviation_ppm": 249, "jump_histogram_min_bucket": 33546500, "jump_index": "power2_mask", "jump_mixer": "avalanche64", "jump_schedule": "power2", "machine": "macOS-26.5-arm64-arm-64bit-Mach-O", "max_threads_per_threadgroup": 1024, "min_ms": 500, "operation": "jacobian_affine_walk_dynamic_dp_stream_xyzz_affine_scan", "ops_per_sec": 66896871.301844, "ops_per_sec_max": 70814796.679132, "ops_per_sec_min": 66124400.820996, "output_layout": "affine_dp_scan", "paired_baseline_ops_per_sec": 123864112.622089, "paired_baseline_ref": "HEAD", "paired_speedup": 0.5400827558983707, "raw_status": "discard", "reason": "", "runner_sample_count": 3, "sample_count": 262144, "seconds": 8.019705, "skipped": false, "state_layout": "xyzz", "status": "discard", "steps_per_sample": 2048, "thread_execution_width": 32, "threadgroup_limit": 128, "threads_per_threadgroup": 128, "timestamp": "2026-06-28T19:05:03Z", "validation_seconds": 22.653767, "validation_workers": 8}
{"affine_scan_mode": "cpu_batch_prod_zz_zzz", "affine_scan_seconds": 0.004991, "backend": "metal", "budget_sec": 300, "bytes_per_target": 2.683818, "candidate_verification": "tag16_hash_filter_then_cpu_exact_key_equality", "commit": "5bd36bf-dirty", "confirmation_index": 1, "confirmation_runs": 2, "confirmation_status": "discard", "cooldown_sec": 10.0, "correctness": true, "description": "Metal XYZZ affine DP scan tag16 hash-filter 25M-target repeat-mode lookup with repeat-indexed GPU hash reads", "distance_tracking": "packet_distance_uint64", "dp_bits": 8, "dp_checksum": "0x9dba4a07ebbb8e14", "dp_count": 1057, "dp_distance_checksum": "0xf0dc88ed68b2ff64", "dp_query_count": 1057, "dp_tracking": "affine_x256_y_parity_cpu_batch", "exact_host_table_bytes": 1268635456, "experiment": "metal_jacobian_dynamic_dp_stream_xyzz_affine_scan_target_lookup_tag16_hash_filter25m_repeat_indexed2048", "filter_false_positive_count": 2048, "filter_positive_count": 133120, "gpu_lookup_lookups_per_sec": 88540580.438129, "gpu_ops_per_sec": 97622607.995869, "hit_count": 131072, "injected_hits": 64, "iterations": 134217728, "jump_count": 16, "jump_histogram_max_bucket": 8394316, "jump_histogram_max_deviation_ppm": 759, "jump_histogram_min_bucket": 8382245, "jump_index": "power2_mask", "jump_mixer": "avalanche64", "jump_schedule": "power2", "lookup_engine": "gpu_filter16_hash_repeat", "lookup_engine_effective": "gpu_filter16_hash_repeat", "lookup_exact_seconds": 0.001197, "lookup_gpu_seconds": 0.024449, "lookup_hash_seconds": 1e-05, "lookup_layout": "open_address_tag16_hash_filter_exact256", "lookup_max_threads_per_threadgroup": 1024, "lookup_query_mode": "repeat", "lookup_repeat": 2048, "lookup_seconds": 0.025656, "lookup_thread_execution_width": 32, "lookup_threadgroup_limit": 512, "lookup_threads_per_threadgroup": 512, "lookups_per_sec": 84374198.785846, "lookups_per_sec_max": 98244891.709126, "lookups_per_sec_min": 51105668.460919, "machine": "macOS-26.5-arm64-arm-64bit-Mach-O", "max_threads_per_threadgroup": 1024, "min_ms": 500, "miss_count": 2033664, "operation": "jacobian_affine_scan_target_lookup_tag32", "ops_per_sec": 84374198.785846, "ops_per_sec_max": 98244891.709126, "ops_per_sec_min": 51105668.460919, "output_layout": "affine_dp_scan_target_lookup", "paired_baseline_ops_per_sec": 99307597.127335, "paired_baseline_ref": "HEAD", "paired_order": "alternate", "paired_speedup": 0.8496248144807997, "query_count": 2164736, "query_input": "hash64_repeat_indexed", "raw_status": "discard", "reason": "", "requested_hits": 64, "runner_sample_count": 3, "sample_count": 262144, "seconds": 1.374863, "skipped": false, "state_layout": "xyzz", "status": "discard", "steps_per_sample": 512, "target_bucket_bytes": 268435456, "target_count": 25005000, "target_filter_bucket_bytes": 67108864, "target_key": "x256_y_parity", "target_key_bytes": 1000200000, "target_lookup_checksum": "0x5b746bd07e35a252", "target_query_hash_bytes": 8456, "target_table_buckets": 33554432, "target_table_bytes": 67108864, "thread_execution_width": 32, "threadgroup_limit": 128, "threads_per_threadgroup": 128, "timestamp": "2026-06-28T19:29:32Z", "validation_seconds": 4.522156, "validation_workers": 8}
{"affine_scan_mode": "cpu_batch_prod_zz_zzz", "affine_scan_seconds": 0.005554, "backend": "metal", "budget_sec": 300, "bytes_per_target": 2.683818, "candidate_verification": "tag16_hash_filter_then_cpu_exact_key_equality", "commit": "5bd36bf-dirty", "confirmation_index": 2, "confirmation_runs": 2, "confirmation_status": "discard", "cooldown_sec": 10.0, "correctness": true, "description": "Metal XYZZ affine DP scan tag16 hash-filter 25M-target repeat-mode lookup with repeat-indexed GPU hash reads", "distance_tracking": "packet_distance_uint64", "dp_bits": 8, "dp_checksum": "0x9dba4a07ebbb8e14", "dp_count": 1057, "dp_distance_checksum": "0xf0dc88ed68b2ff64", "dp_query_count": 1057, "dp_tracking": "affine_x256_y_parity_cpu_batch", "exact_host_table_bytes": 1268635456, "experiment": "metal_jacobian_dynamic_dp_stream_xyzz_affine_scan_target_lookup_tag16_hash_filter25m_repeat_indexed2048", "filter_false_positive_count": 2048, "filter_positive_count": 133120, "gpu_lookup_lookups_per_sec": 112306990.647604, "gpu_ops_per_sec": 99047213.802568, "hit_count": 131072, "injected_hits": 64, "iterations": 134217728, "jump_count": 16, "jump_histogram_max_bucket": 8394316, "jump_histogram_max_deviation_ppm": 759, "jump_histogram_min_bucket": 8382245, "jump_index": "power2_mask", "jump_mixer": "avalanche64", "jump_schedule": "power2", "lookup_engine": "gpu_filter16_hash_repeat", "lookup_engine_effective": "gpu_filter16_hash_repeat", "lookup_exact_seconds": 0.001242, "lookup_gpu_seconds": 0.019275, "lookup_hash_seconds": 8e-06, "lookup_layout": "open_address_tag16_hash_filter_exact256", "lookup_max_threads_per_threadgroup": 1024, "lookup_query_mode": "repeat", "lookup_repeat": 2048, "lookup_seconds": 0.020525, "lookup_thread_execution_width": 32, "lookup_threadgroup_limit": 512, "lookup_threads_per_threadgroup": 512, "lookups_per_sec": 105466757.793263, "lookups_per_sec_max": 248871463.079353, "lookups_per_sec_min": 49426675.398179, "machine": "macOS-26.5-arm64-arm-64bit-Mach-O", "max_threads_per_threadgroup": 1024, "min_ms": 500, "miss_count": 2033664, "operation": "jacobian_affine_scan_target_lookup_tag32", "ops_per_sec": 105466757.793263, "ops_per_sec_max": 248871463.079353, "ops_per_sec_min": 49426675.398179, "output_layout": "affine_dp_scan_target_lookup", "paired_baseline_ops_per_sec": 51790678.320998, "paired_baseline_ref": "HEAD", "paired_order": "alternate", "paired_speedup": 2.036404256757969, "query_count": 2164736, "query_input": "hash64_repeat_indexed", "raw_status": "keep", "reason": "", "requested_hits": 64, "runner_sample_count": 3, "sample_count": 262144, "seconds": 1.355088, "skipped": false, "state_layout": "xyzz", "status": "discard", "steps_per_sample": 512, "target_bucket_bytes": 268435456, "target_count": 25005000, "target_filter_bucket_bytes": 67108864, "target_key": "x256_y_parity", "target_key_bytes": 1000200000, "target_lookup_checksum": "0x5b746bd07e35a252", "target_query_hash_bytes": 8456, "target_table_buckets": 33554432, "target_table_bytes": 67108864, "thread_execution_width": 32, "threadgroup_limit": 128, "threads_per_threadgroup": 128, "timestamp": "2026-06-28T19:29:32Z", "validation_seconds": 3.836326, "validation_workers": 8}
{"affine_scan_mode": "cpu_batch_prod_zz_zzz", "affine_scan_seconds": 0.005627, "backend": "metal", "budget_sec": 300, "bytes_per_target": 2.683818, "candidate_verification": "tag16_hash_filter_then_cpu_exact_key_equality", "commit": "5bd36bf-dirty", "confirmation_index": 1, "confirmation_runs": 2, "confirmation_status": "keep", "cooldown_sec": 10.0, "correctness": true, "description": "Metal XYZZ affine DP scan tag16 hash-filter 25M-target repeat-mode lookup with repeat-indexed GPU hash reads", "distance_tracking": "packet_distance_uint64", "dp_bits": 8, "dp_checksum": "0x9dba4a07ebbb8e14", "dp_count": 1057, "dp_distance_checksum": "0xf0dc88ed68b2ff64", "dp_query_count": 1057, "dp_tracking": "affine_x256_y_parity_cpu_batch", "exact_host_table_bytes": 1268635456, "experiment": "metal_jacobian_dynamic_dp_stream_xyzz_affine_scan_target_lookup_tag16_hash_filter25m_repeat_indexed2048", "filter_false_positive_count": 2048, "filter_positive_count": 133120, "gpu_lookup_lookups_per_sec": 124968826.145027, "gpu_ops_per_sec": 94148554.405073, "hit_count": 131072, "injected_hits": 64, "iterations": 134217728, "jump_count": 16, "jump_histogram_max_bucket": 8394316, "jump_histogram_max_deviation_ppm": 759, "jump_histogram_min_bucket": 8382245, "jump_index": "power2_mask", "jump_mixer": "avalanche64", "jump_schedule": "power2", "lookup_engine": "gpu_filter16_hash_repeat", "lookup_engine_effective": "gpu_filter16_hash_repeat", "lookup_exact_seconds": 0.003708, "lookup_gpu_seconds": 0.017322, "lookup_hash_seconds": 3.1e-05, "lookup_layout": "open_address_tag16_hash_filter_exact256", "lookup_max_threads_per_threadgroup": 1024, "lookup_query_mode": "repeat", "lookup_repeat": 2048, "lookup_seconds": 0.021061, "lookup_thread_execution_width": 32, "lookup_threadgroup_limit": 512, "lookup_threads_per_threadgroup": 512, "lookups_per_sec": 102783898.34653, "lookups_per_sec_max": 361165487.18824, "lookups_per_sec_min": 8796421.79849, "machine": "macOS-26.5-arm64-arm-64bit-Mach-O", "max_threads_per_threadgroup": 1024, "min_ms": 500, "miss_count": 2033664, "operation": "jacobian_affine_scan_target_lookup_tag32", "ops_per_sec": 102783898.34653, "ops_per_sec_max": 361165487.18824, "ops_per_sec_min": 8796421.79849, "output_layout": "affine_dp_scan_target_lookup", "paired_baseline_ops_per_sec": 72816861.69221, "paired_baseline_ref": "HEAD", "paired_order": "alternate", "paired_speedup": 1.4115397994078327, "query_count": 2164736, "query_input": "hash64_repeat_indexed", "raw_status": "keep", "reason": "", "requested_hits": 64, "runner_sample_count": 3, "sample_count": 262144, "seconds": 1.425595, "skipped": false, "state_layout": "xyzz", "status": "keep", "steps_per_sample": 512, "target_bucket_bytes": 268435456, "target_count": 25005000, "target_filter_bucket_bytes": 67108864, "target_key": "x256_y_parity", "target_key_bytes": 1000200000, "target_lookup_checksum": "0x5b746bd07e35a252", "target_query_hash_bytes": 8456, "target_table_buckets": 33554432, "target_table_bytes": 67108864, "thread_execution_width": 32, "threadgroup_limit": 128, "threads_per_threadgroup": 128, "timestamp": "2026-06-28T19:35:30Z", "validation_seconds": 4.175906, "validation_workers": 8}
