{"affine_scan_mode": "cpu_batch_prod_zz_zzz", "affine_scan_seconds": 0.010366, "backend": "metal", "budget_sec": 300, "commit": "07df136-dirty", "cooldown_sec": 10.0, "correctness": true, "description": "Large validated Metal XYZZ 2048-step dp6 walk gate matching the 25M fixed-round walker count", "distance_tracking": "packet_distance_uint64", "dp_bits": 6, "dp_checksum": "0x54ccada61fd1edbc", "dp_count": 2087, "dp_distance_checksum": "0xf31d7766e1607041", "dp_normalization": "host_batch_affine", "dp_sampling": "packet_endpoint", "dp_tracking": "affine_x_limb0_cpu_batch", "experiment": "metal_jacobian_dynamic_xyzz_steps2048_dp6_walk_gate_131k", "gpu_ops_per_sec": 52737488.982882, "gpu_ops_per_sec_max": 56581994.863964, "gpu_ops_per_sec_min": 50001478.853602, "iterations": 268435456, "jump_count": 16, "jump_histogram_max_bucket": 16782260, "jump_histogram_max_deviation_ppm": 346, "jump_histogram_min_bucket": 16771410, "jump_index": "power2_mask", "jump_mixer": "avalanche64", "jump_schedule": "power2", "machine": "macOS-26.5-arm64-arm-64bit-Mach-O", "max_sample_spread_ratio": 1.15, "max_threads_per_threadgroup": 1024, "min_ms": 0, "operation": "jacobian_affine_walk_dynamic_dp_stream_xyzz_affine_scan", "ops_per_sec": 52737488.982882, "ops_per_sec_max": 56581994.863964, "ops_per_sec_min": 50001478.853602, "output_layout": "affine_dp_scan", "paired_baseline_ops_per_sec": 57032145.333155, "paired_baseline_ref": "HEAD", "paired_baseline_sample_spread_ratio": 1.2255229912412926, "paired_order": "alternate", "paired_speedup": 0.9246976187694566, "reason": "paired baseline sample spread ratio 1.225523 exceeds max 1.150000", "runner_sample_count": 3, "sample_count": 131072, "sample_metric": "gpu_ops_per_sec", "sample_metric_values": [50001478.853602, 52737488.982882, 56581994.863964], "sample_spread_ratio": 1.1316064276744477, "seconds": 5.090031, "skipped": false, "state_layout": "xyzz", "status": "discard", "steps_per_sample": 2048, "thread_execution_width": 32, "threadgroup_limit": 128, "threads_per_threadgroup": 128, "timestamp": "2026-07-10T03:41:34Z", "validation_seconds": 16.244151, "validation_workers": 8}
{"affine_scan_mode": "cpu_batch_prod_zz_zzz", "affine_scan_seconds": 0.016951, "backend": "metal", "budget_sec": 300, "commit": "cf53c9d-dirty", "cooldown_sec": 10.0, "correctness": true, "description": "Large validated Metal XYZZ 2048-step dp6 walk gate matching the 25M fixed-round walker count", "distance_tracking": "packet_distance_uint64", "dp_bits": 6, "dp_checksum": "0x54ccada61fd1edbc", "dp_count": 2087, "dp_distance_checksum": "0xf31d7766e1607041", "dp_normalization": "host_batch_affine", "dp_sampling": "packet_endpoint", "dp_tracking": "affine_x_limb0_cpu_batch", "experiment": "metal_jacobian_dynamic_xyzz_steps2048_dp6_walk_gate_131k", "gpu_ops_per_sec": 55924386.840744, "gpu_ops_per_sec_max": 57335527.095855, "gpu_ops_per_sec_min": 45687497.139856, "iterations": 268435456, "jump_count": 16, "jump_histogram_max_bucket": 16782260, "jump_histogram_max_deviation_ppm": 346, "jump_histogram_min_bucket": 16771410, "jump_index": "power2_mask", "jump_mixer": "avalanche64", "jump_schedule": "power2", "machine": "macOS-26.5-arm64-arm-64bit-Mach-O", "max_sample_spread_ratio": 1.15, "max_threads_per_threadgroup": 1024, "min_ms": 0, "operation": "jacobian_affine_walk_dynamic_dp_stream_xyzz_affine_scan", "ops_per_sec": 55924386.840744, "ops_per_sec_max": 57335527.095855, "ops_per_sec_min": 45687497.139856, "output_layout": "affine_dp_scan", "paired_baseline_ops_per_sec": 48266665.428202, "paired_baseline_ref": "HEAD", "paired_baseline_sample_spread_ratio": 2.3453195148798622, "paired_order": "alternate", "paired_speedup": 1.1586544532257583, "reason": "sample spread ratio 1.254950 exceeds max 1.150000; paired baseline sample spread ratio 2.345320 exceeds max 1.150000", "runner_sample_count": 3, "sample_count": 131072, "sample_metric": "gpu_ops_per_sec", "sample_metric_values": [45687497.139856, 57335527.095855, 55924386.840744], "sample_spread_ratio": 1.2549500560370532, "seconds": 4.799971, "skipped": false, "state_layout": "xyzz", "status": "discard", "steps_per_sample": 2048, "thread_execution_width": 32, "threadgroup_limit": 128, "threads_per_threadgroup": 128, "timestamp": "2026-07-10T03:54:43Z", "validation_seconds": 34.474057, "validation_workers": 8}
{"affine_scan_mode": "cpu_batch_prod_zz_zzz", "affine_scan_seconds": 0.011591, "backend": "metal", "budget_sec": 600, "commit": "cf53c9d-dirty", "confirmation_index": 1, "confirmation_runs": 2, "confirmation_status": "discard", "cooldown_sec": 10.0, "correctness": true, "description": "Large validated Metal XYZZ 2048-step dp6 walk gate matching the 25M fixed-round walker count", "distance_tracking": "packet_distance_uint64", "dp_bits": 6, "dp_checksum": "0x54ccada61fd1edbc", "dp_count": 2087, "dp_distance_checksum": "0xf31d7766e1607041", "dp_normalization": "host_batch_affine", "dp_sampling": "packet_endpoint", "dp_tracking": "affine_x_limb0_cpu_batch", "experiment": "metal_jacobian_dynamic_xyzz_steps2048_dp6_walk_gate_131k", "gpu_ops_per_sec": 63003375.676572, "gpu_ops_per_sec_max": 116768925.559474, "gpu_ops_per_sec_min": 53298991.046979, "iterations": 268435456, "jump_count": 16, "jump_histogram_max_bucket": 16782260, "jump_histogram_max_deviation_ppm": 346, "jump_histogram_min_bucket": 16771410, "jump_index": "power2_mask", "jump_mixer": "avalanche64", "jump_schedule": "power2", "machine": "macOS-26.5-arm64-arm-64bit-Mach-O", "max_sample_spread_ratio": 1.15, "max_threads_per_threadgroup": 1024, "min_ms": 0, "operation": "jacobian_affine_walk_dynamic_dp_stream_xyzz_affine_scan", "ops_per_sec": 63003375.676572, "ops_per_sec_max": 116768925.559474, "ops_per_sec_min": 53298991.046979, "output_layout": "affine_dp_scan", "paired_baseline_ops_per_sec": 85585862.024576, "paired_baseline_ref": "HEAD", "paired_baseline_sample_spread_ratio": 1.772288021382961, "paired_order": "alternate", "paired_speedup": 0.7361423275549946, "raw_status": "discard", "reason": "sample spread ratio 2.190828 exceeds max 1.150000; paired baseline sample spread ratio 1.772288 exceeds max 1.150000", "runner_sample_count": 3, "sample_count": 131072, "sample_metric": "gpu_ops_per_sec", "sample_metric_values": [53298991.046979, 116768925.559474, 63003375.676572], "sample_spread_ratio": 2.1908280675810747, "seconds": 4.260652, "skipped": false, "state_layout": "xyzz", "status": "discard", "steps_per_sample": 2048, "thread_execution_width": 32, "threadgroup_limit": 128, "threads_per_threadgroup": 128, "timestamp": "2026-07-10T04:01:50Z", "validation_seconds": 11.789304, "validation_workers": 8}
{"affine_scan_mode": "cpu_batch_prod_zz_zzz", "affine_scan_seconds": 0.011261, "backend": "metal", "budget_sec": 600, "commit": "cf53c9d-dirty", "confirmation_index": 2, "confirmation_runs": 2, "confirmation_status": "discard", "cooldown_sec": 10.0, "correctness": true, "description": "Large validated Metal XYZZ 2048-step dp6 walk gate matching the 25M fixed-round walker count", "distance_tracking": "packet_distance_uint64", "dp_bits": 6, "dp_checksum": "0x54ccada61fd1edbc", "dp_count": 2087, "dp_distance_checksum": "0xf31d7766e1607041", "dp_normalization": "host_batch_affine", "dp_sampling": "packet_endpoint", "dp_tracking": "affine_x_limb0_cpu_batch", "experiment": "metal_jacobian_dynamic_xyzz_steps2048_dp6_walk_gate_131k", "gpu_ops_per_sec": 52833534.625048, "gpu_ops_per_sec_max": 115677481.182822, "gpu_ops_per_sec_min": 45918083.598927, "iterations": 268435456, "jump_count": 16, "jump_histogram_max_bucket": 16782260, "jump_histogram_max_deviation_ppm": 346, "jump_histogram_min_bucket": 16771410, "jump_index": "power2_mask", "jump_mixer": "avalanche64", "jump_schedule": "power2", "machine": "macOS-26.5-arm64-arm-64bit-Mach-O", "max_sample_spread_ratio": 1.15, "max_threads_per_threadgroup": 1024, "min_ms": 0, "operation": "jacobian_affine_walk_dynamic_dp_stream_xyzz_affine_scan", "ops_per_sec": 52833534.625048, "ops_per_sec_max": 115677481.182822, "ops_per_sec_min": 45918083.598927, "output_layout": "affine_dp_scan", "paired_baseline_ops_per_sec": 54911526.719308, "paired_baseline_ref": "HEAD", "paired_baseline_sample_spread_ratio": 1.6207086851816368, "paired_order": "alternate", "paired_speedup": 0.9621574518428143, "raw_status": "discard", "reason": "sample spread ratio 2.519214 exceeds max 1.150000; paired baseline sample spread ratio 1.620709 exceeds max 1.150000", "runner_sample_count": 3, "sample_count": 131072, "sample_metric": "gpu_ops_per_sec", "sample_metric_values": [52833534.625048, 115677481.182822, 45918083.598927], "sample_spread_ratio": 2.519214046326731, "seconds": 5.080778, "skipped": false, "state_layout": "xyzz", "status": "discard", "steps_per_sample": 2048, "thread_execution_width": 32, "threadgroup_limit": 128, "threads_per_threadgroup": 128, "timestamp": "2026-07-10T04:01:50Z", "validation_seconds": 15.899787, "validation_workers": 8}
{"affine_scan_mode": "cpu_batch_prod_zz_zzz", "affine_scan_seconds": 0.007265, "backend": "metal", "budget_sec": 300, "bytes_per_target": 4.0, "candidate_verification": "tag16_hash_filter_then_cpu_exact_key_equality", "commit": "a1b7146-dirty", "confirmation_index": 1, "confirmation_runs": 2, "confirmation_status": "discard", "cooldown_sec": 3.0, "correctness": true, "description": "Medium fixed-round 1M target lookup with physical distinct-miss queries; fast falsifier for setup-inclusive wall-clock kangaroo distance/sec", "distance_per_sec": 424474673131.52515, "distance_tracking": "packet_distance_uint64", "distinct_miss_source_seconds": 7e-06, "dp_bits": 6, "dp_checksum": "0xbd17120591af6f74", "dp_count": 1053, "dp_distance_checksum": "0x9eca239fc5687305", "dp_normalization": "host_batch_affine", "dp_query_count": 1053, "dp_sampling": "packet_endpoint", "dp_tracking": "affine_x256_y_parity_cpu_batch", "exact_host_table_bytes": 16779264, "experiment": "metal_jacobian_dynamic_dp_stream_xyzz_affine_scan_target_lookup_tag16_hash_filter1m_rounds_distinct_misses_distance", "filter_false_positive_count": 28, "filter_positive_count": 92, "gpu_distance_per_sec": 428307381074.8715, "gpu_lookup_lookups_per_sec": 250034086.956522, "gpu_ops_per_sec": 104568827.301411, "hit_count": 64, "host_load_1m_start": 4.81201171875, "host_load_per_cpu_start": 0.60150146484375, "host_logical_cpu_count": 8, "injected_hits": 64, "iterations": 134217728, "jump_count": 16, "jump_histogram_max_bucket": 8393138, "jump_histogram_max_deviation_ppm": 707, "jump_histogram_min_bucket": 8382675, "jump_index": "power2_mask", "jump_mixer": "avalanche64", "jump_schedule": "power2", "lookup_buffer_seconds": 0.010157, "lookup_engine": "gpu_filter16_hash", "lookup_engine_effective": "gpu_filter16_hash", "lookup_exact_seconds": 1.2e-05, "lookup_gpu_seconds": 0.004313, "lookup_hash_seconds": 0.0, "lookup_layout": "open_address_tag16_hash_filter_exact256", "lookup_max_threads_per_threadgroup": 1024, "lookup_query_mode": "distinct_misses", "lookup_repeat": 1024, "lookup_seconds": 0.004325, "lookup_thread_execution_width": 32, "lookup_threadgroup_limit": 512, "lookup_threads_per_threadgroup": 512, "lookup_wall_seconds": 0.014482, "lookups_per_sec": 249321014.40194, "machine": "macOS-26.5-arm64-arm-64bit-Mach-O", "max_sample_spread_ratio": 1.5, "max_threads_per_threadgroup": 1024, "mean_jump_distance": 4095.9375, "min_ms": 0, "miss_count": 1078208, "operation": "jacobian_affine_scan_target_lookup_tag32_rounds", "ops_per_sec": 378593852048.7592, "ops_per_sec_max": 402001467648.9685, "ops_per_sec_min": 373246317408.13306, "output_layout": "affine_dp_scan_target_lookup", "paired_baseline_ops_per_sec": 373582370349.6189, "paired_baseline_ref": "HEAD", "paired_order": "alternate", "paired_speedup": 1.0134146632627505, "physical_filter_positive_count": 92, "physical_query_count": 1078272, "query_count": 1078272, "query_input": "hash64_prefix_gpu_miss", "raw_status": "keep", "reason": "", "repeat_positive_index_encoding": "physical_query_index", "requested_hits": 32, "round_count": 2, "round_sample_build_seconds": 0.001609, "runner_sample_count": 3, "sample_count": 32768, "sample_metric": "setup_inclusive_wall_distance_per_sec", "sample_metric_values": [378593852048.7592, 402001467648.9685, 373246317408.13306], "sample_spread_ratio": 1.077040680375669, "seconds": 1.283535, "setup_inclusive_distance_per_sec": 398729782526.55774, "setup_inclusive_ops_per_sec": 97347623.719004, "setup_inclusive_seconds": 1.378747, "setup_inclusive_wall_distance_per_sec": 378593852048.7592, "setup_inclusive_wall_distance_per_sec_max": 402001467648.9685, "setup_inclusive_wall_distance_per_sec_min": 373246317408.13306, "setup_inclusive_wall_ops_per_sec": 92431550.053867, "setup_inclusive_wall_seconds": 1.452077, "skipped": false, "state_layout": "xyzz", "status": "discard", "steps_per_sample": 2048, "target_bucket_bytes": 16777216, "target_build_seconds": 0.082006, "target_count": 1048576, "target_filter_bucket_bytes": 4194304, "target_filter_build_seconds": 0.0, "target_key": "x256_y_parity", "target_key_bytes": 2048, "target_lookup_checksum": "0xcb38405cd10f441d", "target_lookup_scope": "packet_endpoint_dp_keys", "target_query_hash_bytes": 8424, "target_setup_workers": 8, "target_table_buckets": 2097152, "target_table_bytes": 4194304, "thread_execution_width": 32, "threadgroup_limit": 128, "threads_per_threadgroup": 128, "timestamp": "2026-07-10T04:54:25Z", "validation_seconds": 7.87802, "validation_workers": 8, "walk_buffer_seconds": 0.063173, "walk_round_mode": "independent", "walk_wall_seconds": 1.346708}
{"affine_scan_mode": "cpu_batch_prod_zz_zzz", "affine_scan_seconds": 0.034984, "backend": "metal", "budget_sec": 300, "bytes_per_target": 4.0, "candidate_verification": "tag16_hash_filter_then_cpu_exact_key_equality", "commit": "a1b7146-dirty", "confirmation_index": 2, "confirmation_runs": 2, "confirmation_status": "discard", "cooldown_sec": 3.0, "correctness": true, "description": "Medium fixed-round 1M target lookup with physical distinct-miss queries; fast falsifier for setup-inclusive wall-clock kangaroo distance/sec", "distance_per_sec": 235696782667.04108, "distance_tracking": "packet_distance_uint64", "distinct_miss_source_seconds": 1.6e-05, "dp_bits": 6, "dp_checksum": "0xbd17120591af6f74", "dp_count": 1053, "dp_distance_checksum": "0x9eca239fc5687305", "dp_normalization": "host_batch_affine", "dp_query_count": 1053, "dp_sampling": "packet_endpoint", "dp_tracking": "affine_x256_y_parity_cpu_batch", "exact_host_table_bytes": 16779264, "experiment": "metal_jacobian_dynamic_dp_stream_xyzz_affine_scan_target_lookup_tag16_hash_filter1m_rounds_distinct_misses_distance", "filter_false_positive_count": 28, "filter_positive_count": 92, "gpu_distance_per_sec": 239816301501.65076, "gpu_lookup_lookups_per_sec": 212928909.952607, "gpu_ops_per_sec": 58549795.132775, "hit_count": 64, "host_load_1m_start": 4.81201171875, "host_load_per_cpu_start": 0.60150146484375, "host_logical_cpu_count": 8, "injected_hits": 64, "iterations": 134217728, "jump_count": 16, "jump_histogram_max_bucket": 8393138, "jump_histogram_max_deviation_ppm": 707, "jump_histogram_min_bucket": 8382675, "jump_index": "power2_mask", "jump_mixer": "avalanche64", "jump_schedule": "power2", "lookup_buffer_seconds": 0.014882, "lookup_engine": "gpu_filter16_hash", "lookup_engine_effective": "gpu_filter16_hash", "lookup_exact_seconds": 1.9e-05, "lookup_gpu_seconds": 0.005064, "lookup_hash_seconds": 0.0, "lookup_layout": "open_address_tag16_hash_filter_exact256", "lookup_max_threads_per_threadgroup": 1024, "lookup_query_mode": "distinct_misses", "lookup_repeat": 1024, "lookup_seconds": 0.005083, "lookup_thread_execution_width": 32, "lookup_threadgroup_limit": 512, "lookup_threads_per_threadgroup": 512, "lookup_wall_seconds": 0.019965, "lookups_per_sec": 212150396.756925, "machine": "macOS-26.5-arm64-arm-64bit-Mach-O", "max_sample_spread_ratio": 1.5, "max_threads_per_threadgroup": 1024, "mean_jump_distance": 4095.9375, "min_ms": 0, "miss_count": 1078208, "operation": "jacobian_affine_scan_target_lookup_tag32_rounds", "ops_per_sec": 213413293761.22882, "ops_per_sec_max": 232637358264.3751, "ops_per_sec_min": 149827011628.48218, "output_layout": "affine_dp_scan_target_lookup", "paired_baseline_ops_per_sec": 323553463689.15643, "paired_baseline_ref": "HEAD", "paired_baseline_sample_spread_ratio": 2.113140084207967, "paired_order": "alternate", "paired_speedup": 0.6595920542091886, "physical_filter_positive_count": 92, "physical_query_count": 1078272, "query_count": 1078272, "query_input": "hash64_prefix_gpu_miss", "raw_status": "discard", "reason": "sample spread ratio 1.552706 exceeds max 1.500000; paired baseline sample spread ratio 2.113140 exceeds max 1.500000", "repeat_positive_index_encoding": "physical_query_index", "requested_hits": 32, "round_count": 2, "round_sample_build_seconds": 0.00122, "runner_sample_count": 3, "sample_count": 32768, "sample_metric": "setup_inclusive_wall_distance_per_sec", "sample_metric_values": [213413293761.22882, 149827011628.48218, 232637358264.3751], "sample_spread_ratio": 1.5527063894275166, "seconds": 2.292369, "setup_inclusive_distance_per_sec": 222390690921.80432, "setup_inclusive_ops_per_sec": 54295430.758356, "setup_inclusive_seconds": 2.471989, "setup_inclusive_wall_distance_per_sec": 213413293761.22882, "setup_inclusive_wall_distance_per_sec_max": 232637358264.3751, "setup_inclusive_wall_distance_per_sec_min": 149827011628.48218, "setup_inclusive_wall_ops_per_sec": 52103649.960779, "setup_inclusive_wall_seconds": 2.575976, "skipped": false, "state_layout": "xyzz", "status": "discard", "steps_per_sample": 2048, "target_bucket_bytes": 16777216, "target_build_seconds": 0.138318, "target_count": 1048576, "target_filter_bucket_bytes": 4194304, "target_filter_build_seconds": 0.0, "target_key": "x256_y_parity", "target_key_bytes": 2048, "target_lookup_checksum": "0xcb38405cd10f441d", "target_lookup_scope": "packet_endpoint_dp_keys", "target_query_hash_bytes": 8424, "target_setup_workers": 8, "target_table_buckets": 2097152, "target_table_bytes": 4194304, "thread_execution_width": 32, "threadgroup_limit": 128, "threads_per_threadgroup": 128, "timestamp": "2026-07-10T04:54:25Z", "validation_seconds": 47.756221, "validation_workers": 8, "walk_buffer_seconds": 0.089104, "walk_round_mode": "independent", "walk_wall_seconds": 2.381473}
