{"affine_scan_mode": "cpu_batch_prod_zz_zzz", "affine_scan_seconds": 0.001686, "backend": "metal", "budget_sec": 240, "commit": "1850591-dirty", "confirmation_index": 1, "confirmation_runs": 2, "confirmation_status": "discard", "cooldown_sec": 3.0, "correctness": true, "description": "Validated Metal XYZZ 2048-step dp6 walk gate for mechanism-level arithmetic and code-generation changes", "distance_tracking": "packet_distance_uint64", "dp_bits": 6, "dp_checksum": "0x3f104d05ebba588a", "dp_count": 526, "dp_distance_checksum": "0xb6a4ae454b38bdea", "dp_normalization": "host_batch_affine", "dp_sampling": "packet_endpoint", "dp_tracking": "affine_x_limb0_cpu_batch", "experiment": "metal_jacobian_dynamic_xyzz_steps2048_dp6_walk_gate", "gpu_ops_per_sec": 61412473.275719, "gpu_ops_per_sec_max": 80710293.878659, "gpu_ops_per_sec_min": 55156733.177432, "iterations": 67108864, "jump_count": 16, "jump_histogram_max_bucket": 4197079, "jump_histogram_max_deviation_ppm": 726, "jump_histogram_min_bucket": 4191260, "jump_index": "power2_mask", "jump_mixer": "avalanche64", "jump_schedule": "power2", "machine": "macOS-26.5-arm64-arm-64bit-Mach-O", "max_sample_spread_ratio": 1.15, "max_threads_per_threadgroup": 1024, "min_ms": 0, "operation": "jacobian_affine_walk_dynamic_dp_stream_xyzz_affine_scan", "ops_per_sec": 61412473.275719, "ops_per_sec_max": 80710293.878659, "ops_per_sec_min": 55156733.177432, "output_layout": "affine_dp_scan", "paired_baseline_ops_per_sec": 67846659.650813, "paired_baseline_ref": "HEAD", "paired_baseline_sample_spread_ratio": 1.796071237472803, "paired_order": "alternate", "paired_speedup": 0.9051657604337652, "raw_status": "discard", "reason": "sample spread ratio 1.463290 exceeds max 1.150000; paired baseline sample spread ratio 1.796071 exceeds max 1.150000", "runner_sample_count": 3, "sample_count": 32768, "sample_metric": "gpu_ops_per_sec", "sample_metric_values": [80710293.878659, 55156733.177432, 61412473.275719], "sample_spread_ratio": 1.4632899598862124, "seconds": 1.092756, "skipped": false, "state_layout": "xyzz", "status": "discard", "steps_per_sample": 2048, "thread_execution_width": 32, "threadgroup_limit": 128, "threads_per_threadgroup": 128, "timestamp": "2026-07-10T02:47:02Z", "validation_seconds": 5.376984, "validation_workers": 8}
{"affine_scan_mode": "cpu_batch_prod_zz_zzz", "affine_scan_seconds": 0.002483, "backend": "metal", "budget_sec": 240, "commit": "1850591-dirty", "confirmation_index": 2, "confirmation_runs": 2, "confirmation_status": "discard", "cooldown_sec": 3.0, "correctness": true, "description": "Validated Metal XYZZ 2048-step dp6 walk gate for mechanism-level arithmetic and code-generation changes", "distance_tracking": "packet_distance_uint64", "dp_bits": 6, "dp_checksum": "0x3f104d05ebba588a", "dp_count": 526, "dp_distance_checksum": "0xb6a4ae454b38bdea", "dp_normalization": "host_batch_affine", "dp_sampling": "packet_endpoint", "dp_tracking": "affine_x_limb0_cpu_batch", "experiment": "metal_jacobian_dynamic_xyzz_steps2048_dp6_walk_gate", "gpu_ops_per_sec": 83424464.69819, "gpu_ops_per_sec_max": 85638721.065795, "gpu_ops_per_sec_min": 81719682.632837, "iterations": 67108864, "jump_count": 16, "jump_histogram_max_bucket": 4197079, "jump_histogram_max_deviation_ppm": 726, "jump_histogram_min_bucket": 4191260, "jump_index": "power2_mask", "jump_mixer": "avalanche64", "jump_schedule": "power2", "machine": "macOS-26.5-arm64-arm-64bit-Mach-O", "max_sample_spread_ratio": 1.15, "max_threads_per_threadgroup": 1024, "min_ms": 0, "operation": "jacobian_affine_walk_dynamic_dp_stream_xyzz_affine_scan", "ops_per_sec": 83424464.69819, "ops_per_sec_max": 85638721.065795, "ops_per_sec_min": 81719682.632837, "output_layout": "affine_dp_scan", "paired_baseline_ops_per_sec": 77605888.201225, "paired_baseline_ref": "HEAD", "paired_order": "alternate", "paired_speedup": 1.0749759667962044, "raw_status": "keep", "reason": "", "runner_sample_count": 3, "sample_count": 32768, "sample_metric": "gpu_ops_per_sec", "sample_metric_values": [85638721.065795, 83424464.69819, 81719682.632837], "sample_spread_ratio": 1.0479570931591362, "seconds": 0.804427, "skipped": false, "state_layout": "xyzz", "status": "discard", "steps_per_sample": 2048, "thread_execution_width": 32, "threadgroup_limit": 128, "threads_per_threadgroup": 128, "timestamp": "2026-07-10T02:47:03Z", "validation_seconds": 5.229293, "validation_workers": 8}
{"affine_scan_mode": "cpu_batch_prod_zz_zzz", "affine_scan_seconds": 0.028028, "backend": "metal", "budget_sec": 480, "commit": "1850591-dirty", "cooldown_sec": 10.0, "correctness": true, "description": "Large validated Metal XYZZ 2048-step dp6 walk gate matching the 25M fixed-round walker count", "distance_tracking": "packet_distance_uint64", "dp_bits": 6, "dp_checksum": "0x54ccada61fd1edbc", "dp_count": 2087, "dp_distance_checksum": "0xf31d7766e1607041", "dp_normalization": "host_batch_affine", "dp_sampling": "packet_endpoint", "dp_tracking": "affine_x_limb0_cpu_batch", "experiment": "metal_jacobian_dynamic_xyzz_steps2048_dp6_walk_gate_131k", "gpu_ops_per_sec": 73643730.147977, "gpu_ops_per_sec_max": 77681038.020423, "gpu_ops_per_sec_min": 69800277.636578, "iterations": 268435456, "jump_count": 16, "jump_histogram_max_bucket": 16782260, "jump_histogram_max_deviation_ppm": 346, "jump_histogram_min_bucket": 16771410, "jump_index": "power2_mask", "jump_mixer": "avalanche64", "jump_schedule": "power2", "machine": "macOS-26.5-arm64-arm-64bit-Mach-O", "max_sample_spread_ratio": 1.15, "max_threads_per_threadgroup": 1024, "min_ms": 0, "operation": "jacobian_affine_walk_dynamic_dp_stream_xyzz_affine_scan", "ops_per_sec": 73643730.147977, "ops_per_sec_max": 77681038.020423, "ops_per_sec_min": 69800277.636578, "output_layout": "affine_dp_scan", "paired_baseline_ops_per_sec": 66809514.21736, "paired_baseline_ref": "HEAD", "paired_order": "alternate", "paired_speedup": 1.1022940521372804, "reason": "", "runner_sample_count": 3, "sample_count": 131072, "sample_metric": "gpu_ops_per_sec", "sample_metric_values": [69800277.636578, 73643730.147977, 77681038.020423], "sample_spread_ratio": 1.1129044274705748, "seconds": 3.645055, "skipped": false, "state_layout": "xyzz", "status": "keep", "steps_per_sample": 2048, "thread_execution_width": 32, "threadgroup_limit": 128, "threads_per_threadgroup": 128, "timestamp": "2026-07-10T02:53:52Z", "validation_seconds": 18.709869, "validation_workers": 8}
{"affine_scan_mode": "cpu_batch_prod_zz_zzz", "affine_scan_seconds": 0.046279, "backend": "metal", "budget_sec": 360, "bytes_per_target": 4.0, "candidate_verification": "tag16_hash_filter_then_cpu_exact_key_equality", "commit": "1850591-dirty", "cooldown_sec": 3.0, "correctness": true, "description": "Medium fixed-round 1M target lookup with physical distinct-miss queries; fast falsifier for setup-inclusive wall-clock kangaroo distance/sec", "distance_per_sec": 300654566136.2758, "distance_tracking": "packet_distance_uint64", "distinct_miss_source_seconds": 2.3e-05, "dp_bits": 6, "dp_checksum": "0xbd17120591af6f74", "dp_count": 1053, "dp_distance_checksum": "0x9eca239fc5687305", "dp_normalization": "host_batch_affine", "dp_query_count": 1053, "dp_sampling": "packet_endpoint", "dp_tracking": "affine_x256_y_parity_cpu_batch", "exact_host_table_bytes": 16779264, "experiment": "metal_jacobian_dynamic_dp_stream_xyzz_affine_scan_target_lookup_tag16_hash_filter1m_rounds_distinct_misses_distance", "filter_false_positive_count": 28, "filter_positive_count": 92, "gpu_distance_per_sec": 309240969343.16534, "gpu_lookup_lookups_per_sec": 249330642.10493, "gpu_ops_per_sec": 75499435.561008, "hit_count": 64, "injected_hits": 64, "iterations": 134217728, "jump_count": 16, "jump_histogram_max_bucket": 8393138, "jump_histogram_max_deviation_ppm": 707, "jump_histogram_min_bucket": 8382675, "jump_index": "power2_mask", "jump_mixer": "avalanche64", "jump_schedule": "power2", "lookup_buffer_seconds": 0.001855, "lookup_engine": "gpu_filter16_hash", "lookup_engine_effective": "gpu_filter16_hash", "lookup_exact_seconds": 0.000167, "lookup_gpu_seconds": 0.004325, "lookup_hash_seconds": 0.0, "lookup_layout": "open_address_tag16_hash_filter_exact256", "lookup_max_threads_per_threadgroup": 1024, "lookup_query_mode": "distinct_misses", "lookup_repeat": 1024, "lookup_seconds": 0.004492, "lookup_thread_execution_width": 32, "lookup_threadgroup_limit": 512, "lookup_threads_per_threadgroup": 512, "lookup_wall_seconds": 0.006347, "lookups_per_sec": 240053911.680218, "machine": "macOS-26.5-arm64-arm-64bit-Mach-O", "max_sample_spread_ratio": 1.5, "max_threads_per_threadgroup": 1024, "mean_jump_distance": 4095.9375, "min_ms": 0, "miss_count": 1078208, "operation": "jacobian_affine_scan_target_lookup_tag32_rounds", "ops_per_sec": 273503001340.47253, "ops_per_sec_max": 279023926237.8669, "ops_per_sec_min": 266018832480.50214, "output_layout": "affine_dp_scan_target_lookup", "paired_baseline_ops_per_sec": 269431527059.4614, "paired_baseline_ref": "HEAD", "paired_order": "alternate", "paired_speedup": 1.015111350647961, "physical_filter_positive_count": 92, "physical_query_count": 1078272, "query_count": 1078272, "query_input": "hash64_prefix_gpu_miss", "reason": "", "repeat_positive_index_encoding": "physical_query_index", "requested_hits": 32, "round_count": 2, "round_sample_build_seconds": 0.001781, "runner_sample_count": 3, "sample_count": 32768, "sample_metric": "setup_inclusive_wall_distance_per_sec", "sample_metric_values": [279023926237.8669, 266018832480.50214, 273503001340.47253], "sample_spread_ratio": 1.0488878687125205, "seconds": 1.777732, "setup_inclusive_distance_per_sec": 289971622940.7868, "setup_inclusive_ops_per_sec": 70794933.501985, "setup_inclusive_seconds": 1.895866, "setup_inclusive_wall_distance_per_sec": 273503001340.47253, "setup_inclusive_wall_distance_per_sec_max": 279023926237.8669, "setup_inclusive_wall_distance_per_sec_min": 266018832480.50214, "setup_inclusive_wall_ops_per_sec": 66774212.580263, "setup_inclusive_wall_seconds": 2.010023, "skipped": false, "state_layout": "xyzz", "status": "keep", "steps_per_sample": 2048, "target_bucket_bytes": 16777216, "target_build_seconds": 0.065561, "target_count": 1048576, "target_filter_bucket_bytes": 4194304, "target_filter_build_seconds": 0.0, "target_key": "x256_y_parity", "target_key_bytes": 2048, "target_lookup_checksum": "0xcb38405cd10f441d", "target_lookup_scope": "packet_endpoint_dp_keys", "target_query_hash_bytes": 8424, "target_setup_workers": 8, "target_table_buckets": 2097152, "target_table_bytes": 4194304, "thread_execution_width": 32, "threadgroup_limit": 128, "threads_per_threadgroup": 128, "timestamp": "2026-07-10T02:57:52Z", "validation_seconds": 10.002312, "validation_workers": 8, "walk_buffer_seconds": 0.112302, "walk_round_mode": "independent", "walk_wall_seconds": 1.890034}
{"affine_scan_mode": "cpu_batch_prod_zz_zzz", "affine_scan_seconds": 0.029353, "backend": "metal", "budget_sec": 900, "bytes_per_target": 2.683818, "candidate_verification": "tag16_hash_filter_then_cpu_exact_key_equality", "commit": "6b2be7a", "cooldown_sec": 10.0, "correctness": true, "description": "Fixed-round 25M target lookup with physical distinct-miss queries; scores setup-inclusive wall-clock kangaroo distance/sec", "distance_per_sec": 251210174770.4765, "distance_tracking": "packet_distance_uint64", "distinct_miss_source_seconds": 2e-05, "dp_bits": 6, "dp_checksum": "0x7f111e78c67b5c18", "dp_count": 4121, "dp_distance_checksum": "0x894123b96acf0de5", "dp_normalization": "host_batch_affine", "dp_query_count": 4121, "dp_sampling": "packet_endpoint", "dp_tracking": "affine_x256_y_parity_cpu_batch", "exact_host_table_bytes": 268439552, "experiment": "metal_jacobian_dynamic_dp_stream_xyzz_affine_scan_target_lookup_tag16_hash_filter25m_rounds_distinct_misses_distance", "filter_false_positive_count": 411, "filter_positive_count": 539, "gpu_distance_per_sec": 252758043384.3857, "gpu_lookup_lookups_per_sec": 176713208.624571, "gpu_ops_per_sec": 61709448.297096, "hit_count": 128, "injected_hits": 128, "iterations": 536870912, "jump_count": 16, "jump_histogram_max_bucket": 33562777, "jump_histogram_max_deviation_ppm": 249, "jump_histogram_min_bucket": 33546500, "jump_index": "power2_mask", "jump_mixer": "avalanche64", "jump_schedule": "power2", "lookup_buffer_seconds": 0.002563, "lookup_engine": "gpu_filter16_hash", "lookup_engine_effective": "gpu_filter16_hash", "lookup_exact_seconds": 0.000373, "lookup_gpu_seconds": 0.02388, "lookup_hash_seconds": 0.0, "lookup_layout": "open_address_tag16_hash_filter_exact256", "lookup_max_threads_per_threadgroup": 1024, "lookup_query_mode": "distinct_misses", "lookup_repeat": 1024, "lookup_seconds": 0.024253, "lookup_thread_execution_width": 32, "lookup_threadgroup_limit": 512, "lookup_threads_per_threadgroup": 512, "lookup_wall_seconds": 0.026816, "lookups_per_sec": 173993046.964224, "machine": "macOS-26.5-arm64-arm-64bit-Mach-O", "max_sample_spread_ratio": 1.5, "max_threads_per_threadgroup": 1024, "mean_jump_distance": 4095.9375, "min_ms": 0, "miss_count": 4219776, "operation": "jacobian_affine_scan_target_lookup_tag32_rounds", "ops_per_sec": 219466772397.49008, "ops_per_sec_max": 404201608811.6237, "ops_per_sec_min": 207530107372.91016, "output_layout": "affine_dp_scan_target_lookup", "paired_baseline_ops_per_sec": 238301068109.46716, "paired_baseline_ref": "1850591009b117ebb23baa9696dee052a7916563", "paired_baseline_sample_spread_ratio": 1.97203114971449, "paired_order": "alternate", "paired_speedup": 0.9209642832850197, "physical_filter_positive_count": 539, "physical_query_count": 4219904, "query_count": 4219904, "query_input": "hash64_prefix_gpu_miss", "reason": "sample spread ratio 1.947677 exceeds max 1.500000; paired baseline sample spread ratio 1.972031 exceeds max 1.500000", "repeat_positive_index_encoding": "physical_query_index", "requested_hits": 64, "round_count": 2, "round_sample_build_seconds": 0.00847, "runner_sample_count": 3, "sample_count": 131072, "sample_metric": "setup_inclusive_wall_distance_per_sec", "sample_metric_values": [219466772397.49008, 404201608811.6237, 207530107372.91016], "sample_spread_ratio": 1.9476769608436388, "seconds": 8.699979, "setup_inclusive_distance_per_sec": 225102653176.14648, "setup_inclusive_ops_per_sec": 54957541.021108, "setup_inclusive_seconds": 9.768831, "setup_inclusive_wall_distance_per_sec": 219466772397.49008, "setup_inclusive_wall_distance_per_sec_max": 404201608811.6237, "setup_inclusive_wall_distance_per_sec_min": 207530107372.91016, "setup_inclusive_wall_ops_per_sec": 53581572.569769, "setup_inclusive_wall_seconds": 10.019693, "skipped": false, "state_layout": "xyzz", "status": "discard", "steps_per_sample": 2048, "target_bucket_bytes": 268435456, "target_build_seconds": 1.006755, "target_count": 25005000, "target_filter_bucket_bytes": 67108864, "target_filter_build_seconds": 0.0, "target_key": "x256_y_parity", "target_key_bytes": 4096, "target_lookup_checksum": "0x5c90bdf7f12141b9", "target_lookup_scope": "packet_endpoint_dp_keys", "target_query_hash_bytes": 32968, "target_setup_workers": 8, "target_table_buckets": 33554432, "target_table_bytes": 67108864, "thread_execution_width": 32, "threadgroup_limit": 128, "threads_per_threadgroup": 128, "timestamp": "2026-07-10T03:16:21Z", "validation_seconds": 47.941804, "validation_workers": 8, "walk_buffer_seconds": 0.2483, "walk_round_mode": "independent", "walk_wall_seconds": 8.948279}
{"affine_scan_mode": "cpu_batch_prod_zz_zzz", "affine_scan_seconds": 0.00774, "backend": "metal", "budget_sec": 300, "commit": "ccdc95f-dirty", "cooldown_sec": 10.0, "correctness": true, "description": "Large validated Metal XYZZ 2048-step dp6 walk gate matching the 25M fixed-round walker count", "distance_tracking": "packet_distance_uint64", "dp_bits": 6, "dp_checksum": "0x54ccada61fd1edbc", "dp_count": 2087, "dp_distance_checksum": "0xf31d7766e1607041", "dp_normalization": "host_batch_affine", "dp_sampling": "packet_endpoint", "dp_tracking": "affine_x_limb0_cpu_batch", "experiment": "metal_jacobian_dynamic_xyzz_steps2048_dp6_walk_gate_131k", "gpu_ops_per_sec": 122242153.217859, "gpu_ops_per_sec_max": 123231105.041674, "gpu_ops_per_sec_min": 48399567.878156, "iterations": 268435456, "jump_count": 16, "jump_histogram_max_bucket": 16782260, "jump_histogram_max_deviation_ppm": 346, "jump_histogram_min_bucket": 16771410, "jump_index": "power2_mask", "jump_mixer": "avalanche64", "jump_schedule": "power2", "machine": "macOS-26.5-arm64-arm-64bit-Mach-O", "max_sample_spread_ratio": 1.15, "max_threads_per_threadgroup": 1024, "min_ms": 0, "operation": "jacobian_affine_walk_dynamic_dp_stream_xyzz_affine_scan", "ops_per_sec": 122242153.217859, "ops_per_sec_max": 123231105.041674, "ops_per_sec_min": 48399567.878156, "output_layout": "affine_dp_scan", "paired_baseline_ops_per_sec": 124847003.265383, "paired_baseline_ref": "HEAD", "paired_order": "alternate", "paired_speedup": 0.9791356622154, "reason": "sample spread ratio 2.546120 exceeds max 1.150000", "runner_sample_count": 3, "sample_count": 131072, "sample_metric": "gpu_ops_per_sec", "sample_metric_values": [123231105.041674, 122242153.217859, 48399567.878156], "sample_spread_ratio": 2.546119943713205, "seconds": 2.195932, "skipped": false, "state_layout": "xyzz", "status": "discard", "steps_per_sample": 2048, "thread_execution_width": 32, "threadgroup_limit": 128, "threads_per_threadgroup": 128, "timestamp": "2026-07-10T03:23:14Z", "validation_seconds": 8.960665, "validation_workers": 8}
{"affine_scan_mode": "cpu_batch_prod_zz_zzz", "affine_scan_seconds": 0.005105, "backend": "metal", "budget_sec": 300, "commit": "ccdc95f-dirty", "cooldown_sec": 10.0, "correctness": true, "description": "Large validated Metal XYZZ 2048-step dp6 walk gate matching the 25M fixed-round walker count", "distance_tracking": "packet_distance_uint64", "dp_bits": 6, "dp_checksum": "0x54ccada61fd1edbc", "dp_count": 2087, "dp_distance_checksum": "0xf31d7766e1607041", "dp_normalization": "host_batch_affine", "dp_sampling": "packet_endpoint", "dp_tracking": "affine_x_limb0_cpu_batch", "experiment": "metal_jacobian_dynamic_xyzz_steps2048_dp6_walk_gate_131k", "gpu_ops_per_sec": 125979259.226929, "gpu_ops_per_sec_max": 128321054.732409, "gpu_ops_per_sec_min": 91384437.233116, "iterations": 268435456, "jump_count": 16, "jump_histogram_max_bucket": 16782260, "jump_histogram_max_deviation_ppm": 346, "jump_histogram_min_bucket": 16771410, "jump_index": "power2_mask", "jump_mixer": "avalanche64", "jump_schedule": "power2", "machine": "macOS-26.5-arm64-arm-64bit-Mach-O", "max_sample_spread_ratio": 1.15, "max_threads_per_threadgroup": 1024, "min_ms": 0, "operation": "jacobian_affine_walk_dynamic_dp_stream_xyzz_affine_scan", "ops_per_sec": 125979259.226929, "ops_per_sec_max": 128321054.732409, "ops_per_sec_min": 91384437.233116, "output_layout": "affine_dp_scan", "paired_baseline_ops_per_sec": 126384877.712609, "paired_baseline_ref": "HEAD", "paired_baseline_sample_spread_ratio": 1.4964749804289517, "paired_order": "alternate", "paired_speedup": 0.9967906090267987, "reason": "sample spread ratio 1.404189 exceeds max 1.150000; paired baseline sample spread ratio 1.496475 exceeds max 1.150000", "runner_sample_count": 3, "sample_count": 131072, "sample_metric": "gpu_ops_per_sec", "sample_metric_values": [128321054.732409, 125979259.226929, 91384437.233116], "sample_spread_ratio": 1.4041893632837066, "seconds": 2.130791, "skipped": false, "state_layout": "xyzz", "status": "discard", "steps_per_sample": 2048, "thread_execution_width": 32, "threadgroup_limit": 128, "threads_per_threadgroup": 128, "timestamp": "2026-07-10T03:27:31Z", "validation_seconds": 13.344265, "validation_workers": 8}
{"affine_scan_mode": "cpu_batch_prod_zz_zzz", "affine_scan_seconds": 0.012901, "backend": "metal", "budget_sec": 300, "commit": "82ecf76-dirty", "cooldown_sec": 10.0, "correctness": true, "description": "Large validated Metal XYZZ 2048-step dp6 walk gate matching the 25M fixed-round walker count", "distance_tracking": "packet_distance_uint64", "dp_bits": 6, "dp_checksum": "0x54ccada61fd1edbc", "dp_count": 2087, "dp_distance_checksum": "0xf31d7766e1607041", "dp_normalization": "host_batch_affine", "dp_sampling": "packet_endpoint", "dp_tracking": "affine_x_limb0_cpu_batch", "experiment": "metal_jacobian_dynamic_xyzz_steps2048_dp6_walk_gate_131k", "gpu_ops_per_sec": 56257133.655341, "gpu_ops_per_sec_max": 65889027.489572, "gpu_ops_per_sec_min": 54937482.497488, "iterations": 268435456, "jump_count": 16, "jump_histogram_max_bucket": 16782260, "jump_histogram_max_deviation_ppm": 346, "jump_histogram_min_bucket": 16771410, "jump_index": "power2_mask", "jump_mixer": "avalanche64", "jump_schedule": "power2", "machine": "macOS-26.5-arm64-arm-64bit-Mach-O", "max_sample_spread_ratio": 1.15, "max_threads_per_threadgroup": 1024, "min_ms": 0, "operation": "jacobian_affine_walk_dynamic_dp_stream_xyzz_affine_scan", "ops_per_sec": 56257133.655341, "ops_per_sec_max": 65889027.489572, "ops_per_sec_min": 54937482.497488, "output_layout": "affine_dp_scan", "paired_baseline_ops_per_sec": 63992494.822484, "paired_baseline_ref": "HEAD", "paired_baseline_sample_spread_ratio": 1.199109552685359, "paired_order": "alternate", "paired_speedup": 0.8791208064539288, "reason": "sample spread ratio 1.199346 exceeds max 1.150000; paired baseline sample spread ratio 1.199110 exceeds max 1.150000", "runner_sample_count": 3, "sample_count": 131072, "sample_metric": "gpu_ops_per_sec", "sample_metric_values": [54937482.497488, 65889027.489572, 56257133.655341], "sample_spread_ratio": 1.1993455923755654, "seconds": 4.771581, "skipped": false, "state_layout": "xyzz", "status": "discard", "steps_per_sample": 2048, "thread_execution_width": 32, "threadgroup_limit": 128, "threads_per_threadgroup": 128, "timestamp": "2026-07-10T03:34:38Z", "validation_seconds": 24.886447, "validation_workers": 8}
