{"backend": "cpu", "budget_sec": 5, "commit": "e53e7ec", "correctness": true, "description": "CPU multiply_g baseline with correctness gates", "experiment": "baseline", "iterations": 64, "machine": "macOS-26.5-arm64-arm-64bit-Mach-O", "operation": "multiply_g", "ops_per_sec": 69669.342768, "seconds": 0.000919, "status": "keep", "timestamp": "2026-06-19T21:17:21Z"}
{"backend": "cpu", "budget_sec": 5, "commit": "8bf2459", "correctness": true, "description": "CPU multiply_g baseline with correctness gates", "experiment": "baseline", "iterations": 64, "machine": "macOS-26.5-arm64-arm-64bit-Mach-O", "operation": "multiply_g", "ops_per_sec": 68882.012646, "seconds": 0.000929, "status": "discard", "timestamp": "2026-06-19T21:22:09Z"}
{"backend": "cpu", "budget_sec": 5, "commit": "0ddf57b", "correctness": true, "description": "CPU multiply_g baseline with correctness gates", "experiment": "baseline", "iterations": 64, "machine": "macOS-26.5-arm64-arm-64bit-Mach-O", "operation": "multiply_g", "ops_per_sec": 68175.765646, "seconds": 0.000939, "status": "discard", "timestamp": "2026-06-19T21:23:09Z"}
{"backend": "metal", "budget_sec": 5, "commit": "c167ffc", "correctness": false, "description": "Metal secp256k1 field_add_mod_p correctness and throughput gate", "experiment": "metal_field_add", "iterations": 0, "machine": "macOS-26.5-arm64-arm-64bit-Mach-O", "operation": "field_add_mod_p", "ops_per_sec": 0.0, "reason": "no Metal device available", "seconds": 0.0, "skipped": true, "status": "skip", "timestamp": "2026-06-19T21:33:40Z"}
{"backend": "cpu", "budget_sec": 5, "commit": "c167ffc", "correctness": true, "description": "CPU multiply_g baseline with correctness gates", "experiment": "baseline", "iterations": 64, "machine": "macOS-26.5-arm64-arm-64bit-Mach-O", "operation": "multiply_g", "ops_per_sec": 85790.884718, "reason": "", "seconds": 0.000746, "skipped": false, "status": "keep", "timestamp": "2026-06-19T21:35:52Z"}
{"backend": "metal", "budget_sec": 5, "commit": "c167ffc", "correctness": false, "description": "Metal secp256k1 field_add_mod_p correctness and throughput gate", "experiment": "metal_field_add", "iterations": 0, "machine": "macOS-26.5-arm64-arm-64bit-Mach-O", "operation": "field_add_mod_p", "ops_per_sec": 0.0, "reason": "no Metal device available", "seconds": 0.0, "skipped": true, "status": "skip", "timestamp": "2026-06-19T21:36:03Z"}
{"backend": "macos_cpu", "budget_sec": 5, "commit": "93e7017", "correctness": true, "description": "Apple Silicon CPU secp256k1 field_mul_mod_p benchmark against EcInt reference", "experiment": "cpu_field_mul", "iterations": 4096, "machine": "macOS-26.5-arm64-arm-64bit-Mach-O", "operation": "field_mul_mod_p", "ops_per_sec": 117589642.006144, "reason": "", "seconds": 3.5e-05, "skipped": false, "status": "keep", "timestamp": "2026-06-19T21:44:58Z"}
{"backend": "macos_cpu", "budget_sec": 5, "commit": "93e7017", "correctness": true, "description": "Apple Silicon CPU secp256k1 field_mul_mod_p benchmark against EcInt reference", "experiment": "cpu_field_mul", "iterations": 4096, "machine": "macOS-26.5-arm64-arm-64bit-Mach-O", "operation": "field_mul_mod_p", "ops_per_sec": 120321955.231773, "reason": "", "seconds": 3.4e-05, "skipped": false, "status": "keep", "timestamp": "2026-06-19T21:47:07Z"}
{"backend": "metal", "budget_sec": 5, "commit": "93e7017", "correctness": false, "description": "Metal secp256k1 field_add_mod_p correctness and throughput gate", "experiment": "metal_field_add", "iterations": 0, "machine": "macOS-26.5-arm64-arm-64bit-Mach-O", "operation": "field_add_mod_p", "ops_per_sec": 0.0, "reason": "no Metal device available", "seconds": 0.0, "skipped": true, "status": "skip", "timestamp": "2026-06-19T21:47:22Z"}
{"backend": "metal", "budget_sec": 5, "commit": "1b068d6", "correctness": false, "description": "Metal secp256k1 field_mul_mod_p correctness and throughput gate", "experiment": "metal_field_mul", "iterations": 0, "machine": "macOS-26.5-arm64-arm-64bit-Mach-O", "operation": "field_mul_mod_p", "ops_per_sec": 0.0, "reason": "no Metal device available", "seconds": 0.0, "skipped": true, "status": "skip", "timestamp": "2026-06-19T21:57:58Z"}
{"backend": "macos_cpu", "budget_sec": 5, "commit": "6342ba7", "correctness": true, "description": "Apple Silicon CPU secp256k1 field_mul_mod_p benchmark against EcInt reference", "experiment": "cpu_field_mul", "iterations": 6037504, "machine": "macOS-26.5-arm64-arm-64bit-Mach-O", "min_ms": 50, "operation": "field_mul_mod_p", "ops_per_sec": 120721510.047432, "reason": "", "sample_count": 4096, "seconds": 0.050012, "skipped": false, "status": "discard", "timestamp": "2026-06-19T22:08:30Z"}
{"backend": "macos_cpu", "budget_sec": 5, "commit": "26722c5", "correctness": true, "description": "Apple Silicon CPU affine point-add walk benchmark against MultiplyG final-point oracle", "experiment": "point_add_g", "iterations": 25088, "machine": "macOS-26.5-arm64-arm-64bit-Mach-O", "min_ms": 50, "operation": "point_add_g", "ops_per_sec": 497584.440554, "reason": "", "sample_count": 256, "seconds": 0.05042, "skipped": false, "status": "keep", "timestamp": "2026-06-19T22:13:57Z"}
{"backend": "macos_cpu", "budget_sec": 5, "commit": "b18eb86", "correctness": true, "description": "Apple Silicon CPU Jacobian mixed point-add walk benchmark with affine reference speedup", "experiment": "jacobian_point_add_g", "iterations": 180736, "machine": "macOS-26.5-arm64-arm-64bit-Mach-O", "min_ms": 50, "operation": "jacobian_point_add_g", "ops_per_sec": 3614226.079864, "reason": "", "sample_count": 256, "seconds": 0.050007, "skipped": false, "status": "keep", "timestamp": "2026-06-19T22:21:08Z"}
{"backend": "macos_cpu", "budget_sec": 5, "commit": "074375a", "correctness": true, "description": "Apple Silicon CPU deterministic Jacobian jump-table walk benchmark with scalar-distance oracle", "experiment": "jacobian_jump_walk", "iterations": 163584, "machine": "macOS-26.5-arm64-arm-64bit-Mach-O", "min_ms": 50, "operation": "jacobian_jump_walk", "ops_per_sec": 3268359.86931, "reason": "", "sample_count": 256, "seconds": 0.050051, "skipped": false, "status": "keep", "timestamp": "2026-06-19T22:29:16Z"}
{"backend": "macos_cpu", "budget_sec": 5, "commit": "b3e82a9", "correctness": true, "description": "Apple Silicon CPU shared-tame tiny multi-target kangaroo benchmark", "experiment": "jacobian_kangaroo_multi_small", "iterations": 100, "machine": "macOS-26.5-arm64-arm-64bit-Mach-O", "min_ms": 50, "operation": "jacobian_kangaroo_multi_small", "ops_per_sec": 1982.945047, "reason": "", "sample_count": 1, "seconds": 0.05043, "skipped": false, "status": "keep", "timestamp": "2026-06-19T23:06:25Z"}
{"backend": "macos_cpu", "budget_sec": 5, "commit": "c08210b", "correctness": true, "description": "Apple Silicon CPU shared-tame tiny multi-target kangaroo benchmark", "experiment": "jacobian_kangaroo_multi_small", "iterations": 122, "machine": "macOS-26.5-arm64-arm-64bit-Mach-O", "min_ms": 50, "operation": "jacobian_kangaroo_multi_small", "ops_per_sec": 2426.418125, "reason": "", "sample_count": 1, "seconds": 0.05028, "skipped": false, "status": "keep", "timestamp": "2026-06-19T23:15:01Z"}
{"backend": "macos_cpu", "budget_sec": 5, "commit": "b544b00", "correctness": true, "description": "Apple Silicon CPU single-target tiny kangaroo benchmark", "experiment": "jacobian_kangaroo_small", "iterations": 79, "machine": "macOS-26.5-arm64-arm-64bit-Mach-O", "min_ms": 50, "operation": "jacobian_kangaroo_small", "ops_per_sec": 1572.903594, "reason": "", "sample_count": 1, "seconds": 0.050226, "skipped": false, "status": "keep", "timestamp": "2026-06-19T23:34:21Z"}
{"architecture": "shared_tame", "avg_dp_count": 84.0, "backend": "macos_cpu", "budget_sec": 5, "commit": "00a5a7a", "correctness": true, "description": "Apple Silicon CPU shared-tame tiny multi-target kangaroo benchmark", "dp_bits": 0, "dp_lookup": "hash", "expected_private_key": "0x7", "experiment": "jacobian_kangaroo_multi_small", "found_private_key": "0x7", "found_target_index": 3, "iterations": 151, "jump_count": 8, "last_dp_count": 84, "machine": "macOS-26.5-arm64-arm-64bit-Mach-O", "max_steps": 4096, "min_ms": 50, "operation": "jacobian_kangaroo_multi_small", "ops_per_sec": 3011.24979, "range_bits": 8, "reason": "", "sample_count": 1, "seconds": 0.050145, "single_target_ops_per_sec": 3787.81898, "skipped": false, "speedup_vs_single": 0.794982, "start_scalar": "0x2", "status": "keep", "tame_states": 1, "target_count": 4, "target_throughput_vs_single": 3.17993, "timestamp": "2026-06-19T23:46:38Z", "wild_states": 4}
{"affine_conversion": "batch", "architecture": "shared_tame", "avg_dp_count": 84.0, "backend": "macos_cpu", "budget_sec": 5, "commit": "dbc3227", "correctness": true, "description": "Apple Silicon CPU shared-tame tiny multi-target kangaroo benchmark", "dp_bits": 0, "dp_lookup": "hash", "expected_private_key": "0x7", "experiment": "jacobian_kangaroo_multi_small", "found_private_key": "0x7", "found_target_index": 3, "iterations": 322, "jump_count": 8, "last_dp_count": 84, "machine": "macOS-26.5-arm64-arm-64bit-Mach-O", "max_steps": 4096, "min_ms": 50, "operation": "jacobian_kangaroo_multi_small", "ops_per_sec": 6439.99459, "range_bits": 8, "reason": "", "sample_count": 1, "seconds": 0.05, "single_target_ops_per_sec": 4728.368214, "skipped": false, "speedup_vs_single": 1.361991, "start_scalar": "0x2", "status": "keep", "tame_states": 1, "target_count": 4, "target_throughput_vs_single": 5.447964, "timestamp": "2026-06-19T23:58:19Z", "wild_states": 4}
{"affine_conversion": "batch", "architecture": "single_target", "avg_dp_count": 53.0, "backend": "macos_cpu", "budget_sec": 5, "commit": "f46a7c7", "correctness": true, "description": "Apple Silicon CPU single-target tiny kangaroo benchmark", "dp_bits": 0, "dp_lookup": "hash", "expected_private_key": "0x7", "experiment": "jacobian_kangaroo_small", "found_private_key": "0x7", "found_target_index": 0, "iterations": 265, "jump_count": 8, "last_dp_count": 53, "machine": "macOS-26.5-arm64-arm-64bit-Mach-O", "max_steps": 4096, "min_ms": 50, "operation": "jacobian_kangaroo_small", "ops_per_sec": 5298.370751, "range_bits": 8, "reason": "", "sample_count": 1, "seconds": 0.050015, "skipped": false, "start_scalar": "0x0", "status": "keep", "tame_states": 1, "target_count": 1, "timestamp": "2026-06-20T00:06:31Z", "wild_states": 1}
{"affine_conversion": "batch", "architecture": "single_target", "avg_dp_count": 53.0, "backend": "macos_cpu", "budget_sec": 5, "commit": "81af0eb", "correctness": true, "description": "Apple Silicon CPU single-target tiny kangaroo benchmark", "dp_bits": 0, "dp_lookup": "hash", "expected_private_key": "0x7", "experiment": "jacobian_kangaroo_small", "found_private_key": "0x7", "found_target_index": 0, "iterations": 272, "jump_count": 8, "jump_table": "precomputed", "last_dp_count": 53, "machine": "macOS-26.5-arm64-arm-64bit-Mach-O", "max_steps": 4096, "min_ms": 50, "operation": "jacobian_kangaroo_small", "ops_per_sec": 5424.332791, "range_bits": 8, "reason": "", "sample_count": 1, "seconds": 0.050144, "skipped": false, "start_scalar": "0x0", "status": "keep", "tame_states": 1, "target_count": 1, "timestamp": "2026-06-20T00:13:53Z", "wild_states": 1}
{"affine_conversion": "batch", "architecture": "shared_tame", "avg_dp_count": 84.0, "backend": "macos_cpu", "budget_sec": 5, "commit": "81af0eb", "correctness": true, "description": "Apple Silicon CPU shared-tame tiny multi-target kangaroo benchmark", "dp_bits": 0, "dp_lookup": "hash", "expected_private_key": "0x7", "experiment": "jacobian_kangaroo_multi_small", "found_private_key": "0x7", "found_target_index": 3, "iterations": 243, "jump_count": 8, "jump_table": "precomputed", "last_dp_count": 84, "machine": "macOS-26.5-arm64-arm-64bit-Mach-O", "max_steps": 4096, "min_ms": 50, "operation": "jacobian_kangaroo_multi_small", "ops_per_sec": 4844.256167, "range_bits": 8, "reason": "", "sample_count": 1, "seconds": 0.050162, "single_target_ops_per_sec": 4515.762769, "skipped": false, "speedup_vs_single": 1.072744, "start_scalar": "0x2", "status": "discard", "tame_states": 1, "target_count": 4, "target_throughput_vs_single": 4.290975, "timestamp": "2026-06-20T00:14:10Z", "wild_states": 4}
{"affine_conversion": "batch", "architecture": "single_target", "avg_dp_count": 53.0, "backend": "macos_cpu", "budget_sec": 5, "commit": "d21ae9a", "correctness": true, "description": "Apple Silicon CPU single-target tiny kangaroo benchmark", "dp_bits": 0, "dp_lookup": "hash", "expected_private_key": "0x7", "experiment": "jacobian_kangaroo_small", "found_private_key": "0x7", "found_target_index": 0, "iterations": 419, "jump_count": 8, "jump_table": "precomputed", "last_dp_count": 53, "machine": "macOS-26.5-arm64-arm-64bit-Mach-O", "max_steps": 4096, "min_ms": 50, "operation": "jacobian_kangaroo_small", "ops_per_sec": 8364.581233, "range_bits": 8, "reason": "", "sample_count": 1, "scratch": "reused", "seconds": 0.050092, "skipped": false, "start_scalar": "0x0", "status": "keep", "tame_states": 1, "target_count": 1, "timestamp": "2026-06-20T00:22:33Z", "wild_states": 1}
{"affine_conversion": "batch", "architecture": "shared_tame", "avg_dp_count": 84.0, "backend": "macos_cpu", "budget_sec": 5, "commit": "d21ae9a", "correctness": true, "description": "Apple Silicon CPU shared-tame tiny multi-target kangaroo benchmark", "dp_bits": 0, "dp_lookup": "hash", "expected_private_key": "0x7", "experiment": "jacobian_kangaroo_multi_small", "found_private_key": "0x7", "found_target_index": 3, "iterations": 450, "jump_count": 8, "jump_table": "precomputed", "last_dp_count": 84, "machine": "macOS-26.5-arm64-arm-64bit-Mach-O", "max_steps": 4096, "min_ms": 50, "operation": "jacobian_kangaroo_multi_small", "ops_per_sec": 8988.509629, "range_bits": 8, "reason": "", "sample_count": 1, "scratch": "reused", "seconds": 0.050064, "single_target_ops_per_sec": 8572.670367, "skipped": false, "speedup_vs_single": 1.048508, "start_scalar": "0x2", "status": "keep", "tame_states": 1, "target_count": 4, "target_throughput_vs_single": 4.19403, "timestamp": "2026-06-20T00:22:45Z", "wild_states": 4}
{"affine_conversion": "batch", "architecture": "single_target", "avg_dp_count": 53.0, "backend": "macos_cpu", "budget_sec": 5, "commit": "1144bf2", "correctness": true, "description": "Apple Silicon CPU single-target tiny kangaroo benchmark", "dp_bits": 0, "dp_lookup": "hash", "expected_private_key": "0x7", "experiment": "jacobian_kangaroo_small", "found_private_key": "0x7", "found_target_index": 0, "iterations": 644, "jump_count": 8, "jump_table": "precomputed", "last_dp_count": 53, "machine": "macOS-26.5-arm64-arm-64bit-Mach-O", "max_steps": 4096, "min_ms": 50, "operation": "jacobian_kangaroo_small", "ops_per_sec": 12873.102077, "range_bits": 8, "range_context": "precomputed", "reason": "", "sample_count": 1, "scratch": "reused", "seconds": 0.050027, "skipped": false, "start_scalar": "0x0", "status": "keep", "tame_states": 1, "target_count": 1, "timestamp": "2026-06-20T00:31:09Z", "wild_states": 1}
{"affine_conversion": "batch", "architecture": "shared_tame", "avg_dp_count": 84.0, "backend": "macos_cpu", "budget_sec": 5, "commit": "1144bf2", "correctness": true, "description": "Apple Silicon CPU shared-tame tiny multi-target kangaroo benchmark", "dp_bits": 0, "dp_lookup": "hash", "expected_private_key": "0x7", "experiment": "jacobian_kangaroo_multi_small", "found_private_key": "0x7", "found_target_index": 3, "iterations": 627, "jump_count": 8, "jump_table": "precomputed", "last_dp_count": 84, "machine": "macOS-26.5-arm64-arm-64bit-Mach-O", "max_steps": 4096, "min_ms": 50, "operation": "jacobian_kangaroo_multi_small", "ops_per_sec": 12532.824958, "range_bits": 8, "range_context": "precomputed", "reason": "", "sample_count": 1, "scratch": "reused", "seconds": 0.050029, "single_target_ops_per_sec": 12133.589339, "skipped": false, "speedup_vs_single": 1.032903, "start_scalar": "0x2", "status": "keep", "tame_states": 1, "target_count": 4, "target_throughput_vs_single": 4.131613, "timestamp": "2026-06-20T00:31:19Z", "wild_states": 4}
{"affine_conversion": "batch", "architecture": "single_target", "avg_dp_count": 53.0, "backend": "macos_cpu", "budget_sec": 5, "commit": "581fddb", "correctness": true, "description": "Apple Silicon CPU single-target tiny kangaroo benchmark", "dp_bits": 0, "dp_bucket_storage": "inline_first", "dp_lookup": "hash", "expected_private_key": "0x7", "experiment": "jacobian_kangaroo_small", "found_private_key": "0x7", "found_target_index": 0, "iterations": 651, "jump_count": 8, "jump_table": "precomputed", "last_dp_count": 53, "machine": "macOS-26.5-arm64-arm-64bit-Mach-O", "max_steps": 4096, "min_ms": 50, "operation": "jacobian_kangaroo_small", "ops_per_sec": 13002.100528, "range_bits": 8, "range_context": "precomputed", "reason": "", "sample_count": 1, "scratch": "reused", "seconds": 0.050069, "skipped": false, "start_scalar": "0x0", "status": "discard", "tame_states": 1, "target_count": 1, "timestamp": "2026-06-20T00:37:41Z", "wild_states": 1}
{"affine_conversion": "batch", "architecture": "shared_tame", "avg_dp_count": 84.0, "backend": "macos_cpu", "budget_sec": 5, "commit": "581fddb", "correctness": true, "description": "Apple Silicon CPU shared-tame tiny multi-target kangaroo benchmark", "dp_bits": 0, "dp_bucket_storage": "inline_first", "dp_lookup": "hash", "expected_private_key": "0x7", "experiment": "jacobian_kangaroo_multi_small", "found_private_key": "0x7", "found_target_index": 3, "iterations": 667, "jump_count": 8, "jump_table": "precomputed", "last_dp_count": 84, "machine": "macOS-26.5-arm64-arm-64bit-Mach-O", "max_steps": 4096, "min_ms": 50, "operation": "jacobian_kangaroo_multi_small", "ops_per_sec": 13326.418248, "range_bits": 8, "range_context": "precomputed", "reason": "", "sample_count": 1, "scratch": "reused", "seconds": 0.050051, "single_target_ops_per_sec": 12854.161897, "skipped": false, "speedup_vs_single": 1.03674, "start_scalar": "0x2", "status": "keep", "tame_states": 1, "target_count": 4, "target_throughput_vs_single": 4.146958, "timestamp": "2026-06-20T00:37:52Z", "wild_states": 4}
{"affine_conversion": "batch", "architecture": "shared_tame", "avg_dp_count": 288.0, "backend": "macos_cpu", "budget_sec": 5, "commit": "f6f8709", "correctness": true, "description": "Apple Silicon CPU shared-tame tiny 16-target kangaroo benchmark", "dp_bits": 0, "dp_bucket_storage": "inline_first", "dp_lookup": "hash", "expected_private_key": "0x7", "experiment": "jacobian_kangaroo_multi16_small", "found_private_key": "0x7", "found_target_index": 15, "iterations": 151, "jump_count": 8, "jump_table": "precomputed", "last_dp_count": 288, "machine": "macOS-26.5-arm64-arm-64bit-Mach-O", "max_steps": 4096, "min_ms": 50, "operation": "jacobian_kangaroo_multi_small", "ops_per_sec": 3013.859262, "range_bits": 8, "range_context": "precomputed", "reason": "", "sample_count": 1, "scratch": "reused", "seconds": 0.050102, "single_target_ops_per_sec": 7535.315596, "skipped": false, "speedup_vs_single": 0.399965, "start_scalar": "0x2", "status": "keep", "tame_states": 1, "target_count": 16, "target_throughput_vs_single": 6.399433, "timestamp": "2026-06-20T00:59:41Z", "wild_states": 16}
{"affine_conversion": "batch", "architecture": "shared_tame", "avg_dp_count": 288.0, "backend": "macos_cpu", "budget_sec": 5, "commit": "5155176", "correctness": true, "description": "Apple Silicon CPU shared-tame tiny 16-target kangaroo benchmark", "dp_bits": 0, "dp_bucket_storage": "inline_first", "dp_lookup": "hash", "expected_private_key": "0x7", "experiment": "jacobian_kangaroo_multi16_small", "found_private_key": "0x7", "found_target_index": 15, "iterations": 307, "jump_count": 8, "jump_table": "precomputed", "last_dp_count": 288, "machine": "macOS-26.5-arm64-arm-64bit-Mach-O", "max_steps": 4096, "min_ms": 50, "operation": "jacobian_kangaroo_multi_small", "ops_per_sec": 6137.187082, "range_bits": 8, "range_context": "precomputed", "reason": "", "sample_count": 1, "scratch": "reused", "seconds": 0.050023, "single_target_ops_per_sec": 13166.449617, "skipped": false, "speedup_vs_single": 0.466123, "start_scalar": "0x2", "status": "keep", "tame_states": 1, "target_count": 16, "target_throughput_vs_single": 7.457971, "timestamp": "2026-06-20T01:01:03Z", "wild_states": 16}
{"affine_conversion": "batch", "architecture": "shared_tame", "avg_dp_count": 84.0, "backend": "macos_cpu", "budget_sec": 5, "commit": "e3328d0", "correctness": true, "description": "Apple Silicon CPU shared-tame tiny multi-target kangaroo benchmark", "dp_bits": 0, "dp_bucket_storage": "inline_first", "dp_lookup": "hash", "expected_private_key": "0x7", "experiment": "jacobian_kangaroo_multi_small", "found_private_key": "0x7", "found_target_index": 3, "iterations": 678, "jump_count": 8, "jump_table": "precomputed", "last_dp_count": 84, "machine": "macOS-26.5-arm64-arm-64bit-Mach-O", "max_steps": 4096, "min_ms": 50, "operation": "jacobian_kangaroo_multi_small", "ops_per_sec": 13558.519952, "point_passing": "const_ref", "range_bits": 8, "range_context": "precomputed", "reason": "", "sample_count": 1, "scratch": "reused", "seconds": 0.050005, "single_target_ops_per_sec": 13197.206679, "skipped": false, "speedup_vs_single": 1.027378, "start_scalar": "0x2", "status": "keep", "tame_states": 1, "target_count": 4, "target_throughput_vs_single": 4.109512, "timestamp": "2026-06-20T01:06:41Z", "wild_states": 4}
