{"backend": "metal", "budget_sec": 2, "commit": "ce388fa-dirty", "correctness": true, "description": "Metal secp256k1 field_add_mod_p correctness and throughput gate", "experiment": "metal_field_add", "iterations": 11534336, "machine": "macOS-26.5-arm64-arm-64bit-Mach-O", "max_threads_per_threadgroup": 1024, "min_ms": 50, "operation": "field_add_mod_p", "ops_per_sec": 225377938.159104, "ops_per_sec_max": 251713412.482005, "ops_per_sec_min": 166476004.465393, "reason": "", "runner_sample_count": 3, "sample_count": 1048576, "seconds": 0.051178, "skipped": false, "status": "keep", "thread_execution_width": 32, "threadgroup_limit": 256, "threads_per_threadgroup": 256, "timestamp": "2026-06-22T14:56:59Z"}
{"backend": "metal", "budget_sec": 3, "commit": "641227b-dirty", "correctness": true, "description": "Metal dynamic Jacobian DP stream with runtime dp_bits=8 mask", "distance_tracking": "dp_stream_uint64", "dp_bits": 8, "dp_capacity": 16384, "dp_checksum": "0xab1c2cd29cd70a84", "dp_count": 61, "dp_distance_checksum": "0x822e141de4770a0b", "dp_stream_overflow": false, "dp_tracking": "projective_x_limb0", "emitted_records": 61, "experiment": "metal_jacobian_dynamic_dp_stream_dp8", "iterations": 13500416, "jump_count": 16, "jump_histogram_max_bucket": 8336, "jump_histogram_max_deviation_ppm": 17578, "jump_histogram_min_bucket": 8082, "jump_index": "power2_mask", "jump_mixer": "avalanche64", "machine": "macOS-26.5-arm64-arm-64bit-Mach-O", "max_threads_per_threadgroup": 1024, "min_ms": 200, "operation": "jacobian_affine_walk_dynamic_dp_stream", "ops_per_sec": 67169019.394725, "ops_per_sec_max": 69038939.390693, "ops_per_sec_min": 65212074.669975, "output_bytes_per_record": 20, "output_bytes_total": 1220, "output_layout": "dp_stream", "reason": "", "runner_sample_count": 3, "sample_count": 16384, "seconds": 0.200992, "skipped": false, "status": "keep", "steps_per_sample": 8, "thread_execution_width": 32, "threadgroup_limit": 256, "threads_per_threadgroup": 256, "timestamp": "2026-06-22T15:02:53Z"}
{"backend": "metal", "budget_sec": 3, "commit": "a5ed767-dirty", "correctness": true, "description": "Metal in-place dynamic Jacobian DP8 stream state-update gate", "distance_tracking": "dp_stream_uint64", "dp_bits": 8, "dp_capacity": 16384, "dp_checksum": "0xab1c2cd29cd70a84", "dp_count": 61, "dp_distance_checksum": "0x822e141de4770a0b", "dp_stream_overflow": false, "dp_tracking": "projective_x_limb0", "emitted_records": 61, "experiment": "metal_jacobian_dynamic_dp_stream_inplace", "iterations": 13500416, "jump_count": 16, "jump_histogram_max_bucket": 8336, "jump_histogram_max_deviation_ppm": 17578, "jump_histogram_min_bucket": 8082, "jump_index": "power2_mask", "jump_mixer": "avalanche64", "machine": "macOS-26.5-arm64-arm-64bit-Mach-O", "max_threads_per_threadgroup": 1024, "min_ms": 200, "operation": "jacobian_affine_walk_dynamic_dp_stream_inplace", "ops_per_sec": 67315699.992225, "ops_per_sec_max": 68061007.081506, "ops_per_sec_min": 59116927.747574, "output_bytes_per_record": 20, "output_bytes_total": 1220, "output_layout": "dp_stream", "reason": "", "runner_sample_count": 3, "sample_count": 16384, "seconds": 0.200554, "skipped": false, "status": "keep", "steps_per_sample": 8, "thread_execution_width": 32, "threadgroup_limit": 256, "threads_per_threadgroup": 256, "timestamp": "2026-06-22T15:12:32Z"}
{"backend": "metal", "budget_sec": 5, "commit": "d3a617f-dirty", "confirmation_index": 1, "confirmation_runs": 3, "confirmation_status": "discard", "correctness": true, "description": "Metal in-place dynamic Jacobian DP8 stream state-update gate", "distance_tracking": "dp_stream_uint64", "dp_bits": 8, "dp_capacity": 16384, "dp_checksum": "0xab1c2cd29cd70a84", "dp_count": 61, "dp_distance_checksum": "0x822e141de4770a0b", "dp_stream_overflow": false, "dp_tracking": "projective_x_limb0", "emitted_records": 61, "experiment": "metal_jacobian_dynamic_dp_stream_inplace", "iterations": 11534336, "jump_count": 16, "jump_histogram_max_bucket": 8336, "jump_histogram_max_deviation_ppm": 17578, "jump_histogram_min_bucket": 8082, "jump_index": "power2_mask", "jump_mixer": "avalanche64", "machine": "macOS-26.5-arm64-arm-64bit-Mach-O", "max_threads_per_threadgroup": 1024, "min_ms": 200, "operation": "jacobian_affine_walk_dynamic_dp_stream_inplace", "ops_per_sec": 57598134.669784, "ops_per_sec_max": 60168506.8106, "ops_per_sec_min": 54956554.527021, "output_bytes_per_record": 20, "output_bytes_total": 1220, "output_layout": "dp_stream", "paired_baseline_ops_per_sec": 63442891.787134, "paired_baseline_ref": "main", "paired_speedup": 0.9078737278092469, "raw_status": "discard", "reason": "", "runner_sample_count": 3, "sample_count": 16384, "seconds": 0.200255, "skipped": false, "status": "discard", "steps_per_sample": 8, "thread_execution_width": 32, "threadgroup_limit": 256, "threads_per_threadgroup": 256, "timestamp": "2026-06-22T15:22:07Z"}
{"backend": "metal", "budget_sec": 5, "commit": "d3a617f-dirty", "confirmation_index": 2, "confirmation_runs": 3, "confirmation_status": "discard", "correctness": true, "description": "Metal in-place dynamic Jacobian DP8 stream state-update gate", "distance_tracking": "dp_stream_uint64", "dp_bits": 8, "dp_capacity": 16384, "dp_checksum": "0xab1c2cd29cd70a84", "dp_count": 61, "dp_distance_checksum": "0x822e141de4770a0b", "dp_stream_overflow": false, "dp_tracking": "projective_x_limb0", "emitted_records": 61, "experiment": "metal_jacobian_dynamic_dp_stream_inplace", "iterations": 12976128, "jump_count": 16, "jump_histogram_max_bucket": 8336, "jump_histogram_max_deviation_ppm": 17578, "jump_histogram_min_bucket": 8082, "jump_index": "power2_mask", "jump_mixer": "avalanche64", "machine": "macOS-26.5-arm64-arm-64bit-Mach-O", "max_threads_per_threadgroup": 1024, "min_ms": 200, "operation": "jacobian_affine_walk_dynamic_dp_stream_inplace", "ops_per_sec": 64614777.972996, "ops_per_sec_max": 69524105.066212, "ops_per_sec_min": 61394014.291297, "output_bytes_per_record": 20, "output_bytes_total": 1220, "output_layout": "dp_stream", "paired_baseline_ops_per_sec": 67657396.026016, "paired_baseline_ref": "main", "paired_speedup": 0.9550290399611295, "raw_status": "discard", "reason": "", "runner_sample_count": 3, "sample_count": 16384, "seconds": 0.200823, "skipped": false, "status": "discard", "steps_per_sample": 8, "thread_execution_width": 32, "threadgroup_limit": 256, "threads_per_threadgroup": 256, "timestamp": "2026-06-22T15:22:07Z"}
{"backend": "metal", "budget_sec": 5, "commit": "d3a617f-dirty", "confirmation_index": 3, "confirmation_runs": 3, "confirmation_status": "discard", "correctness": true, "description": "Metal in-place dynamic Jacobian DP8 stream state-update gate", "distance_tracking": "dp_stream_uint64", "dp_bits": 8, "dp_capacity": 16384, "dp_checksum": "0xab1c2cd29cd70a84", "dp_count": 61, "dp_distance_checksum": "0x822e141de4770a0b", "dp_stream_overflow": false, "dp_tracking": "projective_x_limb0", "emitted_records": 61, "experiment": "metal_jacobian_dynamic_dp_stream_inplace", "iterations": 11010048, "jump_count": 16, "jump_histogram_max_bucket": 8336, "jump_histogram_max_deviation_ppm": 17578, "jump_histogram_min_bucket": 8082, "jump_index": "power2_mask", "jump_mixer": "avalanche64", "machine": "macOS-26.5-arm64-arm-64bit-Mach-O", "max_threads_per_threadgroup": 1024, "min_ms": 200, "operation": "jacobian_affine_walk_dynamic_dp_stream_inplace", "ops_per_sec": 54676152.869964, "ops_per_sec_max": 68129224.281764, "ops_per_sec_min": 34354292.778025, "output_bytes_per_record": 20, "output_bytes_total": 1220, "output_layout": "dp_stream", "paired_baseline_ops_per_sec": 67731465.636918, "paired_baseline_ref": "main", "paired_speedup": 0.8072489256774918, "raw_status": "discard", "reason": "", "runner_sample_count": 3, "sample_count": 16384, "seconds": 0.201368, "skipped": false, "status": "discard", "steps_per_sample": 8, "thread_execution_width": 32, "threadgroup_limit": 256, "threads_per_threadgroup": 256, "timestamp": "2026-06-22T15:22:07Z"}
{"backend": "metal", "budget_sec": 10, "commit": "7c4045f-dirty", "confirmation_index": 1, "confirmation_runs": 3, "confirmation_status": "keep", "correctness": true, "description": "Metal in-place dynamic Jacobian DP8 stream with 16-step state packets", "distance_tracking": "dp_stream_uint64", "dp_bits": 8, "dp_capacity": 16384, "dp_checksum": "0xdd7021cb96f924c0", "dp_count": 67, "dp_distance_checksum": "0x68fbd251ce4fd08e", "dp_stream_overflow": false, "dp_tracking": "projective_x_limb0", "emitted_records": 67, "experiment": "metal_jacobian_dynamic_dp_stream_inplace_steps16", "iterations": 14942208, "jump_count": 16, "jump_histogram_max_bucket": 16612, "jump_histogram_max_deviation_ppm": 13916, "jump_histogram_min_bucket": 16237, "jump_index": "power2_mask", "jump_mixer": "avalanche64", "machine": "macOS-26.5-arm64-arm-64bit-Mach-O", "max_threads_per_threadgroup": 1024, "min_ms": 200, "operation": "jacobian_affine_walk_dynamic_dp_stream_inplace", "ops_per_sec": 73968565.361627, "ops_per_sec_max": 79071842.36504, "ops_per_sec_min": 71448218.983693, "output_bytes_per_record": 20, "output_bytes_total": 1340, "output_layout": "dp_stream", "raw_status": "keep", "reason": "", "runner_sample_count": 3, "sample_count": 16384, "seconds": 0.202008, "skipped": false, "status": "keep", "steps_per_sample": 16, "thread_execution_width": 32, "threadgroup_limit": 256, "threads_per_threadgroup": 256, "timestamp": "2026-06-22T15:32:08Z"}
{"backend": "metal", "budget_sec": 10, "commit": "7c4045f-dirty", "confirmation_index": 2, "confirmation_runs": 3, "confirmation_status": "keep", "correctness": true, "description": "Metal in-place dynamic Jacobian DP8 stream with 16-step state packets", "distance_tracking": "dp_stream_uint64", "dp_bits": 8, "dp_capacity": 16384, "dp_checksum": "0xdd7021cb96f924c0", "dp_count": 67, "dp_distance_checksum": "0x68fbd251ce4fd08e", "dp_stream_overflow": false, "dp_tracking": "projective_x_limb0", "emitted_records": 67, "experiment": "metal_jacobian_dynamic_dp_stream_inplace_steps16", "iterations": 12320768, "jump_count": 16, "jump_histogram_max_bucket": 16612, "jump_histogram_max_deviation_ppm": 13916, "jump_histogram_min_bucket": 16237, "jump_index": "power2_mask", "jump_mixer": "avalanche64", "machine": "macOS-26.5-arm64-arm-64bit-Mach-O", "max_threads_per_threadgroup": 1024, "min_ms": 200, "operation": "jacobian_affine_walk_dynamic_dp_stream_inplace", "ops_per_sec": 60768590.010919, "ops_per_sec_max": 79328790.095141, "ops_per_sec_min": 52895484.213908, "output_bytes_per_record": 20, "output_bytes_total": 1340, "output_layout": "dp_stream", "raw_status": "keep", "reason": "", "runner_sample_count": 3, "sample_count": 16384, "seconds": 0.202749, "skipped": false, "status": "keep", "steps_per_sample": 16, "thread_execution_width": 32, "threadgroup_limit": 256, "threads_per_threadgroup": 256, "timestamp": "2026-06-22T15:32:13Z"}
{"backend": "metal", "budget_sec": 10, "commit": "7c4045f-dirty", "confirmation_index": 3, "confirmation_runs": 3, "confirmation_status": "keep", "correctness": true, "description": "Metal in-place dynamic Jacobian DP8 stream with 16-step state packets", "distance_tracking": "dp_stream_uint64", "dp_bits": 8, "dp_capacity": 16384, "dp_checksum": "0xdd7021cb96f924c0", "dp_count": 67, "dp_distance_checksum": "0x68fbd251ce4fd08e", "dp_stream_overflow": false, "dp_tracking": "projective_x_limb0", "emitted_records": 67, "experiment": "metal_jacobian_dynamic_dp_stream_inplace_steps16", "iterations": 15466496, "jump_count": 16, "jump_histogram_max_bucket": 16612, "jump_histogram_max_deviation_ppm": 13916, "jump_histogram_min_bucket": 16237, "jump_index": "power2_mask", "jump_mixer": "avalanche64", "machine": "macOS-26.5-arm64-arm-64bit-Mach-O", "max_threads_per_threadgroup": 1024, "min_ms": 200, "operation": "jacobian_affine_walk_dynamic_dp_stream_inplace", "ops_per_sec": 76531591.057923, "ops_per_sec_max": 76980807.039585, "ops_per_sec_min": 76211488.267532, "output_bytes_per_record": 20, "output_bytes_total": 1340, "output_layout": "dp_stream", "raw_status": "keep", "reason": "", "runner_sample_count": 3, "sample_count": 16384, "seconds": 0.202093, "skipped": false, "status": "keep", "steps_per_sample": 16, "thread_execution_width": 32, "threadgroup_limit": 256, "threads_per_threadgroup": 256, "timestamp": "2026-06-22T15:32:18Z"}
{"backend": "metal", "budget_sec": 10, "commit": "7665e0e-dirty", "confirmation_index": 1, "confirmation_runs": 3, "confirmation_status": "keep", "correctness": true, "description": "Metal in-place dynamic Jacobian DP8 stream with 32-step state packets", "distance_tracking": "dp_stream_uint64", "dp_bits": 8, "dp_capacity": 16384, "dp_checksum": "0x751402be27e58082", "dp_count": 61, "dp_distance_checksum": "0xa31eaba41f549318", "dp_stream_overflow": false, "dp_tracking": "projective_x_limb0", "emitted_records": 61, "experiment": "metal_jacobian_dynamic_dp_stream_inplace_steps32", "iterations": 16252928, "jump_count": 16, "jump_histogram_max_bucket": 33066, "jump_histogram_max_deviation_ppm": 9094, "jump_histogram_min_bucket": 32531, "jump_index": "power2_mask", "jump_mixer": "avalanche64", "machine": "macOS-26.5-arm64-arm-64bit-Mach-O", "max_threads_per_threadgroup": 1024, "min_ms": 200, "operation": "jacobian_affine_walk_dynamic_dp_stream_inplace", "ops_per_sec": 80442981.709512, "ops_per_sec_max": 82198896.68228, "ops_per_sec_min": 71272653.122656, "output_bytes_per_record": 20, "output_bytes_total": 1220, "output_layout": "dp_stream", "raw_status": "keep", "reason": "", "runner_sample_count": 3, "sample_count": 16384, "seconds": 0.202043, "skipped": false, "status": "keep", "steps_per_sample": 32, "thread_execution_width": 32, "threadgroup_limit": 256, "threads_per_threadgroup": 256, "timestamp": "2026-06-22T15:39:47Z"}
{"backend": "metal", "budget_sec": 10, "commit": "7665e0e-dirty", "confirmation_index": 2, "confirmation_runs": 3, "confirmation_status": "keep", "correctness": true, "description": "Metal in-place dynamic Jacobian DP8 stream with 32-step state packets", "distance_tracking": "dp_stream_uint64", "dp_bits": 8, "dp_capacity": 16384, "dp_checksum": "0x751402be27e58082", "dp_count": 61, "dp_distance_checksum": "0xa31eaba41f549318", "dp_stream_overflow": false, "dp_tracking": "projective_x_limb0", "emitted_records": 61, "experiment": "metal_jacobian_dynamic_dp_stream_inplace_steps32", "iterations": 16777216, "jump_count": 16, "jump_histogram_max_bucket": 33066, "jump_histogram_max_deviation_ppm": 9094, "jump_histogram_min_bucket": 32531, "jump_index": "power2_mask", "jump_mixer": "avalanche64", "machine": "macOS-26.5-arm64-arm-64bit-Mach-O", "max_threads_per_threadgroup": 1024, "min_ms": 200, "operation": "jacobian_affine_walk_dynamic_dp_stream_inplace", "ops_per_sec": 81644727.704469, "ops_per_sec_max": 85002914.855226, "ops_per_sec_min": 75930532.881617, "output_bytes_per_record": 20, "output_bytes_total": 1220, "output_layout": "dp_stream", "raw_status": "keep", "reason": "", "runner_sample_count": 3, "sample_count": 16384, "seconds": 0.205491, "skipped": false, "status": "keep", "steps_per_sample": 32, "thread_execution_width": 32, "threadgroup_limit": 256, "threads_per_threadgroup": 256, "timestamp": "2026-06-22T15:39:52Z"}
{"backend": "metal", "budget_sec": 10, "commit": "7665e0e-dirty", "confirmation_index": 3, "confirmation_runs": 3, "confirmation_status": "keep", "correctness": true, "description": "Metal in-place dynamic Jacobian DP8 stream with 32-step state packets", "distance_tracking": "dp_stream_uint64", "dp_bits": 8, "dp_capacity": 16384, "dp_checksum": "0x751402be27e58082", "dp_count": 61, "dp_distance_checksum": "0xa31eaba41f549318", "dp_stream_overflow": false, "dp_tracking": "projective_x_limb0", "emitted_records": 61, "experiment": "metal_jacobian_dynamic_dp_stream_inplace_steps32", "iterations": 15728640, "jump_count": 16, "jump_histogram_max_bucket": 33066, "jump_histogram_max_deviation_ppm": 9094, "jump_histogram_min_bucket": 32531, "jump_index": "power2_mask", "jump_mixer": "avalanche64", "machine": "macOS-26.5-arm64-arm-64bit-Mach-O", "max_threads_per_threadgroup": 1024, "min_ms": 200, "operation": "jacobian_affine_walk_dynamic_dp_stream_inplace", "ops_per_sec": 78549463.782889, "ops_per_sec_max": 81998993.698549, "ops_per_sec_min": 77257285.040241, "output_bytes_per_record": 20, "output_bytes_total": 1220, "output_layout": "dp_stream", "raw_status": "keep", "reason": "", "runner_sample_count": 3, "sample_count": 16384, "seconds": 0.200239, "skipped": false, "status": "keep", "steps_per_sample": 32, "thread_execution_width": 32, "threadgroup_limit": 256, "threads_per_threadgroup": 256, "timestamp": "2026-06-22T15:39:58Z"}
{"backend": "metal", "budget_sec": 10, "commit": "c542029-dirty", "confirmation_index": 1, "confirmation_runs": 3, "confirmation_status": "keep", "correctness": true, "description": "Metal in-place dynamic Jacobian DP8 stream with 64-step state packets", "distance_tracking": "dp_stream_uint64", "dp_bits": 8, "dp_capacity": 16384, "dp_checksum": "0xc4c55fe6a6308d32", "dp_count": 54, "dp_distance_checksum": "0x132b1b39482c3732", "dp_stream_overflow": false, "dp_tracking": "projective_x_limb0", "emitted_records": 54, "experiment": "metal_jacobian_dynamic_dp_stream_inplace_steps64", "iterations": 15728640, "jump_count": 16, "jump_histogram_max_bucket": 65847, "jump_histogram_max_deviation_ppm": 7172, "jump_histogram_min_bucket": 65066, "jump_index": "power2_mask", "jump_mixer": "avalanche64", "machine": "macOS-26.5-arm64-arm-64bit-Mach-O", "max_threads_per_threadgroup": 1024, "min_ms": 200, "operation": "jacobian_affine_walk_dynamic_dp_stream_inplace", "ops_per_sec": 77390855.374023, "ops_per_sec_max": 87113054.589906, "ops_per_sec_min": 62656038.678172, "output_bytes_per_record": 20, "output_bytes_total": 1080, "output_layout": "dp_stream", "raw_status": "keep", "reason": "", "runner_sample_count": 3, "sample_count": 16384, "seconds": 0.203236, "skipped": false, "status": "keep", "steps_per_sample": 64, "thread_execution_width": 32, "threadgroup_limit": 256, "threads_per_threadgroup": 256, "timestamp": "2026-06-22T15:46:35Z"}
{"backend": "metal", "budget_sec": 10, "commit": "c542029-dirty", "confirmation_index": 2, "confirmation_runs": 3, "confirmation_status": "keep", "correctness": true, "description": "Metal in-place dynamic Jacobian DP8 stream with 64-step state packets", "distance_tracking": "dp_stream_uint64", "dp_bits": 8, "dp_capacity": 16384, "dp_checksum": "0xc4c55fe6a6308d32", "dp_count": 54, "dp_distance_checksum": "0x132b1b39482c3732", "dp_stream_overflow": false, "dp_tracking": "projective_x_limb0", "emitted_records": 54, "experiment": "metal_jacobian_dynamic_dp_stream_inplace_steps64", "iterations": 18874368, "jump_count": 16, "jump_histogram_max_bucket": 65847, "jump_histogram_max_deviation_ppm": 7172, "jump_histogram_min_bucket": 65066, "jump_index": "power2_mask", "jump_mixer": "avalanche64", "machine": "macOS-26.5-arm64-arm-64bit-Mach-O", "max_threads_per_threadgroup": 1024, "min_ms": 200, "operation": "jacobian_affine_walk_dynamic_dp_stream_inplace", "ops_per_sec": 91485491.497771, "ops_per_sec_max": 91582319.033477, "ops_per_sec_min": 88588204.312645, "output_bytes_per_record": 20, "output_bytes_total": 1080, "output_layout": "dp_stream", "raw_status": "keep", "reason": "", "runner_sample_count": 3, "sample_count": 16384, "seconds": 0.20631, "skipped": false, "status": "keep", "steps_per_sample": 64, "thread_execution_width": 32, "threadgroup_limit": 256, "threads_per_threadgroup": 256, "timestamp": "2026-06-22T15:46:41Z"}
{"backend": "metal", "budget_sec": 10, "commit": "c542029-dirty", "confirmation_index": 3, "confirmation_runs": 3, "confirmation_status": "keep", "correctness": true, "description": "Metal in-place dynamic Jacobian DP8 stream with 64-step state packets", "distance_tracking": "dp_stream_uint64", "dp_bits": 8, "dp_capacity": 16384, "dp_checksum": "0xc4c55fe6a6308d32", "dp_count": 54, "dp_distance_checksum": "0x132b1b39482c3732", "dp_stream_overflow": false, "dp_tracking": "projective_x_limb0", "emitted_records": 54, "experiment": "metal_jacobian_dynamic_dp_stream_inplace_steps64", "iterations": 18874368, "jump_count": 16, "jump_histogram_max_bucket": 65847, "jump_histogram_max_deviation_ppm": 7172, "jump_histogram_min_bucket": 65066, "jump_index": "power2_mask", "jump_mixer": "avalanche64", "machine": "macOS-26.5-arm64-arm-64bit-Mach-O", "max_threads_per_threadgroup": 1024, "min_ms": 200, "operation": "jacobian_affine_walk_dynamic_dp_stream_inplace", "ops_per_sec": 90119567.57947, "ops_per_sec_max": 91544859.222694, "ops_per_sec_min": 88851926.800391, "output_bytes_per_record": 20, "output_bytes_total": 1080, "output_layout": "dp_stream", "raw_status": "keep", "reason": "", "runner_sample_count": 3, "sample_count": 16384, "seconds": 0.209437, "skipped": false, "status": "keep", "steps_per_sample": 64, "thread_execution_width": 32, "threadgroup_limit": 256, "threads_per_threadgroup": 256, "timestamp": "2026-06-22T15:46:46Z"}
