{"affine_scan_mode": "cpu_batch_prod_zz_zzz", "affine_scan_seconds": 0.018297, "backend": "metal", "budget_sec": 420, "bytes_per_target": 2.683818, "candidate_verification": "tag16_hash_filter_then_cpu_exact_key_equality", "commit": "6c6f1f3-dirty", "confirmation_index": 2, "confirmation_runs": 2, "confirmation_status": "discard", "cooldown_sec": 10.0, "correctness": true, "description": "Metal XYZZ 2048-step dp6 repeat4096 target lookup with cached exact resolver versus same command on the paired baseline", "distance_tracking": "packet_distance_uint64", "dp_bits": 6, "dp_checksum": "0x54ccada61fd1edbc", "dp_count": 2087, "dp_distance_checksum": "0xf31d7766e1607041", "dp_query_count": 2087, "dp_tracking": "affine_x256_y_parity_cpu_batch", "exact_host_table_bytes": 1268635456, "experiment": "metal_jacobian_dynamic_dp_stream_xyzz_affine_scan_target_lookup_tag16_hash_filter25m_repeat4096_resolver_cache", "filter_false_positive_count": 0, "filter_positive_count": 262144, "gpu_lookup_lookups_per_sec": 161029506.575462, "gpu_ops_per_sec": 51473316.104244, "hit_count": 262144, "injected_hits": 64, "iterations": 268435456, "jump_count": 16, "jump_histogram_max_bucket": 16782260, "jump_histogram_max_deviation_ppm": 346, "jump_histogram_min_bucket": 16771410, "jump_index": "power2_mask", "jump_mixer": "avalanche64", "jump_schedule": "power2", "lookup_engine": "gpu_filter16_hash_repeat", "lookup_engine_effective": "gpu_filter16_hash_repeat", "lookup_exact_seconds": 0.014312, "lookup_gpu_seconds": 0.053086, "lookup_hash_seconds": 5.5e-05, "lookup_layout": "open_address_tag16_hash_filter_exact256", "lookup_max_threads_per_threadgroup": 1024, "lookup_query_mode": "repeat", "lookup_repeat": 4096, "lookup_seconds": 0.067453, "lookup_thread_execution_width": 32, "lookup_threadgroup_limit": 512, "lookup_threads_per_threadgroup": 512, "lookups_per_sec": 126730884.616311, "lookups_per_sec_max": 138487179.293189, "lookups_per_sec_min": 116079188.43837, "machine": "macOS-26.5-arm64-arm-64bit-Mach-O", "max_threads_per_threadgroup": 1024, "min_ms": 500, "miss_count": 8286208, "operation": "jacobian_affine_scan_target_lookup_tag32", "ops_per_sec": 126730884.616311, "ops_per_sec_max": 138487179.293189, "ops_per_sec_min": 116079188.43837, "output_layout": "affine_dp_scan_target_lookup", "paired_baseline_ops_per_sec": 131362546.004964, "paired_baseline_ref": "HEAD", "paired_order": "alternate", "paired_speedup": 0.9647413853528846, "query_count": 8548352, "query_input": "hash64_repeat_indexed", "raw_status": "discard", "reason": "", "repeat_positive_index_encoding": "packed16_base_repeat", "requested_hits": 64, "runner_sample_count": 3, "sample_count": 131072, "seconds": 5.215041, "setup_inclusive_ops_per_sec": 39638108.024221, "setup_inclusive_seconds": 6.772156, "skipped": false, "state_layout": "xyzz", "status": "discard", "steps_per_sample": 2048, "target_bucket_bytes": 268435456, "target_build_seconds": 1.430222, "target_count": 25005000, "target_filter_bucket_bytes": 67108864, "target_filter_build_seconds": 0.041144, "target_key": "x256_y_parity", "target_key_bytes": 1000200000, "target_lookup_checksum": "0xa2cd0ae701083735", "target_query_hash_bytes": 16696, "target_table_buckets": 33554432, "target_table_bytes": 67108864, "thread_execution_width": 32, "threadgroup_limit": 128, "threads_per_threadgroup": 128, "timestamp": "2026-06-29T15:32:46Z", "validation_seconds": 18.579793, "validation_workers": 8}
{"affine_scan_mode": "cpu_batch_prod_zz_zzz", "affine_scan_seconds": 0.003381, "backend": "metal", "budget_sec": 540, "bytes_per_target": 2.683818, "candidate_verification": "tag16_hash_filter_then_cpu_exact_key_equality", "commit": "2c49c90-dirty", "confirmation_index": 1, "confirmation_runs": 2, "confirmation_status": "keep", "cooldown_sec": 10.0, "correctness": true, "description": "Metal XYZZ 2048-step dp6 scaled4-balanced 4-jump affine-scan target lookup versus accepted 16-jump power2 setup gate", "distance_tracking": "packet_distance_uint64", "dp_bits": 6, "dp_checksum": "0x58d7138663a105aa", "dp_count": 2075, "dp_distance_checksum": "0xad580a14bfda5cf8", "dp_query_count": 2075, "dp_tracking": "affine_x256_y_parity_cpu_batch", "exact_host_table_bytes": 1268635456, "experiment": "metal_jacobian_dynamic_dp_stream_xyzz_affine_scan_target_lookup_tag16_hash_filter25m_scaled4_j4_setup", "filter_false_positive_count": 0, "filter_positive_count": 65536, "gpu_lookup_lookups_per_sec": 248130090.794967, "gpu_ops_per_sec": 127044358.84439, "hit_count": 65536, "injected_hits": 64, "iterations": 268435456, "jump_count": 4, "jump_histogram_max_bucket": 67113326, "jump_histogram_max_deviation_ppm": 68, "jump_histogram_min_bucket": 67104275, "jump_index": "power2_mask", "jump_mixer": "avalanche64", "jump_schedule": "scaled4_balanced", "lookup_engine": "gpu_filter16_hash_repeat", "lookup_engine_effective": "gpu_filter16_hash_repeat", "lookup_exact_seconds": 0.00872, "lookup_gpu_seconds": 0.008563, "lookup_hash_seconds": 3.2e-05, "lookup_layout": "open_address_tag16_hash_filter_exact256", "lookup_max_threads_per_threadgroup": 1024, "lookup_query_mode": "repeat", "lookup_repeat": 1024, "lookup_seconds": 0.017315, "lookup_thread_execution_width": 32, "lookup_threadgroup_limit": 512, "lookup_threads_per_threadgroup": 512, "lookups_per_sec": 122712340.051788, "machine": "macOS-26.5-arm64-arm-64bit-Mach-O", "max_threads_per_threadgroup": 1024, "min_ms": 500, "miss_count": 2059264, "operation": "jacobian_affine_scan_target_lookup_tag32", "ops_per_sec": 93508028.064667, "ops_per_sec_max": 97450997.465326, "ops_per_sec_min": 34953333.964935, "output_layout": "affine_dp_scan_target_lookup", "paired_baseline_ops_per_sec": 59826653.9848, "paired_baseline_ref": "HEAD", "paired_order": "alternate", "paired_speedup": 1.5629827482650849, "query_count": 2124800, "query_input": "hash64_repeat_indexed", "raw_status": "keep", "reason": "", "repeat_positive_index_encoding": "packed16_base_repeat", "requested_hits": 64, "runner_sample_count": 3, "sample_count": 131072, "seconds": 2.112927, "setup_inclusive_ops_per_sec": 93508028.064667, "setup_inclusive_ops_per_sec_max": 97450997.465326, "setup_inclusive_ops_per_sec_min": 34953333.964935, "setup_inclusive_seconds": 2.870721, "skipped": false, "state_layout": "xyzz", "status": "keep", "steps_per_sample": 2048, "target_bucket_bytes": 268435456, "target_build_seconds": 0.711134, "target_count": 25005000, "target_filter_bucket_bytes": 67108864, "target_filter_build_seconds": 0.025963, "target_key": "x256_y_parity", "target_key_bytes": 1000200000, "target_lookup_checksum": "0x52efac244f7b11f3", "target_query_hash_bytes": 16600, "target_table_buckets": 33554432, "target_table_bytes": 67108864, "thread_execution_width": 32, "threadgroup_limit": 128, "threads_per_threadgroup": 128, "timestamp": "2026-06-29T15:54:40Z", "validation_seconds": 10.790529, "validation_workers": 8}
{"affine_scan_mode": "cpu_batch_prod_zz_zzz", "affine_scan_seconds": 0.003236, "backend": "metal", "budget_sec": 540, "bytes_per_target": 2.683818, "candidate_verification": "tag16_hash_filter_then_cpu_exact_key_equality", "commit": "2c49c90-dirty", "confirmation_index": 2, "confirmation_runs": 2, "confirmation_status": "keep", "cooldown_sec": 10.0, "correctness": true, "description": "Metal XYZZ 2048-step dp6 scaled4-balanced 4-jump affine-scan target lookup versus accepted 16-jump power2 setup gate", "distance_tracking": "packet_distance_uint64", "dp_bits": 6, "dp_checksum": "0x58d7138663a105aa", "dp_count": 2075, "dp_distance_checksum": "0xad580a14bfda5cf8", "dp_query_count": 2075, "dp_tracking": "affine_x256_y_parity_cpu_batch", "exact_host_table_bytes": 1268635456, "experiment": "metal_jacobian_dynamic_dp_stream_xyzz_affine_scan_target_lookup_tag16_hash_filter25m_scaled4_j4_setup", "filter_false_positive_count": 0, "filter_positive_count": 65536, "gpu_lookup_lookups_per_sec": 171904169.574143, "gpu_ops_per_sec": 69135541.424126, "hit_count": 65536, "injected_hits": 64, "iterations": 268435456, "jump_count": 4, "jump_histogram_max_bucket": 67113326, "jump_histogram_max_deviation_ppm": 68, "jump_histogram_min_bucket": 67104275, "jump_index": "power2_mask", "jump_mixer": "avalanche64", "jump_schedule": "scaled4_balanced", "lookup_engine": "gpu_filter16_hash_repeat", "lookup_engine_effective": "gpu_filter16_hash_repeat", "lookup_exact_seconds": 0.001255, "lookup_gpu_seconds": 0.01236, "lookup_hash_seconds": 3.5e-05, "lookup_layout": "open_address_tag16_hash_filter_exact256", "lookup_max_threads_per_threadgroup": 1024, "lookup_query_mode": "repeat", "lookup_repeat": 1024, "lookup_seconds": 0.01365, "lookup_thread_execution_width": 32, "lookup_threadgroup_limit": 512, "lookup_threads_per_threadgroup": 512, "lookups_per_sec": 155659194.859261, "machine": "macOS-26.5-arm64-arm-64bit-Mach-O", "max_threads_per_threadgroup": 1024, "min_ms": 500, "miss_count": 2059264, "operation": "jacobian_affine_scan_target_lookup_tag32", "ops_per_sec": 57402367.574511, "ops_per_sec_max": 91315330.02735, "ops_per_sec_min": 48473326.844342, "output_layout": "affine_dp_scan_target_lookup", "paired_baseline_ops_per_sec": 46863993.301787, "paired_baseline_ref": "HEAD", "paired_order": "alternate", "paired_speedup": 1.224871453118831, "query_count": 2124800, "query_input": "hash64_repeat_indexed", "raw_status": "keep", "reason": "", "repeat_positive_index_encoding": "packed16_base_repeat", "requested_hits": 64, "runner_sample_count": 3, "sample_count": 131072, "seconds": 3.882742, "setup_inclusive_ops_per_sec": 57402367.574511, "setup_inclusive_ops_per_sec_max": 91315330.02735, "setup_inclusive_ops_per_sec_min": 48473326.844342, "setup_inclusive_seconds": 4.676383, "skipped": false, "state_layout": "xyzz", "status": "keep", "steps_per_sample": 2048, "target_bucket_bytes": 268435456, "target_build_seconds": 0.743189, "target_count": 25005000, "target_filter_bucket_bytes": 67108864, "target_filter_build_seconds": 0.033566, "target_key": "x256_y_parity", "target_key_bytes": 1000200000, "target_lookup_checksum": "0x52efac244f7b11f3", "target_query_hash_bytes": 16600, "target_table_buckets": 33554432, "target_table_bytes": 67108864, "thread_execution_width": 32, "threadgroup_limit": 128, "threads_per_threadgroup": 128, "timestamp": "2026-06-29T15:54:40Z", "validation_seconds": 17.501442, "validation_workers": 8}
{"affine_scan_mode": "cpu_batch_prod_zz_zzz", "affine_scan_seconds": 0.003598, "backend": "metal", "budget_sec": 540, "bytes_per_target": 2.683818, "candidate_verification": "tag16_hash_filter_then_cpu_exact_key_equality", "commit": "f8dceeb-dirty", "confirmation_index": 1, "confirmation_runs": 2, "confirmation_status": "discard", "cooldown_sec": 10.0, "correctness": true, "description": "Metal XYZZ 2048-step dp6 25M-target setup gate isolating scaled4-balanced distances versus 4-jump power2 distances", "distance_tracking": "packet_distance_uint64", "dp_bits": 6, "dp_checksum": "0x58d7138663a105aa", "dp_count": 2075, "dp_distance_checksum": "0xad580a14bfda5cf8", "dp_query_count": 2075, "dp_tracking": "affine_x256_y_parity_cpu_batch", "exact_host_table_bytes": 1268635456, "experiment": "metal_jacobian_dynamic_dp_stream_xyzz_affine_scan_target_lookup_tag16_hash_filter25m_scaled4_vs_power2_j4_setup", "filter_false_positive_count": 0, "filter_positive_count": 65536, "gpu_lookup_lookups_per_sec": 166219682.685311, "gpu_ops_per_sec": 123321422.215173, "hit_count": 65536, "injected_hits": 64, "iterations": 268435456, "jump_count": 4, "jump_histogram_max_bucket": 67113326, "jump_histogram_max_deviation_ppm": 68, "jump_histogram_min_bucket": 67104275, "jump_index": "power2_mask", "jump_mixer": "avalanche64", "jump_schedule": "scaled4_balanced", "lookup_engine": "gpu_filter16_hash_repeat", "lookup_engine_effective": "gpu_filter16_hash_repeat", "lookup_exact_seconds": 0.001786, "lookup_gpu_seconds": 0.012783, "lookup_hash_seconds": 3.9e-05, "lookup_layout": "open_address_tag16_hash_filter_exact256", "lookup_max_threads_per_threadgroup": 1024, "lookup_query_mode": "repeat", "lookup_repeat": 1024, "lookup_seconds": 0.014608, "lookup_thread_execution_width": 32, "lookup_threadgroup_limit": 512, "lookup_threads_per_threadgroup": 512, "lookups_per_sec": 145453300.817182, "machine": "macOS-26.5-arm64-arm-64bit-Mach-O", "max_threads_per_threadgroup": 1024, "min_ms": 500, "miss_count": 2059264, "operation": "jacobian_affine_scan_target_lookup_tag32", "ops_per_sec": 89145487.327852, "ops_per_sec_max": 91204806.13404, "ops_per_sec_min": 71052831.232263, "output_layout": "affine_dp_scan_target_lookup", "paired_baseline_ops_per_sec": 87022562.367405, "paired_baseline_ref": "HEAD", "paired_order": "alternate", "paired_speedup": 1.0243951097588246, "query_count": 2124800, "query_input": "hash64_repeat_indexed", "raw_status": "keep", "reason": "", "repeat_positive_index_encoding": "packed16_base_repeat", "requested_hits": 64, "runner_sample_count": 3, "sample_count": 131072, "seconds": 2.176714, "setup_inclusive_ops_per_sec": 89145487.327852, "setup_inclusive_ops_per_sec_max": 91204806.13404, "setup_inclusive_ops_per_sec_min": 71052831.232263, "setup_inclusive_seconds": 3.011206, "skipped": false, "state_layout": "xyzz", "status": "discard", "steps_per_sample": 2048, "target_bucket_bytes": 268435456, "target_build_seconds": 0.792206, "target_count": 25005000, "target_filter_bucket_bytes": 67108864, "target_filter_build_seconds": 0.024081, "target_key": "x256_y_parity", "target_key_bytes": 1000200000, "target_lookup_checksum": "0x52efac244f7b11f3", "target_query_hash_bytes": 16600, "target_table_buckets": 33554432, "target_table_bytes": 67108864, "thread_execution_width": 32, "threadgroup_limit": 128, "threads_per_threadgroup": 128, "timestamp": "2026-06-29T16:07:23Z", "validation_seconds": 8.154646, "validation_workers": 8}
{"affine_scan_mode": "cpu_batch_prod_zz_zzz", "affine_scan_seconds": 0.003353, "backend": "metal", "budget_sec": 540, "bytes_per_target": 2.683818, "candidate_verification": "tag16_hash_filter_then_cpu_exact_key_equality", "commit": "f8dceeb-dirty", "confirmation_index": 2, "confirmation_runs": 2, "confirmation_status": "discard", "cooldown_sec": 10.0, "correctness": true, "description": "Metal XYZZ 2048-step dp6 25M-target setup gate isolating scaled4-balanced distances versus 4-jump power2 distances", "distance_tracking": "packet_distance_uint64", "dp_bits": 6, "dp_checksum": "0x58d7138663a105aa", "dp_count": 2075, "dp_distance_checksum": "0xad580a14bfda5cf8", "dp_query_count": 2075, "dp_tracking": "affine_x256_y_parity_cpu_batch", "exact_host_table_bytes": 1268635456, "experiment": "metal_jacobian_dynamic_dp_stream_xyzz_affine_scan_target_lookup_tag16_hash_filter25m_scaled4_vs_power2_j4_setup", "filter_false_positive_count": 0, "filter_positive_count": 65536, "gpu_lookup_lookups_per_sec": 57101715.46743, "gpu_ops_per_sec": 77710921.277495, "hit_count": 65536, "injected_hits": 64, "iterations": 268435456, "jump_count": 4, "jump_histogram_max_bucket": 67113326, "jump_histogram_max_deviation_ppm": 68, "jump_histogram_min_bucket": 67104275, "jump_index": "power2_mask", "jump_mixer": "avalanche64", "jump_schedule": "scaled4_balanced", "lookup_engine": "gpu_filter16_hash_repeat", "lookup_engine_effective": "gpu_filter16_hash_repeat", "lookup_exact_seconds": 0.002135, "lookup_gpu_seconds": 0.037211, "lookup_hash_seconds": 8.8e-05, "lookup_layout": "open_address_tag16_hash_filter_exact256", "lookup_max_threads_per_threadgroup": 1024, "lookup_query_mode": "repeat", "lookup_repeat": 1024, "lookup_seconds": 0.039434, "lookup_thread_execution_width": 32, "lookup_threadgroup_limit": 512, "lookup_threads_per_threadgroup": 512, "lookups_per_sec": 53882267.04364, "machine": "macOS-26.5-arm64-arm-64bit-Mach-O", "max_threads_per_threadgroup": 1024, "min_ms": 500, "miss_count": 2059264, "operation": "jacobian_affine_scan_target_lookup_tag32", "ops_per_sec": 55752350.612289, "ops_per_sec_max": 78682254.866945, "ops_per_sec_min": 35532555.837459, "output_layout": "affine_dp_scan_target_lookup", "paired_baseline_ops_per_sec": 75648578.254959, "paired_baseline_ref": "HEAD", "paired_order": "alternate", "paired_speedup": 0.7369913869945633, "query_count": 2124800, "query_input": "hash64_repeat_indexed", "raw_status": "discard", "reason": "", "repeat_positive_index_encoding": "packed16_base_repeat", "requested_hits": 64, "runner_sample_count": 3, "sample_count": 131072, "seconds": 3.454282, "setup_inclusive_ops_per_sec": 55752350.612289, "setup_inclusive_ops_per_sec_max": 78682254.866945, "setup_inclusive_ops_per_sec_min": 35532555.837459, "setup_inclusive_seconds": 4.814783, "skipped": false, "state_layout": "xyzz", "status": "discard", "steps_per_sample": 2048, "target_bucket_bytes": 268435456, "target_build_seconds": 1.280244, "target_count": 25005000, "target_filter_bucket_bytes": 67108864, "target_filter_build_seconds": 0.037469, "target_key": "x256_y_parity", "target_key_bytes": 1000200000, "target_lookup_checksum": "0x52efac244f7b11f3", "target_query_hash_bytes": 16600, "target_table_buckets": 33554432, "target_table_bytes": 67108864, "thread_execution_width": 32, "threadgroup_limit": 128, "threads_per_threadgroup": 128, "timestamp": "2026-06-29T16:07:23Z", "validation_seconds": 13.093406, "validation_workers": 8}
{"affine_scan_mode": "cpu_batch_prod_zz_zzz", "affine_scan_seconds": 0.004995, "backend": "metal", "budget_sec": 540, "bytes_per_target": 2.683818, "candidate_verification": "tag16_hash_filter_then_cpu_exact_key_equality", "commit": "f8dceeb-dirty", "confirmation_index": 1, "confirmation_runs": 2, "confirmation_status": "discard", "cooldown_sec": 10.0, "correctness": true, "description": "Metal XYZZ 2048-step dp6 25M-target setup gate isolating 4-jump power2 against the accepted 16-jump power2 baseline", "distance_tracking": "packet_distance_uint64", "dp_bits": 6, "dp_checksum": "0x444def74a8413f00", "dp_count": 2012, "dp_distance_checksum": "0x271ee73d4839b420", "dp_query_count": 2012, "dp_tracking": "affine_x256_y_parity_cpu_batch", "exact_host_table_bytes": 1268635456, "experiment": "metal_jacobian_dynamic_dp_stream_xyzz_affine_scan_target_lookup_tag16_hash_filter25m_power2_j4_setup", "filter_false_positive_count": 1024, "filter_positive_count": 66560, "gpu_lookup_lookups_per_sec": 82105813.781431, "gpu_ops_per_sec": 94263146.469289, "hit_count": 65536, "injected_hits": 64, "iterations": 268435456, "jump_count": 4, "jump_histogram_max_bucket": 67115660, "jump_histogram_max_deviation_ppm": 116, "jump_histogram_min_bucket": 67101097, "jump_index": "power2_mask", "jump_mixer": "avalanche64", "jump_schedule": "power2", "lookup_engine": "gpu_filter16_hash_repeat", "lookup_engine_effective": "gpu_filter16_hash_repeat", "lookup_exact_seconds": 0.001234, "lookup_gpu_seconds": 0.025093, "lookup_hash_seconds": 3.6e-05, "lookup_layout": "open_address_tag16_hash_filter_exact256", "lookup_max_threads_per_threadgroup": 1024, "lookup_query_mode": "repeat", "lookup_repeat": 1024, "lookup_seconds": 0.026363, "lookup_thread_execution_width": 32, "lookup_threadgroup_limit": 512, "lookup_threads_per_threadgroup": 512, "lookups_per_sec": 78149259.392721, "machine": "macOS-26.5-arm64-arm-64bit-Mach-O", "max_threads_per_threadgroup": 1024, "min_ms": 500, "miss_count": 1994752, "operation": "jacobian_affine_scan_target_lookup_tag32", "ops_per_sec": 63460011.180716, "ops_per_sec_max": 87044595.140041, "ops_per_sec_min": 50017459.806248, "output_layout": "affine_dp_scan_target_lookup", "paired_baseline_ops_per_sec": 72944791.53069, "paired_baseline_ref": "HEAD", "paired_order": "alternate", "paired_speedup": 0.8699731653084035, "query_count": 2060288, "query_input": "hash64_repeat_indexed", "raw_status": "discard", "reason": "", "repeat_positive_index_encoding": "packed16_base_repeat", "requested_hits": 64, "runner_sample_count": 3, "sample_count": 131072, "seconds": 2.847724, "setup_inclusive_ops_per_sec": 63460011.180716, "setup_inclusive_ops_per_sec_max": 87044595.140041, "setup_inclusive_ops_per_sec_min": 50017459.806248, "setup_inclusive_seconds": 4.229994, "skipped": false, "state_layout": "xyzz", "status": "discard", "steps_per_sample": 2048, "target_bucket_bytes": 268435456, "target_build_seconds": 1.327235, "target_count": 25005000, "target_filter_bucket_bytes": 67108864, "target_filter_build_seconds": 0.023676, "target_key": "x256_y_parity", "target_key_bytes": 1000200000, "target_lookup_checksum": "0x7b006ccd0f00dc3b", "target_query_hash_bytes": 16096, "target_table_buckets": 33554432, "target_table_bytes": 67108864, "thread_execution_width": 32, "threadgroup_limit": 128, "threads_per_threadgroup": 128, "timestamp": "2026-06-29T16:13:48Z", "validation_seconds": 11.247252, "validation_workers": 8}
