{"affine_scan_mode": "cpu_batch_prod_zz_zzz", "affine_scan_seconds": 0.003627, "backend": "metal", "budget_sec": 240, "bytes_per_target": 2.0, "candidate_verification": "bloom64_hash_filter_then_cpu_exact_key_equality", "commit": "60873d8-dirty", "confirmation_index": 2, "confirmation_runs": 2, "confirmation_status": "discard", "cooldown_sec": 3.0, "correctness": true, "description": "Medium fixed-round 1M physical distinct-miss A/B for Bloom64 hash filtering versus tag16; scores setup-inclusive wall-clock kangaroo distance/sec", "distance_per_sec": 495566909700.428, "distance_tracking": "packet_distance_uint64", "distinct_miss_source_seconds": 6e-06, "dp_bits": 6, "dp_checksum": "0xbd17120591af6f74", "dp_count": 1053, "dp_distance_checksum": "0x9eca239fc5687305", "dp_normalization": "host_batch_affine", "dp_query_count": 1053, "dp_sampling": "packet_endpoint", "dp_tracking": "affine_x256_y_parity_cpu_batch", "exact_host_table_bytes": 16779264, "experiment": "metal_jacobian_dynamic_dp_stream_xyzz_affine_scan_target_lookup_bloom64_hash_filter1m_rounds_distinct_misses_distance", "filter_false_positive_count": 5749, "filter_positive_count": 5813, "gpu_distance_per_sec": 498660112624.1861, "gpu_lookup_lookups_per_sec": 390448377.314081, "gpu_ops_per_sec": 121745049.240665, "hit_count": 64, "injected_hits": 64, "iterations": 134217728, "jump_count": 16, "jump_histogram_max_bucket": 8393138, "jump_histogram_max_deviation_ppm": 707, "jump_histogram_min_bucket": 8382675, "jump_index": "power2_mask", "jump_mixer": "avalanche64", "jump_schedule": "power2", "lookup_buffer_seconds": 0.000969, "lookup_engine": "gpu_filter_bloom64_hash", "lookup_engine_effective": "gpu_filter_bloom64_hash", "lookup_exact_seconds": 0.000492, "lookup_gpu_seconds": 0.002762, "lookup_hash_seconds": 0.0, "lookup_layout": "blocked_bloom64_hash_filter_exact256", "lookup_max_threads_per_threadgroup": 1024, "lookup_query_mode": "distinct_misses", "lookup_repeat": 1024, "lookup_seconds": 0.003254, "lookup_thread_execution_width": 32, "lookup_threadgroup_limit": 512, "lookup_threads_per_threadgroup": 512, "lookup_wall_seconds": 0.004223, "lookups_per_sec": 331380892.013369, "machine": "macOS-26.5-arm64-arm-64bit-Mach-O", "max_sample_spread_ratio": 1.5, "max_threads_per_threadgroup": 1024, "mean_jump_distance": 4095.9375, "min_ms": 0, "miss_count": 1078208, "operation": "jacobian_affine_scan_target_lookup_tag32_rounds", "ops_per_sec": 466302611631.63556, "ops_per_sec_max": 467256518487.1717, "ops_per_sec_min": 460932911923.78394, "output_layout": "affine_dp_scan_target_lookup", "paired_baseline_ops_per_sec": 463444729650.19604, "paired_baseline_ref": "HEAD", "paired_order": "alternate", "paired_speedup": 1.0061666080086757, "physical_filter_positive_count": 5813, "physical_query_count": 1078272, "query_count": 1078272, "query_input": "hash64_prefix_gpu_miss", "raw_status": "discard", "reason": "", "repeat_positive_index_encoding": "physical_query_index", "requested_hits": 32, "round_count": 2, "round_sample_build_seconds": 0.000653, "runner_sample_count": 3, "sample_count": 32768, "sample_metric": "setup_inclusive_wall_distance_per_sec", "sample_metric_values": [466302611631.63556, 460932911923.78394, 467256518487.1717], "sample_spread_ratio": 1.0137191474069298, "seconds": 1.102449, "setup_inclusive_distance_per_sec": 479775401748.1959, "setup_inclusive_ops_per_sec": 117134453.772353, "setup_inclusive_seconds": 1.145843, "setup_inclusive_wall_distance_per_sec": 466302611631.63556, "setup_inclusive_wall_distance_per_sec_max": 467256518487.1717, "setup_inclusive_wall_distance_per_sec_min": 460932911923.78394, "setup_inclusive_wall_ops_per_sec": 113845148.181982, "setup_inclusive_wall_seconds": 1.17895, "skipped": false, "state_layout": "xyzz", "status": "discard", "steps_per_sample": 2048, "target_bucket_bytes": 16777216, "target_build_seconds": 0.035854, "target_count": 1048576, "target_filter_bucket_bytes": 2097152, "target_filter_build_seconds": 0.0, "target_key": "x256_y_parity", "target_key_bytes": 2048, "target_lookup_checksum": "0xcb38405cd10f441d", "target_lookup_scope": "packet_endpoint_dp_keys", "target_query_hash_bytes": 8424, "target_setup_workers": 8, "target_table_buckets": 2097152, "target_table_bytes": 2097152, "thread_execution_width": 32, "threadgroup_limit": 128, "threads_per_threadgroup": 128, "timestamp": "2026-07-07T17:33:06Z", "validation_seconds": 3.933357, "validation_workers": 8, "walk_buffer_seconds": 0.032137, "walk_round_mode": "independent", "walk_wall_seconds": 1.134586}
{"affine_scan_mode": "cpu_batch_prod_zz_zzz", "affine_scan_seconds": 0.001997, "backend": "metal", "budget_sec": 240, "bytes_per_target": 4.0, "candidate_verification": "tag16_hash_filter_then_cpu_exact_key_equality", "commit": "3005cb4-dirty", "cooldown_sec": 3.0, "correctness": true, "description": "Medium fixed-round 1M target lookup with physical distinct-miss queries; fast falsifier for setup-inclusive wall-clock kangaroo distance/sec", "distance_per_sec": 506096088530.029, "distance_tracking": "packet_distance_uint64", "distinct_miss_source_seconds": 6e-06, "dp_bits": 6, "dp_checksum": "0xbd17120591af6f74", "dp_count": 1053, "dp_distance_checksum": "0x9eca239fc5687305", "dp_normalization": "host_batch_affine", "dp_query_count": 1053, "dp_sampling": "packet_endpoint", "dp_tracking": "affine_x256_y_parity_cpu_batch", "exact_host_table_bytes": 16779264, "experiment": "metal_jacobian_dynamic_dp_stream_xyzz_affine_scan_target_lookup_tag16_hash_filter1m_rounds_distinct_misses_distance", "filter_false_positive_count": 28, "filter_positive_count": 92, "gpu_distance_per_sec": 508736206920.4223, "gpu_lookup_lookups_per_sec": 301354579.713612, "gpu_ops_per_sec": 124205070.736656, "hit_count": 64, "injected_hits": 64, "iterations": 134217728, "jump_count": 16, "jump_histogram_max_bucket": 8393138, "jump_histogram_max_deviation_ppm": 707, "jump_histogram_min_bucket": 8382675, "jump_index": "power2_mask", "jump_mixer": "avalanche64", "jump_schedule": "power2", "lookup_buffer_seconds": 0.000926, "lookup_engine": "gpu_filter16_hash", "lookup_engine_effective": "gpu_filter16_hash", "lookup_exact_seconds": 6.2e-05, "lookup_gpu_seconds": 0.003578, "lookup_hash_seconds": 0.0, "lookup_layout": "open_address_tag16_hash_filter_exact256", "lookup_max_threads_per_threadgroup": 1024, "lookup_query_mode": "distinct_misses", "lookup_repeat": 1024, "lookup_seconds": 0.00364, "lookup_thread_execution_width": 32, "lookup_threadgroup_limit": 512, "lookup_threads_per_threadgroup": 512, "lookup_wall_seconds": 0.004566, "lookups_per_sec": 296225072.066456, "machine": "macOS-26.5-arm64-arm-64bit-Mach-O", "max_sample_spread_ratio": 1.5, "max_threads_per_threadgroup": 1024, "mean_jump_distance": 4095.9375, "min_ms": 0, "miss_count": 1078208, "operation": "jacobian_affine_scan_target_lookup_tag32_rounds", "ops_per_sec": 470474223199.0677, "ops_per_sec_max": 471229564390.28186, "ops_per_sec_min": 465815917628.1692, "output_layout": "affine_dp_scan_target_lookup", "paired_baseline_ops_per_sec": 466788556389.9584, "paired_baseline_ref": "HEAD", "paired_order": "alternate", "paired_speedup": 1.0078957951274845, "physical_filter_positive_count": 92, "physical_query_count": 1078272, "query_count": 1078272, "query_input": "hash64_prefix_gpu_miss", "reason": "", "repeat_positive_index_encoding": "physical_query_index", "requested_hits": 32, "round_count": 2, "round_sample_build_seconds": 0.001769, "runner_sample_count": 3, "sample_count": 32768, "sample_metric": "setup_inclusive_wall_distance_per_sec", "sample_metric_values": [471229564390.28186, 470474223199.0677, 465815917628.1692], "sample_spread_ratio": 1.0116218586725798, "seconds": 1.080614, "setup_inclusive_distance_per_sec": 490965550582.3853, "setup_inclusive_ops_per_sec": 119866465.389764, "setup_inclusive_seconds": 1.119727, "setup_inclusive_wall_distance_per_sec": 470474223199.0677, "setup_inclusive_wall_distance_per_sec_max": 471229564390.28186, "setup_inclusive_wall_distance_per_sec_min": 465815917628.1692, "setup_inclusive_wall_ops_per_sec": 114863623.578013, "setup_inclusive_wall_seconds": 1.168496, "skipped": false, "state_layout": "xyzz", "status": "discard", "steps_per_sample": 2048, "target_bucket_bytes": 16777216, "target_build_seconds": 0.031701, "target_count": 1048576, "target_filter_bucket_bytes": 4194304, "target_filter_build_seconds": 0.0, "target_key": "x256_y_parity", "target_key_bytes": 2048, "target_lookup_checksum": "0xcb38405cd10f441d", "target_lookup_scope": "packet_endpoint_dp_keys", "target_query_hash_bytes": 8424, "target_setup_workers": 8, "target_table_buckets": 2097152, "target_table_bytes": 4194304, "thread_execution_width": 32, "threadgroup_limit": 128, "threads_per_threadgroup": 128, "timestamp": "2026-07-07T17:45:55Z", "validation_seconds": 3.824554, "validation_workers": 8, "walk_buffer_seconds": 0.047843, "walk_round_mode": "independent", "walk_wall_seconds": 1.128457}
{"affine_scan_mode": "cpu_batch_prod_zz_zzz", "affine_scan_seconds": 0.001999, "backend": "metal", "budget_sec": 240, "bytes_per_target": 4.0, "candidate_verification": "tag16_hash_filter_then_cpu_exact_key_equality", "commit": "123ddfe-dirty", "confirmation_index": 1, "confirmation_runs": 2, "confirmation_status": "discard", "cooldown_sec": 3.0, "correctness": true, "description": "Medium fixed-round 1M target lookup with physical distinct-miss queries; fast falsifier for setup-inclusive wall-clock kangaroo distance/sec", "distance_per_sec": 501052492946.6996, "distance_tracking": "packet_distance_uint64", "distinct_miss_source_seconds": 5e-06, "dp_bits": 6, "dp_checksum": "0xbd17120591af6f74", "dp_count": 1053, "dp_distance_checksum": "0x9eca239fc5687305", "dp_normalization": "host_batch_affine", "dp_query_count": 1053, "dp_sampling": "packet_endpoint", "dp_tracking": "affine_x256_y_parity_cpu_batch", "exact_host_table_bytes": 16779264, "experiment": "metal_jacobian_dynamic_dp_stream_xyzz_affine_scan_target_lookup_tag16_hash_filter1m_rounds_distinct_misses_distance", "filter_false_positive_count": 28, "filter_positive_count": 92, "gpu_distance_per_sec": 503562633033.0429, "gpu_lookup_lookups_per_sec": 316313153.166367, "gpu_ops_per_sec": 122941971.900949, "hit_count": 64, "injected_hits": 64, "iterations": 134217728, "jump_count": 16, "jump_histogram_max_bucket": 8393138, "jump_histogram_max_deviation_ppm": 707, "jump_histogram_min_bucket": 8382675, "jump_index": "power2_mask", "jump_mixer": "avalanche64", "jump_schedule": "power2", "lookup_buffer_seconds": 0.001721, "lookup_engine": "gpu_filter16_hash", "lookup_engine_effective": "gpu_filter16_hash", "lookup_exact_seconds": 6.1e-05, "lookup_gpu_seconds": 0.003409, "lookup_hash_seconds": 0.0, "lookup_layout": "open_address_tag16_hash_filter_exact256", "lookup_max_threads_per_threadgroup": 1024, "lookup_query_mode": "distinct_misses", "lookup_repeat": 1024, "lookup_seconds": 0.00347, "lookup_thread_execution_width": 32, "lookup_threadgroup_limit": 512, "lookup_threads_per_threadgroup": 512, "lookup_wall_seconds": 0.005191, "lookups_per_sec": 310726345.656087, "machine": "macOS-26.5-arm64-arm-64bit-Mach-O", "max_sample_spread_ratio": 1.5, "max_threads_per_threadgroup": 1024, "mean_jump_distance": 4095.9375, "min_ms": 0, "miss_count": 1078208, "operation": "jacobian_affine_scan_target_lookup_tag32_rounds", "ops_per_sec": 466419436267.3624, "ops_per_sec_max": 468692871500.0591, "ops_per_sec_min": 456907875817.90674, "output_layout": "affine_dp_scan_target_lookup", "paired_baseline_ops_per_sec": 470379036865.17035, "paired_baseline_ref": "HEAD", "paired_order": "alternate", "paired_speedup": 0.9915821065832428, "physical_filter_positive_count": 92, "physical_query_count": 1078272, "query_count": 1078272, "query_input": "hash64_prefix_gpu_miss", "raw_status": "discard", "reason": "", "repeat_positive_index_encoding": "physical_query_index", "requested_hits": 32, "round_count": 2, "round_sample_build_seconds": 0.000659, "runner_sample_count": 3, "sample_count": 32768, "sample_metric": "setup_inclusive_wall_distance_per_sec", "sample_metric_values": [468692871500.0591, 456907875817.90674, 466419436267.3624], "sample_spread_ratio": 1.02579293618228, "seconds": 1.091716, "setup_inclusive_distance_per_sec": 485834518489.3673, "setup_inclusive_ops_per_sec": 118613752.892803, "setup_inclusive_seconds": 1.131553, "setup_inclusive_wall_distance_per_sec": 466419436267.3624, "setup_inclusive_wall_distance_per_sec_max": 468692871500.0591, "setup_inclusive_wall_distance_per_sec_min": 456907875817.90674, "setup_inclusive_wall_ops_per_sec": 113873670.256776, "setup_inclusive_wall_seconds": 1.178655, "skipped": false, "state_layout": "xyzz", "status": "discard", "steps_per_sample": 2048, "target_bucket_bytes": 16777216, "target_build_seconds": 0.033704, "target_count": 1048576, "target_filter_bucket_bytes": 4194304, "target_filter_build_seconds": 0.0, "target_key": "x256_y_parity", "target_key_bytes": 2048, "target_lookup_checksum": "0xcb38405cd10f441d", "target_lookup_scope": "packet_endpoint_dp_keys", "target_query_hash_bytes": 8424, "target_setup_workers": 8, "target_table_buckets": 2097152, "target_table_bytes": 4194304, "thread_execution_width": 32, "threadgroup_limit": 128, "threads_per_threadgroup": 128, "timestamp": "2026-07-07T17:53:15Z", "validation_seconds": 3.777109, "validation_workers": 8, "walk_buffer_seconds": 0.045381, "walk_round_mode": "independent", "walk_wall_seconds": 1.137097}
{"affine_scan_mode": "cpu_batch_prod_zz_zzz", "affine_scan_seconds": 0.001828, "backend": "metal", "budget_sec": 240, "bytes_per_target": 4.0, "candidate_verification": "tag16_hash_filter_then_cpu_exact_key_equality", "commit": "123ddfe-dirty", "confirmation_index": 2, "confirmation_runs": 2, "confirmation_status": "discard", "cooldown_sec": 3.0, "correctness": true, "description": "Medium fixed-round 1M target lookup with physical distinct-miss queries; fast falsifier for setup-inclusive wall-clock kangaroo distance/sec", "distance_per_sec": 495706047669.1561, "distance_tracking": "packet_distance_uint64", "distinct_miss_source_seconds": 5e-06, "dp_bits": 6, "dp_checksum": "0xbd17120591af6f74", "dp_count": 1053, "dp_distance_checksum": "0x9eca239fc5687305", "dp_normalization": "host_batch_affine", "dp_query_count": 1053, "dp_sampling": "packet_endpoint", "dp_tracking": "affine_x256_y_parity_cpu_batch", "exact_host_table_bytes": 16779264, "experiment": "metal_jacobian_dynamic_dp_stream_xyzz_affine_scan_target_lookup_tag16_hash_filter1m_rounds_distinct_misses_distance", "filter_false_positive_count": 28, "filter_positive_count": 92, "gpu_distance_per_sec": 498025749446.0426, "gpu_lookup_lookups_per_sec": 323882436.903912, "gpu_ops_per_sec": 121590173.054653, "hit_count": 64, "injected_hits": 64, "iterations": 134217728, "jump_count": 16, "jump_histogram_max_bucket": 8393138, "jump_histogram_max_deviation_ppm": 707, "jump_histogram_min_bucket": 8382675, "jump_index": "power2_mask", "jump_mixer": "avalanche64", "jump_schedule": "power2", "lookup_buffer_seconds": 0.001043, "lookup_engine": "gpu_filter16_hash", "lookup_engine_effective": "gpu_filter16_hash", "lookup_exact_seconds": 8e-06, "lookup_gpu_seconds": 0.003329, "lookup_hash_seconds": 0.0, "lookup_layout": "open_address_tag16_hash_filter_exact256", "lookup_max_threads_per_threadgroup": 1024, "lookup_query_mode": "distinct_misses", "lookup_repeat": 1024, "lookup_seconds": 0.003337, "lookup_thread_execution_width": 32, "lookup_threadgroup_limit": 512, "lookup_threads_per_threadgroup": 512, "lookup_wall_seconds": 0.00438, "lookups_per_sec": 323097888.947086, "machine": "macOS-26.5-arm64-arm-64bit-Mach-O", "max_sample_spread_ratio": 1.5, "max_threads_per_threadgroup": 1024, "mean_jump_distance": 4095.9375, "min_ms": 0, "miss_count": 1078208, "operation": "jacobian_affine_scan_target_lookup_tag32_rounds", "ops_per_sec": 466927220846.6804, "ops_per_sec_max": 470875487326.5062, "ops_per_sec_min": 456469499429.9809, "output_layout": "affine_dp_scan_target_lookup", "paired_baseline_ops_per_sec": 463356318836.27594, "paired_baseline_ref": "HEAD", "paired_order": "alternate", "paired_speedup": 1.0077066004395339, "physical_filter_positive_count": 92, "physical_query_count": 1078272, "query_count": 1078272, "query_input": "hash64_prefix_gpu_miss", "raw_status": "discard", "reason": "", "repeat_positive_index_encoding": "physical_query_index", "requested_hits": 32, "round_count": 2, "round_sample_build_seconds": 0.000637, "runner_sample_count": 3, "sample_count": 32768, "sample_metric": "setup_inclusive_wall_distance_per_sec", "sample_metric_values": [466927220846.6804, 456469499429.9809, 470875487326.5062], "sample_spread_ratio": 1.0315595848452412, "seconds": 1.103853, "setup_inclusive_distance_per_sec": 480089429460.4646, "setup_inclusive_ops_per_sec": 117211121.864156, "setup_inclusive_seconds": 1.145094, "setup_inclusive_wall_distance_per_sec": 466927220846.6804, "setup_inclusive_wall_distance_per_sec_max": 470875487326.5062, "setup_inclusive_wall_distance_per_sec_min": 456469499429.9809, "setup_inclusive_wall_ops_per_sec": 113997642.99301, "setup_inclusive_wall_seconds": 1.177373, "skipped": false, "state_layout": "xyzz", "status": "discard", "steps_per_sample": 2048, "target_bucket_bytes": 16777216, "target_build_seconds": 0.035432, "target_count": 1048576, "target_filter_bucket_bytes": 4194304, "target_filter_build_seconds": 0.0, "target_key": "x256_y_parity", "target_key_bytes": 2048, "target_lookup_checksum": "0xcb38405cd10f441d", "target_lookup_scope": "packet_endpoint_dp_keys", "target_query_hash_bytes": 8424, "target_setup_workers": 8, "target_table_buckets": 2097152, "target_table_bytes": 4194304, "thread_execution_width": 32, "threadgroup_limit": 128, "threads_per_threadgroup": 128, "timestamp": "2026-07-07T17:53:15Z", "validation_seconds": 4.039052, "validation_workers": 8, "walk_buffer_seconds": 0.031236, "walk_round_mode": "independent", "walk_wall_seconds": 1.135089}
