{"backend": "metal", "budget_sec": 20, "commit": "925c05e-dirty", "correctness": true, "description": "Metal dynamic Jacobian DP stream with runtime dp_bits=8 mask", "distance_tracking": "dp_stream_uint64", "dp_bits": 8, "dp_capacity": 16384, "dp_checksum": "0x641ef713d473d79e", "dp_count": 66, "dp_distance_checksum": "0x7157e1d08c6afc2b", "dp_stream_overflow": false, "dp_tracking": "projective_x_limb0", "emitted_records": 66, "experiment": "metal_jacobian_dynamic_dp_stream_dp8", "iterations": 6029312, "jump_count": 16, "jump_histogram_max_bucket": 8347, "jump_histogram_max_deviation_ppm": 18921, "jump_histogram_min_bucket": 8039, "jump_index": "power2_mask", "jump_mixer": "x_limb0", "machine": "macOS-26.5-arm64-arm-64bit-Mach-O", "max_threads_per_threadgroup": 1024, "min_ms": 200, "operation": "jacobian_affine_walk_dynamic_dp_stream", "ops_per_sec": 29799267.712366, "ops_per_sec_max": 33348152.912071, "ops_per_sec_min": 27603086.503402, "output_bytes_per_record": 20, "output_bytes_total": 1320, "output_layout": "dp_stream", "paired_baseline_ops_per_sec": 31783403.981837, "paired_baseline_ref": "main", "paired_speedup": 0.9375731979304401, "reason": "", "runner_sample_count": 3, "sample_count": 16384, "seconds": 0.202331, "skipped": false, "status": "discard", "steps_per_sample": 8, "thread_execution_width": 32, "threadgroup_limit": 256, "threads_per_threadgroup": 256, "timestamp": "2026-06-22T04:33:53Z"}
{"backend": "metal", "budget_sec": 20, "commit": "53879b9-dirty", "correctness": true, "description": "Metal dynamic Jacobian DP stream with runtime dp_bits=8 mask", "distance_tracking": "dp_stream_uint64", "dp_bits": 8, "dp_capacity": 16384, "dp_checksum": "0xab1c2cd29cd70a84", "dp_count": 61, "dp_distance_checksum": "0x822e141de4770a0b", "dp_stream_overflow": false, "dp_tracking": "projective_x_limb0", "emitted_records": 61, "experiment": "metal_jacobian_dynamic_dp_stream_dp8", "iterations": 262144, "jump_count": 16, "jump_histogram_max_bucket": 8336, "jump_histogram_max_deviation_ppm": 17578, "jump_histogram_min_bucket": 8082, "jump_index": "power2_mask", "jump_mixer": "avalanche64", "machine": "macOS-26.5-arm64-arm-64bit-Mach-O", "max_threads_per_threadgroup": 1024, "min_ms": 200, "operation": "jacobian_affine_walk_dynamic_dp_stream", "ops_per_sec": 910556.434373, "ops_per_sec_max": 1191971.044843, "ops_per_sec_min": 836748.733737, "output_bytes_per_record": 20, "output_bytes_total": 1220, "output_layout": "dp_stream", "paired_baseline_ops_per_sec": 1799640.261424, "paired_baseline_ref": "main", "paired_speedup": 0.5059658054396409, "reason": "", "runner_sample_count": 3, "sample_count": 16384, "seconds": 0.287894, "skipped": false, "status": "discard", "steps_per_sample": 8, "thread_execution_width": 32, "threadgroup_limit": 256, "threads_per_threadgroup": 256, "timestamp": "2026-06-22T05:00:31Z"}
{"backend": "metal", "budget_sec": 20, "commit": "b3a9ee6-dirty", "correctness": true, "description": "Metal dynamic Jacobian DP stream with runtime dp_bits=8 mask", "distance_tracking": "dp_stream_uint64", "dp_bits": 8, "dp_capacity": 16384, "dp_checksum": "0xab1c2cd29cd70a84", "dp_count": 61, "dp_distance_checksum": "0x822e141de4770a0b", "dp_stream_overflow": false, "dp_tracking": "projective_x_limb0", "emitted_records": 61, "experiment": "metal_jacobian_dynamic_dp_stream_dp8", "iterations": 6946816, "jump_count": 16, "jump_histogram_max_bucket": 8336, "jump_histogram_max_deviation_ppm": 17578, "jump_histogram_min_bucket": 8082, "jump_index": "power2_mask", "jump_mixer": "avalanche64", "machine": "macOS-26.5-arm64-arm-64bit-Mach-O", "max_threads_per_threadgroup": 1024, "min_ms": 200, "operation": "jacobian_affine_walk_dynamic_dp_stream", "ops_per_sec": 34715854.003069, "ops_per_sec_max": 34834754.705358, "ops_per_sec_min": 34590529.131153, "output_bytes_per_record": 20, "output_bytes_total": 1220, "output_layout": "dp_stream", "paired_baseline_ops_per_sec": 50834993.1403, "paired_baseline_ref": "main", "paired_speedup": 0.6829125344279358, "reason": "", "runner_sample_count": 3, "sample_count": 16384, "seconds": 0.200105, "skipped": false, "status": "discard", "steps_per_sample": 8, "thread_execution_width": 32, "threadgroup_limit": 256, "threads_per_threadgroup": 256, "timestamp": "2026-06-22T05:31:58Z"}
{"backend": "metal", "budget_sec": 20, "commit": "b1b0232-dirty", "correctness": true, "description": "Metal dynamic Jacobian DP stream with runtime dp_bits=8 mask", "distance_tracking": "dp_stream_uint64", "dp_bits": 8, "dp_capacity": 16384, "dp_checksum": "0xab1c2cd29cd70a84", "dp_count": 61, "dp_distance_checksum": "0x822e141de4770a0b", "dp_stream_overflow": false, "dp_tracking": "projective_x_limb0", "emitted_records": 61, "experiment": "metal_jacobian_dynamic_dp_stream_dp8", "iterations": 12582912, "jump_count": 16, "jump_histogram_max_bucket": 8336, "jump_histogram_max_deviation_ppm": 17578, "jump_histogram_min_bucket": 8082, "jump_index": "power2_mask", "jump_mixer": "avalanche64", "machine": "macOS-26.5-arm64-arm-64bit-Mach-O", "max_threads_per_threadgroup": 1024, "min_ms": 200, "operation": "jacobian_affine_walk_dynamic_dp_stream", "ops_per_sec": 62611858.275279, "ops_per_sec_max": 74206989.027034, "ops_per_sec_min": 49232473.11476, "output_bytes_per_record": 20, "output_bytes_total": 1220, "output_layout": "dp_stream", "paired_baseline_ops_per_sec": 56207874.481378, "paired_baseline_ref": "main", "paired_speedup": 1.1139339256819376, "reason": "", "runner_sample_count": 3, "sample_count": 16384, "seconds": 0.200967, "skipped": false, "status": "keep", "steps_per_sample": 8, "thread_execution_width": 32, "threadgroup_limit": 256, "threads_per_threadgroup": 256, "timestamp": "2026-06-22T05:38:01Z"}
{"backend": "metal", "budget_sec": 20, "commit": "3194ed6-dirty", "correctness": true, "description": "Metal dynamic Jacobian jump walk with sparse distinguished-point stream emission", "distance_tracking": "dp_stream_uint64", "dp_bits": 4, "dp_capacity": 16384, "dp_checksum": "0xbfd3b2319760e774", "dp_count": 1017, "dp_distance_checksum": "0x19e43ca50eec2a74", "dp_stream_overflow": false, "dp_tracking": "projective_x_limb0", "emitted_records": 1017, "experiment": "metal_jacobian_dynamic_dp_stream", "iterations": 13107200, "jump_count": 16, "jump_histogram_max_bucket": 8336, "jump_histogram_max_deviation_ppm": 17578, "jump_histogram_min_bucket": 8082, "jump_index": "power2_mask", "jump_mixer": "avalanche64", "machine": "macOS-26.5-arm64-arm-64bit-Mach-O", "max_threads_per_threadgroup": 1024, "min_ms": 200, "operation": "jacobian_affine_walk_dynamic_dp_stream", "ops_per_sec": 65061282.305496, "ops_per_sec_max": 67393074.821646, "ops_per_sec_min": 41003406.661886, "output_bytes_per_record": 20, "output_bytes_total": 20340, "output_layout": "dp_stream", "paired_baseline_ops_per_sec": 52181168.524837, "paired_baseline_ref": "main", "paired_speedup": 1.2468345218165893, "reason": "", "runner_sample_count": 3, "sample_count": 16384, "seconds": 0.201459, "skipped": false, "status": "keep", "steps_per_sample": 8, "thread_execution_width": 32, "threadgroup_limit": 256, "threads_per_threadgroup": 256, "timestamp": "2026-06-22T05:41:38Z"}
{"backend": "metal", "budget_sec": 20, "commit": "1893ed1-dirty", "correctness": true, "description": "Metal dynamic Jacobian jump walk with compact distinguished-point candidate emission", "distance_checksum": "0x5c36c706ffa2cbaa", "distance_tracking": "uint64", "dp_bits": 4, "dp_checksum": "0xbfd3b2319760e774", "dp_count": 1017, "dp_tracking": "projective_x_limb0", "experiment": "metal_jacobian_dynamic_compact_dp", "iterations": 5898240, "jump_count": 16, "jump_histogram_max_bucket": 8336, "jump_histogram_max_deviation_ppm": 17578, "jump_histogram_min_bucket": 8082, "jump_index": "power2_mask", "jump_mixer": "avalanche64", "machine": "macOS-26.5-arm64-arm-64bit-Mach-O", "max_threads_per_threadgroup": 1024, "min_ms": 200, "operation": "jacobian_affine_walk_dynamic_dp_compact", "ops_per_sec": 28896380.858909, "ops_per_sec_max": 38095787.769098, "ops_per_sec_min": 28120992.430797, "output_bytes_per_sample": 17, "output_layout": "dp_compact", "paired_baseline_ops_per_sec": 54829695.882427, "paired_baseline_ref": "main", "paired_speedup": 0.5270206298585423, "reason": "", "runner_sample_count": 3, "sample_count": 16384, "seconds": 0.204117, "skipped": false, "status": "discard", "steps_per_sample": 8, "thread_execution_width": 32, "threadgroup_limit": 256, "threads_per_threadgroup": 256, "timestamp": "2026-06-22T09:28:08Z"}
{"backend": "metal", "budget_sec": 20, "commit": "fc19690-dirty", "correctness": true, "description": "Stable Metal dynamic Jacobian jump walk with in-kernel jump selection and projective distinguished-point candidate flags", "distance_checksum": "0x5c36c706ffa2cbaa", "distance_tracking": "uint64", "dp_bits": 4, "dp_checksum": "0xbfd3b2319760e774", "dp_count": 1017, "dp_tracking": "projective_x_limb0", "experiment": "metal_jacobian_dynamic_walk_dp_stable", "iterations": 7733248, "jump_count": 16, "jump_histogram_max_bucket": 8336, "jump_histogram_max_deviation_ppm": 17578, "jump_histogram_min_bucket": 8082, "jump_index": "power2_mask", "jump_mixer": "avalanche64", "machine": "macOS-26.5-arm64-arm-64bit-Mach-O", "max_threads_per_threadgroup": 1024, "min_ms": 200, "operation": "jacobian_affine_walk_dynamic_jump_table", "ops_per_sec": 37929646.083412, "ops_per_sec_max": 53617873.109935, "ops_per_sec_min": 31352106.536932, "paired_baseline_ops_per_sec": 49708107.924197, "paired_baseline_ref": "main", "paired_speedup": 0.7630474718782957, "reason": "", "runner_sample_count": 3, "sample_count": 16384, "seconds": 0.203884, "skipped": false, "status": "discard", "steps_per_sample": 8, "thread_execution_width": 32, "threadgroup_limit": 256, "threads_per_threadgroup": 256, "timestamp": "2026-06-22T09:32:14Z"}
{"backend": "metal", "budget_sec": 20, "commit": "20425f1-dirty", "correctness": true, "description": "Metal dynamic Jacobian DP count-only probe with runtime dp_bits=8 mask", "distance_tracking": "none", "dp_bits": 8, "dp_count": 61, "dp_tracking": "projective_x_limb0", "experiment": "metal_jacobian_dynamic_dp_count_dp8", "iterations": 6291456, "jump_count": 16, "jump_histogram_max_bucket": 8336, "jump_histogram_max_deviation_ppm": 17578, "jump_histogram_min_bucket": 8082, "jump_index": "power2_mask", "jump_mixer": "avalanche64", "machine": "macOS-26.5-arm64-arm-64bit-Mach-O", "max_threads_per_threadgroup": 1024, "min_ms": 200, "operation": "jacobian_affine_walk_dynamic_dp_count", "ops_per_sec": 31386712.313105, "ops_per_sec_max": 53030510.888202, "ops_per_sec_min": 27381736.631399, "output_bytes_total": 4, "output_layout": "dp_count", "paired_baseline_ops_per_sec": 38552397.853331, "paired_baseline_ref": "main", "paired_speedup": 0.8141312618870769, "reason": "", "runner_sample_count": 3, "sample_count": 16384, "seconds": 0.20045, "skipped": false, "status": "discard", "steps_per_sample": 8, "thread_execution_width": 32, "threadgroup_limit": 256, "threads_per_threadgroup": 256, "timestamp": "2026-06-22T09:36:27Z"}
{"backend": "metal", "budget_sec": 10, "commit": "9aae4d3", "correctness": true, "description": "Metal dynamic Jacobian DP stream with runtime dp_bits=10 mask", "distance_tracking": "dp_stream_uint64", "dp_bits": 10, "dp_capacity": 16384, "dp_checksum": "0xcbfdc2badaf0e57a", "dp_count": 15, "dp_distance_checksum": "0xb6973c2035ff6351", "dp_stream_overflow": false, "dp_tracking": "projective_x_limb0", "emitted_records": 15, "experiment": "metal_jacobian_dynamic_dp_stream_dp10", "iterations": 6160384, "jump_count": 16, "jump_histogram_max_bucket": 8336, "jump_histogram_max_deviation_ppm": 17578, "jump_histogram_min_bucket": 8082, "jump_index": "power2_mask", "jump_mixer": "avalanche64", "machine": "macOS-26.5-arm64-arm-64bit-Mach-O", "max_threads_per_threadgroup": 1024, "min_ms": 200, "operation": "jacobian_affine_walk_dynamic_dp_stream", "ops_per_sec": 30209443.482633, "ops_per_sec_max": 46241502.977642, "ops_per_sec_min": 26595828.945919, "output_bytes_per_record": 20, "output_bytes_total": 300, "output_layout": "dp_stream", "paired_baseline_ops_per_sec": 33775886.308299, "paired_baseline_ref": "main", "paired_speedup": 0.8944086087597442, "reason": "", "runner_sample_count": 3, "sample_count": 16384, "seconds": 0.203922, "skipped": false, "status": "discard", "steps_per_sample": 8, "thread_execution_width": 32, "threadgroup_limit": 256, "threads_per_threadgroup": 256, "timestamp": "2026-06-22T09:49:10Z"}
{"backend": "metal", "budget_sec": 20, "commit": "0c18528-dirty", "correctness": true, "description": "Metal dynamic Jacobian DP stream with runtime dp_bits=10 mask", "distance_tracking": "dp_stream_uint64", "dp_bits": 10, "dp_capacity": 16384, "dp_checksum": "0xcbfdc2badaf0e57a", "dp_count": 15, "dp_distance_checksum": "0xb6973c2035ff6351", "dp_stream_overflow": false, "dp_tracking": "projective_x_limb0", "emitted_records": 15, "experiment": "metal_jacobian_dynamic_dp_stream_dp10", "iterations": 10878976, "jump_count": 16, "jump_histogram_max_bucket": 8336, "jump_histogram_max_deviation_ppm": 17578, "jump_histogram_min_bucket": 8082, "jump_index": "power2_mask", "jump_mixer": "avalanche64", "machine": "macOS-26.5-arm64-arm-64bit-Mach-O", "max_threads_per_threadgroup": 1024, "min_ms": 200, "operation": "jacobian_affine_walk_dynamic_dp_stream", "ops_per_sec": 54324631.18967, "ops_per_sec_max": 59913902.741406, "ops_per_sec_min": 31337310.278256, "output_bytes_per_record": 20, "output_bytes_total": 300, "output_layout": "dp_stream", "paired_baseline_ops_per_sec": 57359097.012105, "paired_baseline_ref": "main", "paired_speedup": 0.9470970433548733, "reason": "", "runner_sample_count": 3, "sample_count": 16384, "seconds": 0.200259, "skipped": false, "status": "discard", "steps_per_sample": 8, "thread_execution_width": 32, "threadgroup_limit": 256, "threads_per_threadgroup": 256, "timestamp": "2026-06-22T09:53:05Z"}
{"backend": "metal", "budget_sec": 20, "commit": "9624a50-dirty", "correctness": true, "description": "Metal dynamic Jacobian DP stream with runtime dp_bits=10 mask", "distance_tracking": "dp_stream_uint64", "dp_bits": 10, "dp_capacity": 16384, "dp_checksum": "0xcbfdc2badaf0e57a", "dp_count": 15, "dp_distance_checksum": "0xb6973c2035ff6351", "dp_stream_overflow": false, "dp_tracking": "projective_x_limb0", "emitted_records": 15, "experiment": "metal_jacobian_dynamic_dp_stream_dp10", "iterations": 11141120, "jump_count": 16, "jump_histogram_max_bucket": 8336, "jump_histogram_max_deviation_ppm": 17578, "jump_histogram_min_bucket": 8082, "jump_index": "power2_mask", "jump_mixer": "avalanche64", "machine": "macOS-26.5-arm64-arm-64bit-Mach-O", "max_threads_per_threadgroup": 1024, "min_ms": 200, "operation": "jacobian_affine_walk_dynamic_dp_stream", "ops_per_sec": 55120744.100756, "ops_per_sec_max": 61234592.955097, "ops_per_sec_min": 44358197.083863, "output_bytes_per_record": 20, "output_bytes_total": 300, "output_layout": "dp_stream", "paired_baseline_ops_per_sec": 57341488.499819, "paired_baseline_ref": "main", "paired_speedup": 0.9612715948406185, "reason": "", "runner_sample_count": 3, "sample_count": 16384, "seconds": 0.202122, "skipped": false, "status": "discard", "steps_per_sample": 8, "thread_execution_width": 32, "threadgroup_limit": 64, "threads_per_threadgroup": 64, "timestamp": "2026-06-22T09:57:23Z"}
{"backend": "metal", "budget_sec": 20, "commit": "98bc52a-dirty", "correctness": true, "description": "Metal dynamic Jacobian DP stream with runtime dp_bits=6 mask", "distance_tracking": "dp_stream_uint64", "dp_bits": 6, "dp_capacity": 16384, "dp_checksum": "0xb302d085b993018a", "dp_count": 248, "dp_distance_checksum": "0xcd602d19c5edfa05", "dp_stream_overflow": false, "dp_tracking": "projective_x_limb0", "emitted_records": 248, "experiment": "metal_jacobian_dynamic_dp_stream_dp6", "iterations": 7995392, "jump_count": 16, "jump_histogram_max_bucket": 8336, "jump_histogram_max_deviation_ppm": 17578, "jump_histogram_min_bucket": 8082, "jump_index": "power2_mask", "jump_mixer": "avalanche64", "machine": "macOS-26.5-arm64-arm-64bit-Mach-O", "max_threads_per_threadgroup": 1024, "min_ms": 200, "operation": "jacobian_affine_walk_dynamic_dp_stream", "ops_per_sec": 39834931.34075, "ops_per_sec_max": 59170008.949403, "ops_per_sec_min": 30115365.114382, "output_bytes_per_record": 20, "output_bytes_total": 4960, "output_layout": "dp_stream", "paired_baseline_ops_per_sec": 55663782.861444, "paired_baseline_ref": "main", "paired_speedup": 0.7156346423653146, "reason": "", "runner_sample_count": 3, "sample_count": 16384, "seconds": 0.200713, "skipped": false, "status": "discard", "steps_per_sample": 8, "thread_execution_width": 32, "threadgroup_limit": 256, "threads_per_threadgroup": 256, "timestamp": "2026-06-22T10:01:43Z"}
{"backend": "metal", "budget_sec": 20, "commit": "b6240da-dirty", "correctness": true, "description": "Metal dynamic Jacobian DP stream with runtime dp_bits=8 mask", "distance_tracking": "dp_stream_uint32", "dp_bits": 8, "dp_capacity": 16384, "dp_checksum": "0xab1c2cd29cd70a84", "dp_count": 61, "dp_distance_checksum": "0x822e141de4770a0b", "dp_stream_overflow": false, "dp_tracking": "projective_x_limb0", "emitted_records": 61, "experiment": "metal_jacobian_dynamic_dp_stream_dp8", "iterations": 6553600, "jump_count": 16, "jump_histogram_max_bucket": 8336, "jump_histogram_max_deviation_ppm": 17578, "jump_histogram_min_bucket": 8082, "jump_index": "power2_mask", "jump_mixer": "avalanche64", "machine": "macOS-26.5-arm64-arm-64bit-Mach-O", "max_threads_per_threadgroup": 1024, "min_ms": 200, "operation": "jacobian_affine_walk_dynamic_dp_stream", "ops_per_sec": 32233487.865141, "ops_per_sec_max": 53615043.29436, "ops_per_sec_min": 31206309.497131, "output_bytes_per_record": 16, "output_bytes_total": 976, "output_layout": "dp_stream", "paired_baseline_ops_per_sec": 38353440.458919, "paired_baseline_ref": "main", "paired_speedup": 0.8404327611669367, "reason": "", "runner_sample_count": 3, "sample_count": 16384, "seconds": 0.203317, "skipped": false, "status": "discard", "steps_per_sample": 8, "thread_execution_width": 32, "threadgroup_limit": 256, "threads_per_threadgroup": 256, "timestamp": "2026-06-22T10:11:10Z"}
{"backend": "metal", "budget_sec": 120, "commit": "cdd860d-dirty", "correctness": true, "description": "Metal dynamic Jacobian DP stream with runtime dp_bits=8 mask", "distance_tracking": "dp_stream_uint64", "dp_bits": 8, "dp_capacity": 16384, "dp_checksum": "0xab1c2cd29cd70a84", "dp_count": 61, "dp_distance_checksum": "0x822e141de4770a0b", "dp_stream_overflow": false, "dp_tracking": "projective_x_limb0", "emitted_records": 61, "experiment": "metal_jacobian_dynamic_dp_stream_dp8", "iterations": 11141120, "jump_count": 16, "jump_histogram_max_bucket": 8336, "jump_histogram_max_deviation_ppm": 17578, "jump_histogram_min_bucket": 8082, "jump_index": "power2_mask", "jump_mixer": "avalanche64", "machine": "macOS-26.5-arm64-arm-64bit-Mach-O", "max_threads_per_threadgroup": 1024, "min_ms": 200, "operation": "jacobian_affine_walk_dynamic_dp_stream", "ops_per_sec": 55340023.527875, "ops_per_sec_max": 55936507.62711, "ops_per_sec_min": 40201575.992859, "output_bytes_per_record": 20, "output_bytes_total": 1220, "output_layout": "dp_stream", "paired_baseline_ops_per_sec": 35628876.688184, "paired_baseline_ref": "main", "paired_speedup": 1.5532351472149561, "reason": "", "runner_sample_count": 3, "sample_count": 16384, "seconds": 0.201321, "skipped": false, "status": "keep", "steps_per_sample": 8, "thread_execution_width": 32, "threadgroup_limit": 256, "threads_per_threadgroup": 256, "timestamp": "2026-06-22T10:17:52Z"}
{"backend": "metal", "budget_sec": 120, "commit": "e563523-dirty", "correctness": true, "description": "Metal dynamic Jacobian jump walk with sparse distinguished-point stream emission", "distance_tracking": "dp_stream_uint64", "dp_bits": 4, "dp_capacity": 16384, "dp_checksum": "0xbfd3b2319760e774", "dp_count": 1017, "dp_distance_checksum": "0x19e43ca50eec2a74", "dp_stream_overflow": false, "dp_tracking": "projective_x_limb0", "emitted_records": 1017, "experiment": "metal_jacobian_dynamic_dp_stream", "iterations": 6291456, "jump_count": 16, "jump_histogram_max_bucket": 8336, "jump_histogram_max_deviation_ppm": 17578, "jump_histogram_min_bucket": 8082, "jump_index": "power2_mask", "jump_mixer": "avalanche64", "machine": "macOS-26.5-arm64-arm-64bit-Mach-O", "max_threads_per_threadgroup": 1024, "min_ms": 200, "operation": "jacobian_affine_walk_dynamic_dp_stream", "ops_per_sec": 31405650.680564, "ops_per_sec_max": 58509134.530611, "ops_per_sec_min": 27107472.594526, "output_bytes_per_record": 20, "output_bytes_total": 20340, "output_layout": "dp_stream", "paired_baseline_ops_per_sec": 41006978.823522, "paired_baseline_ref": "main", "paired_speedup": 0.7658611188042318, "reason": "", "runner_sample_count": 3, "sample_count": 16384, "seconds": 0.200329, "skipped": false, "status": "discard", "steps_per_sample": 8, "thread_execution_width": 32, "threadgroup_limit": 256, "threads_per_threadgroup": 256, "timestamp": "2026-06-22T10:22:31Z"}
