{"affine_scan_mode": "cpu_batch_prod_zz_zzz", "affine_scan_seconds": 0.014552, "backend": "metal", "budget_sec": 180, "bytes_per_target": 2.683818, "candidate_verification": "tag16_hash_filter_then_cpu_exact_key_equality", "commit": "5cfda6b-dirty", "confirmation_index": 2, "confirmation_runs": 2, "confirmation_status": "discard", "cooldown_sec": 10.0, "correctness": true, "description": "Metal XYZZ affine DP scan tag16 hash-filter 25M-target repeat-mode lookup with host reuse of repeated DP query hashes", "distance_tracking": "packet_distance_uint64", "dp_bits": 8, "dp_checksum": "0x9dba4a07ebbb8e14", "dp_count": 1057, "dp_distance_checksum": "0xf0dc88ed68b2ff64", "dp_query_count": 1057, "dp_tracking": "affine_x256_y_parity_cpu_batch", "exact_host_table_bytes": 1268635456, "experiment": "metal_jacobian_dynamic_dp_stream_xyzz_affine_scan_target_lookup_tag16_hash_filter25m_repeat_mode2048", "filter_false_positive_count": 2048, "filter_positive_count": 133120, "gpu_lookup_lookups_per_sec": 149737912.860998, "gpu_ops_per_sec": 123927362.681047, "hit_count": 131072, "injected_hits": 64, "iterations": 134217728, "jump_count": 16, "jump_histogram_max_bucket": 8394316, "jump_histogram_max_deviation_ppm": 759, "jump_histogram_min_bucket": 8382245, "jump_index": "power2_mask", "jump_mixer": "avalanche64", "jump_schedule": "power2", "lookup_engine": "gpu_filter16_hash", "lookup_engine_effective": "gpu_filter16_hash", "lookup_exact_seconds": 0.006472, "lookup_gpu_seconds": 0.014457, "lookup_hash_seconds": 0.000686, "lookup_layout": "open_address_tag16_hash_filter_exact256", "lookup_max_threads_per_threadgroup": 1024, "lookup_query_mode": "repeat", "lookup_repeat": 2048, "lookup_seconds": 0.021614, "lookup_thread_execution_width": 32, "lookup_threadgroup_limit": 512, "lookup_threads_per_threadgroup": 512, "lookups_per_sec": 100152806.017785, "lookups_per_sec_max": 144247225.517694, "lookups_per_sec_min": 62986660.387988, "machine": "macOS-26.5-arm64-arm-64bit-Mach-O", "max_threads_per_threadgroup": 1024, "min_ms": 500, "miss_count": 2033664, "operation": "jacobian_affine_scan_target_lookup_tag32", "ops_per_sec": 100152806.017785, "ops_per_sec_max": 144247225.517694, "ops_per_sec_min": 62986660.387988, "output_layout": "affine_dp_scan_target_lookup", "paired_baseline_ops_per_sec": 57097018.715837, "paired_baseline_ref": "HEAD", "paired_speedup": 1.7540811809497439, "query_count": 2164736, "query_input": "hash64", "raw_status": "keep", "reason": "", "requested_hits": 64, "runner_sample_count": 3, "sample_count": 262144, "seconds": 1.083035, "skipped": false, "state_layout": "xyzz", "status": "discard", "steps_per_sample": 512, "target_bucket_bytes": 268435456, "target_count": 25005000, "target_filter_bucket_bytes": 67108864, "target_key": "x256_y_parity", "target_key_bytes": 1000200000, "target_lookup_checksum": "0x5b746bd07e35a252", "target_query_hash_bytes": 17317888, "target_table_buckets": 33554432, "target_table_bytes": 67108864, "thread_execution_width": 32, "threadgroup_limit": 128, "threads_per_threadgroup": 128, "timestamp": "2026-06-27T22:52:20Z", "validation_seconds": 4.103384, "validation_workers": 8}
{"affine_scan_mode": "cpu_batch_prod_zz_zzz", "affine_scan_seconds": 0.015086, "backend": "metal", "budget_sec": 180, "bytes_per_target": 2.683818, "candidate_verification": "tag16_hash_filter_then_cpu_exact_key_equality", "commit": "6a91b2d-dirty", "confirmation_index": 1, "confirmation_runs": 2, "confirmation_status": "discard", "cooldown_sec": 10.0, "correctness": true, "description": "Metal XYZZ affine DP scan repeat-mode tag16 hash-filter 25M-target GPU lookup threadgroup 768 versus 512", "distance_tracking": "packet_distance_uint64", "dp_bits": 8, "dp_checksum": "0x9dba4a07ebbb8e14", "dp_count": 1057, "dp_distance_checksum": "0xf0dc88ed68b2ff64", "dp_query_count": 1057, "dp_tracking": "affine_x256_y_parity_cpu_batch", "exact_host_table_bytes": 1268635456, "experiment": "metal_jacobian_dynamic_dp_stream_xyzz_affine_scan_target_lookup_tag16_hash_filter25m_repeat_mode2048_tg768_gpu_lookup", "filter_false_positive_count": 2048, "filter_positive_count": 133120, "gpu_lookup_lookups_per_sec": 89231127.530542, "gpu_lookup_lookups_per_sec_max": 95941498.774791, "gpu_lookup_lookups_per_sec_min": 65776288.435851, "gpu_ops_per_sec": 124366732.401525, "hit_count": 131072, "injected_hits": 64, "iterations": 134217728, "jump_count": 16, "jump_histogram_max_bucket": 8394316, "jump_histogram_max_deviation_ppm": 759, "jump_histogram_min_bucket": 8382245, "jump_index": "power2_mask", "jump_mixer": "avalanche64", "jump_schedule": "power2", "lookup_engine": "gpu_filter16_hash", "lookup_engine_effective": "gpu_filter16_hash", "lookup_exact_seconds": 0.006383, "lookup_gpu_seconds": 0.02426, "lookup_hash_seconds": 0.000778, "lookup_layout": "open_address_tag16_hash_filter_exact256", "lookup_max_threads_per_threadgroup": 1024, "lookup_query_mode": "repeat", "lookup_repeat": 2048, "lookup_seconds": 0.031421, "lookup_thread_execution_width": 32, "lookup_threadgroup_limit": 768, "lookup_threads_per_threadgroup": 768, "lookups_per_sec": 68893828.632483, "machine": "macOS-26.5-arm64-arm-64bit-Mach-O", "max_threads_per_threadgroup": 1024, "min_ms": 500, "miss_count": 2033664, "operation": "jacobian_affine_scan_target_lookup_tag32", "ops_per_sec": 89231127.530542, "ops_per_sec_max": 95941498.774791, "ops_per_sec_min": 65776288.435851, "output_layout": "affine_dp_scan_target_lookup", "paired_baseline_ops_per_sec": 123208709.647144, "paired_baseline_ref": "HEAD", "paired_speedup": 0.7242274331586622, "query_count": 2164736, "query_input": "hash64", "raw_status": "discard", "reason": "", "requested_hits": 64, "runner_sample_count": 3, "sample_count": 262144, "seconds": 1.079209, "skipped": false, "state_layout": "xyzz", "status": "discard", "steps_per_sample": 512, "target_bucket_bytes": 268435456, "target_count": 25005000, "target_filter_bucket_bytes": 67108864, "target_key": "x256_y_parity", "target_key_bytes": 1000200000, "target_lookup_checksum": "0x5b746bd07e35a252", "target_query_hash_bytes": 17317888, "target_table_buckets": 33554432, "target_table_bytes": 67108864, "thread_execution_width": 32, "threadgroup_limit": 128, "threads_per_threadgroup": 128, "timestamp": "2026-06-27T23:00:50Z", "validation_seconds": 4.37034, "validation_workers": 8}
{"affine_scan_mode": "cpu_batch_prod_zz_zzz", "affine_scan_seconds": 0.015706, "backend": "metal", "budget_sec": 180, "bytes_per_target": 2.683818, "candidate_verification": "tag16_hash_filter_then_cpu_exact_key_equality", "commit": "6a91b2d-dirty", "confirmation_index": 2, "confirmation_runs": 2, "confirmation_status": "discard", "cooldown_sec": 10.0, "correctness": true, "description": "Metal XYZZ affine DP scan repeat-mode tag16 hash-filter 25M-target GPU lookup threadgroup 768 versus 512", "distance_tracking": "packet_distance_uint64", "dp_bits": 8, "dp_checksum": "0x9dba4a07ebbb8e14", "dp_count": 1057, "dp_distance_checksum": "0xf0dc88ed68b2ff64", "dp_query_count": 1057, "dp_tracking": "affine_x256_y_parity_cpu_batch", "exact_host_table_bytes": 1268635456, "experiment": "metal_jacobian_dynamic_dp_stream_xyzz_affine_scan_target_lookup_tag16_hash_filter25m_repeat_mode2048_tg768_gpu_lookup", "filter_false_positive_count": 2048, "filter_positive_count": 133120, "gpu_lookup_lookups_per_sec": 167726637.169006, "gpu_lookup_lookups_per_sec_max": 252275711.195439, "gpu_lookup_lookups_per_sec_min": 79116130.329112, "gpu_ops_per_sec": 123955880.298492, "hit_count": 131072, "injected_hits": 64, "iterations": 134217728, "jump_count": 16, "jump_histogram_max_bucket": 8394316, "jump_histogram_max_deviation_ppm": 759, "jump_histogram_min_bucket": 8382245, "jump_index": "power2_mask", "jump_mixer": "avalanche64", "jump_schedule": "power2", "lookup_engine": "gpu_filter16_hash", "lookup_engine_effective": "gpu_filter16_hash", "lookup_exact_seconds": 0.004049, "lookup_gpu_seconds": 0.012906, "lookup_hash_seconds": 0.000919, "lookup_layout": "open_address_tag16_hash_filter_exact256", "lookup_max_threads_per_threadgroup": 1024, "lookup_query_mode": "repeat", "lookup_repeat": 2048, "lookup_seconds": 0.017874, "lookup_thread_execution_width": 32, "lookup_threadgroup_limit": 768, "lookup_threads_per_threadgroup": 768, "lookups_per_sec": 121108902.041608, "machine": "macOS-26.5-arm64-arm-64bit-Mach-O", "max_threads_per_threadgroup": 1024, "min_ms": 500, "miss_count": 2033664, "operation": "jacobian_affine_scan_target_lookup_tag32", "ops_per_sec": 167726637.169006, "ops_per_sec_max": 252275711.195439, "ops_per_sec_min": 79116130.329112, "output_layout": "affine_dp_scan_target_lookup", "paired_baseline_ops_per_sec": 79346311.916685, "paired_baseline_ref": "HEAD", "paired_speedup": 2.1138554914199648, "query_count": 2164736, "query_input": "hash64", "raw_status": "keep", "reason": "", "requested_hits": 64, "runner_sample_count": 3, "sample_count": 262144, "seconds": 1.082786, "skipped": false, "state_layout": "xyzz", "status": "discard", "steps_per_sample": 512, "target_bucket_bytes": 268435456, "target_count": 25005000, "target_filter_bucket_bytes": 67108864, "target_key": "x256_y_parity", "target_key_bytes": 1000200000, "target_lookup_checksum": "0x5b746bd07e35a252", "target_query_hash_bytes": 17317888, "target_table_buckets": 33554432, "target_table_bytes": 67108864, "thread_execution_width": 32, "threadgroup_limit": 128, "threads_per_threadgroup": 128, "timestamp": "2026-06-27T23:00:50Z", "validation_seconds": 3.793454, "validation_workers": 8}
{"affine_scan_mode": "cpu_batch_prod_zz_zzz", "affine_scan_seconds": 0.008168, "backend": "metal", "budget_sec": 180, "commit": "003a78c-dirty", "confirmation_index": 1, "confirmation_runs": 2, "confirmation_status": "keep", "cooldown_sec": 0.0, "correctness": true, "description": "Metal XYZZ 512-step packet walk with GPU per-walker distances and CPU batched affine DP scan", "distance_tracking": "packet_distance_uint64", "dp_bits": 8, "dp_checksum": "0x9dba4a07ebbb8e14", "dp_count": 1057, "dp_distance_checksum": "0xf0dc88ed68b2ff64", "dp_tracking": "affine_x_limb0_cpu_batch", "experiment": "metal_jacobian_dynamic_dp_stream_xyzz_affine_scan_steps512", "gpu_ops_per_sec": 124032313.258193, "iterations": 134217728, "jump_count": 16, "jump_histogram_max_bucket": 8394316, "jump_histogram_max_deviation_ppm": 759, "jump_histogram_min_bucket": 8382245, "jump_index": "power2_mask", "jump_mixer": "avalanche64", "jump_schedule": "power2", "machine": "macOS-26.5-arm64-arm-64bit-Mach-O", "max_threads_per_threadgroup": 1024, "min_ms": 500, "operation": "jacobian_affine_walk_dynamic_dp_stream_xyzz_affine_scan", "ops_per_sec": 123103088.658516, "ops_per_sec_max": 125459802.60685, "ops_per_sec_min": 121365619.59176, "output_layout": "affine_dp_scan", "paired_baseline_ops_per_sec": 119589154.173552, "paired_baseline_ref": "HEAD", "paired_speedup": 1.029383387726486, "raw_status": "keep", "reason": "", "runner_sample_count": 3, "sample_count": 262144, "seconds": 1.082119, "skipped": false, "state_layout": "xyzz", "status": "keep", "steps_per_sample": 512, "thread_execution_width": 32, "threadgroup_limit": 128, "threads_per_threadgroup": 128, "timestamp": "2026-06-27T23:39:11Z", "validation_seconds": 3.915345, "validation_workers": 8}
{"affine_scan_mode": "cpu_batch_prod_zz_zzz", "affine_scan_seconds": 0.010773, "backend": "metal", "budget_sec": 180, "commit": "003a78c-dirty", "confirmation_index": 2, "confirmation_runs": 2, "confirmation_status": "keep", "cooldown_sec": 0.0, "correctness": true, "description": "Metal XYZZ 512-step packet walk with GPU per-walker distances and CPU batched affine DP scan", "distance_tracking": "packet_distance_uint64", "dp_bits": 8, "dp_checksum": "0x9dba4a07ebbb8e14", "dp_count": 1057, "dp_distance_checksum": "0xf0dc88ed68b2ff64", "dp_tracking": "affine_x_limb0_cpu_batch", "experiment": "metal_jacobian_dynamic_dp_stream_xyzz_affine_scan_steps512", "gpu_ops_per_sec": 115619050.120309, "iterations": 134217728, "jump_count": 16, "jump_histogram_max_bucket": 8394316, "jump_histogram_max_deviation_ppm": 759, "jump_histogram_min_bucket": 8382245, "jump_index": "power2_mask", "jump_mixer": "avalanche64", "jump_schedule": "power2", "machine": "macOS-26.5-arm64-arm-64bit-Mach-O", "max_threads_per_threadgroup": 1024, "min_ms": 500, "operation": "jacobian_affine_walk_dynamic_dp_stream_xyzz_affine_scan", "ops_per_sec": 114555979.28206, "ops_per_sec_max": 115741057.122999, "ops_per_sec_min": 111835327.150637, "output_layout": "affine_dp_scan", "paired_baseline_ops_per_sec": 103616298.999303, "paired_baseline_ref": "HEAD", "paired_speedup": 1.1055787592146153, "raw_status": "keep", "reason": "", "runner_sample_count": 3, "sample_count": 262144, "seconds": 1.160862, "skipped": false, "state_layout": "xyzz", "status": "keep", "steps_per_sample": 512, "thread_execution_width": 32, "threadgroup_limit": 128, "threads_per_threadgroup": 128, "timestamp": "2026-06-27T23:39:11Z", "validation_seconds": 4.26451, "validation_workers": 8}
{"affine_scan_mode": "cpu_batch_split_zz_sparse_zzz", "affine_scan_seconds": 0.011749, "backend": "metal", "budget_sec": 180, "commit": "5d963d1-dirty", "confirmation_index": 1, "confirmation_runs": 2, "confirmation_status": "discard", "cooldown_sec": 0.0, "correctness": true, "description": "Metal XYZZ 512-step packet walk with GPU per-walker distances and CPU batched affine DP scan", "distance_tracking": "packet_distance_uint64", "dp_bits": 8, "dp_checksum": "0x9dba4a07ebbb8e14", "dp_count": 1057, "dp_distance_checksum": "0xf0dc88ed68b2ff64", "dp_tracking": "affine_x_limb0_cpu_batch", "experiment": "metal_jacobian_dynamic_dp_stream_xyzz_affine_scan_steps512", "gpu_ops_per_sec": 126831550.000242, "iterations": 134217728, "jump_count": 16, "jump_histogram_max_bucket": 8394316, "jump_histogram_max_deviation_ppm": 759, "jump_histogram_min_bucket": 8382245, "jump_index": "power2_mask", "jump_mixer": "avalanche64", "jump_schedule": "power2", "machine": "macOS-26.5-arm64-arm-64bit-Mach-O", "max_threads_per_threadgroup": 1024, "min_ms": 500, "operation": "jacobian_affine_walk_dynamic_dp_stream_xyzz_affine_scan", "ops_per_sec": 125438897.308717, "ops_per_sec_max": 127371020.798419, "ops_per_sec_min": 124949921.552008, "output_layout": "affine_dp_scan", "paired_baseline_ops_per_sec": 123189340.96161, "paired_baseline_ref": "HEAD", "paired_speedup": 1.018260965839634, "raw_status": "keep", "reason": "", "runner_sample_count": 3, "sample_count": 262144, "seconds": 1.058236, "skipped": false, "state_layout": "xyzz", "status": "discard", "steps_per_sample": 512, "thread_execution_width": 32, "threadgroup_limit": 128, "threads_per_threadgroup": 128, "timestamp": "2026-06-27T23:51:15Z", "validation_seconds": 4.044463, "validation_workers": 8}
{"affine_scan_mode": "cpu_batch_split_zz_sparse_zzz", "affine_scan_seconds": 0.012711, "backend": "metal", "budget_sec": 180, "commit": "5d963d1-dirty", "confirmation_index": 2, "confirmation_runs": 2, "confirmation_status": "discard", "cooldown_sec": 0.0, "correctness": true, "description": "Metal XYZZ 512-step packet walk with GPU per-walker distances and CPU batched affine DP scan", "distance_tracking": "packet_distance_uint64", "dp_bits": 8, "dp_checksum": "0x9dba4a07ebbb8e14", "dp_count": 1057, "dp_distance_checksum": "0xf0dc88ed68b2ff64", "dp_tracking": "affine_x_limb0_cpu_batch", "experiment": "metal_jacobian_dynamic_dp_stream_xyzz_affine_scan_steps512", "gpu_ops_per_sec": 100730943.098792, "iterations": 134217728, "jump_count": 16, "jump_histogram_max_bucket": 8394316, "jump_histogram_max_deviation_ppm": 759, "jump_histogram_min_bucket": 8382245, "jump_index": "power2_mask", "jump_mixer": "avalanche64", "jump_schedule": "power2", "machine": "macOS-26.5-arm64-arm-64bit-Mach-O", "max_threads_per_threadgroup": 1024, "min_ms": 500, "operation": "jacobian_affine_walk_dynamic_dp_stream_xyzz_affine_scan", "ops_per_sec": 99779103.449835, "ops_per_sec_max": 113421818.711267, "ops_per_sec_min": 98340223.318748, "output_layout": "affine_dp_scan", "paired_baseline_ops_per_sec": 102551705.591218, "paired_baseline_ref": "HEAD", "paired_speedup": 0.9729638612502958, "raw_status": "discard", "reason": "", "runner_sample_count": 3, "sample_count": 262144, "seconds": 1.332438, "skipped": false, "state_layout": "xyzz", "status": "discard", "steps_per_sample": 512, "thread_execution_width": 32, "threadgroup_limit": 128, "threads_per_threadgroup": 128, "timestamp": "2026-06-27T23:51:15Z", "validation_seconds": 4.32824, "validation_workers": 8}
{"affine_scan_mode": "cpu_batch_prod_zz_zzz", "affine_scan_seconds": 0.006663, "backend": "metal", "budget_sec": 240, "commit": "ac3b27a-dirty", "confirmation_index": 1, "confirmation_runs": 2, "confirmation_status": "keep", "cooldown_sec": 10.0, "correctness": true, "description": "Metal XYZZ 1024-step packet walk with dp_bits=7 affine scan versus the accepted 512-step dp8 cadence", "distance_tracking": "packet_distance_uint64", "dp_bits": 7, "dp_checksum": "0x08b06faea04109e6", "dp_count": 1999, "dp_distance_checksum": "0x33b34eda684bc0e5", "dp_tracking": "affine_x_limb0_cpu_batch", "experiment": "metal_jacobian_dynamic_dp_stream_xyzz_affine_scan_steps1024_dp7", "gpu_ops_per_sec": 128381300.086443, "iterations": 268435456, "jump_count": 16, "jump_histogram_max_bucket": 16782744, "jump_histogram_max_deviation_ppm": 389, "jump_histogram_min_bucket": 16770687, "jump_index": "power2_mask", "jump_mixer": "avalanche64", "jump_schedule": "power2", "machine": "macOS-26.5-arm64-arm-64bit-Mach-O", "max_threads_per_threadgroup": 1024, "min_ms": 500, "operation": "jacobian_affine_walk_dynamic_dp_stream_xyzz_affine_scan", "ops_per_sec": 127973480.593162, "ops_per_sec_max": 128058444.947777, "ops_per_sec_min": 126330018.563081, "output_layout": "affine_dp_scan", "paired_baseline_ops_per_sec": 125609000.001448, "paired_baseline_ref": "HEAD", "paired_speedup": 1.018824133554815, "raw_status": "keep", "reason": "", "runner_sample_count": 3, "sample_count": 262144, "seconds": 2.090923, "skipped": false, "state_layout": "xyzz", "status": "keep", "steps_per_sample": 1024, "thread_execution_width": 32, "threadgroup_limit": 128, "threads_per_threadgroup": 128, "timestamp": "2026-06-28T00:05:44Z", "validation_seconds": 7.501944, "validation_workers": 8}
{"affine_scan_mode": "cpu_batch_prod_zz_zzz", "affine_scan_seconds": 0.005158, "backend": "metal", "budget_sec": 240, "commit": "ac3b27a-dirty", "confirmation_index": 2, "confirmation_runs": 2, "confirmation_status": "keep", "cooldown_sec": 10.0, "correctness": true, "description": "Metal XYZZ 1024-step packet walk with dp_bits=7 affine scan versus the accepted 512-step dp8 cadence", "distance_tracking": "packet_distance_uint64", "dp_bits": 7, "dp_checksum": "0x08b06faea04109e6", "dp_count": 1999, "dp_distance_checksum": "0x33b34eda684bc0e5", "dp_tracking": "affine_x_limb0_cpu_batch", "experiment": "metal_jacobian_dynamic_dp_stream_xyzz_affine_scan_steps1024_dp7", "gpu_ops_per_sec": 128030168.668919, "iterations": 268435456, "jump_count": 16, "jump_histogram_max_bucket": 16782744, "jump_histogram_max_deviation_ppm": 389, "jump_histogram_min_bucket": 16770687, "jump_index": "power2_mask", "jump_mixer": "avalanche64", "jump_schedule": "power2", "machine": "macOS-26.5-arm64-arm-64bit-Mach-O", "max_threads_per_threadgroup": 1024, "min_ms": 500, "operation": "jacobian_affine_walk_dynamic_dp_stream_xyzz_affine_scan", "ops_per_sec": 127715945.975739, "ops_per_sec_max": 128068131.093762, "ops_per_sec_min": 127610292.964331, "output_layout": "affine_dp_scan", "paired_baseline_ops_per_sec": 124991147.125391, "paired_baseline_ref": "HEAD", "paired_speedup": 1.021799934739494, "raw_status": "keep", "reason": "", "runner_sample_count": 3, "sample_count": 262144, "seconds": 2.096658, "skipped": false, "state_layout": "xyzz", "status": "keep", "steps_per_sample": 1024, "thread_execution_width": 32, "threadgroup_limit": 128, "threads_per_threadgroup": 128, "timestamp": "2026-06-28T00:05:44Z", "validation_seconds": 7.74923, "validation_workers": 8}
{"affine_scan_mode": "cpu_batch_prod_zz_zzz", "affine_scan_seconds": 0.008776, "backend": "metal", "budget_sec": 240, "commit": "b54ff56-dirty", "confirmation_index": 1, "confirmation_runs": 2, "confirmation_status": "discard", "cooldown_sec": 10.0, "correctness": true, "description": "Metal XYZZ 1024-step dp7 affine scan with 64-thread groups versus the default 128-thread cadence", "distance_tracking": "packet_distance_uint64", "dp_bits": 7, "dp_checksum": "0x08b06faea04109e6", "dp_count": 1999, "dp_distance_checksum": "0x33b34eda684bc0e5", "dp_tracking": "affine_x_limb0_cpu_batch", "experiment": "metal_jacobian_dynamic_dp_stream_xyzz_affine_scan_steps1024_dp7_tg64", "gpu_ops_per_sec": 99951319.338754, "iterations": 268435456, "jump_count": 16, "jump_histogram_max_bucket": 16782744, "jump_histogram_max_deviation_ppm": 389, "jump_histogram_min_bucket": 16770687, "jump_index": "power2_mask", "jump_mixer": "avalanche64", "jump_schedule": "power2", "machine": "macOS-26.5-arm64-arm-64bit-Mach-O", "max_threads_per_threadgroup": 1024, "min_ms": 500, "operation": "jacobian_affine_walk_dynamic_dp_stream_xyzz_affine_scan", "ops_per_sec": 99625768.379018, "ops_per_sec_max": 125222994.257887, "ops_per_sec_min": 57652397.131098, "output_layout": "affine_dp_scan", "paired_baseline_ops_per_sec": 124916919.058623, "paired_baseline_ref": "HEAD", "paired_speedup": 0.7975362275166588, "raw_status": "discard", "reason": "", "runner_sample_count": 3, "sample_count": 262144, "seconds": 2.685662, "skipped": false, "state_layout": "xyzz", "status": "discard", "steps_per_sample": 1024, "thread_execution_width": 32, "threadgroup_limit": 64, "threads_per_threadgroup": 64, "timestamp": "2026-06-28T18:41:27Z", "validation_seconds": 8.041879, "validation_workers": 8}
