{"affine_scan_mode": "cpu_batch_prod_zz_zzz", "affine_scan_seconds": 0.001581, "backend": "metal", "budget_sec": 240, "bytes_per_target": 4.0, "candidate_verification": "tag16_hash_filter_then_cpu_exact_key_equality", "commit": "ce7dc7b-dirty", "confirmation_index": 1, "confirmation_runs": 2, "confirmation_status": "keep", "cooldown_sec": 3.0, "correctness": true, "description": "Medium fixed-round 1M target lookup with physical distinct-miss queries; fast falsifier for setup-inclusive wall-clock kangaroo distance/sec", "distance_per_sec": 533301042944.60455, "distance_tracking": "packet_distance_uint64", "distinct_miss_source_seconds": 7e-06, "dp_bits": 6, "dp_checksum": "0xbd17120591af6f74", "dp_count": 1053, "dp_distance_checksum": "0x9eca239fc5687305", "dp_normalization": "host_batch_affine", "dp_query_count": 1053, "dp_sampling": "packet_endpoint", "dp_tracking": "affine_x256_y_parity_cpu_batch", "exact_host_table_bytes": 16779264, "experiment": "metal_jacobian_dynamic_dp_stream_xyzz_affine_scan_target_lookup_tag16_hash_filter1m_rounds_distinct_misses_distance", "filter_false_positive_count": 28, "filter_positive_count": 92, "gpu_distance_per_sec": 535515063396.23584, "gpu_lookup_lookups_per_sec": 403368889.174859, "gpu_ops_per_sec": 130742977.253983, "hit_count": 64, "injected_hits": 64, "iterations": 134217728, "jump_count": 16, "jump_histogram_max_bucket": 8393138, "jump_histogram_max_deviation_ppm": 707, "jump_histogram_min_bucket": 8382675, "jump_index": "power2_mask", "jump_mixer": "avalanche64", "jump_schedule": "power2", "lookup_buffer_seconds": 0.000908, "lookup_engine": "gpu_filter16_hash", "lookup_engine_effective": "gpu_filter16_hash", "lookup_exact_seconds": 8e-06, "lookup_gpu_seconds": 0.002673, "lookup_hash_seconds": 0.0, "lookup_layout": "open_address_tag16_hash_filter_exact256", "lookup_max_threads_per_threadgroup": 1024, "lookup_query_mode": "distinct_misses", "lookup_repeat": 1024, "lookup_seconds": 0.002681, "lookup_thread_execution_width": 32, "lookup_threadgroup_limit": 512, "lookup_threads_per_threadgroup": 512, "lookup_wall_seconds": 0.003589, "lookups_per_sec": 402165326.578063, "machine": "macOS-26.5-arm64-arm-64bit-Mach-O", "max_sample_spread_ratio": 1.5, "max_threads_per_threadgroup": 1024, "mean_jump_distance": 4095.9375, "min_ms": 0, "miss_count": 1078208, "operation": "jacobian_affine_scan_target_lookup_tag32_rounds", "ops_per_sec": 497866217610.3363, "ops_per_sec_max": 503611472985.0424, "ops_per_sec_min": 492056560846.8098, "output_layout": "affine_dp_scan_target_lookup", "paired_baseline_ops_per_sec": 468636086398.7213, "paired_baseline_ref": "HEAD", "paired_order": "alternate", "paired_speedup": 1.062372770812928, "physical_filter_positive_count": 92, "physical_query_count": 1078272, "query_count": 1078272, "query_input": "hash64_prefix_gpu_miss", "raw_status": "keep", "reason": "", "repeat_positive_index_encoding": "physical_query_index", "requested_hits": 32, "round_count": 2, "round_sample_build_seconds": 0.000626, "runner_sample_count": 3, "sample_count": 32768, "sample_metric": "setup_inclusive_wall_distance_per_sec", "sample_metric_values": [497866217610.3363, 492056560846.8098, 503611472985.0424], "sample_spread_ratio": 1.0234828941582388, "seconds": 1.026577, "setup_inclusive_distance_per_sec": 515558163982.0852, "setup_inclusive_ops_per_sec": 125870613.011572, "setup_inclusive_seconds": 1.066315, "setup_inclusive_wall_distance_per_sec": 497866217610.3363, "setup_inclusive_wall_distance_per_sec_max": 503611472985.0424, "setup_inclusive_wall_distance_per_sec_min": 492056560846.8098, "setup_inclusive_wall_ops_per_sec": 121551224.258265, "setup_inclusive_wall_seconds": 1.104207, "skipped": false, "state_layout": "xyzz", "status": "keep", "steps_per_sample": 2048, "target_bucket_bytes": 16777216, "target_build_seconds": 0.034843, "target_count": 1048576, "target_filter_bucket_bytes": 4194304, "target_filter_build_seconds": 0.0, "target_key": "x256_y_parity", "target_key_bytes": 2048, "target_lookup_checksum": "0xcb38405cd10f441d", "target_lookup_scope": "packet_endpoint_dp_keys", "target_query_hash_bytes": 8424, "target_setup_workers": 8, "target_table_buckets": 2097152, "target_table_bytes": 4194304, "thread_execution_width": 32, "threadgroup_limit": 128, "threads_per_threadgroup": 128, "timestamp": "2026-07-07T17:58:34Z", "validation_seconds": 3.929271, "validation_workers": 8, "walk_buffer_seconds": 0.036985, "walk_round_mode": "independent", "walk_wall_seconds": 1.063562}
{"affine_scan_mode": "cpu_batch_prod_zz_zzz", "affine_scan_seconds": 0.004452, "backend": "metal", "budget_sec": 240, "bytes_per_target": 4.0, "candidate_verification": "tag16_hash_filter_then_cpu_exact_key_equality", "commit": "ce7dc7b-dirty", "confirmation_index": 2, "confirmation_runs": 2, "confirmation_status": "keep", "cooldown_sec": 3.0, "correctness": true, "description": "Medium fixed-round 1M target lookup with physical distinct-miss queries; fast falsifier for setup-inclusive wall-clock kangaroo distance/sec", "distance_per_sec": 529613123176.2099, "distance_tracking": "packet_distance_uint64", "distinct_miss_source_seconds": 6e-06, "dp_bits": 6, "dp_checksum": "0xbd17120591af6f74", "dp_count": 1053, "dp_distance_checksum": "0x9eca239fc5687305", "dp_normalization": "host_batch_affine", "dp_query_count": 1053, "dp_sampling": "packet_endpoint", "dp_tracking": "affine_x256_y_parity_cpu_batch", "exact_host_table_bytes": 16779264, "experiment": "metal_jacobian_dynamic_dp_stream_xyzz_affine_scan_target_lookup_tag16_hash_filter1m_rounds_distinct_misses_distance", "filter_false_positive_count": 28, "filter_positive_count": 92, "gpu_distance_per_sec": 533292507378.4334, "gpu_lookup_lookups_per_sec": 399292268.200431, "gpu_ops_per_sec": 130200352.758906, "hit_count": 64, "injected_hits": 64, "iterations": 134217728, "jump_count": 16, "jump_histogram_max_bucket": 8393138, "jump_histogram_max_deviation_ppm": 707, "jump_histogram_min_bucket": 8382675, "jump_index": "power2_mask", "jump_mixer": "avalanche64", "jump_schedule": "power2", "lookup_buffer_seconds": 0.000862, "lookup_engine": "gpu_filter16_hash", "lookup_engine_effective": "gpu_filter16_hash", "lookup_exact_seconds": 9e-06, "lookup_gpu_seconds": 0.0027, "lookup_hash_seconds": 0.0, "lookup_layout": "open_address_tag16_hash_filter_exact256", "lookup_max_threads_per_threadgroup": 1024, "lookup_query_mode": "distinct_misses", "lookup_repeat": 1024, "lookup_seconds": 0.002709, "lookup_thread_execution_width": 32, "lookup_threadgroup_limit": 512, "lookup_threads_per_threadgroup": 512, "lookup_wall_seconds": 0.003572, "lookups_per_sec": 397984300.933108, "machine": "macOS-26.5-arm64-arm-64bit-Mach-O", "max_sample_spread_ratio": 1.5, "max_threads_per_threadgroup": 1024, "mean_jump_distance": 4095.9375, "min_ms": 0, "miss_count": 1078208, "operation": "jacobian_affine_scan_target_lookup_tag32_rounds", "ops_per_sec": 487706720145.6083, "ops_per_sec_max": 503440505431.98224, "ops_per_sec_min": 471074171982.17346, "output_layout": "affine_dp_scan_target_lookup", "paired_baseline_ops_per_sec": 466703126826.09863, "paired_baseline_ref": "HEAD", "paired_order": "alternate", "paired_speedup": 1.0450041838424107, "physical_filter_positive_count": 92, "physical_query_count": 1078272, "query_count": 1078272, "query_input": "hash64_prefix_gpu_miss", "raw_status": "keep", "reason": "", "repeat_positive_index_encoding": "physical_query_index", "requested_hits": 32, "round_count": 2, "round_sample_build_seconds": 0.001392, "runner_sample_count": 3, "sample_count": 32768, "sample_metric": "setup_inclusive_wall_distance_per_sec", "sample_metric_values": [503440505431.98224, 487706720145.6083, 471074171982.17346], "sample_spread_ratio": 1.0687075101435057, "seconds": 1.030855, "setup_inclusive_distance_per_sec": 510425776196.99457, "setup_inclusive_ops_per_sec": 124617569.530051, "setup_inclusive_seconds": 1.077037, "setup_inclusive_wall_distance_per_sec": 487706720145.6083, "setup_inclusive_wall_distance_per_sec_max": 503440505431.98224, "setup_inclusive_wall_distance_per_sec_min": 471074171982.17346, "setup_inclusive_wall_ops_per_sec": 119070840.349885, "setup_inclusive_wall_seconds": 1.127209, "skipped": false, "state_layout": "xyzz", "status": "keep", "steps_per_sample": 2048, "target_bucket_bytes": 16777216, "target_build_seconds": 0.037622, "target_count": 1048576, "target_filter_bucket_bytes": 4194304, "target_filter_build_seconds": 0.0, "target_key": "x256_y_parity", "target_key_bytes": 2048, "target_lookup_checksum": "0xcb38405cd10f441d", "target_lookup_scope": "packet_endpoint_dp_keys", "target_query_hash_bytes": 8424, "target_setup_workers": 8, "target_table_buckets": 2097152, "target_table_bytes": 4194304, "thread_execution_width": 32, "threadgroup_limit": 128, "threads_per_threadgroup": 128, "timestamp": "2026-07-07T17:58:35Z", "validation_seconds": 3.924467, "validation_workers": 8, "walk_buffer_seconds": 0.04931, "walk_round_mode": "independent", "walk_wall_seconds": 1.080165}
{"affine_scan_mode": "cpu_batch_prod_zz_zzz", "affine_scan_seconds": 0.006249, "backend": "metal", "budget_sec": 720, "bytes_per_target": 2.683818, "candidate_verification": "tag16_hash_filter_then_cpu_exact_key_equality", "commit": "ce7dc7b-dirty", "confirmation_index": 1, "confirmation_runs": 2, "confirmation_status": "discard", "cooldown_sec": 10.0, "correctness": true, "description": "Fixed-round 25M target lookup with physical distinct-miss queries; scores setup-inclusive wall-clock kangaroo distance/sec", "distance_per_sec": 466716040641.4003, "distance_tracking": "packet_distance_uint64", "distinct_miss_source_seconds": 1.4e-05, "dp_bits": 6, "dp_checksum": "0x7f111e78c67b5c18", "dp_count": 4121, "dp_distance_checksum": "0x894123b96acf0de5", "dp_normalization": "host_batch_affine", "dp_query_count": 4121, "dp_sampling": "packet_endpoint", "dp_tracking": "affine_x256_y_parity_cpu_batch", "exact_host_table_bytes": 268439552, "experiment": "metal_jacobian_dynamic_dp_stream_xyzz_affine_scan_target_lookup_tag16_hash_filter25m_rounds_distinct_misses_distance", "filter_false_positive_count": 412, "filter_positive_count": 540, "gpu_distance_per_sec": 469373400679.0881, "gpu_lookup_lookups_per_sec": 209297711.83791, "gpu_ops_per_sec": 114594863.979025, "hit_count": 128, "injected_hits": 128, "iterations": 536870912, "jump_count": 16, "jump_histogram_max_bucket": 33562777, "jump_histogram_max_deviation_ppm": 249, "jump_histogram_min_bucket": 33546500, "jump_index": "power2_mask", "jump_mixer": "avalanche64", "jump_schedule": "power2", "lookup_buffer_seconds": 0.001487, "lookup_engine": "gpu_filter16_hash", "lookup_engine_effective": "gpu_filter16_hash", "lookup_exact_seconds": 0.000263, "lookup_gpu_seconds": 0.020162, "lookup_hash_seconds": 0.0, "lookup_layout": "open_address_tag16_hash_filter_exact256", "lookup_max_threads_per_threadgroup": 1024, "lookup_query_mode": "distinct_misses", "lookup_repeat": 1024, "lookup_seconds": 0.020425, "lookup_thread_execution_width": 32, "lookup_threadgroup_limit": 512, "lookup_threads_per_threadgroup": 512, "lookup_wall_seconds": 0.021913, "lookups_per_sec": 206600629.010414, "machine": "macOS-26.5-arm64-arm-64bit-Mach-O", "max_sample_spread_ratio": 1.5, "max_threads_per_threadgroup": 1024, "mean_jump_distance": 4095.9375, "min_ms": 0, "miss_count": 4219776, "operation": "jacobian_affine_scan_target_lookup_tag32_rounds", "ops_per_sec": 409115206575.59717, "ops_per_sec_max": 464043220084.7003, "ops_per_sec_min": 293796944332.30566, "output_layout": "affine_dp_scan_target_lookup", "paired_baseline_ops_per_sec": 423630291377.9489, "paired_baseline_ref": "HEAD", "paired_order": "alternate", "paired_speedup": 0.9657364331640726, "physical_filter_positive_count": 540, "physical_query_count": 4219904, "query_count": 4219904, "query_input": "hash64_prefix_gpu_miss", "raw_status": "discard", "reason": "sample spread ratio 1.579469 exceeds max 1.500000", "repeat_positive_index_encoding": "physical_query_index", "requested_hits": 64, "round_count": 2, "round_sample_build_seconds": 0.003114, "runner_sample_count": 3, "sample_count": 131072, "sample_metric": "setup_inclusive_wall_distance_per_sec", "sample_metric_values": [409115206575.59717, 464043220084.7003, 293796944332.30566], "sample_spread_ratio": 1.5794691845393523, "seconds": 4.684947, "setup_inclusive_distance_per_sec": 412758663609.02893, "setup_inclusive_ops_per_sec": 100772695.776981, "setup_inclusive_seconds": 5.327543, "setup_inclusive_wall_distance_per_sec": 409115206575.59717, "setup_inclusive_wall_distance_per_sec_max": 464043220084.7003, "setup_inclusive_wall_distance_per_sec_min": 293796944332.30566, "setup_inclusive_wall_ops_per_sec": 99883166.326536, "setup_inclusive_wall_seconds": 5.374989, "skipped": false, "state_layout": "xyzz", "status": "discard", "steps_per_sample": 2048, "target_bucket_bytes": 268435456, "target_build_seconds": 0.612793, "target_count": 25005000, "target_filter_bucket_bytes": 67108864, "target_filter_build_seconds": 0.0, "target_key": "x256_y_parity", "target_key_bytes": 4096, "target_lookup_checksum": "0x5c90bdf7f12141b9", "target_lookup_scope": "packet_endpoint_dp_keys", "target_query_hash_bytes": 32968, "target_setup_workers": 8, "target_table_buckets": 33554432, "target_table_bytes": 67108864, "thread_execution_width": 32, "threadgroup_limit": 128, "threads_per_threadgroup": 128, "timestamp": "2026-07-07T18:05:51Z", "validation_seconds": 17.864824, "validation_workers": 8, "walk_buffer_seconds": 0.045958, "walk_round_mode": "independent", "walk_wall_seconds": 4.730906}
{"affine_scan_mode": "cpu_batch_prod_zz_zzz", "affine_scan_seconds": 0.016178, "backend": "metal", "budget_sec": 720, "bytes_per_target": 2.683818, "candidate_verification": "tag16_hash_filter_then_cpu_exact_key_equality", "commit": "ce7dc7b-dirty", "confirmation_index": 2, "confirmation_runs": 2, "confirmation_status": "discard", "cooldown_sec": 10.0, "correctness": true, "description": "Fixed-round 25M target lookup with physical distinct-miss queries; scores setup-inclusive wall-clock kangaroo distance/sec", "distance_per_sec": 345160330488.5178, "distance_tracking": "packet_distance_uint64", "distinct_miss_source_seconds": 1.8e-05, "dp_bits": 6, "dp_checksum": "0x7f111e78c67b5c18", "dp_count": 4121, "dp_distance_checksum": "0x894123b96acf0de5", "dp_normalization": "host_batch_affine", "dp_query_count": 4121, "dp_sampling": "packet_endpoint", "dp_tracking": "affine_x256_y_parity_cpu_batch", "exact_host_table_bytes": 268439552, "experiment": "metal_jacobian_dynamic_dp_stream_xyzz_affine_scan_target_lookup_tag16_hash_filter25m_rounds_distinct_misses_distance", "filter_false_positive_count": 414, "filter_positive_count": 542, "gpu_distance_per_sec": 347234725796.1242, "gpu_lookup_lookups_per_sec": 194905731.836867, "gpu_ops_per_sec": 84775396.547463, "hit_count": 128, "injected_hits": 128, "iterations": 536870912, "jump_count": 16, "jump_histogram_max_bucket": 33562777, "jump_histogram_max_deviation_ppm": 249, "jump_histogram_min_bucket": 33546500, "jump_index": "power2_mask", "jump_mixer": "avalanche64", "jump_schedule": "power2", "lookup_buffer_seconds": 0.002189, "lookup_engine": "gpu_filter16_hash", "lookup_engine_effective": "gpu_filter16_hash", "lookup_exact_seconds": 0.000232, "lookup_gpu_seconds": 0.021651, "lookup_hash_seconds": 0.0, "lookup_layout": "open_address_tag16_hash_filter_exact256", "lookup_max_threads_per_threadgroup": 1024, "lookup_query_mode": "distinct_misses", "lookup_repeat": 1024, "lookup_seconds": 0.021883, "lookup_thread_execution_width": 32, "lookup_threadgroup_limit": 512, "lookup_threads_per_threadgroup": 512, "lookup_wall_seconds": 0.024072, "lookups_per_sec": 192842677.695203, "machine": "macOS-26.5-arm64-arm-64bit-Mach-O", "max_sample_spread_ratio": 1.5, "max_threads_per_threadgroup": 1024, "mean_jump_distance": 4095.9375, "min_ms": 0, "miss_count": 4219776, "operation": "jacobian_affine_scan_target_lookup_tag32_rounds", "ops_per_sec": 305030899028.5069, "ops_per_sec_max": 409739469919.7452, "ops_per_sec_min": 293292056682.1972, "output_layout": "affine_dp_scan_target_lookup", "paired_baseline_ops_per_sec": 301466537536.75256, "paired_baseline_ref": "HEAD", "paired_order": "alternate", "paired_speedup": 1.0118234067398602, "physical_filter_positive_count": 542, "physical_query_count": 4219904, "query_count": 4219904, "query_input": "hash64_prefix_gpu_miss", "raw_status": "keep", "reason": "", "repeat_positive_index_encoding": "physical_query_index", "requested_hits": 64, "round_count": 2, "round_sample_build_seconds": 0.00408, "runner_sample_count": 3, "sample_count": 131072, "sample_metric": "setup_inclusive_wall_distance_per_sec", "sample_metric_values": [293292056682.1972, 409739469919.7452, 305030899028.5069], "sample_spread_ratio": 1.397035687071904, "seconds": 6.332862, "setup_inclusive_distance_per_sec": 308840307403.7451, "setup_inclusive_ops_per_sec": 75401616.212099, "setup_inclusive_seconds": 7.120151, "setup_inclusive_wall_distance_per_sec": 305030899028.5069, "setup_inclusive_wall_distance_per_sec_max": 409739469919.7452, "setup_inclusive_wall_distance_per_sec_min": 293292056682.1972, "setup_inclusive_wall_ops_per_sec": 74471570.67912, "setup_inclusive_wall_seconds": 7.209072, "skipped": false, "state_layout": "xyzz", "status": "discard", "steps_per_sample": 2048, "target_bucket_bytes": 268435456, "target_build_seconds": 0.745131, "target_count": 25005000, "target_filter_bucket_bytes": 67108864, "target_filter_build_seconds": 0.0, "target_key": "x256_y_parity", "target_key_bytes": 4096, "target_lookup_checksum": "0x5c90bdf7f12141b9", "target_lookup_scope": "packet_endpoint_dp_keys", "target_query_hash_bytes": 32968, "target_setup_workers": 8, "target_table_buckets": 33554432, "target_table_bytes": 67108864, "thread_execution_width": 32, "threadgroup_limit": 128, "threads_per_threadgroup": 128, "timestamp": "2026-07-07T18:05:51Z", "validation_seconds": 21.098892, "validation_workers": 8, "walk_buffer_seconds": 0.086732, "walk_round_mode": "independent", "walk_wall_seconds": 6.419594}
