{"affine_scan_mode": "cpu_batch_prod_zz_zzz", "affine_scan_seconds": 0.123982, "backend": "metal", "budget_sec": 120, "bytes_per_target": 56.0, "candidate_verification": "tag32_prefilter_then_exact_key_equality", "commit": "c34aaf3-dirty", "confirmation_index": 2, "confirmation_runs": 2, "confirmation_status": "keep", "cooldown_sec": 0.0, "correctness": true, "description": "Metal XYZZ affine DP scan feeding exact tag32 multi-target lookup with a distinct-miss bulk query batch", "distance_tracking": "packet_distance_uint64", "dp_bits": 8, "dp_checksum": "0x9dba4a07ebbb8e14", "dp_count": 1057, "dp_distance_checksum": "0xf0dc88ed68b2ff64", "dp_query_count": 1057, "dp_tracking": "affine_x256_y_parity_cpu_batch", "exact_host_table_bytes": 58720256, "experiment": "metal_jacobian_dynamic_dp_stream_xyzz_affine_scan_target_lookup_tag32_distinct_misses1024", "filter_false_positive_count": 0, "filter_positive_count": 0, "gpu_lookup_lookups_per_sec": 61105278.35028, "gpu_ops_per_sec": 24189932.937223, "hit_count": 64, "injected_hits": 64, "iterations": 134217728, "jump_count": 16, "jump_histogram_max_bucket": 8394316, "jump_histogram_max_deviation_ppm": 759, "jump_histogram_min_bucket": 8382245, "jump_index": "power2_mask", "jump_mixer": "avalanche64", "jump_schedule": "power2", "lookup_engine": "gpu", "lookup_engine_effective": "gpu", "lookup_exact_seconds": 0.0, "lookup_gpu_seconds": 0.017713, "lookup_hash_seconds": 0.0, "lookup_layout": "open_address_tag32_index_exact256", "lookup_max_threads_per_threadgroup": 1024, "lookup_query_mode": "distinct_misses", "lookup_repeat": 1024, "lookup_seconds": 0.017713, "lookup_thread_execution_width": 32, "lookup_threadgroup_limit": 64, "lookup_threads_per_threadgroup": 64, "lookups_per_sec": 61105278.35028, "lookups_per_sec_max": 67990963.417217, "lookups_per_sec_min": 53623500.668803, "machine": "macOS-26.5-arm64-arm-64bit-Mach-O", "max_threads_per_threadgroup": 1024, "min_ms": 500, "miss_count": 1082304, "operation": "jacobian_affine_scan_target_lookup_tag32", "ops_per_sec": 61105278.35028, "ops_per_sec_max": 67990963.417217, "ops_per_sec_min": 53623500.668803, "output_layout": "affine_dp_scan_target_lookup", "paired_baseline_ops_per_sec": 42658539.548974, "paired_baseline_ref": "HEAD", "paired_speedup": 1.4324278092110556, "query_count": 1082368, "raw_status": "keep", "reason": "", "requested_hits": 64, "runner_sample_count": 3, "sample_count": 262144, "seconds": 5.548495, "skipped": false, "state_layout": "xyzz", "status": "keep", "steps_per_sample": 512, "target_bucket_bytes": 16777216, "target_count": 1048576, "target_filter_bucket_bytes": 0, "target_key": "x256_y_parity", "target_key_bytes": 41943040, "target_lookup_checksum": "0x8b2568562837af7f", "target_query_hash_bytes": 0, "target_table_buckets": 2097152, "target_table_bytes": 58720256, "thread_execution_width": 32, "threadgroup_limit": 128, "threads_per_threadgroup": 128, "timestamp": "2026-06-27T19:12:25Z", "validation_seconds": 11.824417, "validation_workers": 8}
{"affine_scan_mode": "cpu_batch_prod_zz_zzz", "affine_scan_seconds": 0.46837, "backend": "metal", "budget_sec": 120, "bytes_per_target": 56.0, "candidate_verification": "tag32_prefilter_then_exact_key_equality", "commit": "46f7054-dirty", "confirmation_index": 1, "confirmation_runs": 2, "confirmation_status": "discard", "cooldown_sec": 0.0, "correctness": true, "description": "Metal XYZZ affine DP scan feeding exact tag32 multi-target lookup with a distinct-miss bulk query batch", "distance_tracking": "packet_distance_uint64", "dp_bits": 8, "dp_checksum": "0x9dba4a07ebbb8e14", "dp_count": 1057, "dp_distance_checksum": "0xf0dc88ed68b2ff64", "dp_query_count": 1057, "dp_tracking": "affine_x256_y_parity_cpu_batch", "exact_host_table_bytes": 58720256, "experiment": "metal_jacobian_dynamic_dp_stream_xyzz_affine_scan_target_lookup_tag32_distinct_misses1024", "filter_false_positive_count": 0, "filter_positive_count": 0, "gpu_lookup_lookups_per_sec": 39470130.649849, "gpu_ops_per_sec": 15334426.049914, "hit_count": 64, "injected_hits": 64, "iterations": 134217728, "jump_count": 16, "jump_histogram_max_bucket": 8394316, "jump_histogram_max_deviation_ppm": 759, "jump_histogram_min_bucket": 8382245, "jump_index": "power2_mask", "jump_mixer": "avalanche64", "jump_schedule": "power2", "lookup_engine": "gpu", "lookup_engine_effective": "gpu", "lookup_exact_seconds": 0.0, "lookup_gpu_seconds": 0.027422, "lookup_hash_seconds": 0.0, "lookup_layout": "open_address_tag32_index_exact256", "lookup_max_threads_per_threadgroup": 1024, "lookup_query_mode": "distinct_misses", "lookup_repeat": 1024, "lookup_seconds": 0.027422, "lookup_thread_execution_width": 32, "lookup_threadgroup_limit": 64, "lookup_threads_per_threadgroup": 64, "lookups_per_sec": 39470130.649849, "lookups_per_sec_max": 77971741.179762, "lookups_per_sec_min": 31554538.431264, "machine": "macOS-26.5-arm64-arm-64bit-Mach-O", "max_threads_per_threadgroup": 1024, "min_ms": 500, "miss_count": 1082304, "operation": "jacobian_affine_scan_target_lookup_tag32", "ops_per_sec": 39470130.649849, "ops_per_sec_max": 77971741.179762, "ops_per_sec_min": 31554538.431264, "output_layout": "affine_dp_scan_target_lookup", "paired_baseline_ops_per_sec": 62278431.485371, "paired_baseline_ref": "HEAD", "paired_speedup": 0.6337688620035398, "query_count": 1082368, "raw_status": "discard", "reason": "", "requested_hits": 64, "runner_sample_count": 3, "sample_count": 262144, "seconds": 8.752706, "skipped": false, "state_layout": "xyzz", "status": "discard", "steps_per_sample": 512, "target_bucket_bytes": 16777216, "target_count": 1048576, "target_filter_bucket_bytes": 0, "target_key": "x256_y_parity", "target_key_bytes": 41943040, "target_lookup_checksum": "0x8b2568562837af7f", "target_query_hash_bytes": 0, "target_table_buckets": 2097152, "target_table_bytes": 58720256, "thread_execution_width": 32, "threadgroup_limit": 128, "threads_per_threadgroup": 128, "timestamp": "2026-06-27T19:24:31Z", "validation_seconds": 21.448718, "validation_workers": 8}
{"affine_scan_mode": "cpu_batch_prod_zz_zzz", "affine_scan_seconds": 0.046695, "backend": "metal", "budget_sec": 120, "bytes_per_target": 56.0, "candidate_verification": "tag32_prefilter_then_exact_key_equality", "commit": "46f7054-dirty", "confirmation_index": 2, "confirmation_runs": 2, "confirmation_status": "discard", "cooldown_sec": 0.0, "correctness": true, "description": "Metal XYZZ affine DP scan feeding exact tag32 multi-target lookup with a distinct-miss bulk query batch", "distance_tracking": "packet_distance_uint64", "dp_bits": 8, "dp_checksum": "0x9dba4a07ebbb8e14", "dp_count": 1057, "dp_distance_checksum": "0xf0dc88ed68b2ff64", "dp_query_count": 1057, "dp_tracking": "affine_x256_y_parity_cpu_batch", "exact_host_table_bytes": 58720256, "experiment": "metal_jacobian_dynamic_dp_stream_xyzz_affine_scan_target_lookup_tag32_distinct_misses1024", "filter_false_positive_count": 0, "filter_positive_count": 0, "gpu_lookup_lookups_per_sec": 50170407.826926, "gpu_ops_per_sec": 18737778.344363, "hit_count": 64, "injected_hits": 64, "iterations": 134217728, "jump_count": 16, "jump_histogram_max_bucket": 8394316, "jump_histogram_max_deviation_ppm": 759, "jump_histogram_min_bucket": 8382245, "jump_index": "power2_mask", "jump_mixer": "avalanche64", "jump_schedule": "power2", "lookup_engine": "gpu", "lookup_engine_effective": "gpu", "lookup_exact_seconds": 0.0, "lookup_gpu_seconds": 0.021574, "lookup_hash_seconds": 0.0, "lookup_layout": "open_address_tag32_index_exact256", "lookup_max_threads_per_threadgroup": 1024, "lookup_query_mode": "distinct_misses", "lookup_repeat": 1024, "lookup_seconds": 0.021574, "lookup_thread_execution_width": 32, "lookup_threadgroup_limit": 64, "lookup_threads_per_threadgroup": 64, "lookups_per_sec": 50170407.826926, "lookups_per_sec_max": 67101749.817889, "lookups_per_sec_min": 35414759.03984, "machine": "macOS-26.5-arm64-arm-64bit-Mach-O", "max_threads_per_threadgroup": 1024, "min_ms": 500, "miss_count": 1082304, "operation": "jacobian_affine_scan_target_lookup_tag32", "ops_per_sec": 50170407.826926, "ops_per_sec_max": 67101749.817889, "ops_per_sec_min": 35414759.03984, "output_layout": "affine_dp_scan_target_lookup", "paired_baseline_ops_per_sec": 31241567.175757, "paired_baseline_ref": "HEAD", "paired_speedup": 1.6058863995099935, "query_count": 1082368, "raw_status": "keep", "reason": "", "requested_hits": 64, "runner_sample_count": 3, "sample_count": 262144, "seconds": 7.162948, "skipped": false, "state_layout": "xyzz", "status": "discard", "steps_per_sample": 512, "target_bucket_bytes": 16777216, "target_count": 1048576, "target_filter_bucket_bytes": 0, "target_key": "x256_y_parity", "target_key_bytes": 41943040, "target_lookup_checksum": "0x8b2568562837af7f", "target_query_hash_bytes": 0, "target_table_buckets": 2097152, "target_table_bytes": 58720256, "thread_execution_width": 32, "threadgroup_limit": 128, "threads_per_threadgroup": 128, "timestamp": "2026-06-27T19:24:31Z", "validation_seconds": 16.545193, "validation_workers": 8}
{"affine_scan_mode": "cpu_batch_prod_zz_zzz", "affine_scan_seconds": 0.082382, "backend": "metal", "budget_sec": 120, "bytes_per_target": 56.0, "candidate_verification": "tag32_prefilter_then_exact_key_equality", "commit": "e5963a6-dirty", "confirmation_index": 1, "confirmation_runs": 2, "confirmation_status": "keep", "cooldown_sec": 0.0, "correctness": true, "description": "Metal XYZZ affine DP scan feeding exact tag32 multi-target lookup with a distinct-miss bulk query batch", "distance_tracking": "packet_distance_uint64", "dp_bits": 8, "dp_checksum": "0x9dba4a07ebbb8e14", "dp_count": 1057, "dp_distance_checksum": "0xf0dc88ed68b2ff64", "dp_query_count": 1057, "dp_tracking": "affine_x256_y_parity_cpu_batch", "exact_host_table_bytes": 58720256, "experiment": "metal_jacobian_dynamic_dp_stream_xyzz_affine_scan_target_lookup_tag32_distinct_misses1024", "filter_false_positive_count": 0, "filter_positive_count": 0, "gpu_lookup_lookups_per_sec": 44495886.454849, "gpu_ops_per_sec": 23483226.254838, "hit_count": 64, "injected_hits": 64, "iterations": 134217728, "jump_count": 16, "jump_histogram_max_bucket": 8394316, "jump_histogram_max_deviation_ppm": 759, "jump_histogram_min_bucket": 8382245, "jump_index": "power2_mask", "jump_mixer": "avalanche64", "jump_schedule": "power2", "lookup_engine": "gpu", "lookup_engine_effective": "gpu", "lookup_exact_seconds": 0.0, "lookup_gpu_seconds": 0.024325, "lookup_hash_seconds": 0.0, "lookup_layout": "open_address_tag32_index_exact256", "lookup_max_threads_per_threadgroup": 1024, "lookup_query_mode": "distinct_misses", "lookup_repeat": 1024, "lookup_seconds": 0.024325, "lookup_thread_execution_width": 32, "lookup_threadgroup_limit": 64, "lookup_threads_per_threadgroup": 64, "lookups_per_sec": 44495886.454849, "lookups_per_sec_max": 65961850.204156, "lookups_per_sec_min": 37910705.320384, "machine": "macOS-26.5-arm64-arm-64bit-Mach-O", "max_threads_per_threadgroup": 1024, "min_ms": 500, "miss_count": 1082304, "operation": "jacobian_affine_scan_target_lookup_tag32", "ops_per_sec": 44495886.454849, "ops_per_sec_max": 65961850.204156, "ops_per_sec_min": 37910705.320384, "output_layout": "affine_dp_scan_target_lookup", "paired_baseline_ops_per_sec": 33843081.152192, "paired_baseline_ref": "HEAD", "paired_speedup": 1.314770551024933, "query_count": 1082368, "raw_status": "keep", "reason": "", "requested_hits": 64, "runner_sample_count": 3, "sample_count": 262144, "seconds": 5.715472, "skipped": false, "state_layout": "xyzz", "status": "keep", "steps_per_sample": 512, "target_bucket_bytes": 16777216, "target_count": 1048576, "target_filter_bucket_bytes": 0, "target_key": "x256_y_parity", "target_key_bytes": 41943040, "target_lookup_checksum": "0x8b2568562837af7f", "target_query_hash_bytes": 0, "target_table_buckets": 2097152, "target_table_bytes": 58720256, "thread_execution_width": 32, "threadgroup_limit": 128, "threads_per_threadgroup": 128, "timestamp": "2026-06-27T19:39:08Z", "validation_seconds": 15.258049, "validation_workers": 8}
{"affine_scan_mode": "cpu_batch_prod_zz_zzz", "affine_scan_seconds": 0.087803, "backend": "metal", "budget_sec": 120, "bytes_per_target": 56.0, "candidate_verification": "tag32_prefilter_then_exact_key_equality", "commit": "e5963a6-dirty", "confirmation_index": 2, "confirmation_runs": 2, "confirmation_status": "keep", "cooldown_sec": 0.0, "correctness": true, "description": "Metal XYZZ affine DP scan feeding exact tag32 multi-target lookup with a distinct-miss bulk query batch", "distance_tracking": "packet_distance_uint64", "dp_bits": 8, "dp_checksum": "0x9dba4a07ebbb8e14", "dp_count": 1057, "dp_distance_checksum": "0xf0dc88ed68b2ff64", "dp_query_count": 1057, "dp_tracking": "affine_x256_y_parity_cpu_batch", "exact_host_table_bytes": 58720256, "experiment": "metal_jacobian_dynamic_dp_stream_xyzz_affine_scan_target_lookup_tag32_distinct_misses1024", "filter_false_positive_count": 0, "filter_positive_count": 0, "gpu_lookup_lookups_per_sec": 51322297.101063, "gpu_ops_per_sec": 19625247.445064, "hit_count": 64, "injected_hits": 64, "iterations": 134217728, "jump_count": 16, "jump_histogram_max_bucket": 8394316, "jump_histogram_max_deviation_ppm": 759, "jump_histogram_min_bucket": 8382245, "jump_index": "power2_mask", "jump_mixer": "avalanche64", "jump_schedule": "power2", "lookup_engine": "gpu", "lookup_engine_effective": "gpu", "lookup_exact_seconds": 0.0, "lookup_gpu_seconds": 0.02109, "lookup_hash_seconds": 0.0, "lookup_layout": "open_address_tag32_index_exact256", "lookup_max_threads_per_threadgroup": 1024, "lookup_query_mode": "distinct_misses", "lookup_repeat": 1024, "lookup_seconds": 0.02109, "lookup_thread_execution_width": 32, "lookup_threadgroup_limit": 64, "lookup_threads_per_threadgroup": 64, "lookups_per_sec": 51322297.101063, "lookups_per_sec_max": 77923560.803089, "lookups_per_sec_min": 40418788.974113, "machine": "macOS-26.5-arm64-arm-64bit-Mach-O", "max_threads_per_threadgroup": 1024, "min_ms": 500, "miss_count": 1082304, "operation": "jacobian_affine_scan_target_lookup_tag32", "ops_per_sec": 51322297.101063, "ops_per_sec_max": 77923560.803089, "ops_per_sec_min": 40418788.974113, "output_layout": "affine_dp_scan_target_lookup", "paired_baseline_ops_per_sec": 28022533.434118, "paired_baseline_ref": "HEAD", "paired_speedup": 1.8314652820996216, "query_count": 1082368, "raw_status": "keep", "reason": "", "requested_hits": 64, "runner_sample_count": 3, "sample_count": 262144, "seconds": 6.839034, "skipped": false, "state_layout": "xyzz", "status": "keep", "steps_per_sample": 512, "target_bucket_bytes": 16777216, "target_count": 1048576, "target_filter_bucket_bytes": 0, "target_key": "x256_y_parity", "target_key_bytes": 41943040, "target_lookup_checksum": "0x8b2568562837af7f", "target_query_hash_bytes": 0, "target_table_buckets": 2097152, "target_table_bytes": 58720256, "thread_execution_width": 32, "threadgroup_limit": 128, "threads_per_threadgroup": 128, "timestamp": "2026-06-27T19:39:08Z", "validation_seconds": 17.487764, "validation_workers": 8}
{"affine_scan_mode": "cpu_batch_prod_zz_zzz", "affine_scan_seconds": 0.026381, "backend": "metal", "budget_sec": 180, "bytes_per_target": 56.0, "candidate_verification": "tag32_prefilter_then_exact_key_equality", "commit": "d160d36-dirty", "confirmation_index": 1, "confirmation_runs": 2, "confirmation_status": "discard", "cooldown_sec": 0.0, "correctness": true, "description": "Metal XYZZ affine DP scan feeding exact tag32 multi-target lookup with a distinct-miss bulk query batch", "distance_tracking": "packet_distance_uint64", "dp_bits": 8, "dp_checksum": "0x9dba4a07ebbb8e14", "dp_count": 1057, "dp_distance_checksum": "0xf0dc88ed68b2ff64", "dp_query_count": 1057, "dp_tracking": "affine_x256_y_parity_cpu_batch", "exact_host_table_bytes": 58720256, "experiment": "metal_jacobian_dynamic_dp_stream_xyzz_affine_scan_target_lookup_tag32_distinct_misses1024", "filter_false_positive_count": 0, "filter_positive_count": 0, "gpu_lookup_lookups_per_sec": 142566912.539515, "gpu_ops_per_sec": 78062004.001082, "hit_count": 64, "injected_hits": 64, "iterations": 134217728, "jump_count": 16, "jump_histogram_max_bucket": 8394316, "jump_histogram_max_deviation_ppm": 759, "jump_histogram_min_bucket": 8382245, "jump_index": "power2_mask", "jump_mixer": "avalanche64", "jump_schedule": "power2", "lookup_engine": "gpu", "lookup_engine_effective": "gpu", "lookup_exact_seconds": 0.0, "lookup_gpu_seconds": 0.007592, "lookup_hash_seconds": 0.0, "lookup_layout": "open_address_tag32_index_exact256", "lookup_max_threads_per_threadgroup": 1024, "lookup_query_mode": "distinct_misses", "lookup_repeat": 1024, "lookup_seconds": 0.007592, "lookup_thread_execution_width": 32, "lookup_threadgroup_limit": 64, "lookup_threads_per_threadgroup": 64, "lookups_per_sec": 142566912.539515, "lookups_per_sec_max": 145299741.932297, "lookups_per_sec_min": 108534357.795332, "machine": "macOS-26.5-arm64-arm-64bit-Mach-O", "max_threads_per_threadgroup": 1024, "min_ms": 500, "miss_count": 1082304, "operation": "jacobian_affine_scan_target_lookup_tag32", "ops_per_sec": 142566912.539515, "ops_per_sec_max": 145299741.932297, "ops_per_sec_min": 108534357.795332, "output_layout": "affine_dp_scan_target_lookup", "paired_baseline_ops_per_sec": 194717221.721902, "paired_baseline_ref": "HEAD", "paired_speedup": 0.7321741306638564, "query_count": 1082368, "raw_status": "discard", "reason": "", "requested_hits": 64, "runner_sample_count": 3, "sample_count": 262144, "seconds": 1.719373, "skipped": false, "state_layout": "xyzz", "status": "discard", "steps_per_sample": 512, "target_bucket_bytes": 16777216, "target_count": 1048576, "target_filter_bucket_bytes": 0, "target_key": "x256_y_parity", "target_key_bytes": 41943040, "target_lookup_checksum": "0x8b2568562837af7f", "target_query_hash_bytes": 0, "target_table_buckets": 2097152, "target_table_bytes": 58720256, "thread_execution_width": 32, "threadgroup_limit": 128, "threads_per_threadgroup": 128, "timestamp": "2026-06-27T20:59:46Z", "validation_seconds": 6.537179, "validation_workers": 8}
{"affine_scan_mode": "cpu_batch_prod_zz_zzz", "affine_scan_seconds": 0.018206, "backend": "metal", "budget_sec": 180, "bytes_per_target": 56.0, "candidate_verification": "tag32_prefilter_then_exact_key_equality", "commit": "d160d36-dirty", "confirmation_index": 2, "confirmation_runs": 2, "confirmation_status": "discard", "cooldown_sec": 0.0, "correctness": true, "description": "Metal XYZZ affine DP scan feeding exact tag32 multi-target lookup with a distinct-miss bulk query batch", "distance_tracking": "packet_distance_uint64", "dp_bits": 8, "dp_checksum": "0x9dba4a07ebbb8e14", "dp_count": 1057, "dp_distance_checksum": "0xf0dc88ed68b2ff64", "dp_query_count": 1057, "dp_tracking": "affine_x256_y_parity_cpu_batch", "exact_host_table_bytes": 58720256, "experiment": "metal_jacobian_dynamic_dp_stream_xyzz_affine_scan_target_lookup_tag32_distinct_misses1024", "filter_false_positive_count": 0, "filter_positive_count": 0, "gpu_lookup_lookups_per_sec": 112839230.097606, "gpu_ops_per_sec": 45950735.72877, "hit_count": 64, "injected_hits": 64, "iterations": 134217728, "jump_count": 16, "jump_histogram_max_bucket": 8394316, "jump_histogram_max_deviation_ppm": 759, "jump_histogram_min_bucket": 8382245, "jump_index": "power2_mask", "jump_mixer": "avalanche64", "jump_schedule": "power2", "lookup_engine": "gpu", "lookup_engine_effective": "gpu", "lookup_exact_seconds": 0.0, "lookup_gpu_seconds": 0.009592, "lookup_hash_seconds": 0.0, "lookup_layout": "open_address_tag32_index_exact256", "lookup_max_threads_per_threadgroup": 1024, "lookup_query_mode": "distinct_misses", "lookup_repeat": 1024, "lookup_seconds": 0.009592, "lookup_thread_execution_width": 32, "lookup_threadgroup_limit": 64, "lookup_threads_per_threadgroup": 64, "lookups_per_sec": 112839230.097606, "lookups_per_sec_max": 214698771.138506, "lookups_per_sec_min": 67554761.76225, "machine": "macOS-26.5-arm64-arm-64bit-Mach-O", "max_threads_per_threadgroup": 1024, "min_ms": 500, "miss_count": 1082304, "operation": "jacobian_affine_scan_target_lookup_tag32", "ops_per_sec": 112839230.097606, "ops_per_sec_max": 214698771.138506, "ops_per_sec_min": 67554761.76225, "output_layout": "affine_dp_scan_target_lookup", "paired_baseline_ops_per_sec": 139371914.20957, "paired_baseline_ref": "HEAD", "paired_speedup": 0.8096267511109343, "query_count": 1082368, "raw_status": "discard", "reason": "", "requested_hits": 64, "runner_sample_count": 3, "sample_count": 262144, "seconds": 2.920905, "skipped": false, "state_layout": "xyzz", "status": "discard", "steps_per_sample": 512, "target_bucket_bytes": 16777216, "target_count": 1048576, "target_filter_bucket_bytes": 0, "target_key": "x256_y_parity", "target_key_bytes": 41943040, "target_lookup_checksum": "0x8b2568562837af7f", "target_query_hash_bytes": 0, "target_table_buckets": 2097152, "target_table_bytes": 58720256, "thread_execution_width": 32, "threadgroup_limit": 128, "threads_per_threadgroup": 128, "timestamp": "2026-06-27T20:59:46Z", "validation_seconds": 9.545982, "validation_workers": 8}
