{"backend": "metal", "budget_sec": 10, "commit": "35b2a71", "confirmation_index": 2, "confirmation_runs": 3, "confirmation_status": "discard", "correctness": true, "description": "Stable Metal Jacobian jump-table walk with projective distinguished-point candidate flags", "distance_checksum": "0xa45f471493cace2f", "distance_tracking": "uint64", "dp_bits": 4, "dp_checksum": "0x30a7914972cba014", "dp_count": 1000, "dp_tracking": "projective_x_limb0", "experiment": "metal_jacobian_jump_walk_dp_stable", "iterations": 6684672, "jump_count": 16, "machine": "macOS-26.5-arm64-arm-64bit-Mach-O", "max_threads_per_threadgroup": 1024, "min_ms": 200, "operation": "jacobian_affine_walk_jump_table", "ops_per_sec": 33215699.433029, "ops_per_sec_max": 36375786.381975, "ops_per_sec_min": 30901655.107956, "paired_baseline_ops_per_sec": 30918239.356938, "paired_baseline_ref": "main", "paired_speedup": 1.074307597194258, "raw_status": "keep", "reason": "", "runner_sample_count": 3, "sample_count": 16384, "seconds": 0.20125, "skipped": false, "status": "discard", "steps_per_sample": 8, "thread_execution_width": 32, "threadgroup_limit": 256, "threads_per_threadgroup": 256, "timestamp": "2026-06-21T20:43:28Z"}
{"backend": "metal", "budget_sec": 10, "commit": "35b2a71", "confirmation_index": 3, "confirmation_runs": 3, "confirmation_status": "discard", "correctness": true, "description": "Stable Metal Jacobian jump-table walk with projective distinguished-point candidate flags", "distance_checksum": "0xa45f471493cace2f", "distance_tracking": "uint64", "dp_bits": 4, "dp_checksum": "0x30a7914972cba014", "dp_count": 1000, "dp_tracking": "projective_x_limb0", "experiment": "metal_jacobian_jump_walk_dp_stable", "iterations": 6160384, "jump_count": 16, "machine": "macOS-26.5-arm64-arm-64bit-Mach-O", "max_threads_per_threadgroup": 1024, "min_ms": 200, "operation": "jacobian_affine_walk_jump_table", "ops_per_sec": 30586406.649428, "ops_per_sec_max": 36185549.023835, "ops_per_sec_min": 26493965.095117, "paired_baseline_ops_per_sec": 36692081.66531, "paired_baseline_ref": "main", "paired_speedup": 0.8335969304882878, "raw_status": "discard", "reason": "", "runner_sample_count": 3, "sample_count": 16384, "seconds": 0.201409, "skipped": false, "status": "discard", "steps_per_sample": 8, "thread_execution_width": 32, "threadgroup_limit": 256, "threads_per_threadgroup": 256, "timestamp": "2026-06-21T20:44:21Z"}
{"backend": "metal", "budget_sec": 10, "commit": "0f35050", "confirmation_index": 1, "confirmation_runs": 3, "confirmation_status": "discard", "correctness": true, "description": "Stable Metal Jacobian jump-table walk with projective distinguished-point candidate flags", "distance_checksum": "0xa45f471493cace2f", "distance_tracking": "uint64", "dp_bits": 4, "dp_checksum": "0x30a7914972cba014", "dp_count": 1000, "dp_tracking": "projective_x_limb0", "experiment": "metal_jacobian_jump_walk_dp_stable", "iterations": 11403264, "jump_count": 16, "machine": "macOS-26.5-arm64-arm-64bit-Mach-O", "max_threads_per_threadgroup": 1024, "min_ms": 200, "operation": "jacobian_affine_walk_jump_table", "ops_per_sec": 56890167.192055, "ops_per_sec_max": 63917277.977573, "ops_per_sec_min": 18221523.68829, "paired_baseline_ops_per_sec": 59601516.020101, "paired_baseline_ref": "main", "paired_speedup": 0.9545087271415784, "raw_status": "discard", "reason": "", "runner_sample_count": 3, "sample_count": 16384, "seconds": 0.200443, "skipped": false, "status": "discard", "steps_per_sample": 8, "thread_execution_width": 32, "threadgroup_limit": 256, "threads_per_threadgroup": 256, "timestamp": "2026-06-21T20:51:46Z"}
{"backend": "metal", "budget_sec": 10, "commit": "0f35050", "confirmation_index": 2, "confirmation_runs": 3, "confirmation_status": "discard", "correctness": true, "description": "Stable Metal Jacobian jump-table walk with projective distinguished-point candidate flags", "distance_checksum": "0xa45f471493cace2f", "distance_tracking": "uint64", "dp_bits": 4, "dp_checksum": "0x30a7914972cba014", "dp_count": 1000, "dp_tracking": "projective_x_limb0", "experiment": "metal_jacobian_jump_walk_dp_stable", "iterations": 4063232, "jump_count": 16, "machine": "macOS-26.5-arm64-arm-64bit-Mach-O", "max_threads_per_threadgroup": 1024, "min_ms": 200, "operation": "jacobian_affine_walk_jump_table", "ops_per_sec": 19914318.330146, "ops_per_sec_max": 39040161.234468, "ops_per_sec_min": 17970538.71802, "paired_baseline_ops_per_sec": 16906429.646554, "paired_baseline_ref": "main", "paired_speedup": 1.17791389113343, "raw_status": "keep", "reason": "", "runner_sample_count": 3, "sample_count": 16384, "seconds": 0.204036, "skipped": false, "status": "discard", "steps_per_sample": 8, "thread_execution_width": 32, "threadgroup_limit": 256, "threads_per_threadgroup": 256, "timestamp": "2026-06-21T20:54:05Z"}
{"backend": "metal", "budget_sec": 10, "commit": "0f35050", "confirmation_index": 3, "confirmation_runs": 3, "confirmation_status": "discard", "correctness": true, "description": "Stable Metal Jacobian jump-table walk with projective distinguished-point candidate flags", "distance_checksum": "0xa45f471493cace2f", "distance_tracking": "uint64", "dp_bits": 4, "dp_checksum": "0x30a7914972cba014", "dp_count": 1000, "dp_tracking": "projective_x_limb0", "experiment": "metal_jacobian_jump_walk_dp_stable", "iterations": 4063232, "jump_count": 16, "machine": "macOS-26.5-arm64-arm-64bit-Mach-O", "max_threads_per_threadgroup": 1024, "min_ms": 200, "operation": "jacobian_affine_walk_jump_table", "ops_per_sec": 19878189.612933, "ops_per_sec_max": 28581193.002822, "ops_per_sec_min": 19448872.059298, "paired_baseline_ops_per_sec": 32692351.043917, "paired_baseline_ref": "main", "paired_speedup": 0.6080379348132472, "raw_status": "discard", "reason": "", "runner_sample_count": 3, "sample_count": 16384, "seconds": 0.204407, "skipped": false, "status": "discard", "steps_per_sample": 8, "thread_execution_width": 32, "threadgroup_limit": 256, "threads_per_threadgroup": 256, "timestamp": "2026-06-21T20:55:02Z"}
{"backend": "metal", "budget_sec": 10, "commit": "a963a4d", "confirmation_index": 1, "confirmation_runs": 3, "confirmation_status": "keep", "correctness": true, "description": "Stable Metal Jacobian jump-table walk with projective distinguished-point candidate flags", "distance_checksum": "0xa45f471493cace2f", "distance_tracking": "uint64", "dp_bits": 4, "dp_checksum": "0x30a7914972cba014", "dp_count": 1000, "dp_tracking": "projective_x_limb0", "experiment": "metal_jacobian_jump_walk_dp_stable", "iterations": 4980736, "jump_count": 16, "machine": "macOS-26.5-arm64-arm-64bit-Mach-O", "max_threads_per_threadgroup": 1024, "min_ms": 200, "operation": "jacobian_affine_walk_jump_table", "ops_per_sec": 24066394.957596, "ops_per_sec_max": 32365713.599388, "ops_per_sec_min": 12081083.976284, "paired_baseline_ops_per_sec": 20221607.504307, "paired_baseline_ref": "main", "paired_speedup": 1.1901326317638248, "raw_status": "keep", "reason": "", "runner_sample_count": 3, "sample_count": 16384, "seconds": 0.206958, "skipped": false, "status": "keep", "steps_per_sample": 8, "thread_execution_width": 32, "threadgroup_limit": 256, "threads_per_threadgroup": 256, "timestamp": "2026-06-21T21:15:07Z"}
{"backend": "metal", "budget_sec": 10, "commit": "a963a4d", "confirmation_index": 2, "confirmation_runs": 3, "confirmation_status": "keep", "correctness": true, "description": "Stable Metal Jacobian jump-table walk with projective distinguished-point candidate flags", "distance_checksum": "0xa45f471493cace2f", "distance_tracking": "uint64", "dp_bits": 4, "dp_checksum": "0x30a7914972cba014", "dp_count": 1000, "dp_tracking": "projective_x_limb0", "experiment": "metal_jacobian_jump_walk_dp_stable", "iterations": 7733248, "jump_count": 16, "machine": "macOS-26.5-arm64-arm-64bit-Mach-O", "max_threads_per_threadgroup": 1024, "min_ms": 200, "operation": "jacobian_affine_walk_jump_table", "ops_per_sec": 38235800.665191, "ops_per_sec_max": 41029696.551252, "ops_per_sec_min": 17437585.78352, "paired_baseline_ops_per_sec": 35341368.317401, "paired_baseline_ref": "main", "paired_speedup": 1.0818992723143908, "raw_status": "keep", "reason": "", "runner_sample_count": 3, "sample_count": 16384, "seconds": 0.202251, "skipped": false, "status": "keep", "steps_per_sample": 8, "thread_execution_width": 32, "threadgroup_limit": 256, "threads_per_threadgroup": 256, "timestamp": "2026-06-21T21:17:22Z"}
{"backend": "metal", "budget_sec": 10, "commit": "a963a4d", "confirmation_index": 3, "confirmation_runs": 3, "confirmation_status": "keep", "correctness": true, "description": "Stable Metal Jacobian jump-table walk with projective distinguished-point candidate flags", "distance_checksum": "0xa45f471493cace2f", "distance_tracking": "uint64", "dp_bits": 4, "dp_checksum": "0x30a7914972cba014", "dp_count": 1000, "dp_tracking": "projective_x_limb0", "experiment": "metal_jacobian_jump_walk_dp_stable", "iterations": 12320768, "jump_count": 16, "machine": "macOS-26.5-arm64-arm-64bit-Mach-O", "max_threads_per_threadgroup": 1024, "min_ms": 200, "operation": "jacobian_affine_walk_jump_table", "ops_per_sec": 61299274.249396, "ops_per_sec_max": 66035763.232882, "ops_per_sec_min": 22512139.474136, "paired_baseline_ops_per_sec": 42794891.984669, "paired_baseline_ref": "main", "paired_speedup": 1.4323969849335307, "raw_status": "keep", "reason": "", "runner_sample_count": 3, "sample_count": 16384, "seconds": 0.200994, "skipped": false, "status": "keep", "steps_per_sample": 8, "thread_execution_width": 32, "threadgroup_limit": 256, "threads_per_threadgroup": 256, "timestamp": "2026-06-21T21:18:12Z"}
{"backend": "metal", "budget_sec": 10, "commit": "d04021e", "confirmation_index": 1, "confirmation_runs": 3, "confirmation_status": "discard", "correctness": true, "description": "Stable Metal Jacobian jump-table walk with projective distinguished-point candidate flags", "distance_checksum": "0xa45f471493cace2f", "distance_tracking": "uint64", "dp_bits": 4, "dp_checksum": "0x30a7914972cba014", "dp_count": 1000, "dp_tracking": "projective_x_limb0", "experiment": "metal_jacobian_jump_walk_dp_stable", "iterations": 7471104, "jump_count": 16, "machine": "macOS-26.5-arm64-arm-64bit-Mach-O", "max_threads_per_threadgroup": 1024, "min_ms": 200, "operation": "jacobian_affine_walk_jump_table", "ops_per_sec": 37128202.948728, "ops_per_sec_max": 64037343.843661, "ops_per_sec_min": 20924196.16402, "paired_baseline_ops_per_sec": 43236042.302225, "paired_baseline_ref": "main", "paired_speedup": 0.8587326908692872, "raw_status": "discard", "reason": "", "runner_sample_count": 3, "sample_count": 16384, "seconds": 0.201224, "skipped": false, "status": "discard", "steps_per_sample": 8, "thread_execution_width": 32, "threadgroup_limit": 256, "threads_per_threadgroup": 256, "timestamp": "2026-06-21T21:36:18Z"}
{"backend": "metal", "budget_sec": 10, "commit": "d04021e", "confirmation_index": 2, "confirmation_runs": 3, "confirmation_status": "discard", "correctness": true, "description": "Stable Metal Jacobian jump-table walk with projective distinguished-point candidate flags", "distance_checksum": "0xa45f471493cace2f", "distance_tracking": "uint64", "dp_bits": 4, "dp_checksum": "0x30a7914972cba014", "dp_count": 1000, "dp_tracking": "projective_x_limb0", "experiment": "metal_jacobian_jump_walk_dp_stable", "iterations": 4063232, "jump_count": 16, "machine": "macOS-26.5-arm64-arm-64bit-Mach-O", "max_threads_per_threadgroup": 1024, "min_ms": 200, "operation": "jacobian_affine_walk_jump_table", "ops_per_sec": 19902795.457665, "ops_per_sec_max": 58809534.372522, "ops_per_sec_min": 19042670.995731, "paired_baseline_ops_per_sec": 31420344.858809, "paired_baseline_ref": "main", "paired_speedup": 0.6334365694297928, "raw_status": "discard", "reason": "", "runner_sample_count": 3, "sample_count": 16384, "seconds": 0.204154, "skipped": false, "status": "discard", "steps_per_sample": 8, "thread_execution_width": 32, "threadgroup_limit": 256, "threads_per_threadgroup": 256, "timestamp": "2026-06-21T21:38:42Z"}
{"backend": "metal", "budget_sec": 10, "commit": "d04021e", "confirmation_index": 3, "confirmation_runs": 3, "confirmation_status": "discard", "correctness": true, "description": "Stable Metal Jacobian jump-table walk with projective distinguished-point candidate flags", "distance_checksum": "0xa45f471493cace2f", "distance_tracking": "uint64", "dp_bits": 4, "dp_checksum": "0x30a7914972cba014", "dp_count": 1000, "dp_tracking": "projective_x_limb0", "experiment": "metal_jacobian_jump_walk_dp_stable", "iterations": 4849664, "jump_count": 16, "machine": "macOS-26.5-arm64-arm-64bit-Mach-O", "max_threads_per_threadgroup": 1024, "min_ms": 200, "operation": "jacobian_affine_walk_jump_table", "ops_per_sec": 24111058.037145, "ops_per_sec_max": 35426214.542709, "ops_per_sec_min": 20036475.941632, "paired_baseline_ops_per_sec": 38453887.060831, "paired_baseline_ref": "main", "paired_speedup": 0.6270122445359871, "raw_status": "discard", "reason": "", "runner_sample_count": 3, "sample_count": 16384, "seconds": 0.201139, "skipped": false, "status": "discard", "steps_per_sample": 8, "thread_execution_width": 32, "threadgroup_limit": 256, "threads_per_threadgroup": 256, "timestamp": "2026-06-21T21:39:33Z"}
{"backend": "metal", "budget_sec": 10, "commit": "03ed392", "confirmation_index": 1, "confirmation_runs": 3, "confirmation_status": "discard", "correctness": true, "description": "Stable Metal Jacobian jump-table walk with projective distinguished-point candidate flags", "distance_checksum": "0xa45f471493cace2f", "distance_tracking": "uint64", "dp_bits": 4, "dp_checksum": "0x30a7914972cba014", "dp_count": 1000, "dp_tracking": "projective_x_limb0", "experiment": "metal_jacobian_jump_walk_dp_stable", "iterations": 3801088, "jump_count": 16, "machine": "macOS-26.5-arm64-arm-64bit-Mach-O", "max_threads_per_threadgroup": 1024, "min_ms": 200, "operation": "jacobian_affine_walk_jump_table", "ops_per_sec": 18798631.461639, "ops_per_sec_max": 20016101.82019, "ops_per_sec_min": 17887617.99623, "paired_baseline_ops_per_sec": 19785512.55332, "paired_baseline_ref": "main", "paired_speedup": 0.9501210247133373, "raw_status": "discard", "reason": "", "runner_sample_count": 3, "sample_count": 16384, "seconds": 0.2022, "skipped": false, "status": "discard", "steps_per_sample": 8, "thread_execution_width": 32, "threadgroup_limit": 256, "threads_per_threadgroup": 256, "timestamp": "2026-06-21T21:53:50Z"}
{"backend": "metal", "budget_sec": 10, "commit": "03ed392", "confirmation_index": 2, "confirmation_runs": 3, "confirmation_status": "discard", "correctness": true, "description": "Stable Metal Jacobian jump-table walk with projective distinguished-point candidate flags", "distance_checksum": "0xa45f471493cace2f", "distance_tracking": "uint64", "dp_bits": 4, "dp_checksum": "0x30a7914972cba014", "dp_count": 1000, "dp_tracking": "projective_x_limb0", "experiment": "metal_jacobian_jump_walk_dp_stable", "iterations": 6553600, "jump_count": 16, "machine": "macOS-26.5-arm64-arm-64bit-Mach-O", "max_threads_per_threadgroup": 1024, "min_ms": 200, "operation": "jacobian_affine_walk_jump_table", "ops_per_sec": 32104788.745018, "ops_per_sec_max": 40670162.353053, "ops_per_sec_min": 25738769.29273, "paired_baseline_ops_per_sec": 26746653.179411, "paired_baseline_ref": "main", "paired_speedup": 1.2003291974388623, "raw_status": "keep", "reason": "", "runner_sample_count": 3, "sample_count": 16384, "seconds": 0.204132, "skipped": false, "status": "discard", "steps_per_sample": 8, "thread_execution_width": 32, "threadgroup_limit": 256, "threads_per_threadgroup": 256, "timestamp": "2026-06-21T21:54:40Z"}
{"backend": "metal", "budget_sec": 10, "commit": "03ed392", "confirmation_index": 3, "confirmation_runs": 3, "confirmation_status": "discard", "correctness": true, "description": "Stable Metal Jacobian jump-table walk with projective distinguished-point candidate flags", "distance_checksum": "0xa45f471493cace2f", "distance_tracking": "uint64", "dp_bits": 4, "dp_checksum": "0x30a7914972cba014", "dp_count": 1000, "dp_tracking": "projective_x_limb0", "experiment": "metal_jacobian_jump_walk_dp_stable", "iterations": 6422528, "jump_count": 16, "machine": "macOS-26.5-arm64-arm-64bit-Mach-O", "max_threads_per_threadgroup": 1024, "min_ms": 200, "operation": "jacobian_affine_walk_jump_table", "ops_per_sec": 31874933.005858, "ops_per_sec_max": 38661028.390277, "ops_per_sec_min": 22930472.635843, "paired_baseline_ops_per_sec": 32142027.269108, "paired_baseline_ref": "main", "paired_speedup": 0.9916901861536684, "raw_status": "discard", "reason": "", "runner_sample_count": 3, "sample_count": 16384, "seconds": 0.201491, "skipped": false, "status": "discard", "steps_per_sample": 8, "thread_execution_width": 32, "threadgroup_limit": 256, "threads_per_threadgroup": 256, "timestamp": "2026-06-21T21:55:25Z"}
{"backend": "metal", "budget_sec": 10, "commit": "8b3d413", "confirmation_index": 1, "confirmation_runs": 3, "confirmation_status": "discard", "correctness": true, "description": "Stable Metal Jacobian jump-table walk with projective distinguished-point candidate flags", "distance_checksum": "0xa45f471493cace2f", "distance_tracking": "uint64", "dp_bits": 4, "dp_checksum": "0x30a7914972cba014", "dp_count": 1000, "dp_tracking": "projective_x_limb0", "experiment": "metal_jacobian_jump_walk_dp_stable", "iterations": 7208960, "jump_count": 16, "machine": "macOS-26.5-arm64-arm-64bit-Mach-O", "max_threads_per_threadgroup": 1024, "min_ms": 200, "operation": "jacobian_affine_walk_jump_table", "ops_per_sec": 35303989.210328, "ops_per_sec_max": 36425376.430804, "ops_per_sec_min": 32364516.108705, "paired_baseline_ops_per_sec": 34610160.914607, "paired_baseline_ref": "main", "paired_speedup": 1.020046953766926, "raw_status": "keep", "reason": "", "runner_sample_count": 3, "sample_count": 16384, "seconds": 0.204197, "skipped": false, "status": "discard", "steps_per_sample": 8, "thread_execution_width": 32, "threadgroup_limit": 256, "threads_per_threadgroup": 256, "timestamp": "2026-06-21T22:03:19Z"}
{"backend": "metal", "budget_sec": 10, "commit": "8b3d413", "confirmation_index": 2, "confirmation_runs": 3, "confirmation_status": "discard", "correctness": true, "description": "Stable Metal Jacobian jump-table walk with projective distinguished-point candidate flags", "distance_checksum": "0xa45f471493cace2f", "distance_tracking": "uint64", "dp_bits": 4, "dp_checksum": "0x30a7914972cba014", "dp_count": 1000, "dp_tracking": "projective_x_limb0", "experiment": "metal_jacobian_jump_walk_dp_stable", "iterations": 7602176, "jump_count": 16, "machine": "macOS-26.5-arm64-arm-64bit-Mach-O", "max_threads_per_threadgroup": 1024, "min_ms": 200, "operation": "jacobian_affine_walk_jump_table", "ops_per_sec": 37919746.146894, "ops_per_sec_max": 38302795.118872, "ops_per_sec_min": 20314652.754339, "paired_baseline_ops_per_sec": 34493059.9163, "paired_baseline_ref": "main", "paired_speedup": 1.0993442228352346, "raw_status": "keep", "reason": "", "runner_sample_count": 3, "sample_count": 16384, "seconds": 0.200481, "skipped": false, "status": "discard", "steps_per_sample": 8, "thread_execution_width": 32, "threadgroup_limit": 256, "threads_per_threadgroup": 256, "timestamp": "2026-06-21T22:05:04Z"}
{"backend": "metal", "budget_sec": 10, "commit": "8b3d413", "confirmation_index": 3, "confirmation_runs": 3, "confirmation_status": "discard", "correctness": true, "description": "Stable Metal Jacobian jump-table walk with projective distinguished-point candidate flags", "distance_checksum": "0xa45f471493cace2f", "distance_tracking": "uint64", "dp_bits": 4, "dp_checksum": "0x30a7914972cba014", "dp_count": 1000, "dp_tracking": "projective_x_limb0", "experiment": "metal_jacobian_jump_walk_dp_stable", "iterations": 7602176, "jump_count": 16, "machine": "macOS-26.5-arm64-arm-64bit-Mach-O", "max_threads_per_threadgroup": 1024, "min_ms": 200, "operation": "jacobian_affine_walk_jump_table", "ops_per_sec": 37748168.413333, "ops_per_sec_max": 58606403.876196, "ops_per_sec_min": 18883863.327415, "paired_baseline_ops_per_sec": 42215470.224073, "paired_baseline_ref": "main", "paired_speedup": 0.8941785609155062, "raw_status": "discard", "reason": "", "runner_sample_count": 3, "sample_count": 16384, "seconds": 0.201392, "skipped": false, "status": "discard", "steps_per_sample": 8, "thread_execution_width": 32, "threadgroup_limit": 256, "threads_per_threadgroup": 256, "timestamp": "2026-06-21T22:06:09Z"}
{"backend": "metal", "budget_sec": 10, "commit": "959e118", "confirmation_index": 1, "confirmation_runs": 3, "confirmation_status": "discard", "correctness": true, "description": "Stable Metal Jacobian jump-table walk with projective distinguished-point candidate flags", "distance_checksum": "0xa45f471493cace2f", "distance_tracking": "uint64", "dp_bits": 4, "dp_checksum": "0x30a7914972cba014", "dp_count": 1000, "dp_tracking": "projective_x_limb0", "experiment": "metal_jacobian_jump_walk_dp_stable", "iterations": 3801088, "jump_count": 16, "machine": "macOS-26.5-arm64-arm-64bit-Mach-O", "max_threads_per_threadgroup": 1024, "min_ms": 200, "operation": "jacobian_affine_walk_jump_table", "ops_per_sec": 18804261.387271, "ops_per_sec_max": 18814209.551982, "ops_per_sec_min": 13551918.198822, "paired_baseline_ops_per_sec": 30616350.945069, "paired_baseline_ref": "main", "paired_speedup": 0.6141901567893926, "raw_status": "discard", "reason": "", "runner_sample_count": 3, "sample_count": 16384, "seconds": 0.20214, "skipped": false, "status": "discard", "steps_per_sample": 8, "thread_execution_width": 32, "threadgroup_limit": 256, "threads_per_threadgroup": 256, "timestamp": "2026-06-21T22:21:38Z"}
