{"affine_active_path": "all_active_fast", "affine_buffer": "resize_reuse", "affine_conversion": "batch", "affine_field_ops": "inplace", "affine_reverse_loop": "split_zero", "affine_tail_update": "skip_final", "affine_z_access": "const_ref", "affine_z_check": "infinity_flag", "architecture": "shared_tame", "avg_dp_count": 84.0, "backend": "macos_cpu", "budget_sec": 5, "candidate_verification": "full_point_collision", "commit": "1a62d47", "confirmation_index": 1, "confirmation_runs": 3, "confirmation_status": "discard", "correctness": true, "description": "Apple Silicon CPU shared-tame tiny multi-target kangaroo benchmark", "dp_bits": 0, "dp_bucket_storage": "inline_first", "dp_capacity": "max_load_2of3", "dp_clear": "empty_guard", "dp_hash": "partial_limb_mix", "dp_key": "x_parity", "dp_lookup": "open_address_linear", "dp_reserve": "sqrt_range_estimate", "ecint_carry_impl": "clang_builtin", "ecint_mul_final_sub": "single_conditional", "expected_private_key": "0x7", "experiment": "jacobian_kangaroo_multi_small", "field_rhs_passing": "const_ref", "found_private_key": "0x7", "found_target_index": 3, "iterations": 968, "jacobian_step_passing": "const_ref", "jump_count": 8, "jump_index": "power2_mask", "jump_table": "precomputed", "last_dp_count": 84, "machine": "macOS-26.5-arm64-arm-64bit-Mach-O", "max_steps": 4096, "min_ms": 50, "operation": "jacobian_kangaroo_multi_small", "ops_per_sec": 19351.823854, "ops_per_sec_max": 23850.658651, "ops_per_sec_min": 13473.51008, "paired_baseline_ops_per_sec": 21135.033267, "paired_baseline_ref": "main", "paired_speedup": 0.9156277924679549, "point_passing": "const_ref", "range_bits": 8, "range_context": "precomputed", "raw_status": "discard", "reason": "", "runner_sample_count": 3, "sample_count": 1, "scratch": "reused", "seconds": 0.050021, "single_target_ops_per_sec": 17911.417565, "skipped": false, "speedup_vs_single": 1.080418, "start_scalar": "0x2", "status": "discard", "tame_states": 1, "target_count": 4, "target_throughput_vs_single": 4.321673, "timestamp": "2026-06-21T20:07:45Z", "wild_states": 4}
{"affine_active_path": "all_active_fast", "affine_buffer": "resize_reuse", "affine_conversion": "batch", "affine_field_ops": "inplace", "affine_reverse_loop": "split_zero", "affine_tail_update": "skip_final", "affine_z_access": "const_ref", "affine_z_check": "infinity_flag", "architecture": "shared_tame", "avg_dp_count": 84.0, "backend": "macos_cpu", "budget_sec": 5, "candidate_verification": "full_point_collision", "commit": "1a62d47", "confirmation_index": 2, "confirmation_runs": 3, "confirmation_status": "discard", "correctness": true, "description": "Apple Silicon CPU shared-tame tiny multi-target kangaroo benchmark", "dp_bits": 0, "dp_bucket_storage": "inline_first", "dp_capacity": "max_load_2of3", "dp_clear": "empty_guard", "dp_hash": "partial_limb_mix", "dp_key": "x_parity", "dp_lookup": "open_address_linear", "dp_reserve": "sqrt_range_estimate", "ecint_carry_impl": "clang_builtin", "ecint_mul_final_sub": "single_conditional", "expected_private_key": "0x7", "experiment": "jacobian_kangaroo_multi_small", "field_rhs_passing": "const_ref", "found_private_key": "0x7", "found_target_index": 3, "iterations": 388, "jacobian_step_passing": "const_ref", "jump_count": 8, "jump_index": "power2_mask", "jump_table": "precomputed", "last_dp_count": 84, "machine": "macOS-26.5-arm64-arm-64bit-Mach-O", "max_steps": 4096, "min_ms": 50, "operation": "jacobian_kangaroo_multi_small", "ops_per_sec": 7734.437683, "ops_per_sec_max": 12548.580791, "ops_per_sec_min": 612.493475, "paired_baseline_ops_per_sec": 11058.239971, "paired_baseline_ref": "main", "paired_speedup": 0.6994275493463153, "point_passing": "const_ref", "range_bits": 8, "range_context": "precomputed", "raw_status": "discard", "reason": "", "runner_sample_count": 3, "sample_count": 1, "scratch": "reused", "seconds": 0.050165, "single_target_ops_per_sec": 9613.251129, "skipped": false, "speedup_vs_single": 0.80456, "start_scalar": "0x2", "status": "discard", "tame_states": 1, "target_count": 4, "target_throughput_vs_single": 3.21824, "timestamp": "2026-06-21T20:07:58Z", "wild_states": 4}
{"affine_active_path": "all_active_fast", "affine_buffer": "resize_reuse", "affine_conversion": "batch", "affine_field_ops": "inplace", "affine_reverse_loop": "split_zero", "affine_tail_update": "skip_final", "affine_z_access": "const_ref", "affine_z_check": "infinity_flag", "architecture": "shared_tame", "avg_dp_count": 84.0, "backend": "macos_cpu", "budget_sec": 5, "candidate_verification": "full_point_collision", "commit": "1a62d47", "confirmation_index": 3, "confirmation_runs": 3, "confirmation_status": "discard", "correctness": true, "description": "Apple Silicon CPU shared-tame tiny multi-target kangaroo benchmark", "dp_bits": 0, "dp_bucket_storage": "inline_first", "dp_capacity": "max_load_2of3", "dp_clear": "empty_guard", "dp_hash": "partial_limb_mix", "dp_key": "x_parity", "dp_lookup": "open_address_linear", "dp_reserve": "sqrt_range_estimate", "ecint_carry_impl": "clang_builtin", "ecint_mul_final_sub": "single_conditional", "expected_private_key": "0x7", "experiment": "jacobian_kangaroo_multi_small", "field_rhs_passing": "const_ref", "found_private_key": "0x7", "found_target_index": 3, "iterations": 1299, "jacobian_step_passing": "const_ref", "jump_count": 8, "jump_index": "power2_mask", "jump_table": "precomputed", "last_dp_count": 84, "machine": "macOS-26.5-arm64-arm-64bit-Mach-O", "max_steps": 4096, "min_ms": 50, "operation": "jacobian_kangaroo_multi_small", "ops_per_sec": 25968.898296, "ops_per_sec_max": 26715.614365, "ops_per_sec_min": 25357.083935, "paired_baseline_ops_per_sec": 24813.734532, "paired_baseline_ref": "main", "paired_speedup": 1.0465534022099854, "point_passing": "const_ref", "range_bits": 8, "range_context": "precomputed", "raw_status": "keep", "reason": "", "runner_sample_count": 3, "sample_count": 1, "scratch": "reused", "seconds": 0.050021, "single_target_ops_per_sec": 23102.038165, "skipped": false, "speedup_vs_single": 1.124096, "start_scalar": "0x2", "status": "discard", "tame_states": 1, "target_count": 4, "target_throughput_vs_single": 4.496382, "timestamp": "2026-06-21T20:08:32Z", "wild_states": 4}
{"affine_active_path": "all_active_fast", "affine_buffer": "resize_reuse", "affine_conversion": "batch", "affine_field_ops": "inplace", "affine_reverse_loop": "split_zero", "affine_tail_update": "skip_final", "affine_z_access": "const_ref", "affine_z_check": "infinity_flag", "backend": "macos_cpu", "batch_points": 17, "budget_sec": 5, "checksum": "0xbb7eaed4c5c0dc80", "commit": "bd5506c", "confirmation_index": 1, "confirmation_runs": 3, "confirmation_status": "discard", "correctness": true, "description": "Apple Silicon CPU Jacobian batch-to-affine conversion benchmark", "experiment": "jacobian_batch_affine", "field_rhs_passing": "const_ref", "iterations": 28928, "machine": "macOS-26.5-arm64-arm-64bit-Mach-O", "min_ms": 50, "operation": "jacobian_batch_affine", "ops_per_sec": 578151.917251, "ops_per_sec_max": 578151.917251, "ops_per_sec_min": 578151.917251, "paired_baseline_ops_per_sec": 584240.006747, "paired_baseline_ref": "main", "paired_speedup": 0.9895794717484376, "points_per_sec": 9828582.593262, "raw_status": "discard", "reason": "", "runner_sample_count": 1, "sample_count": 256, "seconds": 0.050035, "skipped": false, "status": "discard", "timestamp": "2026-06-21T20:16:14Z", "wild_points": 16}
{"affine_active_path": "all_active_fast", "affine_buffer": "resize_reuse", "affine_conversion": "batch", "affine_field_ops": "inplace", "affine_reverse_loop": "split_zero", "affine_tail_update": "skip_final", "affine_z_access": "const_ref", "affine_z_check": "infinity_flag", "backend": "macos_cpu", "batch_points": 17, "budget_sec": 5, "checksum": "0x528c6474c86cef80", "commit": "bd5506c", "confirmation_index": 2, "confirmation_runs": 3, "confirmation_status": "discard", "correctness": true, "description": "Apple Silicon CPU Jacobian batch-to-affine conversion benchmark", "experiment": "jacobian_batch_affine", "field_rhs_passing": "const_ref", "iterations": 26368, "machine": "macOS-26.5-arm64-arm-64bit-Mach-O", "min_ms": 50, "operation": "jacobian_batch_affine", "ops_per_sec": 526343.273226, "ops_per_sec_max": 526343.273226, "ops_per_sec_min": 526343.273226, "paired_baseline_ops_per_sec": 584641.735655, "paired_baseline_ref": "main", "paired_speedup": 0.9002834404839648, "points_per_sec": 8947835.644842, "raw_status": "discard", "reason": "", "runner_sample_count": 1, "sample_count": 256, "seconds": 0.050097, "skipped": false, "status": "discard", "timestamp": "2026-06-21T20:16:23Z", "wild_points": 16}
{"affine_active_path": "all_active_fast", "affine_buffer": "resize_reuse", "affine_conversion": "batch", "affine_field_ops": "inplace", "affine_reverse_loop": "split_zero", "affine_tail_update": "skip_final", "affine_z_access": "const_ref", "affine_z_check": "infinity_flag", "backend": "macos_cpu", "batch_points": 17, "budget_sec": 5, "checksum": "0xe99a1a14d1bd0280", "commit": "bd5506c", "confirmation_index": 3, "confirmation_runs": 3, "confirmation_status": "discard", "correctness": true, "description": "Apple Silicon CPU Jacobian batch-to-affine conversion benchmark", "experiment": "jacobian_batch_affine", "field_rhs_passing": "const_ref", "iterations": 23808, "machine": "macOS-26.5-arm64-arm-64bit-Mach-O", "min_ms": 50, "operation": "jacobian_batch_affine", "ops_per_sec": 474542.597483, "ops_per_sec_max": 474542.597483, "ops_per_sec_min": 474542.597483, "paired_baseline_ops_per_sec": 299220.694915, "paired_baseline_ref": "main", "paired_speedup": 1.5859283984946426, "points_per_sec": 8067224.157216, "raw_status": "keep", "reason": "", "runner_sample_count": 1, "sample_count": 256, "seconds": 0.05017, "skipped": false, "status": "discard", "timestamp": "2026-06-21T20:16:30Z", "wild_points": 16}
{"affine_active_path": "all_active_fast", "affine_buffer": "resize_reuse", "affine_conversion": "batch", "affine_field_ops": "inplace", "affine_reverse_loop": "split_zero", "affine_tail_update": "skip_final", "affine_z_access": "const_ref", "affine_z_check": "infinity_flag", "architecture": "shared_tame", "avg_dp_count": 288.0, "backend": "macos_cpu", "budget_sec": 5, "candidate_verification": "full_point_collision", "commit": "bd5506c", "confirmation_index": 1, "confirmation_runs": 3, "confirmation_status": "discard", "correctness": true, "description": "Apple Silicon CPU shared-tame tiny 16-target kangaroo benchmark", "dp_bits": 0, "dp_bucket_storage": "inline_first", "dp_capacity": "max_load_2of3", "dp_clear": "empty_guard", "dp_hash": "partial_limb_mix", "dp_key": "x_parity", "dp_lookup": "open_address_linear", "dp_reserve": "sqrt_range_estimate", "ecint_carry_impl": "clang_builtin", "ecint_mul_final_sub": "single_conditional", "expected_private_key": "0x7", "experiment": "jacobian_kangaroo_multi16_small", "field_rhs_passing": "const_ref", "found_private_key": "0x7", "found_target_index": 15, "iterations": 631, "jacobian_step_passing": "const_ref", "jump_count": 8, "jump_index": "power2_mask", "jump_table": "precomputed", "last_dp_count": 288, "machine": "macOS-26.5-arm64-arm-64bit-Mach-O", "max_steps": 4096, "min_ms": 50, "operation": "jacobian_kangaroo_multi_small", "ops_per_sec": 12610.06957, "ops_per_sec_max": 13137.862701, "ops_per_sec_min": 7754.016536, "paired_baseline_ops_per_sec": 13218.336605, "paired_baseline_ref": "main", "paired_speedup": 0.9539830877986633, "point_passing": "const_ref", "range_bits": 8, "range_context": "precomputed", "raw_status": "discard", "reason": "", "runner_sample_count": 3, "sample_count": 1, "scratch": "reused", "seconds": 0.050039, "single_target_ops_per_sec": 25340.930949, "skipped": false, "speedup_vs_single": 0.497617, "start_scalar": "0x2", "status": "discard", "tame_states": 1, "target_count": 16, "target_throughput_vs_single": 7.961867, "timestamp": "2026-06-21T20:17:00Z", "wild_states": 16}
{"affine_active_path": "all_active_fast", "affine_buffer": "resize_reuse", "affine_conversion": "batch", "affine_field_ops": "inplace", "affine_reverse_loop": "split_zero", "affine_tail_update": "skip_final", "affine_z_access": "const_ref", "affine_z_check": "infinity_flag", "architecture": "shared_tame", "avg_dp_count": 288.0, "backend": "macos_cpu", "budget_sec": 5, "candidate_verification": "full_point_collision", "commit": "bd5506c", "confirmation_index": 2, "confirmation_runs": 3, "confirmation_status": "discard", "correctness": true, "description": "Apple Silicon CPU shared-tame tiny 16-target kangaroo benchmark", "dp_bits": 0, "dp_bucket_storage": "inline_first", "dp_capacity": "max_load_2of3", "dp_clear": "empty_guard", "dp_hash": "partial_limb_mix", "dp_key": "x_parity", "dp_lookup": "open_address_linear", "dp_reserve": "sqrt_range_estimate", "ecint_carry_impl": "clang_builtin", "ecint_mul_final_sub": "single_conditional", "expected_private_key": "0x7", "experiment": "jacobian_kangaroo_multi16_small", "field_rhs_passing": "const_ref", "found_private_key": "0x7", "found_target_index": 15, "iterations": 774, "jacobian_step_passing": "const_ref", "jump_count": 8, "jump_index": "power2_mask", "jump_table": "precomputed", "last_dp_count": 288, "machine": "macOS-26.5-arm64-arm-64bit-Mach-O", "max_steps": 4096, "min_ms": 50, "operation": "jacobian_kangaroo_multi_small", "ops_per_sec": 15469.712641, "ops_per_sec_max": 15609.229632, "ops_per_sec_min": 15272.287495, "paired_baseline_ops_per_sec": 15498.915076, "paired_baseline_ref": "main", "paired_speedup": 0.9981158400535262, "point_passing": "const_ref", "range_bits": 8, "range_context": "precomputed", "raw_status": "discard", "reason": "", "runner_sample_count": 3, "sample_count": 1, "scratch": "reused", "seconds": 0.050033, "single_target_ops_per_sec": 30748.546167, "skipped": false, "speedup_vs_single": 0.503104, "start_scalar": "0x2", "status": "discard", "tame_states": 1, "target_count": 16, "target_throughput_vs_single": 8.049662, "timestamp": "2026-06-21T20:17:08Z", "wild_states": 16}
{"affine_active_path": "all_active_fast", "affine_buffer": "resize_reuse", "affine_conversion": "batch", "affine_field_ops": "inplace", "affine_reverse_loop": "split_zero", "affine_tail_update": "skip_final", "affine_z_access": "const_ref", "affine_z_check": "infinity_flag", "architecture": "shared_tame", "avg_dp_count": 288.0, "backend": "macos_cpu", "budget_sec": 5, "candidate_verification": "full_point_collision", "commit": "bd5506c", "confirmation_index": 3, "confirmation_runs": 3, "confirmation_status": "discard", "correctness": true, "description": "Apple Silicon CPU shared-tame tiny 16-target kangaroo benchmark", "dp_bits": 0, "dp_bucket_storage": "inline_first", "dp_capacity": "max_load_2of3", "dp_clear": "empty_guard", "dp_hash": "partial_limb_mix", "dp_key": "x_parity", "dp_lookup": "open_address_linear", "dp_reserve": "sqrt_range_estimate", "ecint_carry_impl": "clang_builtin", "ecint_mul_final_sub": "single_conditional", "expected_private_key": "0x7", "experiment": "jacobian_kangaroo_multi16_small", "field_rhs_passing": "const_ref", "found_private_key": "0x7", "found_target_index": 15, "iterations": 682, "jacobian_step_passing": "const_ref", "jump_count": 8, "jump_index": "power2_mask", "jump_table": "precomputed", "last_dp_count": 288, "machine": "macOS-26.5-arm64-arm-64bit-Mach-O", "max_steps": 4096, "min_ms": 50, "operation": "jacobian_kangaroo_multi_small", "ops_per_sec": 13628.018791, "ops_per_sec_max": 15206.251116, "ops_per_sec_min": 12312.003049, "paired_baseline_ops_per_sec": 15024.061874, "paired_baseline_ref": "main", "paired_speedup": 0.9070795171966156, "point_passing": "const_ref", "range_bits": 8, "range_context": "precomputed", "raw_status": "discard", "reason": "", "runner_sample_count": 3, "sample_count": 1, "scratch": "reused", "seconds": 0.050044, "single_target_ops_per_sec": 26582.721231, "skipped": false, "speedup_vs_single": 0.512665, "start_scalar": "0x2", "status": "discard", "tame_states": 1, "target_count": 16, "target_throughput_vs_single": 8.202633, "timestamp": "2026-06-21T20:17:15Z", "wild_states": 16}
{"backend": "metal", "budget_sec": 10, "commit": "06562ce", "confirmation_index": 1, "confirmation_runs": 3, "confirmation_status": "discard", "correctness": true, "description": "Stable Metal Jacobian jump-table walk with projective distinguished-point candidate flags", "distance_checksum": "0xa45f471493cace2f", "distance_tracking": "uint64", "dp_bits": 4, "dp_checksum": "0x30a7914972cba014", "dp_count": 1000, "dp_tracking": "projective_x_limb0", "experiment": "metal_jacobian_jump_walk_dp_stable", "iterations": 3801088, "jump_count": 16, "machine": "macOS-26.5-arm64-arm-64bit-Mach-O", "max_threads_per_threadgroup": 1024, "min_ms": 200, "operation": "jacobian_affine_walk_jump_table", "ops_per_sec": 18838868.887764, "ops_per_sec_max": 19533547.144444, "ops_per_sec_min": 18774834.156754, "paired_baseline_ops_per_sec": 19686904.51786, "paired_baseline_ref": "main", "paired_speedup": 0.9569238714330808, "raw_status": "discard", "reason": "", "runner_sample_count": 3, "sample_count": 16384, "seconds": 0.201768, "skipped": false, "status": "discard", "steps_per_sample": 8, "thread_execution_width": 32, "threadgroup_limit": 256, "threads_per_threadgroup": 256, "timestamp": "2026-06-21T20:31:05Z"}
{"backend": "metal", "budget_sec": 10, "commit": "06562ce", "confirmation_index": 2, "confirmation_runs": 3, "confirmation_status": "discard", "correctness": true, "description": "Stable Metal Jacobian jump-table walk with projective distinguished-point candidate flags", "distance_checksum": "0xa45f471493cace2f", "distance_tracking": "uint64", "dp_bits": 4, "dp_checksum": "0x30a7914972cba014", "dp_count": 1000, "dp_tracking": "projective_x_limb0", "experiment": "metal_jacobian_jump_walk_dp_stable", "iterations": 3932160, "jump_count": 16, "machine": "macOS-26.5-arm64-arm-64bit-Mach-O", "max_threads_per_threadgroup": 1024, "min_ms": 200, "operation": "jacobian_affine_walk_jump_table", "ops_per_sec": 19585916.675128, "ops_per_sec_max": 19785311.775239, "ops_per_sec_min": 19289497.239222, "paired_baseline_ops_per_sec": 19535301.802543, "paired_baseline_ref": "main", "paired_speedup": 1.0025909439790899, "raw_status": "discard", "reason": "", "runner_sample_count": 3, "sample_count": 16384, "seconds": 0.200765, "skipped": false, "status": "discard", "steps_per_sample": 8, "thread_execution_width": 32, "threadgroup_limit": 256, "threads_per_threadgroup": 256, "timestamp": "2026-06-21T20:32:21Z"}
{"backend": "metal", "budget_sec": 10, "commit": "06562ce", "confirmation_index": 3, "confirmation_runs": 3, "confirmation_status": "discard", "correctness": true, "description": "Stable Metal Jacobian jump-table walk with projective distinguished-point candidate flags", "distance_checksum": "0xa45f471493cace2f", "distance_tracking": "uint64", "dp_bits": 4, "dp_checksum": "0x30a7914972cba014", "dp_count": 1000, "dp_tracking": "projective_x_limb0", "experiment": "metal_jacobian_jump_walk_dp_stable", "iterations": 3801088, "jump_count": 16, "machine": "macOS-26.5-arm64-arm-64bit-Mach-O", "max_threads_per_threadgroup": 1024, "min_ms": 200, "operation": "jacobian_affine_walk_jump_table", "ops_per_sec": 18908094.981902, "ops_per_sec_max": 25645115.618683, "ops_per_sec_min": 17663506.735239, "paired_baseline_ops_per_sec": 20095896.216572, "paired_baseline_ref": "main", "paired_speedup": 0.9408933435031135, "raw_status": "discard", "reason": "", "runner_sample_count": 3, "sample_count": 16384, "seconds": 0.20103, "skipped": false, "status": "discard", "steps_per_sample": 8, "thread_execution_width": 32, "threadgroup_limit": 256, "threads_per_threadgroup": 256, "timestamp": "2026-06-21T20:33:56Z"}
{"backend": "metal", "budget_sec": 10, "commit": "35b2a71", "confirmation_index": 1, "confirmation_runs": 3, "confirmation_status": "discard", "correctness": true, "description": "Stable Metal Jacobian jump-table walk with projective distinguished-point candidate flags", "distance_checksum": "0xa45f471493cace2f", "distance_tracking": "uint64", "dp_bits": 4, "dp_checksum": "0x30a7914972cba014", "dp_count": 1000, "dp_tracking": "projective_x_limb0", "experiment": "metal_jacobian_jump_walk_dp_stable", "iterations": 6422528, "jump_count": 16, "machine": "macOS-26.5-arm64-arm-64bit-Mach-O", "max_threads_per_threadgroup": 1024, "min_ms": 200, "operation": "jacobian_affine_walk_jump_table", "ops_per_sec": 31843094.415179, "ops_per_sec_max": 34563172.198927, "ops_per_sec_min": 27758573.007488, "paired_baseline_ops_per_sec": 30975577.554428, "paired_baseline_ref": "main", "paired_speedup": 1.0280064789502847, "raw_status": "keep", "reason": "", "runner_sample_count": 3, "sample_count": 16384, "seconds": 0.201693, "skipped": false, "status": "discard", "steps_per_sample": 8, "thread_execution_width": 32, "threadgroup_limit": 256, "threads_per_threadgroup": 256, "timestamp": "2026-06-21T20:42:35Z"}
