{"affine_scan_mode": "cpu_batch_prod_zz_zzz", "affine_scan_seconds": 0.02894, "backend": "metal", "budget_sec": 120, "bytes_per_target": 2.683818, "candidate_verification": "tag16_fast_filter_then_cpu_exact_key_equality", "commit": "8ae72aa-dirty", "confirmation_index": 1, "confirmation_runs": 2, "confirmation_status": "discard", "cooldown_sec": 10.0, "correctness": true, "description": "Lookup-only metric for explicit tag16 fast-key filter versus tag16 prehashed filter on a 25M-target distinct-miss batch", "distance_tracking": "packet_distance_uint64", "dp_bits": 8, "dp_checksum": "0x9dba4a07ebbb8e14", "dp_count": 1057, "dp_distance_checksum": "0xf0dc88ed68b2ff64", "dp_query_count": 1057, "dp_tracking": "affine_x256_y_parity_cpu_batch", "exact_host_table_bytes": 1268635456, "experiment": "metal_jacobian_dynamic_dp_stream_xyzz_affine_scan_target_lookup_tag16_fast_filter25m_lookup", "filter_false_positive_count": 249, "filter_positive_count": 313, "gpu_lookup_lookups_per_sec": 27227928.066739, "gpu_ops_per_sec": 25800815.323987, "hit_count": 64, "injected_hits": 64, "iterations": 134217728, "jump_count": 16, "jump_histogram_max_bucket": 8394316, "jump_histogram_max_deviation_ppm": 759, "jump_histogram_min_bucket": 8382245, "jump_index": "power2_mask", "jump_mixer": "avalanche64", "jump_schedule": "power2", "lookup_engine": "gpu_filter16_fast", "lookup_engine_effective": "gpu_filter16_fast", "lookup_exact_seconds": 0.006593, "lookup_gpu_seconds": 0.039752, "lookup_hash_seconds": 0.0, "lookup_layout": "open_address_tag16_fast_filter_exact256", "lookup_max_threads_per_threadgroup": 1024, "lookup_query_mode": "distinct_misses", "lookup_repeat": 1024, "lookup_seconds": 0.046345, "lookup_thread_execution_width": 32, "lookup_threadgroup_limit": 512, "lookup_threads_per_threadgroup": 512, "lookups_per_sec": 23354516.79114, "lookups_per_sec_max": 51079287.128399, "lookups_per_sec_min": 19066068.646605, "machine": "macOS-26.5-arm64-arm-64bit-Mach-O", "max_threads_per_threadgroup": 1024, "min_ms": 500, "miss_count": 1082304, "operation": "jacobian_affine_scan_target_lookup_tag32", "ops_per_sec": 23354516.79114, "ops_per_sec_max": 51079287.128399, "ops_per_sec_min": 19066068.646605, "output_layout": "affine_dp_scan_target_lookup", "paired_baseline_ops_per_sec": 26384687.341231, "paired_baseline_ref": "HEAD", "paired_speedup": 0.8851541990662216, "query_count": 1082368, "query_input": "key40_fast_hash", "raw_status": "discard", "reason": "", "requested_hits": 64, "runner_sample_count": 3, "sample_count": 262144, "seconds": 5.202073, "skipped": false, "state_layout": "xyzz", "status": "discard", "steps_per_sample": 512, "target_bucket_bytes": 268435456, "target_count": 25005000, "target_filter_bucket_bytes": 67108864, "target_key": "x256_y_parity", "target_key_bytes": 1000200000, "target_lookup_checksum": "0x8b2568562837af7f", "target_query_hash_bytes": 0, "target_table_buckets": 33554432, "target_table_bytes": 67108864, "thread_execution_width": 32, "threadgroup_limit": 128, "threads_per_threadgroup": 128, "timestamp": "2026-06-27T17:31:27Z", "validation_seconds": 26.630439, "validation_workers": 8}
{"affine_scan_mode": "cpu_batch_prod_zz_zzz", "affine_scan_seconds": 0.149074, "backend": "metal", "budget_sec": 120, "bytes_per_target": 2.683818, "candidate_verification": "tag16_fast_filter_then_cpu_exact_key_equality", "commit": "8ae72aa-dirty", "confirmation_index": 2, "confirmation_runs": 2, "confirmation_status": "discard", "cooldown_sec": 10.0, "correctness": true, "description": "Lookup-only metric for explicit tag16 fast-key filter versus tag16 prehashed filter on a 25M-target distinct-miss batch", "distance_tracking": "packet_distance_uint64", "dp_bits": 8, "dp_checksum": "0x9dba4a07ebbb8e14", "dp_count": 1057, "dp_distance_checksum": "0xf0dc88ed68b2ff64", "dp_query_count": 1057, "dp_tracking": "affine_x256_y_parity_cpu_batch", "exact_host_table_bytes": 1268635456, "experiment": "metal_jacobian_dynamic_dp_stream_xyzz_affine_scan_target_lookup_tag16_fast_filter25m_lookup", "filter_false_positive_count": 249, "filter_positive_count": 313, "gpu_lookup_lookups_per_sec": 78807467.388478, "gpu_ops_per_sec": 37655281.621744, "hit_count": 64, "injected_hits": 64, "iterations": 134217728, "jump_count": 16, "jump_histogram_max_bucket": 8394316, "jump_histogram_max_deviation_ppm": 759, "jump_histogram_min_bucket": 8382245, "jump_index": "power2_mask", "jump_mixer": "avalanche64", "jump_schedule": "power2", "lookup_engine": "gpu_filter16_fast", "lookup_engine_effective": "gpu_filter16_fast", "lookup_exact_seconds": 0.000123, "lookup_gpu_seconds": 0.013734, "lookup_hash_seconds": 0.0, "lookup_layout": "open_address_tag16_fast_filter_exact256", "lookup_max_threads_per_threadgroup": 1024, "lookup_query_mode": "distinct_misses", "lookup_repeat": 1024, "lookup_seconds": 0.013857, "lookup_thread_execution_width": 32, "lookup_threadgroup_limit": 512, "lookup_threads_per_threadgroup": 512, "lookups_per_sec": 78110309.682183, "lookups_per_sec_max": 83979087.782, "lookups_per_sec_min": 20081116.45403, "machine": "macOS-26.5-arm64-arm-64bit-Mach-O", "max_threads_per_threadgroup": 1024, "min_ms": 500, "miss_count": 1082304, "operation": "jacobian_affine_scan_target_lookup_tag32", "ops_per_sec": 78110309.682183, "ops_per_sec_max": 83979087.782, "ops_per_sec_min": 20081116.45403, "output_layout": "affine_dp_scan_target_lookup", "paired_baseline_ops_per_sec": 12251668.020419, "paired_baseline_ref": "HEAD", "paired_speedup": 6.375483693485817, "query_count": 1082368, "query_input": "key40_fast_hash", "raw_status": "keep", "reason": "", "requested_hits": 64, "runner_sample_count": 3, "sample_count": 262144, "seconds": 3.56438, "skipped": false, "state_layout": "xyzz", "status": "discard", "steps_per_sample": 512, "target_bucket_bytes": 268435456, "target_count": 25005000, "target_filter_bucket_bytes": 67108864, "target_key": "x256_y_parity", "target_key_bytes": 1000200000, "target_lookup_checksum": "0x8b2568562837af7f", "target_query_hash_bytes": 0, "target_table_buckets": 33554432, "target_table_bytes": 67108864, "thread_execution_width": 32, "threadgroup_limit": 128, "threads_per_threadgroup": 128, "timestamp": "2026-06-27T17:31:27Z", "validation_seconds": 23.57712, "validation_workers": 8}
{"affine_scan_mode": "cpu_batch_prod_zz_zzz", "affine_scan_seconds": 0.017561, "backend": "metal", "budget_sec": 120, "bytes_per_target": 2.683818, "candidate_verification": "tag16_hash_filter_then_cpu_exact_key_equality", "commit": "8dd4011-dirty", "confirmation_index": 1, "confirmation_runs": 2, "confirmation_status": "discard", "cooldown_sec": 10.0, "correctness": true, "description": "Metal XYZZ affine DP scan auto-routing to tag16 hash filter on a 25M-target repeat4096 distinct-miss batch", "distance_tracking": "packet_distance_uint64", "dp_bits": 8, "dp_checksum": "0x9dba4a07ebbb8e14", "dp_count": 1057, "dp_distance_checksum": "0xf0dc88ed68b2ff64", "dp_query_count": 1057, "dp_tracking": "affine_x256_y_parity_cpu_batch", "exact_host_table_bytes": 1268635456, "experiment": "metal_jacobian_dynamic_dp_stream_xyzz_affine_scan_target_lookup_tag16_hash_filter25m_repeat4096_auto", "filter_false_positive_count": 900, "filter_positive_count": 964, "gpu_lookup_lookups_per_sec": 411853465.784311, "gpu_ops_per_sec": 121920708.753882, "hit_count": 64, "injected_hits": 64, "iterations": 134217728, "jump_count": 16, "jump_histogram_max_bucket": 8394316, "jump_histogram_max_deviation_ppm": 759, "jump_histogram_min_bucket": 8382245, "jump_index": "power2_mask", "jump_mixer": "avalanche64", "jump_schedule": "power2", "lookup_engine": "auto", "lookup_engine_effective": "gpu_filter16_hash", "lookup_exact_seconds": 0.000321, "lookup_gpu_seconds": 0.010512, "lookup_hash_seconds": 0.02292, "lookup_layout": "open_address_tag16_hash_filter_exact256", "lookup_max_threads_per_threadgroup": 1024, "lookup_query_mode": "distinct_misses", "lookup_repeat": 4096, "lookup_seconds": 0.033754, "lookup_thread_execution_width": 32, "lookup_threadgroup_limit": 512, "lookup_threads_per_threadgroup": 512, "lookups_per_sec": 128265450.020738, "machine": "macOS-26.5-arm64-arm-64bit-Mach-O", "max_threads_per_threadgroup": 1024, "min_ms": 500, "miss_count": 4329408, "operation": "jacobian_affine_scan_target_lookup_tag32", "ops_per_sec": 116490697.814699, "ops_per_sec_max": 121033489.365624, "ops_per_sec_min": 104157672.079987, "output_layout": "affine_dp_scan_target_lookup", "paired_baseline_ops_per_sec": 91841252.102085, "paired_baseline_ref": "HEAD", "paired_speedup": 1.268391873460253, "query_count": 4329472, "query_input": "hash64", "raw_status": "keep", "reason": "", "requested_hits": 64, "runner_sample_count": 3, "sample_count": 262144, "seconds": 1.100861, "skipped": false, "state_layout": "xyzz", "status": "discard", "steps_per_sample": 512, "target_bucket_bytes": 268435456, "target_count": 25005000, "target_filter_bucket_bytes": 67108864, "target_key": "x256_y_parity", "target_key_bytes": 1000200000, "target_lookup_checksum": "0x78c54b7ab782db0e", "target_query_hash_bytes": 34635776, "target_table_buckets": 33554432, "target_table_bytes": 67108864, "thread_execution_width": 32, "threadgroup_limit": 128, "threads_per_threadgroup": 128, "timestamp": "2026-06-27T17:48:28Z", "validation_seconds": 4.211537, "validation_workers": 8}
{"affine_scan_mode": "cpu_batch_prod_zz_zzz", "affine_scan_seconds": 0.029516, "backend": "metal", "budget_sec": 120, "bytes_per_target": 2.683818, "candidate_verification": "tag16_hash_filter_then_cpu_exact_key_equality", "commit": "8dd4011-dirty", "confirmation_index": 2, "confirmation_runs": 2, "confirmation_status": "discard", "cooldown_sec": 10.0, "correctness": true, "description": "Metal XYZZ affine DP scan auto-routing to tag16 hash filter on a 25M-target repeat4096 distinct-miss batch", "distance_tracking": "packet_distance_uint64", "dp_bits": 8, "dp_checksum": "0x9dba4a07ebbb8e14", "dp_count": 1057, "dp_distance_checksum": "0xf0dc88ed68b2ff64", "dp_query_count": 1057, "dp_tracking": "affine_x256_y_parity_cpu_batch", "exact_host_table_bytes": 1268635456, "experiment": "metal_jacobian_dynamic_dp_stream_xyzz_affine_scan_target_lookup_tag16_hash_filter25m_repeat4096_auto", "filter_false_positive_count": 900, "filter_positive_count": 964, "gpu_lookup_lookups_per_sec": 102654531.279034, "gpu_ops_per_sec": 80534363.559887, "hit_count": 64, "injected_hits": 64, "iterations": 134217728, "jump_count": 16, "jump_histogram_max_bucket": 8394316, "jump_histogram_max_deviation_ppm": 759, "jump_histogram_min_bucket": 8382245, "jump_index": "power2_mask", "jump_mixer": "avalanche64", "jump_schedule": "power2", "lookup_engine": "auto", "lookup_engine_effective": "gpu_filter16_hash", "lookup_exact_seconds": 0.000371, "lookup_gpu_seconds": 0.042175, "lookup_hash_seconds": 0.023762, "lookup_layout": "open_address_tag16_hash_filter_exact256", "lookup_max_threads_per_threadgroup": 1024, "lookup_query_mode": "distinct_misses", "lookup_repeat": 4096, "lookup_seconds": 0.066308, "lookup_thread_execution_width": 32, "lookup_threadgroup_limit": 512, "lookup_threads_per_threadgroup": 512, "lookups_per_sec": 65293564.07002, "machine": "macOS-26.5-arm64-arm-64bit-Mach-O", "max_threads_per_threadgroup": 1024, "min_ms": 500, "miss_count": 4329408, "operation": "jacobian_affine_scan_target_lookup_tag32", "ops_per_sec": 76155652.63975, "ops_per_sec_max": 104952419.42732, "ops_per_sec_min": 49086232.860695, "output_layout": "affine_dp_scan_target_lookup", "paired_baseline_ops_per_sec": 82761070.389746, "paired_baseline_ref": "HEAD", "paired_speedup": 0.9201868980320197, "query_count": 4329472, "query_input": "hash64", "raw_status": "discard", "reason": "", "requested_hits": 64, "runner_sample_count": 3, "sample_count": 262144, "seconds": 1.66659, "skipped": false, "state_layout": "xyzz", "status": "discard", "steps_per_sample": 512, "target_bucket_bytes": 268435456, "target_count": 25005000, "target_filter_bucket_bytes": 67108864, "target_key": "x256_y_parity", "target_key_bytes": 1000200000, "target_lookup_checksum": "0x78c54b7ab782db0e", "target_query_hash_bytes": 34635776, "target_table_buckets": 33554432, "target_table_bytes": 67108864, "thread_execution_width": 32, "threadgroup_limit": 128, "threads_per_threadgroup": 128, "timestamp": "2026-06-27T17:48:28Z", "validation_seconds": 5.940363, "validation_workers": 8}
{"affine_scan_mode": "cpu_batch_prod_zz_zzz", "affine_scan_seconds": 0.737381, "backend": "metal", "budget_sec": 120, "bytes_per_target": 2.683818, "candidate_verification": "tag16_hash_filter_then_cpu_exact_key_equality", "commit": "040bed7-dirty", "confirmation_index": 1, "confirmation_runs": 2, "confirmation_status": "keep", "cooldown_sec": 10.0, "correctness": true, "description": "Metal XYZZ affine DP scan tag16 hash-filter 25M-target repeat4096 lookup with thresholded parallel host query-hash build", "distance_tracking": "packet_distance_uint64", "dp_bits": 8, "dp_checksum": "0x9dba4a07ebbb8e14", "dp_count": 1057, "dp_distance_checksum": "0xf0dc88ed68b2ff64", "dp_query_count": 1057, "dp_tracking": "affine_x256_y_parity_cpu_batch", "exact_host_table_bytes": 1268635456, "experiment": "metal_jacobian_dynamic_dp_stream_xyzz_affine_scan_target_lookup_tag16_hash_filter25m_parallel_hash_repeat4096", "filter_false_positive_count": 900, "filter_positive_count": 964, "gpu_lookup_lookups_per_sec": 39272422.040223, "gpu_ops_per_sec": 49009362.378782, "hit_count": 64, "injected_hits": 64, "iterations": 134217728, "jump_count": 16, "jump_histogram_max_bucket": 8394316, "jump_histogram_max_deviation_ppm": 759, "jump_histogram_min_bucket": 8382245, "jump_index": "power2_mask", "jump_mixer": "avalanche64", "jump_schedule": "power2", "lookup_engine": "gpu_filter16_hash", "lookup_engine_effective": "gpu_filter16_hash", "lookup_exact_seconds": 0.000996, "lookup_gpu_seconds": 0.110242, "lookup_hash_seconds": 0.088505, "lookup_layout": "open_address_tag16_hash_filter_exact256", "lookup_max_threads_per_threadgroup": 1024, "lookup_query_mode": "distinct_misses", "lookup_repeat": 4096, "lookup_seconds": 0.199743, "lookup_thread_execution_width": 32, "lookup_threadgroup_limit": 512, "lookup_threads_per_threadgroup": 512, "lookups_per_sec": 21675244.226311, "lookups_per_sec_max": 45509675.927386, "lookups_per_sec_min": 11576561.689475, "machine": "macOS-26.5-arm64-arm-64bit-Mach-O", "max_threads_per_threadgroup": 1024, "min_ms": 500, "miss_count": 4329408, "operation": "jacobian_affine_scan_target_lookup_tag32", "ops_per_sec": 21675244.226311, "ops_per_sec_max": 45509675.927386, "ops_per_sec_min": 11576561.689475, "output_layout": "affine_dp_scan_target_lookup", "paired_baseline_ops_per_sec": 10124044.254344, "paired_baseline_ref": "HEAD", "paired_speedup": 2.1409669576474477, "query_count": 4329472, "query_input": "hash64", "raw_status": "keep", "reason": "", "requested_hits": 64, "runner_sample_count": 3, "sample_count": 262144, "seconds": 2.738614, "skipped": false, "state_layout": "xyzz", "status": "keep", "steps_per_sample": 512, "target_bucket_bytes": 268435456, "target_count": 25005000, "target_filter_bucket_bytes": 67108864, "target_key": "x256_y_parity", "target_key_bytes": 1000200000, "target_lookup_checksum": "0x78c54b7ab782db0e", "target_query_hash_bytes": 34635776, "target_table_buckets": 33554432, "target_table_bytes": 67108864, "thread_execution_width": 32, "threadgroup_limit": 128, "threads_per_threadgroup": 128, "timestamp": "2026-06-27T18:02:44Z", "validation_seconds": 6.759423, "validation_workers": 8}
{"affine_scan_mode": "cpu_batch_prod_zz_zzz", "affine_scan_seconds": 0.038307, "backend": "metal", "budget_sec": 120, "bytes_per_target": 2.683818, "candidate_verification": "tag16_hash_filter_then_cpu_exact_key_equality", "commit": "040bed7-dirty", "confirmation_index": 2, "confirmation_runs": 2, "confirmation_status": "keep", "cooldown_sec": 10.0, "correctness": true, "description": "Metal XYZZ affine DP scan tag16 hash-filter 25M-target repeat4096 lookup with thresholded parallel host query-hash build", "distance_tracking": "packet_distance_uint64", "dp_bits": 8, "dp_checksum": "0x9dba4a07ebbb8e14", "dp_count": 1057, "dp_distance_checksum": "0xf0dc88ed68b2ff64", "dp_query_count": 1057, "dp_tracking": "affine_x256_y_parity_cpu_batch", "exact_host_table_bytes": 1268635456, "experiment": "metal_jacobian_dynamic_dp_stream_xyzz_affine_scan_target_lookup_tag16_hash_filter25m_parallel_hash_repeat4096", "filter_false_positive_count": 900, "filter_positive_count": 964, "gpu_lookup_lookups_per_sec": 126310518.395199, "gpu_ops_per_sec": 54311403.498789, "hit_count": 64, "injected_hits": 64, "iterations": 134217728, "jump_count": 16, "jump_histogram_max_bucket": 8394316, "jump_histogram_max_deviation_ppm": 759, "jump_histogram_min_bucket": 8382245, "jump_index": "power2_mask", "jump_mixer": "avalanche64", "jump_schedule": "power2", "lookup_engine": "gpu_filter16_hash", "lookup_engine_effective": "gpu_filter16_hash", "lookup_exact_seconds": 0.000452, "lookup_gpu_seconds": 0.034276, "lookup_hash_seconds": 0.059608, "lookup_layout": "open_address_tag16_hash_filter_exact256", "lookup_max_threads_per_threadgroup": 1024, "lookup_query_mode": "distinct_misses", "lookup_repeat": 4096, "lookup_seconds": 0.094337, "lookup_thread_execution_width": 32, "lookup_threadgroup_limit": 512, "lookup_threads_per_threadgroup": 512, "lookups_per_sec": 45893820.612292, "lookups_per_sec_max": 50878375.382505, "lookups_per_sec_min": 19980960.391453, "machine": "macOS-26.5-arm64-arm-64bit-Mach-O", "max_threads_per_threadgroup": 1024, "min_ms": 500, "miss_count": 4329408, "operation": "jacobian_affine_scan_target_lookup_tag32", "ops_per_sec": 45893820.612292, "ops_per_sec_max": 50878375.382505, "ops_per_sec_min": 19980960.391453, "output_layout": "affine_dp_scan_target_lookup", "paired_baseline_ops_per_sec": 29851024.943759, "paired_baseline_ref": "HEAD", "paired_speedup": 1.5374286376685062, "query_count": 4329472, "query_input": "hash64", "raw_status": "keep", "reason": "", "requested_hits": 64, "runner_sample_count": 3, "sample_count": 262144, "seconds": 2.471262, "skipped": false, "state_layout": "xyzz", "status": "keep", "steps_per_sample": 512, "target_bucket_bytes": 268435456, "target_count": 25005000, "target_filter_bucket_bytes": 67108864, "target_key": "x256_y_parity", "target_key_bytes": 1000200000, "target_lookup_checksum": "0x78c54b7ab782db0e", "target_query_hash_bytes": 34635776, "target_table_buckets": 33554432, "target_table_bytes": 67108864, "thread_execution_width": 32, "threadgroup_limit": 128, "threads_per_threadgroup": 128, "timestamp": "2026-06-27T18:02:44Z", "validation_seconds": 7.36597, "validation_workers": 8}
{"affine_scan_mode": "cpu_batch_prod_zz_zzz", "affine_scan_seconds": 0.017029, "backend": "metal", "budget_sec": 120, "bytes_per_target": 2.683818, "candidate_verification": "tag16_hash_filter_then_cpu_exact_key_equality", "commit": "b2bdf82-dirty", "confirmation_index": 1, "confirmation_runs": 2, "confirmation_status": "keep", "cooldown_sec": 10.0, "correctness": true, "description": "Metal XYZZ affine DP scan tag16 hash-filter 25M-target repeat2048 lookup with thresholded parallel host query-hash build", "distance_tracking": "packet_distance_uint64", "dp_bits": 8, "dp_checksum": "0x9dba4a07ebbb8e14", "dp_count": 1057, "dp_distance_checksum": "0xf0dc88ed68b2ff64", "dp_query_count": 1057, "dp_tracking": "affine_x256_y_parity_cpu_batch", "exact_host_table_bytes": 1268635456, "experiment": "metal_jacobian_dynamic_dp_stream_xyzz_affine_scan_target_lookup_tag16_hash_filter25m_parallel_hash_repeat2048", "filter_false_positive_count": 444, "filter_positive_count": 508, "gpu_lookup_lookups_per_sec": 85722076.597918, "gpu_ops_per_sec": 122521717.937763, "hit_count": 64, "injected_hits": 64, "iterations": 134217728, "jump_count": 16, "jump_histogram_max_bucket": 8394316, "jump_histogram_max_deviation_ppm": 759, "jump_histogram_min_bucket": 8382245, "jump_index": "power2_mask", "jump_mixer": "avalanche64", "jump_schedule": "power2", "lookup_engine": "gpu_filter16_hash", "lookup_engine_effective": "gpu_filter16_hash", "lookup_exact_seconds": 0.001566, "lookup_gpu_seconds": 0.025253, "lookup_hash_seconds": 0.011318, "lookup_layout": "open_address_tag16_hash_filter_exact256", "lookup_max_threads_per_threadgroup": 1024, "lookup_query_mode": "distinct_misses", "lookup_repeat": 2048, "lookup_seconds": 0.038136, "lookup_thread_execution_width": 32, "lookup_threadgroup_limit": 512, "lookup_threads_per_threadgroup": 512, "lookups_per_sec": 56763210.855813, "lookups_per_sec_max": 66928605.336428, "lookups_per_sec_min": 30519239.41912, "machine": "macOS-26.5-arm64-arm-64bit-Mach-O", "max_threads_per_threadgroup": 1024, "min_ms": 500, "miss_count": 2164672, "operation": "jacobian_affine_scan_target_lookup_tag32", "ops_per_sec": 56763210.855813, "ops_per_sec_max": 66928605.336428, "ops_per_sec_min": 30519239.41912, "output_layout": "affine_dp_scan_target_lookup", "paired_baseline_ops_per_sec": 46262580.174655, "paired_baseline_ref": "040bed7", "paired_speedup": 1.2269789242518467, "query_count": 2164736, "query_input": "hash64", "raw_status": "keep", "reason": "", "requested_hits": 64, "runner_sample_count": 3, "sample_count": 262144, "seconds": 1.095461, "skipped": false, "state_layout": "xyzz", "status": "keep", "steps_per_sample": 512, "target_bucket_bytes": 268435456, "target_count": 25005000, "target_filter_bucket_bytes": 67108864, "target_key": "x256_y_parity", "target_key_bytes": 1000200000, "target_lookup_checksum": "0x90b9fdeac531859a", "target_query_hash_bytes": 17317888, "target_table_buckets": 33554432, "target_table_bytes": 67108864, "thread_execution_width": 32, "threadgroup_limit": 128, "threads_per_threadgroup": 128, "timestamp": "2026-06-27T18:13:33Z", "validation_seconds": 4.074217, "validation_workers": 8}
