{"backend": "metal", "budget_sec": 120, "commit": "be247bc-dirty", "confirmation_index": 2, "confirmation_runs": 2, "confirmation_status": "discard", "correctness": true, "description": "Metal dynamic Jacobian DP count-only probe with runtime dp_bits=8 mask", "distance_tracking": "none", "dp_bits": 8, "dp_count": 61, "dp_tracking": "projective_x_limb0", "experiment": "metal_jacobian_dynamic_dp_count_dp8", "iterations": 11403264, "jump_count": 16, "jump_histogram_max_bucket": 8336, "jump_histogram_max_deviation_ppm": 17578, "jump_histogram_min_bucket": 8082, "jump_index": "power2_mask", "jump_mixer": "avalanche64", "machine": "macOS-26.5-arm64-arm-64bit-Mach-O", "max_threads_per_threadgroup": 1024, "min_ms": 200, "operation": "jacobian_affine_walk_dynamic_dp_count", "ops_per_sec": 56888060.46332, "ops_per_sec_max": 63083480.756547, "ops_per_sec_min": 40444002.411551, "output_bytes_total": 4, "output_layout": "dp_count", "paired_baseline_ops_per_sec": 42842463.991402, "paired_baseline_ref": "main", "paired_speedup": 1.3278428727800715, "raw_status": "keep", "reason": "", "runner_sample_count": 3, "sample_count": 16384, "seconds": 0.200451, "skipped": false, "status": "discard", "steps_per_sample": 8, "thread_execution_width": 32, "threadgroup_limit": 128, "threads_per_threadgroup": 128, "timestamp": "2026-06-22T11:22:05Z"}
{"backend": "metal", "budget_sec": 120, "commit": "ce12827-dirty", "correctness": true, "description": "Metal dynamic Jacobian DP stream with runtime dp_bits=12 mask", "distance_tracking": "dp_stream_uint64", "dp_bits": 12, "dp_capacity": 16384, "dp_checksum": "0xccdf6d15eaf2c6b0", "dp_count": 3, "dp_distance_checksum": "0xfb58c602127bde02", "dp_stream_overflow": false, "dp_tracking": "projective_x_limb0", "emitted_records": 3, "experiment": "metal_jacobian_dynamic_dp_stream_dp12", "iterations": 7995392, "jump_count": 16, "jump_histogram_max_bucket": 8336, "jump_histogram_max_deviation_ppm": 17578, "jump_histogram_min_bucket": 8082, "jump_index": "power2_mask", "jump_mixer": "avalanche64", "machine": "macOS-26.5-arm64-arm-64bit-Mach-O", "max_threads_per_threadgroup": 1024, "min_ms": 200, "operation": "jacobian_affine_walk_dynamic_dp_stream", "ops_per_sec": 39603303.230057, "ops_per_sec_max": 39707503.885942, "ops_per_sec_min": 32723053.250208, "output_bytes_per_record": 20, "output_bytes_total": 60, "output_layout": "dp_stream", "reason": "", "runner_sample_count": 3, "sample_count": 16384, "seconds": 0.201887, "skipped": false, "status": "keep", "steps_per_sample": 8, "thread_execution_width": 32, "threadgroup_limit": 256, "threads_per_threadgroup": 256, "timestamp": "2026-06-22T11:29:05Z"}
{"backend": "metal", "budget_sec": 120, "commit": "75d71a6-dirty", "correctness": true, "description": "Metal dynamic Jacobian DP stream with runtime dp_bits=12 mask", "distance_tracking": "dp_stream_uint64", "dp_bits": 12, "dp_capacity": 16384, "dp_checksum": "0xccdf6d15eaf2c6b0", "dp_count": 3, "dp_distance_checksum": "0xfb58c602127bde02", "dp_stream_overflow": false, "dp_tracking": "projective_x_limb0", "emitted_records": 3, "experiment": "metal_jacobian_dynamic_dp_stream_dp12", "iterations": 7077888, "jump_count": 16, "jump_histogram_max_bucket": 8336, "jump_histogram_max_deviation_ppm": 17578, "jump_histogram_min_bucket": 8082, "jump_index": "power2_mask", "jump_mixer": "avalanche64", "machine": "macOS-26.5-arm64-arm-64bit-Mach-O", "max_threads_per_threadgroup": 1024, "min_ms": 200, "operation": "jacobian_affine_walk_dynamic_dp_stream", "ops_per_sec": 35307732.434448, "ops_per_sec_max": 43014286.776302, "ops_per_sec_min": 33279343.640396, "output_bytes_per_record": 20, "output_bytes_total": 60, "output_layout": "dp_stream", "paired_baseline_ops_per_sec": 39646497.326093, "paired_baseline_ref": "main", "paired_speedup": 0.8905637273336253, "reason": "", "runner_sample_count": 3, "sample_count": 16384, "seconds": 0.200463, "skipped": false, "status": "discard", "steps_per_sample": 8, "thread_execution_width": 32, "threadgroup_limit": 256, "threads_per_threadgroup": 256, "timestamp": "2026-06-22T11:34:06Z"}
{"backend": "metal", "budget_sec": 120, "commit": "e4a8aa4-dirty", "correctness": true, "description": "Metal dynamic Jacobian DP stream with runtime dp_bits=12 mask", "distance_tracking": "dp_stream_uint64", "dp_bits": 12, "dp_capacity": 16384, "dp_checksum": "0xccdf6d15eaf2c6b0", "dp_count": 3, "dp_distance_checksum": "0xfb58c602127bde02", "dp_stream_overflow": false, "dp_tracking": "projective_x_limb0", "emitted_records": 3, "experiment": "metal_jacobian_dynamic_dp_stream_dp12", "iterations": 4587520, "jump_count": 16, "jump_histogram_max_bucket": 8336, "jump_histogram_max_deviation_ppm": 17578, "jump_histogram_min_bucket": 8082, "jump_index": "power2_mask", "jump_mixer": "avalanche64", "machine": "macOS-26.5-arm64-arm-64bit-Mach-O", "max_threads_per_threadgroup": 1024, "min_ms": 200, "operation": "jacobian_affine_walk_dynamic_dp_stream", "ops_per_sec": 22566572.599272, "ops_per_sec_max": 31723066.625079, "ops_per_sec_min": 22240797.942765, "output_bytes_per_record": 20, "output_bytes_total": 60, "output_layout": "dp_stream", "paired_baseline_ops_per_sec": 21412443.160846, "paired_baseline_ref": "main", "paired_speedup": 1.0538999417187667, "reason": "", "runner_sample_count": 3, "sample_count": 16384, "seconds": 0.203288, "skipped": false, "status": "keep", "steps_per_sample": 8, "thread_execution_width": 32, "threadgroup_limit": 128, "threads_per_threadgroup": 128, "timestamp": "2026-06-22T11:43:45Z"}
{"backend": "metal", "budget_sec": 120, "commit": "e4a8aa4-dirty", "confirmation_index": 1, "confirmation_runs": 2, "confirmation_status": "keep", "correctness": true, "description": "Metal dynamic Jacobian DP stream with runtime dp_bits=12 mask", "distance_tracking": "dp_stream_uint64", "dp_bits": 12, "dp_capacity": 16384, "dp_checksum": "0xccdf6d15eaf2c6b0", "dp_count": 3, "dp_distance_checksum": "0xfb58c602127bde02", "dp_stream_overflow": false, "dp_tracking": "projective_x_limb0", "emitted_records": 3, "experiment": "metal_jacobian_dynamic_dp_stream_dp12", "iterations": 4587520, "jump_count": 16, "jump_histogram_max_bucket": 8336, "jump_histogram_max_deviation_ppm": 17578, "jump_histogram_min_bucket": 8082, "jump_index": "power2_mask", "jump_mixer": "avalanche64", "machine": "macOS-26.5-arm64-arm-64bit-Mach-O", "max_threads_per_threadgroup": 1024, "min_ms": 200, "operation": "jacobian_affine_walk_dynamic_dp_stream", "ops_per_sec": 22712598.663408, "ops_per_sec_max": 42913837.135786, "ops_per_sec_min": 22266852.602843, "output_bytes_per_record": 20, "output_bytes_total": 60, "output_layout": "dp_stream", "paired_baseline_ops_per_sec": 18646300.505102, "paired_baseline_ref": "main", "paired_speedup": 1.2180753312000618, "raw_status": "keep", "reason": "", "runner_sample_count": 3, "sample_count": 16384, "seconds": 0.201981, "skipped": false, "status": "keep", "steps_per_sample": 8, "thread_execution_width": 32, "threadgroup_limit": 128, "threads_per_threadgroup": 128, "timestamp": "2026-06-22T11:45:13Z"}
{"backend": "metal", "budget_sec": 120, "commit": "e4a8aa4-dirty", "confirmation_index": 2, "confirmation_runs": 2, "confirmation_status": "keep", "correctness": true, "description": "Metal dynamic Jacobian DP stream with runtime dp_bits=12 mask", "distance_tracking": "dp_stream_uint64", "dp_bits": 12, "dp_capacity": 16384, "dp_checksum": "0xccdf6d15eaf2c6b0", "dp_count": 3, "dp_distance_checksum": "0xfb58c602127bde02", "dp_stream_overflow": false, "dp_tracking": "projective_x_limb0", "emitted_records": 3, "experiment": "metal_jacobian_dynamic_dp_stream_dp12", "iterations": 4456448, "jump_count": 16, "jump_histogram_max_bucket": 8336, "jump_histogram_max_deviation_ppm": 17578, "jump_histogram_min_bucket": 8082, "jump_index": "power2_mask", "jump_mixer": "avalanche64", "machine": "macOS-26.5-arm64-arm-64bit-Mach-O", "max_threads_per_threadgroup": 1024, "min_ms": 200, "operation": "jacobian_affine_walk_dynamic_dp_stream", "ops_per_sec": 21793968.794878, "ops_per_sec_max": 22584259.214592, "ops_per_sec_min": 13562457.334494, "output_bytes_per_record": 20, "output_bytes_total": 60, "output_layout": "dp_stream", "paired_baseline_ops_per_sec": 19686379.815135, "paired_baseline_ref": "main", "paired_speedup": 1.107058230082642, "raw_status": "keep", "reason": "", "runner_sample_count": 3, "sample_count": 16384, "seconds": 0.204481, "skipped": false, "status": "keep", "steps_per_sample": 8, "thread_execution_width": 32, "threadgroup_limit": 128, "threads_per_threadgroup": 128, "timestamp": "2026-06-22T11:47:31Z"}
{"backend": "metal", "budget_sec": 120, "commit": "579c846-dirty", "correctness": true, "description": "Metal dynamic Jacobian DP stream with runtime dp_bits=10 mask", "distance_tracking": "dp_stream_uint64", "dp_bits": 10, "dp_capacity": 16384, "dp_checksum": "0xcbfdc2badaf0e57a", "dp_count": 15, "dp_distance_checksum": "0xb6973c2035ff6351", "dp_stream_overflow": false, "dp_tracking": "projective_x_limb0", "emitted_records": 15, "experiment": "metal_jacobian_dynamic_dp_stream_dp10", "iterations": 5636096, "jump_count": 16, "jump_histogram_max_bucket": 8336, "jump_histogram_max_deviation_ppm": 17578, "jump_histogram_min_bucket": 8082, "jump_index": "power2_mask", "jump_mixer": "avalanche64", "machine": "macOS-26.5-arm64-arm-64bit-Mach-O", "max_threads_per_threadgroup": 1024, "min_ms": 200, "operation": "jacobian_affine_walk_dynamic_dp_stream", "ops_per_sec": 27932757.086802, "ops_per_sec_max": 31341166.931341, "ops_per_sec_min": 19534840.908609, "output_bytes_per_record": 20, "output_bytes_total": 300, "output_layout": "dp_stream", "paired_baseline_ops_per_sec": 26237218.701084, "paired_baseline_ref": "main", "paired_speedup": 1.0646234040671372, "reason": "", "runner_sample_count": 3, "sample_count": 16384, "seconds": 0.201774, "skipped": false, "status": "keep", "steps_per_sample": 8, "thread_execution_width": 32, "threadgroup_limit": 512, "threads_per_threadgroup": 512, "timestamp": "2026-06-22T11:55:34Z"}
{"backend": "metal", "budget_sec": 120, "commit": "579c846-dirty", "confirmation_index": 1, "confirmation_runs": 2, "confirmation_status": "discard", "correctness": true, "description": "Metal dynamic Jacobian DP stream with runtime dp_bits=10 mask", "distance_tracking": "dp_stream_uint64", "dp_bits": 10, "dp_capacity": 16384, "dp_checksum": "0xcbfdc2badaf0e57a", "dp_count": 15, "dp_distance_checksum": "0xb6973c2035ff6351", "dp_stream_overflow": false, "dp_tracking": "projective_x_limb0", "emitted_records": 15, "experiment": "metal_jacobian_dynamic_dp_stream_dp10", "iterations": 7471104, "jump_count": 16, "jump_histogram_max_bucket": 8336, "jump_histogram_max_deviation_ppm": 17578, "jump_histogram_min_bucket": 8082, "jump_index": "power2_mask", "jump_mixer": "avalanche64", "machine": "macOS-26.5-arm64-arm-64bit-Mach-O", "max_threads_per_threadgroup": 1024, "min_ms": 200, "operation": "jacobian_affine_walk_dynamic_dp_stream", "ops_per_sec": 36924669.479014, "ops_per_sec_max": 40215992.384201, "ops_per_sec_min": 19344675.693559, "output_bytes_per_record": 20, "output_bytes_total": 300, "output_layout": "dp_stream", "paired_baseline_ops_per_sec": 22272880.712796, "paired_baseline_ref": "main", "paired_speedup": 1.6578308821005088, "raw_status": "keep", "reason": "", "runner_sample_count": 3, "sample_count": 16384, "seconds": 0.202334, "skipped": false, "status": "discard", "steps_per_sample": 8, "thread_execution_width": 32, "threadgroup_limit": 512, "threads_per_threadgroup": 512, "timestamp": "2026-06-22T11:56:45Z"}
{"backend": "metal", "budget_sec": 120, "commit": "579c846-dirty", "confirmation_index": 2, "confirmation_runs": 2, "confirmation_status": "discard", "correctness": true, "description": "Metal dynamic Jacobian DP stream with runtime dp_bits=10 mask", "distance_tracking": "dp_stream_uint64", "dp_bits": 10, "dp_capacity": 16384, "dp_checksum": "0xcbfdc2badaf0e57a", "dp_count": 15, "dp_distance_checksum": "0xb6973c2035ff6351", "dp_stream_overflow": false, "dp_tracking": "projective_x_limb0", "emitted_records": 15, "experiment": "metal_jacobian_dynamic_dp_stream_dp10", "iterations": 3932160, "jump_count": 16, "jump_histogram_max_bucket": 8336, "jump_histogram_max_deviation_ppm": 17578, "jump_histogram_min_bucket": 8082, "jump_index": "power2_mask", "jump_mixer": "avalanche64", "machine": "macOS-26.5-arm64-arm-64bit-Mach-O", "max_threads_per_threadgroup": 1024, "min_ms": 200, "operation": "jacobian_affine_walk_dynamic_dp_stream", "ops_per_sec": 19095076.656232, "ops_per_sec_max": 32680966.827028, "ops_per_sec_min": 18181585.790008, "output_bytes_per_record": 20, "output_bytes_total": 300, "output_layout": "dp_stream", "paired_baseline_ops_per_sec": 20268925.094271, "paired_baseline_ref": "main", "paired_speedup": 0.9420863004535555, "raw_status": "discard", "reason": "", "runner_sample_count": 3, "sample_count": 16384, "seconds": 0.205925, "skipped": false, "status": "discard", "steps_per_sample": 8, "thread_execution_width": 32, "threadgroup_limit": 512, "threads_per_threadgroup": 512, "timestamp": "2026-06-22T11:57:26Z"}
{"backend": "metal", "budget_sec": 120, "commit": "589d9e1-dirty", "correctness": true, "description": "Metal dynamic Jacobian DP stream with runtime dp_bits=6 mask", "distance_tracking": "dp_stream_uint64", "dp_bits": 6, "dp_capacity": 16384, "dp_checksum": "0xb302d085b993018a", "dp_count": 248, "dp_distance_checksum": "0xcd602d19c5edfa05", "dp_stream_overflow": false, "dp_tracking": "projective_x_limb0", "emitted_records": 248, "experiment": "metal_jacobian_dynamic_dp_stream_dp6", "iterations": 4718592, "jump_count": 16, "jump_histogram_max_bucket": 8336, "jump_histogram_max_deviation_ppm": 17578, "jump_histogram_min_bucket": 8082, "jump_index": "power2_mask", "jump_mixer": "avalanche64", "machine": "macOS-26.5-arm64-arm-64bit-Mach-O", "max_threads_per_threadgroup": 1024, "min_ms": 200, "operation": "jacobian_affine_walk_dynamic_dp_stream", "ops_per_sec": 23221999.015625, "ops_per_sec_max": 29196949.926971, "ops_per_sec_min": 22612460.629475, "output_bytes_per_record": 20, "output_bytes_total": 4960, "output_layout": "dp_stream", "paired_baseline_ops_per_sec": 20744125.284209, "paired_baseline_ref": "main", "paired_speedup": 1.119449419894423, "reason": "", "runner_sample_count": 3, "sample_count": 16384, "seconds": 0.203195, "skipped": false, "status": "keep", "steps_per_sample": 8, "thread_execution_width": 32, "threadgroup_limit": 128, "threads_per_threadgroup": 128, "timestamp": "2026-06-22T12:01:53Z"}
{"backend": "metal", "budget_sec": 120, "commit": "589d9e1-dirty", "confirmation_index": 1, "confirmation_runs": 2, "confirmation_status": "discard", "correctness": true, "description": "Metal dynamic Jacobian DP stream with runtime dp_bits=6 mask", "distance_tracking": "dp_stream_uint64", "dp_bits": 6, "dp_capacity": 16384, "dp_checksum": "0xb302d085b993018a", "dp_count": 248, "dp_distance_checksum": "0xcd602d19c5edfa05", "dp_stream_overflow": false, "dp_tracking": "projective_x_limb0", "emitted_records": 248, "experiment": "metal_jacobian_dynamic_dp_stream_dp6", "iterations": 4587520, "jump_count": 16, "jump_histogram_max_bucket": 8336, "jump_histogram_max_deviation_ppm": 17578, "jump_histogram_min_bucket": 8082, "jump_index": "power2_mask", "jump_mixer": "avalanche64", "machine": "macOS-26.5-arm64-arm-64bit-Mach-O", "max_threads_per_threadgroup": 1024, "min_ms": 200, "operation": "jacobian_affine_walk_dynamic_dp_stream", "ops_per_sec": 22611569.767587, "ops_per_sec_max": 43935515.200848, "ops_per_sec_min": 12370301.712923, "output_bytes_per_record": 20, "output_bytes_total": 4960, "output_layout": "dp_stream", "paired_baseline_ops_per_sec": 28144092.643342, "paired_baseline_ref": "main", "paired_speedup": 0.8034215227377807, "raw_status": "discard", "reason": "", "runner_sample_count": 3, "sample_count": 16384, "seconds": 0.202884, "skipped": false, "status": "discard", "steps_per_sample": 8, "thread_execution_width": 32, "threadgroup_limit": 128, "threads_per_threadgroup": 128, "timestamp": "2026-06-22T12:03:22Z"}
{"backend": "metal", "budget_sec": 120, "commit": "589d9e1-dirty", "confirmation_index": 2, "confirmation_runs": 2, "confirmation_status": "discard", "correctness": true, "description": "Metal dynamic Jacobian DP stream with runtime dp_bits=6 mask", "distance_tracking": "dp_stream_uint64", "dp_bits": 6, "dp_capacity": 16384, "dp_checksum": "0xb302d085b993018a", "dp_count": 248, "dp_distance_checksum": "0xcd602d19c5edfa05", "dp_stream_overflow": false, "dp_tracking": "projective_x_limb0", "emitted_records": 248, "experiment": "metal_jacobian_dynamic_dp_stream_dp6", "iterations": 8257536, "jump_count": 16, "jump_histogram_max_bucket": 8336, "jump_histogram_max_deviation_ppm": 17578, "jump_histogram_min_bucket": 8082, "jump_index": "power2_mask", "jump_mixer": "avalanche64", "machine": "macOS-26.5-arm64-arm-64bit-Mach-O", "max_threads_per_threadgroup": 1024, "min_ms": 200, "operation": "jacobian_affine_walk_dynamic_dp_stream", "ops_per_sec": 41127821.914115, "ops_per_sec_max": 45588977.58232, "ops_per_sec_min": 37827252.143738, "output_bytes_per_record": 20, "output_bytes_total": 4960, "output_layout": "dp_stream", "paired_baseline_ops_per_sec": 37804523.817718, "paired_baseline_ref": "main", "paired_speedup": 1.0879074184989326, "raw_status": "keep", "reason": "", "runner_sample_count": 3, "sample_count": 16384, "seconds": 0.200777, "skipped": false, "status": "discard", "steps_per_sample": 8, "thread_execution_width": 32, "threadgroup_limit": 128, "threads_per_threadgroup": 128, "timestamp": "2026-06-22T12:04:53Z"}
{"backend": "metal", "budget_sec": 120, "commit": "82dff04", "correctness": true, "description": "Stable Metal Jacobian jump-table walk with projective distinguished-point candidate flags", "distance_checksum": "0xa45f471493cace2f", "distance_tracking": "uint64", "dp_bits": 4, "dp_checksum": "0x30a7914972cba014", "dp_count": 1000, "dp_tracking": "projective_x_limb0", "experiment": "metal_jacobian_jump_walk_dp_stable", "iterations": 5636096, "jump_count": 16, "machine": "macOS-26.5-arm64-arm-64bit-Mach-O", "max_threads_per_threadgroup": 1024, "min_ms": 200, "operation": "jacobian_affine_walk_jump_table", "ops_per_sec": 27922343.656972, "ops_per_sec_max": 34517404.415027, "ops_per_sec_min": 20150535.194783, "reason": "", "runner_sample_count": 3, "sample_count": 16384, "seconds": 0.201849, "skipped": false, "status": "discard", "steps_per_sample": 8, "thread_execution_width": 32, "threadgroup_limit": 256, "threads_per_threadgroup": 256, "timestamp": "2026-06-22T12:17:08Z"}
{"backend": "metal", "budget_sec": 120, "commit": "6b4fd99-dirty", "correctness": true, "description": "Metal dynamic Jacobian DP stream with runtime dp_bits=16 mask and larger sample count", "distance_tracking": "dp_stream_uint64", "dp_bits": 16, "dp_capacity": 65536, "dp_checksum": "0xebe643771995a1fa", "dp_count": 1, "dp_distance_checksum": "0x9e3779b97f4bab4a", "dp_stream_overflow": false, "dp_tracking": "projective_x_limb0", "emitted_records": 1, "experiment": "metal_jacobian_dynamic_dp_stream_dp16_large", "iterations": 11010048, "jump_count": 16, "jump_histogram_max_bucket": 33129, "jump_histogram_max_deviation_ppm": 11047, "jump_histogram_min_bucket": 32406, "jump_index": "power2_mask", "jump_mixer": "avalanche64", "machine": "macOS-26.5-arm64-arm-64bit-Mach-O", "max_threads_per_threadgroup": 1024, "min_ms": 200, "operation": "jacobian_affine_walk_dynamic_dp_stream", "ops_per_sec": 52989830.333319, "ops_per_sec_max": 70280067.920733, "ops_per_sec_min": 32678324.080216, "output_bytes_per_record": 20, "output_bytes_total": 20, "output_layout": "dp_stream", "reason": "", "runner_sample_count": 3, "sample_count": 65536, "seconds": 0.207777, "skipped": false, "status": "keep", "steps_per_sample": 8, "thread_execution_width": 32, "threadgroup_limit": 256, "threads_per_threadgroup": 256, "timestamp": "2026-06-22T12:24:43Z"}
{"backend": "metal", "budget_sec": 120, "commit": "1f32b3b-dirty", "correctness": true, "description": "Metal dynamic Jacobian DP stream with runtime dp_bits=16 mask and larger sample count", "distance_tracking": "dp_stream_uint64", "dp_bits": 16, "dp_capacity": 65536, "dp_checksum": "0xebe643771995a1fa", "dp_count": 1, "dp_distance_checksum": "0x9e3779b97f4bab4a", "dp_stream_overflow": false, "dp_tracking": "projective_x_limb0", "emitted_records": 1, "experiment": "metal_jacobian_dynamic_dp_stream_dp16_large", "iterations": 12058624, "jump_count": 16, "jump_histogram_max_bucket": 33129, "jump_histogram_max_deviation_ppm": 11047, "jump_histogram_min_bucket": 32406, "jump_index": "power2_mask", "jump_mixer": "avalanche64", "machine": "macOS-26.5-arm64-arm-64bit-Mach-O", "max_threads_per_threadgroup": 1024, "min_ms": 200, "operation": "jacobian_affine_walk_dynamic_dp_stream", "ops_per_sec": 58886361.62476, "ops_per_sec_max": 87782217.076216, "ops_per_sec_min": 55907733.425461, "output_bytes_per_record": 20, "output_bytes_total": 20, "output_layout": "dp_stream", "paired_baseline_ops_per_sec": 81212851.782611, "paired_baseline_ref": "main", "paired_speedup": 0.7250867360548535, "reason": "", "runner_sample_count": 3, "sample_count": 65536, "seconds": 0.204778, "skipped": false, "status": "discard", "steps_per_sample": 8, "thread_execution_width": 32, "threadgroup_limit": 256, "threads_per_threadgroup": 256, "timestamp": "2026-06-22T12:30:24Z"}
