{"affine_scan_mode": "cpu_batch_prod_zz_zzz", "affine_scan_seconds": 0.011812, "backend": "metal", "budget_sec": 180, "bytes_per_target": 4.0, "candidate_verification": "tag16_hash_filter_then_cpu_exact_key_equality", "commit": "65b2c7f-dirty", "confirmation_index": 1, "confirmation_runs": 2, "confirmation_status": "discard", "cooldown_sec": 3.0, "correctness": true, "description": "Medium fixed-round 1M target lookup with physical distinct-miss queries; fast falsifier for setup-inclusive wall-clock kangaroo distance/sec", "distance_per_sec": 113949320829.2578, "distance_tracking": "packet_distance_uint64", "distinct_miss_source_seconds": 1.4e-05, "dp_bits": 6, "dp_checksum": "0xbd17120591af6f74", "dp_count": 1053, "dp_distance_checksum": "0x9eca239fc5687305", "dp_normalization": "host_batch_affine", "dp_query_count": 1053, "dp_sampling": "packet_endpoint", "dp_tracking": "affine_x256_y_parity_cpu_batch", "exact_host_table_bytes": 16779264, "experiment": "metal_jacobian_dynamic_dp_stream_xyzz_affine_scan_target_lookup_tag16_hash_filter1m_rounds_distinct_misses_distance", "filter_false_positive_count": 28, "filter_positive_count": 92, "gpu_distance_per_sec": 114344567195.59639, "gpu_lookup_lookups_per_sec": 251438293.299904, "gpu_ops_per_sec": 27916580.073694, "hit_count": 64, "injected_hits": 64, "iterations": 134217728, "jump_count": 16, "jump_histogram_max_bucket": 8393138, "jump_histogram_max_deviation_ppm": 707, "jump_histogram_min_bucket": 8382675, "jump_index": "power2_mask", "jump_mixer": "avalanche64", "jump_schedule": "power2", "lookup_buffer_seconds": 0.008855, "lookup_engine": "gpu_filter16_hash", "lookup_engine_effective": "gpu_filter16_hash", "lookup_exact_seconds": 0.000576, "lookup_gpu_seconds": 0.004288, "lookup_hash_seconds": 0.0, "lookup_layout": "open_address_tag16_hash_filter_exact256", "lookup_max_threads_per_threadgroup": 1024, "lookup_query_mode": "distinct_misses", "lookup_repeat": 1024, "lookup_seconds": 0.004864, "lookup_thread_execution_width": 32, "lookup_threadgroup_limit": 512, "lookup_threads_per_threadgroup": 512, "lookup_wall_seconds": 0.013719, "lookups_per_sec": 221665252.313947, "machine": "macOS-26.5-arm64-arm-64bit-Mach-O", "max_sample_spread_ratio": 1.5, "max_threads_per_threadgroup": 1024, "mean_jump_distance": 4095.9375, "min_ms": 0, "miss_count": 1078208, "operation": "jacobian_affine_scan_target_lookup_tag32_rounds", "ops_per_sec": 108718060029.86165, "ops_per_sec_max": 152039031812.30484, "ops_per_sec_min": 80551550346.83965, "output_layout": "affine_dp_scan_target_lookup", "paired_baseline_ops_per_sec": 128535593794.30785, "paired_baseline_ref": "HEAD", "paired_baseline_sample_spread_ratio": 1.9790459886405893, "paired_order": "alternate", "paired_speedup": 0.8458206541904675, "physical_filter_positive_count": 92, "physical_query_count": 1078272, "query_count": 1078272, "query_input": "hash64_prefix_gpu_miss", "raw_status": "discard", "reason": "sample spread ratio 1.887475 exceeds max 1.500000; paired baseline sample spread ratio 1.979046 exceeds max 1.500000", "repeat_positive_index_encoding": "physical_query_index", "requested_hits": 32, "round_count": 2, "round_sample_build_seconds": 0.002462, "runner_sample_count": 3, "sample_count": 32768, "sample_metric": "setup_inclusive_wall_distance_per_sec", "sample_metric_values": [108718060029.86165, 80551550346.83965, 152039031812.30484], "sample_spread_ratio": 1.887474929503575, "seconds": 4.807814, "setup_inclusive_distance_per_sec": 111541169174.53288, "setup_inclusive_ops_per_sec": 27232146.285077, "setup_inclusive_seconds": 4.92865, "setup_inclusive_wall_distance_per_sec": 108718060029.86165, "setup_inclusive_wall_distance_per_sec_max": 152039031812.30484, "setup_inclusive_wall_distance_per_sec_min": 80551550346.83965, "setup_inclusive_wall_ops_per_sec": 26542900.136992, "setup_inclusive_wall_seconds": 5.056634, "skipped": false, "state_layout": "xyzz", "status": "discard", "steps_per_sample": 2048, "target_bucket_bytes": 16777216, "target_build_seconds": 0.101683, "target_count": 1048576, "target_filter_bucket_bytes": 4194304, "target_filter_build_seconds": 0.0, "target_key": "x256_y_parity", "target_key_bytes": 2048, "target_lookup_checksum": "0xcb38405cd10f441d", "target_lookup_scope": "packet_endpoint_dp_keys", "target_query_hash_bytes": 8424, "target_setup_workers": 8, "target_table_buckets": 2097152, "target_table_bytes": 4194304, "thread_execution_width": 32, "threadgroup_limit": 128, "threads_per_threadgroup": 128, "timestamp": "2026-07-07T18:17:45Z", "validation_seconds": 20.322991, "validation_workers": 8, "walk_buffer_seconds": 0.119129, "walk_round_mode": "independent", "walk_wall_seconds": 4.926943}
{"affine_scan_mode": "cpu_batch_prod_zz_zzz", "affine_scan_seconds": 0.005451, "backend": "metal", "budget_sec": 180, "bytes_per_target": 4.0, "candidate_verification": "tag16_hash_filter_then_cpu_exact_key_equality", "commit": "65b2c7f-dirty", "confirmation_index": 2, "confirmation_runs": 2, "confirmation_status": "discard", "cooldown_sec": 3.0, "correctness": true, "description": "Medium fixed-round 1M target lookup with physical distinct-miss queries; fast falsifier for setup-inclusive wall-clock kangaroo distance/sec", "distance_per_sec": 164451419523.99023, "distance_tracking": "packet_distance_uint64", "distinct_miss_source_seconds": 1.2e-05, "dp_bits": 6, "dp_checksum": "0xbd17120591af6f74", "dp_count": 1053, "dp_distance_checksum": "0x9eca239fc5687305", "dp_normalization": "host_batch_affine", "dp_query_count": 1053, "dp_sampling": "packet_endpoint", "dp_tracking": "affine_x256_y_parity_cpu_batch", "exact_host_table_bytes": 16779264, "experiment": "metal_jacobian_dynamic_dp_stream_xyzz_affine_scan_target_lookup_tag16_hash_filter1m_rounds_distinct_misses_distance", "filter_false_positive_count": 28, "filter_positive_count": 92, "gpu_distance_per_sec": 164937707151.10446, "gpu_lookup_lookups_per_sec": 245566401.325997, "gpu_ops_per_sec": 40268609.360154, "hit_count": 64, "injected_hits": 64, "iterations": 134217728, "jump_count": 16, "jump_histogram_max_bucket": 8393138, "jump_histogram_max_deviation_ppm": 707, "jump_histogram_min_bucket": 8382675, "jump_index": "power2_mask", "jump_mixer": "avalanche64", "jump_schedule": "power2", "lookup_buffer_seconds": 0.00601, "lookup_engine": "gpu_filter16_hash", "lookup_engine_effective": "gpu_filter16_hash", "lookup_exact_seconds": 1.4e-05, "lookup_gpu_seconds": 0.004391, "lookup_hash_seconds": 0.0, "lookup_layout": "open_address_tag16_hash_filter_exact256", "lookup_max_threads_per_threadgroup": 1024, "lookup_query_mode": "distinct_misses", "lookup_repeat": 1024, "lookup_seconds": 0.004405, "lookup_thread_execution_width": 32, "lookup_threadgroup_limit": 512, "lookup_threads_per_threadgroup": 512, "lookup_wall_seconds": 0.010415, "lookups_per_sec": 244781321.040753, "machine": "macOS-26.5-arm64-arm-64bit-Mach-O", "max_sample_spread_ratio": 1.5, "max_threads_per_threadgroup": 1024, "mean_jump_distance": 4095.9375, "min_ms": 0, "miss_count": 1078208, "operation": "jacobian_affine_scan_target_lookup_tag32_rounds", "ops_per_sec": 157380676707.83865, "ops_per_sec_max": 164204588642.5096, "ops_per_sec_min": 143628032387.68436, "output_layout": "affine_dp_scan_target_lookup", "paired_baseline_ops_per_sec": 191514442261.43472, "paired_baseline_ref": "HEAD", "paired_baseline_sample_spread_ratio": 1.914037942738832, "paired_order": "alternate", "paired_speedup": 0.8217692349958633, "physical_filter_positive_count": 92, "physical_query_count": 1078272, "query_count": 1078272, "query_input": "hash64_prefix_gpu_miss", "raw_status": "discard", "reason": "paired baseline sample spread ratio 1.914038 exceeds max 1.500000", "repeat_positive_index_encoding": "physical_query_index", "requested_hits": 32, "round_count": 2, "round_sample_build_seconds": 0.001912, "runner_sample_count": 3, "sample_count": 32768, "sample_metric": "setup_inclusive_wall_distance_per_sec", "sample_metric_values": [164204588642.5096, 157380676707.83865, 143628032387.68436], "sample_spread_ratio": 1.1432628151535524, "seconds": 3.333061, "setup_inclusive_distance_per_sec": 161142768817.48834, "setup_inclusive_ops_per_sec": 39342096.606086, "setup_inclusive_seconds": 3.411555, "setup_inclusive_wall_distance_per_sec": 157380676707.83865, "setup_inclusive_wall_distance_per_sec_max": 164204588642.5096, "setup_inclusive_wall_distance_per_sec_min": 143628032387.68436, "setup_inclusive_wall_ops_per_sec": 38423603.072029, "setup_inclusive_wall_seconds": 3.493106, "skipped": false, "state_layout": "xyzz", "status": "discard", "steps_per_sample": 2048, "target_bucket_bytes": 16777216, "target_build_seconds": 0.066714, "target_count": 1048576, "target_filter_bucket_bytes": 4194304, "target_filter_build_seconds": 0.0, "target_key": "x256_y_parity", "target_key_bytes": 2048, "target_lookup_checksum": "0xcb38405cd10f441d", "target_lookup_scope": "packet_endpoint_dp_keys", "target_query_hash_bytes": 8424, "target_setup_workers": 8, "target_table_buckets": 2097152, "target_table_bytes": 4194304, "thread_execution_width": 32, "threadgroup_limit": 128, "threads_per_threadgroup": 128, "timestamp": "2026-07-07T18:17:45Z", "validation_seconds": 9.314384, "validation_workers": 8, "walk_buffer_seconds": 0.075542, "walk_round_mode": "independent", "walk_wall_seconds": 3.408603}
{"affine_scan_mode": "cpu_batch_prod_zz_zzz", "affine_scan_seconds": 0.006288, "backend": "metal", "budget_sec": 240, "commit": "1850591-dirty", "confirmation_index": 1, "confirmation_runs": 2, "confirmation_status": "discard", "cooldown_sec": 3.0, "correctness": true, "description": "Validated Metal XYZZ 2048-step dp6 walk gate for mechanism-level arithmetic and code-generation changes", "distance_tracking": "packet_distance_uint64", "dp_bits": 6, "dp_checksum": "0x3f104d05ebba588a", "dp_count": 526, "dp_distance_checksum": "0xb6a4ae454b38bdea", "dp_normalization": "host_batch_affine", "dp_sampling": "packet_endpoint", "dp_tracking": "affine_x_limb0_cpu_batch", "experiment": "metal_jacobian_dynamic_xyzz_steps2048_dp6_walk_gate", "gpu_ops_per_sec": 73210957.63886, "gpu_ops_per_sec_max": 76138157.97267, "gpu_ops_per_sec_min": 47597887.139204, "iterations": 67108864, "jump_count": 16, "jump_histogram_max_bucket": 4197079, "jump_histogram_max_deviation_ppm": 726, "jump_histogram_min_bucket": 4191260, "jump_index": "power2_mask", "jump_mixer": "avalanche64", "jump_schedule": "power2", "machine": "macOS-26.5-arm64-arm-64bit-Mach-O", "max_sample_spread_ratio": 1.15, "max_threads_per_threadgroup": 1024, "min_ms": 0, "operation": "jacobian_affine_walk_dynamic_dp_stream_xyzz_affine_scan", "ops_per_sec": 73210957.63886, "ops_per_sec_max": 76138157.97267, "ops_per_sec_min": 47597887.139204, "output_layout": "affine_dp_scan", "paired_baseline_ops_per_sec": 67800508.307934, "paired_baseline_ref": "HEAD", "paired_baseline_sample_spread_ratio": 1.23182283959701, "paired_order": "alternate", "paired_speedup": 1.079799539353791, "raw_status": "discard", "reason": "sample spread ratio 1.599612 exceeds max 1.150000; paired baseline sample spread ratio 1.231823 exceeds max 1.150000", "runner_sample_count": 3, "sample_count": 32768, "sample_metric": "gpu_ops_per_sec", "sample_metric_values": [47597887.139204, 73210957.63886, 76138157.97267], "sample_spread_ratio": 1.5996121371941907, "seconds": 0.916651, "skipped": false, "state_layout": "xyzz", "status": "discard", "steps_per_sample": 2048, "thread_execution_width": 32, "threadgroup_limit": 128, "threads_per_threadgroup": 128, "timestamp": "2026-07-10T02:32:59Z", "validation_seconds": 5.532482, "validation_workers": 8}
{"affine_scan_mode": "cpu_batch_prod_zz_zzz", "affine_scan_seconds": 0.004727, "backend": "metal", "budget_sec": 240, "commit": "1850591-dirty", "confirmation_index": 2, "confirmation_runs": 2, "confirmation_status": "discard", "cooldown_sec": 3.0, "correctness": true, "description": "Validated Metal XYZZ 2048-step dp6 walk gate for mechanism-level arithmetic and code-generation changes", "distance_tracking": "packet_distance_uint64", "dp_bits": 6, "dp_checksum": "0x3f104d05ebba588a", "dp_count": 526, "dp_distance_checksum": "0xb6a4ae454b38bdea", "dp_normalization": "host_batch_affine", "dp_sampling": "packet_endpoint", "dp_tracking": "affine_x_limb0_cpu_batch", "experiment": "metal_jacobian_dynamic_xyzz_steps2048_dp6_walk_gate", "gpu_ops_per_sec": 83428146.449833, "gpu_ops_per_sec_max": 87308306.414931, "gpu_ops_per_sec_min": 75943913.039296, "iterations": 67108864, "jump_count": 16, "jump_histogram_max_bucket": 4197079, "jump_histogram_max_deviation_ppm": 726, "jump_histogram_min_bucket": 4191260, "jump_index": "power2_mask", "jump_mixer": "avalanche64", "jump_schedule": "power2", "machine": "macOS-26.5-arm64-arm-64bit-Mach-O", "max_sample_spread_ratio": 1.15, "max_threads_per_threadgroup": 1024, "min_ms": 0, "operation": "jacobian_affine_walk_dynamic_dp_stream_xyzz_affine_scan", "ops_per_sec": 83428146.449833, "ops_per_sec_max": 87308306.414931, "ops_per_sec_min": 75943913.039296, "output_layout": "affine_dp_scan", "paired_baseline_ops_per_sec": 80770812.850552, "paired_baseline_ref": "HEAD", "paired_baseline_sample_spread_ratio": 1.1968906755994697, "paired_order": "alternate", "paired_speedup": 1.0328996763248848, "raw_status": "discard", "reason": "paired baseline sample spread ratio 1.196891 exceeds max 1.150000", "runner_sample_count": 3, "sample_count": 32768, "sample_metric": "gpu_ops_per_sec", "sample_metric_values": [83428146.449833, 75943913.039296, 87308306.414931], "sample_spread_ratio": 1.1496419254793293, "seconds": 0.804391, "skipped": false, "state_layout": "xyzz", "status": "discard", "steps_per_sample": 2048, "thread_execution_width": 32, "threadgroup_limit": 128, "threads_per_threadgroup": 128, "timestamp": "2026-07-10T02:32:59Z", "validation_seconds": 5.127114, "validation_workers": 8}
{"affine_scan_mode": "cpu_batch_prod_zz_zzz", "affine_scan_seconds": 0.013155, "backend": "metal", "budget_sec": 240, "commit": "1850591-dirty", "confirmation_index": 1, "confirmation_runs": 2, "confirmation_status": "discard", "cooldown_sec": 3.0, "correctness": true, "description": "Validated Metal XYZZ 2048-step dp6 walk gate for mechanism-level arithmetic and code-generation changes", "distance_tracking": "packet_distance_uint64", "dp_bits": 6, "dp_checksum": "0x3f104d05ebba588a", "dp_count": 526, "dp_distance_checksum": "0xb6a4ae454b38bdea", "dp_normalization": "host_batch_affine", "dp_sampling": "packet_endpoint", "dp_tracking": "affine_x_limb0_cpu_batch", "experiment": "metal_jacobian_dynamic_xyzz_steps2048_dp6_walk_gate", "gpu_ops_per_sec": 57751745.689226, "gpu_ops_per_sec_max": 62646143.319488, "gpu_ops_per_sec_min": 50258305.439208, "iterations": 67108864, "jump_count": 16, "jump_histogram_max_bucket": 4197079, "jump_histogram_max_deviation_ppm": 726, "jump_histogram_min_bucket": 4191260, "jump_index": "power2_mask", "jump_mixer": "avalanche64", "jump_schedule": "power2", "machine": "macOS-26.5-arm64-arm-64bit-Mach-O", "max_sample_spread_ratio": 1.15, "max_threads_per_threadgroup": 1024, "min_ms": 0, "operation": "jacobian_affine_walk_dynamic_dp_stream_xyzz_affine_scan", "ops_per_sec": 57751745.689226, "ops_per_sec_max": 62646143.319488, "ops_per_sec_min": 50258305.439208, "output_layout": "affine_dp_scan", "paired_baseline_ops_per_sec": 48829707.242359, "paired_baseline_ref": "HEAD", "paired_baseline_sample_spread_ratio": 1.2814324874970504, "paired_order": "alternate", "paired_speedup": 1.1827174265572347, "raw_status": "discard", "reason": "sample spread ratio 1.246483 exceeds max 1.150000; paired baseline sample spread ratio 1.281432 exceeds max 1.150000", "runner_sample_count": 3, "sample_count": 32768, "sample_metric": "gpu_ops_per_sec", "sample_metric_values": [57751745.689226, 50258305.439208, 62646143.319488], "sample_spread_ratio": 1.246483397560314, "seconds": 1.162023, "skipped": false, "state_layout": "xyzz", "status": "discard", "steps_per_sample": 2048, "thread_execution_width": 32, "threadgroup_limit": 128, "threads_per_threadgroup": 128, "timestamp": "2026-07-10T02:35:25Z", "validation_seconds": 9.306059, "validation_workers": 8}
{"affine_scan_mode": "cpu_batch_prod_zz_zzz", "affine_scan_seconds": 0.041257, "backend": "metal", "budget_sec": 240, "commit": "1850591-dirty", "confirmation_index": 2, "confirmation_runs": 2, "confirmation_status": "discard", "cooldown_sec": 3.0, "correctness": true, "description": "Validated Metal XYZZ 2048-step dp6 walk gate for mechanism-level arithmetic and code-generation changes", "distance_tracking": "packet_distance_uint64", "dp_bits": 6, "dp_checksum": "0x3f104d05ebba588a", "dp_count": 526, "dp_distance_checksum": "0xb6a4ae454b38bdea", "dp_normalization": "host_batch_affine", "dp_sampling": "packet_endpoint", "dp_tracking": "affine_x_limb0_cpu_batch", "experiment": "metal_jacobian_dynamic_xyzz_steps2048_dp6_walk_gate", "gpu_ops_per_sec": 48889523.178842, "gpu_ops_per_sec_max": 50417605.29037, "gpu_ops_per_sec_min": 48772082.941814, "iterations": 67108864, "jump_count": 16, "jump_histogram_max_bucket": 4197079, "jump_histogram_max_deviation_ppm": 726, "jump_histogram_min_bucket": 4191260, "jump_index": "power2_mask", "jump_mixer": "avalanche64", "jump_schedule": "power2", "machine": "macOS-26.5-arm64-arm-64bit-Mach-O", "max_sample_spread_ratio": 1.15, "max_threads_per_threadgroup": 1024, "min_ms": 0, "operation": "jacobian_affine_walk_dynamic_dp_stream_xyzz_affine_scan", "ops_per_sec": 48889523.178842, "ops_per_sec_max": 50417605.29037, "ops_per_sec_min": 48772082.941814, "output_layout": "affine_dp_scan", "paired_baseline_ops_per_sec": 48086725.219906, "paired_baseline_ref": "HEAD", "paired_baseline_sample_spread_ratio": 1.1512787046232429, "paired_order": "alternate", "paired_speedup": 1.0166947937349593, "raw_status": "discard", "reason": "paired baseline sample spread ratio 1.151279 exceeds max 1.150000", "runner_sample_count": 3, "sample_count": 32768, "sample_metric": "gpu_ops_per_sec", "sample_metric_values": [50417605.29037, 48772082.941814, 48889523.178842], "sample_spread_ratio": 1.0337390213684157, "seconds": 1.372664, "skipped": false, "state_layout": "xyzz", "status": "discard", "steps_per_sample": 2048, "thread_execution_width": 32, "threadgroup_limit": 128, "threads_per_threadgroup": 128, "timestamp": "2026-07-10T02:35:25Z", "validation_seconds": 5.334994, "validation_workers": 8}
{"affine_scan_mode": "cpu_batch_prod_zz_zzz", "affine_scan_seconds": 0.008028, "backend": "metal", "budget_sec": 480, "commit": "1850591-dirty", "cooldown_sec": 10.0, "correctness": true, "description": "Large validated Metal XYZZ 2048-step dp6 walk gate matching the 25M fixed-round walker count", "distance_tracking": "packet_distance_uint64", "dp_bits": 6, "dp_checksum": "0x54ccada61fd1edbc", "dp_count": 2087, "dp_distance_checksum": "0xf31d7766e1607041", "dp_normalization": "host_batch_affine", "dp_sampling": "packet_endpoint", "dp_tracking": "affine_x_limb0_cpu_batch", "experiment": "metal_jacobian_dynamic_xyzz_steps2048_dp6_walk_gate_131k", "gpu_ops_per_sec": 69645133.743211, "gpu_ops_per_sec_max": 84931286.640168, "gpu_ops_per_sec_min": 59174138.447346, "iterations": 268435456, "jump_count": 16, "jump_histogram_max_bucket": 16782260, "jump_histogram_max_deviation_ppm": 346, "jump_histogram_min_bucket": 16771410, "jump_index": "power2_mask", "jump_mixer": "avalanche64", "jump_schedule": "power2", "machine": "macOS-26.5-arm64-arm-64bit-Mach-O", "max_sample_spread_ratio": 1.15, "max_threads_per_threadgroup": 1024, "min_ms": 0, "operation": "jacobian_affine_walk_dynamic_dp_stream_xyzz_affine_scan", "ops_per_sec": 69645133.743211, "ops_per_sec_max": 84931286.640168, "ops_per_sec_min": 59174138.447346, "output_layout": "affine_dp_scan", "paired_baseline_ops_per_sec": 95575277.423572, "paired_baseline_ref": "HEAD", "paired_baseline_sample_spread_ratio": 1.8074976008337524, "paired_order": "alternate", "paired_speedup": 0.7286940265373922, "reason": "sample spread ratio 1.435277 exceeds max 1.150000; paired baseline sample spread ratio 1.807498 exceeds max 1.150000", "runner_sample_count": 3, "sample_count": 131072, "sample_metric": "gpu_ops_per_sec", "sample_metric_values": [59174138.447346, 69645133.743211, 84931286.640168], "sample_spread_ratio": 1.435277113763829, "seconds": 3.854332, "skipped": false, "state_layout": "xyzz", "status": "discard", "steps_per_sample": 2048, "thread_execution_width": 32, "threadgroup_limit": 128, "threads_per_threadgroup": 128, "timestamp": "2026-07-10T02:40:00Z", "validation_seconds": 12.621693, "validation_workers": 8}
