{"affine_scan_mode": "cpu_batch_prod_zz_zzz", "affine_scan_seconds": 0.00535, "backend": "metal", "budget_sec": 180, "bytes_per_target": 4.0, "candidate_verification": "tag16_hash_filter_then_cpu_exact_key_equality", "commit": "1edced1-dirty", "cooldown_sec": 3.0, "correctness": true, "description": "Medium fixed-round 1M target lookup with physical distinct-miss queries; fast falsifier for setup-inclusive wall-clock kangaroo distance/sec", "distance_per_sec": 174543773444.86874, "distance_tracking": "packet_distance_uint64", "distinct_miss_source_seconds": 1.5e-05, "dp_bits": 6, "dp_checksum": "0xbd17120591af6f74", "dp_count": 1053, "dp_distance_checksum": "0x9eca239fc5687305", "dp_normalization": "host_batch_affine", "dp_query_count": 1053, "dp_sampling": "packet_endpoint", "dp_tracking": "affine_x256_y_parity_cpu_batch", "exact_host_table_bytes": 50331648, "experiment": "metal_jacobian_dynamic_dp_stream_xyzz_affine_scan_target_lookup_tag16_hash_filter1m_rounds_distinct_misses_distance", "filter_false_positive_count": 28, "filter_positive_count": 92, "gpu_distance_per_sec": 176614715414.4416, "gpu_lookup_lookups_per_sec": 34176337.746928, "gpu_ops_per_sec": 43119484.956604, "hit_count": 64, "injected_hits": 64, "iterations": 134217728, "jump_count": 16, "jump_histogram_max_bucket": 8393138, "jump_histogram_max_deviation_ppm": 707, "jump_histogram_min_bucket": 8382675, "jump_index": "power2_mask", "jump_mixer": "avalanche64", "jump_schedule": "power2", "lookup_buffer_seconds": 0.002583, "lookup_engine": "gpu_filter16_hash", "lookup_engine_effective": "gpu_filter16_hash", "lookup_exact_seconds": 3.2e-05, "lookup_gpu_seconds": 0.03155, "lookup_hash_seconds": 0.0, "lookup_layout": "open_address_tag16_hash_filter_exact256", "lookup_max_threads_per_threadgroup": 1024, "lookup_query_mode": "distinct_misses", "lookup_repeat": 1024, "lookup_seconds": 0.031582, "lookup_thread_execution_width": 32, "lookup_threadgroup_limit": 512, "lookup_threads_per_threadgroup": 512, "lookup_wall_seconds": 0.034165, "lookups_per_sec": 34142025.013142, "machine": "macOS-26.5-arm64-arm-64bit-Mach-O", "max_sample_spread_ratio": 1.5, "max_threads_per_threadgroup": 1024, "mean_jump_distance": 4095.9375, "min_ms": 0, "miss_count": 1078208, "operation": "jacobian_affine_scan_target_lookup_tag32_rounds", "ops_per_sec": 157315104425.45416, "ops_per_sec_max": 170832174200.65762, "ops_per_sec_min": 125553730608.2134, "output_layout": "affine_dp_scan_target_lookup", "paired_baseline_ops_per_sec": 142459694236.06815, "paired_baseline_ref": "main", "paired_order": "alternate", "paired_speedup": 1.104277987321588, "physical_filter_positive_count": 92, "physical_query_count": 1078272, "query_count": 1078272, "query_input": "hash64_prefix_gpu_miss", "reason": "", "repeat_positive_index_encoding": "physical_query_index", "requested_hits": 32, "round_count": 2, "round_sample_build_seconds": 0.001909, "runner_sample_count": 3, "sample_count": 32768, "sample_metric": "setup_inclusive_wall_distance_per_sec", "sample_metric_values": [170832174200.65762, 157315104425.45416, 125553730608.2134], "sample_spread_ratio": 1.360630013724835, "seconds": 3.112693, "setup_inclusive_distance_per_sec": 160176822754.30524, "setup_inclusive_ops_per_sec": 39106266.332019, "setup_inclusive_seconds": 3.432128, "setup_inclusive_wall_distance_per_sec": 157315104425.45416, "setup_inclusive_wall_distance_per_sec_max": 170832174200.65762, "setup_inclusive_wall_distance_per_sec_min": 125553730608.2134, "setup_inclusive_wall_ops_per_sec": 38407593.969745, "setup_inclusive_wall_seconds": 3.494562, "skipped": false, "state_layout": "xyzz", "status": "keep", "steps_per_sample": 2048, "target_bucket_bytes": 16777216, "target_build_seconds": 0.280579, "target_count": 1048576, "target_filter_bucket_bytes": 4194304, "target_filter_build_seconds": 0.0, "target_key": "x256_y_parity", "target_key_bytes": 33554432, "target_lookup_checksum": "0xcb38405cd10f441d", "target_lookup_scope": "packet_endpoint_dp_keys", "target_query_hash_bytes": 8424, "target_setup_workers": 8, "target_table_buckets": 2097152, "target_table_bytes": 4194304, "thread_execution_width": 32, "threadgroup_limit": 128, "threads_per_threadgroup": 128, "timestamp": "2026-07-07T15:17:11Z", "validation_seconds": 15.056684, "validation_workers": 8, "walk_buffer_seconds": 0.05985, "walk_round_mode": "independent", "walk_wall_seconds": 3.172544}
{"affine_scan_mode": "cpu_batch_prod_zz_zzz", "affine_scan_seconds": 0.021876, "backend": "metal", "budget_sec": 180, "bytes_per_target": 4.0, "candidate_verification": "tag16_hash_filter_then_cpu_exact_key_equality", "commit": "1edced1-dirty", "cooldown_sec": 3.0, "correctness": true, "description": "Medium fixed-round 1M target lookup with physical distinct-miss queries; fast falsifier for setup-inclusive wall-clock kangaroo distance/sec", "distance_per_sec": 248839360837.35406, "distance_tracking": "packet_distance_uint64", "distinct_miss_source_seconds": 8e-06, "dp_bits": 6, "dp_checksum": "0xbd17120591af6f74", "dp_count": 1053, "dp_distance_checksum": "0x9eca239fc5687305", "dp_normalization": "host_batch_affine", "dp_query_count": 1053, "dp_sampling": "packet_endpoint", "dp_tracking": "affine_x256_y_parity_cpu_batch", "exact_host_table_bytes": 50331648, "experiment": "metal_jacobian_dynamic_dp_stream_xyzz_affine_scan_target_lookup_tag16_hash_filter1m_rounds_distinct_misses_distance", "filter_false_positive_count": 28, "filter_positive_count": 92, "gpu_distance_per_sec": 252233665412.29688, "gpu_lookup_lookups_per_sec": 218814430.479209, "gpu_ops_per_sec": 61581424.377764, "hit_count": 64, "injected_hits": 64, "iterations": 134217728, "jump_count": 16, "jump_histogram_max_bucket": 8393138, "jump_histogram_max_deviation_ppm": 707, "jump_histogram_min_bucket": 8382675, "jump_index": "power2_mask", "jump_mixer": "avalanche64", "jump_schedule": "power2", "lookup_buffer_seconds": 0.006615, "lookup_engine": "gpu_filter16_hash", "lookup_engine_effective": "gpu_filter16_hash", "lookup_exact_seconds": 0.002926, "lookup_gpu_seconds": 0.004928, "lookup_hash_seconds": 0.0, "lookup_layout": "open_address_tag16_hash_filter_exact256", "lookup_max_threads_per_threadgroup": 1024, "lookup_query_mode": "distinct_misses", "lookup_repeat": 1024, "lookup_seconds": 0.007854, "lookup_thread_execution_width": 32, "lookup_threadgroup_limit": 512, "lookup_threads_per_threadgroup": 512, "lookup_wall_seconds": 0.014468, "lookups_per_sec": 137296806.146086, "machine": "macOS-26.5-arm64-arm-64bit-Mach-O", "max_sample_spread_ratio": 1.5, "max_threads_per_threadgroup": 1024, "mean_jump_distance": 4095.9375, "min_ms": 0, "miss_count": 1078208, "operation": "jacobian_affine_scan_target_lookup_tag32_rounds", "ops_per_sec": 234743244634.23108, "ops_per_sec_max": 352373725250.591, "ops_per_sec_min": 203432753676.88528, "output_layout": "affine_dp_scan_target_lookup", "paired_baseline_ops_per_sec": 238032504535.73224, "paired_baseline_ref": "main", "paired_order": "alternate", "paired_speedup": 0.9861814674936238, "physical_filter_positive_count": 92, "physical_query_count": 1078272, "query_count": 1078272, "query_input": "hash64_prefix_gpu_miss", "reason": "sample spread ratio 1.732139 exceeds max 1.500000", "repeat_positive_index_encoding": "physical_query_index", "requested_hits": 32, "round_count": 2, "round_sample_build_seconds": 0.001021, "runner_sample_count": 3, "sample_count": 32768, "sample_metric": "setup_inclusive_wall_distance_per_sec", "sample_metric_values": [203432753676.88528, 352373725250.591, 234743244634.23108], "sample_spread_ratio": 1.7321386005041768, "seconds": 2.179516, "setup_inclusive_distance_per_sec": 240016793421.71884, "setup_inclusive_ops_per_sec": 58598744.10235, "setup_inclusive_seconds": 2.290454, "setup_inclusive_wall_distance_per_sec": 234743244634.23108, "setup_inclusive_wall_distance_per_sec_max": 352373725250.591, "setup_inclusive_wall_distance_per_sec_min": 203432753676.88528, "setup_inclusive_wall_ops_per_sec": 57311236.959605, "setup_inclusive_wall_seconds": 2.341909, "skipped": false, "state_layout": "xyzz", "status": "discard", "steps_per_sample": 2048, "target_bucket_bytes": 16777216, "target_build_seconds": 0.080179, "target_count": 1048576, "target_filter_bucket_bytes": 4194304, "target_filter_build_seconds": 0.0, "target_key": "x256_y_parity", "target_key_bytes": 33554432, "target_lookup_checksum": "0xcb38405cd10f441d", "target_lookup_scope": "packet_endpoint_dp_keys", "target_query_hash_bytes": 8424, "target_setup_workers": 8, "target_table_buckets": 2097152, "target_table_bytes": 4194304, "thread_execution_width": 32, "threadgroup_limit": 128, "threads_per_threadgroup": 128, "timestamp": "2026-07-07T15:19:56Z", "validation_seconds": 13.713158, "validation_workers": 8, "walk_buffer_seconds": 0.044841, "walk_round_mode": "independent", "walk_wall_seconds": 2.224357}
{"affine_scan_mode": "cpu_batch_prod_zz_zzz", "affine_scan_seconds": 0.004266, "backend": "metal", "budget_sec": 180, "bytes_per_target": 4.0, "candidate_verification": "tag16_hash_filter_then_cpu_exact_key_equality", "commit": "7cf8dbf-dirty", "confirmation_index": 1, "confirmation_runs": 2, "confirmation_status": "discard", "cooldown_sec": 3.0, "correctness": true, "description": "Medium fixed-round 1M target lookup with physical distinct-miss queries; fast falsifier for setup-inclusive wall-clock kangaroo distance/sec", "distance_per_sec": 207733327377.69135, "distance_tracking": "packet_distance_uint64", "distinct_miss_source_seconds": 7e-06, "dp_bits": 6, "dp_checksum": "0xbd17120591af6f74", "dp_count": 1053, "dp_distance_checksum": "0x9eca239fc5687305", "dp_normalization": "host_batch_affine", "dp_query_count": 1053, "dp_sampling": "packet_endpoint", "dp_tracking": "affine_x256_y_parity_cpu_batch", "exact_host_table_bytes": 16779264, "experiment": "metal_jacobian_dynamic_dp_stream_xyzz_affine_scan_target_lookup_tag16_hash_filter1m_rounds_distinct_misses_distance", "filter_false_positive_count": 28, "filter_positive_count": 92, "gpu_distance_per_sec": 208536896370.88156, "gpu_lookup_lookups_per_sec": 182267542.840239, "gpu_ops_per_sec": 50913105.087878, "hit_count": 64, "injected_hits": 64, "iterations": 134217728, "jump_count": 16, "jump_histogram_max_bucket": 8393138, "jump_histogram_max_deviation_ppm": 707, "jump_histogram_min_bucket": 8382675, "jump_index": "power2_mask", "jump_mixer": "avalanche64", "jump_schedule": "power2", "lookup_buffer_seconds": 0.002504, "lookup_engine": "gpu_filter16_hash", "lookup_engine_effective": "gpu_filter16_hash", "lookup_exact_seconds": 1.5e-05, "lookup_gpu_seconds": 0.005916, "lookup_hash_seconds": 0.0, "lookup_layout": "open_address_tag16_hash_filter_exact256", "lookup_max_threads_per_threadgroup": 1024, "lookup_query_mode": "distinct_misses", "lookup_repeat": 1024, "lookup_seconds": 0.005931, "lookup_thread_execution_width": 32, "lookup_threadgroup_limit": 512, "lookup_threads_per_threadgroup": 512, "lookup_wall_seconds": 0.008435, "lookups_per_sec": 181798899.871441, "machine": "macOS-26.5-arm64-arm-64bit-Mach-O", "max_sample_spread_ratio": 1.5, "max_threads_per_threadgroup": 1024, "mean_jump_distance": 4095.9375, "min_ms": 0, "miss_count": 1078208, "operation": "jacobian_affine_scan_target_lookup_tag32_rounds", "ops_per_sec": 197339550125.07977, "ops_per_sec_max": 223799675272.66125, "ops_per_sec_min": 189008595879.93414, "output_layout": "affine_dp_scan_target_lookup", "paired_baseline_ops_per_sec": 192011249747.14645, "paired_baseline_ref": "HEAD", "paired_order": "alternate", "paired_speedup": 1.027749938531987, "physical_filter_positive_count": 92, "physical_query_count": 1078272, "query_count": 1078272, "query_input": "hash64_prefix_gpu_miss", "raw_status": "keep", "reason": "", "repeat_positive_index_encoding": "physical_query_index", "requested_hits": 32, "round_count": 2, "round_sample_build_seconds": 0.001344, "runner_sample_count": 3, "sample_count": 32768, "sample_metric": "setup_inclusive_wall_distance_per_sec", "sample_metric_values": [189008595879.93414, 197339550125.07977, 223799675272.66125], "sample_spread_ratio": 1.1840714134230583, "seconds": 2.636212, "setup_inclusive_distance_per_sec": 201379426586.68896, "setup_inclusive_ops_per_sec": 49165649.277287, "setup_inclusive_seconds": 2.729909, "setup_inclusive_wall_distance_per_sec": 197339550125.07977, "setup_inclusive_wall_distance_per_sec_max": 223799675272.66125, "setup_inclusive_wall_distance_per_sec_min": 189008595879.93414, "setup_inclusive_wall_ops_per_sec": 48179336.263085, "setup_inclusive_wall_seconds": 2.785794, "skipped": false, "state_layout": "xyzz", "status": "discard", "steps_per_sample": 2048, "target_bucket_bytes": 16777216, "target_build_seconds": 0.082148, "target_count": 1048576, "target_filter_bucket_bytes": 4194304, "target_filter_build_seconds": 0.0, "target_key": "x256_y_parity", "target_key_bytes": 2048, "target_lookup_checksum": "0xcb38405cd10f441d", "target_lookup_scope": "packet_endpoint_dp_keys", "target_query_hash_bytes": 8424, "target_setup_workers": 8, "target_table_buckets": 2097152, "target_table_bytes": 4194304, "thread_execution_width": 32, "threadgroup_limit": 128, "threads_per_threadgroup": 128, "timestamp": "2026-07-07T16:25:27Z", "validation_seconds": 8.395692, "validation_workers": 8, "walk_buffer_seconds": 0.053382, "walk_round_mode": "independent", "walk_wall_seconds": 2.689593}
{"affine_scan_mode": "cpu_batch_prod_zz_zzz", "affine_scan_seconds": 0.004564, "backend": "metal", "budget_sec": 180, "bytes_per_target": 4.0, "candidate_verification": "tag16_hash_filter_then_cpu_exact_key_equality", "commit": "7cf8dbf-dirty", "confirmation_index": 2, "confirmation_runs": 2, "confirmation_status": "discard", "cooldown_sec": 3.0, "correctness": true, "description": "Medium fixed-round 1M target lookup with physical distinct-miss queries; fast falsifier for setup-inclusive wall-clock kangaroo distance/sec", "distance_per_sec": 214316535131.00388, "distance_tracking": "packet_distance_uint64", "distinct_miss_source_seconds": 6e-06, "dp_bits": 6, "dp_checksum": "0xbd17120591af6f74", "dp_count": 1053, "dp_distance_checksum": "0x9eca239fc5687305", "dp_normalization": "host_batch_affine", "dp_query_count": 1053, "dp_sampling": "packet_endpoint", "dp_tracking": "affine_x256_y_parity_cpu_batch", "exact_host_table_bytes": 16779264, "experiment": "metal_jacobian_dynamic_dp_stream_xyzz_affine_scan_target_lookup_tag16_hash_filter1m_rounds_distinct_misses_distance", "filter_false_positive_count": 28, "filter_positive_count": 92, "gpu_distance_per_sec": 215131354582.40332, "gpu_lookup_lookups_per_sec": 209889409.56535, "gpu_ops_per_sec": 52523104.803822, "hit_count": 64, "injected_hits": 64, "iterations": 134217728, "jump_count": 16, "jump_histogram_max_bucket": 8393138, "jump_histogram_max_deviation_ppm": 707, "jump_histogram_min_bucket": 8382675, "jump_index": "power2_mask", "jump_mixer": "avalanche64", "jump_schedule": "power2", "lookup_buffer_seconds": 0.001793, "lookup_engine": "gpu_filter16_hash", "lookup_engine_effective": "gpu_filter16_hash", "lookup_exact_seconds": 1.4e-05, "lookup_gpu_seconds": 0.005137, "lookup_hash_seconds": 0.0, "lookup_layout": "open_address_tag16_hash_filter_exact256", "lookup_max_threads_per_threadgroup": 1024, "lookup_query_mode": "distinct_misses", "lookup_repeat": 1024, "lookup_seconds": 0.005151, "lookup_thread_execution_width": 32, "lookup_threadgroup_limit": 512, "lookup_threads_per_threadgroup": 512, "lookup_wall_seconds": 0.006944, "lookups_per_sec": 209317318.191745, "machine": "macOS-26.5-arm64-arm-64bit-Mach-O", "max_sample_spread_ratio": 1.5, "max_threads_per_threadgroup": 1024, "mean_jump_distance": 4095.9375, "min_ms": 0, "miss_count": 1078208, "operation": "jacobian_affine_scan_target_lookup_tag32_rounds", "ops_per_sec": 201497410371.19272, "ops_per_sec_max": 224314599229.34442, "ops_per_sec_min": 199026557464.3228, "output_layout": "affine_dp_scan_target_lookup", "paired_baseline_ops_per_sec": 213837309445.73947, "paired_baseline_ref": "HEAD", "paired_order": "alternate", "paired_speedup": 0.9422930492974709, "physical_filter_positive_count": 92, "physical_query_count": 1078272, "query_count": 1078272, "query_input": "hash64_prefix_gpu_miss", "raw_status": "discard", "reason": "", "repeat_positive_index_encoding": "physical_query_index", "requested_hits": 32, "round_count": 2, "round_sample_build_seconds": 0.000971, "runner_sample_count": 3, "sample_count": 32768, "sample_metric": "setup_inclusive_wall_distance_per_sec", "sample_metric_values": [201497410371.19272, 199026557464.3228, 224314599229.34442], "sample_spread_ratio": 1.1270586302009202, "seconds": 2.555404, "setup_inclusive_distance_per_sec": 206462490885.2768, "setup_inclusive_ops_per_sec": 50406650.708239, "setup_inclusive_seconds": 2.662699, "setup_inclusive_wall_distance_per_sec": 201497410371.19272, "setup_inclusive_wall_distance_per_sec_max": 224314599229.34442, "setup_inclusive_wall_distance_per_sec_min": 199026557464.3228, "setup_inclusive_wall_ops_per_sec": 49194454.351706, "setup_inclusive_wall_seconds": 2.72831, "skipped": false, "state_layout": "xyzz", "status": "discard", "steps_per_sample": 2048, "target_bucket_bytes": 16777216, "target_build_seconds": 0.096603, "target_count": 1048576, "target_filter_bucket_bytes": 4194304, "target_filter_build_seconds": 0.0, "target_key": "x256_y_parity", "target_key_bytes": 2048, "target_lookup_checksum": "0xcb38405cd10f441d", "target_lookup_scope": "packet_endpoint_dp_keys", "target_query_hash_bytes": 8424, "target_setup_workers": 8, "target_table_buckets": 2097152, "target_table_bytes": 4194304, "thread_execution_width": 32, "threadgroup_limit": 128, "threads_per_threadgroup": 128, "timestamp": "2026-07-07T16:25:27Z", "validation_seconds": 8.845666, "validation_workers": 8, "walk_buffer_seconds": 0.063819, "walk_round_mode": "independent", "walk_wall_seconds": 2.619222}
