{"affine_scan_mode": "cpu_batch_prod_zz_zzz", "affine_scan_seconds": 0.000579, "backend": "metal", "budget_sec": 180, "bytes_per_target": 4.0, "candidate_verification": "tag16_hash_filter_then_cpu_exact_key_equality", "commit": "e5892e2-dirty", "confirmation_index": 2, "confirmation_runs": 2, "confirmation_status": "discard", "cooldown_sec": 5.0, "correctness": true, "description": "M3 large-repeat auto lookup threadgroup 768 policy versus prior 512 default", "distance_tracking": "packet_distance_uint64", "dp_bits": 6, "dp_checksum": "0xbeb579944293c04a", "dp_count": 125, "dp_distance_checksum": "0xe3db79a4e83bd59d", "dp_query_count": 125, "dp_tracking": "affine_x256_y_parity_cpu_batch", "exact_host_table_bytes": 939524096, "experiment": "metal_jacobian_dynamic_dp_stream_xyzz_affine_scan_target_lookup_tag16_hash_filter_m3_auto_repeat_tg768", "filter_false_positive_count": 0, "filter_positive_count": 2097152, "gpu_lookup_lookups_per_sec": 2105179707.039008, "gpu_ops_per_sec": 65788575.189484, "hit_count": 2097152, "injected_hits": 16, "iterations": 8388608, "jump_count": 16, "jump_histogram_max_bucket": 262877, "jump_histogram_max_deviation_ppm": 3475, "jump_histogram_min_bucket": 261233, "jump_index": "power2_mask", "jump_mixer": "avalanche64", "jump_schedule": "power2", "lookup_engine": "auto", "lookup_engine_effective": "gpu_filter16_hash_repeat", "lookup_exact_seconds": 0.004512, "lookup_gpu_seconds": 0.015565, "lookup_hash_seconds": 2e-06, "lookup_layout": "open_address_tag16_hash_filter_exact256", "lookup_max_threads_per_threadgroup": 1024, "lookup_query_mode": "repeat", "lookup_repeat": 131072, "lookup_seconds": 0.020079, "lookup_thread_execution_width": 32, "lookup_threadgroup_limit": 768, "lookup_threads_per_threadgroup": 768, "lookups_per_sec": 1631933463.650286, "machine": "macOS-26.5-arm64-arm-64bit-Mach-O", "max_threads_per_threadgroup": 1024, "min_ms": 100, "miss_count": 14286848, "operation": "jacobian_affine_scan_target_lookup_tag32", "ops_per_sec": 56615931.341812, "ops_per_sec_max": 60881628.072147, "ops_per_sec_min": 55999185.200149, "output_layout": "affine_dp_scan_target_lookup", "paired_baseline_ops_per_sec": 59226315.668816, "paired_baseline_ref": "HEAD", "paired_order": "alternate", "paired_speedup": 0.9559252623175001, "query_count": 16384000, "query_input": "hash64_repeat_indexed", "raw_status": "discard", "reason": "", "repeat_positive_index_encoding": "logical_query_index", "requested_hits": 16, "round_count": 1, "runner_sample_count": 3, "sample_count": 8192, "seconds": 0.127509, "setup_inclusive_ops_per_sec": 18985632.649887, "setup_inclusive_seconds": 0.44184, "skipped": false, "state_layout": "xyzz", "status": "discard", "steps_per_sample": 512, "target_bucket_bytes": 268435456, "target_build_seconds": 0.267795, "target_count": 16777216, "target_filter_bucket_bytes": 67108864, "target_filter_build_seconds": 0.025878, "target_key": "x256_y_parity", "target_key_bytes": 671088640, "target_lookup_checksum": "0x86ec0110960785f8", "target_query_hash_bytes": 1000, "target_table_buckets": 33554432, "target_table_bytes": 67108864, "thread_execution_width": 32, "threadgroup_limit": 128, "threads_per_threadgroup": 128, "timestamp": "2026-06-30T18:54:44Z", "validation_seconds": 0.12944, "validation_workers": 8}
{"affine_scan_mode": "cpu_batch_prod_zz_zzz", "affine_scan_seconds": 0.000725, "backend": "metal", "budget_sec": 180, "bytes_per_target": 4.0, "candidate_verification": "tag16_hash_filter_then_cpu_exact_key_equality", "commit": "e5892e2-dirty", "confirmation_index": 1, "confirmation_runs": 2, "confirmation_status": "keep", "cooldown_sec": 5.0, "correctness": true, "description": "M3 repeat-indexed tag16 hash filter sparse base-index positive encoding versus logical positive indices", "distance_tracking": "packet_distance_uint64", "dp_bits": 6, "dp_checksum": "0xbeb579944293c04a", "dp_count": 125, "dp_distance_checksum": "0xe3db79a4e83bd59d", "dp_query_count": 125, "dp_tracking": "affine_x256_y_parity_cpu_batch", "exact_host_table_bytes": 939524096, "experiment": "metal_jacobian_dynamic_dp_stream_xyzz_affine_scan_target_lookup_tag16_hash_filter_m3_sparse_repeat_base_index", "filter_false_positive_count": 0, "filter_positive_count": 2097152, "gpu_lookup_lookups_per_sec": 1491711912.408541, "gpu_ops_per_sec": 67637269.072114, "hit_count": 2097152, "injected_hits": 16, "iterations": 8388608, "jump_count": 16, "jump_histogram_max_bucket": 262877, "jump_histogram_max_deviation_ppm": 3475, "jump_histogram_min_bucket": 261233, "jump_index": "power2_mask", "jump_mixer": "avalanche64", "jump_schedule": "power2", "lookup_engine": "auto", "lookup_engine_effective": "gpu_filter16_hash_repeat", "lookup_exact_seconds": 0.010581, "lookup_gpu_seconds": 0.021967, "lookup_hash_seconds": 3e-06, "lookup_layout": "open_address_tag16_hash_filter_exact256", "lookup_max_threads_per_threadgroup": 1024, "lookup_query_mode": "repeat", "lookup_repeat": 131072, "lookup_seconds": 0.032551, "lookup_thread_execution_width": 32, "lookup_threadgroup_limit": 512, "lookup_threads_per_threadgroup": 512, "lookups_per_sec": 1006663833.171767, "machine": "macOS-26.5-arm64-arm-64bit-Mach-O", "max_threads_per_threadgroup": 1024, "min_ms": 100, "miss_count": 14286848, "operation": "jacobian_affine_scan_target_lookup_tag32", "ops_per_sec": 53328905.600368, "ops_per_sec_max": 56208515.260983, "ops_per_sec_min": 47263479.754293, "output_layout": "affine_dp_scan_target_lookup", "paired_baseline_ops_per_sec": 46870638.585665, "paired_baseline_ref": "HEAD", "paired_order": "alternate", "paired_speedup": 1.1377891833690144, "query_count": 16384000, "query_input": "hash64_repeat_indexed", "raw_status": "keep", "reason": "", "repeat_positive_index_encoding": "base_query_index_repeated", "requested_hits": 16, "round_count": 1, "runner_sample_count": 3, "sample_count": 8192, "seconds": 0.124023, "setup_inclusive_ops_per_sec": 16549787.398291, "setup_inclusive_seconds": 0.506871, "skipped": false, "state_layout": "xyzz", "status": "keep", "steps_per_sample": 512, "target_bucket_bytes": 268435456, "target_build_seconds": 0.316693, "target_count": 16777216, "target_filter_bucket_bytes": 67108864, "target_filter_build_seconds": 0.032878, "target_key": "x256_y_parity", "target_key_bytes": 671088640, "target_lookup_checksum": "0x86ec0110960785f8", "target_query_hash_bytes": 1000, "target_table_buckets": 33554432, "target_table_bytes": 67108864, "thread_execution_width": 32, "threadgroup_limit": 128, "threads_per_threadgroup": 128, "timestamp": "2026-06-30T19:02:24Z", "validation_seconds": 0.164298, "validation_workers": 8}
{"affine_scan_mode": "cpu_batch_prod_zz_zzz", "affine_scan_seconds": 0.00055, "backend": "metal", "budget_sec": 180, "bytes_per_target": 4.0, "candidate_verification": "tag16_hash_filter_then_cpu_exact_key_equality", "commit": "e5892e2-dirty", "confirmation_index": 2, "confirmation_runs": 2, "confirmation_status": "keep", "cooldown_sec": 5.0, "correctness": true, "description": "M3 repeat-indexed tag16 hash filter sparse base-index positive encoding versus logical positive indices", "distance_tracking": "packet_distance_uint64", "dp_bits": 6, "dp_checksum": "0xbeb579944293c04a", "dp_count": 125, "dp_distance_checksum": "0xe3db79a4e83bd59d", "dp_query_count": 125, "dp_tracking": "affine_x256_y_parity_cpu_batch", "exact_host_table_bytes": 939524096, "experiment": "metal_jacobian_dynamic_dp_stream_xyzz_affine_scan_target_lookup_tag16_hash_filter_m3_sparse_repeat_base_index", "filter_false_positive_count": 0, "filter_positive_count": 2097152, "gpu_lookup_lookups_per_sec": 892773898.743725, "gpu_ops_per_sec": 53912516.944129, "hit_count": 2097152, "injected_hits": 16, "iterations": 4194304, "jump_count": 16, "jump_histogram_max_bucket": 262877, "jump_histogram_max_deviation_ppm": 3475, "jump_histogram_min_bucket": 261233, "jump_index": "power2_mask", "jump_mixer": "avalanche64", "jump_schedule": "power2", "lookup_engine": "auto", "lookup_engine_effective": "gpu_filter16_hash_repeat", "lookup_exact_seconds": 0.005509, "lookup_gpu_seconds": 0.018352, "lookup_hash_seconds": 5e-06, "lookup_layout": "open_address_tag16_hash_filter_exact256", "lookup_max_threads_per_threadgroup": 1024, "lookup_query_mode": "repeat", "lookup_repeat": 131072, "lookup_seconds": 0.023866, "lookup_thread_execution_width": 32, "lookup_threadgroup_limit": 512, "lookup_threads_per_threadgroup": 512, "lookups_per_sec": 686502039.142348, "machine": "macOS-26.5-arm64-arm-64bit-Mach-O", "max_threads_per_threadgroup": 1024, "min_ms": 100, "miss_count": 14286848, "operation": "jacobian_affine_scan_target_lookup_tag32", "ops_per_sec": 41034435.022514, "ops_per_sec_max": 48824864.065378, "ops_per_sec_min": 38974588.774482, "output_layout": "affine_dp_scan_target_lookup", "paired_baseline_ops_per_sec": 33622719.47427, "paired_baseline_ref": "HEAD", "paired_order": "alternate", "paired_speedup": 1.2204377178329036, "query_count": 16384000, "query_input": "hash64_repeat_indexed", "raw_status": "keep", "reason": "", "repeat_positive_index_encoding": "base_query_index_repeated", "requested_hits": 16, "round_count": 1, "runner_sample_count": 3, "sample_count": 8192, "seconds": 0.077798, "setup_inclusive_ops_per_sec": 6556227.613098, "setup_inclusive_seconds": 0.639744, "skipped": false, "state_layout": "xyzz", "status": "keep", "steps_per_sample": 512, "target_bucket_bytes": 268435456, "target_build_seconds": 0.452933, "target_count": 16777216, "target_filter_bucket_bytes": 67108864, "target_filter_build_seconds": 0.084596, "target_key": "x256_y_parity", "target_key_bytes": 671088640, "target_lookup_checksum": "0x86ec0110960785f8", "target_query_hash_bytes": 1000, "target_table_buckets": 33554432, "target_table_bytes": 67108864, "thread_execution_width": 32, "threadgroup_limit": 128, "threads_per_threadgroup": 128, "timestamp": "2026-06-30T19:02:25Z", "validation_seconds": 0.306452, "validation_workers": 8}
{"affine_scan_mode": "cpu_batch_prod_zz_zzz", "affine_scan_seconds": 0.000717, "backend": "metal", "budget_sec": 180, "bytes_per_target": 4.0, "candidate_verification": "tag16_hash_filter_then_cpu_exact_key_equality", "commit": "d16d3fd-dirty", "confirmation_index": 1, "confirmation_runs": 2, "confirmation_status": "keep", "cooldown_sec": 5.0, "correctness": true, "description": "M3 repeat-indexed tag16 hash filter fused target-filter setup versus post-build filter derivation", "distance_tracking": "packet_distance_uint64", "dp_bits": 6, "dp_checksum": "0xbeb579944293c04a", "dp_count": 125, "dp_distance_checksum": "0xe3db79a4e83bd59d", "dp_query_count": 125, "dp_tracking": "affine_x256_y_parity_cpu_batch", "exact_host_table_bytes": 939524096, "experiment": "metal_jacobian_dynamic_dp_stream_xyzz_affine_scan_target_lookup_tag16_hash_filter_m3_fused_filter_setup", "filter_false_positive_count": 0, "filter_positive_count": 2097152, "gpu_lookup_lookups_per_sec": 768846944.976059, "gpu_ops_per_sec": 52738252.905804, "hit_count": 2097152, "injected_hits": 16, "iterations": 4194304, "jump_count": 16, "jump_histogram_max_bucket": 262877, "jump_histogram_max_deviation_ppm": 3475, "jump_histogram_min_bucket": 261233, "jump_index": "power2_mask", "jump_mixer": "avalanche64", "jump_schedule": "power2", "lookup_engine": "auto", "lookup_engine_effective": "gpu_filter16_hash_repeat", "lookup_exact_seconds": 0.006975, "lookup_gpu_seconds": 0.02131, "lookup_hash_seconds": 3.8e-05, "lookup_layout": "open_address_tag16_hash_filter_exact256", "lookup_max_threads_per_threadgroup": 1024, "lookup_query_mode": "repeat", "lookup_repeat": 131072, "lookup_seconds": 0.028323, "lookup_thread_execution_width": 32, "lookup_threadgroup_limit": 512, "lookup_threads_per_threadgroup": 512, "lookups_per_sec": 578475758.744538, "machine": "macOS-26.5-arm64-arm-64bit-Mach-O", "max_threads_per_threadgroup": 1024, "min_ms": 100, "miss_count": 14286848, "operation": "jacobian_affine_scan_target_lookup_tag32", "ops_per_sec": 5059542.988443, "ops_per_sec_max": 10226257.517735, "ops_per_sec_min": 4422030.262806, "output_layout": "affine_dp_scan_target_lookup", "paired_baseline_ops_per_sec": 4518461.033311, "paired_baseline_ref": "HEAD", "paired_order": "alternate", "paired_speedup": 1.1197491692731298, "query_count": 16384000, "query_input": "hash64_repeat_indexed", "raw_status": "keep", "reason": "", "repeat_positive_index_encoding": "base_query_index_repeated", "requested_hits": 16, "round_count": 1, "runner_sample_count": 3, "sample_count": 8192, "seconds": 0.079531, "setup_inclusive_ops_per_sec": 5059542.988443, "setup_inclusive_ops_per_sec_max": 10226257.517735, "setup_inclusive_ops_per_sec_min": 4422030.262806, "setup_inclusive_seconds": 0.828989, "skipped": false, "state_layout": "xyzz", "status": "keep", "steps_per_sample": 512, "target_bucket_bytes": 268435456, "target_build_seconds": 0.720418, "target_count": 16777216, "target_filter_bucket_bytes": 67108864, "target_filter_build_seconds": 0.0, "target_key": "x256_y_parity", "target_key_bytes": 671088640, "target_lookup_checksum": "0x86ec0110960785f8", "target_query_hash_bytes": 1000, "target_table_buckets": 33554432, "target_table_bytes": 67108864, "thread_execution_width": 32, "threadgroup_limit": 128, "threads_per_threadgroup": 128, "timestamp": "2026-06-30T19:17:01Z", "validation_seconds": 0.325625, "validation_workers": 8}
{"affine_scan_mode": "cpu_batch_prod_zz_zzz", "affine_scan_seconds": 0.00088, "backend": "metal", "budget_sec": 180, "bytes_per_target": 4.0, "candidate_verification": "tag16_hash_filter_then_cpu_exact_key_equality", "commit": "d16d3fd-dirty", "confirmation_index": 2, "confirmation_runs": 2, "confirmation_status": "keep", "cooldown_sec": 5.0, "correctness": true, "description": "M3 repeat-indexed tag16 hash filter fused target-filter setup versus post-build filter derivation", "distance_tracking": "packet_distance_uint64", "dp_bits": 6, "dp_checksum": "0xbeb579944293c04a", "dp_count": 125, "dp_distance_checksum": "0xe3db79a4e83bd59d", "dp_query_count": 125, "dp_tracking": "affine_x256_y_parity_cpu_batch", "exact_host_table_bytes": 939524096, "experiment": "metal_jacobian_dynamic_dp_stream_xyzz_affine_scan_target_lookup_tag16_hash_filter_m3_fused_filter_setup", "filter_false_positive_count": 0, "filter_positive_count": 2097152, "gpu_lookup_lookups_per_sec": 1269962632.062665, "gpu_ops_per_sec": 54144503.969535, "hit_count": 2097152, "injected_hits": 16, "iterations": 4194304, "jump_count": 16, "jump_histogram_max_bucket": 262877, "jump_histogram_max_deviation_ppm": 3475, "jump_histogram_min_bucket": 261233, "jump_index": "power2_mask", "jump_mixer": "avalanche64", "jump_schedule": "power2", "lookup_engine": "auto", "lookup_engine_effective": "gpu_filter16_hash_repeat", "lookup_exact_seconds": 0.009117, "lookup_gpu_seconds": 0.012901, "lookup_hash_seconds": 2e-05, "lookup_layout": "open_address_tag16_hash_filter_exact256", "lookup_max_threads_per_threadgroup": 1024, "lookup_query_mode": "repeat", "lookup_repeat": 131072, "lookup_seconds": 0.022038, "lookup_thread_execution_width": 32, "lookup_threadgroup_limit": 512, "lookup_threads_per_threadgroup": 512, "lookups_per_sec": 743443109.926349, "machine": "macOS-26.5-arm64-arm-64bit-Mach-O", "max_threads_per_threadgroup": 1024, "min_ms": 100, "miss_count": 14286848, "operation": "jacobian_affine_scan_target_lookup_tag32", "ops_per_sec": 5103671.503285, "ops_per_sec_max": 8464281.845339, "ops_per_sec_min": 4555736.587642, "output_layout": "affine_dp_scan_target_lookup", "paired_baseline_ops_per_sec": 4925686.310904, "paired_baseline_ref": "HEAD", "paired_order": "alternate", "paired_speedup": 1.036134089981937, "query_count": 16384000, "query_input": "hash64_repeat_indexed", "raw_status": "keep", "reason": "", "repeat_positive_index_encoding": "base_query_index_repeated", "requested_hits": 16, "round_count": 1, "runner_sample_count": 3, "sample_count": 8192, "seconds": 0.077465, "setup_inclusive_ops_per_sec": 5103671.503285, "setup_inclusive_ops_per_sec_max": 8464281.845339, "setup_inclusive_ops_per_sec_min": 4555736.587642, "setup_inclusive_seconds": 0.821821, "skipped": false, "state_layout": "xyzz", "status": "keep", "steps_per_sample": 512, "target_bucket_bytes": 268435456, "target_build_seconds": 0.721438, "target_count": 16777216, "target_filter_bucket_bytes": 67108864, "target_filter_build_seconds": 0.0, "target_key": "x256_y_parity", "target_key_bytes": 671088640, "target_lookup_checksum": "0x86ec0110960785f8", "target_query_hash_bytes": 1000, "target_table_buckets": 33554432, "target_table_bytes": 67108864, "thread_execution_width": 32, "threadgroup_limit": 128, "threads_per_threadgroup": 128, "timestamp": "2026-06-30T19:17:01Z", "validation_seconds": 0.348085, "validation_workers": 8}
{"affine_scan_mode": "cpu_batch_prod_zz_zzz", "affine_scan_seconds": 0.001118, "backend": "metal", "budget_sec": 180, "bytes_per_target": 4.0, "candidate_verification": "tag16_hash_filter_then_cpu_exact_key_equality", "commit": "99581a8-dirty", "confirmation_index": 1, "confirmation_runs": 2, "confirmation_status": "keep", "cooldown_sec": 5.0, "correctness": true, "description": "M3 repeat-indexed tag16 hash filter sparse exact resolver with per-base positive counts", "distance_tracking": "packet_distance_uint64", "dp_bits": 6, "dp_checksum": "0xbeb579944293c04a", "dp_count": 125, "dp_distance_checksum": "0xe3db79a4e83bd59d", "dp_query_count": 125, "dp_tracking": "affine_x256_y_parity_cpu_batch", "exact_host_table_bytes": 939524096, "experiment": "metal_jacobian_dynamic_dp_stream_xyzz_affine_scan_target_lookup_tag16_hash_filter_m3_sparse_repeat_base_counts", "filter_false_positive_count": 0, "filter_positive_count": 2097152, "gpu_lookup_lookups_per_sec": 1719811580.701455, "gpu_ops_per_sec": 46678052.028801, "hit_count": 2097152, "injected_hits": 16, "iterations": 8388608, "jump_count": 16, "jump_histogram_max_bucket": 262877, "jump_histogram_max_deviation_ppm": 3475, "jump_histogram_min_bucket": 261233, "jump_index": "power2_mask", "jump_mixer": "avalanche64", "jump_schedule": "power2", "lookup_engine": "auto", "lookup_engine_effective": "gpu_filter16_hash_repeat", "lookup_exact_seconds": 0.002904, "lookup_gpu_seconds": 0.019053, "lookup_hash_seconds": 0.000239, "lookup_layout": "open_address_tag16_hash_filter_exact256", "lookup_max_threads_per_threadgroup": 1024, "lookup_query_mode": "repeat", "lookup_repeat": 131072, "lookup_seconds": 0.022196, "lookup_thread_execution_width": 32, "lookup_threadgroup_limit": 512, "lookup_threads_per_threadgroup": 512, "lookups_per_sec": 1476299309.412881, "machine": "macOS-26.5-arm64-arm-64bit-Mach-O", "max_threads_per_threadgroup": 1024, "min_ms": 100, "miss_count": 14286848, "operation": "jacobian_affine_scan_target_lookup_tag32", "ops_per_sec": 41317942.907647, "ops_per_sec_max": 46360212.539205, "ops_per_sec_min": 35095596.437725, "output_layout": "affine_dp_scan_target_lookup", "paired_baseline_ops_per_sec": 35704953.032364, "paired_baseline_ref": "HEAD", "paired_order": "alternate", "paired_speedup": 1.1572047964940668, "query_count": 16384000, "query_input": "hash64_repeat_indexed", "raw_status": "keep", "reason": "", "repeat_positive_index_encoding": "base_query_index_repeated", "requested_hits": 16, "round_count": 1, "runner_sample_count": 3, "sample_count": 8192, "seconds": 0.179712, "setup_inclusive_ops_per_sec": 8937072.025993, "setup_inclusive_seconds": 0.93863, "skipped": false, "state_layout": "xyzz", "status": "keep", "steps_per_sample": 512, "target_bucket_bytes": 268435456, "target_build_seconds": 0.735605, "target_count": 16777216, "target_filter_bucket_bytes": 67108864, "target_filter_build_seconds": 0.0, "target_key": "x256_y_parity", "target_key_bytes": 671088640, "target_lookup_checksum": "0x86ec0110960785f8", "target_query_hash_bytes": 1000, "target_table_buckets": 33554432, "target_table_bytes": 67108864, "thread_execution_width": 32, "threadgroup_limit": 128, "threads_per_threadgroup": 128, "timestamp": "2026-06-30T19:32:41Z", "validation_seconds": 0.302166, "validation_workers": 8}
