{"affine_scan_mode": "cpu_batch_prod_zz_zzz", "affine_scan_seconds": 0.008137, "backend": "metal", "budget_sec": 540, "bytes_per_target": 2.683818, "candidate_verification": "tag16_hash_filter_then_cpu_exact_key_equality", "commit": "f8dceeb-dirty", "confirmation_index": 2, "confirmation_runs": 2, "confirmation_status": "discard", "cooldown_sec": 10.0, "correctness": true, "description": "Metal XYZZ 2048-step dp6 25M-target setup gate isolating 4-jump power2 against the accepted 16-jump power2 baseline", "distance_tracking": "packet_distance_uint64", "dp_bits": 6, "dp_checksum": "0x444def74a8413f00", "dp_count": 2012, "dp_distance_checksum": "0x271ee73d4839b420", "dp_query_count": 2012, "dp_tracking": "affine_x256_y_parity_cpu_batch", "exact_host_table_bytes": 1268635456, "experiment": "metal_jacobian_dynamic_dp_stream_xyzz_affine_scan_target_lookup_tag16_hash_filter25m_power2_j4_setup", "filter_false_positive_count": 1024, "filter_positive_count": 66560, "gpu_lookup_lookups_per_sec": 80954077.831495, "gpu_ops_per_sec": 59326246.728122, "hit_count": 65536, "injected_hits": 64, "iterations": 268435456, "jump_count": 4, "jump_histogram_max_bucket": 67115660, "jump_histogram_max_deviation_ppm": 116, "jump_histogram_min_bucket": 67101097, "jump_index": "power2_mask", "jump_mixer": "avalanche64", "jump_schedule": "power2", "lookup_engine": "gpu_filter16_hash_repeat", "lookup_engine_effective": "gpu_filter16_hash_repeat", "lookup_exact_seconds": 0.001783, "lookup_gpu_seconds": 0.02545, "lookup_hash_seconds": 5.3e-05, "lookup_layout": "open_address_tag16_hash_filter_exact256", "lookup_max_threads_per_threadgroup": 1024, "lookup_query_mode": "repeat", "lookup_repeat": 1024, "lookup_seconds": 0.027286, "lookup_thread_execution_width": 32, "lookup_threadgroup_limit": 512, "lookup_threads_per_threadgroup": 512, "lookups_per_sec": 75507841.107825, "machine": "macOS-26.5-arm64-arm-64bit-Mach-O", "max_threads_per_threadgroup": 1024, "min_ms": 500, "miss_count": 1994752, "operation": "jacobian_affine_scan_target_lookup_tag32", "ops_per_sec": 44460373.620674, "ops_per_sec_max": 54504997.265947, "ops_per_sec_min": 41653649.37055, "output_layout": "affine_dp_scan_target_lookup", "paired_baseline_ops_per_sec": 47576894.508189, "paired_baseline_ref": "HEAD", "paired_order": "alternate", "paired_speedup": 0.9344950753988666, "query_count": 2060288, "query_input": "hash64_repeat_indexed", "raw_status": "discard", "reason": "", "repeat_positive_index_encoding": "packed16_base_repeat", "requested_hits": 64, "runner_sample_count": 3, "sample_count": 131072, "seconds": 4.524733, "setup_inclusive_ops_per_sec": 44460373.620674, "setup_inclusive_ops_per_sec_max": 54504997.265947, "setup_inclusive_ops_per_sec_min": 41653649.37055, "setup_inclusive_seconds": 6.037634, "skipped": false, "state_layout": "xyzz", "status": "discard", "steps_per_sample": 2048, "target_bucket_bytes": 268435456, "target_build_seconds": 1.443965, "target_count": 25005000, "target_filter_bucket_bytes": 67108864, "target_filter_build_seconds": 0.033513, "target_key": "x256_y_parity", "target_key_bytes": 1000200000, "target_lookup_checksum": "0x7b006ccd0f00dc3b", "target_query_hash_bytes": 16096, "target_table_buckets": 33554432, "target_table_bytes": 67108864, "thread_execution_width": 32, "threadgroup_limit": 128, "threads_per_threadgroup": 128, "timestamp": "2026-06-29T16:13:48Z", "validation_seconds": 13.02033, "validation_workers": 8}
{"affine_scan_mode": "cpu_batch_prod_zz_zzz", "affine_scan_seconds": 0.003195, "backend": "metal", "budget_sec": 540, "bytes_per_target": 2.683818, "candidate_verification": "tag16_hash_filter_then_cpu_exact_key_equality", "commit": "f8dceeb-dirty", "confirmation_index": 1, "confirmation_runs": 2, "confirmation_status": "discard", "cooldown_sec": 10.0, "correctness": true, "description": "Metal XYZZ 2048-step dp6 25M-target setup gate testing an 8-jump balanced-distance schedule against the accepted 16-jump power2 baseline", "distance_tracking": "packet_distance_uint64", "dp_bits": 6, "dp_checksum": "0x2b7aeff167cc0692", "dp_count": 2006, "dp_distance_checksum": "0x616e355d19541c00", "dp_query_count": 2006, "dp_tracking": "affine_x256_y_parity_cpu_batch", "exact_host_table_bytes": 1268635456, "experiment": "metal_jacobian_dynamic_dp_stream_xyzz_affine_scan_target_lookup_tag16_hash_filter25m_scaled8_j8_setup", "filter_false_positive_count": 0, "filter_positive_count": 65536, "gpu_lookup_lookups_per_sec": 159747830.762538, "gpu_ops_per_sec": 122839382.161868, "hit_count": 65536, "injected_hits": 64, "iterations": 268435456, "jump_count": 8, "jump_histogram_max_bucket": 33561524, "jump_histogram_max_deviation_ppm": 356, "jump_histogram_min_bucket": 33542498, "jump_index": "power2_mask", "jump_mixer": "avalanche64", "jump_schedule": "scaled8_balanced", "lookup_engine": "gpu_filter16_hash_repeat", "lookup_engine_effective": "gpu_filter16_hash_repeat", "lookup_exact_seconds": 0.001183, "lookup_gpu_seconds": 0.012859, "lookup_hash_seconds": 3.7e-05, "lookup_layout": "open_address_tag16_hash_filter_exact256", "lookup_max_threads_per_threadgroup": 1024, "lookup_query_mode": "repeat", "lookup_repeat": 1024, "lookup_seconds": 0.014079, "lookup_thread_execution_width": 32, "lookup_threadgroup_limit": 512, "lookup_threads_per_threadgroup": 512, "lookups_per_sec": 145906028.188574, "machine": "macOS-26.5-arm64-arm-64bit-Mach-O", "max_threads_per_threadgroup": 1024, "min_ms": 500, "miss_count": 1988608, "operation": "jacobian_affine_scan_target_lookup_tag32", "ops_per_sec": 83880983.784617, "ops_per_sec_max": 88976473.898562, "ops_per_sec_min": 50931519.448801, "output_layout": "affine_dp_scan_target_lookup", "paired_baseline_ops_per_sec": 90987263.956026, "paired_baseline_ref": "HEAD", "paired_order": "alternate", "paired_speedup": 0.9218980782316584, "query_count": 2054144, "query_input": "hash64_repeat_indexed", "raw_status": "discard", "reason": "", "repeat_positive_index_encoding": "packed16_base_repeat", "requested_hits": 64, "runner_sample_count": 3, "sample_count": 131072, "seconds": 2.185256, "setup_inclusive_ops_per_sec": 83880983.784617, "setup_inclusive_ops_per_sec_max": 88976473.898562, "setup_inclusive_ops_per_sec_min": 50931519.448801, "setup_inclusive_seconds": 3.200194, "skipped": false, "state_layout": "xyzz", "status": "discard", "steps_per_sample": 2048, "target_bucket_bytes": 268435456, "target_build_seconds": 0.972639, "target_count": 25005000, "target_filter_bucket_bytes": 67108864, "target_filter_build_seconds": 0.025027, "target_key": "x256_y_parity", "target_key_bytes": 1000200000, "target_lookup_checksum": "0x356d2bd0a459b4a1", "target_query_hash_bytes": 16048, "target_table_buckets": 33554432, "target_table_bytes": 67108864, "thread_execution_width": 32, "threadgroup_limit": 128, "threads_per_threadgroup": 128, "timestamp": "2026-06-29T16:23:17Z", "validation_seconds": 8.970916, "validation_workers": 8}
{"affine_scan_mode": "cpu_batch_prod_zz_zzz", "affine_scan_seconds": 0.003406, "backend": "metal", "budget_sec": 540, "bytes_per_target": 2.683818, "candidate_verification": "tag16_hash_filter_then_cpu_exact_key_equality", "commit": "f8dceeb-dirty", "confirmation_index": 2, "confirmation_runs": 2, "confirmation_status": "discard", "cooldown_sec": 10.0, "correctness": true, "description": "Metal XYZZ 2048-step dp6 25M-target setup gate testing an 8-jump balanced-distance schedule against the accepted 16-jump power2 baseline", "distance_tracking": "packet_distance_uint64", "dp_bits": 6, "dp_checksum": "0x2b7aeff167cc0692", "dp_count": 2006, "dp_distance_checksum": "0x616e355d19541c00", "dp_query_count": 2006, "dp_tracking": "affine_x256_y_parity_cpu_batch", "exact_host_table_bytes": 1268635456, "experiment": "metal_jacobian_dynamic_dp_stream_xyzz_affine_scan_target_lookup_tag16_hash_filter25m_scaled8_j8_setup", "filter_false_positive_count": 0, "filter_positive_count": 65536, "gpu_lookup_lookups_per_sec": 122145364.438615, "gpu_ops_per_sec": 50508496.793362, "hit_count": 65536, "injected_hits": 64, "iterations": 268435456, "jump_count": 8, "jump_histogram_max_bucket": 33561524, "jump_histogram_max_deviation_ppm": 356, "jump_histogram_min_bucket": 33542498, "jump_index": "power2_mask", "jump_mixer": "avalanche64", "jump_schedule": "scaled8_balanced", "lookup_engine": "gpu_filter16_hash_repeat", "lookup_engine_effective": "gpu_filter16_hash_repeat", "lookup_exact_seconds": 0.002341, "lookup_gpu_seconds": 0.016817, "lookup_hash_seconds": 5.1e-05, "lookup_layout": "open_address_tag16_hash_filter_exact256", "lookup_max_threads_per_threadgroup": 1024, "lookup_query_mode": "repeat", "lookup_repeat": 1024, "lookup_seconds": 0.01921, "lookup_thread_execution_width": 32, "lookup_threadgroup_limit": 512, "lookup_threads_per_threadgroup": 512, "lookups_per_sec": 106931441.03285, "machine": "macOS-26.5-arm64-arm-64bit-Mach-O", "max_threads_per_threadgroup": 1024, "min_ms": 500, "miss_count": 1988608, "operation": "jacobian_affine_scan_target_lookup_tag32", "ops_per_sec": 41081001.458294, "ops_per_sec_max": 81861787.220721, "ops_per_sec_min": 38329151.038467, "output_layout": "affine_dp_scan_target_lookup", "paired_baseline_ops_per_sec": 36418203.81958, "paired_baseline_ref": "HEAD", "paired_order": "alternate", "paired_speedup": 1.1280348053905687, "query_count": 2054144, "query_input": "hash64_repeat_indexed", "raw_status": "keep", "reason": "", "repeat_positive_index_encoding": "packed16_base_repeat", "requested_hits": 64, "runner_sample_count": 3, "sample_count": 131072, "seconds": 5.314659, "setup_inclusive_ops_per_sec": 41081001.458294, "setup_inclusive_ops_per_sec_max": 81861787.220721, "setup_inclusive_ops_per_sec_min": 38329151.038467, "setup_inclusive_seconds": 6.534297, "skipped": false, "state_layout": "xyzz", "status": "discard", "steps_per_sample": 2048, "target_bucket_bytes": 268435456, "target_build_seconds": 1.129586, "target_count": 25005000, "target_filter_bucket_bytes": 67108864, "target_filter_build_seconds": 0.067435, "target_key": "x256_y_parity", "target_key_bytes": 1000200000, "target_lookup_checksum": "0x356d2bd0a459b4a1", "target_query_hash_bytes": 16048, "target_table_buckets": 33554432, "target_table_bytes": 67108864, "thread_execution_width": 32, "threadgroup_limit": 128, "threads_per_threadgroup": 128, "timestamp": "2026-06-29T16:23:17Z", "validation_seconds": 14.446664, "validation_workers": 8}
{"affine_scan_mode": "cpu_batch_prod_zz_zzz", "affine_scan_seconds": 0.008771, "backend": "metal", "budget_sec": 900, "bytes_per_target": 2.683818, "candidate_verification": "tag16_hash_filter_then_cpu_exact_key_equality", "commit": "444dec5-dirty", "confirmation_index": 1, "confirmation_runs": 2, "confirmation_status": "discard", "cooldown_sec": 10.0, "correctness": true, "description": "Metal XYZZ 2048-step dp6 scaled4-balanced 4-jump 25M-target steady-state setup-amortized gate with min_ms=5000 versus 16-jump power2", "distance_tracking": "packet_distance_uint64", "dp_bits": 6, "dp_checksum": "0x58d7138663a105aa", "dp_count": 2075, "dp_distance_checksum": "0xad580a14bfda5cf8", "dp_query_count": 2075, "dp_tracking": "affine_x256_y_parity_cpu_batch", "exact_host_table_bytes": 1268635456, "experiment": "metal_jacobian_dynamic_dp_stream_xyzz_affine_scan_target_lookup_tag16_hash_filter25m_scaled4_j4_steady5000_setup", "filter_false_positive_count": 0, "filter_positive_count": 65536, "gpu_lookup_lookups_per_sec": 350718697.129338, "gpu_ops_per_sec": 112543495.197894, "hit_count": 65536, "injected_hits": 64, "iterations": 805306368, "jump_count": 4, "jump_histogram_max_bucket": 67113326, "jump_histogram_max_deviation_ppm": 68, "jump_histogram_min_bucket": 67104275, "jump_index": "power2_mask", "jump_mixer": "avalanche64", "jump_schedule": "scaled4_balanced", "lookup_engine": "gpu_filter16_hash_repeat", "lookup_engine_effective": "gpu_filter16_hash_repeat", "lookup_exact_seconds": 0.002064, "lookup_gpu_seconds": 0.018175, "lookup_hash_seconds": 3.6e-05, "lookup_layout": "open_address_tag16_hash_filter_exact256", "lookup_max_threads_per_threadgroup": 1024, "lookup_query_mode": "repeat", "lookup_repeat": 1024, "lookup_seconds": 0.020275, "lookup_thread_execution_width": 32, "lookup_threadgroup_limit": 512, "lookup_threads_per_threadgroup": 512, "lookups_per_sec": 314391210.303572, "machine": "macOS-26.5-arm64-arm-64bit-Mach-O", "max_threads_per_threadgroup": 1024, "min_ms": 5000, "miss_count": 2059264, "operation": "jacobian_affine_scan_target_lookup_tag32", "ops_per_sec": 103992785.327127, "ops_per_sec_max": 112701742.078574, "ops_per_sec_min": 44333988.441805, "output_layout": "affine_dp_scan_target_lookup", "paired_baseline_ops_per_sec": 45963566.19712, "paired_baseline_ref": "HEAD", "paired_order": "alternate", "paired_speedup": 2.2625047169130013, "query_count": 2124800, "query_input": "hash64_repeat_indexed", "raw_status": "keep", "reason": "", "repeat_positive_index_encoding": "packed16_base_repeat", "requested_hits": 64, "runner_sample_count": 3, "sample_count": 131072, "seconds": 7.155512, "setup_inclusive_ops_per_sec": 103992785.327127, "setup_inclusive_ops_per_sec_max": 112701742.078574, "setup_inclusive_ops_per_sec_min": 44333988.441805, "setup_inclusive_seconds": 7.743868, "skipped": false, "state_layout": "xyzz", "status": "discard", "steps_per_sample": 2048, "target_bucket_bytes": 268435456, "target_build_seconds": 0.540645, "target_count": 25005000, "target_filter_bucket_bytes": 67108864, "target_filter_build_seconds": 0.018664, "target_key": "x256_y_parity", "target_key_bytes": 1000200000, "target_lookup_checksum": "0x52efac244f7b11f3", "target_query_hash_bytes": 16600, "target_table_buckets": 33554432, "target_table_bytes": 67108864, "thread_execution_width": 32, "threadgroup_limit": 128, "threads_per_threadgroup": 128, "timestamp": "2026-06-29T16:39:13Z", "validation_seconds": 9.13324, "validation_workers": 8}
{"affine_scan_mode": "cpu_batch_prod_zz_zzz", "affine_scan_seconds": 0.006279, "backend": "metal", "budget_sec": 900, "bytes_per_target": 2.683818, "candidate_verification": "tag16_hash_filter_then_cpu_exact_key_equality", "commit": "444dec5-dirty", "confirmation_index": 2, "confirmation_runs": 2, "confirmation_status": "discard", "cooldown_sec": 10.0, "correctness": true, "description": "Metal XYZZ 2048-step dp6 scaled4-balanced 4-jump 25M-target steady-state setup-amortized gate with min_ms=5000 versus 16-jump power2", "distance_tracking": "packet_distance_uint64", "dp_bits": 6, "dp_checksum": "0x58d7138663a105aa", "dp_count": 2075, "dp_distance_checksum": "0xad580a14bfda5cf8", "dp_query_count": 2075, "dp_tracking": "affine_x256_y_parity_cpu_batch", "exact_host_table_bytes": 1268635456, "experiment": "metal_jacobian_dynamic_dp_stream_xyzz_affine_scan_target_lookup_tag16_hash_filter25m_scaled4_j4_steady5000_setup", "filter_false_positive_count": 0, "filter_positive_count": 65536, "gpu_lookup_lookups_per_sec": 268501782.672145, "gpu_ops_per_sec": 63937239.263963, "hit_count": 65536, "injected_hits": 64, "iterations": 536870912, "jump_count": 4, "jump_histogram_max_bucket": 67113326, "jump_histogram_max_deviation_ppm": 68, "jump_histogram_min_bucket": 67104275, "jump_index": "power2_mask", "jump_mixer": "avalanche64", "jump_schedule": "scaled4_balanced", "lookup_engine": "gpu_filter16_hash_repeat", "lookup_engine_effective": "gpu_filter16_hash_repeat", "lookup_exact_seconds": 0.013294, "lookup_gpu_seconds": 0.015827, "lookup_hash_seconds": 0.000155, "lookup_layout": "open_address_tag16_hash_filter_exact256", "lookup_max_threads_per_threadgroup": 1024, "lookup_query_mode": "repeat", "lookup_repeat": 1024, "lookup_seconds": 0.029275, "lookup_thread_execution_width": 32, "lookup_threadgroup_limit": 512, "lookup_threads_per_threadgroup": 512, "lookups_per_sec": 145159541.081882, "machine": "macOS-26.5-arm64-arm-64bit-Mach-O", "max_threads_per_threadgroup": 1024, "min_ms": 5000, "miss_count": 2059264, "operation": "jacobian_affine_scan_target_lookup_tag32", "ops_per_sec": 56480003.605877, "ops_per_sec_max": 59295273.49531, "ops_per_sec_min": 38183640.804056, "output_layout": "affine_dp_scan_target_lookup", "paired_baseline_ops_per_sec": 64994848.031781, "paired_baseline_ref": "HEAD", "paired_order": "alternate", "paired_speedup": 0.868992009616817, "query_count": 2124800, "query_input": "hash64_repeat_indexed", "raw_status": "discard", "reason": "", "repeat_positive_index_encoding": "packed16_base_repeat", "requested_hits": 64, "runner_sample_count": 3, "sample_count": 131072, "seconds": 8.396842, "setup_inclusive_ops_per_sec": 56480003.605877, "setup_inclusive_ops_per_sec_max": 59295273.49531, "setup_inclusive_ops_per_sec_min": 38183640.804056, "setup_inclusive_seconds": 9.505504, "skipped": false, "state_layout": "xyzz", "status": "discard", "steps_per_sample": 2048, "target_bucket_bytes": 268435456, "target_build_seconds": 1.017882, "target_count": 25005000, "target_filter_bucket_bytes": 67108864, "target_filter_build_seconds": 0.055226, "target_key": "x256_y_parity", "target_key_bytes": 1000200000, "target_lookup_checksum": "0x52efac244f7b11f3", "target_query_hash_bytes": 16600, "target_table_buckets": 33554432, "target_table_bytes": 67108864, "thread_execution_width": 32, "threadgroup_limit": 128, "threads_per_threadgroup": 128, "timestamp": "2026-06-29T16:39:13Z", "validation_seconds": 11.372531, "validation_workers": 8}
{"affine_scan_mode": "cpu_batch_prod_zz_zzz", "affine_scan_seconds": 0.000794, "backend": "metal", "budget_sec": 60, "bytes_per_target": 4.0, "candidate_verification": "tag16_hash_filter_then_cpu_exact_key_equality", "commit": "e01d29c-dirty", "cooldown_sec": 5.0, "correctness": true, "description": "M3 large-target repeat-mode auto lookup routing versus explicit CPU lookup", "distance_tracking": "packet_distance_uint64", "dp_bits": 6, "dp_checksum": "0xbeb579944293c04a", "dp_count": 125, "dp_distance_checksum": "0xe3db79a4e83bd59d", "dp_query_count": 125, "dp_tracking": "affine_x256_y_parity_cpu_batch", "exact_host_table_bytes": 939524096, "experiment": "metal_jacobian_dynamic_dp_stream_xyzz_affine_scan_target_lookup_tag16_hash_filter_m3_auto_repeat", "filter_false_positive_count": 0, "filter_positive_count": 131072, "gpu_lookup_lookups_per_sec": 331358074.628375, "gpu_ops_per_sec": 63364587.179005, "hit_count": 131072, "injected_hits": 16, "iterations": 8388608, "jump_count": 16, "jump_histogram_max_bucket": 262877, "jump_histogram_max_deviation_ppm": 3475, "jump_histogram_min_bucket": 261233, "jump_index": "power2_mask", "jump_mixer": "avalanche64", "jump_schedule": "power2", "lookup_engine": "auto", "lookup_engine_effective": "gpu_filter16_hash_repeat", "lookup_exact_seconds": 0.002509, "lookup_gpu_seconds": 0.006181, "lookup_hash_seconds": 6e-06, "lookup_layout": "open_address_tag16_hash_filter_exact256", "lookup_max_threads_per_threadgroup": 1024, "lookup_query_mode": "repeat", "lookup_repeat": 8192, "lookup_seconds": 0.008696, "lookup_thread_execution_width": 32, "lookup_threadgroup_limit": 512, "lookup_threads_per_threadgroup": 512, "lookups_per_sec": 235518433.802415, "machine": "macOS-26.5-arm64-arm-64bit-Mach-O", "max_threads_per_threadgroup": 1024, "min_ms": 100, "miss_count": 892928, "operation": "jacobian_affine_scan_target_lookup_tag32", "ops_per_sec": 59126178.560367, "ops_per_sec_max": 59910426.833995, "ops_per_sec_min": 59106355.678818, "output_layout": "affine_dp_scan_target_lookup", "query_count": 1024000, "query_input": "hash64_repeat_indexed", "reason": "", "repeat_positive_index_encoding": "packed16_base_repeat", "requested_hits": 16, "round_count": 1, "runner_sample_count": 3, "sample_count": 8192, "seconds": 0.132386, "setup_inclusive_ops_per_sec": 13127252.349725, "setup_inclusive_seconds": 0.639022, "skipped": false, "state_layout": "xyzz", "status": "keep", "steps_per_sample": 512, "target_bucket_bytes": 268435456, "target_build_seconds": 0.467721, "target_count": 16777216, "target_filter_bucket_bytes": 67108864, "target_filter_build_seconds": 0.029425, "target_key": "x256_y_parity", "target_key_bytes": 671088640, "target_lookup_checksum": "0xb87fc40ba6652a4f", "target_query_hash_bytes": 1000, "target_table_buckets": 33554432, "target_table_bytes": 67108864, "thread_execution_width": 32, "threadgroup_limit": 128, "threads_per_threadgroup": 128, "timestamp": "2026-06-30T17:41:34Z", "validation_seconds": 0.119497, "validation_workers": 8}
