{"affine_scan_mode": "cpu_batch_prod_zz_zzz", "affine_scan_seconds": 0.015359, "backend": "metal", "budget_sec": 240, "bytes_per_target": 2.683818, "candidate_verification": "tag16_hash_filter_then_cpu_exact_key_equality", "commit": "4f72e56-dirty", "confirmation_index": 1, "confirmation_runs": 2, "confirmation_status": "keep", "cooldown_sec": 10.0, "correctness": true, "description": "Metal XYZZ affine DP scan tag16 hash-filter 25M-target repeat2048 lookup with thresholded parallel host query-hash build", "distance_tracking": "packet_distance_uint64", "dp_bits": 8, "dp_checksum": "0x9dba4a07ebbb8e14", "dp_count": 1057, "dp_distance_checksum": "0xf0dc88ed68b2ff64", "dp_query_count": 1057, "dp_tracking": "affine_x256_y_parity_cpu_batch", "exact_host_table_bytes": 1268635456, "experiment": "metal_jacobian_dynamic_dp_stream_xyzz_affine_scan_target_lookup_tag16_hash_filter25m_parallel_hash_repeat2048", "filter_false_positive_count": 444, "filter_positive_count": 508, "gpu_lookup_lookups_per_sec": 85131006.248119, "gpu_ops_per_sec": 50327981.933648, "hit_count": 64, "injected_hits": 64, "iterations": 134217728, "jump_count": 16, "jump_histogram_max_bucket": 8394316, "jump_histogram_max_deviation_ppm": 759, "jump_histogram_min_bucket": 8382245, "jump_index": "power2_mask", "jump_mixer": "avalanche64", "jump_schedule": "power2", "lookup_engine": "gpu_filter16_hash", "lookup_engine_effective": "gpu_filter16_hash", "lookup_exact_seconds": 0.000629, "lookup_gpu_seconds": 0.025428, "lookup_hash_seconds": 0.0044, "lookup_layout": "open_address_tag16_hash_filter_exact256", "lookup_max_threads_per_threadgroup": 1024, "lookup_query_mode": "distinct_misses", "lookup_repeat": 2048, "lookup_seconds": 0.030457, "lookup_thread_execution_width": 32, "lookup_threadgroup_limit": 512, "lookup_threads_per_threadgroup": 512, "lookups_per_sec": 71075351.161621, "lookups_per_sec_max": 78081191.763129, "lookups_per_sec_min": 39778560.203244, "machine": "macOS-26.5-arm64-arm-64bit-Mach-O", "max_threads_per_threadgroup": 1024, "min_ms": 500, "miss_count": 2164672, "operation": "jacobian_affine_scan_target_lookup_tag32", "ops_per_sec": 71075351.161621, "ops_per_sec_max": 78081191.763129, "ops_per_sec_min": 39778560.203244, "output_layout": "affine_dp_scan_target_lookup", "paired_baseline_ops_per_sec": 47898394.694751, "paired_baseline_ref": "HEAD", "paired_speedup": 1.483877520626174, "query_count": 2164736, "query_input": "hash64", "raw_status": "keep", "reason": "", "requested_hits": 64, "runner_sample_count": 3, "sample_count": 262144, "seconds": 2.666861, "skipped": false, "state_layout": "xyzz", "status": "keep", "steps_per_sample": 512, "target_bucket_bytes": 268435456, "target_count": 25005000, "target_filter_bucket_bytes": 67108864, "target_key": "x256_y_parity", "target_key_bytes": 1000200000, "target_lookup_checksum": "0x90b9fdeac531859a", "target_query_hash_bytes": 17317888, "target_table_buckets": 33554432, "target_table_bytes": 67108864, "thread_execution_width": 32, "threadgroup_limit": 128, "threads_per_threadgroup": 128, "timestamp": "2026-06-27T21:11:00Z", "validation_seconds": 7.746179, "validation_workers": 8}
{"affine_scan_mode": "cpu_batch_prod_zz_zzz", "affine_scan_seconds": 0.022018, "backend": "metal", "budget_sec": 240, "bytes_per_target": 2.683818, "candidate_verification": "tag16_hash_filter_then_cpu_exact_key_equality", "commit": "4f72e56-dirty", "confirmation_index": 2, "confirmation_runs": 2, "confirmation_status": "keep", "cooldown_sec": 10.0, "correctness": true, "description": "Metal XYZZ affine DP scan tag16 hash-filter 25M-target repeat2048 lookup with thresholded parallel host query-hash build", "distance_tracking": "packet_distance_uint64", "dp_bits": 8, "dp_checksum": "0x9dba4a07ebbb8e14", "dp_count": 1057, "dp_distance_checksum": "0xf0dc88ed68b2ff64", "dp_query_count": 1057, "dp_tracking": "affine_x256_y_parity_cpu_batch", "exact_host_table_bytes": 1268635456, "experiment": "metal_jacobian_dynamic_dp_stream_xyzz_affine_scan_target_lookup_tag16_hash_filter25m_parallel_hash_repeat2048", "filter_false_positive_count": 444, "filter_positive_count": 508, "gpu_lookup_lookups_per_sec": 134254828.631185, "gpu_ops_per_sec": 53169555.568939, "hit_count": 64, "injected_hits": 64, "iterations": 134217728, "jump_count": 16, "jump_histogram_max_bucket": 8394316, "jump_histogram_max_deviation_ppm": 759, "jump_histogram_min_bucket": 8382245, "jump_index": "power2_mask", "jump_mixer": "avalanche64", "jump_schedule": "power2", "lookup_engine": "gpu_filter16_hash", "lookup_engine_effective": "gpu_filter16_hash", "lookup_exact_seconds": 0.001876, "lookup_gpu_seconds": 0.016124, "lookup_hash_seconds": 0.005395, "lookup_layout": "open_address_tag16_hash_filter_exact256", "lookup_max_threads_per_threadgroup": 1024, "lookup_query_mode": "distinct_misses", "lookup_repeat": 2048, "lookup_seconds": 0.023395, "lookup_thread_execution_width": 32, "lookup_threadgroup_limit": 512, "lookup_threads_per_threadgroup": 512, "lookups_per_sec": 92529528.533838, "lookups_per_sec_max": 133346499.184393, "lookups_per_sec_min": 26508337.527631, "machine": "macOS-26.5-arm64-arm-64bit-Mach-O", "max_threads_per_threadgroup": 1024, "min_ms": 500, "miss_count": 2164672, "operation": "jacobian_affine_scan_target_lookup_tag32", "ops_per_sec": 92529528.533838, "ops_per_sec_max": 133346499.184393, "ops_per_sec_min": 26508337.527631, "output_layout": "affine_dp_scan_target_lookup", "paired_baseline_ops_per_sec": 65946694.80248, "paired_baseline_ref": "HEAD", "paired_speedup": 1.403095770166761, "query_count": 2164736, "query_input": "hash64", "raw_status": "keep", "reason": "", "requested_hits": 64, "runner_sample_count": 3, "sample_count": 262144, "seconds": 2.524334, "skipped": false, "state_layout": "xyzz", "status": "keep", "steps_per_sample": 512, "target_bucket_bytes": 268435456, "target_count": 25005000, "target_filter_bucket_bytes": 67108864, "target_key": "x256_y_parity", "target_key_bytes": 1000200000, "target_lookup_checksum": "0x90b9fdeac531859a", "target_query_hash_bytes": 17317888, "target_table_buckets": 33554432, "target_table_bytes": 67108864, "thread_execution_width": 32, "threadgroup_limit": 128, "threads_per_threadgroup": 128, "timestamp": "2026-06-27T21:11:00Z", "validation_seconds": 6.569613, "validation_workers": 8}
{"affine_scan_mode": "cpu_batch_prod_zz_zzz", "affine_scan_seconds": 0.170017, "backend": "metal", "budget_sec": 240, "bytes_per_target": 2.683818, "candidate_verification": "tag16_hash_filter_then_cpu_exact_key_equality", "commit": "905d9a3-dirty", "confirmation_index": 1, "confirmation_runs": 2, "confirmation_status": "discard", "cooldown_sec": 10.0, "correctness": true, "description": "Auto lookup routing for a 25M-target repeat2048 affine DP lookup, expected to promote the kept tag16 hash-filter backend", "distance_tracking": "packet_distance_uint64", "dp_bits": 8, "dp_checksum": "0x9dba4a07ebbb8e14", "dp_count": 1057, "dp_distance_checksum": "0xf0dc88ed68b2ff64", "dp_query_count": 1057, "dp_tracking": "affine_x256_y_parity_cpu_batch", "exact_host_table_bytes": 1268635456, "experiment": "metal_jacobian_dynamic_dp_stream_xyzz_affine_scan_target_lookup_tag16_hash_filter25m_auto_repeat2048", "filter_false_positive_count": 444, "filter_positive_count": 508, "gpu_lookup_lookups_per_sec": 94159555.665806, "gpu_ops_per_sec": 74921240.461889, "hit_count": 64, "injected_hits": 64, "iterations": 134217728, "jump_count": 16, "jump_histogram_max_bucket": 8394316, "jump_histogram_max_deviation_ppm": 759, "jump_histogram_min_bucket": 8382245, "jump_index": "power2_mask", "jump_mixer": "avalanche64", "jump_schedule": "power2", "lookup_engine": "auto", "lookup_engine_effective": "gpu_filter16_hash", "lookup_exact_seconds": 0.010551, "lookup_gpu_seconds": 0.02299, "lookup_hash_seconds": 0.006008, "lookup_layout": "open_address_tag16_hash_filter_exact256", "lookup_max_threads_per_threadgroup": 1024, "lookup_query_mode": "distinct_misses", "lookup_repeat": 2048, "lookup_seconds": 0.039549, "lookup_thread_execution_width": 32, "lookup_threadgroup_limit": 512, "lookup_threads_per_threadgroup": 512, "lookups_per_sec": 54736120.381355, "machine": "macOS-26.5-arm64-arm-64bit-Mach-O", "max_threads_per_threadgroup": 1024, "min_ms": 500, "miss_count": 2164672, "operation": "jacobian_affine_scan_target_lookup_tag32", "ops_per_sec": 67074784.442296, "ops_per_sec_max": 67450835.554309, "ops_per_sec_min": 56948526.670852, "output_layout": "affine_dp_scan_target_lookup", "paired_baseline_ops_per_sec": 73749600.661159, "paired_baseline_ref": "HEAD", "paired_speedup": 0.909493527300164, "query_count": 2164736, "query_input": "hash64", "raw_status": "discard", "reason": "", "requested_hits": 64, "runner_sample_count": 3, "sample_count": 262144, "seconds": 1.791451, "skipped": false, "state_layout": "xyzz", "status": "discard", "steps_per_sample": 512, "target_bucket_bytes": 268435456, "target_count": 25005000, "target_filter_bucket_bytes": 67108864, "target_key": "x256_y_parity", "target_key_bytes": 1000200000, "target_lookup_checksum": "0x90b9fdeac531859a", "target_query_hash_bytes": 17317888, "target_table_buckets": 33554432, "target_table_bytes": 67108864, "thread_execution_width": 32, "threadgroup_limit": 128, "threads_per_threadgroup": 128, "timestamp": "2026-06-27T21:28:10Z", "validation_seconds": 12.427396, "validation_workers": 8}
{"affine_scan_mode": "cpu_batch_prod_zz_zzz", "affine_scan_seconds": 0.04969, "backend": "metal", "budget_sec": 240, "bytes_per_target": 2.683818, "candidate_verification": "tag16_hash_filter_then_cpu_exact_key_equality", "commit": "905d9a3-dirty", "confirmation_index": 2, "confirmation_runs": 2, "confirmation_status": "discard", "cooldown_sec": 10.0, "correctness": true, "description": "Auto lookup routing for a 25M-target repeat2048 affine DP lookup, expected to promote the kept tag16 hash-filter backend", "distance_tracking": "packet_distance_uint64", "dp_bits": 8, "dp_checksum": "0x9dba4a07ebbb8e14", "dp_count": 1057, "dp_distance_checksum": "0xf0dc88ed68b2ff64", "dp_query_count": 1057, "dp_tracking": "affine_x256_y_parity_cpu_batch", "exact_host_table_bytes": 1268635456, "experiment": "metal_jacobian_dynamic_dp_stream_xyzz_affine_scan_target_lookup_tag16_hash_filter25m_auto_repeat2048", "filter_false_positive_count": 444, "filter_positive_count": 508, "gpu_lookup_lookups_per_sec": 126142456.850814, "gpu_ops_per_sec": 66143525.406457, "hit_count": 64, "injected_hits": 64, "iterations": 134217728, "jump_count": 16, "jump_histogram_max_bucket": 8394316, "jump_histogram_max_deviation_ppm": 759, "jump_histogram_min_bucket": 8382245, "jump_index": "power2_mask", "jump_mixer": "avalanche64", "jump_schedule": "power2", "lookup_engine": "auto", "lookup_engine_effective": "gpu_filter16_hash", "lookup_exact_seconds": 0.003483, "lookup_gpu_seconds": 0.017161, "lookup_hash_seconds": 0.013026, "lookup_layout": "open_address_tag16_hash_filter_exact256", "lookup_max_threads_per_threadgroup": 1024, "lookup_query_mode": "distinct_misses", "lookup_repeat": 2048, "lookup_seconds": 0.03367, "lookup_thread_execution_width": 32, "lookup_threadgroup_limit": 512, "lookup_threads_per_threadgroup": 512, "lookups_per_sec": 64292085.727454, "machine": "macOS-26.5-arm64-arm-64bit-Mach-O", "max_threads_per_threadgroup": 1024, "min_ms": 500, "miss_count": 2164672, "operation": "jacobian_affine_scan_target_lookup_tag32", "ops_per_sec": 63533516.652801, "ops_per_sec_max": 68862703.861688, "ops_per_sec_min": 34122051.98502, "output_layout": "affine_dp_scan_target_lookup", "paired_baseline_ops_per_sec": 54927320.816796, "paired_baseline_ref": "HEAD", "paired_speedup": 1.156683335506387, "query_count": 2164736, "query_input": "hash64", "raw_status": "keep", "reason": "", "requested_hits": 64, "runner_sample_count": 3, "sample_count": 262144, "seconds": 2.029189, "skipped": false, "state_layout": "xyzz", "status": "discard", "steps_per_sample": 512, "target_bucket_bytes": 268435456, "target_count": 25005000, "target_filter_bucket_bytes": 67108864, "target_key": "x256_y_parity", "target_key_bytes": 1000200000, "target_lookup_checksum": "0x90b9fdeac531859a", "target_query_hash_bytes": 17317888, "target_table_buckets": 33554432, "target_table_bytes": 67108864, "thread_execution_width": 32, "threadgroup_limit": 128, "threads_per_threadgroup": 128, "timestamp": "2026-06-27T21:28:10Z", "validation_seconds": 6.430996, "validation_workers": 8}
{"affine_scan_mode": "cpu_batch_prod_zz_zzz", "affine_scan_seconds": 0.021562, "backend": "metal", "budget_sec": 240, "bytes_per_target": 5.367636, "candidate_verification": "tag32_hash_filter_then_cpu_exact_key_equality", "commit": "cfd6507-dirty", "confirmation_index": 1, "confirmation_runs": 2, "confirmation_status": "discard", "cooldown_sec": 10.0, "correctness": true, "description": "Metal XYZZ affine DP scan tag32 hash-filter 25M-target repeat2048 lookup versus tag16 hash-filter", "distance_tracking": "packet_distance_uint64", "dp_bits": 8, "dp_checksum": "0x9dba4a07ebbb8e14", "dp_count": 1057, "dp_distance_checksum": "0xf0dc88ed68b2ff64", "dp_query_count": 1057, "dp_tracking": "affine_x256_y_parity_cpu_batch", "exact_host_table_bytes": 1268635456, "experiment": "metal_jacobian_dynamic_dp_stream_xyzz_affine_scan_target_lookup_tag32_hash_filter25m_repeat2048", "filter_false_positive_count": 0, "filter_positive_count": 64, "gpu_lookup_lookups_per_sec": 52854623.489159, "gpu_ops_per_sec": 53104294.571854, "hit_count": 64, "injected_hits": 64, "iterations": 134217728, "jump_count": 16, "jump_histogram_max_bucket": 8394316, "jump_histogram_max_deviation_ppm": 759, "jump_histogram_min_bucket": 8382245, "jump_index": "power2_mask", "jump_mixer": "avalanche64", "jump_schedule": "power2", "lookup_engine": "gpu_filter32_hash", "lookup_engine_effective": "gpu_filter32_hash", "lookup_exact_seconds": 0.001639, "lookup_gpu_seconds": 0.040956, "lookup_hash_seconds": 0.02354, "lookup_layout": "open_address_tag32_hash_filter_exact256", "lookup_max_threads_per_threadgroup": 1024, "lookup_query_mode": "distinct_misses", "lookup_repeat": 2048, "lookup_seconds": 0.066135, "lookup_thread_execution_width": 32, "lookup_threadgroup_limit": 512, "lookup_threads_per_threadgroup": 512, "lookups_per_sec": 32732057.537667, "lookups_per_sec_max": 50400327.518685, "lookups_per_sec_min": 23113497.450495, "machine": "macOS-26.5-arm64-arm-64bit-Mach-O", "max_threads_per_threadgroup": 1024, "min_ms": 500, "miss_count": 2164672, "operation": "jacobian_affine_scan_target_lookup_tag32", "ops_per_sec": 32732057.537667, "ops_per_sec_max": 50400327.518685, "ops_per_sec_min": 23113497.450495, "output_layout": "affine_dp_scan_target_lookup", "paired_baseline_ops_per_sec": 40842245.276745, "paired_baseline_ref": "HEAD", "paired_speedup": 0.8014264964101808, "query_count": 2164736, "query_input": "hash64", "raw_status": "discard", "reason": "", "requested_hits": 64, "runner_sample_count": 3, "sample_count": 262144, "seconds": 2.527436, "skipped": false, "state_layout": "xyzz", "status": "discard", "steps_per_sample": 512, "target_bucket_bytes": 268435456, "target_count": 25005000, "target_filter_bucket_bytes": 134217728, "target_key": "x256_y_parity", "target_key_bytes": 1000200000, "target_lookup_checksum": "0x90b9fdeac531859a", "target_query_hash_bytes": 17317888, "target_table_buckets": 33554432, "target_table_bytes": 134217728, "thread_execution_width": 32, "threadgroup_limit": 128, "threads_per_threadgroup": 128, "timestamp": "2026-06-27T21:49:39Z", "validation_seconds": 6.162844, "validation_workers": 8}
{"affine_scan_mode": "cpu_batch_prod_zz_zzz", "affine_scan_seconds": 0.027762, "backend": "metal", "budget_sec": 240, "bytes_per_target": 5.367636, "candidate_verification": "tag32_hash_filter_then_cpu_exact_key_equality", "commit": "cfd6507-dirty", "confirmation_index": 2, "confirmation_runs": 2, "confirmation_status": "discard", "cooldown_sec": 10.0, "correctness": true, "description": "Metal XYZZ affine DP scan tag32 hash-filter 25M-target repeat2048 lookup versus tag16 hash-filter", "distance_tracking": "packet_distance_uint64", "dp_bits": 8, "dp_checksum": "0x9dba4a07ebbb8e14", "dp_count": 1057, "dp_distance_checksum": "0xf0dc88ed68b2ff64", "dp_query_count": 1057, "dp_tracking": "affine_x256_y_parity_cpu_batch", "exact_host_table_bytes": 1268635456, "experiment": "metal_jacobian_dynamic_dp_stream_xyzz_affine_scan_target_lookup_tag32_hash_filter25m_repeat2048", "filter_false_positive_count": 0, "filter_positive_count": 64, "gpu_lookup_lookups_per_sec": 41105476.832502, "gpu_ops_per_sec": 37250781.241371, "hit_count": 64, "injected_hits": 64, "iterations": 134217728, "jump_count": 16, "jump_histogram_max_bucket": 8394316, "jump_histogram_max_deviation_ppm": 759, "jump_histogram_min_bucket": 8382245, "jump_index": "power2_mask", "jump_mixer": "avalanche64", "jump_schedule": "power2", "lookup_engine": "gpu_filter32_hash", "lookup_engine_effective": "gpu_filter32_hash", "lookup_exact_seconds": 0.003483, "lookup_gpu_seconds": 0.052663, "lookup_hash_seconds": 0.068792, "lookup_layout": "open_address_tag32_hash_filter_exact256", "lookup_max_threads_per_threadgroup": 1024, "lookup_query_mode": "distinct_misses", "lookup_repeat": 2048, "lookup_seconds": 0.124938, "lookup_thread_execution_width": 32, "lookup_threadgroup_limit": 512, "lookup_threads_per_threadgroup": 512, "lookups_per_sec": 17326534.079118, "lookups_per_sec_max": 28178105.365747, "lookups_per_sec_min": 13833228.559675, "machine": "macOS-26.5-arm64-arm-64bit-Mach-O", "max_threads_per_threadgroup": 1024, "min_ms": 500, "miss_count": 2164672, "operation": "jacobian_affine_scan_target_lookup_tag32", "ops_per_sec": 17326534.079118, "ops_per_sec_max": 28178105.365747, "ops_per_sec_min": 13833228.559675, "output_layout": "affine_dp_scan_target_lookup", "paired_baseline_ops_per_sec": 50197164.421003, "paired_baseline_ref": "HEAD", "paired_speedup": 0.3451695783809733, "query_count": 2164736, "query_input": "hash64", "raw_status": "discard", "reason": "", "requested_hits": 64, "runner_sample_count": 3, "sample_count": 262144, "seconds": 3.603085, "skipped": false, "state_layout": "xyzz", "status": "discard", "steps_per_sample": 512, "target_bucket_bytes": 268435456, "target_count": 25005000, "target_filter_bucket_bytes": 134217728, "target_key": "x256_y_parity", "target_key_bytes": 1000200000, "target_lookup_checksum": "0x90b9fdeac531859a", "target_query_hash_bytes": 17317888, "target_table_buckets": 33554432, "target_table_bytes": 134217728, "thread_execution_width": 32, "threadgroup_limit": 128, "threads_per_threadgroup": 128, "timestamp": "2026-06-27T21:49:39Z", "validation_seconds": 13.574237, "validation_workers": 8}
{"backend": "macos_cpu", "budget_sec": 180, "candidate_verification": "legacy_rehash_filter_byte_equality", "commit": "4ac0438-dirty", "confirmation_index": 1, "confirmation_runs": 2, "confirmation_status": "keep", "cooldown_sec": 0.0, "correctness": true, "derived_seconds": 0.251764, "derived_targets_per_sec": 198638046.042226, "description": "Host setup benchmark comparing legacy rehash/probe filter construction against deriving tag32/tag16 filters from the already-built exact tag32 table", "experiment": "target_lookup_filter_build_from_tag32_buckets", "iterations": 1, "legacy_seconds": 4.023798, "legacy_targets_per_sec": 12428557.589193, "lookup_layout": "open_address_tag32_tag16_filter_exact256", "machine": "macOS-26.5-arm64-arm-64bit-Mach-O", "min_ms": 0, "operation": "target_lookup_filter_build_from_tag32_buckets", "ops_per_sec": 15.982389, "ops_per_sec_max": 17.098289, "ops_per_sec_min": 13.128301, "raw_status": "keep", "reason": "", "runner_sample_count": 3, "sample_count": 25005000, "seconds": 0.251764, "setup_phase": "host_filter_build", "skipped": false, "speedup": 15.982389, "speedup_max": 17.098289, "speedup_min": 13.128301, "status": "keep", "tag16_byte_equal": true, "tag16_derived_seconds": 0.08206, "tag16_filter_checksum": "0x8ba16d0e4799e611", "tag16_legacy_seconds": 1.516719, "tag16_speedup": 18.482999, "tag32_byte_equal": true, "tag32_derived_seconds": 0.169704, "tag32_filter_checksum": "0x42b1584566f30df0", "tag32_legacy_seconds": 2.507079, "tag32_speedup": 14.773224, "target_bucket_bytes": 268435456, "target_count": 25005000, "target_filter16_bucket_bytes": 67108864, "target_filter32_bucket_bytes": 134217728, "target_key": "x256_y_parity", "target_key_bytes": 1000200000, "target_table_buckets": 33554432, "target_table_bytes": 201326592, "timestamp": "2026-06-27T22:13:09Z"}
