{"affine_scan_mode": "cpu_batch_prod_zz_zzz", "affine_scan_seconds": 0.000633, "backend": "metal", "budget_sec": 180, "bytes_per_target": 4.0, "candidate_verification": "tag16_mix_hash_filter_then_cpu_exact_key_equality", "commit": "31518ad-dirty", "confirmation_index": 2, "confirmation_runs": 2, "confirmation_status": "discard", "cooldown_sec": 5.0, "correctness": true, "description": "M3 repeat-indexed tag16-mix hash filter with fused setup and base-count positives versus standard tag16", "distance_tracking": "packet_distance_uint64", "dp_bits": 6, "dp_checksum": "0xbeb579944293c04a", "dp_count": 125, "dp_distance_checksum": "0xe3db79a4e83bd59d", "dp_query_count": 125, "dp_tracking": "affine_x256_y_parity_cpu_batch", "exact_host_table_bytes": 939524096, "experiment": "metal_jacobian_dynamic_dp_stream_xyzz_affine_scan_target_lookup_tag16_mix_filter_m3_base_count_repeat", "filter_false_positive_count": 0, "filter_positive_count": 2097152, "gpu_lookup_lookups_per_sec": 1781268898.598191, "gpu_ops_per_sec": 70474218.806892, "hit_count": 2097152, "injected_hits": 16, "iterations": 8388608, "jump_count": 16, "jump_histogram_max_bucket": 262877, "jump_histogram_max_deviation_ppm": 3475, "jump_histogram_min_bucket": 261233, "jump_index": "power2_mask", "jump_mixer": "avalanche64", "jump_schedule": "power2", "lookup_engine": "auto", "lookup_engine_effective": "gpu_filter16_mix_hash_repeat", "lookup_exact_seconds": 0.000141, "lookup_gpu_seconds": 0.018396, "lookup_hash_seconds": 2.8e-05, "lookup_layout": "open_address_tag16_mix_hash_filter_exact256", "lookup_max_threads_per_threadgroup": 1024, "lookup_query_mode": "repeat", "lookup_repeat": 131072, "lookup_seconds": 0.018565, "lookup_thread_execution_width": 32, "lookup_threadgroup_limit": 512, "lookup_threads_per_threadgroup": 512, "lookups_per_sec": 1765002195.480026, "machine": "macOS-26.5-arm64-arm-64bit-Mach-O", "max_threads_per_threadgroup": 1024, "min_ms": 100, "miss_count": 14286848, "operation": "jacobian_affine_scan_target_lookup_tag32", "ops_per_sec": 15462762.638213, "ops_per_sec_max": 17199722.9282, "ops_per_sec_min": 13785730.760084, "output_layout": "affine_dp_scan_target_lookup", "paired_baseline_ops_per_sec": 17646576.051489, "paired_baseline_ref": "HEAD", "paired_order": "alternate", "paired_speedup": 0.8762471877318245, "query_count": 16384000, "query_input": "hash64_repeat_indexed", "raw_status": "discard", "reason": "", "repeat_positive_index_encoding": "base_query_count_repeated", "requested_hits": 16, "round_count": 1, "runner_sample_count": 3, "sample_count": 8192, "seconds": 0.119031, "setup_inclusive_ops_per_sec": 15462762.638213, "setup_inclusive_ops_per_sec_max": 17199722.9282, "setup_inclusive_ops_per_sec_min": 13785730.760084, "setup_inclusive_seconds": 0.542504, "skipped": false, "state_layout": "xyzz", "status": "discard", "steps_per_sample": 512, "target_bucket_bytes": 268435456, "target_build_seconds": 0.404275, "target_count": 16777216, "target_filter_bucket_bytes": 67108864, "target_filter_build_seconds": 0.0, "target_key": "x256_y_parity", "target_key_bytes": 671088640, "target_lookup_checksum": "0x86ec0110960785f8", "target_query_hash_bytes": 1000, "target_table_buckets": 33554432, "target_table_bytes": 67108864, "thread_execution_width": 32, "threadgroup_limit": 128, "threads_per_threadgroup": 128, "timestamp": "2026-06-30T20:26:21Z", "validation_seconds": 0.138638, "validation_workers": 8}
{"affine_scan_mode": "cpu_batch_prod_zz_zzz", "affine_scan_seconds": 0.000625, "backend": "metal", "budget_sec": 180, "bytes_per_target": 4.0, "candidate_verification": "tag16_hash_filter_then_cpu_exact_key_equality", "commit": "73adb7f-dirty", "confirmation_index": 1, "confirmation_runs": 2, "confirmation_status": "keep", "cooldown_sec": 5.0, "correctness": true, "description": "M3 repeat-indexed tag16 hash filter base-count by-base threadgroup reduction versus per-positive global atomics", "distance_tracking": "packet_distance_uint64", "dp_bits": 6, "dp_checksum": "0xbeb579944293c04a", "dp_count": 125, "dp_distance_checksum": "0xe3db79a4e83bd59d", "dp_query_count": 125, "dp_tracking": "affine_x256_y_parity_cpu_batch", "exact_host_table_bytes": 939524096, "experiment": "metal_jacobian_dynamic_dp_stream_xyzz_affine_scan_target_lookup_tag16_hash_filter_m3_base_count_by_base_reduce", "filter_false_positive_count": 0, "filter_positive_count": 2097152, "gpu_lookup_lookups_per_sec": 3954522985.664854, "gpu_ops_per_sec": 82103075.426019, "hit_count": 2097152, "injected_hits": 16, "iterations": 8388608, "jump_count": 16, "jump_histogram_max_bucket": 262877, "jump_histogram_max_deviation_ppm": 3475, "jump_histogram_min_bucket": 261233, "jump_index": "power2_mask", "jump_mixer": "avalanche64", "jump_schedule": "power2", "lookup_engine": "auto", "lookup_engine_effective": "gpu_filter16_hash_repeat", "lookup_exact_seconds": 2e-05, "lookup_gpu_seconds": 0.008286, "lookup_hash_seconds": 1.1e-05, "lookup_layout": "open_address_tag16_hash_filter_exact256", "lookup_max_threads_per_threadgroup": 1024, "lookup_query_mode": "repeat", "lookup_repeat": 131072, "lookup_seconds": 0.008318, "lookup_thread_execution_width": 32, "lookup_threadgroup_limit": 512, "lookup_threads_per_threadgroup": 512, "lookups_per_sec": 3939428402.980635, "machine": "macOS-26.5-arm64-arm-64bit-Mach-O", "max_threads_per_threadgroup": 1024, "min_ms": 100, "miss_count": 14286848, "operation": "jacobian_affine_scan_target_lookup_tag32", "ops_per_sec": 75494801.824354, "ops_per_sec_max": 80565346.413708, "ops_per_sec_min": 73066433.251953, "output_layout": "affine_dp_scan_target_lookup", "paired_baseline_ops_per_sec": 72939819.645629, "paired_baseline_ref": "HEAD", "paired_order": "alternate", "paired_speedup": 1.0350286330722795, "query_count": 16384000, "query_input": "hash64_repeat_indexed", "raw_status": "keep", "reason": "", "repeat_positive_index_encoding": "base_query_count_repeated", "requested_hits": 16, "round_count": 1, "runner_sample_count": 3, "sample_count": 8192, "seconds": 0.102172, "setup_inclusive_ops_per_sec": 21120804.486209, "setup_inclusive_seconds": 0.397173, "skipped": false, "state_layout": "xyzz", "status": "keep", "steps_per_sample": 512, "target_bucket_bytes": 268435456, "target_build_seconds": 0.286058, "target_count": 16777216, "target_filter_bucket_bytes": 67108864, "target_filter_build_seconds": 0.0, "target_key": "x256_y_parity", "target_key_bytes": 671088640, "target_lookup_checksum": "0x86ec0110960785f8", "target_query_hash_bytes": 1000, "target_table_buckets": 33554432, "target_table_bytes": 67108864, "thread_execution_width": 32, "threadgroup_limit": 128, "threads_per_threadgroup": 128, "timestamp": "2026-06-30T20:43:34Z", "validation_seconds": 0.137964, "validation_workers": 8}
{"affine_scan_mode": "cpu_batch_prod_zz_zzz", "affine_scan_seconds": 0.000634, "backend": "metal", "budget_sec": 180, "bytes_per_target": 4.0, "candidate_verification": "tag16_hash_filter_then_cpu_exact_key_equality", "commit": "73adb7f-dirty", "confirmation_index": 2, "confirmation_runs": 2, "confirmation_status": "keep", "cooldown_sec": 5.0, "correctness": true, "description": "M3 repeat-indexed tag16 hash filter base-count by-base threadgroup reduction versus per-positive global atomics", "distance_tracking": "packet_distance_uint64", "dp_bits": 6, "dp_checksum": "0xbeb579944293c04a", "dp_count": 125, "dp_distance_checksum": "0xe3db79a4e83bd59d", "dp_query_count": 125, "dp_tracking": "affine_x256_y_parity_cpu_batch", "exact_host_table_bytes": 939524096, "experiment": "metal_jacobian_dynamic_dp_stream_xyzz_affine_scan_target_lookup_tag16_hash_filter_m3_base_count_by_base_reduce", "filter_false_positive_count": 0, "filter_positive_count": 2097152, "gpu_lookup_lookups_per_sec": 5236770992.431069, "gpu_ops_per_sec": 83221177.74273, "hit_count": 2097152, "injected_hits": 16, "iterations": 8388608, "jump_count": 16, "jump_histogram_max_bucket": 262877, "jump_histogram_max_deviation_ppm": 3475, "jump_histogram_min_bucket": 261233, "jump_index": "power2_mask", "jump_mixer": "avalanche64", "jump_schedule": "power2", "lookup_engine": "auto", "lookup_engine_effective": "gpu_filter16_hash_repeat", "lookup_exact_seconds": 8e-06, "lookup_gpu_seconds": 0.006257, "lookup_hash_seconds": 1.2e-05, "lookup_layout": "open_address_tag16_hash_filter_exact256", "lookup_max_threads_per_threadgroup": 1024, "lookup_query_mode": "repeat", "lookup_repeat": 131072, "lookup_seconds": 0.006277, "lookup_thread_execution_width": 32, "lookup_threadgroup_limit": 512, "lookup_threads_per_threadgroup": 512, "lookups_per_sec": 5220605971.386721, "machine": "macOS-26.5-arm64-arm-64bit-Mach-O", "max_threads_per_threadgroup": 1024, "min_ms": 100, "miss_count": 14286848, "operation": "jacobian_affine_scan_target_lookup_tag32", "ops_per_sec": 77881634.196628, "ops_per_sec_max": 78432291.401705, "ops_per_sec_min": 76348915.101209, "output_layout": "affine_dp_scan_target_lookup", "paired_baseline_ops_per_sec": 73789843.671519, "paired_baseline_ref": "HEAD", "paired_order": "alternate", "paired_speedup": 1.0554519473347026, "query_count": 16384000, "query_input": "hash64_repeat_indexed", "raw_status": "keep", "reason": "", "repeat_positive_index_encoding": "base_query_count_repeated", "requested_hits": 16, "round_count": 1, "runner_sample_count": 3, "sample_count": 8192, "seconds": 0.100799, "setup_inclusive_ops_per_sec": 19375490.289621, "setup_inclusive_seconds": 0.432949, "skipped": false, "state_layout": "xyzz", "status": "keep", "steps_per_sample": 512, "target_bucket_bytes": 268435456, "target_build_seconds": 0.32524, "target_count": 16777216, "target_filter_bucket_bytes": 67108864, "target_filter_build_seconds": 0.0, "target_key": "x256_y_parity", "target_key_bytes": 671088640, "target_lookup_checksum": "0x86ec0110960785f8", "target_query_hash_bytes": 1000, "target_table_buckets": 33554432, "target_table_bytes": 67108864, "thread_execution_width": 32, "threadgroup_limit": 128, "threads_per_threadgroup": 128, "timestamp": "2026-06-30T20:43:34Z", "validation_seconds": 0.120049, "validation_workers": 8}
{"affine_scan_mode": "cpu_batch_prod_zz_zzz", "affine_scan_seconds": 0.016107, "backend": "metal", "budget_sec": 540, "bytes_per_target": 2.683818, "candidate_verification": "tag16_hash_filter_then_cpu_exact_key_equality", "commit": "9399a02-dirty", "confirmation_index": 1, "confirmation_runs": 2, "confirmation_status": "keep", "cooldown_sec": 10.0, "correctness": true, "description": "Fixed-round 25M target tag16 repeat lookup with base-count positives versus expanded positive indices", "distance_tracking": "packet_distance_uint64", "dp_bits": 6, "dp_checksum": "0x7f111e78c67b5c18", "dp_count": 4121, "dp_distance_checksum": "0x894123b96acf0de5", "dp_query_count": 4121, "dp_tracking": "affine_x256_y_parity_cpu_batch", "exact_host_table_bytes": 1268635456, "experiment": "metal_jacobian_dynamic_dp_stream_xyzz_affine_scan_target_lookup_tag16_hash_filter25m_rounds_base_count_repeat", "filter_false_positive_count": 0, "filter_positive_count": 131072, "gpu_lookup_lookups_per_sec": 221469802.561477, "gpu_ops_per_sec": 55557745.727414, "hit_count": 131072, "injected_hits": 128, "iterations": 536870912, "jump_count": 16, "jump_histogram_max_bucket": 33562777, "jump_histogram_max_deviation_ppm": 249, "jump_histogram_min_bucket": 33546500, "jump_index": "power2_mask", "jump_mixer": "avalanche64", "jump_schedule": "power2", "lookup_engine": "gpu_filter16_hash_repeat", "lookup_engine_effective": "gpu_filter16_hash_repeat", "lookup_exact_seconds": 1.7e-05, "lookup_gpu_seconds": 0.019054, "lookup_hash_seconds": 4.6e-05, "lookup_layout": "open_address_tag16_hash_filter_exact256", "lookup_max_threads_per_threadgroup": 1024, "lookup_query_mode": "repeat", "lookup_repeat": 1024, "lookup_seconds": 0.019117, "lookup_thread_execution_width": 32, "lookup_threadgroup_limit": 512, "lookup_threads_per_threadgroup": 512, "lookups_per_sec": 220740437.811479, "machine": "macOS-26.5-arm64-arm-64bit-Mach-O", "max_threads_per_threadgroup": 1024, "min_ms": 0, "miss_count": 4088832, "operation": "jacobian_affine_scan_target_lookup_tag32_rounds", "ops_per_sec": 55355964.432093, "ops_per_sec_max": 56609679.359726, "ops_per_sec_min": 33476809.739717, "output_layout": "affine_dp_scan_target_lookup", "paired_baseline_ops_per_sec": 48038763.096163, "paired_baseline_ref": "HEAD", "paired_order": "alternate", "paired_speedup": 1.1523186873334474, "physical_filter_positive_count": 131072, "physical_query_count": 4219904, "query_count": 4219904, "query_input": "hash64_repeat_indexed", "raw_status": "keep", "reason": "", "repeat_positive_index_encoding": "base_query_count_repeated", "requested_hits": 64, "round_count": 2, "runner_sample_count": 3, "sample_count": 131072, "seconds": 9.663295, "setup_inclusive_ops_per_sec": 48167388.101535, "setup_inclusive_seconds": 11.145942, "skipped": false, "state_layout": "xyzz", "status": "keep", "steps_per_sample": 2048, "target_bucket_bytes": 268435456, "target_build_seconds": 1.447422, "target_count": 25005000, "target_filter_bucket_bytes": 67108864, "target_filter_build_seconds": 0.0, "target_key": "x256_y_parity", "target_key_bytes": 1000200000, "target_lookup_checksum": "0x923b46f156f9d59b", "target_query_hash_bytes": 32968, "target_table_buckets": 33554432, "target_table_bytes": 67108864, "thread_execution_width": 32, "threadgroup_limit": 128, "threads_per_threadgroup": 128, "timestamp": "2026-06-30T21:28:57Z", "validation_seconds": 30.56085, "validation_workers": 8}
{"affine_scan_mode": "cpu_batch_prod_zz_zzz", "affine_scan_seconds": 0.007759, "backend": "metal", "budget_sec": 540, "bytes_per_target": 2.683818, "candidate_verification": "tag16_hash_filter_then_cpu_exact_key_equality", "commit": "9399a02-dirty", "confirmation_index": 2, "confirmation_runs": 2, "confirmation_status": "keep", "cooldown_sec": 10.0, "correctness": true, "description": "Fixed-round 25M target tag16 repeat lookup with base-count positives versus expanded positive indices", "distance_tracking": "packet_distance_uint64", "dp_bits": 6, "dp_checksum": "0x7f111e78c67b5c18", "dp_count": 4121, "dp_distance_checksum": "0x894123b96acf0de5", "dp_query_count": 4121, "dp_tracking": "affine_x256_y_parity_cpu_batch", "exact_host_table_bytes": 1268635456, "experiment": "metal_jacobian_dynamic_dp_stream_xyzz_affine_scan_target_lookup_tag16_hash_filter25m_rounds_base_count_repeat", "filter_false_positive_count": 0, "filter_positive_count": 131072, "gpu_lookup_lookups_per_sec": 183441187.178386, "gpu_ops_per_sec": 64970055.522064, "hit_count": 131072, "injected_hits": 128, "iterations": 536870912, "jump_count": 16, "jump_histogram_max_bucket": 33562777, "jump_histogram_max_deviation_ppm": 249, "jump_histogram_min_bucket": 33546500, "jump_index": "power2_mask", "jump_mixer": "avalanche64", "jump_schedule": "power2", "lookup_engine": "gpu_filter16_hash_repeat", "lookup_engine_effective": "gpu_filter16_hash_repeat", "lookup_exact_seconds": 2.2e-05, "lookup_gpu_seconds": 0.023004, "lookup_hash_seconds": 0.000204, "lookup_layout": "open_address_tag16_hash_filter_exact256", "lookup_max_threads_per_threadgroup": 1024, "lookup_query_mode": "repeat", "lookup_repeat": 1024, "lookup_seconds": 0.02323, "lookup_thread_execution_width": 32, "lookup_threadgroup_limit": 512, "lookup_threads_per_threadgroup": 512, "lookups_per_sec": 181660115.919871, "machine": "macOS-26.5-arm64-arm-64bit-Mach-O", "max_threads_per_threadgroup": 1024, "min_ms": 0, "miss_count": 4088832, "operation": "jacobian_affine_scan_target_lookup_tag32_rounds", "ops_per_sec": 64727322.948725, "ops_per_sec_max": 82031301.027033, "ops_per_sec_min": 64091735.53534, "output_layout": "affine_dp_scan_target_lookup", "paired_baseline_ops_per_sec": 57414054.969548, "paired_baseline_ref": "HEAD", "paired_order": "alternate", "paired_speedup": 1.127377660105281, "physical_filter_positive_count": 131072, "physical_query_count": 4219904, "query_count": 4219904, "query_input": "hash64_repeat_indexed", "raw_status": "keep", "reason": "", "repeat_positive_index_encoding": "base_query_count_repeated", "requested_hits": 64, "round_count": 2, "runner_sample_count": 3, "sample_count": 131072, "seconds": 8.263359, "setup_inclusive_ops_per_sec": 56018676.510504, "setup_inclusive_seconds": 9.583784, "skipped": false, "state_layout": "xyzz", "status": "keep", "steps_per_sample": 2048, "target_bucket_bytes": 268435456, "target_build_seconds": 1.289437, "target_count": 25005000, "target_filter_bucket_bytes": 67108864, "target_filter_build_seconds": 0.0, "target_key": "x256_y_parity", "target_key_bytes": 1000200000, "target_lookup_checksum": "0x923b46f156f9d59b", "target_query_hash_bytes": 32968, "target_table_buckets": 33554432, "target_table_bytes": 67108864, "thread_execution_width": 32, "threadgroup_limit": 128, "threads_per_threadgroup": 128, "timestamp": "2026-06-30T21:28:57Z", "validation_seconds": 23.813152, "validation_workers": 8}
{"affine_scan_mode": "cpu_batch_prod_zz_zzz", "affine_scan_seconds": 0.008437, "backend": "metal", "budget_sec": 540, "bytes_per_target": 2.683818, "candidate_verification": "tag16_hash_filter_then_cpu_exact_key_equality", "commit": "d06499f-dirty", "confirmation_index": 1, "confirmation_runs": 2, "confirmation_status": "keep", "cooldown_sec": 10.0, "correctness": true, "description": "Fixed-round 25M target lookup with distinct round starts batched into one Metal walk dispatch", "distance_tracking": "packet_distance_uint64", "dp_bits": 6, "dp_checksum": "0x7f111e78c67b5c18", "dp_count": 4121, "dp_distance_checksum": "0x894123b96acf0de5", "dp_query_count": 4121, "dp_tracking": "affine_x256_y_parity_cpu_batch", "exact_host_table_bytes": 1268635456, "experiment": "metal_jacobian_dynamic_dp_stream_xyzz_affine_scan_target_lookup_tag16_hash_filter25m_rounds_batched_walk", "filter_false_positive_count": 0, "filter_positive_count": 131072, "gpu_lookup_lookups_per_sec": 368782723.656954, "gpu_ops_per_sec": 109842065.419591, "hit_count": 131072, "injected_hits": 128, "iterations": 536870912, "jump_count": 16, "jump_histogram_max_bucket": 33562777, "jump_histogram_max_deviation_ppm": 249, "jump_histogram_min_bucket": 33546500, "jump_index": "power2_mask", "jump_mixer": "avalanche64", "jump_schedule": "power2", "lookup_engine": "gpu_filter16_hash_repeat", "lookup_engine_effective": "gpu_filter16_hash_repeat", "lookup_exact_seconds": 1.9e-05, "lookup_gpu_seconds": 0.011443, "lookup_hash_seconds": 3.7e-05, "lookup_layout": "open_address_tag16_hash_filter_exact256", "lookup_max_threads_per_threadgroup": 1024, "lookup_query_mode": "repeat", "lookup_repeat": 1024, "lookup_seconds": 0.011499, "lookup_thread_execution_width": 32, "lookup_threadgroup_limit": 512, "lookup_threads_per_threadgroup": 512, "lookups_per_sec": 366980085.224802, "machine": "macOS-26.5-arm64-arm-64bit-Mach-O", "max_threads_per_threadgroup": 1024, "min_ms": 0, "miss_count": 4088832, "operation": "jacobian_affine_scan_target_lookup_tag32_rounds", "ops_per_sec": 109395855.173225, "ops_per_sec_max": 124771910.765623, "ops_per_sec_min": 45310968.928328, "output_layout": "affine_dp_scan_target_lookup", "paired_baseline_ops_per_sec": 78109003.815734, "paired_baseline_ref": "HEAD", "paired_order": "alternate", "paired_speedup": 1.400553711212339, "physical_filter_positive_count": 131072, "physical_query_count": 4219904, "query_count": 4219904, "query_input": "hash64_repeat_indexed", "raw_status": "keep", "reason": "", "repeat_positive_index_encoding": "base_query_count_repeated", "requested_hits": 64, "round_count": 2, "runner_sample_count": 3, "sample_count": 131072, "seconds": 4.887662, "setup_inclusive_ops_per_sec": 83012360.302826, "setup_inclusive_seconds": 6.467361, "skipped": false, "state_layout": "xyzz", "status": "keep", "steps_per_sample": 2048, "target_bucket_bytes": 268435456, "target_build_seconds": 1.559763, "target_count": 25005000, "target_filter_bucket_bytes": 67108864, "target_filter_build_seconds": 0.0, "target_key": "x256_y_parity", "target_key_bytes": 1000200000, "target_lookup_checksum": "0x923b46f156f9d59b", "target_query_hash_bytes": 32968, "target_table_buckets": 33554432, "target_table_bytes": 67108864, "thread_execution_width": 32, "threadgroup_limit": 128, "threads_per_threadgroup": 128, "timestamp": "2026-06-30T21:49:39Z", "validation_seconds": 34.781915, "validation_workers": 8}
