{"backend": "metal", "budget_sec": 10, "commit": "b8e1120", "correctness": true, "description": "Metal Jacobian jump-table walk with projective distinguished-point candidate flags", "distance_checksum": "0xa45f471493cace2f", "distance_tracking": "uint64", "dp_bits": 4, "dp_checksum": "0x30a7914972cba014", "dp_count": 1000, "dp_tracking": "projective_x_limb0", "experiment": "metal_jacobian_jump_walk_dp", "iterations": 1572864, "jump_count": 16, "machine": "macOS-26.5-arm64-arm-64bit-Mach-O", "max_threads_per_threadgroup": 1024, "min_ms": 50, "operation": "jacobian_affine_walk_jump_table", "ops_per_sec": 29895632.602187, "ops_per_sec_max": 33404614.217008, "ops_per_sec_min": 25087151.015531, "paired_baseline_ops_per_sec": 25779267.617206, "paired_baseline_ref": "main", "paired_speedup": 1.1596773440620785, "reason": "", "runner_sample_count": 5, "sample_count": 16384, "seconds": 0.052612, "skipped": false, "status": "keep", "steps_per_sample": 8, "thread_execution_width": 32, "threadgroup_limit": 256, "threads_per_threadgroup": 256, "timestamp": "2026-06-21T10:47:22Z"}
{"backend": "metal", "budget_sec": 10, "commit": "9c751f6", "correctness": true, "description": "Metal Jacobian jump-table walk with projective distinguished-point candidate flags", "distance_checksum": "0xa45f471493cace2f", "distance_tracking": "uint64", "dp_bits": 4, "dp_checksum": "0x30a7914972cba014", "dp_count": 1000, "dp_tracking": "projective_x_limb0", "experiment": "metal_jacobian_jump_walk_dp", "iterations": 1441792, "jump_count": 16, "machine": "macOS-26.5-arm64-arm-64bit-Mach-O", "max_threads_per_threadgroup": 1024, "min_ms": 50, "operation": "jacobian_affine_walk_jump_table", "ops_per_sec": 27998203.73962, "ops_per_sec_max": 32379369.728238, "ops_per_sec_min": 24922935.360168, "paired_baseline_ops_per_sec": 28161283.758521, "paired_baseline_ref": "main", "paired_speedup": 0.9942090701439824, "reason": "", "runner_sample_count": 5, "sample_count": 16384, "seconds": 0.051496, "skipped": false, "status": "discard", "steps_per_sample": 8, "thread_execution_width": 32, "threadgroup_limit": 256, "threads_per_threadgroup": 256, "timestamp": "2026-06-21T10:56:13Z"}
{"backend": "metal", "budget_sec": 10, "commit": "da3086d", "correctness": true, "description": "Metal Jacobian jump-table walk with projective distinguished-point candidate flags", "distance_checksum": "0xa45f471493cace2f", "distance_tracking": "uint64", "dp_bits": 4, "dp_checksum": "0x30a7914972cba014", "dp_count": 1000, "dp_tracking": "projective_x_limb0", "experiment": "metal_jacobian_jump_walk_dp", "iterations": 1966080, "jump_count": 16, "machine": "macOS-26.5-arm64-arm-64bit-Mach-O", "max_threads_per_threadgroup": 1024, "min_ms": 50, "operation": "jacobian_affine_walk_jump_table", "ops_per_sec": 38098881.915015, "ops_per_sec_max": 39222856.458865, "ops_per_sec_min": 36152864.915872, "paired_baseline_ops_per_sec": 27330823.387611, "paired_baseline_ref": "main", "paired_speedup": 1.3939895397474609, "reason": "", "runner_sample_count": 5, "sample_count": 16384, "seconds": 0.051605, "skipped": false, "status": "keep", "steps_per_sample": 8, "thread_execution_width": 32, "threadgroup_limit": 256, "threads_per_threadgroup": 256, "timestamp": "2026-06-21T11:01:29Z"}
{"backend": "metal", "budget_sec": 10, "commit": "da3086d", "correctness": true, "description": "Metal Jacobian jump-table walk with projective distinguished-point candidate flags", "distance_checksum": "0xa45f471493cace2f", "distance_tracking": "uint64", "dp_bits": 4, "dp_checksum": "0x30a7914972cba014", "dp_count": 1000, "dp_tracking": "projective_x_limb0", "experiment": "metal_jacobian_jump_walk_dp", "iterations": 1572864, "jump_count": 16, "machine": "macOS-26.5-arm64-arm-64bit-Mach-O", "max_threads_per_threadgroup": 1024, "min_ms": 50, "operation": "jacobian_affine_walk_jump_table", "ops_per_sec": 30444886.448562, "ops_per_sec_max": 38445460.254976, "ops_per_sec_min": 16788203.274668, "paired_baseline_ops_per_sec": 33237046.959255, "paired_baseline_ref": "main", "paired_speedup": 0.9159925214139546, "reason": "", "runner_sample_count": 5, "sample_count": 16384, "seconds": 0.051663, "skipped": false, "status": "discard", "steps_per_sample": 8, "thread_execution_width": 32, "threadgroup_limit": 256, "threads_per_threadgroup": 256, "timestamp": "2026-06-21T11:02:28Z"}
{"backend": "metal", "budget_sec": 10, "commit": "6fe1f43", "correctness": true, "description": "Metal Jacobian jump-table walk with projective distinguished-point candidate flags", "distance_checksum": "0xa45f471493cace2f", "distance_tracking": "uint64", "dp_bits": 4, "dp_checksum": "0x30a7914972cba014", "dp_count": 1000, "dp_tracking": "projective_x_limb0", "experiment": "metal_jacobian_jump_walk_dp", "iterations": 1703936, "jump_count": 16, "machine": "macOS-26.5-arm64-arm-64bit-Mach-O", "max_threads_per_threadgroup": 1024, "min_ms": 50, "operation": "jacobian_affine_walk_jump_table", "ops_per_sec": 31734147.843923, "ops_per_sec_max": 38595585.390426, "ops_per_sec_min": 18181417.174554, "paired_baseline_ops_per_sec": 36197526.932618, "paired_baseline_ref": "main", "paired_speedup": 0.8766938112373363, "reason": "", "runner_sample_count": 5, "sample_count": 16384, "seconds": 0.053694, "skipped": false, "status": "discard", "steps_per_sample": 8, "thread_execution_width": 32, "threadgroup_limit": 256, "threads_per_threadgroup": 256, "timestamp": "2026-06-21T11:07:47Z"}
{"backend": "metal", "budget_sec": 10, "commit": "21d2cb4", "correctness": true, "description": "Metal Jacobian jump-table walk with projective distinguished-point candidate flags", "distance_checksum": "0xa45f471493cace2f", "distance_tracking": "uint64", "dp_bits": 4, "dp_checksum": "0x30a7914972cba014", "dp_count": 1000, "dp_tracking": "projective_x_limb0", "experiment": "metal_jacobian_jump_walk_dp", "iterations": 1966080, "jump_count": 16, "machine": "macOS-26.5-arm64-arm-64bit-Mach-O", "max_threads_per_threadgroup": 1024, "min_ms": 50, "operation": "jacobian_affine_walk_jump_table", "ops_per_sec": 38940533.391902, "ops_per_sec_max": 58844848.248366, "ops_per_sec_min": 29701430.624271, "paired_baseline_ops_per_sec": 35722986.288468, "paired_baseline_ref": "main", "paired_speedup": 1.09006937654797, "reason": "", "runner_sample_count": 5, "sample_count": 16384, "seconds": 0.050489, "skipped": false, "status": "keep", "steps_per_sample": 8, "thread_execution_width": 32, "threadgroup_limit": 256, "threads_per_threadgroup": 256, "timestamp": "2026-06-21T11:12:08Z"}
{"backend": "metal", "budget_sec": 10, "commit": "21d2cb4", "correctness": true, "description": "Metal Jacobian jump-table walk with projective distinguished-point candidate flags", "distance_checksum": "0xa45f471493cace2f", "distance_tracking": "uint64", "dp_bits": 4, "dp_checksum": "0x30a7914972cba014", "dp_count": 1000, "dp_tracking": "projective_x_limb0", "experiment": "metal_jacobian_jump_walk_dp", "iterations": 1966080, "jump_count": 16, "machine": "macOS-26.5-arm64-arm-64bit-Mach-O", "max_threads_per_threadgroup": 1024, "min_ms": 50, "operation": "jacobian_affine_walk_jump_table", "ops_per_sec": 38149612.617702, "ops_per_sec_max": 47159512.559347, "ops_per_sec_min": 26134949.231637, "paired_baseline_ops_per_sec": 32974113.574544, "paired_baseline_ref": "main", "paired_speedup": 1.1569564267878751, "reason": "", "runner_sample_count": 5, "sample_count": 16384, "seconds": 0.051536, "skipped": false, "status": "keep", "steps_per_sample": 8, "thread_execution_width": 32, "threadgroup_limit": 256, "threads_per_threadgroup": 256, "timestamp": "2026-06-21T11:13:16Z"}
{"backend": "metal", "budget_sec": 10, "commit": "8c25d98", "correctness": false, "description": "Metal Jacobian jump-table walk with projective distinguished-point candidate flags", "distance_checksum": "0x0000000000000000", "distance_tracking": "uint64", "dp_bits": 4, "dp_checksum": "0x0000000000000000", "dp_count": 0, "dp_tracking": "projective_x_limb0", "experiment": "metal_jacobian_jump_walk_dp", "iterations": 0, "jump_count": 16, "machine": "macOS-26.5-arm64-arm-64bit-Mach-O", "max_threads_per_threadgroup": 0, "min_ms": 50, "operation": "jacobian_affine_walk_jump_table", "ops_per_sec": 0.0, "ops_per_sec_max": 0.0, "ops_per_sec_min": 0.0, "paired_baseline_ops_per_sec": 0.0, "paired_baseline_ref": "main", "paired_speedup": 0.0, "reason": "no Metal device available", "runner_sample_count": 5, "sample_count": 16384, "seconds": 0.0, "skipped": true, "status": "skip", "steps_per_sample": 8, "thread_execution_width": 0, "threadgroup_limit": 256, "threads_per_threadgroup": 0, "timestamp": "2026-06-21T11:30:24Z"}
{"backend": "metal", "budget_sec": 10, "commit": "8c25d98", "correctness": false, "description": "Metal Jacobian jump-table walk with projective distinguished-point candidate flags", "distance_checksum": "0x0000000000000000", "distance_tracking": "uint64", "dp_bits": 4, "dp_checksum": "0x0000000000000000", "dp_count": 0, "dp_tracking": "projective_x_limb0", "experiment": "metal_jacobian_jump_walk_dp", "iterations": 0, "jump_count": 16, "machine": "macOS-26.5-arm64-arm-64bit-Mach-O", "max_threads_per_threadgroup": 0, "min_ms": 50, "operation": "jacobian_affine_walk_jump_table", "ops_per_sec": 0.0, "ops_per_sec_max": 0.0, "ops_per_sec_min": 0.0, "paired_baseline_ops_per_sec": 0.0, "paired_baseline_ref": "main", "paired_speedup": 0.0, "reason": "no Metal device available", "runner_sample_count": 5, "sample_count": 16384, "seconds": 0.0, "skipped": true, "status": "skip", "steps_per_sample": 8, "thread_execution_width": 0, "threadgroup_limit": 256, "threads_per_threadgroup": 0, "timestamp": "2026-06-21T11:31:43Z"}
{"backend": "metal", "budget_sec": 10, "commit": "8c25d98", "correctness": true, "description": "Metal Jacobian jump-table walk with projective distinguished-point candidate flags", "distance_checksum": "0xa45f471493cace2f", "distance_tracking": "uint64", "dp_bits": 4, "dp_checksum": "0x30a7914972cba014", "dp_count": 1000, "dp_tracking": "projective_x_limb0", "experiment": "metal_jacobian_jump_walk_dp", "iterations": 2228224, "jump_count": 16, "machine": "macOS-26.5-arm64-arm-64bit-Mach-O", "max_threads_per_threadgroup": 1024, "min_ms": 50, "operation": "jacobian_affine_walk_jump_table", "ops_per_sec": 43098694.269856, "ops_per_sec_max": 51644618.811928, "ops_per_sec_min": 22538622.186556, "paired_baseline_ops_per_sec": 49646792.3442, "paired_baseline_ref": "main", "paired_speedup": 0.8681063213722611, "reason": "", "runner_sample_count": 5, "sample_count": 16384, "seconds": 0.0517, "skipped": false, "status": "discard", "steps_per_sample": 8, "thread_execution_width": 32, "threadgroup_limit": 256, "threads_per_threadgroup": 256, "timestamp": "2026-06-21T11:52:39Z"}
{"backend": "metal", "budget_sec": 10, "commit": "04d9064", "correctness": true, "description": "Metal Jacobian jump-table walk with projective distinguished-point candidate flags", "distance_checksum": "0xa45f471493cace2f", "distance_tracking": "uint64", "dp_bits": 4, "dp_checksum": "0x30a7914972cba014", "dp_count": 1000, "dp_tracking": "projective_x_limb0", "experiment": "metal_jacobian_jump_walk_dp", "iterations": 1835008, "jump_count": 16, "machine": "macOS-26.5-arm64-arm-64bit-Mach-O", "max_threads_per_threadgroup": 1024, "min_ms": 50, "operation": "jacobian_affine_walk_jump_table", "ops_per_sec": 35979020.969423, "ops_per_sec_max": 41339890.175541, "ops_per_sec_min": 22313362.305855, "paired_baseline_ops_per_sec": 38080155.698501, "paired_baseline_ref": "main", "paired_speedup": 0.9448233682206109, "reason": "", "runner_sample_count": 5, "sample_count": 16384, "seconds": 0.051002, "skipped": false, "status": "discard", "steps_per_sample": 8, "thread_execution_width": 32, "threadgroup_limit": 256, "threads_per_threadgroup": 256, "timestamp": "2026-06-21T12:02:07Z"}
{"backend": "metal", "budget_sec": 10, "commit": "b93fb81", "correctness": true, "description": "Metal Jacobian jump-table walk with projective distinguished-point candidate flags", "distance_checksum": "0xa45f471493cace2f", "distance_tracking": "uint64", "dp_bits": 4, "dp_checksum": "0x30a7914972cba014", "dp_count": 1000, "dp_tracking": "projective_x_limb0", "experiment": "metal_jacobian_jump_walk_dp", "iterations": 2228224, "jump_count": 16, "machine": "macOS-26.5-arm64-arm-64bit-Mach-O", "max_threads_per_threadgroup": 1024, "min_ms": 50, "operation": "jacobian_affine_walk_jump_table", "ops_per_sec": 42681923.754455, "ops_per_sec_max": 45090167.779169, "ops_per_sec_min": 19963147.863335, "paired_baseline_ops_per_sec": 25846773.075579, "paired_baseline_ref": "main", "paired_speedup": 1.6513443914119585, "reason": "", "runner_sample_count": 5, "sample_count": 16384, "seconds": 0.052205, "skipped": false, "status": "keep", "steps_per_sample": 8, "thread_execution_width": 32, "threadgroup_limit": 256, "threads_per_threadgroup": 256, "timestamp": "2026-06-21T12:19:36Z"}
{"backend": "metal", "budget_sec": 10, "commit": "b93fb81", "correctness": true, "description": "Metal Jacobian jump-table walk with projective distinguished-point candidate flags", "distance_checksum": "0xa45f471493cace2f", "distance_tracking": "uint64", "dp_bits": 4, "dp_checksum": "0x30a7914972cba014", "dp_count": 1000, "dp_tracking": "projective_x_limb0", "experiment": "metal_jacobian_jump_walk_dp", "iterations": 1048576, "jump_count": 16, "machine": "macOS-26.5-arm64-arm-64bit-Mach-O", "max_threads_per_threadgroup": 1024, "min_ms": 50, "operation": "jacobian_affine_walk_jump_table", "ops_per_sec": 20418005.034635, "ops_per_sec_max": 26092223.16503, "ops_per_sec_min": 20088913.966653, "paired_baseline_ops_per_sec": 19749595.911307, "paired_baseline_ref": "main", "paired_speedup": 1.0338441923738462, "reason": "", "runner_sample_count": 5, "sample_count": 16384, "seconds": 0.051355, "skipped": false, "status": "keep", "steps_per_sample": 8, "thread_execution_width": 32, "threadgroup_limit": 256, "threads_per_threadgroup": 256, "timestamp": "2026-06-21T12:20:34Z"}
{"backend": "metal", "budget_sec": 10, "commit": "b93fb81", "correctness": true, "description": "Metal Jacobian jump-table walk with projective distinguished-point candidate flags", "distance_checksum": "0xa45f471493cace2f", "distance_tracking": "uint64", "dp_bits": 4, "dp_checksum": "0x30a7914972cba014", "dp_count": 1000, "dp_tracking": "projective_x_limb0", "experiment": "metal_jacobian_jump_walk_dp", "iterations": 1048576, "jump_count": 16, "machine": "macOS-26.5-arm64-arm-64bit-Mach-O", "max_threads_per_threadgroup": 1024, "min_ms": 50, "operation": "jacobian_affine_walk_jump_table", "ops_per_sec": 19989883.202345, "ops_per_sec_max": 41420624.036169, "ops_per_sec_min": 19653629.373323, "paired_baseline_ops_per_sec": 38528020.636069, "paired_baseline_ref": "main", "paired_speedup": 0.518840129140477, "reason": "", "runner_sample_count": 5, "sample_count": 16384, "seconds": 0.052455, "skipped": false, "status": "discard", "steps_per_sample": 8, "thread_execution_width": 32, "threadgroup_limit": 256, "threads_per_threadgroup": 256, "timestamp": "2026-06-21T12:21:33Z"}
{"backend": "metal", "budget_sec": 10, "commit": "074d8a9", "correctness": true, "description": "Metal Jacobian jump-table walk with projective distinguished-point candidate flags", "distance_checksum": "0xa45f471493cace2f", "distance_tracking": "uint64", "dp_bits": 4, "dp_checksum": "0x30a7914972cba014", "dp_count": 1000, "dp_tracking": "projective_x_limb0", "experiment": "metal_jacobian_jump_walk_dp", "iterations": 1441792, "jump_count": 16, "machine": "macOS-26.5-arm64-arm-64bit-Mach-O", "max_threads_per_threadgroup": 1024, "min_ms": 50, "operation": "jacobian_affine_walk_jump_table", "ops_per_sec": 27479586.125938, "ops_per_sec_max": 46285097.221038, "ops_per_sec_min": 19732392.078319, "paired_baseline_ops_per_sec": 39064201.289996, "paired_baseline_ref": "main", "paired_speedup": 0.7034467675901332, "reason": "", "runner_sample_count": 5, "sample_count": 16384, "seconds": 0.052468, "skipped": false, "status": "discard", "steps_per_sample": 8, "thread_execution_width": 32, "threadgroup_limit": 256, "threads_per_threadgroup": 256, "timestamp": "2026-06-21T12:37:37Z"}
{"backend": "metal", "budget_sec": 10, "commit": "cbd1493", "correctness": true, "description": "Metal Jacobian jump-table walk with projective distinguished-point candidate flags", "distance_checksum": "0xa45f471493cace2f", "distance_tracking": "uint64", "dp_bits": 4, "dp_checksum": "0x30a7914972cba014", "dp_count": 1000, "dp_tracking": "projective_x_limb0", "experiment": "metal_jacobian_jump_walk_dp", "iterations": 1572864, "jump_count": 16, "machine": "macOS-26.5-arm64-arm-64bit-Mach-O", "max_threads_per_threadgroup": 1024, "min_ms": 50, "operation": "jacobian_affine_walk_jump_table", "ops_per_sec": 30497177.022142, "ops_per_sec_max": 46155649.289481, "ops_per_sec_min": 18735402.163826, "paired_baseline_ops_per_sec": 42867189.634848, "paired_baseline_ref": "main", "paired_speedup": 0.7114340193962692, "reason": "", "runner_sample_count": 5, "sample_count": 16384, "seconds": 0.051574, "skipped": false, "status": "discard", "steps_per_sample": 8, "thread_execution_width": 32, "threadgroup_limit": 512, "threads_per_threadgroup": 512, "timestamp": "2026-06-21T12:45:51Z"}
{"backend": "metal", "budget_sec": 10, "commit": "69a724c", "confirmation_index": 1, "confirmation_runs": 3, "confirmation_status": "discard", "correctness": true, "description": "Metal Jacobian jump-table walk with projective distinguished-point candidate flags", "distance_checksum": "0xa45f471493cace2f", "distance_tracking": "uint64", "dp_bits": 4, "dp_checksum": "0x30a7914972cba014", "dp_count": 1000, "dp_tracking": "projective_x_limb0", "experiment": "metal_jacobian_jump_walk_dp", "iterations": 2228224, "jump_count": 16, "machine": "macOS-26.5-arm64-arm-64bit-Mach-O", "max_threads_per_threadgroup": 1024, "min_ms": 50, "operation": "jacobian_affine_walk_jump_table", "ops_per_sec": 41921077.695352, "ops_per_sec_max": 58667922.335903, "ops_per_sec_min": 28759531.759193, "paired_baseline_ops_per_sec": 34056101.299761, "paired_baseline_ref": "main", "paired_speedup": 1.2309417724114593, "raw_status": "keep", "reason": "", "runner_sample_count": 5, "sample_count": 16384, "seconds": 0.053153, "skipped": false, "status": "discard", "steps_per_sample": 8, "thread_execution_width": 32, "threadgroup_limit": 256, "threads_per_threadgroup": 256, "timestamp": "2026-06-21T14:45:22Z"}
{"backend": "metal", "budget_sec": 10, "commit": "69a724c", "confirmation_index": 2, "confirmation_runs": 3, "confirmation_status": "discard", "correctness": true, "description": "Metal Jacobian jump-table walk with projective distinguished-point candidate flags", "distance_checksum": "0xa45f471493cace2f", "distance_tracking": "uint64", "dp_bits": 4, "dp_checksum": "0x30a7914972cba014", "dp_count": 1000, "dp_tracking": "projective_x_limb0", "experiment": "metal_jacobian_jump_walk_dp", "iterations": 1572864, "jump_count": 16, "machine": "macOS-26.5-arm64-arm-64bit-Mach-O", "max_threads_per_threadgroup": 1024, "min_ms": 50, "operation": "jacobian_affine_walk_jump_table", "ops_per_sec": 31295093.179597, "ops_per_sec_max": 36522809.619226, "ops_per_sec_min": 22133184.413859, "paired_baseline_ops_per_sec": 34738943.749887, "paired_baseline_ref": "main", "paired_speedup": 0.9008648450832303, "raw_status": "discard", "reason": "", "runner_sample_count": 5, "sample_count": 16384, "seconds": 0.050259, "skipped": false, "status": "discard", "steps_per_sample": 8, "thread_execution_width": 32, "threadgroup_limit": 256, "threads_per_threadgroup": 256, "timestamp": "2026-06-21T14:46:08Z"}
{"backend": "metal", "budget_sec": 10, "commit": "69a724c", "confirmation_index": 3, "confirmation_runs": 3, "confirmation_status": "discard", "correctness": true, "description": "Metal Jacobian jump-table walk with projective distinguished-point candidate flags", "distance_checksum": "0xa45f471493cace2f", "distance_tracking": "uint64", "dp_bits": 4, "dp_checksum": "0x30a7914972cba014", "dp_count": 1000, "dp_tracking": "projective_x_limb0", "experiment": "metal_jacobian_jump_walk_dp", "iterations": 2097152, "jump_count": 16, "machine": "macOS-26.5-arm64-arm-64bit-Mach-O", "max_threads_per_threadgroup": 1024, "min_ms": 50, "operation": "jacobian_affine_walk_jump_table", "ops_per_sec": 40742624.570094, "ops_per_sec_max": 57143434.661304, "ops_per_sec_min": 30894788.472611, "paired_baseline_ops_per_sec": 38913847.475444, "paired_baseline_ref": "main", "paired_speedup": 1.0469955353503408, "raw_status": "keep", "reason": "", "runner_sample_count": 5, "sample_count": 16384, "seconds": 0.051473, "skipped": false, "status": "discard", "steps_per_sample": 8, "thread_execution_width": 32, "threadgroup_limit": 256, "threads_per_threadgroup": 256, "timestamp": "2026-06-21T14:46:55Z"}
{"backend": "metal", "budget_sec": 10, "commit": "4013057", "correctness": true, "description": "Metal Jacobian jump-table walk with projective distinguished-point candidate flags", "distance_checksum": "0xa45f471493cace2f", "distance_tracking": "uint64", "dp_bits": 4, "dp_checksum": "0x30a7914972cba014", "dp_count": 1000, "dp_tracking": "projective_x_limb0", "experiment": "metal_jacobian_jump_walk_dp", "iterations": 1572864, "jump_count": 16, "machine": "macOS-26.5-arm64-arm-64bit-Mach-O", "max_threads_per_threadgroup": 1024, "min_ms": 50, "operation": "jacobian_affine_walk_jump_table", "ops_per_sec": 30095459.840316, "ops_per_sec_max": 49150909.302519, "ops_per_sec_min": 17940395.987689, "paired_baseline_ops_per_sec": 37579388.005384, "paired_baseline_ref": "main", "paired_speedup": 0.8008501851069055, "reason": "", "runner_sample_count": 5, "sample_count": 16384, "seconds": 0.052263, "skipped": false, "status": "discard", "steps_per_sample": 8, "thread_execution_width": 32, "threadgroup_limit": 256, "threads_per_threadgroup": 256, "timestamp": "2026-06-21T15:18:35Z"}
