{"affine_scan_mode": "cpu_batch_prod_zz_zzz", "affine_scan_seconds": 0.008413, "backend": "metal", "budget_sec": 180, "bytes_per_target": 2.683818, "candidate_verification": "tag16_hash_filter_then_cpu_exact_key_equality", "commit": "d636653-dirty", "cooldown_sec": 10.0, "correctness": true, "description": "Fixed-round 25M target lookup with physical distinct-miss queries; scores setup-inclusive wall-clock kangaroo distance/sec", "distance_per_sec": 513329654254.3802, "distance_tracking": "packet_distance_uint64", "dp_bits": 6, "dp_checksum": "0x7f111e78c67b5c18", "dp_count": 4121, "dp_distance_checksum": "0x894123b96acf0de5", "dp_query_count": 4121, "dp_tracking": "affine_x256_y_parity_cpu_batch", "exact_host_table_bytes": 1068595456, "experiment": "metal_jacobian_dynamic_dp_stream_xyzz_affine_scan_target_lookup_tag16_hash_filter25m_rounds_distinct_misses_distance", "filter_false_positive_count": 871, "filter_positive_count": 999, "gpu_distance_per_sec": 517277932519.16016, "gpu_lookup_lookups_per_sec": 330354258.202777, "gpu_ops_per_sec": 126290484.783804, "hit_count": 128, "injected_hits": 128, "iterations": 536870912, "jump_count": 16, "jump_histogram_max_bucket": 33562777, "jump_histogram_max_deviation_ppm": 249, "jump_histogram_min_bucket": 33546500, "jump_index": "power2_mask", "jump_mixer": "avalanche64", "jump_schedule": "power2", "lookup_buffer_seconds": 0.000977, "lookup_engine": "gpu_filter16_hash", "lookup_engine_effective": "gpu_filter16_hash", "lookup_exact_seconds": 0.000314, "lookup_gpu_seconds": 0.012774, "lookup_hash_seconds": 0.011196, "lookup_layout": "open_address_tag16_hash_filter_exact256", "lookup_max_threads_per_threadgroup": 1024, "lookup_query_mode": "distinct_misses", "lookup_repeat": 1024, "lookup_seconds": 0.024284, "lookup_thread_execution_width": 32, "lookup_threadgroup_limit": 512, "lookup_threads_per_threadgroup": 512, "lookup_wall_seconds": 0.025261, "lookups_per_sec": 173770343.019754, "machine": "macOS-26.5-arm64-arm-64bit-Mach-O", "max_threads_per_threadgroup": 1024, "mean_jump_distance": 4095.9375, "min_ms": 0, "miss_count": 4219776, "operation": "jacobian_affine_scan_target_lookup_tag32_rounds", "ops_per_sec": 440817525593.2808, "ops_per_sec_max": 446454740412.9358, "ops_per_sec_min": 439827907194.732, "output_layout": "affine_dp_scan_target_lookup", "physical_filter_positive_count": 999, "physical_query_count": 4219904, "query_count": 4219904, "query_input": "hash64", "reason": "", "repeat_positive_index_encoding": "physical_query_index", "requested_hits": 64, "round_count": 2, "round_sample_build_seconds": 0.005639, "runner_sample_count": 3, "sample_count": 131072, "seconds": 4.25108, "setup_inclusive_distance_per_sec": 446363852237.08636, "setup_inclusive_ops_per_sec": 108977212.722871, "setup_inclusive_seconds": 4.926451, "setup_inclusive_wall_distance_per_sec": 440817525593.2808, "setup_inclusive_wall_distance_per_sec_max": 446454740412.9358, "setup_inclusive_wall_distance_per_sec_min": 439827907194.732, "setup_inclusive_wall_ops_per_sec": 107623108.407607, "setup_inclusive_wall_seconds": 4.988435, "skipped": false, "state_layout": "xyzz", "status": "discard", "steps_per_sample": 2048, "target_bucket_bytes": 268435456, "target_build_seconds": 0.637035, "target_count": 25005000, "target_filter_bucket_bytes": 67108864, "target_filter_build_seconds": 0.0, "target_key": "x256_y_parity", "target_key_bytes": 800160000, "target_lookup_checksum": "0x5c90bdf7f12141b9", "target_query_hash_bytes": 33759232, "target_table_buckets": 33554432, "target_table_bytes": 67108864, "thread_execution_width": 32, "threadgroup_limit": 128, "threads_per_threadgroup": 128, "timestamp": "2026-07-01T11:56:11Z", "validation_seconds": 15.342925, "validation_workers": 8, "walk_buffer_seconds": 0.061007, "walk_wall_seconds": 4.312087}
{"affine_scan_mode": "cpu_batch_prod_zz_zzz", "affine_scan_seconds": 0.017607, "backend": "metal", "budget_sec": 240, "bytes_per_target": 2.683818, "candidate_verification": "tag16_hash_filter_then_cpu_exact_key_equality", "commit": "6d12de4-dirty", "cooldown_sec": 10.0, "correctness": true, "description": "Fixed-round 25M target lookup with physical distinct-miss queries; scores setup-inclusive wall-clock kangaroo distance/sec", "distance_per_sec": 513752356667.7422, "distance_tracking": "packet_distance_uint64", "dp_bits": 6, "dp_checksum": "0x7f111e78c67b5c18", "dp_count": 4121, "dp_distance_checksum": "0x894123b96acf0de5", "dp_query_count": 4121, "dp_tracking": "affine_x256_y_parity_cpu_batch", "exact_host_table_bytes": 1068595456, "experiment": "metal_jacobian_dynamic_dp_stream_xyzz_affine_scan_target_lookup_tag16_hash_filter25m_rounds_distinct_misses_distance", "filter_false_positive_count": 883, "filter_positive_count": 1011, "gpu_distance_per_sec": 522414032097.498, "gpu_lookup_lookups_per_sec": 186982380.453286, "gpu_ops_per_sec": 127544434.478675, "hit_count": 128, "injected_hits": 128, "iterations": 536870912, "jump_count": 16, "jump_histogram_max_bucket": 33562777, "jump_histogram_max_deviation_ppm": 249, "jump_histogram_min_bucket": 33546500, "jump_index": "power2_mask", "jump_mixer": "avalanche64", "jump_schedule": "power2", "lookup_buffer_seconds": 0.0014, "lookup_engine": "gpu_filter16_hash", "lookup_engine_effective": "gpu_filter16_hash", "lookup_exact_seconds": 0.000685, "lookup_gpu_seconds": 0.022568, "lookup_hash_seconds": 0.030106, "lookup_layout": "open_address_tag16_hash_filter_exact256", "lookup_max_threads_per_threadgroup": 1024, "lookup_query_mode": "distinct_misses", "lookup_repeat": 1024, "lookup_seconds": 0.05336, "lookup_thread_execution_width": 32, "lookup_threadgroup_limit": 512, "lookup_threads_per_threadgroup": 512, "lookup_wall_seconds": 0.054759, "lookups_per_sec": 79084276.202084, "machine": "macOS-26.5-arm64-arm-64bit-Mach-O", "max_threads_per_threadgroup": 1024, "mean_jump_distance": 4095.9375, "min_ms": 0, "miss_count": 4219776, "operation": "jacobian_affine_scan_target_lookup_tag32_rounds", "ops_per_sec": 399396664598.7855, "ops_per_sec_max": 414791012917.60876, "ops_per_sec_min": 284047458777.6462, "output_layout": "affine_dp_scan_target_lookup", "paired_baseline_ops_per_sec": 421792537649.22284, "paired_baseline_ref": "6d12de4", "paired_order": "alternate", "paired_speedup": 0.9469031074488509, "physical_filter_positive_count": 1011, "physical_query_count": 4219904, "query_count": 4219904, "query_input": "hash64", "reason": "", "repeat_positive_index_encoding": "physical_query_index", "requested_hits": 64, "round_count": 2, "round_sample_build_seconds": 0.005601, "runner_sample_count": 3, "sample_count": 131072, "seconds": 4.209285, "setup_inclusive_distance_per_sec": 404054572587.17523, "setup_inclusive_ops_per_sec": 98647641.129088, "setup_inclusive_seconds": 5.442309, "setup_inclusive_wall_distance_per_sec": 399396664598.7855, "setup_inclusive_wall_distance_per_sec_max": 414791012917.60876, "setup_inclusive_wall_distance_per_sec_min": 284047458777.6462, "setup_inclusive_wall_ops_per_sec": 97510439.209286, "setup_inclusive_wall_seconds": 5.505779, "skipped": false, "state_layout": "xyzz", "status": "discard", "steps_per_sample": 2048, "target_bucket_bytes": 268435456, "target_build_seconds": 1.156456, "target_count": 25005000, "target_filter_bucket_bytes": 67108864, "target_filter_build_seconds": 0.0, "target_key": "x256_y_parity", "target_key_bytes": 800160000, "target_lookup_checksum": "0x5c90bdf7f12141b9", "target_query_hash_bytes": 33759232, "target_table_buckets": 33554432, "target_table_bytes": 67108864, "thread_execution_width": 32, "threadgroup_limit": 128, "threads_per_threadgroup": 128, "timestamp": "2026-07-01T12:11:50Z", "validation_seconds": 25.869212, "validation_workers": 8, "walk_buffer_seconds": 0.06207, "walk_wall_seconds": 4.271356}
{"all_keys_found": true, "backend": "macos_cpu", "budget_sec": 120, "build_seconds": 0.57896, "candidate_verification": "xonly_parity_tag32_prefilter_semantic_find_all_keys", "checksum": "0xcb087e356daf9f55", "commit": "f3617d3-dirty", "cooldown_sec": 5.0, "correctness": true, "description": "Host setup benchmark for the x-only parity tag32 builder used by fixed-round distinct-miss lookup", "experiment": "target_lookup_tag32_parity_parallel_insert", "injected_count": 128, "iterations": 1, "lookup_layout": "open_address_tag32_parity_xonly_tag16_filter_exact256", "machine": "macOS-26.5-arm64-arm-64bit-Mach-O", "min_ms": 0, "operation": "target_lookup_tag32_parity_parallel_insert_probe", "ops_per_sec": 43189537.070119, "ops_per_sec_max": 48326754.96132, "ops_per_sec_min": 41550374.844451, "parallel_targets_per_sec": 43189537.070119, "parallel_targets_per_sec_max": 48326754.96132, "parallel_targets_per_sec_min": 41550374.844451, "reason": "", "runner_sample_count": 3, "sample_count": 25005000, "seconds": 0.57896, "semantic_checksum": "0x388d492ffb8b482f", "setup_phase": "host_tag32_parity_parallel_insert_probe", "skipped": false, "status": "keep", "target_bucket_bytes": 268435456, "target_count": 25005000, "target_filter_bucket_bytes": 67108864, "target_key": "x256_y_parity", "target_table_buckets": 33554432, "target_table_bytes": 1135704320, "target_x_key_bytes": 800160000, "timestamp": "2026-07-01T15:29:09Z"}
{"all_keys_found": true, "backend": "macos_cpu", "budget_sec": 120, "build_seconds": 0.567892, "candidate_verification": "xonly_parity_tag32_prefilter_semantic_find_all_keys", "checksum": "0x7d81c0577b28437f", "commit": "79a93be-dirty", "cooldown_sec": 5.0, "correctness": true, "description": "Host setup benchmark for the x-only parity tag32 builder used by fixed-round distinct-miss lookup", "experiment": "target_lookup_tag32_parity_parallel_insert", "injected_count": 128, "iterations": 1, "lookup_layout": "open_address_tag32_parity_xonly_tag16_filter_exact256", "machine": "macOS-26.5-arm64-arm-64bit-Mach-O", "min_ms": 0, "operation": "target_lookup_tag32_parity_parallel_insert_probe", "ops_per_sec": 44031285.361388, "ops_per_sec_max": 48103910.541278, "ops_per_sec_min": 43478752.270224, "parallel_targets_per_sec": 44031285.361388, "parallel_targets_per_sec_max": 48103910.541278, "parallel_targets_per_sec_min": 43478752.270224, "reason": "", "runner_sample_count": 3, "sample_count": 25005000, "seconds": 0.567892, "semantic_checksum": "0x388d492ffb8b482f", "setup_phase": "host_tag32_parity_parallel_insert_probe", "skipped": false, "status": "keep", "target_bucket_bytes": 268435456, "target_count": 25005000, "target_filter_bucket_bytes": 67108864, "target_key": "x256_y_parity", "target_table_buckets": 33554432, "target_table_bytes": 1135704320, "target_x_key_bytes": 800160000, "timestamp": "2026-07-01T15:33:05Z"}
{"all_keys_found": true, "backend": "macos_cpu", "budget_sec": 180, "build_seconds": 1.24388, "candidate_verification": "xonly_parity_tag32_prefilter_semantic_find_all_keys", "checksum": "0x06ebe38700c64f2b", "commit": "79a93be-dirty", "cooldown_sec": 5.0, "correctness": true, "description": "Host setup benchmark for the x-only parity tag32 builder used by fixed-round distinct-miss lookup", "experiment": "target_lookup_tag32_parity_parallel_insert", "injected_count": 128, "iterations": 1, "lookup_layout": "open_address_tag32_parity_xonly_tag16_filter_exact256", "machine": "macOS-26.5-arm64-arm-64bit-Mach-O", "min_ms": 0, "operation": "target_lookup_tag32_parity_parallel_insert_probe", "ops_per_sec": 20102413.374918, "ops_per_sec_max": 26335868.886473, "ops_per_sec_min": 15210748.016136, "paired_baseline_ops_per_sec": 19226470.622761, "paired_baseline_ref": "79a93be", "paired_order": "alternate", "paired_speedup": 1.0455592068530781, "parallel_targets_per_sec": 20102413.374918, "parallel_targets_per_sec_max": 26335868.886473, "parallel_targets_per_sec_min": 15210748.016136, "reason": "", "runner_sample_count": 3, "sample_count": 25005000, "seconds": 1.24388, "semantic_checksum": "0x388d492ffb8b482f", "setup_phase": "host_tag32_parity_parallel_insert_probe", "skipped": false, "status": "keep", "target_bucket_bytes": 268435456, "target_count": 25005000, "target_filter_bucket_bytes": 67108864, "target_key": "x256_y_parity", "target_table_buckets": 33554432, "target_table_bytes": 1135704320, "target_x_key_bytes": 800160000, "timestamp": "2026-07-01T15:35:16Z"}
{"affine_scan_mode": "cpu_batch_prod_zz_zzz", "affine_scan_seconds": 0.014286, "backend": "metal", "budget_sec": 240, "bytes_per_target": 2.683818, "candidate_verification": "tag16_hash_filter_then_cpu_exact_key_equality", "commit": "79a93be-dirty", "cooldown_sec": 10.0, "correctness": true, "description": "Fixed-round 25M target lookup with physical distinct-miss queries; scores setup-inclusive wall-clock kangaroo distance/sec", "distance_per_sec": 198586917503.68558, "distance_tracking": "packet_distance_uint64", "dp_bits": 6, "dp_checksum": "0x7f111e78c67b5c18", "dp_count": 4121, "dp_distance_checksum": "0x894123b96acf0de5", "dp_query_count": 4121, "dp_tracking": "affine_x256_y_parity_cpu_batch", "exact_host_table_bytes": 1068595456, "experiment": "metal_jacobian_dynamic_dp_stream_xyzz_affine_scan_target_lookup_tag16_hash_filter25m_rounds_distinct_misses_distance", "filter_false_positive_count": 883, "filter_positive_count": 1011, "gpu_distance_per_sec": 199612338978.2048, "gpu_lookup_lookups_per_sec": 166534619.86227, "gpu_ops_per_sec": 48734224.821107, "hit_count": 128, "injected_hits": 128, "iterations": 536870912, "jump_count": 16, "jump_histogram_max_bucket": 33562777, "jump_histogram_max_deviation_ppm": 249, "jump_histogram_min_bucket": 33546500, "jump_index": "power2_mask", "jump_mixer": "avalanche64", "jump_schedule": "power2", "lookup_buffer_seconds": 0.001966, "lookup_engine": "gpu_filter16_hash", "lookup_engine_effective": "gpu_filter16_hash", "lookup_exact_seconds": 0.00046, "lookup_gpu_seconds": 0.02534, "lookup_hash_seconds": 0.016798, "lookup_layout": "open_address_tag16_hash_filter_exact256", "lookup_max_threads_per_threadgroup": 1024, "lookup_query_mode": "distinct_misses", "lookup_repeat": 1024, "lookup_seconds": 0.042597, "lookup_thread_execution_width": 32, "lookup_threadgroup_limit": 512, "lookup_threads_per_threadgroup": 512, "lookup_wall_seconds": 0.044564, "lookups_per_sec": 99064688.342091, "machine": "macOS-26.5-arm64-arm-64bit-Mach-O", "max_threads_per_threadgroup": 1024, "mean_jump_distance": 4095.9375, "min_ms": 0, "miss_count": 4219776, "operation": "jacobian_affine_scan_target_lookup_tag32_rounds", "ops_per_sec": 178099044881.70877, "ops_per_sec_max": 178300702325.59622, "ops_per_sec_min": 46003529738.20678, "output_layout": "affine_dp_scan_target_lookup", "paired_baseline_ops_per_sec": 117545776027.99529, "paired_baseline_ref": "79a93be", "paired_order": "alternate", "paired_speedup": 1.5151462766241113, "physical_filter_positive_count": 1011, "physical_query_count": 4219904, "query_count": 4219904, "query_input": "hash64", "reason": "", "repeat_positive_index_encoding": "physical_query_index", "requested_hits": 64, "round_count": 2, "round_sample_build_seconds": 0.006568, "runner_sample_count": 3, "sample_count": 131072, "seconds": 11.016301, "setup_inclusive_distance_per_sec": 179309137859.17545, "setup_inclusive_ops_per_sec": 43777312.973935, "setup_inclusive_seconds": 12.263679, "setup_inclusive_wall_distance_per_sec": 178099044881.70877, "setup_inclusive_wall_distance_per_sec_max": 178300702325.59622, "setup_inclusive_wall_distance_per_sec_min": 46003529738.20678, "setup_inclusive_wall_ops_per_sec": 43481875.610091, "setup_inclusive_wall_seconds": 12.347004, "skipped": false, "state_layout": "xyzz", "status": "keep", "steps_per_sample": 2048, "target_bucket_bytes": 268435456, "target_build_seconds": 1.183925, "target_count": 25005000, "target_filter_bucket_bytes": 67108864, "target_filter_build_seconds": 0.0, "target_key": "x256_y_parity", "target_key_bytes": 800160000, "target_lookup_checksum": "0x5c90bdf7f12141b9", "target_query_hash_bytes": 33759232, "target_table_buckets": 33554432, "target_table_bytes": 67108864, "thread_execution_width": 32, "threadgroup_limit": 128, "threads_per_threadgroup": 128, "timestamp": "2026-07-01T16:04:25Z", "validation_seconds": 55.320304, "validation_workers": 8, "walk_buffer_seconds": 0.081359, "walk_wall_seconds": 11.097661}
{"affine_scan_mode": "cpu_batch_prod_zz_zzz", "affine_scan_seconds": 0.067678, "backend": "metal", "budget_sec": 240, "bytes_per_target": 2.683818, "candidate_verification": "tag16_hash_filter_then_cpu_exact_key_equality", "commit": "6799fb3-dirty", "cooldown_sec": 10.0, "correctness": true, "description": "Fixed-round 25M target lookup with physical distinct-miss queries; scores setup-inclusive wall-clock kangaroo distance/sec", "distance_per_sec": 149521586134.30728, "distance_tracking": "packet_distance_uint64", "distinct_miss_source_seconds": 0.242052, "dp_bits": 6, "dp_checksum": "0x7f111e78c67b5c18", "dp_count": 4121, "dp_distance_checksum": "0x894123b96acf0de5", "dp_query_count": 4121, "dp_tracking": "affine_x256_y_parity_cpu_batch", "exact_host_table_bytes": 1068595456, "experiment": "metal_jacobian_dynamic_dp_stream_xyzz_affine_scan_target_lookup_tag16_hash_filter25m_rounds_distinct_misses_distance", "filter_false_positive_count": 883, "filter_positive_count": 1011, "gpu_distance_per_sec": 150749162741.0388, "gpu_lookup_lookups_per_sec": 148645957.747165, "gpu_ops_per_sec": 36804556.402787, "hit_count": 128, "injected_hits": 128, "iterations": 536870912, "jump_count": 16, "jump_histogram_max_bucket": 33562777, "jump_histogram_max_deviation_ppm": 249, "jump_histogram_min_bucket": 33546500, "jump_index": "power2_mask", "jump_mixer": "avalanche64", "jump_schedule": "power2", "lookup_buffer_seconds": 0.003094, "lookup_engine": "gpu_filter16_hash", "lookup_engine_effective": "gpu_filter16_hash", "lookup_exact_seconds": 0.000517, "lookup_gpu_seconds": 0.028389, "lookup_hash_seconds": 0.023176, "lookup_layout": "open_address_tag16_hash_filter_exact256", "lookup_max_threads_per_threadgroup": 1024, "lookup_query_mode": "distinct_misses", "lookup_repeat": 1024, "lookup_seconds": 0.052082, "lookup_thread_execution_width": 32, "lookup_threadgroup_limit": 512, "lookup_threads_per_threadgroup": 512, "lookup_wall_seconds": 0.055176, "lookups_per_sec": 81023582.296497, "machine": "macOS-26.5-arm64-arm-64bit-Mach-O", "max_threads_per_threadgroup": 1024, "mean_jump_distance": 4095.9375, "min_ms": 0, "miss_count": 4219776, "operation": "jacobian_affine_scan_target_lookup_tag32_rounds", "ops_per_sec": 134904859680.91953, "ops_per_sec_max": 183158507543.0746, "ops_per_sec_min": 127661556301.13281, "output_layout": "affine_dp_scan_target_lookup", "physical_filter_positive_count": 1011, "physical_query_count": 4219904, "query_count": 4219904, "query_input": "hash64", "reason": "", "repeat_positive_index_encoding": "physical_query_index", "requested_hits": 64, "round_count": 2, "round_sample_build_seconds": 0.002756, "runner_sample_count": 3, "sample_count": 131072, "seconds": 14.587077, "setup_inclusive_distance_per_sec": 135611000053.90475, "setup_inclusive_ops_per_sec": 33108659.508087, "setup_inclusive_seconds": 16.215423, "setup_inclusive_wall_distance_per_sec": 134904859680.91953, "setup_inclusive_wall_distance_per_sec_max": 183158507543.0746, "setup_inclusive_wall_distance_per_sec_min": 127661556301.13281, "setup_inclusive_wall_ops_per_sec": 32936259.325471, "setup_inclusive_wall_seconds": 16.3003, "skipped": false, "state_layout": "xyzz", "status": "discard", "steps_per_sample": 2048, "target_bucket_bytes": 268435456, "target_build_seconds": 1.263777, "target_count": 25005000, "target_filter_bucket_bytes": 67108864, "target_filter_build_seconds": 0.0, "target_key": "x256_y_parity", "target_key_bytes": 800160000, "target_lookup_checksum": "0x5c90bdf7f12141b9", "target_query_hash_bytes": 33759232, "target_table_buckets": 33554432, "target_table_bytes": 67108864, "thread_execution_width": 32, "threadgroup_limit": 128, "threads_per_threadgroup": 128, "timestamp": "2026-07-01T22:09:11Z", "validation_seconds": 47.48724, "validation_workers": 8, "walk_buffer_seconds": 0.081784, "walk_wall_seconds": 14.668861}
