{"affine_scan_mode": "cpu_batch_prod_zz_zzz", "affine_scan_seconds": 0.004523, "backend": "metal", "budget_sec": 540, "bytes_per_target": 2.683818, "candidate_verification": "tag16_hash_filter_then_cpu_exact_key_equality", "commit": "1e2ab9a-dirty", "confirmation_index": 1, "confirmation_runs": 2, "confirmation_status": "discard", "cooldown_sec": 10.0, "correctness": true, "description": "Metal XYZZ 4096-step dp5 affine-scan target lookup versus accepted 2048-step dp6 setup gate", "distance_tracking": "packet_distance_uint64", "dp_bits": 5, "dp_checksum": "0x1277ccb107e05a36", "dp_count": 2112, "dp_distance_checksum": "0xb75d72c71a05e4ad", "dp_query_count": 2112, "dp_tracking": "affine_x256_y_parity_cpu_batch", "exact_host_table_bytes": 1268635456, "experiment": "metal_jacobian_dynamic_dp_stream_xyzz_affine_scan_target_lookup_tag16_hash_filter25m_steps4096_dp5_setup", "filter_false_positive_count": 0, "filter_positive_count": 65536, "gpu_lookup_lookups_per_sec": 167726619.681444, "gpu_ops_per_sec": 112912546.604828, "hit_count": 65536, "injected_hits": 64, "iterations": 268435456, "jump_count": 16, "jump_histogram_max_bucket": 16783784, "jump_histogram_max_deviation_ppm": 391, "jump_histogram_min_bucket": 16771114, "jump_index": "power2_mask", "jump_mixer": "avalanche64", "jump_schedule": "power2", "lookup_engine": "gpu_filter16_hash_repeat", "lookup_engine_effective": "gpu_filter16_hash_repeat", "lookup_exact_seconds": 0.001542, "lookup_gpu_seconds": 0.012894, "lookup_hash_seconds": 1.3e-05, "lookup_layout": "open_address_tag16_hash_filter_exact256", "lookup_max_threads_per_threadgroup": 1024, "lookup_query_mode": "repeat", "lookup_repeat": 1024, "lookup_seconds": 0.01445, "lookup_thread_execution_width": 32, "lookup_threadgroup_limit": 512, "lookup_threads_per_threadgroup": 512, "lookups_per_sec": 149667424.638881, "machine": "macOS-26.5-arm64-arm-64bit-Mach-O", "max_threads_per_threadgroup": 1024, "min_ms": 500, "miss_count": 2097152, "operation": "jacobian_affine_scan_target_lookup_tag32", "ops_per_sec": 75314077.842822, "ops_per_sec_max": 82622791.486586, "ops_per_sec_min": 69998753.800823, "output_layout": "affine_dp_scan_target_lookup", "paired_baseline_ops_per_sec": 78564303.900017, "paired_baseline_ref": "main", "paired_order": "alternate", "paired_speedup": 0.9586297351869709, "query_count": 2162688, "query_input": "hash64_repeat_indexed", "raw_status": "discard", "reason": "", "repeat_positive_index_encoding": "packed16_base_repeat", "requested_hits": 64, "runner_sample_count": 3, "sample_count": 65536, "seconds": 2.377375, "setup_inclusive_ops_per_sec": 75314077.842822, "setup_inclusive_ops_per_sec_max": 82622791.486586, "setup_inclusive_ops_per_sec_min": 69998753.800823, "setup_inclusive_seconds": 3.564214, "skipped": false, "state_layout": "xyzz", "status": "discard", "steps_per_sample": 4096, "target_bucket_bytes": 268435456, "target_build_seconds": 1.130569, "target_count": 25005000, "target_filter_bucket_bytes": 67108864, "target_filter_build_seconds": 0.037296, "target_key": "x256_y_parity", "target_key_bytes": 1000200000, "target_lookup_checksum": "0x7714f2accdb9fd49", "target_query_hash_bytes": 16896, "target_table_buckets": 33554432, "target_table_bytes": 67108864, "thread_execution_width": 32, "threadgroup_limit": 128, "threads_per_threadgroup": 128, "timestamp": "2026-06-29T15:06:19Z", "validation_seconds": 10.680076, "validation_workers": 8}
{"affine_scan_mode": "cpu_batch_prod_zz_zzz", "affine_scan_seconds": 0.008791, "backend": "metal", "budget_sec": 540, "bytes_per_target": 2.683818, "candidate_verification": "tag16_hash_filter_then_cpu_exact_key_equality", "commit": "1e2ab9a-dirty", "confirmation_index": 2, "confirmation_runs": 2, "confirmation_status": "discard", "cooldown_sec": 10.0, "correctness": true, "description": "Metal XYZZ 4096-step dp5 affine-scan target lookup versus accepted 2048-step dp6 setup gate", "distance_tracking": "packet_distance_uint64", "dp_bits": 5, "dp_checksum": "0x1277ccb107e05a36", "dp_count": 2112, "dp_distance_checksum": "0xb75d72c71a05e4ad", "dp_query_count": 2112, "dp_tracking": "affine_x256_y_parity_cpu_batch", "exact_host_table_bytes": 1268635456, "experiment": "metal_jacobian_dynamic_dp_stream_xyzz_affine_scan_target_lookup_tag16_hash_filter25m_steps4096_dp5_setup", "filter_false_positive_count": 0, "filter_positive_count": 65536, "gpu_lookup_lookups_per_sec": 251950187.050199, "gpu_ops_per_sec": 81460295.275767, "hit_count": 65536, "injected_hits": 64, "iterations": 268435456, "jump_count": 16, "jump_histogram_max_bucket": 16783784, "jump_histogram_max_deviation_ppm": 391, "jump_histogram_min_bucket": 16771114, "jump_index": "power2_mask", "jump_mixer": "avalanche64", "jump_schedule": "power2", "lookup_engine": "gpu_filter16_hash_repeat", "lookup_engine_effective": "gpu_filter16_hash_repeat", "lookup_exact_seconds": 0.001876, "lookup_gpu_seconds": 0.008584, "lookup_hash_seconds": 1.8e-05, "lookup_layout": "open_address_tag16_hash_filter_exact256", "lookup_max_threads_per_threadgroup": 1024, "lookup_query_mode": "repeat", "lookup_repeat": 1024, "lookup_seconds": 0.010478, "lookup_thread_execution_width": 32, "lookup_threadgroup_limit": 512, "lookup_threads_per_threadgroup": 512, "lookups_per_sec": 206399478.687396, "machine": "macOS-26.5-arm64-arm-64bit-Mach-O", "max_threads_per_threadgroup": 1024, "min_ms": 500, "miss_count": 2097152, "operation": "jacobian_affine_scan_target_lookup_tag32", "ops_per_sec": 64790787.951621, "ops_per_sec_max": 82067934.364152, "ops_per_sec_min": 38087621.955366, "output_layout": "affine_dp_scan_target_lookup", "paired_baseline_ops_per_sec": 63073497.832969, "paired_baseline_ref": "main", "paired_order": "alternate", "paired_speedup": 1.0272268096372223, "query_count": 2162688, "query_input": "hash64_repeat_indexed", "raw_status": "keep", "reason": "", "repeat_positive_index_encoding": "packed16_base_repeat", "requested_hits": 64, "runner_sample_count": 3, "sample_count": 65536, "seconds": 3.295292, "setup_inclusive_ops_per_sec": 64790787.951621, "setup_inclusive_ops_per_sec_max": 82067934.364152, "setup_inclusive_ops_per_sec_min": 38087621.955366, "setup_inclusive_seconds": 4.143111, "skipped": false, "state_layout": "xyzz", "status": "discard", "steps_per_sample": 4096, "target_bucket_bytes": 268435456, "target_build_seconds": 0.793914, "target_count": 25005000, "target_filter_bucket_bytes": 67108864, "target_filter_build_seconds": 0.034636, "target_key": "x256_y_parity", "target_key_bytes": 1000200000, "target_lookup_checksum": "0x7714f2accdb9fd49", "target_query_hash_bytes": 16896, "target_table_buckets": 33554432, "target_table_bytes": 67108864, "thread_execution_width": 32, "threadgroup_limit": 128, "threads_per_threadgroup": 128, "timestamp": "2026-06-29T15:06:19Z", "validation_seconds": 12.341078, "validation_workers": 8}
{"affine_scan_mode": "cpu_batch_prod_zz_zzz", "affine_scan_seconds": 0.002824, "backend": "metal", "budget_sec": 540, "bytes_per_target": 2.683818, "candidate_verification": "tag16_hash_filter_then_cpu_exact_key_equality", "commit": "6c6f1f3-dirty", "confirmation_index": 1, "confirmation_runs": 2, "confirmation_status": "discard", "cooldown_sec": 10.0, "correctness": true, "description": "Metal XYZZ 2048-step dp6 repeat-mode target lookup with cached exact resolver versus same command on the paired baseline", "distance_tracking": "packet_distance_uint64", "dp_bits": 6, "dp_checksum": "0x54ccada61fd1edbc", "dp_count": 2087, "dp_distance_checksum": "0xf31d7766e1607041", "dp_query_count": 2087, "dp_tracking": "affine_x256_y_parity_cpu_batch", "exact_host_table_bytes": 1268635456, "experiment": "metal_jacobian_dynamic_dp_stream_xyzz_affine_scan_target_lookup_tag16_hash_filter25m_repeat_resolver_cache", "filter_false_positive_count": 0, "filter_positive_count": 65536, "gpu_lookup_lookups_per_sec": 40500975.48941, "gpu_ops_per_sec": 121773533.355848, "hit_count": 65536, "injected_hits": 64, "iterations": 268435456, "jump_count": 16, "jump_histogram_max_bucket": 16782260, "jump_histogram_max_deviation_ppm": 346, "jump_histogram_min_bucket": 16771410, "jump_index": "power2_mask", "jump_mixer": "avalanche64", "jump_schedule": "power2", "lookup_engine": "gpu_filter16_hash_repeat", "lookup_engine_effective": "gpu_filter16_hash_repeat", "lookup_exact_seconds": 0.001287, "lookup_gpu_seconds": 0.052766, "lookup_hash_seconds": 1.7e-05, "lookup_layout": "open_address_tag16_hash_filter_exact256", "lookup_max_threads_per_threadgroup": 1024, "lookup_query_mode": "repeat", "lookup_repeat": 1024, "lookup_seconds": 0.05407, "lookup_thread_execution_width": 32, "lookup_threadgroup_limit": 512, "lookup_threads_per_threadgroup": 512, "lookups_per_sec": 39524132.761662, "machine": "macOS-26.5-arm64-arm-64bit-Mach-O", "max_threads_per_threadgroup": 1024, "min_ms": 500, "miss_count": 2071552, "operation": "jacobian_affine_scan_target_lookup_tag32", "ops_per_sec": 118709682.938361, "ops_per_sec_max": 121961409.298444, "ops_per_sec_min": 60939933.568582, "output_layout": "affine_dp_scan_target_lookup", "paired_baseline_ops_per_sec": 120531346.046534, "paired_baseline_ref": "HEAD", "paired_order": "alternate", "paired_speedup": 0.984886395382412, "query_count": 2137088, "query_input": "hash64_repeat_indexed", "raw_status": "discard", "reason": "", "repeat_positive_index_encoding": "packed16_base_repeat", "requested_hits": 64, "runner_sample_count": 3, "sample_count": 131072, "seconds": 2.204383, "setup_inclusive_ops_per_sec": 88438008.478665, "setup_inclusive_seconds": 3.035295, "skipped": false, "state_layout": "xyzz", "status": "discard", "steps_per_sample": 2048, "target_bucket_bytes": 268435456, "target_build_seconds": 0.755261, "target_count": 25005000, "target_filter_bucket_bytes": 67108864, "target_filter_build_seconds": 0.018757, "target_key": "x256_y_parity", "target_key_bytes": 1000200000, "target_lookup_checksum": "0x197ac7fed54a4156", "target_query_hash_bytes": 16696, "target_table_buckets": 33554432, "target_table_bytes": 67108864, "thread_execution_width": 32, "threadgroup_limit": 128, "threads_per_threadgroup": 128, "timestamp": "2026-06-29T15:22:18Z", "validation_seconds": 7.744608, "validation_workers": 8}
{"affine_scan_mode": "cpu_batch_prod_zz_zzz", "affine_scan_seconds": 0.009, "backend": "metal", "budget_sec": 540, "bytes_per_target": 2.683818, "candidate_verification": "tag16_hash_filter_then_cpu_exact_key_equality", "commit": "6c6f1f3-dirty", "confirmation_index": 2, "confirmation_runs": 2, "confirmation_status": "discard", "cooldown_sec": 10.0, "correctness": true, "description": "Metal XYZZ 2048-step dp6 repeat-mode target lookup with cached exact resolver versus same command on the paired baseline", "distance_tracking": "packet_distance_uint64", "dp_bits": 6, "dp_checksum": "0x54ccada61fd1edbc", "dp_count": 2087, "dp_distance_checksum": "0xf31d7766e1607041", "dp_query_count": 2087, "dp_tracking": "affine_x256_y_parity_cpu_batch", "exact_host_table_bytes": 1268635456, "experiment": "metal_jacobian_dynamic_dp_stream_xyzz_affine_scan_target_lookup_tag16_hash_filter25m_repeat_resolver_cache", "filter_false_positive_count": 0, "filter_positive_count": 65536, "gpu_lookup_lookups_per_sec": 37912077.511732, "gpu_ops_per_sec": 43624560.022069, "hit_count": 65536, "injected_hits": 64, "iterations": 268435456, "jump_count": 16, "jump_histogram_max_bucket": 16782260, "jump_histogram_max_deviation_ppm": 346, "jump_histogram_min_bucket": 16771410, "jump_index": "power2_mask", "jump_mixer": "avalanche64", "jump_schedule": "power2", "lookup_engine": "gpu_filter16_hash_repeat", "lookup_engine_effective": "gpu_filter16_hash_repeat", "lookup_exact_seconds": 0.003993, "lookup_gpu_seconds": 0.05637, "lookup_hash_seconds": 7.4e-05, "lookup_layout": "open_address_tag16_hash_filter_exact256", "lookup_max_threads_per_threadgroup": 1024, "lookup_query_mode": "repeat", "lookup_repeat": 1024, "lookup_seconds": 0.060437, "lookup_thread_execution_width": 32, "lookup_threadgroup_limit": 512, "lookup_threads_per_threadgroup": 512, "lookups_per_sec": 35360810.358964, "machine": "macOS-26.5-arm64-arm-64bit-Mach-O", "max_threads_per_threadgroup": 1024, "min_ms": 500, "miss_count": 2071552, "operation": "jacobian_affine_scan_target_lookup_tag32", "ops_per_sec": 43137775.235818, "ops_per_sec_max": 117818402.833612, "ops_per_sec_min": 31465762.390271, "output_layout": "affine_dp_scan_target_lookup", "paired_baseline_ops_per_sec": 60204961.635386, "paired_baseline_ref": "HEAD", "paired_order": "alternate", "paired_speedup": 0.7165152848542534, "query_count": 2137088, "query_input": "hash64_repeat_indexed", "raw_status": "discard", "reason": "", "repeat_positive_index_encoding": "packed16_base_repeat", "requested_hits": 64, "runner_sample_count": 3, "sample_count": 131072, "seconds": 6.15331, "setup_inclusive_ops_per_sec": 34383126.049805, "setup_inclusive_seconds": 7.807186, "skipped": false, "state_layout": "xyzz", "status": "discard", "steps_per_sample": 2048, "target_bucket_bytes": 268435456, "target_build_seconds": 1.540034, "target_count": 25005000, "target_filter_bucket_bytes": 67108864, "target_filter_build_seconds": 0.044404, "target_key": "x256_y_parity", "target_key_bytes": 1000200000, "target_lookup_checksum": "0x197ac7fed54a4156", "target_query_hash_bytes": 16696, "target_table_buckets": 33554432, "target_table_bytes": 67108864, "thread_execution_width": 32, "threadgroup_limit": 128, "threads_per_threadgroup": 128, "timestamp": "2026-06-29T15:22:18Z", "validation_seconds": 12.913453, "validation_workers": 8}
{"affine_scan_mode": "cpu_batch_prod_zz_zzz", "affine_scan_seconds": 0.003159, "backend": "metal", "budget_sec": 420, "bytes_per_target": 2.683818, "candidate_verification": "tag16_hash_filter_then_cpu_exact_key_equality", "commit": "6c6f1f3-dirty", "cooldown_sec": 10.0, "correctness": true, "description": "Metal XYZZ 2048-step dp6 repeat4096 target lookup with cached exact resolver versus same command on the paired baseline", "distance_tracking": "packet_distance_uint64", "dp_bits": 6, "dp_checksum": "0x54ccada61fd1edbc", "dp_count": 2087, "dp_distance_checksum": "0xf31d7766e1607041", "dp_query_count": 2087, "dp_tracking": "affine_x256_y_parity_cpu_batch", "exact_host_table_bytes": 1268635456, "experiment": "metal_jacobian_dynamic_dp_stream_xyzz_affine_scan_target_lookup_tag16_hash_filter25m_repeat4096_resolver_cache", "filter_false_positive_count": 0, "filter_positive_count": 262144, "gpu_lookup_lookups_per_sec": 241543404.449697, "gpu_ops_per_sec": 117610141.982507, "hit_count": 262144, "injected_hits": 64, "iterations": 268435456, "jump_count": 16, "jump_histogram_max_bucket": 16782260, "jump_histogram_max_deviation_ppm": 346, "jump_histogram_min_bucket": 16771410, "jump_index": "power2_mask", "jump_mixer": "avalanche64", "jump_schedule": "power2", "lookup_engine": "gpu_filter16_hash_repeat", "lookup_engine_effective": "gpu_filter16_hash_repeat", "lookup_exact_seconds": 0.005621, "lookup_gpu_seconds": 0.035391, "lookup_hash_seconds": 0.000241, "lookup_layout": "open_address_tag16_hash_filter_exact256", "lookup_max_threads_per_threadgroup": 1024, "lookup_query_mode": "repeat", "lookup_repeat": 4096, "lookup_seconds": 0.041252, "lookup_thread_execution_width": 32, "lookup_threadgroup_limit": 512, "lookup_threads_per_threadgroup": 512, "lookups_per_sec": 207220633.884313, "lookups_per_sec_max": 211163185.565372, "lookups_per_sec_min": 61921732.83427, "machine": "macOS-26.5-arm64-arm-64bit-Mach-O", "max_threads_per_threadgroup": 1024, "min_ms": 500, "miss_count": 8286208, "operation": "jacobian_affine_scan_target_lookup_tag32", "ops_per_sec": 207220633.884313, "ops_per_sec_max": 211163185.565372, "ops_per_sec_min": 61921732.83427, "output_layout": "affine_dp_scan_target_lookup", "paired_baseline_ops_per_sec": 175064121.659721, "paired_baseline_ref": "HEAD", "paired_order": "alternate", "paired_speedup": 1.1836841947951842, "query_count": 8548352, "query_input": "hash64_repeat_indexed", "reason": "", "repeat_positive_index_encoding": "packed16_base_repeat", "requested_hits": 64, "runner_sample_count": 3, "sample_count": 131072, "seconds": 2.282418, "setup_inclusive_ops_per_sec": 83171476.727877, "setup_inclusive_seconds": 3.227494, "skipped": false, "state_layout": "xyzz", "status": "keep", "steps_per_sample": 2048, "target_bucket_bytes": 268435456, "target_build_seconds": 0.868788, "target_count": 25005000, "target_filter_bucket_bytes": 67108864, "target_filter_build_seconds": 0.031877, "target_key": "x256_y_parity", "target_key_bytes": 1000200000, "target_lookup_checksum": "0xa2cd0ae701083735", "target_query_hash_bytes": 16696, "target_table_buckets": 33554432, "target_table_bytes": 67108864, "thread_execution_width": 32, "threadgroup_limit": 128, "threads_per_threadgroup": 128, "timestamp": "2026-06-29T15:26:27Z", "validation_seconds": 9.807097, "validation_workers": 8}
{"affine_scan_mode": "cpu_batch_prod_zz_zzz", "affine_scan_seconds": 0.006425, "backend": "metal", "budget_sec": 420, "bytes_per_target": 2.683818, "candidate_verification": "tag16_hash_filter_then_cpu_exact_key_equality", "commit": "6c6f1f3-dirty", "confirmation_index": 1, "confirmation_runs": 2, "confirmation_status": "discard", "cooldown_sec": 10.0, "correctness": true, "description": "Metal XYZZ 2048-step dp6 repeat4096 target lookup with cached exact resolver versus same command on the paired baseline", "distance_tracking": "packet_distance_uint64", "dp_bits": 6, "dp_checksum": "0x54ccada61fd1edbc", "dp_count": 2087, "dp_distance_checksum": "0xf31d7766e1607041", "dp_query_count": 2087, "dp_tracking": "affine_x256_y_parity_cpu_batch", "exact_host_table_bytes": 1268635456, "experiment": "metal_jacobian_dynamic_dp_stream_xyzz_affine_scan_target_lookup_tag16_hash_filter25m_repeat4096_resolver_cache", "filter_false_positive_count": 0, "filter_positive_count": 262144, "gpu_lookup_lookups_per_sec": 285415202.58837, "gpu_ops_per_sec": 60437563.079679, "hit_count": 262144, "injected_hits": 64, "iterations": 268435456, "jump_count": 16, "jump_histogram_max_bucket": 16782260, "jump_histogram_max_deviation_ppm": 346, "jump_histogram_min_bucket": 16771410, "jump_index": "power2_mask", "jump_mixer": "avalanche64", "jump_schedule": "power2", "lookup_engine": "gpu_filter16_hash_repeat", "lookup_engine_effective": "gpu_filter16_hash_repeat", "lookup_exact_seconds": 0.007495, "lookup_gpu_seconds": 0.029951, "lookup_hash_seconds": 6.4e-05, "lookup_layout": "open_address_tag16_hash_filter_exact256", "lookup_max_threads_per_threadgroup": 1024, "lookup_query_mode": "repeat", "lookup_repeat": 4096, "lookup_seconds": 0.037509, "lookup_thread_execution_width": 32, "lookup_threadgroup_limit": 512, "lookup_threads_per_threadgroup": 512, "lookups_per_sec": 227899576.779546, "lookups_per_sec_max": 267150960.453785, "lookups_per_sec_min": 164001751.147337, "machine": "macOS-26.5-arm64-arm-64bit-Mach-O", "max_threads_per_threadgroup": 1024, "min_ms": 500, "miss_count": 8286208, "operation": "jacobian_affine_scan_target_lookup_tag32", "ops_per_sec": 227899576.779546, "ops_per_sec_max": 267150960.453785, "ops_per_sec_min": 164001751.147337, "output_layout": "affine_dp_scan_target_lookup", "paired_baseline_ops_per_sec": 147524744.410271, "paired_baseline_ref": "HEAD", "paired_order": "alternate", "paired_speedup": 1.5448227189992618, "query_count": 8548352, "query_input": "hash64_repeat_indexed", "raw_status": "keep", "reason": "", "repeat_positive_index_encoding": "packed16_base_repeat", "requested_hits": 64, "runner_sample_count": 3, "sample_count": 131072, "seconds": 4.441533, "setup_inclusive_ops_per_sec": 44962380.966769, "setup_inclusive_seconds": 5.970223, "skipped": false, "state_layout": "xyzz", "status": "discard", "steps_per_sample": 2048, "target_bucket_bytes": 268435456, "target_build_seconds": 1.429957, "target_count": 25005000, "target_filter_bucket_bytes": 67108864, "target_filter_build_seconds": 0.054799, "target_key": "x256_y_parity", "target_key_bytes": 1000200000, "target_lookup_checksum": "0xa2cd0ae701083735", "target_query_hash_bytes": 16696, "target_table_buckets": 33554432, "target_table_bytes": 67108864, "thread_execution_width": 32, "threadgroup_limit": 128, "threads_per_threadgroup": 128, "timestamp": "2026-06-29T15:32:46Z", "validation_seconds": 14.28734, "validation_workers": 8}
