{"backend": "metal", "budget_sec": 120, "commit": "7720fc1-dirty", "correctness": true, "description": "Metal dynamic Jacobian DP stream with runtime dp_bits=10 mask", "distance_tracking": "dp_stream_uint64", "dp_bits": 10, "dp_capacity": 16384, "dp_checksum": "0xcbfdc2badaf0e57a", "dp_count": 15, "dp_distance_checksum": "0xb6973c2035ff6351", "dp_stream_overflow": false, "dp_tracking": "projective_x_limb0", "emitted_records": 15, "experiment": "metal_jacobian_dynamic_dp_stream_dp10", "iterations": 8519680, "jump_count": 16, "jump_histogram_max_bucket": 8336, "jump_histogram_max_deviation_ppm": 17578, "jump_histogram_min_bucket": 8082, "jump_index": "power2_mask", "jump_mixer": "avalanche64", "machine": "macOS-26.5-arm64-arm-64bit-Mach-O", "max_threads_per_threadgroup": 1024, "min_ms": 200, "operation": "jacobian_affine_walk_dynamic_dp_stream", "ops_per_sec": 42278414.551117, "ops_per_sec_max": 57431328.740594, "ops_per_sec_min": 26790936.74883, "output_bytes_per_record": 20, "output_bytes_total": 300, "output_layout": "dp_stream", "paired_baseline_ops_per_sec": 29964798.774474, "paired_baseline_ref": "main", "paired_speedup": 1.4109360409632572, "reason": "", "runner_sample_count": 3, "sample_count": 16384, "seconds": 0.201514, "skipped": false, "status": "keep", "steps_per_sample": 8, "thread_execution_width": 32, "threadgroup_limit": 256, "threads_per_threadgroup": 256, "timestamp": "2026-06-22T10:26:34Z"}
{"backend": "metal", "budget_sec": 120, "commit": "7720fc1-dirty", "correctness": true, "description": "Metal dynamic Jacobian DP stream with runtime dp_bits=6 mask", "distance_tracking": "dp_stream_uint64", "dp_bits": 6, "dp_capacity": 16384, "dp_checksum": "0xb302d085b993018a", "dp_count": 248, "dp_distance_checksum": "0xcd602d19c5edfa05", "dp_stream_overflow": false, "dp_tracking": "projective_x_limb0", "emitted_records": 248, "experiment": "metal_jacobian_dynamic_dp_stream_dp6", "iterations": 10092544, "jump_count": 16, "jump_histogram_max_bucket": 8336, "jump_histogram_max_deviation_ppm": 17578, "jump_histogram_min_bucket": 8082, "jump_index": "power2_mask", "jump_mixer": "avalanche64", "machine": "macOS-26.5-arm64-arm-64bit-Mach-O", "max_threads_per_threadgroup": 1024, "min_ms": 200, "operation": "jacobian_affine_walk_dynamic_dp_stream", "ops_per_sec": 50415308.93932, "ops_per_sec_max": 56064889.448233, "ops_per_sec_min": 33340118.517518, "output_bytes_per_record": 20, "output_bytes_total": 4960, "output_layout": "dp_stream", "paired_baseline_ops_per_sec": 59073704.479935, "paired_baseline_ref": "main", "paired_speedup": 0.8534306318379624, "reason": "", "runner_sample_count": 3, "sample_count": 16384, "seconds": 0.200188, "skipped": false, "status": "discard", "steps_per_sample": 8, "thread_execution_width": 32, "threadgroup_limit": 256, "threads_per_threadgroup": 256, "timestamp": "2026-06-22T10:27:27Z"}
{"backend": "metal", "budget_sec": 120, "commit": "ca6509f-dirty", "confirmation_index": 1, "confirmation_runs": 2, "confirmation_status": "discard", "correctness": true, "description": "Metal dynamic Jacobian DP stream with runtime dp_bits=10 mask", "distance_tracking": "dp_stream_uint64", "dp_bits": 10, "dp_capacity": 16384, "dp_checksum": "0xcbfdc2badaf0e57a", "dp_count": 15, "dp_distance_checksum": "0xb6973c2035ff6351", "dp_stream_overflow": false, "dp_tracking": "projective_x_limb0", "emitted_records": 15, "experiment": "metal_jacobian_dynamic_dp_stream_dp10", "iterations": 10223616, "jump_count": 16, "jump_histogram_max_bucket": 8336, "jump_histogram_max_deviation_ppm": 17578, "jump_histogram_min_bucket": 8082, "jump_index": "power2_mask", "jump_mixer": "avalanche64", "machine": "macOS-26.5-arm64-arm-64bit-Mach-O", "max_threads_per_threadgroup": 1024, "min_ms": 200, "operation": "jacobian_affine_walk_dynamic_dp_stream", "ops_per_sec": 50590171.559774, "ops_per_sec_max": 54102926.810683, "ops_per_sec_min": 38859111.868345, "output_bytes_per_record": 20, "output_bytes_total": 300, "output_layout": "dp_stream", "paired_baseline_ops_per_sec": 57834567.954473, "paired_baseline_ref": "main", "paired_speedup": 0.8747393358172617, "raw_status": "discard", "reason": "", "runner_sample_count": 3, "sample_count": 16384, "seconds": 0.202087, "skipped": false, "status": "discard", "steps_per_sample": 8, "thread_execution_width": 32, "threadgroup_limit": 256, "threads_per_threadgroup": 256, "timestamp": "2026-06-22T10:32:26Z"}
{"backend": "metal", "budget_sec": 120, "commit": "ca6509f-dirty", "confirmation_index": 2, "confirmation_runs": 2, "confirmation_status": "discard", "correctness": true, "description": "Metal dynamic Jacobian DP stream with runtime dp_bits=10 mask", "distance_tracking": "dp_stream_uint64", "dp_bits": 10, "dp_capacity": 16384, "dp_checksum": "0xcbfdc2badaf0e57a", "dp_count": 15, "dp_distance_checksum": "0xb6973c2035ff6351", "dp_stream_overflow": false, "dp_tracking": "projective_x_limb0", "emitted_records": 15, "experiment": "metal_jacobian_dynamic_dp_stream_dp10", "iterations": 7340032, "jump_count": 16, "jump_histogram_max_bucket": 8336, "jump_histogram_max_deviation_ppm": 17578, "jump_histogram_min_bucket": 8082, "jump_index": "power2_mask", "jump_mixer": "avalanche64", "machine": "macOS-26.5-arm64-arm-64bit-Mach-O", "max_threads_per_threadgroup": 1024, "min_ms": 200, "operation": "jacobian_affine_walk_dynamic_dp_stream", "ops_per_sec": 36257628.573029, "ops_per_sec_max": 54091492.986425, "ops_per_sec_min": 34276813.25765, "output_bytes_per_record": 20, "output_bytes_total": 300, "output_layout": "dp_stream", "paired_baseline_ops_per_sec": 56053192.101321, "paired_baseline_ref": "main", "paired_speedup": 0.646843243244563, "raw_status": "discard", "reason": "", "runner_sample_count": 3, "sample_count": 16384, "seconds": 0.202441, "skipped": false, "status": "discard", "steps_per_sample": 8, "thread_execution_width": 32, "threadgroup_limit": 256, "threads_per_threadgroup": 256, "timestamp": "2026-06-22T10:33:06Z"}
{"backend": "metal", "budget_sec": 120, "commit": "2699577-dirty", "correctness": true, "description": "Metal dynamic Jacobian DP stream with runtime dp_bits=8 mask", "distance_tracking": "dp_stream_uint64", "dp_bits": 8, "dp_capacity": 16384, "dp_checksum": "0xab1c2cd29cd70a84", "dp_count": 61, "dp_distance_checksum": "0x822e141de4770a0b", "dp_stream_overflow": false, "dp_tracking": "projective_x_limb0", "emitted_records": 61, "experiment": "metal_jacobian_dynamic_dp_stream_dp8", "iterations": 7208960, "jump_count": 16, "jump_histogram_max_bucket": 8336, "jump_histogram_max_deviation_ppm": 17578, "jump_histogram_min_bucket": 8082, "jump_index": "power2_mask", "jump_mixer": "avalanche64", "machine": "macOS-26.5-arm64-arm-64bit-Mach-O", "max_threads_per_threadgroup": 1024, "min_ms": 200, "operation": "jacobian_affine_walk_dynamic_dp_stream", "ops_per_sec": 35931562.757915, "ops_per_sec_max": 56007937.211084, "ops_per_sec_min": 31275134.865548, "output_bytes_per_record": 20, "output_bytes_total": 1220, "output_layout": "dp_stream", "paired_baseline_ops_per_sec": 33107357.883692, "paired_baseline_ref": "main", "paired_speedup": 1.0853044475534588, "reason": "", "runner_sample_count": 3, "sample_count": 16384, "seconds": 0.20063, "skipped": false, "status": "keep", "steps_per_sample": 8, "thread_execution_width": 32, "threadgroup_limit": 256, "threads_per_threadgroup": 256, "timestamp": "2026-06-22T10:41:26Z"}
{"backend": "metal", "budget_sec": 120, "commit": "2699577-dirty", "confirmation_index": 1, "confirmation_runs": 2, "confirmation_status": "keep", "correctness": true, "description": "Metal dynamic Jacobian DP stream with runtime dp_bits=8 mask", "distance_tracking": "dp_stream_uint64", "dp_bits": 8, "dp_capacity": 16384, "dp_checksum": "0xab1c2cd29cd70a84", "dp_count": 61, "dp_distance_checksum": "0x822e141de4770a0b", "dp_stream_overflow": false, "dp_tracking": "projective_x_limb0", "emitted_records": 61, "experiment": "metal_jacobian_dynamic_dp_stream_dp8", "iterations": 9175040, "jump_count": 16, "jump_histogram_max_bucket": 8336, "jump_histogram_max_deviation_ppm": 17578, "jump_histogram_min_bucket": 8082, "jump_index": "power2_mask", "jump_mixer": "avalanche64", "machine": "macOS-26.5-arm64-arm-64bit-Mach-O", "max_threads_per_threadgroup": 1024, "min_ms": 200, "operation": "jacobian_affine_walk_dynamic_dp_stream", "ops_per_sec": 45448401.334809, "ops_per_sec_max": 49388484.655344, "ops_per_sec_min": 20729618.822593, "output_bytes_per_record": 20, "output_bytes_total": 1220, "output_layout": "dp_stream", "paired_baseline_ops_per_sec": 39873314.502482, "paired_baseline_ref": "main", "paired_speedup": 1.1398199999646372, "raw_status": "keep", "reason": "", "runner_sample_count": 3, "sample_count": 16384, "seconds": 0.201878, "skipped": false, "status": "keep", "steps_per_sample": 8, "thread_execution_width": 32, "threadgroup_limit": 256, "threads_per_threadgroup": 256, "timestamp": "2026-06-22T10:42:16Z"}
{"backend": "metal", "budget_sec": 120, "commit": "2699577-dirty", "confirmation_index": 2, "confirmation_runs": 2, "confirmation_status": "keep", "correctness": true, "description": "Metal dynamic Jacobian DP stream with runtime dp_bits=8 mask", "distance_tracking": "dp_stream_uint64", "dp_bits": 8, "dp_capacity": 16384, "dp_checksum": "0xab1c2cd29cd70a84", "dp_count": 61, "dp_distance_checksum": "0x822e141de4770a0b", "dp_stream_overflow": false, "dp_tracking": "projective_x_limb0", "emitted_records": 61, "experiment": "metal_jacobian_dynamic_dp_stream_dp8", "iterations": 8519680, "jump_count": 16, "jump_histogram_max_bucket": 8336, "jump_histogram_max_deviation_ppm": 17578, "jump_histogram_min_bucket": 8082, "jump_index": "power2_mask", "jump_mixer": "avalanche64", "machine": "macOS-26.5-arm64-arm-64bit-Mach-O", "max_threads_per_threadgroup": 1024, "min_ms": 200, "operation": "jacobian_affine_walk_dynamic_dp_stream", "ops_per_sec": 42203534.028814, "ops_per_sec_max": 55623670.472829, "ops_per_sec_min": 39831980.594591, "output_bytes_per_record": 20, "output_bytes_total": 1220, "output_layout": "dp_stream", "paired_baseline_ops_per_sec": 37060740.353657, "paired_baseline_ref": "main", "paired_speedup": 1.138766620042698, "raw_status": "keep", "reason": "", "runner_sample_count": 3, "sample_count": 16384, "seconds": 0.201871, "skipped": false, "status": "keep", "steps_per_sample": 8, "thread_execution_width": 32, "threadgroup_limit": 256, "threads_per_threadgroup": 256, "timestamp": "2026-06-22T10:42:52Z"}
{"backend": "metal", "budget_sec": 120, "commit": "f868bcf-dirty", "correctness": true, "description": "Metal dynamic Jacobian jump walk with sparse distinguished-point stream emission", "distance_tracking": "dp_stream_uint64", "dp_bits": 4, "dp_capacity": 16384, "dp_checksum": "0xbfd3b2319760e774", "dp_count": 1017, "dp_distance_checksum": "0x19e43ca50eec2a74", "dp_stream_overflow": false, "dp_tracking": "projective_x_limb0", "emitted_records": 1017, "experiment": "metal_jacobian_dynamic_dp_stream", "iterations": 10092544, "jump_count": 16, "jump_histogram_max_bucket": 8336, "jump_histogram_max_deviation_ppm": 17578, "jump_histogram_min_bucket": 8082, "jump_index": "power2_mask", "jump_mixer": "avalanche64", "machine": "macOS-26.5-arm64-arm-64bit-Mach-O", "max_threads_per_threadgroup": 1024, "min_ms": 200, "operation": "jacobian_affine_walk_dynamic_dp_stream", "ops_per_sec": 49544294.377036, "ops_per_sec_max": 57349092.786802, "ops_per_sec_min": 41430851.669889, "output_bytes_per_record": 20, "output_bytes_total": 20340, "output_layout": "dp_stream", "paired_baseline_ops_per_sec": 50583214.35598, "paired_baseline_ref": "main", "paired_speedup": 0.9794611712171435, "reason": "", "runner_sample_count": 3, "sample_count": 16384, "seconds": 0.203707, "skipped": false, "status": "discard", "steps_per_sample": 8, "thread_execution_width": 32, "threadgroup_limit": 256, "threads_per_threadgroup": 256, "timestamp": "2026-06-22T10:46:53Z"}
{"backend": "metal", "budget_sec": 120, "commit": "7246372-dirty", "correctness": true, "description": "Metal dynamic Jacobian DP stream with runtime dp_bits=8 mask", "distance_tracking": "dp_stream_uint64", "dp_bits": 8, "dp_capacity": 16384, "dp_checksum": "0xab1c2cd29cd70a84", "dp_count": 61, "dp_distance_checksum": "0x822e141de4770a0b", "dp_stream_overflow": false, "dp_tracking": "projective_x_limb0", "emitted_records": 61, "experiment": "metal_jacobian_dynamic_dp_stream_dp8", "iterations": 8126464, "jump_count": 16, "jump_histogram_max_bucket": 8336, "jump_histogram_max_deviation_ppm": 17578, "jump_histogram_min_bucket": 8082, "jump_index": "power2_mask", "jump_mixer": "avalanche64", "machine": "macOS-26.5-arm64-arm-64bit-Mach-O", "max_threads_per_threadgroup": 1024, "min_ms": 200, "operation": "jacobian_affine_walk_dynamic_dp_stream", "ops_per_sec": 40455982.284936, "ops_per_sec_max": 59280850.861247, "ops_per_sec_min": 34922296.143458, "output_bytes_per_record": 20, "output_bytes_total": 1220, "output_layout": "dp_stream", "paired_baseline_ops_per_sec": 54871015.351268, "paired_baseline_ref": "main", "paired_speedup": 0.7372923942804553, "reason": "", "runner_sample_count": 3, "sample_count": 16384, "seconds": 0.200872, "skipped": false, "status": "discard", "steps_per_sample": 8, "thread_execution_width": 32, "threadgroup_limit": 256, "threads_per_threadgroup": 256, "timestamp": "2026-06-22T10:53:34Z"}
{"backend": "metal", "budget_sec": 120, "commit": "1fd0ecb-dirty", "correctness": true, "description": "Metal dynamic Jacobian DP stream with runtime dp_bits=8 mask", "distance_tracking": "dp_stream_uint64", "dp_bits": 8, "dp_capacity": 16384, "dp_checksum": "0xab1c2cd29cd70a84", "dp_count": 61, "dp_distance_checksum": "0x822e141de4770a0b", "dp_stream_overflow": false, "dp_tracking": "projective_x_limb0", "emitted_records": 61, "experiment": "metal_jacobian_dynamic_dp_stream_dp8", "iterations": 4063232, "jump_count": 16, "jump_histogram_max_bucket": 8336, "jump_histogram_max_deviation_ppm": 17578, "jump_histogram_min_bucket": 8082, "jump_index": "power2_mask", "jump_mixer": "avalanche64", "machine": "macOS-26.5-arm64-arm-64bit-Mach-O", "max_threads_per_threadgroup": 1024, "min_ms": 200, "operation": "jacobian_affine_walk_dynamic_dp_stream", "ops_per_sec": 20232288.96815, "ops_per_sec_max": 32213287.036171, "ops_per_sec_min": 19756963.738793, "output_bytes_per_record": 20, "output_bytes_total": 1220, "output_layout": "dp_stream", "paired_baseline_ops_per_sec": 52397986.361443, "paired_baseline_ref": "main", "paired_speedup": 0.38612722306897485, "reason": "", "runner_sample_count": 3, "sample_count": 16384, "seconds": 0.200829, "skipped": false, "status": "discard", "steps_per_sample": 8, "thread_execution_width": 32, "threadgroup_limit": 256, "threads_per_threadgroup": 256, "timestamp": "2026-06-22T10:59:39Z"}
{"backend": "metal", "budget_sec": 120, "commit": "aaaa374-dirty", "correctness": true, "description": "Metal dynamic Jacobian DP count-only probe with runtime dp_bits=8 mask", "distance_tracking": "none", "dp_bits": 8, "dp_count": 61, "dp_tracking": "projective_x_limb0", "experiment": "metal_jacobian_dynamic_dp_count_dp8", "iterations": 8781824, "jump_count": 16, "jump_histogram_max_bucket": 8336, "jump_histogram_max_deviation_ppm": 17578, "jump_histogram_min_bucket": 8082, "jump_index": "power2_mask", "jump_mixer": "avalanche64", "machine": "macOS-26.5-arm64-arm-64bit-Mach-O", "max_threads_per_threadgroup": 1024, "min_ms": 200, "operation": "jacobian_affine_walk_dynamic_dp_count", "ops_per_sec": 43773240.202096, "ops_per_sec_max": 48847567.549002, "ops_per_sec_min": 37157424.295935, "output_bytes_total": 4, "output_layout": "dp_count", "paired_baseline_ops_per_sec": 44442548.274759, "paired_baseline_ref": "main", "paired_speedup": 0.9849399258448208, "reason": "", "runner_sample_count": 3, "sample_count": 16384, "seconds": 0.200621, "skipped": false, "status": "discard", "steps_per_sample": 8, "thread_execution_width": 32, "threadgroup_limit": 256, "threads_per_threadgroup": 256, "timestamp": "2026-06-22T11:05:59Z"}
{"backend": "metal", "budget_sec": 120, "commit": "aaaa374-dirty", "correctness": true, "description": "Metal dynamic Jacobian DP count-only probe with runtime dp_bits=8 mask", "distance_tracking": "none", "dp_bits": 8, "dp_count": 61, "dp_tracking": "projective_x_limb0", "experiment": "metal_jacobian_dynamic_dp_count_dp8", "iterations": 10092544, "jump_count": 16, "jump_histogram_max_bucket": 8336, "jump_histogram_max_deviation_ppm": 17578, "jump_histogram_min_bucket": 8082, "jump_index": "power2_mask", "jump_mixer": "avalanche64", "machine": "macOS-26.5-arm64-arm-64bit-Mach-O", "max_threads_per_threadgroup": 1024, "min_ms": 200, "operation": "jacobian_affine_walk_dynamic_dp_count", "ops_per_sec": 50394707.554658, "ops_per_sec_max": 69338828.177601, "ops_per_sec_min": 42322353.086826, "output_bytes_total": 4, "output_layout": "dp_count", "paired_baseline_ops_per_sec": 68896134.342987, "paired_baseline_ref": "main", "paired_speedup": 0.7314591454983095, "reason": "", "runner_sample_count": 3, "sample_count": 16384, "seconds": 0.20027, "skipped": false, "status": "discard", "steps_per_sample": 8, "thread_execution_width": 32, "threadgroup_limit": 256, "threads_per_threadgroup": 256, "timestamp": "2026-06-22T11:07:15Z"}
{"backend": "metal", "budget_sec": 120, "commit": "7e71d4c-dirty", "correctness": true, "description": "Metal dynamic Jacobian DP count-only probe with runtime dp_bits=8 mask", "distance_tracking": "none", "dp_bits": 8, "dp_count": 61, "dp_tracking": "projective_x_limb0", "experiment": "metal_jacobian_dynamic_dp_count_dp8", "iterations": 7471104, "jump_count": 16, "jump_histogram_max_bucket": 8336, "jump_histogram_max_deviation_ppm": 17578, "jump_histogram_min_bucket": 8082, "jump_index": "power2_mask", "jump_mixer": "avalanche64", "machine": "macOS-26.5-arm64-arm-64bit-Mach-O", "max_threads_per_threadgroup": 1024, "min_ms": 200, "operation": "jacobian_affine_walk_dynamic_dp_count", "ops_per_sec": 36757514.20682, "ops_per_sec_max": 58109926.786046, "ops_per_sec_min": 20607438.290084, "output_bytes_total": 4, "output_layout": "dp_count", "paired_baseline_ops_per_sec": 40073503.015154, "paired_baseline_ref": "main", "paired_speedup": 0.9172523348637619, "reason": "", "runner_sample_count": 3, "sample_count": 16384, "seconds": 0.203254, "skipped": false, "status": "discard", "steps_per_sample": 8, "thread_execution_width": 32, "threadgroup_limit": 256, "threads_per_threadgroup": 256, "timestamp": "2026-06-22T11:13:07Z"}
{"backend": "metal", "budget_sec": 120, "commit": "be247bc-dirty", "correctness": true, "description": "Metal dynamic Jacobian DP count-only probe with runtime dp_bits=8 mask", "distance_tracking": "none", "dp_bits": 8, "dp_count": 61, "dp_tracking": "projective_x_limb0", "experiment": "metal_jacobian_dynamic_dp_count_dp8", "iterations": 8519680, "jump_count": 16, "jump_histogram_max_bucket": 8336, "jump_histogram_max_deviation_ppm": 17578, "jump_histogram_min_bucket": 8082, "jump_index": "power2_mask", "jump_mixer": "avalanche64", "machine": "macOS-26.5-arm64-arm-64bit-Mach-O", "max_threads_per_threadgroup": 1024, "min_ms": 200, "operation": "jacobian_affine_walk_dynamic_dp_count", "ops_per_sec": 42541651.351471, "ops_per_sec_max": 59214635.309784, "ops_per_sec_min": 39387711.369554, "output_bytes_total": 4, "output_layout": "dp_count", "paired_baseline_ops_per_sec": 41943177.10902, "paired_baseline_ref": "main", "paired_speedup": 1.0142686912079986, "reason": "", "runner_sample_count": 3, "sample_count": 16384, "seconds": 0.200267, "skipped": false, "status": "keep", "steps_per_sample": 8, "thread_execution_width": 32, "threadgroup_limit": 128, "threads_per_threadgroup": 128, "timestamp": "2026-06-22T11:20:20Z"}
{"backend": "metal", "budget_sec": 120, "commit": "be247bc-dirty", "confirmation_index": 1, "confirmation_runs": 2, "confirmation_status": "discard", "correctness": true, "description": "Metal dynamic Jacobian DP count-only probe with runtime dp_bits=8 mask", "distance_tracking": "none", "dp_bits": 8, "dp_count": 61, "dp_tracking": "projective_x_limb0", "experiment": "metal_jacobian_dynamic_dp_count_dp8", "iterations": 7602176, "jump_count": 16, "jump_histogram_max_bucket": 8336, "jump_histogram_max_deviation_ppm": 17578, "jump_histogram_min_bucket": 8082, "jump_index": "power2_mask", "jump_mixer": "avalanche64", "machine": "macOS-26.5-arm64-arm-64bit-Mach-O", "max_threads_per_threadgroup": 1024, "min_ms": 200, "operation": "jacobian_affine_walk_dynamic_dp_count", "ops_per_sec": 36984641.449378, "ops_per_sec_max": 41455132.640791, "ops_per_sec_min": 36402042.560289, "output_bytes_total": 4, "output_layout": "dp_count", "paired_baseline_ops_per_sec": 41255140.214432, "paired_baseline_ref": "main", "paired_speedup": 0.8964856562635053, "raw_status": "discard", "reason": "", "runner_sample_count": 3, "sample_count": 16384, "seconds": 0.20555, "skipped": false, "status": "discard", "steps_per_sample": 8, "thread_execution_width": 32, "threadgroup_limit": 128, "threads_per_threadgroup": 128, "timestamp": "2026-06-22T11:21:12Z"}
