{"backend": "metal", "budget_sec": 120, "commit": "a587357-dirty", "confirmation_index": 3, "confirmation_runs": 3, "confirmation_status": "keep", "correctness": true, "description": "Metal dynamic DP8 stream using XYZZ state packets at 512 steps", "distance_tracking": "dp_stream_uint64", "dp_bits": 8, "dp_capacity": 16384, "dp_checksum": "0x979de1728771393c", "dp_count": 76, "dp_distance_checksum": "0x59171fb04821054e", "dp_stream_overflow": false, "dp_tracking": "projective_x_limb0", "emitted_records": 76, "experiment": "metal_jacobian_dynamic_dp_stream_xyzz_steps512", "iterations": 25165824, "jump_count": 16, "jump_histogram_max_bucket": 525454, "jump_histogram_max_deviation_ppm": 2724, "jump_histogram_min_bucket": 522860, "jump_index": "power2_mask", "jump_mixer": "avalanche64", "machine": "macOS-26.5-arm64-arm-64bit-Mach-O", "max_threads_per_threadgroup": 1024, "min_ms": 200, "operation": "jacobian_affine_walk_dynamic_dp_stream_xyzz", "ops_per_sec": 107388329.480794, "ops_per_sec_max": 109192425.07854, "ops_per_sec_min": 102435359.705832, "output_bytes_per_record": 20, "output_bytes_total": 1520, "output_layout": "dp_stream", "paired_baseline_ops_per_sec": 103951832.856458, "paired_baseline_ref": "main", "paired_speedup": 1.0330585476937313, "raw_status": "keep", "reason": "", "runner_sample_count": 3, "sample_count": 16384, "seconds": 0.234344, "skipped": false, "state_layout": "xyzz", "status": "keep", "steps_per_sample": 512, "thread_execution_width": 32, "threadgroup_limit": 128, "threads_per_threadgroup": 128, "timestamp": "2026-06-22T17:43:02Z"}
{"backend": "metal", "budget_sec": 5, "commit": "d1b79e7-dirty", "correctness": true, "description": "Metal dynamic DP8 stream using XYZZ 512-step packets with a saturated 262144-state batch", "distance_tracking": "dp_stream_uint64", "dp_bits": 8, "dp_capacity": 262144, "dp_checksum": "0x65d61f2aa446682c", "dp_count": 1015, "dp_distance_checksum": "0xdf5ba046e663f744", "dp_stream_overflow": false, "dp_tracking": "projective_x_limb0", "emitted_records": 1015, "experiment": "metal_jacobian_dynamic_dp_stream_xyzz_steps512_saturated", "iterations": 134217728, "jump_count": 16, "jump_histogram_max_bucket": 8394316, "jump_histogram_max_deviation_ppm": 759, "jump_histogram_min_bucket": 8382245, "jump_index": "power2_mask", "jump_mixer": "avalanche64", "machine": "macOS-26.5-arm64-arm-64bit-Mach-O", "max_threads_per_threadgroup": 1024, "min_ms": 500, "operation": "jacobian_affine_walk_dynamic_dp_stream_xyzz", "ops_per_sec": 123002921.277187, "ops_per_sec_max": 123223925.580016, "ops_per_sec_min": 122795523.777258, "output_bytes_per_record": 20, "output_bytes_total": 20300, "output_layout": "dp_stream", "reason": "", "runner_sample_count": 3, "sample_count": 262144, "seconds": 1.091175, "skipped": false, "state_layout": "xyzz", "status": "keep", "steps_per_sample": 512, "thread_execution_width": 32, "threadgroup_limit": 128, "threads_per_threadgroup": 128, "timestamp": "2026-06-22T19:05:52Z"}
{"backend": "metal", "budget_sec": 20, "commit": "0f58a62", "correctness": true, "description": "Metal dynamic DP8 stream using XYZZ 512-step packets with a large 524288-state batch", "distance_tracking": "dp_stream_uint64", "dp_bits": 8, "dp_capacity": 524288, "dp_checksum": "0x390f891179fdcbea", "dp_count": 1976, "dp_distance_checksum": "0x7325bd945494b7be", "dp_stream_overflow": false, "dp_tracking": "projective_x_limb0", "emitted_records": 1976, "experiment": "metal_jacobian_dynamic_dp_stream_xyzz_steps512_large_batch", "iterations": 268435456, "jump_count": 16, "jump_histogram_max_bucket": 16781828, "jump_histogram_max_deviation_ppm": 553, "jump_histogram_min_bucket": 16767939, "jump_index": "power2_mask", "jump_mixer": "avalanche64", "machine": "macOS-26.5-arm64-arm-64bit-Mach-O", "max_threads_per_threadgroup": 1024, "min_ms": 500, "operation": "jacobian_affine_walk_dynamic_dp_stream_xyzz", "ops_per_sec": 124648214.520876, "ops_per_sec_max": 124996719.967963, "ops_per_sec_min": 123393739.713153, "output_bytes_per_record": 20, "output_bytes_total": 39520, "output_layout": "dp_stream", "reason": "", "runner_sample_count": 3, "sample_count": 524288, "seconds": 2.153544, "skipped": false, "state_layout": "xyzz", "status": "keep", "steps_per_sample": 512, "thread_execution_width": 32, "threadgroup_limit": 128, "threads_per_threadgroup": 128, "timestamp": "2026-06-22T19:28:36Z"}
{"backend": "metal", "budget_sec": 120, "commit": "9edcea1-dirty", "correctness": true, "description": "Metal XYZZ 512-step DP stream with two device-resident chained packets and cumulative uint64 distances", "distance_tracking": "dp_stream_cumulative_uint64", "dp_bits": 8, "dp_capacity": 524288, "dp_checksum": "0x23509000c8141686", "dp_count": 2016, "dp_distance_checksum": "0x7a221c62b92a5ed3", "dp_stream_overflow": false, "dp_tracking": "projective_x_limb0", "emitted_records": 2016, "experiment": "metal_jacobian_dynamic_dp_stream_xyzz_chain_steps512", "iterations": 268435456, "jump_count": 16, "jump_histogram_max_bucket": 16782744, "jump_histogram_max_deviation_ppm": 389, "jump_histogram_min_bucket": 16770687, "jump_index": "power2_mask", "jump_mixer": "avalanche64", "machine": "macOS-26.5-arm64-arm-64bit-Mach-O", "max_threads_per_threadgroup": 1024, "min_ms": 500, "operation": "jacobian_affine_walk_dynamic_dp_stream_xyzz_chain", "ops_per_sec": 52054794.687903, "ops_per_sec_max": 55005340.950417, "ops_per_sec_min": 52038044.171615, "output_bytes_per_record": 20, "output_bytes_total": 40320, "output_layout": "dp_stream", "packet_count": 2, "reason": "", "runner_sample_count": 3, "sample_count": 262144, "seconds": 5.156786, "skipped": false, "state_layout": "xyzz", "status": "keep", "steps_per_sample": 512, "stream_indexing": "packet_sample_u32", "thread_execution_width": 32, "threadgroup_limit": 128, "threads_per_threadgroup": 128, "timestamp": "2026-06-22T20:25:47Z", "validation_seconds": 16.237963}
{"backend": "metal", "budget_sec": 45, "command_buffer_count": 2, "commit": "ebd6cb6", "cooldown_sec": 10.0, "correctness": true, "description": "Metal XYZZ 512-step DP stream with persistent chained rounds, reused pipeline/buffers, and cumulative uint64 distances", "distance_tracking": "dp_stream_cumulative_uint64", "dp_bits": 8, "dp_capacity": 1048576, "dp_checksum": "0x950a1186dae66384", "dp_count": 4037, "dp_distance_checksum": "0x30e91a5edffed133", "dp_stream_overflow": false, "dp_tracking": "projective_x_limb0", "emitted_records": 4037, "experiment": "metal_jacobian_dynamic_dp_stream_xyzz_persistent_chain_steps512", "iterations": 536870912, "jump_count": 16, "jump_histogram_max_bucket": 33562777, "jump_histogram_max_deviation_ppm": 249, "jump_histogram_min_bucket": 33546500, "jump_index": "power2_mask", "jump_mixer": "avalanche64", "machine": "macOS-26.5-arm64-arm-64bit-Mach-O", "max_threads_per_threadgroup": 1024, "min_ms": 0, "operation": "jacobian_affine_walk_dynamic_dp_stream_xyzz_persistent_chain", "ops_per_sec": 56698747.713128, "ops_per_sec_max": 59720222.409339, "ops_per_sec_min": 53084542.05195, "output_bytes_per_record": 20, "output_bytes_total": 80740, "output_layout": "dp_stream", "packet_count": 4, "packets_per_round": 2, "paired_baseline_ops_per_sec": 63930187.480298, "paired_baseline_ref": "main", "paired_speedup": 0.886885365862589, "reason": "", "round_count": 2, "runner_sample_count": 3, "sample_count": 262144, "seconds": 9.468832, "setup_mode": "reuse_pipeline_buffers", "skipped": false, "state_layout": "xyzz", "state_persistence": "round_cumulative_xyzz", "status": "discard", "steps_per_sample": 512, "stream_indexing": "round_packet_sample_u32", "thread_execution_width": 32, "threadgroup_limit": 128, "threads_per_threadgroup": 128, "timestamp": "2026-06-22T22:03:45Z", "validation_seconds": 36.310837}
{"affine_active_path": "all_active_fast", "affine_buffer": "resize_reuse", "affine_conversion": "batch", "affine_field_ops": "inplace", "affine_reverse_loop": "split_zero", "affine_tail_update": "skip_final", "affine_z_access": "const_ref", "affine_z_check": "infinity_flag", "architecture": "shared_tame", "avg_dp_count": 84.0, "backend": "macos_cpu", "budget_sec": 8, "candidate_verification": "full_point_collision", "commit": "cf82107-dirty", "confirmation_index": 1, "confirmation_runs": 3, "confirmation_status": "keep", "cooldown_sec": 0.0, "correctness": true, "description": "Apple Silicon CPU shared-tame tiny multi-target kangaroo benchmark", "dp_bits": 0, "dp_bucket_storage": "inline_first", "dp_capacity": "max_load_2of3", "dp_clear": "empty_guard", "dp_hash": "partial_limb_mix", "dp_key": "x_parity", "dp_lookup": "open_address_linear", "dp_reserve": "sqrt_range_estimate", "ecint_carry_impl": "clang_builtin", "ecint_mul_final_sub": "single_conditional", "expected_private_key": "0x7", "experiment": "jacobian_kangaroo_multi_small", "field_rhs_passing": "const_ref", "found_private_key": "0x7", "found_target_index": 3, "iterations": 1787, "jacobian_step_passing": "const_ref", "jump_count": 8, "jump_index": "power2_mask", "jump_table": "precomputed", "last_dp_count": 84, "machine": "macOS-26.5-arm64-arm-64bit-Mach-O", "max_steps": 4096, "min_ms": 50, "operation": "jacobian_kangaroo_multi_small", "ops_per_sec": 35731.722389, "ops_per_sec_max": 35813.344448, "ops_per_sec_min": 33134.339992, "paired_baseline_ops_per_sec": 34745.667412, "paired_baseline_ref": "main", "paired_speedup": 1.028379221078351, "point_passing": "const_ref", "range_bits": 8, "range_context": "precomputed", "raw_status": "keep", "reason": "", "runner_sample_count": 3, "sample_count": 1, "scratch": "reused", "seconds": 0.050012, "single_target_ops_per_sec": 31759.232697, "skipped": false, "speedup_vs_single": 1.125081, "start_scalar": "0x2", "status": "keep", "tame_states": 1, "target_count": 4, "target_throughput_vs_single": 4.500326, "timestamp": "2026-06-23T17:02:29Z", "wild_states": 4}
{"affine_active_path": "all_active_fast", "affine_buffer": "resize_reuse", "affine_conversion": "batch", "affine_field_ops": "inplace", "affine_reverse_loop": "split_zero", "affine_tail_update": "skip_final", "affine_z_access": "const_ref", "affine_z_check": "infinity_flag", "architecture": "shared_tame", "avg_dp_count": 84.0, "backend": "macos_cpu", "budget_sec": 8, "candidate_verification": "full_point_collision", "commit": "cf82107-dirty", "confirmation_index": 2, "confirmation_runs": 3, "confirmation_status": "keep", "cooldown_sec": 0.0, "correctness": true, "description": "Apple Silicon CPU shared-tame tiny multi-target kangaroo benchmark", "dp_bits": 0, "dp_bucket_storage": "inline_first", "dp_capacity": "max_load_2of3", "dp_clear": "empty_guard", "dp_hash": "partial_limb_mix", "dp_key": "x_parity", "dp_lookup": "open_address_linear", "dp_reserve": "sqrt_range_estimate", "ecint_carry_impl": "clang_builtin", "ecint_mul_final_sub": "single_conditional", "expected_private_key": "0x7", "experiment": "jacobian_kangaroo_multi_small", "field_rhs_passing": "const_ref", "found_private_key": "0x7", "found_target_index": 3, "iterations": 1786, "jacobian_step_passing": "const_ref", "jump_count": 8, "jump_index": "power2_mask", "jump_table": "precomputed", "last_dp_count": 84, "machine": "macOS-26.5-arm64-arm-64bit-Mach-O", "max_steps": 4096, "min_ms": 50, "operation": "jacobian_kangaroo_multi_small", "ops_per_sec": 35707.591612, "ops_per_sec_max": 35728.686154, "ops_per_sec_min": 35686.676736, "paired_baseline_ops_per_sec": 34736.61318, "paired_baseline_ref": "main", "paired_speedup": 1.027952593621276, "point_passing": "const_ref", "range_bits": 8, "range_context": "precomputed", "raw_status": "keep", "reason": "", "runner_sample_count": 3, "sample_count": 1, "scratch": "reused", "seconds": 0.050017, "single_target_ops_per_sec": 31732.648815, "skipped": false, "speedup_vs_single": 1.125264, "start_scalar": "0x2", "status": "keep", "tame_states": 1, "target_count": 4, "target_throughput_vs_single": 4.501054, "timestamp": "2026-06-23T17:02:29Z", "wild_states": 4}
{"affine_active_path": "all_active_fast", "affine_buffer": "resize_reuse", "affine_conversion": "batch", "affine_field_ops": "inplace", "affine_reverse_loop": "split_zero", "affine_tail_update": "skip_final", "affine_z_access": "const_ref", "affine_z_check": "infinity_flag", "architecture": "shared_tame", "avg_dp_count": 84.0, "backend": "macos_cpu", "budget_sec": 8, "candidate_verification": "full_point_collision", "commit": "cf82107-dirty", "confirmation_index": 3, "confirmation_runs": 3, "confirmation_status": "keep", "cooldown_sec": 0.0, "correctness": true, "description": "Apple Silicon CPU shared-tame tiny multi-target kangaroo benchmark", "dp_bits": 0, "dp_bucket_storage": "inline_first", "dp_capacity": "max_load_2of3", "dp_clear": "empty_guard", "dp_hash": "partial_limb_mix", "dp_key": "x_parity", "dp_lookup": "open_address_linear", "dp_reserve": "sqrt_range_estimate", "ecint_carry_impl": "clang_builtin", "ecint_mul_final_sub": "single_conditional", "expected_private_key": "0x7", "experiment": "jacobian_kangaroo_multi_small", "field_rhs_passing": "const_ref", "found_private_key": "0x7", "found_target_index": 3, "iterations": 1787, "jacobian_step_passing": "const_ref", "jump_count": 8, "jump_index": "power2_mask", "jump_table": "precomputed", "last_dp_count": 84, "machine": "macOS-26.5-arm64-arm-64bit-Mach-O", "max_steps": 4096, "min_ms": 50, "operation": "jacobian_kangaroo_multi_small", "ops_per_sec": 35726.216111, "ops_per_sec_max": 35736.724372, "ops_per_sec_min": 34348.664941, "paired_baseline_ops_per_sec": 34721.655161, "paired_baseline_ref": "main", "paired_speedup": 1.0289318278561888, "point_passing": "const_ref", "range_bits": 8, "range_context": "precomputed", "raw_status": "keep", "reason": "", "runner_sample_count": 3, "sample_count": 1, "scratch": "reused", "seconds": 0.050019, "single_target_ops_per_sec": 31644.28355, "skipped": false, "speedup_vs_single": 1.128994, "start_scalar": "0x2", "status": "keep", "tame_states": 1, "target_count": 4, "target_throughput_vs_single": 4.515977, "timestamp": "2026-06-23T17:02:29Z", "wild_states": 4}
{"affine_active_path": "all_active_fast", "affine_buffer": "resize_reuse", "affine_conversion": "batch", "affine_field_ops": "inplace", "affine_reverse_loop": "split_zero", "affine_tail_update": "skip_final", "affine_z_access": "const_ref", "affine_z_check": "infinity_flag", "architecture": "shared_tame", "avg_dp_count": 288.0, "backend": "macos_cpu", "budget_sec": 8, "candidate_verification": "full_point_collision", "commit": "cf82107-dirty", "confirmation_index": 1, "confirmation_runs": 3, "confirmation_status": "keep", "cooldown_sec": 0.0, "correctness": true, "description": "Apple Silicon CPU shared-tame tiny 16-target kangaroo benchmark", "dp_bits": 0, "dp_bucket_storage": "inline_first", "dp_capacity": "max_load_2of3", "dp_clear": "empty_guard", "dp_hash": "partial_limb_mix", "dp_key": "x_parity", "dp_lookup": "open_address_linear", "dp_reserve": "sqrt_range_estimate", "ecint_carry_impl": "clang_builtin", "ecint_mul_final_sub": "single_conditional", "expected_private_key": "0x7", "experiment": "jacobian_kangaroo_multi16_small", "field_rhs_passing": "const_ref", "found_private_key": "0x7", "found_target_index": 15, "iterations": 806, "jacobian_step_passing": "const_ref", "jump_count": 8, "jump_index": "power2_mask", "jump_table": "precomputed", "last_dp_count": 288, "machine": "macOS-26.5-arm64-arm-64bit-Mach-O", "max_steps": 4096, "min_ms": 50, "operation": "jacobian_kangaroo_multi_small", "ops_per_sec": 16112.77632, "ops_per_sec_max": 16128.333731, "ops_per_sec_min": 14985.164687, "paired_baseline_ops_per_sec": 15681.404363, "paired_baseline_ref": "main", "paired_speedup": 1.027508502874769, "point_passing": "const_ref", "range_bits": 8, "range_context": "precomputed", "raw_status": "keep", "reason": "", "runner_sample_count": 3, "sample_count": 1, "scratch": "reused", "seconds": 0.050022, "single_target_ops_per_sec": 32114.540528, "skipped": false, "speedup_vs_single": 0.501728, "start_scalar": "0x2", "status": "keep", "tame_states": 1, "target_count": 16, "target_throughput_vs_single": 8.027654, "timestamp": "2026-06-23T17:04:07Z", "wild_states": 16}
{"affine_active_path": "all_active_fast", "affine_buffer": "resize_reuse", "affine_conversion": "batch", "affine_field_ops": "inplace", "affine_reverse_loop": "split_zero", "affine_tail_update": "skip_final", "affine_z_access": "const_ref", "affine_z_check": "infinity_flag", "architecture": "shared_tame", "avg_dp_count": 288.0, "backend": "macos_cpu", "budget_sec": 8, "candidate_verification": "full_point_collision", "commit": "cf82107-dirty", "confirmation_index": 2, "confirmation_runs": 3, "confirmation_status": "keep", "cooldown_sec": 0.0, "correctness": true, "description": "Apple Silicon CPU shared-tame tiny 16-target kangaroo benchmark", "dp_bits": 0, "dp_bucket_storage": "inline_first", "dp_capacity": "max_load_2of3", "dp_clear": "empty_guard", "dp_hash": "partial_limb_mix", "dp_key": "x_parity", "dp_lookup": "open_address_linear", "dp_reserve": "sqrt_range_estimate", "ecint_carry_impl": "clang_builtin", "ecint_mul_final_sub": "single_conditional", "expected_private_key": "0x7", "experiment": "jacobian_kangaroo_multi16_small", "field_rhs_passing": "const_ref", "found_private_key": "0x7", "found_target_index": 15, "iterations": 805, "jacobian_step_passing": "const_ref", "jump_count": 8, "jump_index": "power2_mask", "jump_table": "precomputed", "last_dp_count": 288, "machine": "macOS-26.5-arm64-arm-64bit-Mach-O", "max_steps": 4096, "min_ms": 50, "operation": "jacobian_kangaroo_multi_small", "ops_per_sec": 16093.576088, "ops_per_sec_max": 16144.501279, "ops_per_sec_min": 16055.651808, "paired_baseline_ops_per_sec": 15778.645561, "paired_baseline_ref": "main", "paired_speedup": 1.0199592877463712, "point_passing": "const_ref", "range_bits": 8, "range_context": "precomputed", "raw_status": "keep", "reason": "", "runner_sample_count": 3, "sample_count": 1, "scratch": "reused", "seconds": 0.05002, "single_target_ops_per_sec": 31666.726575, "skipped": false, "speedup_vs_single": 0.508217, "start_scalar": "0x2", "status": "keep", "tame_states": 1, "target_count": 16, "target_throughput_vs_single": 8.131476, "timestamp": "2026-06-23T17:04:07Z", "wild_states": 16}
{"affine_active_path": "all_active_fast", "affine_buffer": "resize_reuse", "affine_conversion": "batch", "affine_field_ops": "inplace", "affine_reverse_loop": "split_zero", "affine_tail_update": "skip_final", "affine_z_access": "const_ref", "affine_z_check": "infinity_flag", "architecture": "shared_tame", "avg_dp_count": 288.0, "backend": "macos_cpu", "budget_sec": 8, "candidate_verification": "full_point_collision", "commit": "cf82107-dirty", "confirmation_index": 3, "confirmation_runs": 3, "confirmation_status": "keep", "cooldown_sec": 0.0, "correctness": true, "description": "Apple Silicon CPU shared-tame tiny 16-target kangaroo benchmark", "dp_bits": 0, "dp_bucket_storage": "inline_first", "dp_capacity": "max_load_2of3", "dp_clear": "empty_guard", "dp_hash": "partial_limb_mix", "dp_key": "x_parity", "dp_lookup": "open_address_linear", "dp_reserve": "sqrt_range_estimate", "ecint_carry_impl": "clang_builtin", "ecint_mul_final_sub": "single_conditional", "expected_private_key": "0x7", "experiment": "jacobian_kangaroo_multi16_small", "field_rhs_passing": "const_ref", "found_private_key": "0x7", "found_target_index": 15, "iterations": 808, "jacobian_step_passing": "const_ref", "jump_count": 8, "jump_index": "power2_mask", "jump_table": "precomputed", "last_dp_count": 288, "machine": "macOS-26.5-arm64-arm-64bit-Mach-O", "max_steps": 4096, "min_ms": 50, "operation": "jacobian_kangaroo_multi_small", "ops_per_sec": 16147.902637, "ops_per_sec_max": 16156.903368, "ops_per_sec_min": 15976.192554, "paired_baseline_ops_per_sec": 15821.75214, "paired_baseline_ref": "main", "paired_speedup": 1.0206140567817035, "point_passing": "const_ref", "range_bits": 8, "range_context": "precomputed", "raw_status": "keep", "reason": "", "runner_sample_count": 3, "sample_count": 1, "scratch": "reused", "seconds": 0.050037, "single_target_ops_per_sec": 31636.941341, "skipped": false, "speedup_vs_single": 0.510413, "start_scalar": "0x2", "status": "keep", "tame_states": 1, "target_count": 16, "target_throughput_vs_single": 8.166606, "timestamp": "2026-06-23T17:04:07Z", "wild_states": 16}
