{"affine_scan_mode": "cpu_batch_prod_zz_zzz", "affine_scan_seconds": 0.007657, "backend": "metal", "budget_sec": 540, "bytes_per_target": 2.683818, "candidate_verification": "tag16_hash_filter_then_cpu_exact_key_equality", "commit": "6e8f49f-dirty", "confirmation_index": 2, "confirmation_runs": 2, "confirmation_status": "discard", "cooldown_sec": 10.0, "correctness": true, "description": "Fixed-round 25M target lookup setup-inclusive gate for compact target table build changes", "distance_tracking": "packet_distance_uint64", "dp_bits": 6, "dp_checksum": "0x7f111e78c67b5c18", "dp_count": 4121, "dp_distance_checksum": "0x894123b96acf0de5", "dp_query_count": 4121, "dp_tracking": "affine_x256_y_parity_cpu_batch", "exact_host_table_bytes": 1068595456, "experiment": "metal_jacobian_dynamic_dp_stream_xyzz_affine_scan_target_lookup_tag16_hash_filter25m_rounds_setup_inclusive", "filter_false_positive_count": 0, "filter_positive_count": 131072, "gpu_lookup_lookups_per_sec": 163934677.149142, "gpu_ops_per_sec": 107230034.865595, "hit_count": 131072, "injected_hits": 128, "iterations": 536870912, "jump_count": 16, "jump_histogram_max_bucket": 33562777, "jump_histogram_max_deviation_ppm": 249, "jump_histogram_min_bucket": 33546500, "jump_index": "power2_mask", "jump_mixer": "avalanche64", "jump_schedule": "power2", "lookup_engine": "gpu_filter16_hash_repeat", "lookup_engine_effective": "gpu_filter16_hash_repeat", "lookup_exact_seconds": 1.8e-05, "lookup_gpu_seconds": 0.025741, "lookup_hash_seconds": 0.000176, "lookup_layout": "open_address_tag16_hash_filter_exact256", "lookup_max_threads_per_threadgroup": 1024, "lookup_query_mode": "repeat", "lookup_repeat": 1024, "lookup_seconds": 0.025936, "lookup_thread_execution_width": 32, "lookup_threadgroup_limit": 512, "lookup_threads_per_threadgroup": 512, "lookups_per_sec": 162704760.598981, "machine": "macOS-26.5-arm64-arm-64bit-Mach-O", "max_threads_per_threadgroup": 1024, "min_ms": 0, "miss_count": 4088832, "operation": "jacobian_affine_scan_target_lookup_tag32_rounds", "ops_per_sec": 87372372.474576, "ops_per_sec_max": 102666360.840109, "ops_per_sec_min": 69753048.761341, "output_layout": "affine_dp_scan_target_lookup", "paired_baseline_ops_per_sec": 85013762.668708, "paired_baseline_ref": "HEAD", "paired_order": "alternate", "paired_speedup": 1.0277438585451077, "physical_filter_positive_count": 131072, "physical_query_count": 4219904, "query_count": 4219904, "query_input": "hash64_repeat_indexed", "raw_status": "keep", "reason": "", "repeat_positive_index_encoding": "base_query_count_repeated", "requested_hits": 64, "round_count": 2, "runner_sample_count": 3, "sample_count": 131072, "seconds": 5.006721, "setup_inclusive_ops_per_sec": 87372372.474576, "setup_inclusive_ops_per_sec_max": 102666360.840109, "setup_inclusive_ops_per_sec_min": 69753048.761341, "setup_inclusive_seconds": 6.14463, "skipped": false, "state_layout": "xyzz", "status": "discard", "steps_per_sample": 2048, "target_bucket_bytes": 268435456, "target_build_seconds": 1.104316, "target_count": 25005000, "target_filter_bucket_bytes": 67108864, "target_filter_build_seconds": 0.0, "target_key": "x256_y_parity", "target_key_bytes": 800160000, "target_lookup_checksum": "0x923b46f156f9d59b", "target_query_hash_bytes": 32968, "target_table_buckets": 33554432, "target_table_bytes": 67108864, "thread_execution_width": 32, "threadgroup_limit": 128, "threads_per_threadgroup": 128, "timestamp": "2026-06-30T23:20:10Z", "validation_seconds": 20.717915, "validation_workers": 8}
{"affine_scan_mode": "cpu_batch_prod_zz_zzz", "affine_scan_seconds": 0.005924, "backend": "metal", "budget_sec": 540, "bytes_per_target": 2.683818, "candidate_verification": "tag16_hash_filter_then_cpu_exact_key_equality", "commit": "24c0458-dirty", "confirmation_index": 1, "confirmation_runs": 2, "confirmation_status": "discard", "cooldown_sec": 10.0, "correctness": true, "description": "Fixed-round 25M target lookup setup-inclusive gate for compact target table build changes", "distance_tracking": "packet_distance_uint64", "dp_bits": 6, "dp_checksum": "0x7f111e78c67b5c18", "dp_count": 4121, "dp_distance_checksum": "0x894123b96acf0de5", "dp_query_count": 4121, "dp_tracking": "affine_x256_y_parity_cpu_batch", "exact_host_table_bytes": 1068595456, "experiment": "metal_jacobian_dynamic_dp_stream_xyzz_affine_scan_target_lookup_tag16_hash_filter25m_rounds_setup_inclusive", "filter_false_positive_count": 0, "filter_positive_count": 131072, "gpu_lookup_lookups_per_sec": 726171524.583616, "gpu_ops_per_sec": 124270542.880073, "hit_count": 131072, "injected_hits": 128, "iterations": 536870912, "jump_count": 16, "jump_histogram_max_bucket": 33562777, "jump_histogram_max_deviation_ppm": 249, "jump_histogram_min_bucket": 33546500, "jump_index": "power2_mask", "jump_mixer": "avalanche64", "jump_schedule": "power2", "lookup_buffer_seconds": 0.001056, "lookup_engine": "gpu_filter16_hash_repeat", "lookup_engine_effective": "gpu_filter16_hash_repeat", "lookup_exact_seconds": 1.7e-05, "lookup_gpu_seconds": 0.005811, "lookup_hash_seconds": 2.9e-05, "lookup_layout": "open_address_tag16_hash_filter_exact256", "lookup_max_threads_per_threadgroup": 1024, "lookup_query_mode": "repeat", "lookup_repeat": 1024, "lookup_seconds": 0.005858, "lookup_thread_execution_width": 32, "lookup_threadgroup_limit": 512, "lookup_threads_per_threadgroup": 512, "lookup_wall_seconds": 0.006914, "lookups_per_sec": 720396739.362383, "machine": "macOS-26.5-arm64-arm-64bit-Mach-O", "max_threads_per_threadgroup": 1024, "min_ms": 0, "miss_count": 4088832, "operation": "jacobian_affine_scan_target_lookup_tag32_rounds", "ops_per_sec": 108744283.313552, "ops_per_sec_max": 111564125.600459, "ops_per_sec_min": 83438920.706962, "output_layout": "affine_dp_scan_target_lookup", "paired_baseline_ops_per_sec": 109289870.840928, "paired_baseline_ref": "HEAD", "paired_order": "alternate", "paired_speedup": 0.9950078856972016, "physical_filter_positive_count": 131072, "physical_query_count": 4219904, "query_count": 4219904, "query_input": "hash64_repeat_indexed", "raw_status": "discard", "reason": "", "repeat_positive_index_encoding": "base_query_count_repeated", "requested_hits": 64, "round_count": 2, "runner_sample_count": 3, "sample_count": 131072, "seconds": 4.320178, "setup_inclusive_ops_per_sec": 108744283.313552, "setup_inclusive_ops_per_sec_max": 111564125.600459, "setup_inclusive_ops_per_sec_min": 83438920.706962, "setup_inclusive_seconds": 4.937004, "setup_inclusive_wall_ops_per_sec": 107473184.870859, "setup_inclusive_wall_seconds": 4.995394, "skipped": false, "state_layout": "xyzz", "status": "discard", "steps_per_sample": 2048, "target_bucket_bytes": 268435456, "target_build_seconds": 0.605044, "target_count": 25005000, "target_filter_bucket_bytes": 67108864, "target_filter_build_seconds": 0.0, "target_key": "x256_y_parity", "target_key_bytes": 800160000, "target_lookup_checksum": "0x923b46f156f9d59b", "target_query_hash_bytes": 32968, "target_table_buckets": 33554432, "target_table_bytes": 67108864, "thread_execution_width": 32, "threadgroup_limit": 128, "threads_per_threadgroup": 128, "timestamp": "2026-06-30T23:45:43Z", "validation_seconds": 15.568667, "validation_workers": 8, "walk_buffer_seconds": 0.057334, "walk_wall_seconds": 4.377512}
{"affine_scan_mode": "cpu_batch_prod_zz_zzz", "affine_scan_seconds": 0.00557, "backend": "metal", "budget_sec": 540, "bytes_per_target": 2.683818, "candidate_verification": "tag16_hash_filter_then_cpu_exact_key_equality", "commit": "24c0458-dirty", "confirmation_index": 2, "confirmation_runs": 2, "confirmation_status": "discard", "cooldown_sec": 10.0, "correctness": true, "description": "Fixed-round 25M target lookup setup-inclusive gate for compact target table build changes", "distance_tracking": "packet_distance_uint64", "dp_bits": 6, "dp_checksum": "0x7f111e78c67b5c18", "dp_count": 4121, "dp_distance_checksum": "0x894123b96acf0de5", "dp_query_count": 4121, "dp_tracking": "affine_x256_y_parity_cpu_batch", "exact_host_table_bytes": 1068595456, "experiment": "metal_jacobian_dynamic_dp_stream_xyzz_affine_scan_target_lookup_tag16_hash_filter25m_rounds_setup_inclusive", "filter_false_positive_count": 0, "filter_positive_count": 131072, "gpu_lookup_lookups_per_sec": 310949151.877947, "gpu_ops_per_sec": 109370977.456971, "hit_count": 131072, "injected_hits": 128, "iterations": 536870912, "jump_count": 16, "jump_histogram_max_bucket": 33562777, "jump_histogram_max_deviation_ppm": 249, "jump_histogram_min_bucket": 33546500, "jump_index": "power2_mask", "jump_mixer": "avalanche64", "jump_schedule": "power2", "lookup_buffer_seconds": 0.001107, "lookup_engine": "gpu_filter16_hash_repeat", "lookup_engine_effective": "gpu_filter16_hash_repeat", "lookup_exact_seconds": 2.3e-05, "lookup_gpu_seconds": 0.013571, "lookup_hash_seconds": 0.000174, "lookup_layout": "open_address_tag16_hash_filter_exact256", "lookup_max_threads_per_threadgroup": 1024, "lookup_query_mode": "repeat", "lookup_repeat": 1024, "lookup_seconds": 0.013769, "lookup_thread_execution_width": 32, "lookup_threadgroup_limit": 512, "lookup_threads_per_threadgroup": 512, "lookup_wall_seconds": 0.014876, "lookups_per_sec": 306481393.723162, "machine": "macOS-26.5-arm64-arm-64bit-Mach-O", "max_threads_per_threadgroup": 1024, "min_ms": 0, "miss_count": 4088832, "operation": "jacobian_affine_scan_target_lookup_tag32_rounds", "ops_per_sec": 93872895.943423, "ops_per_sec_max": 106299255.100132, "ops_per_sec_min": 75114617.489321, "output_layout": "affine_dp_scan_target_lookup", "paired_baseline_ops_per_sec": 84022131.839218, "paired_baseline_ref": "HEAD", "paired_order": "alternate", "paired_speedup": 1.117240111486996, "physical_filter_positive_count": 131072, "physical_query_count": 4219904, "query_count": 4219904, "query_input": "hash64_repeat_indexed", "raw_status": "keep", "reason": "", "repeat_positive_index_encoding": "base_query_count_repeated", "requested_hits": 64, "round_count": 2, "runner_sample_count": 3, "sample_count": 131072, "seconds": 4.908715, "setup_inclusive_ops_per_sec": 93872895.943423, "setup_inclusive_ops_per_sec_max": 106299255.100132, "setup_inclusive_ops_per_sec_min": 75114617.489321, "setup_inclusive_seconds": 5.719126, "setup_inclusive_wall_ops_per_sec": 93066402.630784, "setup_inclusive_wall_seconds": 5.768687, "skipped": false, "state_layout": "xyzz", "status": "discard", "steps_per_sample": 2048, "target_bucket_bytes": 268435456, "target_build_seconds": 0.791072, "target_count": 25005000, "target_filter_bucket_bytes": 67108864, "target_filter_build_seconds": 0.0, "target_key": "x256_y_parity", "target_key_bytes": 800160000, "target_lookup_checksum": "0x923b46f156f9d59b", "target_query_hash_bytes": 32968, "target_table_buckets": 33554432, "target_table_bytes": 67108864, "thread_execution_width": 32, "threadgroup_limit": 128, "threads_per_threadgroup": 128, "timestamp": "2026-06-30T23:45:43Z", "validation_seconds": 15.705269, "validation_workers": 8, "walk_buffer_seconds": 0.048454, "walk_wall_seconds": 4.957168}
{"affine_scan_mode": "cpu_batch_prod_zz_zzz", "affine_scan_seconds": 0.007387, "backend": "metal", "budget_sec": 360, "bytes_per_target": 2.683818, "candidate_verification": "tag16_hash_filter_then_cpu_exact_key_equality", "commit": "c86eef5-dirty", "cooldown_sec": 10.0, "correctness": true, "description": "Fixed-round 25M target lookup setup-inclusive wall-clock gate including Metal walk and lookup buffer setup", "distance_tracking": "packet_distance_uint64", "dp_bits": 6, "dp_checksum": "0x7f111e78c67b5c18", "dp_count": 4121, "dp_distance_checksum": "0x894123b96acf0de5", "dp_query_count": 4121, "dp_tracking": "affine_x256_y_parity_cpu_batch", "exact_host_table_bytes": 1068595456, "experiment": "metal_jacobian_dynamic_dp_stream_xyzz_affine_scan_target_lookup_tag16_hash_filter25m_rounds_setup_wall", "filter_false_positive_count": 0, "filter_positive_count": 131072, "gpu_lookup_lookups_per_sec": 294007639.634859, "gpu_ops_per_sec": 127326583.840071, "hit_count": 131072, "injected_hits": 128, "iterations": 536870912, "jump_count": 16, "jump_histogram_max_bucket": 33562777, "jump_histogram_max_deviation_ppm": 249, "jump_histogram_min_bucket": 33546500, "jump_index": "power2_mask", "jump_mixer": "avalanche64", "jump_schedule": "power2", "lookup_buffer_seconds": 0.000951, "lookup_engine": "gpu_filter16_hash_repeat", "lookup_engine_effective": "gpu_filter16_hash_repeat", "lookup_exact_seconds": 0.00036, "lookup_gpu_seconds": 0.014353, "lookup_hash_seconds": 1.6e-05, "lookup_layout": "open_address_tag16_hash_filter_exact256", "lookup_max_threads_per_threadgroup": 1024, "lookup_query_mode": "repeat", "lookup_repeat": 1024, "lookup_seconds": 0.014728, "lookup_thread_execution_width": 32, "lookup_threadgroup_limit": 512, "lookup_threads_per_threadgroup": 512, "lookup_wall_seconds": 0.015679, "lookups_per_sec": 286516881.014912, "machine": "macOS-26.5-arm64-arm-64bit-Mach-O", "max_threads_per_threadgroup": 1024, "min_ms": 0, "miss_count": 4088832, "operation": "jacobian_affine_scan_target_lookup_tag32_rounds", "ops_per_sec": 106910092.849915, "ops_per_sec_max": 108532970.848153, "ops_per_sec_min": 106563442.423185, "output_layout": "affine_dp_scan_target_lookup", "paired_baseline_ops_per_sec": 106621267.427845, "paired_baseline_ref": "main", "paired_order": "alternate", "paired_speedup": 1.0027088912844284, "physical_filter_positive_count": 131072, "physical_query_count": 4219904, "query_count": 4219904, "query_input": "hash64_repeat_indexed", "reason": "", "repeat_positive_index_encoding": "base_query_count_repeated", "requested_hits": 64, "round_count": 2, "runner_sample_count": 3, "sample_count": 131072, "seconds": 4.216487, "setup_inclusive_ops_per_sec": 108323961.521754, "setup_inclusive_seconds": 4.95616, "setup_inclusive_wall_ops_per_sec": 106910092.849915, "setup_inclusive_wall_ops_per_sec_max": 108532970.848153, "setup_inclusive_wall_ops_per_sec_min": 106563442.423185, "setup_inclusive_wall_seconds": 5.021705, "skipped": false, "state_layout": "xyzz", "status": "discard", "steps_per_sample": 2048, "target_bucket_bytes": 268435456, "target_build_seconds": 0.717558, "target_count": 25005000, "target_filter_bucket_bytes": 67108864, "target_filter_build_seconds": 0.0, "target_key": "x256_y_parity", "target_key_bytes": 800160000, "target_lookup_checksum": "0x923b46f156f9d59b", "target_query_hash_bytes": 32968, "target_table_buckets": 33554432, "target_table_bytes": 67108864, "thread_execution_width": 32, "threadgroup_limit": 128, "threads_per_threadgroup": 128, "timestamp": "2026-07-01T00:15:39Z", "validation_seconds": 14.967968, "validation_workers": 8, "walk_buffer_seconds": 0.064593, "walk_wall_seconds": 4.281081}
{"affine_scan_mode": "cpu_batch_prod_zz_zzz", "affine_scan_seconds": 0.007576, "backend": "metal", "budget_sec": 720, "bytes_per_target": 2.683818, "candidate_verification": "tag16_hash_filter_then_cpu_exact_key_equality", "commit": "7b4423e-dirty", "confirmation_index": 1, "confirmation_runs": 2, "confirmation_status": "keep", "cooldown_sec": 10.0, "correctness": true, "description": "Fixed-round 25M target lookup setup-inclusive wall-clock gate including Metal walk and lookup buffer setup", "distance_tracking": "packet_distance_uint64", "dp_bits": 6, "dp_checksum": "0x7f111e78c67b5c18", "dp_count": 4121, "dp_distance_checksum": "0x894123b96acf0de5", "dp_query_count": 4121, "dp_tracking": "affine_x256_y_parity_cpu_batch", "exact_host_table_bytes": 1068595456, "experiment": "metal_jacobian_dynamic_dp_stream_xyzz_affine_scan_target_lookup_tag16_hash_filter25m_rounds_setup_wall", "filter_false_positive_count": 0, "filter_positive_count": 131072, "gpu_lookup_lookups_per_sec": 427081553.786377, "gpu_ops_per_sec": 121448561.702998, "hit_count": 131072, "injected_hits": 128, "iterations": 536870912, "jump_count": 16, "jump_histogram_max_bucket": 33562777, "jump_histogram_max_deviation_ppm": 249, "jump_histogram_min_bucket": 33546500, "jump_index": "power2_mask", "jump_mixer": "avalanche64", "jump_schedule": "power2", "lookup_buffer_seconds": 0.004111, "lookup_engine": "gpu_filter16_hash_repeat", "lookup_engine_effective": "gpu_filter16_hash_repeat", "lookup_exact_seconds": 2.6e-05, "lookup_gpu_seconds": 0.009881, "lookup_hash_seconds": 1.3e-05, "lookup_layout": "open_address_tag16_hash_filter_exact256", "lookup_max_threads_per_threadgroup": 1024, "lookup_query_mode": "repeat", "lookup_repeat": 1024, "lookup_seconds": 0.00992, "lookup_thread_execution_width": 32, "lookup_threadgroup_limit": 512, "lookup_threads_per_threadgroup": 512, "lookup_wall_seconds": 0.014031, "lookups_per_sec": 425380984.210849, "machine": "macOS-26.5-arm64-arm-64bit-Mach-O", "max_threads_per_threadgroup": 1024, "min_ms": 0, "miss_count": 4088832, "operation": "jacobian_affine_scan_target_lookup_tag32_rounds", "ops_per_sec": 102762281.417187, "ops_per_sec_max": 104285222.855177, "ops_per_sec_min": 96101866.718765, "output_layout": "affine_dp_scan_target_lookup", "paired_baseline_ops_per_sec": 101650514.686968, "paired_baseline_ref": "main", "paired_order": "alternate", "paired_speedup": 1.0109371480670086, "physical_filter_positive_count": 131072, "physical_query_count": 4219904, "query_count": 4219904, "query_input": "hash64_repeat_indexed", "raw_status": "keep", "reason": "", "repeat_positive_index_encoding": "base_query_count_repeated", "requested_hits": 64, "round_count": 2, "round_sample_build_seconds": 0.004335, "runner_sample_count": 3, "sample_count": 131072, "seconds": 4.420562, "setup_inclusive_ops_per_sec": 104116801.474117, "setup_inclusive_seconds": 5.156429, "setup_inclusive_wall_ops_per_sec": 102762281.417187, "setup_inclusive_wall_ops_per_sec_max": 104285222.855177, "setup_inclusive_wall_ops_per_sec_min": 96101866.718765, "setup_inclusive_wall_seconds": 5.224397, "skipped": false, "state_layout": "xyzz", "status": "keep", "steps_per_sample": 2048, "target_bucket_bytes": 268435456, "target_build_seconds": 0.714036, "target_count": 25005000, "target_filter_bucket_bytes": 67108864, "target_filter_build_seconds": 0.0, "target_key": "x256_y_parity", "target_key_bytes": 800160000, "target_lookup_checksum": "0x923b46f156f9d59b", "target_query_hash_bytes": 32968, "target_table_buckets": 33554432, "target_table_bytes": 67108864, "thread_execution_width": 32, "threadgroup_limit": 128, "threads_per_threadgroup": 128, "timestamp": "2026-07-01T00:39:24Z", "validation_seconds": 17.628799, "validation_workers": 8, "walk_buffer_seconds": 0.063857, "walk_wall_seconds": 4.484419}
