{"backend": "macos_cpu", "budget_sec": 180, "candidate_verification": "legacy_rehash_filter_byte_equality", "commit": "4ac0438-dirty", "confirmation_index": 2, "confirmation_runs": 2, "confirmation_status": "keep", "cooldown_sec": 0.0, "correctness": true, "derived_seconds": 0.433411, "derived_targets_per_sec": 115386922.484127, "description": "Host setup benchmark comparing legacy rehash/probe filter construction against deriving tag32/tag16 filters from the already-built exact tag32 table", "experiment": "target_lookup_filter_build_from_tag32_buckets", "iterations": 1, "legacy_seconds": 6.699196, "legacy_targets_per_sec": 7465075.237736, "lookup_layout": "open_address_tag32_tag16_filter_exact256", "machine": "macOS-26.5-arm64-arm-64bit-Mach-O", "min_ms": 0, "operation": "target_lookup_filter_build_from_tag32_buckets", "ops_per_sec": 15.4569, "ops_per_sec_max": 25.8355, "ops_per_sec_min": 10.253335, "raw_status": "keep", "reason": "", "runner_sample_count": 3, "sample_count": 25005000, "seconds": 0.433411, "setup_phase": "host_filter_build", "skipped": false, "speedup": 15.4569, "speedup_max": 25.8355, "speedup_min": 10.253335, "status": "keep", "tag16_byte_equal": true, "tag16_derived_seconds": 0.159901, "tag16_filter_checksum": "0x8ba16d0e4799e611", "tag16_legacy_seconds": 2.315325, "tag16_speedup": 14.479711, "tag32_byte_equal": true, "tag32_derived_seconds": 0.27351, "tag32_filter_checksum": "0x42b1584566f30df0", "tag32_legacy_seconds": 4.383871, "tag32_speedup": 16.028191, "target_bucket_bytes": 268435456, "target_count": 25005000, "target_filter16_bucket_bytes": 67108864, "target_filter32_bucket_bytes": 134217728, "target_key": "x256_y_parity", "target_key_bytes": 1000200000, "target_table_buckets": 33554432, "target_table_bytes": 201326592, "timestamp": "2026-06-27T22:14:24Z"}
{"backend": "macos_cpu", "budget_sec": 180, "candidate_verification": "legacy_rehash_filter_byte_equality", "commit": "0e2b8d6-dirty", "confirmation_index": 1, "confirmation_runs": 2, "confirmation_status": "discard", "cooldown_sec": 0.0, "correctness": true, "derived_seconds": 0.167105, "derived_targets_per_sec": 299272315.863193, "description": "Host setup benchmark comparing legacy rehash/probe filter construction against deriving tag32/tag16 filters from the already-built exact tag32 table", "experiment": "target_lookup_filter_build_from_tag32_buckets", "iterations": 1, "legacy_seconds": 2.224827, "legacy_targets_per_sec": 22478155.598267, "lookup_layout": "open_address_tag32_tag16_filter_exact256", "machine": "macOS-26.5-arm64-arm-64bit-Mach-O", "min_ms": 0, "operation": "target_lookup_filter_build_from_tag32_buckets", "ops_per_sec": 13.313918, "ops_per_sec_max": 16.044181, "ops_per_sec_min": 11.65256, "paired_baseline_ops_per_sec": 17.005541, "paired_baseline_ref": "HEAD", "paired_speedup": 0.7829164623460082, "raw_status": "discard", "reason": "", "runner_sample_count": 3, "sample_count": 25005000, "seconds": 0.167105, "setup_phase": "host_filter_build", "skipped": false, "speedup": 13.313918, "speedup_max": 16.044181, "speedup_min": 11.65256, "status": "discard", "tag16_byte_equal": true, "tag16_derived_seconds": 0.080966, "tag16_filter_checksum": "0x8ba16d0e4799e611", "tag16_legacy_seconds": 1.045848, "tag16_speedup": 12.917168, "tag32_byte_equal": true, "tag32_derived_seconds": 0.08614, "tag32_filter_checksum": "0x42b1584566f30df0", "tag32_legacy_seconds": 1.178978, "tag32_speedup": 13.686838, "target_bucket_bytes": 268435456, "target_count": 25005000, "target_filter16_bucket_bytes": 67108864, "target_filter32_bucket_bytes": 134217728, "target_key": "x256_y_parity", "target_key_bytes": 1000200000, "target_table_buckets": 33554432, "target_table_bytes": 201326592, "timestamp": "2026-06-27T22:23:41Z"}
{"backend": "macos_cpu", "budget_sec": 180, "candidate_verification": "legacy_rehash_filter_byte_equality", "commit": "0e2b8d6-dirty", "confirmation_index": 2, "confirmation_runs": 2, "confirmation_status": "discard", "cooldown_sec": 0.0, "correctness": true, "derived_seconds": 0.717555, "derived_targets_per_sec": 69694965.552319, "description": "Host setup benchmark comparing legacy rehash/probe filter construction against deriving tag32/tag16 filters from the already-built exact tag32 table", "experiment": "target_lookup_filter_build_from_tag32_buckets", "iterations": 1, "legacy_seconds": 7.075424, "legacy_targets_per_sec": 7068127.981261, "lookup_layout": "open_address_tag32_tag16_filter_exact256", "machine": "macOS-26.5-arm64-arm-64bit-Mach-O", "min_ms": 0, "operation": "target_lookup_filter_build_from_tag32_buckets", "ops_per_sec": 9.860456, "ops_per_sec_max": 11.026878, "ops_per_sec_min": 4.515834, "paired_baseline_ops_per_sec": 12.887176, "paired_baseline_ref": "HEAD", "paired_speedup": 0.7651370633876653, "raw_status": "discard", "reason": "", "runner_sample_count": 3, "sample_count": 25005000, "seconds": 0.717555, "setup_phase": "host_filter_build", "skipped": false, "speedup": 9.860456, "speedup_max": 11.026878, "speedup_min": 4.515834, "status": "discard", "tag16_byte_equal": true, "tag16_derived_seconds": 0.207333, "tag16_filter_checksum": "0x8ba16d0e4799e611", "tag16_legacy_seconds": 2.615585, "tag16_speedup": 12.615381, "tag32_byte_equal": true, "tag32_derived_seconds": 0.510222, "tag32_filter_checksum": "0x42b1584566f30df0", "tag32_legacy_seconds": 4.459838, "tag32_speedup": 8.74097, "target_bucket_bytes": 268435456, "target_count": 25005000, "target_filter16_bucket_bytes": 67108864, "target_filter32_bucket_bytes": 134217728, "target_key": "x256_y_parity", "target_key_bytes": 1000200000, "target_table_buckets": 33554432, "target_table_bytes": 201326592, "timestamp": "2026-06-27T22:23:42Z"}
{"affine_scan_mode": "cpu_batch_prod_zz_zzz", "affine_scan_seconds": 0.016097, "backend": "metal", "budget_sec": 180, "bytes_per_target": 2.683818, "candidate_verification": "tag16_hash_filter_then_cpu_exact_key_equality", "commit": "d49d083-dirty", "confirmation_index": 1, "confirmation_runs": 2, "confirmation_status": "discard", "cooldown_sec": 10.0, "correctness": true, "description": "Metal XYZZ affine DP scan tag16 hash-filter 25M-target repeat2048 lookup with thresholded parallel host query-hash build", "distance_tracking": "packet_distance_uint64", "dp_bits": 8, "dp_checksum": "0x9dba4a07ebbb8e14", "dp_count": 1057, "dp_distance_checksum": "0xf0dc88ed68b2ff64", "dp_query_count": 1057, "dp_tracking": "affine_x256_y_parity_cpu_batch", "exact_host_table_bytes": 1268635456, "experiment": "metal_jacobian_dynamic_dp_stream_xyzz_affine_scan_target_lookup_tag16_hash_filter25m_parallel_hash_repeat2048", "filter_false_positive_count": 444, "filter_positive_count": 508, "gpu_lookup_lookups_per_sec": 60967386.243725, "gpu_ops_per_sec": 123714600.752975, "hit_count": 64, "injected_hits": 64, "iterations": 134217728, "jump_count": 16, "jump_histogram_max_bucket": 8394316, "jump_histogram_max_deviation_ppm": 759, "jump_histogram_min_bucket": 8382245, "jump_index": "power2_mask", "jump_mixer": "avalanche64", "jump_schedule": "power2", "lookup_engine": "gpu_filter16_hash", "lookup_engine_effective": "gpu_filter16_hash", "lookup_exact_seconds": 0.001713, "lookup_gpu_seconds": 0.035506, "lookup_hash_seconds": 0.005835, "lookup_layout": "open_address_tag16_hash_filter_exact256", "lookup_max_threads_per_threadgroup": 1024, "lookup_query_mode": "distinct_misses", "lookup_repeat": 2048, "lookup_seconds": 0.043055, "lookup_thread_execution_width": 32, "lookup_threadgroup_limit": 512, "lookup_threads_per_threadgroup": 512, "lookups_per_sec": 50278631.005812, "lookups_per_sec_max": 54264122.230441, "lookups_per_sec_min": 23132886.417717, "machine": "macOS-26.5-arm64-arm-64bit-Mach-O", "max_threads_per_threadgroup": 1024, "min_ms": 500, "miss_count": 2164672, "operation": "jacobian_affine_scan_target_lookup_tag32", "ops_per_sec": 50278631.005812, "ops_per_sec_max": 54264122.230441, "ops_per_sec_min": 23132886.417717, "output_layout": "affine_dp_scan_target_lookup", "paired_baseline_ops_per_sec": 52677292.814226, "paired_baseline_ref": "HEAD", "paired_speedup": 0.9544649756988608, "query_count": 2164736, "query_input": "hash64", "raw_status": "discard", "reason": "", "requested_hits": 64, "runner_sample_count": 3, "sample_count": 262144, "seconds": 1.084898, "skipped": false, "state_layout": "xyzz", "status": "discard", "steps_per_sample": 512, "target_bucket_bytes": 268435456, "target_count": 25005000, "target_filter_bucket_bytes": 67108864, "target_key": "x256_y_parity", "target_key_bytes": 1000200000, "target_lookup_checksum": "0x90b9fdeac531859a", "target_query_hash_bytes": 17317888, "target_table_buckets": 33554432, "target_table_bytes": 67108864, "thread_execution_width": 32, "threadgroup_limit": 128, "threads_per_threadgroup": 128, "timestamp": "2026-06-27T22:33:48Z", "validation_seconds": 4.633192, "validation_workers": 8}
{"affine_scan_mode": "cpu_batch_prod_zz_zzz", "affine_scan_seconds": 0.017009, "backend": "metal", "budget_sec": 180, "bytes_per_target": 2.683818, "candidate_verification": "tag16_hash_filter_then_cpu_exact_key_equality", "commit": "d49d083-dirty", "confirmation_index": 2, "confirmation_runs": 2, "confirmation_status": "discard", "cooldown_sec": 10.0, "correctness": true, "description": "Metal XYZZ affine DP scan tag16 hash-filter 25M-target repeat2048 lookup with thresholded parallel host query-hash build", "distance_tracking": "packet_distance_uint64", "dp_bits": 8, "dp_checksum": "0x9dba4a07ebbb8e14", "dp_count": 1057, "dp_distance_checksum": "0xf0dc88ed68b2ff64", "dp_query_count": 1057, "dp_tracking": "affine_x256_y_parity_cpu_batch", "exact_host_table_bytes": 1268635456, "experiment": "metal_jacobian_dynamic_dp_stream_xyzz_affine_scan_target_lookup_tag16_hash_filter25m_parallel_hash_repeat2048", "filter_false_positive_count": 444, "filter_positive_count": 508, "gpu_lookup_lookups_per_sec": 83375321.361514, "gpu_ops_per_sec": 70507733.353646, "hit_count": 64, "injected_hits": 64, "iterations": 134217728, "jump_count": 16, "jump_histogram_max_bucket": 8394316, "jump_histogram_max_deviation_ppm": 759, "jump_histogram_min_bucket": 8382245, "jump_index": "power2_mask", "jump_mixer": "avalanche64", "jump_schedule": "power2", "lookup_engine": "gpu_filter16_hash", "lookup_engine_effective": "gpu_filter16_hash", "lookup_exact_seconds": 0.001741, "lookup_gpu_seconds": 0.025964, "lookup_hash_seconds": 0.005007, "lookup_layout": "open_address_tag16_hash_filter_exact256", "lookup_max_threads_per_threadgroup": 1024, "lookup_query_mode": "distinct_misses", "lookup_repeat": 2048, "lookup_seconds": 0.032711, "lookup_thread_execution_width": 32, "lookup_threadgroup_limit": 512, "lookup_threads_per_threadgroup": 512, "lookups_per_sec": 66177027.375654, "lookups_per_sec_max": 119825694.071885, "lookups_per_sec_min": 54924822.724691, "machine": "macOS-26.5-arm64-arm-64bit-Mach-O", "max_threads_per_threadgroup": 1024, "min_ms": 500, "miss_count": 2164672, "operation": "jacobian_affine_scan_target_lookup_tag32", "ops_per_sec": 66177027.375654, "ops_per_sec_max": 119825694.071885, "ops_per_sec_min": 54924822.724691, "output_layout": "affine_dp_scan_target_lookup", "paired_baseline_ops_per_sec": 48873279.340701, "paired_baseline_ref": "HEAD", "paired_speedup": 1.3540533450666707, "query_count": 2164736, "query_input": "hash64", "raw_status": "keep", "reason": "", "requested_hits": 64, "runner_sample_count": 3, "sample_count": 262144, "seconds": 1.903589, "skipped": false, "state_layout": "xyzz", "status": "discard", "steps_per_sample": 512, "target_bucket_bytes": 268435456, "target_count": 25005000, "target_filter_bucket_bytes": 67108864, "target_key": "x256_y_parity", "target_key_bytes": 1000200000, "target_lookup_checksum": "0x90b9fdeac531859a", "target_query_hash_bytes": 17317888, "target_table_buckets": 33554432, "target_table_bytes": 67108864, "thread_execution_width": 32, "threadgroup_limit": 128, "threads_per_threadgroup": 128, "timestamp": "2026-06-27T22:33:48Z", "validation_seconds": 7.641007, "validation_workers": 8}
{"affine_scan_mode": "cpu_batch_prod_zz_zzz", "affine_scan_seconds": 0.092251, "backend": "metal", "budget_sec": 180, "bytes_per_target": 2.683818, "candidate_verification": "tag16_hash_filter_then_cpu_exact_key_equality", "commit": "d49d083-dirty", "confirmation_index": 1, "confirmation_runs": 2, "confirmation_status": "keep", "cooldown_sec": 10.0, "correctness": true, "description": "Metal XYZZ affine DP scan tag16 hash-filter 25M-target repeat-mode lookup with host reuse of repeated DP query hashes", "distance_tracking": "packet_distance_uint64", "dp_bits": 8, "dp_checksum": "0x9dba4a07ebbb8e14", "dp_count": 1057, "dp_distance_checksum": "0xf0dc88ed68b2ff64", "dp_query_count": 1057, "dp_tracking": "affine_x256_y_parity_cpu_batch", "exact_host_table_bytes": 1268635456, "experiment": "metal_jacobian_dynamic_dp_stream_xyzz_affine_scan_target_lookup_tag16_hash_filter25m_repeat_mode2048", "filter_false_positive_count": 2048, "filter_positive_count": 133120, "gpu_lookup_lookups_per_sec": 120925406.124298, "gpu_ops_per_sec": 35449002.849511, "hit_count": 131072, "injected_hits": 64, "iterations": 134217728, "jump_count": 16, "jump_histogram_max_bucket": 8394316, "jump_histogram_max_deviation_ppm": 759, "jump_histogram_min_bucket": 8382245, "jump_index": "power2_mask", "jump_mixer": "avalanche64", "jump_schedule": "power2", "lookup_engine": "gpu_filter16_hash", "lookup_engine_effective": "gpu_filter16_hash", "lookup_exact_seconds": 0.015059, "lookup_gpu_seconds": 0.017901, "lookup_hash_seconds": 0.00146, "lookup_layout": "open_address_tag16_hash_filter_exact256", "lookup_max_threads_per_threadgroup": 1024, "lookup_query_mode": "repeat", "lookup_repeat": 2048, "lookup_seconds": 0.03442, "lookup_thread_execution_width": 32, "lookup_threadgroup_limit": 512, "lookup_threads_per_threadgroup": 512, "lookups_per_sec": 62891277.208879, "lookups_per_sec_max": 114564076.569467, "lookups_per_sec_min": 57925816.103698, "machine": "macOS-26.5-arm64-arm-64bit-Mach-O", "max_threads_per_threadgroup": 1024, "min_ms": 500, "miss_count": 2033664, "operation": "jacobian_affine_scan_target_lookup_tag32", "ops_per_sec": 62891277.208879, "ops_per_sec_max": 114564076.569467, "ops_per_sec_min": 57925816.103698, "output_layout": "affine_dp_scan_target_lookup", "paired_baseline_ops_per_sec": 54985101.284367, "paired_baseline_ref": "HEAD", "paired_speedup": 1.1437876031840617, "query_count": 2164736, "query_input": "hash64", "raw_status": "keep", "reason": "", "requested_hits": 64, "runner_sample_count": 3, "sample_count": 262144, "seconds": 3.78622, "skipped": false, "state_layout": "xyzz", "status": "keep", "steps_per_sample": 512, "target_bucket_bytes": 268435456, "target_count": 25005000, "target_filter_bucket_bytes": 67108864, "target_key": "x256_y_parity", "target_key_bytes": 1000200000, "target_lookup_checksum": "0x5b746bd07e35a252", "target_query_hash_bytes": 17317888, "target_table_buckets": 33554432, "target_table_bytes": 67108864, "thread_execution_width": 32, "threadgroup_limit": 128, "threads_per_threadgroup": 128, "timestamp": "2026-06-27T22:40:14Z", "validation_seconds": 21.127261, "validation_workers": 8}
{"affine_scan_mode": "cpu_batch_prod_zz_zzz", "affine_scan_seconds": 0.026358, "backend": "metal", "budget_sec": 180, "bytes_per_target": 2.683818, "candidate_verification": "tag16_hash_filter_then_cpu_exact_key_equality", "commit": "d49d083-dirty", "confirmation_index": 2, "confirmation_runs": 2, "confirmation_status": "keep", "cooldown_sec": 10.0, "correctness": true, "description": "Metal XYZZ affine DP scan tag16 hash-filter 25M-target repeat-mode lookup with host reuse of repeated DP query hashes", "distance_tracking": "packet_distance_uint64", "dp_bits": 8, "dp_checksum": "0x9dba4a07ebbb8e14", "dp_count": 1057, "dp_distance_checksum": "0xf0dc88ed68b2ff64", "dp_query_count": 1057, "dp_tracking": "affine_x256_y_parity_cpu_batch", "exact_host_table_bytes": 1268635456, "experiment": "metal_jacobian_dynamic_dp_stream_xyzz_affine_scan_target_lookup_tag16_hash_filter25m_repeat_mode2048", "filter_false_positive_count": 2048, "filter_positive_count": 133120, "gpu_lookup_lookups_per_sec": 124385395.132393, "gpu_ops_per_sec": 65392639.601254, "hit_count": 131072, "injected_hits": 64, "iterations": 134217728, "jump_count": 16, "jump_histogram_max_bucket": 8394316, "jump_histogram_max_deviation_ppm": 759, "jump_histogram_min_bucket": 8382245, "jump_index": "power2_mask", "jump_mixer": "avalanche64", "jump_schedule": "power2", "lookup_engine": "gpu_filter16_hash", "lookup_engine_effective": "gpu_filter16_hash", "lookup_exact_seconds": 0.006785, "lookup_gpu_seconds": 0.017403, "lookup_hash_seconds": 0.000689, "lookup_layout": "open_address_tag16_hash_filter_exact256", "lookup_max_threads_per_threadgroup": 1024, "lookup_query_mode": "repeat", "lookup_repeat": 2048, "lookup_seconds": 0.024877, "lookup_thread_execution_width": 32, "lookup_threadgroup_limit": 512, "lookup_threads_per_threadgroup": 512, "lookups_per_sec": 87016838.867127, "lookups_per_sec_max": 116841177.067168, "lookups_per_sec_min": 38083277.825831, "machine": "macOS-26.5-arm64-arm-64bit-Mach-O", "max_threads_per_threadgroup": 1024, "min_ms": 500, "miss_count": 2033664, "operation": "jacobian_affine_scan_target_lookup_tag32", "ops_per_sec": 87016838.867127, "ops_per_sec_max": 116841177.067168, "ops_per_sec_min": 38083277.825831, "output_layout": "affine_dp_scan_target_lookup", "paired_baseline_ops_per_sec": 76126484.96839, "paired_baseline_ref": "HEAD", "paired_speedup": 1.143056045517654, "query_count": 2164736, "query_input": "hash64", "raw_status": "keep", "reason": "", "requested_hits": 64, "runner_sample_count": 3, "sample_count": 262144, "seconds": 2.05249, "skipped": false, "state_layout": "xyzz", "status": "keep", "steps_per_sample": 512, "target_bucket_bytes": 268435456, "target_count": 25005000, "target_filter_bucket_bytes": 67108864, "target_key": "x256_y_parity", "target_key_bytes": 1000200000, "target_lookup_checksum": "0x5b746bd07e35a252", "target_query_hash_bytes": 17317888, "target_table_buckets": 33554432, "target_table_bytes": 67108864, "thread_execution_width": 32, "threadgroup_limit": 128, "threads_per_threadgroup": 128, "timestamp": "2026-06-27T22:40:14Z", "validation_seconds": 6.702106, "validation_workers": 8}
{"affine_scan_mode": "cpu_batch_prod_zz_zzz", "affine_scan_seconds": 0.02311, "backend": "metal", "budget_sec": 180, "bytes_per_target": 2.683818, "candidate_verification": "tag16_hash_filter_then_cpu_exact_key_equality", "commit": "5cfda6b-dirty", "confirmation_index": 1, "confirmation_runs": 2, "confirmation_status": "discard", "cooldown_sec": 10.0, "correctness": true, "description": "Metal XYZZ affine DP scan tag16 hash-filter 25M-target repeat-mode lookup with host reuse of repeated DP query hashes", "distance_tracking": "packet_distance_uint64", "dp_bits": 8, "dp_checksum": "0x9dba4a07ebbb8e14", "dp_count": 1057, "dp_distance_checksum": "0xf0dc88ed68b2ff64", "dp_query_count": 1057, "dp_tracking": "affine_x256_y_parity_cpu_batch", "exact_host_table_bytes": 1268635456, "experiment": "metal_jacobian_dynamic_dp_stream_xyzz_affine_scan_target_lookup_tag16_hash_filter25m_repeat_mode2048", "filter_false_positive_count": 2048, "filter_positive_count": 133120, "gpu_lookup_lookups_per_sec": 172109501.706477, "gpu_ops_per_sec": 124432977.174326, "hit_count": 131072, "injected_hits": 64, "iterations": 134217728, "jump_count": 16, "jump_histogram_max_bucket": 8394316, "jump_histogram_max_deviation_ppm": 759, "jump_histogram_min_bucket": 8382245, "jump_index": "power2_mask", "jump_mixer": "avalanche64", "jump_schedule": "power2", "lookup_engine": "gpu_filter16_hash", "lookup_engine_effective": "gpu_filter16_hash", "lookup_exact_seconds": 0.017509, "lookup_gpu_seconds": 0.012578, "lookup_hash_seconds": 0.003328, "lookup_layout": "open_address_tag16_hash_filter_exact256", "lookup_max_threads_per_threadgroup": 1024, "lookup_query_mode": "repeat", "lookup_repeat": 2048, "lookup_seconds": 0.033415, "lookup_thread_execution_width": 32, "lookup_threadgroup_limit": 512, "lookup_threads_per_threadgroup": 512, "lookups_per_sec": 64783036.996344, "lookups_per_sec_max": 123132207.845439, "lookups_per_sec_min": 19055082.894702, "machine": "macOS-26.5-arm64-arm-64bit-Mach-O", "max_threads_per_threadgroup": 1024, "min_ms": 500, "miss_count": 2033664, "operation": "jacobian_affine_scan_target_lookup_tag32", "ops_per_sec": 64783036.996344, "ops_per_sec_max": 123132207.845439, "ops_per_sec_min": 19055082.894702, "output_layout": "affine_dp_scan_target_lookup", "paired_baseline_ops_per_sec": 78322500.113066, "paired_baseline_ref": "HEAD", "paired_speedup": 0.827131882956028, "query_count": 2164736, "query_input": "hash64", "raw_status": "discard", "reason": "", "requested_hits": 64, "runner_sample_count": 3, "sample_count": 262144, "seconds": 1.078635, "skipped": false, "state_layout": "xyzz", "status": "discard", "steps_per_sample": 512, "target_bucket_bytes": 268435456, "target_count": 25005000, "target_filter_bucket_bytes": 67108864, "target_key": "x256_y_parity", "target_key_bytes": 1000200000, "target_lookup_checksum": "0x5b746bd07e35a252", "target_query_hash_bytes": 17317888, "target_table_buckets": 33554432, "target_table_bytes": 67108864, "thread_execution_width": 32, "threadgroup_limit": 128, "threads_per_threadgroup": 128, "timestamp": "2026-06-27T22:52:19Z", "validation_seconds": 4.107201, "validation_workers": 8}
