{"affine_scan_mode": "cpu_batch_prod_zz_zzz", "affine_scan_seconds": 0.040572, "backend": "metal", "budget_sec": 540, "bytes_per_target": 2.683818, "candidate_verification": "tag16_hash_filter_then_cpu_exact_key_equality", "commit": "7cf8dbf-dirty", "cooldown_sec": 10.0, "correctness": true, "description": "Fixed-round 25M target lookup with physical distinct-miss queries; scores setup-inclusive wall-clock kangaroo distance/sec", "distance_per_sec": 195635311970.02045, "distance_tracking": "packet_distance_uint64", "distinct_miss_source_seconds": 3.3e-05, "dp_bits": 6, "dp_checksum": "0x7f111e78c67b5c18", "dp_count": 4121, "dp_distance_checksum": "0x894123b96acf0de5", "dp_normalization": "host_batch_affine", "dp_query_count": 4121, "dp_sampling": "packet_endpoint", "dp_tracking": "affine_x256_y_parity_cpu_batch", "exact_host_table_bytes": 268439552, "experiment": "metal_jacobian_dynamic_dp_stream_xyzz_affine_scan_target_lookup_tag16_hash_filter25m_rounds_distinct_misses_distance", "filter_false_positive_count": 414, "filter_positive_count": 542, "gpu_distance_per_sec": 196687445398.75266, "gpu_lookup_lookups_per_sec": 230299063.234521, "gpu_ops_per_sec": 48020128.578318, "hit_count": 128, "injected_hits": 128, "iterations": 536870912, "jump_count": 16, "jump_histogram_max_bucket": 33562777, "jump_histogram_max_deviation_ppm": 249, "jump_histogram_min_bucket": 33546500, "jump_index": "power2_mask", "jump_mixer": "avalanche64", "jump_schedule": "power2", "lookup_buffer_seconds": 0.003825, "lookup_engine": "gpu_filter16_hash", "lookup_engine_effective": "gpu_filter16_hash", "lookup_exact_seconds": 0.001232, "lookup_gpu_seconds": 0.018324, "lookup_hash_seconds": 0.0, "lookup_layout": "open_address_tag16_hash_filter_exact256", "lookup_max_threads_per_threadgroup": 1024, "lookup_query_mode": "distinct_misses", "lookup_repeat": 1024, "lookup_seconds": 0.019555, "lookup_thread_execution_width": 32, "lookup_threadgroup_limit": 512, "lookup_threads_per_threadgroup": 512, "lookup_wall_seconds": 0.02338, "lookups_per_sec": 215792085.425337, "machine": "macOS-26.5-arm64-arm-64bit-Mach-O", "max_sample_spread_ratio": 1.5, "max_threads_per_threadgroup": 1024, "mean_jump_distance": 4095.9375, "min_ms": 0, "miss_count": 4219776, "operation": "jacobian_affine_scan_target_lookup_tag32_rounds", "ops_per_sec": 174531285283.43503, "ops_per_sec_max": 183860568763.75647, "ops_per_sec_min": 173905046668.60306, "output_layout": "affine_dp_scan_target_lookup", "paired_baseline_ops_per_sec": 171624904725.97614, "paired_baseline_ref": "HEAD", "paired_order": "alternate", "paired_speedup": 1.0169344918914849, "physical_filter_positive_count": 542, "physical_query_count": 4219904, "query_count": 4219904, "query_input": "hash64_prefix_gpu_miss", "reason": "", "repeat_positive_index_encoding": "physical_query_index", "requested_hits": 64, "round_count": 2, "round_sample_build_seconds": 0.006484, "runner_sample_count": 3, "sample_count": 131072, "sample_metric": "setup_inclusive_wall_distance_per_sec", "sample_metric_values": [173905046668.60306, 174531285283.43503, 183860568763.75647], "sample_spread_ratio": 1.0572468843536487, "seconds": 11.180122, "setup_inclusive_distance_per_sec": 176345276840.16367, "setup_inclusive_ops_per_sec": 43053703.050929, "setup_inclusive_seconds": 12.469796, "setup_inclusive_wall_distance_per_sec": 174531285283.43503, "setup_inclusive_wall_distance_per_sec_max": 183860568763.75647, "setup_inclusive_wall_distance_per_sec_min": 173905046668.60306, "setup_inclusive_wall_ops_per_sec": 42610827.260776, "setup_inclusive_wall_seconds": 12.599401, "skipped": false, "state_layout": "xyzz", "status": "keep", "steps_per_sample": 2048, "target_bucket_bytes": 268435456, "target_build_seconds": 1.223029, "target_count": 25005000, "target_filter_bucket_bytes": 67108864, "target_filter_build_seconds": 0.0, "target_key": "x256_y_parity", "target_key_bytes": 4096, "target_lookup_checksum": "0x5c90bdf7f12141b9", "target_lookup_scope": "packet_endpoint_dp_keys", "target_query_hash_bytes": 32968, "target_setup_workers": 8, "target_table_buckets": 33554432, "target_table_bytes": 67108864, "thread_execution_width": 32, "threadgroup_limit": 128, "threads_per_threadgroup": 128, "timestamp": "2026-07-07T16:34:10Z", "validation_seconds": 45.401061, "validation_workers": 8, "walk_buffer_seconds": 0.12578, "walk_round_mode": "independent", "walk_wall_seconds": 11.305903}
{"affine_scan_mode": "cpu_batch_prod_zz_zzz", "affine_scan_seconds": 0.001933, "backend": "metal", "budget_sec": 240, "bytes_per_target": 4.0, "candidate_verification": "tag16_hash_filter_then_cpu_exact_key_equality", "commit": "5e033a3-dirty", "confirmation_index": 1, "confirmation_runs": 2, "confirmation_status": "discard", "cooldown_sec": 3.0, "correctness": true, "description": "Medium fixed-round 1M target lookup A/B for persistent round walking versus independent round walking; scores setup-inclusive wall-clock kangaroo distance/sec", "distance_per_sec": 484207054533.21027, "distance_tracking": "round_cumulative_uint64", "distinct_miss_source_seconds": 5e-06, "dp_bits": 6, "dp_checksum": "0x629ee4b4c12210d6", "dp_count": 1052, "dp_distance_checksum": "0xa5baca18c951809a", "dp_normalization": "host_batch_affine", "dp_query_count": 1052, "dp_sampling": "packet_endpoint", "dp_tracking": "affine_x256_y_parity_cpu_batch", "exact_host_table_bytes": 16779264, "experiment": "metal_jacobian_dynamic_dp_stream_xyzz_affine_scan_target_lookup_tag16_hash_filter1m_rounds_persistent_distinct_misses_distance", "filter_false_positive_count": 28, "filter_positive_count": 92, "gpu_distance_per_sec": 486273084961.99945, "gpu_lookup_lookups_per_sec": 377799482.705712, "gpu_ops_per_sec": 118720826.419348, "hit_count": 64, "injected_hits": 64, "iterations": 134217728, "jump_count": 16, "jump_histogram_max_bucket": 8391909, "jump_histogram_max_deviation_ppm": 429, "jump_histogram_min_bucket": 8385012, "jump_index": "power2_mask", "jump_mixer": "avalanche64", "jump_schedule": "power2", "lookup_buffer_seconds": 0.001042, "lookup_engine": "gpu_filter16_hash", "lookup_engine_effective": "gpu_filter16_hash", "lookup_exact_seconds": 3.9e-05, "lookup_gpu_seconds": 0.002851, "lookup_hash_seconds": 0.0, "lookup_layout": "open_address_tag16_hash_filter_exact256", "lookup_max_threads_per_threadgroup": 1024, "lookup_query_mode": "distinct_misses", "lookup_repeat": 1024, "lookup_seconds": 0.002891, "lookup_thread_execution_width": 32, "lookup_threadgroup_limit": 512, "lookup_threads_per_threadgroup": 512, "lookup_wall_seconds": 0.003933, "lookups_per_sec": 372685694.51652, "machine": "macOS-26.5-arm64-arm-64bit-Mach-O", "max_sample_spread_ratio": 1.5, "max_threads_per_threadgroup": 1024, "mean_jump_distance": 4095.9375, "min_ms": 0, "miss_count": 1077184, "operation": "jacobian_affine_scan_target_lookup_tag32_rounds", "ops_per_sec": 454793026992.79614, "ops_per_sec_max": 457600252413.0651, "ops_per_sec_min": 449337021171.03766, "output_layout": "affine_dp_scan_target_lookup", "paired_baseline_ops_per_sec": 467358937649.3849, "paired_baseline_ref": "HEAD", "paired_order": "alternate", "paired_speedup": 0.9731129338837727, "physical_filter_positive_count": 92, "physical_query_count": 1077248, "query_count": 1077248, "query_input": "hash64_prefix_gpu_miss", "raw_status": "discard", "reason": "", "repeat_positive_index_encoding": "physical_query_index", "requested_hits": 32, "round_count": 2, "round_sample_build_seconds": 0.0, "runner_sample_count": 3, "sample_count": 32768, "sample_metric": "setup_inclusive_wall_distance_per_sec", "sample_metric_values": [454793026992.79614, 449337021171.03766, 457600252413.0651], "sample_spread_ratio": 1.018389829577123, "seconds": 1.130532, "setup_inclusive_distance_per_sec": 470607163590.37006, "setup_inclusive_ops_per_sec": 114896080.223482, "setup_inclusive_seconds": 1.168166, "setup_inclusive_wall_distance_per_sec": 454793026992.79614, "setup_inclusive_wall_distance_per_sec_max": 457600252413.0651, "setup_inclusive_wall_distance_per_sec_min": 449337021171.03766, "setup_inclusive_wall_ops_per_sec": 111035148.117567, "setup_inclusive_wall_seconds": 1.208786, "skipped": false, "state_layout": "xyzz", "status": "discard", "steps_per_sample": 2048, "target_bucket_bytes": 16777216, "target_build_seconds": 0.032805, "target_count": 1048576, "target_filter_bucket_bytes": 4194304, "target_filter_build_seconds": 0.0, "target_key": "x256_y_parity", "target_key_bytes": 2048, "target_lookup_checksum": "0xdd2a2f23ab08c29b", "target_lookup_scope": "packet_endpoint_dp_keys", "target_query_hash_bytes": 8416, "target_setup_workers": 8, "target_table_buckets": 2097152, "target_table_bytes": 4194304, "thread_execution_width": 32, "threadgroup_limit": 128, "threads_per_threadgroup": 128, "timestamp": "2026-07-07T17:11:44Z", "validation_seconds": 3.880359, "validation_workers": 8, "walk_buffer_seconds": 0.039578, "walk_round_mode": "persistent", "walk_wall_seconds": 1.17011}
{"affine_scan_mode": "cpu_batch_prod_zz_zzz", "affine_scan_seconds": 0.001754, "backend": "metal", "budget_sec": 240, "bytes_per_target": 4.0, "candidate_verification": "tag16_hash_filter_then_cpu_exact_key_equality", "commit": "5e033a3-dirty", "confirmation_index": 2, "confirmation_runs": 2, "confirmation_status": "discard", "cooldown_sec": 3.0, "correctness": true, "description": "Medium fixed-round 1M target lookup A/B for persistent round walking versus independent round walking; scores setup-inclusive wall-clock kangaroo distance/sec", "distance_per_sec": 484911593326.8443, "distance_tracking": "round_cumulative_uint64", "distinct_miss_source_seconds": 6e-06, "dp_bits": 6, "dp_checksum": "0x629ee4b4c12210d6", "dp_count": 1052, "dp_distance_checksum": "0xa5baca18c951809a", "dp_normalization": "host_batch_affine", "dp_query_count": 1052, "dp_sampling": "packet_endpoint", "dp_tracking": "affine_x256_y_parity_cpu_batch", "exact_host_table_bytes": 16779264, "experiment": "metal_jacobian_dynamic_dp_stream_xyzz_affine_scan_target_lookup_tag16_hash_filter1m_rounds_persistent_distinct_misses_distance", "filter_false_positive_count": 28, "filter_positive_count": 92, "gpu_distance_per_sec": 487944082345.68524, "gpu_lookup_lookups_per_sec": 206015806.590912, "gpu_ops_per_sec": 119128790.99002, "hit_count": 64, "injected_hits": 64, "iterations": 134217728, "jump_count": 16, "jump_histogram_max_bucket": 8391909, "jump_histogram_max_deviation_ppm": 429, "jump_histogram_min_bucket": 8385012, "jump_index": "power2_mask", "jump_mixer": "avalanche64", "jump_schedule": "power2", "lookup_buffer_seconds": 0.000972, "lookup_engine": "gpu_filter16_hash", "lookup_engine_effective": "gpu_filter16_hash", "lookup_exact_seconds": 6.3e-05, "lookup_gpu_seconds": 0.005229, "lookup_hash_seconds": 0.0, "lookup_layout": "open_address_tag16_hash_filter_exact256", "lookup_max_threads_per_threadgroup": 1024, "lookup_query_mode": "distinct_misses", "lookup_repeat": 1024, "lookup_seconds": 0.005291, "lookup_thread_execution_width": 32, "lookup_threadgroup_limit": 512, "lookup_threads_per_threadgroup": 512, "lookup_wall_seconds": 0.006263, "lookups_per_sec": 203582453.07815, "machine": "macOS-26.5-arm64-arm-64bit-Mach-O", "max_sample_spread_ratio": 1.5, "max_threads_per_threadgroup": 1024, "mean_jump_distance": 4095.9375, "min_ms": 0, "miss_count": 1077184, "operation": "jacobian_affine_scan_target_lookup_tag32_rounds", "ops_per_sec": 448823710354.9732, "ops_per_sec_max": 460020678911.26196, "ops_per_sec_min": 442806500786.5392, "output_layout": "affine_dp_scan_target_lookup", "paired_baseline_ops_per_sec": 462213442985.2415, "paired_baseline_ref": "HEAD", "paired_order": "alternate", "paired_speedup": 0.9710312782255105, "physical_filter_positive_count": 92, "physical_query_count": 1077248, "query_count": 1077248, "query_input": "hash64_prefix_gpu_miss", "raw_status": "discard", "reason": "", "repeat_positive_index_encoding": "physical_query_index", "requested_hits": 32, "round_count": 2, "round_sample_build_seconds": 0.0, "runner_sample_count": 3, "sample_count": 32768, "sample_metric": "setup_inclusive_wall_distance_per_sec", "sample_metric_values": [460020678911.26196, 448823710354.9732, 442806500786.5392], "sample_spread_ratio": 1.0388751702925452, "seconds": 1.126661, "setup_inclusive_distance_per_sec": 471357257385.39734, "setup_inclusive_ops_per_sec": 115079211.385769, "setup_inclusive_seconds": 1.166307, "setup_inclusive_wall_distance_per_sec": 448823710354.9732, "setup_inclusive_wall_distance_per_sec_max": 460020678911.26196, "setup_inclusive_wall_distance_per_sec_min": 442806500786.5392, "setup_inclusive_wall_ops_per_sec": 109577773.185009, "setup_inclusive_wall_seconds": 1.224863, "skipped": false, "state_layout": "xyzz", "status": "discard", "steps_per_sample": 2048, "target_bucket_bytes": 16777216, "target_build_seconds": 0.032595, "target_count": 1048576, "target_filter_bucket_bytes": 4194304, "target_filter_build_seconds": 0.0, "target_key": "x256_y_parity", "target_key_bytes": 2048, "target_lookup_checksum": "0xdd2a2f23ab08c29b", "target_lookup_scope": "packet_endpoint_dp_keys", "target_query_hash_bytes": 8416, "target_setup_workers": 8, "target_table_buckets": 2097152, "target_table_bytes": 4194304, "thread_execution_width": 32, "threadgroup_limit": 128, "threads_per_threadgroup": 128, "timestamp": "2026-07-07T17:11:44Z", "validation_seconds": 3.752882, "validation_workers": 8, "walk_buffer_seconds": 0.057584, "walk_round_mode": "persistent", "walk_wall_seconds": 1.184244}
{"affine_scan_mode": "cpu_batch_prod_zz_zzz", "affine_scan_seconds": 0.001955, "backend": "metal", "budget_sec": 240, "bytes_per_target": 4.0, "candidate_verification": "tag16_hash_filter_then_cpu_exact_key_equality", "commit": "56f4646-dirty", "confirmation_index": 1, "confirmation_runs": 2, "confirmation_status": "discard", "cooldown_sec": 3.0, "correctness": true, "description": "Medium fixed-round 1M target lookup with physical distinct-miss queries; fast falsifier for setup-inclusive wall-clock kangaroo distance/sec", "distance_per_sec": 498973522274.21155, "distance_tracking": "packet_distance_uint64", "distinct_miss_source_seconds": 4e-06, "dp_bits": 6, "dp_checksum": "0xbd17120591af6f74", "dp_count": 1053, "dp_distance_checksum": "0x9eca239fc5687305", "dp_normalization": "host_batch_affine", "dp_query_count": 1053, "dp_sampling": "packet_endpoint", "dp_tracking": "affine_x256_y_parity_cpu_batch", "exact_host_table_bytes": 16779264, "experiment": "metal_jacobian_dynamic_dp_stream_xyzz_affine_scan_target_lookup_tag16_hash_filter1m_rounds_distinct_misses_distance", "filter_false_positive_count": 28, "filter_positive_count": 92, "gpu_distance_per_sec": 501480968289.8767, "gpu_lookup_lookups_per_sec": 304930396.974089, "gpu_ops_per_sec": 122433745.214588, "hit_count": 64, "injected_hits": 64, "iterations": 134217728, "jump_count": 16, "jump_histogram_max_bucket": 8393138, "jump_histogram_max_deviation_ppm": 707, "jump_histogram_min_bucket": 8382675, "jump_index": "power2_mask", "jump_mixer": "avalanche64", "jump_schedule": "power2", "lookup_buffer_seconds": 0.001806, "lookup_engine": "gpu_filter16_hash", "lookup_engine_effective": "gpu_filter16_hash", "lookup_exact_seconds": 1.8e-05, "lookup_gpu_seconds": 0.003536, "lookup_hash_seconds": 0.0, "lookup_layout": "open_address_tag16_hash_filter_exact256", "lookup_max_threads_per_threadgroup": 1024, "lookup_query_mode": "distinct_misses", "lookup_repeat": 1024, "lookup_seconds": 0.003554, "lookup_thread_execution_width": 32, "lookup_threadgroup_limit": 512, "lookup_threads_per_threadgroup": 512, "lookup_wall_seconds": 0.00536, "lookups_per_sec": 303389650.720031, "machine": "macOS-26.5-arm64-arm-64bit-Mach-O", "max_sample_spread_ratio": 1.5, "max_threads_per_threadgroup": 1024, "mean_jump_distance": 4095.9375, "min_ms": 0, "miss_count": 1078208, "operation": "jacobian_affine_scan_target_lookup_tag32_rounds", "ops_per_sec": 466874249977.01733, "ops_per_sec_max": 466898239097.6348, "ops_per_sec_min": 461884567798.7944, "output_layout": "affine_dp_scan_target_lookup", "paired_baseline_ops_per_sec": 466891184454.2388, "paired_baseline_ref": "HEAD", "paired_order": "alternate", "paired_speedup": 0.9999637292847128, "physical_filter_positive_count": 92, "physical_query_count": 1078272, "query_count": 1078272, "query_input": "hash64_prefix_gpu_miss", "raw_status": "discard", "reason": "", "repeat_positive_index_encoding": "physical_query_index", "requested_hits": 32, "round_count": 2, "round_sample_build_seconds": 0.000189, "runner_sample_count": 3, "sample_count": 32768, "sample_metric": "setup_inclusive_wall_distance_per_sec", "sample_metric_values": [466898239097.6348, 461884567798.7944, 466874249977.01733], "sample_spread_ratio": 1.0108548144891139, "seconds": 1.096248, "setup_inclusive_distance_per_sec": 485099739232.4542, "setup_inclusive_ops_per_sec": 118434360.688476, "setup_inclusive_seconds": 1.133267, "setup_inclusive_wall_distance_per_sec": 466874249977.01733, "setup_inclusive_wall_distance_per_sec_max": 466898239097.6348, "setup_inclusive_wall_distance_per_sec_min": 461884567798.7944, "setup_inclusive_wall_ops_per_sec": 113984710.454448, "setup_inclusive_wall_seconds": 1.177506, "skipped": false, "state_layout": "xyzz", "status": "discard", "steps_per_sample": 2048, "target_bucket_bytes": 16777216, "target_build_seconds": 0.031317, "target_count": 1048576, "target_filter_bucket_bytes": 4194304, "target_filter_build_seconds": 0.0, "target_key": "x256_y_parity", "target_key_bytes": 2048, "target_lookup_checksum": "0xcb38405cd10f441d", "target_lookup_scope": "packet_endpoint_dp_keys", "target_query_hash_bytes": 8424, "target_setup_workers": 8, "target_table_buckets": 2097152, "target_table_bytes": 4194304, "thread_execution_width": 32, "threadgroup_limit": 128, "threads_per_threadgroup": 128, "timestamp": "2026-07-07T17:19:07Z", "validation_seconds": 3.922353, "validation_workers": 8, "walk_buffer_seconds": 0.042434, "walk_round_mode": "independent", "walk_wall_seconds": 1.138681}
