{"backend": "macos_cpu", "budget_sec": 20, "candidate_verification": "legacy_rehash_filter_byte_equality", "commit": "d6eb307-dirty", "confirmation_index": 1, "confirmation_runs": 2, "confirmation_status": "keep", "cooldown_sec": 0.0, "correctness": true, "derived_seconds": 0.060651, "derived_targets_per_sec": 824549066.382432, "description": "Host setup benchmark comparing legacy rehash/probe filter construction against deriving tag32/tag16 filters from the already-built exact tag32 table", "experiment": "target_lookup_filter_build_from_tag32_buckets", "iterations": 1, "legacy_seconds": 2.317777, "legacy_targets_per_sec": 21576705.180228, "lookup_layout": "open_address_tag32_tag16_filter_exact256", "machine": "macOS-26.5-arm64-arm-64bit-Mach-O", "min_ms": 0, "operation": "target_lookup_filter_build_from_tag32_buckets", "ops_per_sec": 38.214781, "ops_per_sec_max": 48.617748, "ops_per_sec_min": 25.287389, "paired_baseline_ops_per_sec": 15.140577, "paired_baseline_ref": "main", "paired_order": "baseline_first", "paired_speedup": 2.5239976653465717, "raw_status": "keep", "reason": "", "runner_sample_count": 3, "sample_count": 25005000, "seconds": 0.060651, "setup_phase": "host_filter_build", "skipped": false, "speedup": 38.214781, "speedup_max": 48.617748, "speedup_min": 25.287389, "status": "keep", "tag16_byte_equal": true, "tag16_derived_seconds": 0.029872, "tag16_filter_checksum": "0x8ba16d0e4799e611", "tag16_legacy_seconds": 1.056088, "tag16_speedup": 35.354089, "tag32_byte_equal": true, "tag32_derived_seconds": 0.03078, "tag32_filter_checksum": "0x42b1584566f30df0", "tag32_legacy_seconds": 1.261689, "tag32_speedup": 40.991098, "target_bucket_bytes": 268435456, "target_count": 25005000, "target_filter16_bucket_bytes": 67108864, "target_filter32_bucket_bytes": 134217728, "target_key": "x256_y_parity", "target_key_bytes": 1000200000, "target_table_buckets": 33554432, "target_table_bytes": 201326592, "timestamp": "2026-06-28T22:33:31Z"}
{"backend": "macos_cpu", "budget_sec": 20, "candidate_verification": "legacy_rehash_filter_byte_equality", "commit": "d6eb307-dirty", "confirmation_index": 2, "confirmation_runs": 2, "confirmation_status": "keep", "cooldown_sec": 0.0, "correctness": true, "derived_seconds": 0.104183, "derived_targets_per_sec": 480021308.684369, "description": "Host setup benchmark comparing legacy rehash/probe filter construction against deriving tag32/tag16 filters from the already-built exact tag32 table", "experiment": "target_lookup_filter_build_from_tag32_buckets", "iterations": 1, "legacy_seconds": 3.351036, "legacy_targets_per_sec": 14923742.61166, "lookup_layout": "open_address_tag32_tag16_filter_exact256", "machine": "macOS-26.5-arm64-arm-64bit-Mach-O", "min_ms": 0, "operation": "target_lookup_filter_build_from_tag32_buckets", "ops_per_sec": 32.164942, "ops_per_sec_max": 47.47156, "ops_per_sec_min": 23.679331, "paired_baseline_ops_per_sec": 15.875932, "paired_baseline_ref": "main", "paired_order": "baseline_first", "paired_speedup": 2.0260191338688025, "raw_status": "keep", "reason": "", "runner_sample_count": 3, "sample_count": 25005000, "seconds": 0.104183, "setup_phase": "host_filter_build", "skipped": false, "speedup": 32.164942, "speedup_max": 47.47156, "speedup_min": 23.679331, "status": "keep", "tag16_byte_equal": true, "tag16_derived_seconds": 0.064256, "tag16_filter_checksum": "0x8ba16d0e4799e611", "tag16_legacy_seconds": 1.217184, "tag16_speedup": 18.942739, "tag32_byte_equal": true, "tag32_derived_seconds": 0.039927, "tag32_filter_checksum": "0x42b1584566f30df0", "tag32_legacy_seconds": 2.133852, "tag32_speedup": 53.443952, "target_bucket_bytes": 268435456, "target_count": 25005000, "target_filter16_bucket_bytes": 67108864, "target_filter32_bucket_bytes": 134217728, "target_key": "x256_y_parity", "target_key_bytes": 1000200000, "target_table_buckets": 33554432, "target_table_bytes": 201326592, "timestamp": "2026-06-28T22:33:31Z"}
{"affine_scan_mode": "cpu_batch_prod_zz_zzz", "affine_scan_seconds": 0.007525, "backend": "metal", "budget_sec": 20, "commit": "c064502-dirty", "confirmation_index": 1, "confirmation_runs": 2, "confirmation_status": "discard", "cooldown_sec": 10.0, "correctness": true, "description": "Metal XYZZ 1024-step affine-scan packet implemented as two 512-step GPU loop segments", "distance_tracking": "packet_distance_uint64", "dp_bits": 7, "dp_checksum": "0x08b06faea04109e6", "dp_count": 1999, "dp_distance_checksum": "0x33b34eda684bc0e5", "dp_tracking": "affine_x_limb0_cpu_batch", "experiment": "metal_jacobian_dynamic_dp_stream_xyzz_affine_scan_steps1024_dp7_split512", "gpu_ops_per_sec": 109187340.075581, "iterations": 268435456, "jump_count": 16, "jump_histogram_max_bucket": 16782744, "jump_histogram_max_deviation_ppm": 389, "jump_histogram_min_bucket": 16770687, "jump_index": "power2_mask", "jump_mixer": "avalanche64", "jump_schedule": "power2", "machine": "macOS-26.5-arm64-arm-64bit-Mach-O", "max_threads_per_threadgroup": 1024, "min_ms": 500, "operation": "jacobian_affine_walk_dynamic_dp_stream_xyzz_affine_scan", "ops_per_sec": 108854143.391471, "ops_per_sec_max": 120468768.031395, "ops_per_sec_min": 87531100.699235, "output_layout": "affine_dp_scan", "paired_baseline_ops_per_sec": 114291668.49171, "paired_baseline_ref": "main", "paired_order": "baseline_first", "paired_speedup": 0.9524241340423392, "raw_status": "discard", "reason": "", "runner_sample_count": 3, "sample_count": 262144, "seconds": 2.458485, "skipped": false, "state_layout": "xyzz", "status": "discard", "steps_per_sample": 1024, "thread_execution_width": 32, "threadgroup_limit": 128, "threads_per_threadgroup": 128, "timestamp": "2026-06-29T01:06:21Z", "validation_seconds": 10.176675, "validation_workers": 8}
{"affine_scan_mode": "cpu_batch_prod_zz_zzz", "affine_scan_seconds": 0.015324, "backend": "metal", "budget_sec": 20, "commit": "c064502-dirty", "confirmation_index": 2, "confirmation_runs": 2, "confirmation_status": "discard", "cooldown_sec": 10.0, "correctness": true, "description": "Metal XYZZ 1024-step affine-scan packet implemented as two 512-step GPU loop segments", "distance_tracking": "packet_distance_uint64", "dp_bits": 7, "dp_checksum": "0x08b06faea04109e6", "dp_count": 1999, "dp_distance_checksum": "0x33b34eda684bc0e5", "dp_tracking": "affine_x_limb0_cpu_batch", "experiment": "metal_jacobian_dynamic_dp_stream_xyzz_affine_scan_steps1024_dp7_split512", "gpu_ops_per_sec": 100081668.269808, "iterations": 268435456, "jump_count": 16, "jump_histogram_max_bucket": 16782744, "jump_histogram_max_deviation_ppm": 389, "jump_histogram_min_bucket": 16770687, "jump_index": "power2_mask", "jump_mixer": "avalanche64", "jump_schedule": "power2", "machine": "macOS-26.5-arm64-arm-64bit-Mach-O", "max_threads_per_threadgroup": 1024, "min_ms": 500, "operation": "jacobian_affine_walk_dynamic_dp_stream_xyzz_affine_scan", "ops_per_sec": 99513137.1548, "ops_per_sec_max": 112499297.883785, "ops_per_sec_min": 76310483.909884, "output_layout": "affine_dp_scan", "paired_baseline_ops_per_sec": 91527877.090034, "paired_baseline_ref": "main", "paired_order": "baseline_first", "paired_speedup": 1.0872440213696979, "raw_status": "keep", "reason": "", "runner_sample_count": 3, "sample_count": 262144, "seconds": 2.682164, "skipped": false, "state_layout": "xyzz", "status": "discard", "steps_per_sample": 1024, "thread_execution_width": 32, "threadgroup_limit": 128, "threads_per_threadgroup": 128, "timestamp": "2026-06-29T01:06:21Z", "validation_seconds": 10.118725, "validation_workers": 8}
{"affine_scan_mode": "cpu_batch_prod_zz_zzz", "affine_scan_seconds": 0.026208, "backend": "metal", "budget_sec": 120, "commit": "c72e85d-dirty", "confirmation_index": 1, "confirmation_runs": 2, "confirmation_status": "discard", "cooldown_sec": 0.0, "correctness": true, "description": "Metal XYZZ 512-step packet walk with GPU per-walker distances and CPU batched affine DP scan", "distance_tracking": "packet_distance_uint64", "dp_bits": 8, "dp_checksum": "0x9dba4a07ebbb8e14", "dp_count": 1057, "dp_distance_checksum": "0xf0dc88ed68b2ff64", "dp_tracking": "affine_x_limb0_cpu_batch", "experiment": "metal_jacobian_dynamic_dp_stream_xyzz_affine_scan_steps512", "gpu_ops_per_sec": 88379387.021064, "iterations": 134217728, "jump_count": 16, "jump_histogram_max_bucket": 8394316, "jump_histogram_max_deviation_ppm": 759, "jump_histogram_min_bucket": 8382245, "jump_index": "power2_mask", "jump_mixer": "avalanche64", "jump_schedule": "power2", "machine": "macOS-26.5-arm64-arm-64bit-Mach-O", "max_threads_per_threadgroup": 1024, "min_ms": 500, "operation": "jacobian_affine_walk_dynamic_dp_stream_xyzz_affine_scan", "ops_per_sec": 86880043.232946, "ops_per_sec_max": 89156987.731968, "ops_per_sec_min": 84963378.037217, "output_layout": "affine_dp_scan", "paired_baseline_ops_per_sec": 86441247.177342, "paired_baseline_ref": "HEAD", "paired_order": "baseline_first", "paired_speedup": 1.0050762346672737, "raw_status": "discard", "reason": "", "runner_sample_count": 3, "sample_count": 262144, "seconds": 1.518654, "skipped": false, "state_layout": "xyzz", "status": "discard", "steps_per_sample": 512, "thread_execution_width": 32, "threadgroup_limit": 128, "threads_per_threadgroup": 128, "timestamp": "2026-06-29T01:20:04Z", "validation_seconds": 7.896293, "validation_workers": 8}
{"affine_scan_mode": "cpu_batch_prod_zz_zzz", "affine_scan_seconds": 0.012303, "backend": "metal", "budget_sec": 120, "commit": "c72e85d-dirty", "confirmation_index": 2, "confirmation_runs": 2, "confirmation_status": "discard", "cooldown_sec": 0.0, "correctness": true, "description": "Metal XYZZ 512-step packet walk with GPU per-walker distances and CPU batched affine DP scan", "distance_tracking": "packet_distance_uint64", "dp_bits": 8, "dp_checksum": "0x9dba4a07ebbb8e14", "dp_count": 1057, "dp_distance_checksum": "0xf0dc88ed68b2ff64", "dp_tracking": "affine_x_limb0_cpu_batch", "experiment": "metal_jacobian_dynamic_dp_stream_xyzz_affine_scan_steps512", "gpu_ops_per_sec": 88048523.542701, "iterations": 134217728, "jump_count": 16, "jump_histogram_max_bucket": 8394316, "jump_histogram_max_deviation_ppm": 759, "jump_histogram_min_bucket": 8382245, "jump_index": "power2_mask", "jump_mixer": "avalanche64", "jump_schedule": "power2", "machine": "macOS-26.5-arm64-arm-64bit-Mach-O", "max_threads_per_threadgroup": 1024, "min_ms": 500, "operation": "jacobian_affine_walk_dynamic_dp_stream_xyzz_affine_scan", "ops_per_sec": 87343594.418012, "ops_per_sec_max": 95190536.246616, "ops_per_sec_min": 84664506.212926, "output_layout": "affine_dp_scan", "paired_baseline_ops_per_sec": 86177005.971957, "paired_baseline_ref": "HEAD", "paired_order": "baseline_first", "paired_speedup": 1.0135371197095733, "raw_status": "keep", "reason": "", "runner_sample_count": 3, "sample_count": 262144, "seconds": 1.524361, "skipped": false, "state_layout": "xyzz", "status": "discard", "steps_per_sample": 512, "thread_execution_width": 32, "threadgroup_limit": 128, "threads_per_threadgroup": 128, "timestamp": "2026-06-29T01:20:05Z", "validation_seconds": 6.77437, "validation_workers": 8}
{"backend": "macos_cpu", "budget_sec": 180, "candidate_verification": "legacy_tag32_table_field_equality", "commit": "c72e85d-dirty", "confirmation_index": 1, "confirmation_runs": 2, "confirmation_status": "keep", "cooldown_sec": 5.0, "correctness": true, "description": "Host setup benchmark comparing legacy injected-key tag32 table construction against prehashed duplicate checks and prehashed table insertion", "experiment": "target_lookup_tag32_build_from_keys", "injected_count": 64, "iterations": 1, "legacy_checksum": "0x0875f90b516f7503", "legacy_seconds": 2.504578, "legacy_targets_per_sec": 9983719.147322, "lookup_layout": "open_address_tag32_index_exact256", "machine": "macOS-26.5-arm64-arm-64bit-Mach-O", "min_ms": 0, "operation": "target_lookup_tag32_build_from_injected_keys", "ops_per_sec": 1.722704, "ops_per_sec_max": 2.20274, "ops_per_sec_min": 1.674158, "prehashed_checksum": "0x0875f90b516f7503", "prehashed_seconds": 1.453864, "prehashed_targets_per_sec": 17198993.25368, "raw_status": "keep", "reason": "", "runner_sample_count": 3, "sample_count": 25005000, "seconds": 1.453864, "setup_phase": "host_tag32_build_from_injected_keys", "skipped": false, "speedup": 1.722704, "speedup_max": 2.20274, "speedup_min": 1.674158, "status": "keep", "table_equal": true, "target_bucket_bytes": 268435456, "target_count": 25005000, "target_key": "x256_y_parity", "target_key_bytes": 1000200000, "target_table_buckets": 33554432, "target_table_bytes": 1268635456, "timestamp": "2026-06-29T01:32:36Z"}
{"backend": "macos_cpu", "budget_sec": 180, "candidate_verification": "legacy_tag32_table_field_equality", "commit": "c72e85d-dirty", "confirmation_index": 2, "confirmation_runs": 2, "confirmation_status": "keep", "cooldown_sec": 5.0, "correctness": true, "description": "Host setup benchmark comparing legacy injected-key tag32 table construction against prehashed duplicate checks and prehashed table insertion", "experiment": "target_lookup_tag32_build_from_keys", "injected_count": 64, "iterations": 1, "legacy_checksum": "0x0875f90b516f7503", "legacy_seconds": 2.42854, "legacy_targets_per_sec": 10296308.657021, "lookup_layout": "open_address_tag32_index_exact256", "machine": "macOS-26.5-arm64-arm-64bit-Mach-O", "min_ms": 0, "operation": "target_lookup_tag32_build_from_injected_keys", "ops_per_sec": 1.435882, "ops_per_sec_max": 1.81567, "ops_per_sec_min": 1.410222, "prehashed_checksum": "0x0875f90b516f7503", "prehashed_seconds": 1.691323, "prehashed_targets_per_sec": 14784288.259075, "raw_status": "keep", "reason": "", "runner_sample_count": 3, "sample_count": 25005000, "seconds": 1.691323, "setup_phase": "host_tag32_build_from_injected_keys", "skipped": false, "speedup": 1.435882, "speedup_max": 1.81567, "speedup_min": 1.410222, "status": "keep", "table_equal": true, "target_bucket_bytes": 268435456, "target_count": 25005000, "target_key": "x256_y_parity", "target_key_bytes": 1000200000, "target_table_buckets": 33554432, "target_table_bytes": 1268635456, "timestamp": "2026-06-29T01:33:09Z"}
{"all_keys_found": true, "backend": "macos_cpu", "budget_sec": 180, "candidate_verification": "prehashed_serial_vs_parallel_semantic_find_all_keys", "commit": "334b4c9-dirty", "confirmation_index": 1, "confirmation_runs": 2, "confirmation_status": "keep", "cooldown_sec": 5.0, "correctness": true, "description": "Host setup benchmark comparing prehashed serial tag32 insertion against parallel CAS insertion with semantic find-all verification", "experiment": "target_lookup_tag32_parallel_insert", "injected_count": 64, "iterations": 1, "lookup_layout": "open_address_tag32_index_exact256", "machine": "macOS-26.5-arm64-arm-64bit-Mach-O", "min_ms": 0, "operation": "target_lookup_tag32_parallel_insert_probe", "ops_per_sec": 0.928064, "ops_per_sec_max": 1.496382, "ops_per_sec_min": 0.880974, "parallel_checksum": "0xd70431c57ceb0369", "parallel_seconds": 1.173347, "parallel_targets_per_sec": 21310839.659261, "raw_status": "keep", "reason": "", "runner_sample_count": 3, "sample_count": 25005000, "seconds": 1.173347, "serial_checksum": "0x0875f90b516f7503", "serial_seconds": 1.088941, "serial_targets_per_sec": 22962686.240035, "setup_phase": "host_tag32_parallel_insert_probe", "skipped": false, "speedup": 0.928064, "speedup_max": 1.496382, "speedup_min": 0.880974, "status": "keep", "target_bucket_bytes": 268435456, "target_count": 25005000, "target_key": "x256_y_parity", "target_key_bytes": 1000200000, "target_keys_equal": true, "target_table_buckets": 33554432, "target_table_bytes": 1268635456, "timestamp": "2026-06-29T01:41:35Z"}
{"all_keys_found": true, "backend": "macos_cpu", "budget_sec": 180, "candidate_verification": "prehashed_serial_vs_parallel_semantic_find_all_keys", "commit": "334b4c9-dirty", "confirmation_index": 2, "confirmation_runs": 2, "confirmation_status": "keep", "cooldown_sec": 5.0, "correctness": true, "description": "Host setup benchmark comparing prehashed serial tag32 insertion against parallel CAS insertion with semantic find-all verification", "experiment": "target_lookup_tag32_parallel_insert", "injected_count": 64, "iterations": 1, "lookup_layout": "open_address_tag32_index_exact256", "machine": "macOS-26.5-arm64-arm-64bit-Mach-O", "min_ms": 0, "operation": "target_lookup_tag32_parallel_insert_probe", "ops_per_sec": 1.883752, "ops_per_sec_max": 2.044074, "ops_per_sec_min": 1.252302, "parallel_checksum": "0x9500d9c4b50c948e", "parallel_seconds": 0.566545, "parallel_targets_per_sec": 44135943.563689, "raw_status": "keep", "reason": "", "runner_sample_count": 3, "sample_count": 25005000, "seconds": 0.566545, "serial_checksum": "0x0875f90b516f7503", "serial_seconds": 1.06723, "serial_targets_per_sec": 23429809.963383, "setup_phase": "host_tag32_parallel_insert_probe", "skipped": false, "speedup": 1.883752, "speedup_max": 2.044074, "speedup_min": 1.252302, "status": "keep", "target_bucket_bytes": 268435456, "target_count": 25005000, "target_key": "x256_y_parity", "target_key_bytes": 1000200000, "target_keys_equal": true, "target_table_buckets": 33554432, "target_table_bytes": 1268635456, "timestamp": "2026-06-29T01:42:03Z"}
{"all_keys_found": true, "backend": "macos_cpu", "budget_sec": 240, "candidate_verification": "prehashed_serial_vs_parallel_semantic_find_all_keys", "commit": "d09c07b-dirty", "confirmation_index": 1, "confirmation_runs": 2, "confirmation_status": "discard", "cooldown_sec": 5.0, "correctness": true, "description": "Host setup benchmark comparing prehashed serial tag32 insertion against parallel CAS insertion with semantic find-all verification", "experiment": "target_lookup_tag32_parallel_insert", "injected_count": 64, "iterations": 1, "lookup_layout": "open_address_tag32_index_exact256", "machine": "macOS-26.5-arm64-arm-64bit-Mach-O", "min_ms": 0, "operation": "target_lookup_tag32_parallel_insert_probe", "ops_per_sec": 1.543172, "ops_per_sec_max": 1.706956, "ops_per_sec_min": 1.054075, "paired_baseline_ops_per_sec": 1.424627, "paired_baseline_ref": "main", "paired_order": "baseline_first", "paired_speedup": 1.0832112545950623, "parallel_checksum": "0xd3d4cf1be0f1cfd7", "parallel_seconds": 1.003671, "parallel_targets_per_sec": 24913542.385901, "raw_status": "keep", "reason": "", "runner_sample_count": 3, "sample_count": 25005000, "seconds": 1.003671, "serial_checksum": "0x0875f90b516f7503", "serial_seconds": 1.548837, "serial_targets_per_sec": 16144366.777059, "setup_phase": "host_tag32_parallel_insert_probe", "skipped": false, "speedup": 1.543172, "speedup_max": 1.706956, "speedup_min": 1.054075, "status": "discard", "target_bucket_bytes": 268435456, "target_count": 25005000, "target_key": "x256_y_parity", "target_key_bytes": 1000200000, "target_keys_equal": true, "target_table_buckets": 33554432, "target_table_bytes": 1268635456, "timestamp": "2026-06-29T13:29:59Z"}
{"all_keys_found": true, "backend": "macos_cpu", "budget_sec": 240, "candidate_verification": "prehashed_serial_vs_parallel_semantic_find_all_keys", "commit": "d09c07b-dirty", "confirmation_index": 2, "confirmation_runs": 2, "confirmation_status": "discard", "cooldown_sec": 5.0, "correctness": true, "description": "Host setup benchmark comparing prehashed serial tag32 insertion against parallel CAS insertion with semantic find-all verification", "experiment": "target_lookup_tag32_parallel_insert", "injected_count": 64, "iterations": 1, "lookup_layout": "open_address_tag32_index_exact256", "machine": "macOS-26.5-arm64-arm-64bit-Mach-O", "min_ms": 0, "operation": "target_lookup_tag32_parallel_insert_probe", "ops_per_sec": 1.355487, "ops_per_sec_max": 1.986275, "ops_per_sec_min": 1.307328, "paired_baseline_ops_per_sec": 1.501061, "paired_baseline_ref": "main", "paired_order": "baseline_first", "paired_speedup": 0.9030192643736664, "parallel_checksum": "0x488d3385bf6f6a6c", "parallel_seconds": 1.311761, "parallel_targets_per_sec": 19062156.636995, "raw_status": "discard", "reason": "", "runner_sample_count": 3, "sample_count": 25005000, "seconds": 1.311761, "serial_checksum": "0x0875f90b516f7503", "serial_seconds": 1.778075, "serial_targets_per_sec": 14062957.726286, "setup_phase": "host_tag32_parallel_insert_probe", "skipped": false, "speedup": 1.355487, "speedup_max": 1.986275, "speedup_min": 1.307328, "status": "discard", "target_bucket_bytes": 268435456, "target_count": 25005000, "target_key": "x256_y_parity", "target_key_bytes": 1000200000, "target_keys_equal": true, "target_table_buckets": 33554432, "target_table_bytes": 1268635456, "timestamp": "2026-06-29T13:29:59Z"}
