{"backend": "metal", "budget_sec": 10, "commit": "4fdac33", "confirmation_index": 3, "confirmation_runs": 3, "confirmation_status": "discard", "correctness": true, "description": "Stable Metal Jacobian jump-table walk with projective distinguished-point candidate flags", "distance_checksum": "0xa45f471493cace2f", "distance_tracking": "uint64", "dp_bits": 4, "dp_checksum": "0x30a7914972cba014", "dp_count": 1000, "dp_tracking": "projective_x_limb0", "experiment": "metal_jacobian_jump_walk_dp_stable", "iterations": 8126464, "jump_count": 16, "machine": "macOS-26.5-arm64-arm-64bit-Mach-O", "max_threads_per_threadgroup": 1024, "min_ms": 200, "operation": "jacobian_affine_walk_jump_table", "ops_per_sec": 40242347.507246, "ops_per_sec_max": 40988210.094935, "ops_per_sec_min": 31707307.57267, "paired_baseline_ops_per_sec": 43666290.014577, "paired_baseline_ref": "main", "paired_speedup": 0.9215884265370841, "raw_status": "discard", "reason": "", "runner_sample_count": 3, "sample_count": 16384, "seconds": 0.201938, "skipped": false, "status": "discard", "steps_per_sample": 8, "thread_execution_width": 32, "threadgroup_limit": 256, "threads_per_threadgroup": 256, "timestamp": "2026-06-21T19:05:28Z"}
{"backend": "metal", "budget_sec": 5, "commit": "9247265", "confirmation_index": 1, "confirmation_runs": 3, "confirmation_status": "discard", "correctness": true, "description": "Metal secp256k1 field_mul4_mod_p correctness and throughput gate", "experiment": "metal_field_mul4", "iterations": 13631488, "machine": "macOS-26.5-arm64-arm-64bit-Mach-O", "max_threads_per_threadgroup": 1024, "min_ms": 50, "operation": "field_mul4_mod_p", "ops_per_sec": 246235567.596198, "ops_per_sec_max": 277834407.294036, "ops_per_sec_min": 160152247.393844, "paired_baseline_ops_per_sec": 210811261.409114, "paired_baseline_ref": "main", "paired_speedup": 1.16803801632939, "raw_status": "keep", "reason": "", "runner_sample_count": 3, "sample_count": 1048576, "seconds": 0.05536, "skipped": false, "status": "discard", "thread_execution_width": 32, "threadgroup_limit": 256, "threads_per_threadgroup": 256, "timestamp": "2026-06-21T19:25:57Z"}
{"backend": "metal", "budget_sec": 5, "commit": "9247265", "confirmation_index": 2, "confirmation_runs": 3, "confirmation_status": "discard", "correctness": true, "description": "Metal secp256k1 field_mul4_mod_p correctness and throughput gate", "experiment": "metal_field_mul4", "iterations": 5242880, "machine": "macOS-26.5-arm64-arm-64bit-Mach-O", "max_threads_per_threadgroup": 1024, "min_ms": 50, "operation": "field_mul4_mod_p", "ops_per_sec": 101896490.037442, "ops_per_sec_max": 126650810.192399, "ops_per_sec_min": 99066583.602263, "paired_baseline_ops_per_sec": 117408210.966088, "paired_baseline_ref": "main", "paired_speedup": 0.8678821455415382, "raw_status": "discard", "reason": "", "runner_sample_count": 3, "sample_count": 1048576, "seconds": 0.051453, "skipped": false, "status": "discard", "thread_execution_width": 32, "threadgroup_limit": 256, "threads_per_threadgroup": 256, "timestamp": "2026-06-21T19:26:30Z"}
{"backend": "metal", "budget_sec": 5, "commit": "9247265", "confirmation_index": 3, "confirmation_runs": 3, "confirmation_status": "discard", "correctness": true, "description": "Metal secp256k1 field_mul4_mod_p correctness and throughput gate", "experiment": "metal_field_mul4", "iterations": 8388608, "machine": "macOS-26.5-arm64-arm-64bit-Mach-O", "max_threads_per_threadgroup": 1024, "min_ms": 50, "operation": "field_mul4_mod_p", "ops_per_sec": 154298318.553492, "ops_per_sec_max": 154898427.750882, "ops_per_sec_min": 131023645.255777, "paired_baseline_ops_per_sec": 103616786.904483, "paired_baseline_ref": "main", "paired_speedup": 1.4891247177518516, "raw_status": "keep", "reason": "", "runner_sample_count": 3, "sample_count": 1048576, "seconds": 0.054366, "skipped": false, "status": "discard", "thread_execution_width": 32, "threadgroup_limit": 256, "threads_per_threadgroup": 256, "timestamp": "2026-06-21T19:27:09Z"}
{"backend": "metal", "budget_sec": 5, "commit": "f0301ef", "confirmation_index": 1, "confirmation_runs": 3, "confirmation_status": "discard", "correctness": true, "description": "Metal secp256k1 field_neg_mod_p correctness and throughput gate", "experiment": "metal_field_neg", "iterations": 5242880, "machine": "macOS-26.5-arm64-arm-64bit-Mach-O", "max_threads_per_threadgroup": 1024, "min_ms": 50, "operation": "field_neg_mod_p", "ops_per_sec": 99750221.099342, "ops_per_sec_max": 127434062.448599, "ops_per_sec_min": 91612760.301827, "paired_baseline_ops_per_sec": 99885549.078458, "paired_baseline_ref": "main", "paired_speedup": 0.9986451695929539, "raw_status": "discard", "reason": "", "runner_sample_count": 3, "sample_count": 1048576, "seconds": 0.05256, "skipped": false, "status": "discard", "thread_execution_width": 32, "threadgroup_limit": 256, "threads_per_threadgroup": 256, "timestamp": "2026-06-21T19:34:49Z"}
{"backend": "metal", "budget_sec": 5, "commit": "f0301ef", "confirmation_index": 2, "confirmation_runs": 3, "confirmation_status": "discard", "correctness": true, "description": "Metal secp256k1 field_neg_mod_p correctness and throughput gate", "experiment": "metal_field_neg", "iterations": 5242880, "machine": "macOS-26.5-arm64-arm-64bit-Mach-O", "max_threads_per_threadgroup": 1024, "min_ms": 50, "operation": "field_neg_mod_p", "ops_per_sec": 102360679.104753, "ops_per_sec_max": 103590273.145331, "ops_per_sec_min": 100099336.339066, "paired_baseline_ops_per_sec": 90829905.666055, "paired_baseline_ref": "main", "paired_speedup": 1.126949085261544, "raw_status": "keep", "reason": "", "runner_sample_count": 3, "sample_count": 1048576, "seconds": 0.05122, "skipped": false, "status": "discard", "thread_execution_width": 32, "threadgroup_limit": 256, "threads_per_threadgroup": 256, "timestamp": "2026-06-21T19:35:28Z"}
{"backend": "metal", "budget_sec": 5, "commit": "f0301ef", "confirmation_index": 3, "confirmation_runs": 3, "confirmation_status": "discard", "correctness": true, "description": "Metal secp256k1 field_neg_mod_p correctness and throughput gate", "experiment": "metal_field_neg", "iterations": 7340032, "machine": "macOS-26.5-arm64-arm-64bit-Mach-O", "max_threads_per_threadgroup": 1024, "min_ms": 50, "operation": "field_neg_mod_p", "ops_per_sec": 119971184.158642, "ops_per_sec_max": 155372214.319583, "ops_per_sec_min": 74649564.031157, "paired_baseline_ops_per_sec": 65403107.018081, "paired_baseline_ref": "main", "paired_speedup": 1.8343346306999664, "raw_status": "keep", "reason": "", "runner_sample_count": 3, "sample_count": 1048576, "seconds": 0.061182, "skipped": false, "status": "discard", "thread_execution_width": 32, "threadgroup_limit": 256, "threads_per_threadgroup": 256, "timestamp": "2026-06-21T19:36:21Z"}
{"backend": "metal", "budget_sec": 10, "commit": "c313c94", "confirmation_index": 1, "confirmation_runs": 3, "confirmation_status": "discard", "correctness": true, "description": "Stable Metal Jacobian jump-table walk with projective distinguished-point candidate flags", "distance_checksum": "0xa45f471493cace2f", "distance_tracking": "uint64", "dp_bits": 4, "dp_checksum": "0x30a7914972cba014", "dp_count": 1000, "dp_tracking": "projective_x_limb0", "experiment": "metal_jacobian_jump_walk_dp_stable", "iterations": 7864320, "jump_count": 16, "machine": "macOS-26.5-arm64-arm-64bit-Mach-O", "max_threads_per_threadgroup": 1024, "min_ms": 200, "operation": "jacobian_affine_walk_jump_table", "ops_per_sec": 38777159.758247, "ops_per_sec_max": 52566880.084711, "ops_per_sec_min": 36496161.421082, "paired_baseline_ops_per_sec": 27131354.605843, "paired_baseline_ref": "main", "paired_speedup": 1.4292378807321315, "raw_status": "keep", "reason": "", "runner_sample_count": 3, "sample_count": 16384, "seconds": 0.202808, "skipped": false, "status": "discard", "steps_per_sample": 8, "thread_execution_width": 32, "threadgroup_limit": 256, "threads_per_threadgroup": 256, "timestamp": "2026-06-21T19:48:48Z"}
{"backend": "metal", "budget_sec": 10, "commit": "c313c94", "confirmation_index": 2, "confirmation_runs": 3, "confirmation_status": "discard", "correctness": true, "description": "Stable Metal Jacobian jump-table walk with projective distinguished-point candidate flags", "distance_checksum": "0xa45f471493cace2f", "distance_tracking": "uint64", "dp_bits": 4, "dp_checksum": "0x30a7914972cba014", "dp_count": 1000, "dp_tracking": "projective_x_limb0", "experiment": "metal_jacobian_jump_walk_dp_stable", "iterations": 4063232, "jump_count": 16, "machine": "macOS-26.5-arm64-arm-64bit-Mach-O", "max_threads_per_threadgroup": 1024, "min_ms": 200, "operation": "jacobian_affine_walk_jump_table", "ops_per_sec": 20215604.148314, "ops_per_sec_max": 42982984.391527, "ops_per_sec_min": 7777928.22974, "paired_baseline_ops_per_sec": 39012192.932426, "paired_baseline_ref": "main", "paired_speedup": 0.5181868187550994, "raw_status": "discard", "reason": "", "runner_sample_count": 3, "sample_count": 16384, "seconds": 0.200995, "skipped": false, "status": "discard", "steps_per_sample": 8, "thread_execution_width": 32, "threadgroup_limit": 256, "threads_per_threadgroup": 256, "timestamp": "2026-06-21T19:49:47Z"}
{"backend": "metal", "budget_sec": 10, "commit": "c313c94", "confirmation_index": 3, "confirmation_runs": 3, "confirmation_status": "discard", "correctness": true, "description": "Stable Metal Jacobian jump-table walk with projective distinguished-point candidate flags", "distance_checksum": "0xa45f471493cace2f", "distance_tracking": "uint64", "dp_bits": 4, "dp_checksum": "0x30a7914972cba014", "dp_count": 1000, "dp_tracking": "projective_x_limb0", "experiment": "metal_jacobian_jump_walk_dp_stable", "iterations": 8126464, "jump_count": 16, "machine": "macOS-26.5-arm64-arm-64bit-Mach-O", "max_threads_per_threadgroup": 1024, "min_ms": 200, "operation": "jacobian_affine_walk_jump_table", "ops_per_sec": 40023158.916315, "ops_per_sec_max": 42542616.139619, "ops_per_sec_min": 19194411.783191, "paired_baseline_ops_per_sec": 20402349.732822, "paired_baseline_ref": "main", "paired_speedup": 1.9616936010036279, "raw_status": "keep", "reason": "", "runner_sample_count": 3, "sample_count": 16384, "seconds": 0.203044, "skipped": false, "status": "discard", "steps_per_sample": 8, "thread_execution_width": 32, "threadgroup_limit": 256, "threads_per_threadgroup": 256, "timestamp": "2026-06-21T19:50:45Z"}
{"backend": "metal", "budget_sec": 10, "commit": "b7d977e", "confirmation_index": 1, "confirmation_runs": 3, "confirmation_status": "discard", "correctness": true, "description": "Stable Metal Jacobian jump-table walk with projective distinguished-point candidate flags", "distance_checksum": "0xa45f471493cace2f", "distance_tracking": "uint64", "dp_bits": 4, "dp_checksum": "0x30a7914972cba014", "dp_count": 1000, "dp_tracking": "projective_x_limb0", "experiment": "metal_jacobian_jump_walk_dp_stable", "iterations": 4063232, "jump_count": 16, "machine": "macOS-26.5-arm64-arm-64bit-Mach-O", "max_threads_per_threadgroup": 1024, "min_ms": 200, "operation": "jacobian_affine_walk_jump_table", "ops_per_sec": 20107017.361589, "ops_per_sec_max": 20113288.522119, "ops_per_sec_min": 19740022.856602, "paired_baseline_ops_per_sec": 20082318.27286, "paired_baseline_ref": "main", "paired_speedup": 1.0012298923059284, "raw_status": "discard", "reason": "", "runner_sample_count": 3, "sample_count": 16384, "seconds": 0.20208, "skipped": false, "status": "discard", "steps_per_sample": 8, "thread_execution_width": 32, "threadgroup_limit": 256, "threads_per_threadgroup": 256, "timestamp": "2026-06-21T19:57:53Z"}
{"backend": "metal", "budget_sec": 10, "commit": "b7d977e", "confirmation_index": 2, "confirmation_runs": 3, "confirmation_status": "discard", "correctness": true, "description": "Stable Metal Jacobian jump-table walk with projective distinguished-point candidate flags", "distance_checksum": "0xa45f471493cace2f", "distance_tracking": "uint64", "dp_bits": 4, "dp_checksum": "0x30a7914972cba014", "dp_count": 1000, "dp_tracking": "projective_x_limb0", "experiment": "metal_jacobian_jump_walk_dp_stable", "iterations": 4063232, "jump_count": 16, "machine": "macOS-26.5-arm64-arm-64bit-Mach-O", "max_threads_per_threadgroup": 1024, "min_ms": 200, "operation": "jacobian_affine_walk_jump_table", "ops_per_sec": 20109534.532677, "ops_per_sec_max": 20800277.245517, "ops_per_sec_min": 20047259.295008, "paired_baseline_ops_per_sec": 20769643.324661, "paired_baseline_ref": "main", "paired_speedup": 0.9682176154079537, "raw_status": "discard", "reason": "", "runner_sample_count": 3, "sample_count": 16384, "seconds": 0.202055, "skipped": false, "status": "discard", "steps_per_sample": 8, "thread_execution_width": 32, "threadgroup_limit": 256, "threads_per_threadgroup": 256, "timestamp": "2026-06-21T19:58:47Z"}
{"backend": "metal", "budget_sec": 10, "commit": "b7d977e", "confirmation_index": 3, "confirmation_runs": 3, "confirmation_status": "discard", "correctness": true, "description": "Stable Metal Jacobian jump-table walk with projective distinguished-point candidate flags", "distance_checksum": "0xa45f471493cace2f", "distance_tracking": "uint64", "dp_bits": 4, "dp_checksum": "0x30a7914972cba014", "dp_count": 1000, "dp_tracking": "projective_x_limb0", "experiment": "metal_jacobian_jump_walk_dp_stable", "iterations": 8650752, "jump_count": 16, "machine": "macOS-26.5-arm64-arm-64bit-Mach-O", "max_threads_per_threadgroup": 1024, "min_ms": 200, "operation": "jacobian_affine_walk_jump_table", "ops_per_sec": 42854092.024259, "ops_per_sec_max": 43513725.786018, "ops_per_sec_min": 19883864.212227, "paired_baseline_ops_per_sec": 20513041.020243, "paired_baseline_ref": "main", "paired_speedup": 2.0891145287512005, "raw_status": "keep", "reason": "", "runner_sample_count": 3, "sample_count": 16384, "seconds": 0.201865, "skipped": false, "status": "discard", "steps_per_sample": 8, "thread_execution_width": 32, "threadgroup_limit": 256, "threads_per_threadgroup": 256, "timestamp": "2026-06-21T19:59:38Z"}
{"affine_active_path": "all_active_fast", "affine_buffer": "resize_reuse", "affine_conversion": "batch", "affine_field_ops": "inplace", "affine_reverse_loop": "split_zero", "affine_tail_update": "skip_final", "affine_z_access": "const_ref", "affine_z_check": "infinity_flag", "architecture": "shared_tame", "avg_dp_count": 288.0, "backend": "macos_cpu", "budget_sec": 5, "candidate_verification": "full_point_collision", "commit": "1a62d47", "confirmation_index": 1, "confirmation_runs": 3, "confirmation_status": "discard", "correctness": true, "description": "Apple Silicon CPU shared-tame tiny 16-target kangaroo benchmark", "dp_bits": 0, "dp_bucket_storage": "inline_first", "dp_capacity": "max_load_2of3", "dp_clear": "empty_guard", "dp_hash": "partial_limb_mix", "dp_key": "x_parity", "dp_lookup": "open_address_linear", "dp_reserve": "sqrt_range_estimate", "ecint_carry_impl": "clang_builtin", "ecint_mul_final_sub": "single_conditional", "expected_private_key": "0x7", "experiment": "jacobian_kangaroo_multi16_small", "field_rhs_passing": "const_ref", "found_private_key": "0x7", "found_target_index": 15, "iterations": 484, "jacobian_step_passing": "const_ref", "jump_count": 8, "jump_index": "power2_mask", "jump_table": "precomputed", "last_dp_count": 288, "machine": "macOS-26.5-arm64-arm-64bit-Mach-O", "max_steps": 4096, "min_ms": 50, "operation": "jacobian_kangaroo_multi_small", "ops_per_sec": 9664.150793, "ops_per_sec_max": 10363.41853, "ops_per_sec_min": 3430.060938, "paired_baseline_ops_per_sec": 11250.118571, "paired_baseline_ref": "main", "paired_speedup": 0.859026572209805, "point_passing": "const_ref", "range_bits": 8, "range_context": "precomputed", "raw_status": "discard", "reason": "", "runner_sample_count": 3, "sample_count": 1, "scratch": "reused", "seconds": 0.050082, "single_target_ops_per_sec": 15466.518455, "skipped": false, "speedup_vs_single": 0.624843, "start_scalar": "0x2", "status": "discard", "tame_states": 1, "target_count": 16, "target_throughput_vs_single": 9.997493, "timestamp": "2026-06-21T20:06:34Z", "wild_states": 16}
{"affine_active_path": "all_active_fast", "affine_buffer": "resize_reuse", "affine_conversion": "batch", "affine_field_ops": "inplace", "affine_reverse_loop": "split_zero", "affine_tail_update": "skip_final", "affine_z_access": "const_ref", "affine_z_check": "infinity_flag", "architecture": "shared_tame", "avg_dp_count": 288.0, "backend": "macos_cpu", "budget_sec": 5, "candidate_verification": "full_point_collision", "commit": "1a62d47", "confirmation_index": 2, "confirmation_runs": 3, "confirmation_status": "discard", "correctness": true, "description": "Apple Silicon CPU shared-tame tiny 16-target kangaroo benchmark", "dp_bits": 0, "dp_bucket_storage": "inline_first", "dp_capacity": "max_load_2of3", "dp_clear": "empty_guard", "dp_hash": "partial_limb_mix", "dp_key": "x_parity", "dp_lookup": "open_address_linear", "dp_reserve": "sqrt_range_estimate", "ecint_carry_impl": "clang_builtin", "ecint_mul_final_sub": "single_conditional", "expected_private_key": "0x7", "experiment": "jacobian_kangaroo_multi16_small", "field_rhs_passing": "const_ref", "found_private_key": "0x7", "found_target_index": 15, "iterations": 539, "jacobian_step_passing": "const_ref", "jump_count": 8, "jump_index": "power2_mask", "jump_table": "precomputed", "last_dp_count": 288, "machine": "macOS-26.5-arm64-arm-64bit-Mach-O", "max_steps": 4096, "min_ms": 50, "operation": "jacobian_kangaroo_multi_small", "ops_per_sec": 10768.083393, "ops_per_sec_max": 12039.066972, "ops_per_sec_min": 5143.442333, "paired_baseline_ops_per_sec": 11486.818875, "paired_baseline_ref": "main", "paired_speedup": 0.9374295451315715, "point_passing": "const_ref", "range_bits": 8, "range_context": "precomputed", "raw_status": "discard", "reason": "", "runner_sample_count": 3, "sample_count": 1, "scratch": "reused", "seconds": 0.050055, "single_target_ops_per_sec": 22670.572669, "skipped": false, "speedup_vs_single": 0.474981, "start_scalar": "0x2", "status": "discard", "tame_states": 1, "target_count": 16, "target_throughput_vs_single": 7.59969, "timestamp": "2026-06-21T20:06:46Z", "wild_states": 16}
{"affine_active_path": "all_active_fast", "affine_buffer": "resize_reuse", "affine_conversion": "batch", "affine_field_ops": "inplace", "affine_reverse_loop": "split_zero", "affine_tail_update": "skip_final", "affine_z_access": "const_ref", "affine_z_check": "infinity_flag", "architecture": "shared_tame", "avg_dp_count": 288.0, "backend": "macos_cpu", "budget_sec": 5, "candidate_verification": "full_point_collision", "commit": "1a62d47", "confirmation_index": 3, "confirmation_runs": 3, "confirmation_status": "discard", "correctness": true, "description": "Apple Silicon CPU shared-tame tiny 16-target kangaroo benchmark", "dp_bits": 0, "dp_bucket_storage": "inline_first", "dp_capacity": "max_load_2of3", "dp_clear": "empty_guard", "dp_hash": "partial_limb_mix", "dp_key": "x_parity", "dp_lookup": "open_address_linear", "dp_reserve": "sqrt_range_estimate", "ecint_carry_impl": "clang_builtin", "ecint_mul_final_sub": "single_conditional", "expected_private_key": "0x7", "experiment": "jacobian_kangaroo_multi16_small", "field_rhs_passing": "const_ref", "found_private_key": "0x7", "found_target_index": 15, "iterations": 618, "jacobian_step_passing": "const_ref", "jump_count": 8, "jump_index": "power2_mask", "jump_table": "precomputed", "last_dp_count": 288, "machine": "macOS-26.5-arm64-arm-64bit-Mach-O", "max_steps": 4096, "min_ms": 50, "operation": "jacobian_kangaroo_multi_small", "ops_per_sec": 12354.481747, "ops_per_sec_max": 12388.045536, "ops_per_sec_min": 12113.257034, "paired_baseline_ops_per_sec": 12012.212002, "paired_baseline_ref": "main", "paired_speedup": 1.028493481878526, "point_passing": "const_ref", "range_bits": 8, "range_context": "precomputed", "raw_status": "keep", "reason": "", "runner_sample_count": 3, "sample_count": 1, "scratch": "reused", "seconds": 0.050022, "single_target_ops_per_sec": 24375.043579, "skipped": false, "speedup_vs_single": 0.50685, "start_scalar": "0x2", "status": "discard", "tame_states": 1, "target_count": 16, "target_throughput_vs_single": 8.109594, "timestamp": "2026-06-21T20:06:57Z", "wild_states": 16}
