{"affine_scan_mode": "cpu_batch_prod_zz_zzz", "affine_scan_seconds": 0.006433, "backend": "metal", "budget_sec": 720, "bytes_per_target": 2.683818, "candidate_verification": "tag16_hash_filter_then_cpu_exact_key_equality", "commit": "7b4423e-dirty", "confirmation_index": 2, "confirmation_runs": 2, "confirmation_status": "keep", "cooldown_sec": 10.0, "correctness": true, "description": "Fixed-round 25M target lookup setup-inclusive wall-clock gate including Metal walk and lookup buffer setup", "distance_tracking": "packet_distance_uint64", "dp_bits": 6, "dp_checksum": "0x7f111e78c67b5c18", "dp_count": 4121, "dp_distance_checksum": "0x894123b96acf0de5", "dp_query_count": 4121, "dp_tracking": "affine_x256_y_parity_cpu_batch", "exact_host_table_bytes": 1068595456, "experiment": "metal_jacobian_dynamic_dp_stream_xyzz_affine_scan_target_lookup_tag16_hash_filter25m_rounds_setup_wall", "filter_false_positive_count": 0, "filter_positive_count": 131072, "gpu_lookup_lookups_per_sec": 335367705.278514, "gpu_ops_per_sec": 93519994.102762, "hit_count": 131072, "injected_hits": 128, "iterations": 536870912, "jump_count": 16, "jump_histogram_max_bucket": 33562777, "jump_histogram_max_deviation_ppm": 249, "jump_histogram_min_bucket": 33546500, "jump_index": "power2_mask", "jump_mixer": "avalanche64", "jump_schedule": "power2", "lookup_buffer_seconds": 0.001407, "lookup_engine": "gpu_filter16_hash_repeat", "lookup_engine_effective": "gpu_filter16_hash_repeat", "lookup_exact_seconds": 1.9e-05, "lookup_gpu_seconds": 0.012583, "lookup_hash_seconds": 1.3e-05, "lookup_layout": "open_address_tag16_hash_filter_exact256", "lookup_max_threads_per_threadgroup": 1024, "lookup_query_mode": "repeat", "lookup_repeat": 1024, "lookup_seconds": 0.012614, "lookup_thread_execution_width": 32, "lookup_threadgroup_limit": 512, "lookup_threads_per_threadgroup": 512, "lookup_wall_seconds": 0.014021, "lookups_per_sec": 334533559.235825, "machine": "macOS-26.5-arm64-arm-64bit-Mach-O", "max_threads_per_threadgroup": 1024, "min_ms": 0, "miss_count": 4088832, "operation": "jacobian_affine_scan_target_lookup_tag32_rounds", "ops_per_sec": 78462642.066908, "ops_per_sec_max": 97783101.611302, "ops_per_sec_min": 68211676.648858, "output_layout": "affine_dp_scan_target_lookup", "paired_baseline_ops_per_sec": 77106310.387503, "paired_baseline_ref": "main", "paired_order": "alternate", "paired_speedup": 1.0175904108572784, "physical_filter_positive_count": 131072, "physical_query_count": 4219904, "query_count": 4219904, "query_input": "hash64_repeat_indexed", "raw_status": "keep", "reason": "", "repeat_positive_index_encoding": "base_query_count_repeated", "requested_hits": 64, "round_count": 2, "round_sample_build_seconds": 0.010275, "runner_sample_count": 3, "sample_count": 131072, "seconds": 5.740707, "setup_inclusive_ops_per_sec": 80866495.077395, "setup_inclusive_seconds": 6.638978, "setup_inclusive_wall_ops_per_sec": 78462642.066908, "setup_inclusive_wall_ops_per_sec_max": 97783101.611302, "setup_inclusive_wall_ops_per_sec_min": 68211676.648858, "setup_inclusive_wall_seconds": 6.842376, "skipped": false, "state_layout": "xyzz", "status": "keep", "steps_per_sample": 2048, "target_bucket_bytes": 268435456, "target_build_seconds": 0.868949, "target_count": 25005000, "target_filter_bucket_bytes": 67108864, "target_filter_build_seconds": 0.0, "target_key": "x256_y_parity", "target_key_bytes": 800160000, "target_lookup_checksum": "0x923b46f156f9d59b", "target_query_hash_bytes": 32968, "target_table_buckets": 33554432, "target_table_bytes": 67108864, "thread_execution_width": 32, "threadgroup_limit": 128, "threads_per_threadgroup": 128, "timestamp": "2026-07-01T00:39:24Z", "validation_seconds": 19.675925, "validation_workers": 8, "walk_buffer_seconds": 0.201991, "walk_wall_seconds": 5.942698}
{"all_keys_found": true, "backend": "macos_cpu", "budget_sec": 240, "candidate_verification": "prehashed_serial_vs_parallel_semantic_find_all_keys", "commit": "1a4e22a-dirty", "confirmation_index": 1, "confirmation_runs": 2, "confirmation_status": "keep", "cooldown_sec": 5.0, "correctness": true, "description": "Host setup benchmark measuring absolute parallel CAS tag32 insertion throughput with semantic find-all verification", "experiment": "target_lookup_tag32_parallel_insert", "injected_count": 64, "iterations": 1, "lookup_layout": "open_address_tag32_index_exact256", "machine": "macOS-26.5-arm64-arm-64bit-Mach-O", "min_ms": 0, "operation": "target_lookup_tag32_parallel_insert_probe", "ops_per_sec": 32901579.175273, "ops_per_sec_max": 33472907.885093, "ops_per_sec_min": 28915572.10096, "paired_baseline_ops_per_sec": 32478416.212303, "paired_baseline_ref": "main", "paired_order": "alternate", "paired_speedup": 1.0130290516693885, "parallel_checksum": "0x62a77348330ebc1d", "parallel_seconds": 0.759994, "parallel_targets_per_sec": 32901579.175273, "parallel_targets_per_sec_max": 33472907.885093, "parallel_targets_per_sec_min": 28915572.10096, "raw_status": "keep", "reason": "", "runner_sample_count": 3, "sample_count": 25005000, "seconds": 0.759994, "serial_checksum": "0x0875f90b516f7503", "serial_seconds": 0.995203, "serial_targets_per_sec": 25125515.565556, "setup_phase": "host_tag32_parallel_insert_probe", "skipped": false, "speedup": 1.309489, "status": "keep", "target_bucket_bytes": 268435456, "target_count": 25005000, "target_key": "x256_y_parity", "target_key_bytes": 1000200000, "target_keys_equal": true, "target_table_buckets": 33554432, "target_table_bytes": 1268635456, "timestamp": "2026-07-01T00:44:46Z"}
{"all_keys_found": true, "backend": "macos_cpu", "budget_sec": 240, "candidate_verification": "prehashed_serial_vs_parallel_semantic_find_all_keys", "commit": "1a4e22a-dirty", "confirmation_index": 2, "confirmation_runs": 2, "confirmation_status": "keep", "cooldown_sec": 5.0, "correctness": true, "description": "Host setup benchmark measuring absolute parallel CAS tag32 insertion throughput with semantic find-all verification", "experiment": "target_lookup_tag32_parallel_insert", "injected_count": 64, "iterations": 1, "lookup_layout": "open_address_tag32_index_exact256", "machine": "macOS-26.5-arm64-arm-64bit-Mach-O", "min_ms": 0, "operation": "target_lookup_tag32_parallel_insert_probe", "ops_per_sec": 57394495.386564, "ops_per_sec_max": 58737938.817299, "ops_per_sec_min": 51890799.354117, "paired_baseline_ops_per_sec": 54632043.996412, "paired_baseline_ref": "main", "paired_order": "alternate", "paired_speedup": 1.050564672087565, "parallel_checksum": "0x4507478722da5de7", "parallel_seconds": 0.435669, "parallel_targets_per_sec": 57394495.386564, "parallel_targets_per_sec_max": 58737938.817299, "parallel_targets_per_sec_min": 51890799.354117, "raw_status": "keep", "reason": "", "runner_sample_count": 3, "sample_count": 25005000, "seconds": 0.435669, "serial_checksum": "0x0875f90b516f7503", "serial_seconds": 1.006455, "serial_targets_per_sec": 24844636.146935, "setup_phase": "host_tag32_parallel_insert_probe", "skipped": false, "speedup": 2.310136, "status": "keep", "target_bucket_bytes": 268435456, "target_count": 25005000, "target_key": "x256_y_parity", "target_key_bytes": 1000200000, "target_keys_equal": true, "target_table_buckets": 33554432, "target_table_bytes": 1268635456, "timestamp": "2026-07-01T00:44:46Z"}
{"affine_scan_mode": "cpu_batch_prod_zz_zzz", "affine_scan_seconds": 0.005203, "backend": "metal", "budget_sec": 180, "bytes_per_target": 2.683818, "candidate_verification": "tag16_hash_filter_then_cpu_exact_key_equality", "commit": "3fc7457-dirty", "cooldown_sec": 10.0, "correctness": true, "description": "Fixed-round 25M target lookup with physical distinct-miss queries; scores setup-inclusive wall-clock kangaroo distance/sec", "distance_per_sec": 514491859663.59973, "distance_tracking": "packet_distance_uint64", "dp_bits": 6, "dp_checksum": "0x7f111e78c67b5c18", "dp_count": 4121, "dp_distance_checksum": "0x894123b96acf0de5", "dp_query_count": 4121, "dp_tracking": "affine_x256_y_parity_cpu_batch", "exact_host_table_bytes": 1068595456, "experiment": "metal_jacobian_dynamic_dp_stream_xyzz_affine_scan_target_lookup_tag16_hash_filter25m_rounds_distinct_misses_distance", "filter_false_positive_count": 877, "filter_positive_count": 1005, "gpu_distance_per_sec": 520393712567.65967, "gpu_lookup_lookups_per_sec": 139313670.445091, "gpu_ops_per_sec": 127051184.879569, "hit_count": 128, "injected_hits": 128, "iterations": 536870912, "jump_count": 16, "jump_histogram_max_bucket": 33562777, "jump_histogram_max_deviation_ppm": 249, "jump_histogram_min_bucket": 33546500, "jump_index": "power2_mask", "jump_mixer": "avalanche64", "jump_schedule": "power2", "lookup_buffer_seconds": 0.017444, "lookup_engine": "gpu_filter16_hash", "lookup_engine_effective": "gpu_filter16_hash", "lookup_exact_seconds": 0.001794, "lookup_gpu_seconds": 0.030291, "lookup_hash_seconds": 0.011186, "lookup_layout": "open_address_tag16_hash_filter_exact256", "lookup_max_threads_per_threadgroup": 1024, "lookup_query_mode": "distinct_misses", "lookup_repeat": 1024, "lookup_seconds": 0.04327, "lookup_thread_execution_width": 32, "lookup_threadgroup_limit": 512, "lookup_threads_per_threadgroup": 512, "lookup_wall_seconds": 0.060715, "lookups_per_sec": 97524370.727593, "machine": "macOS-26.5-arm64-arm-64bit-Mach-O", "max_threads_per_threadgroup": 1024, "mean_jump_distance": 4095.9375, "min_ms": 0, "miss_count": 4219776, "operation": "jacobian_affine_scan_target_lookup_tag32_rounds", "ops_per_sec": 440854462579.941, "ops_per_sec_max": 444661566891.73035, "ops_per_sec_min": 434461529030.06055, "output_layout": "affine_dp_scan_target_lookup", "physical_filter_positive_count": 1005, "physical_query_count": 4219904, "query_count": 4219904, "query_input": "hash64", "reason": "", "repeat_positive_index_encoding": "physical_query_index", "requested_hits": 64, "round_count": 2, "round_sample_build_seconds": 0.004898, "runner_sample_count": 3, "sample_count": 131072, "seconds": 4.225627, "setup_inclusive_distance_per_sec": 448339293074.5751, "setup_inclusive_ops_per_sec": 109459505.442789, "setup_inclusive_seconds": 4.904745, "setup_inclusive_wall_distance_per_sec": 440854462579.941, "setup_inclusive_wall_distance_per_sec_max": 444661566891.73035, "setup_inclusive_wall_distance_per_sec_min": 434461529030.06055, "setup_inclusive_wall_ops_per_sec": 107632126.364218, "setup_inclusive_wall_seconds": 4.988017, "skipped": false, "state_layout": "xyzz", "status": "keep", "steps_per_sample": 2048, "target_bucket_bytes": 268435456, "target_build_seconds": 0.625747, "target_count": 25005000, "target_filter_bucket_bytes": 67108864, "target_filter_build_seconds": 0.0, "target_key": "x256_y_parity", "target_key_bytes": 800160000, "target_lookup_checksum": "0x5c90bdf7f12141b9", "target_query_hash_bytes": 33759232, "target_table_buckets": 33554432, "target_table_bytes": 67108864, "thread_execution_width": 32, "threadgroup_limit": 128, "threads_per_threadgroup": 128, "timestamp": "2026-07-01T10:27:31Z", "validation_seconds": 15.211749, "validation_workers": 8, "walk_buffer_seconds": 0.065828, "walk_wall_seconds": 4.291455}
{"affine_scan_mode": "cpu_batch_prod_zz_zzz", "affine_scan_seconds": 0.006483, "backend": "metal", "budget_sec": 180, "bytes_per_target": 2.683818, "candidate_verification": "tag16_hash_filter_then_cpu_exact_key_equality", "commit": "34b6c9e-dirty", "cooldown_sec": 10.0, "correctness": true, "description": "Fixed-round 25M target lookup with physical distinct-miss queries; scores setup-inclusive wall-clock kangaroo distance/sec", "distance_per_sec": 474231127218.2216, "distance_tracking": "packet_distance_uint64", "dp_bits": 6, "dp_checksum": "0x7f111e78c67b5c18", "dp_count": 4121, "dp_distance_checksum": "0x894123b96acf0de5", "dp_query_count": 4121, "dp_tracking": "affine_x256_y_parity_cpu_batch", "exact_host_table_bytes": 1068595456, "experiment": "metal_jacobian_dynamic_dp_stream_xyzz_affine_scan_target_lookup_tag16_hash_filter25m_rounds_distinct_misses_distance", "filter_false_positive_count": 876, "filter_positive_count": 1004, "gpu_distance_per_sec": 479662263206.13837, "gpu_lookup_lookups_per_sec": 163756285.21204, "gpu_ops_per_sec": 117106831.636503, "hit_count": 128, "injected_hits": 128, "iterations": 536870912, "jump_count": 16, "jump_histogram_max_bucket": 33562777, "jump_histogram_max_deviation_ppm": 249, "jump_histogram_min_bucket": 33546500, "jump_index": "power2_mask", "jump_mixer": "avalanche64", "jump_schedule": "power2", "lookup_buffer_seconds": 0.015738, "lookup_engine": "gpu_filter16_hash", "lookup_engine_effective": "gpu_filter16_hash", "lookup_exact_seconds": 0.001647, "lookup_gpu_seconds": 0.025769, "lookup_hash_seconds": 0.018604, "lookup_layout": "open_address_tag16_hash_filter_exact256", "lookup_max_threads_per_threadgroup": 1024, "lookup_query_mode": "distinct_misses", "lookup_repeat": 1024, "lookup_seconds": 0.04602, "lookup_thread_execution_width": 32, "lookup_threadgroup_limit": 512, "lookup_threads_per_threadgroup": 512, "lookup_wall_seconds": 0.061758, "lookups_per_sec": 91697091.454197, "machine": "macOS-26.5-arm64-arm-64bit-Mach-O", "max_threads_per_threadgroup": 1024, "mean_jump_distance": 4095.9375, "min_ms": 0, "miss_count": 4219776, "operation": "jacobian_affine_scan_target_lookup_tag32_rounds", "ops_per_sec": 419382208002.397, "ops_per_sec_max": 435157324690.1377, "ops_per_sec_min": 349452081403.7209, "output_layout": "affine_dp_scan_target_lookup", "physical_filter_positive_count": 1004, "physical_query_count": 4219904, "query_count": 4219904, "query_input": "hash64", "reason": "", "repeat_positive_index_encoding": "physical_query_index", "requested_hits": 64, "round_count": 2, "round_sample_build_seconds": 0.005309, "runner_sample_count": 3, "sample_count": 131072, "seconds": 4.584454, "setup_inclusive_distance_per_sec": 426359683320.18195, "setup_inclusive_ops_per_sec": 104093307.898419, "setup_inclusive_seconds": 5.157593, "setup_inclusive_wall_distance_per_sec": 419382208002.397, "setup_inclusive_wall_distance_per_sec_max": 435157324690.1377, "setup_inclusive_wall_distance_per_sec_min": 349452081403.7209, "setup_inclusive_wall_ops_per_sec": 102389796.719895, "setup_inclusive_wall_seconds": 5.243402, "skipped": false, "state_layout": "xyzz", "status": "discard", "steps_per_sample": 2048, "target_bucket_bytes": 268435456, "target_build_seconds": 0.515326, "target_count": 25005000, "target_filter_bucket_bytes": 67108864, "target_filter_build_seconds": 0.0, "target_key": "x256_y_parity", "target_key_bytes": 800160000, "target_lookup_checksum": "0x5c90bdf7f12141b9", "target_query_hash_bytes": 33759232, "target_table_buckets": 33554432, "target_table_bytes": 67108864, "thread_execution_width": 32, "threadgroup_limit": 128, "threads_per_threadgroup": 128, "timestamp": "2026-07-01T11:08:30Z", "validation_seconds": 16.295777, "validation_workers": 8, "walk_buffer_seconds": 0.070072, "walk_wall_seconds": 4.654526}
{"affine_scan_mode": "cpu_batch_prod_zz_zzz", "affine_scan_seconds": 0.007488, "backend": "metal", "budget_sec": 180, "bytes_per_target": 2.683818, "candidate_verification": "tag16_hash_filter_then_cpu_exact_key_equality", "commit": "4d17076-dirty", "cooldown_sec": 10.0, "correctness": true, "description": "Fixed-round 25M target lookup with physical distinct-miss queries; scores setup-inclusive wall-clock kangaroo distance/sec", "distance_per_sec": 513569398154.9775, "distance_tracking": "packet_distance_uint64", "dp_bits": 6, "dp_checksum": "0x7f111e78c67b5c18", "dp_count": 4121, "dp_distance_checksum": "0x894123b96acf0de5", "dp_query_count": 4121, "dp_tracking": "affine_x256_y_parity_cpu_batch", "exact_host_table_bytes": 1068595456, "experiment": "metal_jacobian_dynamic_dp_stream_xyzz_affine_scan_target_lookup_tag16_hash_filter25m_rounds_distinct_misses_distance", "filter_false_positive_count": 879, "filter_positive_count": 1007, "gpu_distance_per_sec": 519127158614.5494, "gpu_lookup_lookups_per_sec": 160290352.44738, "gpu_ops_per_sec": 126741962.887507, "hit_count": 128, "injected_hits": 128, "iterations": 536870912, "jump_count": 16, "jump_histogram_max_bucket": 33562777, "jump_histogram_max_deviation_ppm": 249, "jump_histogram_min_bucket": 33546500, "jump_index": "power2_mask", "jump_mixer": "avalanche64", "jump_schedule": "power2", "lookup_buffer_seconds": 0.01098, "lookup_engine": "gpu_filter16_hash", "lookup_engine_effective": "gpu_filter16_hash", "lookup_exact_seconds": 0.000461, "lookup_gpu_seconds": 0.026327, "lookup_hash_seconds": 0.011565, "lookup_layout": "open_address_tag16_hash_filter_exact256", "lookup_max_threads_per_threadgroup": 1024, "lookup_query_mode": "distinct_misses", "lookup_repeat": 1024, "lookup_seconds": 0.038353, "lookup_thread_execution_width": 32, "lookup_threadgroup_limit": 512, "lookup_threads_per_threadgroup": 512, "lookup_wall_seconds": 0.049332, "lookups_per_sec": 110029316.961572, "machine": "macOS-26.5-arm64-arm-64bit-Mach-O", "max_threads_per_threadgroup": 1024, "mean_jump_distance": 4095.9375, "min_ms": 0, "miss_count": 4219776, "operation": "jacobian_affine_scan_target_lookup_tag32_rounds", "ops_per_sec": 440858189444.95154, "ops_per_sec_max": 447840335155.64764, "ops_per_sec_min": 439183237405.76514, "output_layout": "affine_dp_scan_target_lookup", "physical_filter_positive_count": 1007, "physical_query_count": 4219904, "query_count": 4219904, "query_input": "hash64", "reason": "", "repeat_positive_index_encoding": "physical_query_index", "requested_hits": 64, "round_count": 2, "round_sample_build_seconds": 0.005118, "runner_sample_count": 3, "sample_count": 131072, "seconds": 4.235937, "setup_inclusive_distance_per_sec": 446693113709.6557, "setup_inclusive_ops_per_sec": 109057600.051186, "setup_inclusive_seconds": 4.92282, "setup_inclusive_wall_distance_per_sec": 440858189444.95154, "setup_inclusive_wall_distance_per_sec_max": 447840335155.64764, "setup_inclusive_wall_distance_per_sec_min": 439183237405.76514, "setup_inclusive_wall_ops_per_sec": 107633036.257255, "setup_inclusive_wall_seconds": 4.987975, "skipped": false, "state_layout": "xyzz", "status": "discard", "steps_per_sample": 2048, "target_bucket_bytes": 268435456, "target_build_seconds": 0.635925, "target_count": 25005000, "target_filter_bucket_bytes": 67108864, "target_filter_build_seconds": 0.0, "target_key": "x256_y_parity", "target_key_bytes": 800160000, "target_lookup_checksum": "0x5c90bdf7f12141b9", "target_query_hash_bytes": 33759232, "target_table_buckets": 33554432, "target_table_bytes": 67108864, "thread_execution_width": 32, "threadgroup_limit": 128, "threads_per_threadgroup": 128, "timestamp": "2026-07-01T11:31:06Z", "validation_seconds": 15.259927, "validation_workers": 8, "walk_buffer_seconds": 0.054176, "walk_wall_seconds": 4.290112}
