{"backend": "metal", "budget_sec": 10, "commit": "da92cad-dirty", "confirmation_index": 1, "confirmation_runs": 3, "confirmation_status": "keep", "correctness": true, "description": "Metal in-place dynamic Jacobian DP8 stream with 128-step state packets", "distance_tracking": "dp_stream_uint64", "dp_bits": 8, "dp_capacity": 16384, "dp_checksum": "0xc9e5a3440ffdb698", "dp_count": 68, "dp_distance_checksum": "0x2b611389e103e188", "dp_stream_overflow": false, "dp_tracking": "projective_x_limb0", "emitted_records": 68, "experiment": "metal_jacobian_dynamic_dp_stream_inplace_steps128", "iterations": 18874368, "jump_count": 16, "jump_histogram_max_bucket": 131568, "jump_histogram_max_deviation_ppm": 3975, "jump_histogram_min_bucket": 130551, "jump_index": "power2_mask", "jump_mixer": "avalanche64", "machine": "macOS-26.5-arm64-arm-64bit-Mach-O", "max_threads_per_threadgroup": 1024, "min_ms": 200, "operation": "jacobian_affine_walk_dynamic_dp_stream_inplace", "ops_per_sec": 91542712.027089, "ops_per_sec_max": 91894106.556447, "ops_per_sec_min": 88825676.669132, "output_bytes_per_record": 20, "output_bytes_total": 1360, "output_layout": "dp_stream", "raw_status": "keep", "reason": "", "runner_sample_count": 3, "sample_count": 16384, "seconds": 0.206181, "skipped": false, "status": "keep", "steps_per_sample": 128, "thread_execution_width": 32, "threadgroup_limit": 256, "threads_per_threadgroup": 256, "timestamp": "2026-06-22T15:53:54Z"}
{"backend": "metal", "budget_sec": 10, "commit": "da92cad-dirty", "confirmation_index": 2, "confirmation_runs": 3, "confirmation_status": "keep", "correctness": true, "description": "Metal in-place dynamic Jacobian DP8 stream with 128-step state packets", "distance_tracking": "dp_stream_uint64", "dp_bits": 8, "dp_capacity": 16384, "dp_checksum": "0xc9e5a3440ffdb698", "dp_count": 68, "dp_distance_checksum": "0x2b611389e103e188", "dp_stream_overflow": false, "dp_tracking": "projective_x_limb0", "emitted_records": 68, "experiment": "metal_jacobian_dynamic_dp_stream_inplace_steps128", "iterations": 18874368, "jump_count": 16, "jump_histogram_max_bucket": 131568, "jump_histogram_max_deviation_ppm": 3975, "jump_histogram_min_bucket": 130551, "jump_index": "power2_mask", "jump_mixer": "avalanche64", "machine": "macOS-26.5-arm64-arm-64bit-Mach-O", "max_threads_per_threadgroup": 1024, "min_ms": 200, "operation": "jacobian_affine_walk_dynamic_dp_stream_inplace", "ops_per_sec": 89721784.654431, "ops_per_sec_max": 90880677.407914, "ops_per_sec_min": 86077828.482521, "output_bytes_per_record": 20, "output_bytes_total": 1360, "output_layout": "dp_stream", "raw_status": "keep", "reason": "", "runner_sample_count": 3, "sample_count": 16384, "seconds": 0.210365, "skipped": false, "status": "keep", "steps_per_sample": 128, "thread_execution_width": 32, "threadgroup_limit": 256, "threads_per_threadgroup": 256, "timestamp": "2026-06-22T15:54:01Z"}
{"backend": "metal", "budget_sec": 10, "commit": "da92cad-dirty", "confirmation_index": 3, "confirmation_runs": 3, "confirmation_status": "keep", "correctness": true, "description": "Metal in-place dynamic Jacobian DP8 stream with 128-step state packets", "distance_tracking": "dp_stream_uint64", "dp_bits": 8, "dp_capacity": 16384, "dp_checksum": "0xc9e5a3440ffdb698", "dp_count": 68, "dp_distance_checksum": "0x2b611389e103e188", "dp_stream_overflow": false, "dp_tracking": "projective_x_limb0", "emitted_records": 68, "experiment": "metal_jacobian_dynamic_dp_stream_inplace_steps128", "iterations": 18874368, "jump_count": 16, "jump_histogram_max_bucket": 131568, "jump_histogram_max_deviation_ppm": 3975, "jump_histogram_min_bucket": 130551, "jump_index": "power2_mask", "jump_mixer": "avalanche64", "machine": "macOS-26.5-arm64-arm-64bit-Mach-O", "max_threads_per_threadgroup": 1024, "min_ms": 200, "operation": "jacobian_affine_walk_dynamic_dp_stream_inplace", "ops_per_sec": 90611211.497293, "ops_per_sec_max": 91876773.694871, "ops_per_sec_min": 90368172.117244, "output_bytes_per_record": 20, "output_bytes_total": 1360, "output_layout": "dp_stream", "raw_status": "keep", "reason": "", "runner_sample_count": 3, "sample_count": 16384, "seconds": 0.208301, "skipped": false, "status": "keep", "steps_per_sample": 128, "thread_execution_width": 32, "threadgroup_limit": 256, "threads_per_threadgroup": 256, "timestamp": "2026-06-22T15:54:08Z"}
{"backend": "metal", "budget_sec": 10, "commit": "d66c32c-dirty", "confirmation_index": 1, "confirmation_runs": 3, "confirmation_status": "keep", "correctness": true, "description": "Metal in-place dynamic Jacobian DP8 stream with 256-step state packets", "distance_tracking": "dp_stream_uint64", "dp_bits": 8, "dp_capacity": 16384, "dp_checksum": "0xbb961e8e4fffeeb0", "dp_count": 57, "dp_distance_checksum": "0x0ab81bcdffe988ca", "dp_stream_overflow": false, "dp_tracking": "projective_x_limb0", "emitted_records": 57, "experiment": "metal_jacobian_dynamic_dp_stream_inplace_steps256", "iterations": 20971520, "jump_count": 16, "jump_histogram_max_bucket": 262582, "jump_histogram_max_deviation_ppm": 2079, "jump_histogram_min_bucket": 261599, "jump_index": "power2_mask", "jump_mixer": "avalanche64", "machine": "macOS-26.5-arm64-arm-64bit-Mach-O", "max_threads_per_threadgroup": 1024, "min_ms": 200, "operation": "jacobian_affine_walk_dynamic_dp_stream_inplace", "ops_per_sec": 87932729.804642, "ops_per_sec_max": 90757021.85346, "ops_per_sec_min": 87847596.162981, "output_bytes_per_record": 20, "output_bytes_total": 1140, "output_layout": "dp_stream", "raw_status": "keep", "reason": "", "runner_sample_count": 3, "sample_count": 16384, "seconds": 0.238495, "skipped": false, "status": "keep", "steps_per_sample": 256, "thread_execution_width": 32, "threadgroup_limit": 256, "threads_per_threadgroup": 256, "timestamp": "2026-06-22T16:00:24Z"}
{"backend": "metal", "budget_sec": 10, "commit": "d66c32c-dirty", "confirmation_index": 2, "confirmation_runs": 3, "confirmation_status": "keep", "correctness": true, "description": "Metal in-place dynamic Jacobian DP8 stream with 256-step state packets", "distance_tracking": "dp_stream_uint64", "dp_bits": 8, "dp_capacity": 16384, "dp_checksum": "0xbb961e8e4fffeeb0", "dp_count": 57, "dp_distance_checksum": "0x0ab81bcdffe988ca", "dp_stream_overflow": false, "dp_tracking": "projective_x_limb0", "emitted_records": 57, "experiment": "metal_jacobian_dynamic_dp_stream_inplace_steps256", "iterations": 20971520, "jump_count": 16, "jump_histogram_max_bucket": 262582, "jump_histogram_max_deviation_ppm": 2079, "jump_histogram_min_bucket": 261599, "jump_index": "power2_mask", "jump_mixer": "avalanche64", "machine": "macOS-26.5-arm64-arm-64bit-Mach-O", "max_threads_per_threadgroup": 1024, "min_ms": 200, "operation": "jacobian_affine_walk_dynamic_dp_stream_inplace", "ops_per_sec": 90774454.451957, "ops_per_sec_max": 93337687.589535, "ops_per_sec_min": 90767955.335673, "output_bytes_per_record": 20, "output_bytes_total": 1140, "output_layout": "dp_stream", "raw_status": "keep", "reason": "", "runner_sample_count": 3, "sample_count": 16384, "seconds": 0.231029, "skipped": false, "status": "keep", "steps_per_sample": 256, "thread_execution_width": 32, "threadgroup_limit": 256, "threads_per_threadgroup": 256, "timestamp": "2026-06-22T16:00:33Z"}
{"backend": "metal", "budget_sec": 10, "commit": "d66c32c-dirty", "confirmation_index": 3, "confirmation_runs": 3, "confirmation_status": "keep", "correctness": true, "description": "Metal in-place dynamic Jacobian DP8 stream with 256-step state packets", "distance_tracking": "dp_stream_uint64", "dp_bits": 8, "dp_capacity": 16384, "dp_checksum": "0xbb961e8e4fffeeb0", "dp_count": 57, "dp_distance_checksum": "0x0ab81bcdffe988ca", "dp_stream_overflow": false, "dp_tracking": "projective_x_limb0", "emitted_records": 57, "experiment": "metal_jacobian_dynamic_dp_stream_inplace_steps256", "iterations": 20971520, "jump_count": 16, "jump_histogram_max_bucket": 262582, "jump_histogram_max_deviation_ppm": 2079, "jump_histogram_min_bucket": 261599, "jump_index": "power2_mask", "jump_mixer": "avalanche64", "machine": "macOS-26.5-arm64-arm-64bit-Mach-O", "max_threads_per_threadgroup": 1024, "min_ms": 200, "operation": "jacobian_affine_walk_dynamic_dp_stream_inplace", "ops_per_sec": 89960529.450509, "ops_per_sec_max": 90497690.693942, "ops_per_sec_min": 87779939.478256, "output_bytes_per_record": 20, "output_bytes_total": 1140, "output_layout": "dp_stream", "raw_status": "keep", "reason": "", "runner_sample_count": 3, "sample_count": 16384, "seconds": 0.233119, "skipped": false, "status": "keep", "steps_per_sample": 256, "thread_execution_width": 32, "threadgroup_limit": 256, "threads_per_threadgroup": 256, "timestamp": "2026-06-22T16:00:42Z"}
{"backend": "metal", "budget_sec": 10, "commit": "186b887-dirty", "confirmation_index": 1, "confirmation_runs": 3, "confirmation_status": "keep", "correctness": true, "description": "Metal in-place dynamic Jacobian DP8 stream with 256-step state packets", "distance_tracking": "dp_stream_uint64", "dp_bits": 8, "dp_capacity": 16384, "dp_checksum": "0xbb961e8e4fffeeb0", "dp_count": 57, "dp_distance_checksum": "0x0ab81bcdffe988ca", "dp_stream_overflow": false, "dp_tracking": "projective_x_limb0", "emitted_records": 57, "experiment": "metal_jacobian_dynamic_dp_stream_inplace_steps256", "iterations": 20971520, "jump_count": 16, "jump_histogram_max_bucket": 262582, "jump_histogram_max_deviation_ppm": 2079, "jump_histogram_min_bucket": 261599, "jump_index": "power2_mask", "jump_mixer": "avalanche64", "machine": "macOS-26.5-arm64-arm-64bit-Mach-O", "max_threads_per_threadgroup": 1024, "min_ms": 200, "operation": "jacobian_affine_walk_dynamic_dp_stream_inplace", "ops_per_sec": 96388652.058509, "ops_per_sec_max": 98488646.514485, "ops_per_sec_min": 95065030.148389, "output_bytes_per_record": 20, "output_bytes_total": 1140, "output_layout": "dp_stream", "paired_baseline_ops_per_sec": 91254931.009876, "paired_baseline_ref": "main", "paired_speedup": 1.0562569166599602, "raw_status": "keep", "reason": "", "runner_sample_count": 3, "sample_count": 16384, "seconds": 0.217573, "skipped": false, "status": "keep", "steps_per_sample": 256, "thread_execution_width": 32, "threadgroup_limit": 128, "threads_per_threadgroup": 128, "timestamp": "2026-06-22T16:23:12Z"}
{"backend": "metal", "budget_sec": 10, "commit": "186b887-dirty", "confirmation_index": 2, "confirmation_runs": 3, "confirmation_status": "keep", "correctness": true, "description": "Metal in-place dynamic Jacobian DP8 stream with 256-step state packets", "distance_tracking": "dp_stream_uint64", "dp_bits": 8, "dp_capacity": 16384, "dp_checksum": "0xbb961e8e4fffeeb0", "dp_count": 57, "dp_distance_checksum": "0x0ab81bcdffe988ca", "dp_stream_overflow": false, "dp_tracking": "projective_x_limb0", "emitted_records": 57, "experiment": "metal_jacobian_dynamic_dp_stream_inplace_steps256", "iterations": 20971520, "jump_count": 16, "jump_histogram_max_bucket": 262582, "jump_histogram_max_deviation_ppm": 2079, "jump_histogram_min_bucket": 261599, "jump_index": "power2_mask", "jump_mixer": "avalanche64", "machine": "macOS-26.5-arm64-arm-64bit-Mach-O", "max_threads_per_threadgroup": 1024, "min_ms": 200, "operation": "jacobian_affine_walk_dynamic_dp_stream_inplace", "ops_per_sec": 94965319.974295, "ops_per_sec_max": 100327859.833433, "ops_per_sec_min": 94261135.904418, "output_bytes_per_record": 20, "output_bytes_total": 1140, "output_layout": "dp_stream", "paired_baseline_ops_per_sec": 89743503.499161, "paired_baseline_ref": "main", "paired_speedup": 1.0581860109259364, "raw_status": "keep", "reason": "", "runner_sample_count": 3, "sample_count": 16384, "seconds": 0.220833, "skipped": false, "status": "keep", "steps_per_sample": 256, "thread_execution_width": 32, "threadgroup_limit": 128, "threads_per_threadgroup": 128, "timestamp": "2026-06-22T16:23:13Z"}
{"backend": "metal", "budget_sec": 10, "commit": "186b887-dirty", "confirmation_index": 3, "confirmation_runs": 3, "confirmation_status": "keep", "correctness": true, "description": "Metal in-place dynamic Jacobian DP8 stream with 256-step state packets", "distance_tracking": "dp_stream_uint64", "dp_bits": 8, "dp_capacity": 16384, "dp_checksum": "0xbb961e8e4fffeeb0", "dp_count": 57, "dp_distance_checksum": "0x0ab81bcdffe988ca", "dp_stream_overflow": false, "dp_tracking": "projective_x_limb0", "emitted_records": 57, "experiment": "metal_jacobian_dynamic_dp_stream_inplace_steps256", "iterations": 20971520, "jump_count": 16, "jump_histogram_max_bucket": 262582, "jump_histogram_max_deviation_ppm": 2079, "jump_histogram_min_bucket": 261599, "jump_index": "power2_mask", "jump_mixer": "avalanche64", "machine": "macOS-26.5-arm64-arm-64bit-Mach-O", "max_threads_per_threadgroup": 1024, "min_ms": 200, "operation": "jacobian_affine_walk_dynamic_dp_stream_inplace", "ops_per_sec": 98057706.925364, "ops_per_sec_max": 99194209.755962, "ops_per_sec_min": 97248944.228694, "output_bytes_per_record": 20, "output_bytes_total": 1140, "output_layout": "dp_stream", "paired_baseline_ops_per_sec": 91099934.341126, "paired_baseline_ref": "main", "paired_speedup": 1.0763751657403446, "raw_status": "keep", "reason": "", "runner_sample_count": 3, "sample_count": 16384, "seconds": 0.213869, "skipped": false, "status": "keep", "steps_per_sample": 256, "thread_execution_width": 32, "threadgroup_limit": 128, "threads_per_threadgroup": 128, "timestamp": "2026-06-22T16:23:13Z"}
{"backend": "metal", "budget_sec": 120, "commit": "b926b0b-dirty", "confirmation_index": 1, "confirmation_runs": 3, "confirmation_status": "keep", "correctness": true, "description": "Metal dynamic DP8 stream using XYZZ state packets at 256 steps", "distance_tracking": "dp_stream_uint64", "dp_bits": 8, "dp_capacity": 16384, "dp_checksum": "0x7dbd6d4ef9312f92", "dp_count": 66, "dp_distance_checksum": "0x8c7a04f6c070c09d", "dp_stream_overflow": false, "dp_tracking": "projective_x_limb0", "emitted_records": 66, "experiment": "metal_jacobian_dynamic_dp_stream_xyzz_steps256", "iterations": 25165824, "jump_count": 16, "jump_histogram_max_bucket": 262878, "jump_histogram_max_deviation_ppm": 2800, "jump_histogram_min_bucket": 261520, "jump_index": "power2_mask", "jump_mixer": "avalanche64", "machine": "macOS-26.5-arm64-arm-64bit-Mach-O", "max_threads_per_threadgroup": 1024, "min_ms": 200, "operation": "jacobian_affine_walk_dynamic_dp_stream_xyzz", "ops_per_sec": 108430652.959344, "ops_per_sec_max": 109396193.731781, "ops_per_sec_min": 104464248.230428, "output_bytes_per_record": 20, "output_bytes_total": 1320, "output_layout": "dp_stream", "paired_baseline_ops_per_sec": 97116935.449139, "paired_baseline_ref": "main", "paired_speedup": 1.1164958249339538, "raw_status": "keep", "reason": "", "runner_sample_count": 3, "sample_count": 16384, "seconds": 0.232091, "skipped": false, "state_layout": "xyzz", "status": "keep", "steps_per_sample": 256, "thread_execution_width": 32, "threadgroup_limit": 128, "threads_per_threadgroup": 128, "timestamp": "2026-06-22T17:33:47Z"}
{"backend": "metal", "budget_sec": 120, "commit": "b926b0b-dirty", "confirmation_index": 2, "confirmation_runs": 3, "confirmation_status": "keep", "correctness": true, "description": "Metal dynamic DP8 stream using XYZZ state packets at 256 steps", "distance_tracking": "dp_stream_uint64", "dp_bits": 8, "dp_capacity": 16384, "dp_checksum": "0x7dbd6d4ef9312f92", "dp_count": 66, "dp_distance_checksum": "0x8c7a04f6c070c09d", "dp_stream_overflow": false, "dp_tracking": "projective_x_limb0", "emitted_records": 66, "experiment": "metal_jacobian_dynamic_dp_stream_xyzz_steps256", "iterations": 25165824, "jump_count": 16, "jump_histogram_max_bucket": 262878, "jump_histogram_max_deviation_ppm": 2800, "jump_histogram_min_bucket": 261520, "jump_index": "power2_mask", "jump_mixer": "avalanche64", "machine": "macOS-26.5-arm64-arm-64bit-Mach-O", "max_threads_per_threadgroup": 1024, "min_ms": 200, "operation": "jacobian_affine_walk_dynamic_dp_stream_xyzz", "ops_per_sec": 109797276.536427, "ops_per_sec_max": 110953085.113418, "ops_per_sec_min": 104147918.896234, "output_bytes_per_record": 20, "output_bytes_total": 1320, "output_layout": "dp_stream", "paired_baseline_ops_per_sec": 99516980.914828, "paired_baseline_ref": "main", "paired_speedup": 1.1033019242253483, "raw_status": "keep", "reason": "", "runner_sample_count": 3, "sample_count": 16384, "seconds": 0.229203, "skipped": false, "state_layout": "xyzz", "status": "keep", "steps_per_sample": 256, "thread_execution_width": 32, "threadgroup_limit": 128, "threads_per_threadgroup": 128, "timestamp": "2026-06-22T17:33:47Z"}
{"backend": "metal", "budget_sec": 120, "commit": "b926b0b-dirty", "confirmation_index": 3, "confirmation_runs": 3, "confirmation_status": "keep", "correctness": true, "description": "Metal dynamic DP8 stream using XYZZ state packets at 256 steps", "distance_tracking": "dp_stream_uint64", "dp_bits": 8, "dp_capacity": 16384, "dp_checksum": "0x7dbd6d4ef9312f92", "dp_count": 66, "dp_distance_checksum": "0x8c7a04f6c070c09d", "dp_stream_overflow": false, "dp_tracking": "projective_x_limb0", "emitted_records": 66, "experiment": "metal_jacobian_dynamic_dp_stream_xyzz_steps256", "iterations": 25165824, "jump_count": 16, "jump_histogram_max_bucket": 262878, "jump_histogram_max_deviation_ppm": 2800, "jump_histogram_min_bucket": 261520, "jump_index": "power2_mask", "jump_mixer": "avalanche64", "machine": "macOS-26.5-arm64-arm-64bit-Mach-O", "max_threads_per_threadgroup": 1024, "min_ms": 200, "operation": "jacobian_affine_walk_dynamic_dp_stream_xyzz", "ops_per_sec": 109205454.549881, "ops_per_sec_max": 109512846.454566, "ops_per_sec_min": 101620787.382879, "output_bytes_per_record": 20, "output_bytes_total": 1320, "output_layout": "dp_stream", "paired_baseline_ops_per_sec": 98548542.510903, "paired_baseline_ref": "main", "paired_speedup": 1.1081387077622071, "raw_status": "keep", "reason": "", "runner_sample_count": 3, "sample_count": 16384, "seconds": 0.230445, "skipped": false, "state_layout": "xyzz", "status": "keep", "steps_per_sample": 256, "thread_execution_width": 32, "threadgroup_limit": 128, "threads_per_threadgroup": 128, "timestamp": "2026-06-22T17:33:47Z"}
{"backend": "metal", "budget_sec": 120, "commit": "a587357-dirty", "confirmation_index": 1, "confirmation_runs": 3, "confirmation_status": "keep", "correctness": true, "description": "Metal dynamic DP8 stream using XYZZ state packets at 512 steps", "distance_tracking": "dp_stream_uint64", "dp_bits": 8, "dp_capacity": 16384, "dp_checksum": "0x979de1728771393c", "dp_count": 76, "dp_distance_checksum": "0x59171fb04821054e", "dp_stream_overflow": false, "dp_tracking": "projective_x_limb0", "emitted_records": 76, "experiment": "metal_jacobian_dynamic_dp_stream_xyzz_steps512", "iterations": 25165824, "jump_count": 16, "jump_histogram_max_bucket": 525454, "jump_histogram_max_deviation_ppm": 2724, "jump_histogram_min_bucket": 522860, "jump_index": "power2_mask", "jump_mixer": "avalanche64", "machine": "macOS-26.5-arm64-arm-64bit-Mach-O", "max_threads_per_threadgroup": 1024, "min_ms": 200, "operation": "jacobian_affine_walk_dynamic_dp_stream_xyzz", "ops_per_sec": 105678664.660821, "ops_per_sec_max": 109515586.275334, "ops_per_sec_min": 102609821.553316, "output_bytes_per_record": 20, "output_bytes_total": 1520, "output_layout": "dp_stream", "paired_baseline_ops_per_sec": 102653102.552273, "paired_baseline_ref": "main", "paired_speedup": 1.0294736547977916, "raw_status": "keep", "reason": "", "runner_sample_count": 3, "sample_count": 16384, "seconds": 0.238135, "skipped": false, "state_layout": "xyzz", "status": "keep", "steps_per_sample": 512, "thread_execution_width": 32, "threadgroup_limit": 128, "threads_per_threadgroup": 128, "timestamp": "2026-06-22T17:43:02Z"}
{"backend": "metal", "budget_sec": 120, "commit": "a587357-dirty", "confirmation_index": 2, "confirmation_runs": 3, "confirmation_status": "keep", "correctness": true, "description": "Metal dynamic DP8 stream using XYZZ state packets at 512 steps", "distance_tracking": "dp_stream_uint64", "dp_bits": 8, "dp_capacity": 16384, "dp_checksum": "0x979de1728771393c", "dp_count": 76, "dp_distance_checksum": "0x59171fb04821054e", "dp_stream_overflow": false, "dp_tracking": "projective_x_limb0", "emitted_records": 76, "experiment": "metal_jacobian_dynamic_dp_stream_xyzz_steps512", "iterations": 25165824, "jump_count": 16, "jump_histogram_max_bucket": 525454, "jump_histogram_max_deviation_ppm": 2724, "jump_histogram_min_bucket": 522860, "jump_index": "power2_mask", "jump_mixer": "avalanche64", "machine": "macOS-26.5-arm64-arm-64bit-Mach-O", "max_threads_per_threadgroup": 1024, "min_ms": 200, "operation": "jacobian_affine_walk_dynamic_dp_stream_xyzz", "ops_per_sec": 105831859.880228, "ops_per_sec_max": 108444573.72045, "ops_per_sec_min": 103212913.40627, "output_bytes_per_record": 20, "output_bytes_total": 1520, "output_layout": "dp_stream", "paired_baseline_ops_per_sec": 102675656.563845, "paired_baseline_ref": "main", "paired_speedup": 1.0307395484188644, "raw_status": "keep", "reason": "", "runner_sample_count": 3, "sample_count": 16384, "seconds": 0.237791, "skipped": false, "state_layout": "xyzz", "status": "keep", "steps_per_sample": 512, "thread_execution_width": 32, "threadgroup_limit": 128, "threads_per_threadgroup": 128, "timestamp": "2026-06-22T17:43:02Z"}
