{"affine_scan_mode": "cpu_batch_prod_zz_zzz", "affine_scan_seconds": 0.015169, "backend": "metal", "budget_sec": 120, "bytes_per_target": 2.683818, "candidate_verification": "tag16_hash_filter_then_cpu_exact_key_equality", "commit": "b2bdf82-dirty", "confirmation_index": 2, "confirmation_runs": 2, "confirmation_status": "keep", "cooldown_sec": 10.0, "correctness": true, "description": "Metal XYZZ affine DP scan tag16 hash-filter 25M-target repeat2048 lookup with thresholded parallel host query-hash build", "distance_tracking": "packet_distance_uint64", "dp_bits": 8, "dp_checksum": "0x9dba4a07ebbb8e14", "dp_count": 1057, "dp_distance_checksum": "0xf0dc88ed68b2ff64", "dp_query_count": 1057, "dp_tracking": "affine_x256_y_parity_cpu_batch", "exact_host_table_bytes": 1268635456, "experiment": "metal_jacobian_dynamic_dp_stream_xyzz_affine_scan_target_lookup_tag16_hash_filter25m_parallel_hash_repeat2048", "filter_false_positive_count": 444, "filter_positive_count": 508, "gpu_lookup_lookups_per_sec": 81771721.642915, "gpu_ops_per_sec": 126258457.94065, "hit_count": 64, "injected_hits": 64, "iterations": 134217728, "jump_count": 16, "jump_histogram_max_bucket": 8394316, "jump_histogram_max_deviation_ppm": 759, "jump_histogram_min_bucket": 8382245, "jump_index": "power2_mask", "jump_mixer": "avalanche64", "jump_schedule": "power2", "lookup_engine": "gpu_filter16_hash", "lookup_engine_effective": "gpu_filter16_hash", "lookup_exact_seconds": 0.000221, "lookup_gpu_seconds": 0.026473, "lookup_hash_seconds": 0.003514, "lookup_layout": "open_address_tag16_hash_filter_exact256", "lookup_max_threads_per_threadgroup": 1024, "lookup_query_mode": "distinct_misses", "lookup_repeat": 2048, "lookup_seconds": 0.030208, "lookup_thread_execution_width": 32, "lookup_threadgroup_limit": 512, "lookup_threads_per_threadgroup": 512, "lookups_per_sec": 71661607.645005, "lookups_per_sec_max": 92896658.638244, "lookups_per_sec_min": 22192898.279932, "machine": "macOS-26.5-arm64-arm-64bit-Mach-O", "max_threads_per_threadgroup": 1024, "min_ms": 500, "miss_count": 2164672, "operation": "jacobian_affine_scan_target_lookup_tag32", "ops_per_sec": 71661607.645005, "ops_per_sec_max": 92896658.638244, "ops_per_sec_min": 22192898.279932, "output_layout": "affine_dp_scan_target_lookup", "paired_baseline_ops_per_sec": 57162103.373041, "paired_baseline_ref": "040bed7", "paired_speedup": 1.2536558911651652, "query_count": 2164736, "query_input": "hash64", "raw_status": "keep", "reason": "", "requested_hits": 64, "runner_sample_count": 3, "sample_count": 262144, "seconds": 1.063039, "skipped": false, "state_layout": "xyzz", "status": "keep", "steps_per_sample": 512, "target_bucket_bytes": 268435456, "target_count": 25005000, "target_filter_bucket_bytes": 67108864, "target_key": "x256_y_parity", "target_key_bytes": 1000200000, "target_lookup_checksum": "0x90b9fdeac531859a", "target_query_hash_bytes": 17317888, "target_table_buckets": 33554432, "target_table_bytes": 67108864, "thread_execution_width": 32, "threadgroup_limit": 128, "threads_per_threadgroup": 128, "timestamp": "2026-06-27T18:13:33Z", "validation_seconds": 3.809689, "validation_workers": 8}
{"affine_scan_mode": "cpu_batch_prod_zz_zzz", "affine_scan_seconds": 0.015119, "backend": "metal", "budget_sec": 120, "bytes_per_target": 2.683818, "candidate_verification": "tag16_filter_then_cpu_exact_key_equality", "commit": "649b9f1-dirty", "confirmation_index": 1, "confirmation_runs": 2, "confirmation_status": "discard", "cooldown_sec": 10.0, "correctness": true, "description": "Metal XYZZ affine DP scan tag16 full-key in-kernel hash filter versus prehashed tag16 filter on a 25M-target repeat2048 batch", "distance_tracking": "packet_distance_uint64", "dp_bits": 8, "dp_checksum": "0x9dba4a07ebbb8e14", "dp_count": 1057, "dp_distance_checksum": "0xf0dc88ed68b2ff64", "dp_query_count": 1057, "dp_tracking": "affine_x256_y_parity_cpu_batch", "exact_host_table_bytes": 1268635456, "experiment": "metal_jacobian_dynamic_dp_stream_xyzz_affine_scan_target_lookup_tag16_fullkey25m_repeat2048", "filter_false_positive_count": 444, "filter_positive_count": 508, "gpu_lookup_lookups_per_sec": 83029548.124176, "gpu_ops_per_sec": 125354935.615146, "hit_count": 64, "injected_hits": 64, "iterations": 134217728, "jump_count": 16, "jump_histogram_max_bucket": 8394316, "jump_histogram_max_deviation_ppm": 759, "jump_histogram_min_bucket": 8382245, "jump_index": "power2_mask", "jump_mixer": "avalanche64", "jump_schedule": "power2", "lookup_engine": "gpu_filter16", "lookup_engine_effective": "gpu_filter16", "lookup_exact_seconds": 0.000265, "lookup_gpu_seconds": 0.026072, "lookup_hash_seconds": 0.0, "lookup_layout": "open_address_tag16_filter_exact256", "lookup_max_threads_per_threadgroup": 1024, "lookup_query_mode": "distinct_misses", "lookup_repeat": 2048, "lookup_seconds": 0.026337, "lookup_thread_execution_width": 32, "lookup_threadgroup_limit": 512, "lookup_threads_per_threadgroup": 512, "lookups_per_sec": 82195149.234095, "lookups_per_sec_max": 114996177.570864, "lookups_per_sec_min": 11409400.575179, "machine": "macOS-26.5-arm64-arm-64bit-Mach-O", "max_threads_per_threadgroup": 1024, "min_ms": 500, "miss_count": 2164672, "operation": "jacobian_affine_scan_target_lookup_tag32", "ops_per_sec": 82195149.234095, "ops_per_sec_max": 114996177.570864, "ops_per_sec_min": 11409400.575179, "output_layout": "affine_dp_scan_target_lookup", "paired_baseline_ops_per_sec": 95111599.063584, "paired_baseline_ref": "HEAD", "paired_speedup": 0.8641969017800438, "query_count": 2164736, "raw_status": "discard", "reason": "", "requested_hits": 64, "runner_sample_count": 3, "sample_count": 262144, "seconds": 1.070702, "skipped": false, "state_layout": "xyzz", "status": "discard", "steps_per_sample": 512, "target_bucket_bytes": 268435456, "target_count": 25005000, "target_filter_bucket_bytes": 67108864, "target_key": "x256_y_parity", "target_key_bytes": 1000200000, "target_lookup_checksum": "0x90b9fdeac531859a", "target_query_hash_bytes": 0, "target_table_buckets": 33554432, "target_table_bytes": 67108864, "thread_execution_width": 32, "threadgroup_limit": 128, "threads_per_threadgroup": 128, "timestamp": "2026-06-27T18:30:44Z", "validation_seconds": 3.897593, "validation_workers": 8}
{"affine_scan_mode": "cpu_batch_prod_zz_zzz", "affine_scan_seconds": 0.015294, "backend": "metal", "budget_sec": 120, "bytes_per_target": 2.683818, "candidate_verification": "tag16_filter_then_cpu_exact_key_equality", "commit": "649b9f1-dirty", "confirmation_index": 2, "confirmation_runs": 2, "confirmation_status": "discard", "cooldown_sec": 10.0, "correctness": true, "description": "Metal XYZZ affine DP scan tag16 full-key in-kernel hash filter versus prehashed tag16 filter on a 25M-target repeat2048 batch", "distance_tracking": "packet_distance_uint64", "dp_bits": 8, "dp_checksum": "0x9dba4a07ebbb8e14", "dp_count": 1057, "dp_distance_checksum": "0xf0dc88ed68b2ff64", "dp_query_count": 1057, "dp_tracking": "affine_x256_y_parity_cpu_batch", "exact_host_table_bytes": 1268635456, "experiment": "metal_jacobian_dynamic_dp_stream_xyzz_affine_scan_target_lookup_tag16_fullkey25m_repeat2048", "filter_false_positive_count": 444, "filter_positive_count": 508, "gpu_lookup_lookups_per_sec": 80622816.261173, "gpu_ops_per_sec": 118491187.519432, "hit_count": 64, "injected_hits": 64, "iterations": 134217728, "jump_count": 16, "jump_histogram_max_bucket": 8394316, "jump_histogram_max_deviation_ppm": 759, "jump_histogram_min_bucket": 8382245, "jump_index": "power2_mask", "jump_mixer": "avalanche64", "jump_schedule": "power2", "lookup_engine": "gpu_filter16", "lookup_engine_effective": "gpu_filter16", "lookup_exact_seconds": 0.000309, "lookup_gpu_seconds": 0.02685, "lookup_hash_seconds": 0.0, "lookup_layout": "open_address_tag16_filter_exact256", "lookup_max_threads_per_threadgroup": 1024, "lookup_query_mode": "distinct_misses", "lookup_repeat": 2048, "lookup_seconds": 0.027159, "lookup_thread_execution_width": 32, "lookup_threadgroup_limit": 512, "lookup_threads_per_threadgroup": 512, "lookups_per_sec": 79706397.253435, "lookups_per_sec_max": 92826946.682318, "lookups_per_sec_min": 79425885.913934, "machine": "macOS-26.5-arm64-arm-64bit-Mach-O", "max_threads_per_threadgroup": 1024, "min_ms": 500, "miss_count": 2164672, "operation": "jacobian_affine_scan_target_lookup_tag32", "ops_per_sec": 79706397.253435, "ops_per_sec_max": 92826946.682318, "ops_per_sec_min": 79425885.913934, "output_layout": "affine_dp_scan_target_lookup", "paired_baseline_ops_per_sec": 76693431.864349, "paired_baseline_ref": "HEAD", "paired_speedup": 1.0392858334259336, "query_count": 2164736, "raw_status": "keep", "reason": "", "requested_hits": 64, "runner_sample_count": 3, "sample_count": 262144, "seconds": 1.132723, "skipped": false, "state_layout": "xyzz", "status": "discard", "steps_per_sample": 512, "target_bucket_bytes": 268435456, "target_count": 25005000, "target_filter_bucket_bytes": 67108864, "target_key": "x256_y_parity", "target_key_bytes": 1000200000, "target_lookup_checksum": "0x90b9fdeac531859a", "target_query_hash_bytes": 0, "target_table_buckets": 33554432, "target_table_bytes": 67108864, "thread_execution_width": 32, "threadgroup_limit": 128, "threads_per_threadgroup": 128, "timestamp": "2026-06-27T18:30:44Z", "validation_seconds": 4.225545, "validation_workers": 8}
{"affine_scan_mode": "cpu_batch_prod_zz_zzz", "affine_scan_seconds": 0.026173, "backend": "metal", "budget_sec": 90, "commit": "cd21ec5-dirty", "confirmation_index": 1, "confirmation_runs": 2, "confirmation_status": "discard", "cooldown_sec": 0.0, "correctness": true, "description": "Metal XYZZ 512-step packet walk with GPU per-walker distances and CPU batched affine DP scan", "distance_tracking": "packet_distance_uint64", "dp_bits": 8, "dp_checksum": "0x9dba4a07ebbb8e14", "dp_count": 1057, "dp_distance_checksum": "0xf0dc88ed68b2ff64", "dp_tracking": "affine_x_limb0_cpu_batch", "experiment": "metal_jacobian_dynamic_dp_stream_xyzz_affine_scan_steps512", "gpu_ops_per_sec": 119396263.844234, "iterations": 134217728, "jump_count": 16, "jump_histogram_max_bucket": 8394316, "jump_histogram_max_deviation_ppm": 759, "jump_histogram_min_bucket": 8382245, "jump_index": "power2_mask", "jump_mixer": "avalanche64", "jump_schedule": "power2", "machine": "macOS-26.5-arm64-arm-64bit-Mach-O", "max_threads_per_threadgroup": 1024, "min_ms": 500, "operation": "jacobian_affine_walk_dynamic_dp_stream_xyzz_affine_scan", "ops_per_sec": 116679627.739438, "ops_per_sec_max": 121732999.381648, "ops_per_sec_min": 114491952.447331, "output_layout": "affine_dp_scan", "paired_baseline_ops_per_sec": 116980249.552503, "paired_baseline_ref": "HEAD", "paired_speedup": 0.9974301489848499, "raw_status": "discard", "reason": "", "runner_sample_count": 3, "sample_count": 262144, "seconds": 1.124137, "skipped": false, "state_layout": "xyzz", "status": "discard", "steps_per_sample": 512, "thread_execution_width": 32, "threadgroup_limit": 128, "threads_per_threadgroup": 128, "timestamp": "2026-06-27T18:38:02Z", "validation_seconds": 4.395883, "validation_workers": 8}
{"affine_scan_mode": "cpu_batch_prod_zz_zzz", "affine_scan_seconds": 0.020021, "backend": "metal", "budget_sec": 90, "commit": "cd21ec5-dirty", "confirmation_index": 2, "confirmation_runs": 2, "confirmation_status": "discard", "cooldown_sec": 0.0, "correctness": true, "description": "Metal XYZZ 512-step packet walk with GPU per-walker distances and CPU batched affine DP scan", "distance_tracking": "packet_distance_uint64", "dp_bits": 8, "dp_checksum": "0x9dba4a07ebbb8e14", "dp_count": 1057, "dp_distance_checksum": "0xf0dc88ed68b2ff64", "dp_tracking": "affine_x_limb0_cpu_batch", "experiment": "metal_jacobian_dynamic_dp_stream_xyzz_affine_scan_steps512", "gpu_ops_per_sec": 105745108.534486, "iterations": 134217728, "jump_count": 16, "jump_histogram_max_bucket": 8394316, "jump_histogram_max_deviation_ppm": 759, "jump_histogram_min_bucket": 8382245, "jump_index": "power2_mask", "jump_mixer": "avalanche64", "jump_schedule": "power2", "machine": "macOS-26.5-arm64-arm-64bit-Mach-O", "max_threads_per_threadgroup": 1024, "min_ms": 500, "operation": "jacobian_affine_walk_dynamic_dp_stream_xyzz_affine_scan", "ops_per_sec": 104102988.908292, "ops_per_sec_max": 105398263.613762, "ops_per_sec_min": 102793669.119789, "output_layout": "affine_dp_scan", "paired_baseline_ops_per_sec": 108253765.89868, "paired_baseline_ref": "HEAD", "paired_speedup": 0.9616569737234553, "raw_status": "discard", "reason": "", "runner_sample_count": 3, "sample_count": 262144, "seconds": 1.269257, "skipped": false, "state_layout": "xyzz", "status": "discard", "steps_per_sample": 512, "thread_execution_width": 32, "threadgroup_limit": 128, "threads_per_threadgroup": 128, "timestamp": "2026-06-27T18:38:02Z", "validation_seconds": 5.991219, "validation_workers": 8}
{"affine_scan_mode": "cpu_batch_prod_zz_zzz", "affine_scan_seconds": 0.028899, "backend": "metal", "budget_sec": 90, "commit": "a5d5f21-dirty", "confirmation_index": 1, "confirmation_runs": 2, "confirmation_status": "discard", "cooldown_sec": 0.0, "correctness": true, "description": "Metal XYZZ 512-step packet walk with GPU per-walker distances and CPU batched affine DP scan", "distance_tracking": "packet_distance_uint64", "dp_bits": 8, "dp_checksum": "0x9dba4a07ebbb8e14", "dp_count": 1057, "dp_distance_checksum": "0xf0dc88ed68b2ff64", "dp_tracking": "affine_x_limb0_cpu_batch", "experiment": "metal_jacobian_dynamic_dp_stream_xyzz_affine_scan_steps512", "gpu_ops_per_sec": 66096979.849436, "iterations": 134217728, "jump_count": 16, "jump_histogram_max_bucket": 8394316, "jump_histogram_max_deviation_ppm": 759, "jump_histogram_min_bucket": 8382245, "jump_index": "power2_mask", "jump_mixer": "avalanche64", "jump_schedule": "power2", "machine": "macOS-26.5-arm64-arm-64bit-Mach-O", "max_threads_per_threadgroup": 1024, "min_ms": 500, "operation": "jacobian_affine_walk_dynamic_dp_stream_xyzz_affine_scan", "ops_per_sec": 65169523.543836, "ops_per_sec_max": 71065372.320149, "ops_per_sec_min": 50831795.538499, "output_layout": "affine_dp_scan", "paired_baseline_ops_per_sec": 64876935.235559, "paired_baseline_ref": "HEAD", "paired_speedup": 1.004509897195585, "raw_status": "discard", "reason": "", "runner_sample_count": 3, "sample_count": 262144, "seconds": 2.030618, "skipped": false, "state_layout": "xyzz", "status": "discard", "steps_per_sample": 512, "thread_execution_width": 32, "threadgroup_limit": 128, "threads_per_threadgroup": 128, "timestamp": "2026-06-27T18:59:04Z", "validation_seconds": 6.140585, "validation_workers": 8}
{"affine_scan_mode": "cpu_batch_prod_zz_zzz", "affine_scan_seconds": 0.055627, "backend": "metal", "budget_sec": 90, "commit": "a5d5f21-dirty", "confirmation_index": 2, "confirmation_runs": 2, "confirmation_status": "discard", "cooldown_sec": 0.0, "correctness": true, "description": "Metal XYZZ 512-step packet walk with GPU per-walker distances and CPU batched affine DP scan", "distance_tracking": "packet_distance_uint64", "dp_bits": 8, "dp_checksum": "0x9dba4a07ebbb8e14", "dp_count": 1057, "dp_distance_checksum": "0xf0dc88ed68b2ff64", "dp_tracking": "affine_x_limb0_cpu_batch", "experiment": "metal_jacobian_dynamic_dp_stream_xyzz_affine_scan_steps512", "gpu_ops_per_sec": 32812229.290935, "iterations": 134217728, "jump_count": 16, "jump_histogram_max_bucket": 8394316, "jump_histogram_max_deviation_ppm": 759, "jump_histogram_min_bucket": 8382245, "jump_index": "power2_mask", "jump_mixer": "avalanche64", "jump_schedule": "power2", "machine": "macOS-26.5-arm64-arm-64bit-Mach-O", "max_threads_per_threadgroup": 1024, "min_ms": 500, "operation": "jacobian_affine_walk_dynamic_dp_stream_xyzz_affine_scan", "ops_per_sec": 32371999.861737, "ops_per_sec_max": 32539567.951043, "ops_per_sec_min": 31720659.987896, "output_layout": "affine_dp_scan", "paired_baseline_ops_per_sec": 27156148.855221, "paired_baseline_ref": "HEAD", "paired_speedup": 1.1920688767145717, "raw_status": "keep", "reason": "", "runner_sample_count": 3, "sample_count": 262144, "seconds": 4.090479, "skipped": false, "state_layout": "xyzz", "status": "discard", "steps_per_sample": 512, "thread_execution_width": 32, "threadgroup_limit": 128, "threads_per_threadgroup": 128, "timestamp": "2026-06-27T18:59:04Z", "validation_seconds": 7.29723, "validation_workers": 8}
{"affine_scan_mode": "cpu_batch_prod_zz_zzz", "affine_scan_seconds": 0.03462, "backend": "metal", "budget_sec": 120, "bytes_per_target": 56.0, "candidate_verification": "tag32_prefilter_then_exact_key_equality", "commit": "c34aaf3-dirty", "confirmation_index": 1, "confirmation_runs": 2, "confirmation_status": "keep", "cooldown_sec": 0.0, "correctness": true, "description": "Metal XYZZ affine DP scan feeding exact tag32 multi-target lookup with a distinct-miss bulk query batch", "distance_tracking": "packet_distance_uint64", "dp_bits": 8, "dp_checksum": "0x9dba4a07ebbb8e14", "dp_count": 1057, "dp_distance_checksum": "0xf0dc88ed68b2ff64", "dp_query_count": 1057, "dp_tracking": "affine_x256_y_parity_cpu_batch", "exact_host_table_bytes": 58720256, "experiment": "metal_jacobian_dynamic_dp_stream_xyzz_affine_scan_target_lookup_tag32_distinct_misses1024", "filter_false_positive_count": 0, "filter_positive_count": 0, "gpu_lookup_lookups_per_sec": 67643945.591011, "gpu_ops_per_sec": 25989475.973561, "hit_count": 64, "injected_hits": 64, "iterations": 134217728, "jump_count": 16, "jump_histogram_max_bucket": 8394316, "jump_histogram_max_deviation_ppm": 759, "jump_histogram_min_bucket": 8382245, "jump_index": "power2_mask", "jump_mixer": "avalanche64", "jump_schedule": "power2", "lookup_engine": "gpu", "lookup_engine_effective": "gpu", "lookup_exact_seconds": 0.0, "lookup_gpu_seconds": 0.016001, "lookup_hash_seconds": 0.0, "lookup_layout": "open_address_tag32_index_exact256", "lookup_max_threads_per_threadgroup": 1024, "lookup_query_mode": "distinct_misses", "lookup_repeat": 1024, "lookup_seconds": 0.016001, "lookup_thread_execution_width": 32, "lookup_threadgroup_limit": 64, "lookup_threads_per_threadgroup": 64, "lookups_per_sec": 67643945.591011, "lookups_per_sec_max": 91099154.227415, "lookups_per_sec_min": 37253238.613325, "machine": "macOS-26.5-arm64-arm-64bit-Mach-O", "max_threads_per_threadgroup": 1024, "min_ms": 500, "miss_count": 1082304, "operation": "jacobian_affine_scan_target_lookup_tag32", "ops_per_sec": 67643945.591011, "ops_per_sec_max": 91099154.227415, "ops_per_sec_min": 37253238.613325, "output_layout": "affine_dp_scan_target_lookup", "paired_baseline_ops_per_sec": 61035360.390512, "paired_baseline_ref": "HEAD", "paired_speedup": 1.1082746977852909, "query_count": 1082368, "raw_status": "keep", "reason": "", "requested_hits": 64, "runner_sample_count": 3, "sample_count": 262144, "seconds": 5.164311, "skipped": false, "state_layout": "xyzz", "status": "keep", "steps_per_sample": 512, "target_bucket_bytes": 16777216, "target_count": 1048576, "target_filter_bucket_bytes": 0, "target_key": "x256_y_parity", "target_key_bytes": 41943040, "target_lookup_checksum": "0x8b2568562837af7f", "target_query_hash_bytes": 0, "target_table_buckets": 2097152, "target_table_bytes": 58720256, "thread_execution_width": 32, "threadgroup_limit": 128, "threads_per_threadgroup": 128, "timestamp": "2026-06-27T19:12:25Z", "validation_seconds": 10.524676, "validation_workers": 8}
