{"affine_active_path": "all_active_fast", "affine_buffer": "resize_reuse", "affine_conversion": "batch", "affine_field_ops": "inplace", "affine_initial_conversion": "unit_z_copy", "affine_reverse_loop": "split_zero", "affine_tail_update": "skip_final", "affine_z_access": "const_ref", "affine_z_check": "infinity_flag", "architecture": "shared_tame", "avg_dp_count": 84.0, "backend": "macos_cpu", "budget_sec": 8, "candidate_verification": "full_point_collision", "commit": "cf82107-dirty", "confirmation_index": 1, "confirmation_runs": 3, "confirmation_status": "keep", "cooldown_sec": 0.0, "correctness": true, "description": "Apple Silicon CPU shared-tame tiny multi-target kangaroo benchmark", "dp_bits": 0, "dp_bucket_storage": "inline_first", "dp_capacity": "max_load_2of3", "dp_clear": "empty_guard", "dp_hash": "partial_limb_mix", "dp_key": "x_parity", "dp_lookup": "open_address_linear", "dp_reserve": "sqrt_range_estimate", "ecint_carry_impl": "clang_builtin", "ecint_mul_final_sub": "single_conditional", "expected_private_key": "0x7", "experiment": "jacobian_kangaroo_multi_small", "field_rhs_passing": "const_ref", "found_private_key": "0x7", "found_target_index": 3, "iterations": 1785, "jacobian_step_passing": "const_ref", "jump_count": 8, "jump_index": "power2_mask", "jump_table": "precomputed", "last_dp_count": 84, "machine": "macOS-26.5-arm64-arm-64bit-Mach-O", "max_steps": 4096, "min_ms": 50, "operation": "jacobian_kangaroo_multi_small", "ops_per_sec": 35684.298908, "ops_per_sec_max": 35733.359313, "ops_per_sec_min": 33152.209231, "paired_baseline_ops_per_sec": 34762.03915, "paired_baseline_ref": "main", "paired_speedup": 1.0265306575952118, "point_passing": "const_ref", "range_bits": 8, "range_context": "precomputed", "raw_status": "keep", "reason": "", "runner_sample_count": 3, "sample_count": 1, "scratch": "reused", "seconds": 0.050022, "single_target_ops_per_sec": 31952.438136, "skipped": false, "speedup_vs_single": 1.116794, "start_scalar": "0x2", "status": "keep", "tame_states": 1, "target_count": 4, "target_throughput_vs_single": 4.467177, "timestamp": "2026-06-23T17:11:48Z", "wild_states": 4}
{"affine_active_path": "all_active_fast", "affine_buffer": "resize_reuse", "affine_conversion": "batch", "affine_field_ops": "inplace", "affine_initial_conversion": "unit_z_copy", "affine_reverse_loop": "split_zero", "affine_tail_update": "skip_final", "affine_z_access": "const_ref", "affine_z_check": "infinity_flag", "architecture": "shared_tame", "avg_dp_count": 84.0, "backend": "macos_cpu", "budget_sec": 8, "candidate_verification": "full_point_collision", "commit": "cf82107-dirty", "confirmation_index": 2, "confirmation_runs": 3, "confirmation_status": "keep", "cooldown_sec": 0.0, "correctness": true, "description": "Apple Silicon CPU shared-tame tiny multi-target kangaroo benchmark", "dp_bits": 0, "dp_bucket_storage": "inline_first", "dp_capacity": "max_load_2of3", "dp_clear": "empty_guard", "dp_hash": "partial_limb_mix", "dp_key": "x_parity", "dp_lookup": "open_address_linear", "dp_reserve": "sqrt_range_estimate", "ecint_carry_impl": "clang_builtin", "ecint_mul_final_sub": "single_conditional", "expected_private_key": "0x7", "experiment": "jacobian_kangaroo_multi_small", "field_rhs_passing": "const_ref", "found_private_key": "0x7", "found_target_index": 3, "iterations": 1789, "jacobian_step_passing": "const_ref", "jump_count": 8, "jump_index": "power2_mask", "jump_table": "precomputed", "last_dp_count": 84, "machine": "macOS-26.5-arm64-arm-64bit-Mach-O", "max_steps": 4096, "min_ms": 50, "operation": "jacobian_kangaroo_multi_small", "ops_per_sec": 35763.786845, "ops_per_sec_max": 35790.544854, "ops_per_sec_min": 35710.982977, "paired_baseline_ops_per_sec": 34758.811944, "paired_baseline_ref": "main", "paired_speedup": 1.0289128092933417, "point_passing": "const_ref", "range_bits": 8, "range_context": "precomputed", "raw_status": "keep", "reason": "", "runner_sample_count": 3, "sample_count": 1, "scratch": "reused", "seconds": 0.050023, "single_target_ops_per_sec": 31662.295711, "skipped": false, "speedup_vs_single": 1.129539, "start_scalar": "0x2", "status": "keep", "tame_states": 1, "target_count": 4, "target_throughput_vs_single": 4.518155, "timestamp": "2026-06-23T17:11:48Z", "wild_states": 4}
{"affine_active_path": "all_active_fast", "affine_buffer": "resize_reuse", "affine_conversion": "batch", "affine_field_ops": "inplace", "affine_initial_conversion": "unit_z_copy", "affine_reverse_loop": "split_zero", "affine_tail_update": "skip_final", "affine_z_access": "const_ref", "affine_z_check": "infinity_flag", "architecture": "shared_tame", "avg_dp_count": 84.0, "backend": "macos_cpu", "budget_sec": 8, "candidate_verification": "full_point_collision", "commit": "cf82107-dirty", "confirmation_index": 3, "confirmation_runs": 3, "confirmation_status": "keep", "cooldown_sec": 0.0, "correctness": true, "description": "Apple Silicon CPU shared-tame tiny multi-target kangaroo benchmark", "dp_bits": 0, "dp_bucket_storage": "inline_first", "dp_capacity": "max_load_2of3", "dp_clear": "empty_guard", "dp_hash": "partial_limb_mix", "dp_key": "x_parity", "dp_lookup": "open_address_linear", "dp_reserve": "sqrt_range_estimate", "ecint_carry_impl": "clang_builtin", "ecint_mul_final_sub": "single_conditional", "expected_private_key": "0x7", "experiment": "jacobian_kangaroo_multi_small", "field_rhs_passing": "const_ref", "found_private_key": "0x7", "found_target_index": 3, "iterations": 1788, "jacobian_step_passing": "const_ref", "jump_count": 8, "jump_index": "power2_mask", "jump_table": "precomputed", "last_dp_count": 84, "machine": "macOS-26.5-arm64-arm-64bit-Mach-O", "max_steps": 4096, "min_ms": 50, "operation": "jacobian_kangaroo_multi_small", "ops_per_sec": 35740.492125, "ops_per_sec_max": 35778.300531, "ops_per_sec_min": 35712.887421, "paired_baseline_ops_per_sec": 34767.542094, "paired_baseline_ref": "main", "paired_speedup": 1.0279844352634842, "point_passing": "const_ref", "range_bits": 8, "range_context": "precomputed", "raw_status": "keep", "reason": "", "runner_sample_count": 3, "sample_count": 1, "scratch": "reused", "seconds": 0.050027, "single_target_ops_per_sec": 31718.520014, "skipped": false, "speedup_vs_single": 1.126802, "start_scalar": "0x2", "status": "keep", "tame_states": 1, "target_count": 4, "target_throughput_vs_single": 4.507208, "timestamp": "2026-06-23T17:11:48Z", "wild_states": 4}
{"affine_active_path": "all_active_fast", "affine_buffer": "resize_reuse", "affine_conversion": "batch", "affine_field_ops": "inplace", "affine_initial_conversion": "unit_z_copy", "affine_reverse_loop": "split_zero", "affine_tail_update": "skip_final", "affine_z_access": "const_ref", "affine_z_check": "infinity_flag", "architecture": "shared_tame", "avg_dp_count": 288.0, "backend": "macos_cpu", "budget_sec": 8, "candidate_verification": "full_point_collision", "commit": "cf82107-dirty", "confirmation_index": 1, "confirmation_runs": 3, "confirmation_status": "keep", "cooldown_sec": 0.0, "correctness": true, "description": "Apple Silicon CPU shared-tame tiny 16-target kangaroo benchmark", "dp_bits": 0, "dp_bucket_storage": "inline_first", "dp_capacity": "max_load_2of3", "dp_clear": "empty_guard", "dp_hash": "partial_limb_mix", "dp_key": "x_parity", "dp_lookup": "open_address_linear", "dp_reserve": "sqrt_range_estimate", "ecint_carry_impl": "clang_builtin", "ecint_mul_final_sub": "single_conditional", "expected_private_key": "0x7", "experiment": "jacobian_kangaroo_multi16_small", "field_rhs_passing": "const_ref", "found_private_key": "0x7", "found_target_index": 15, "iterations": 807, "jacobian_step_passing": "const_ref", "jump_count": 8, "jump_index": "power2_mask", "jump_table": "precomputed", "last_dp_count": 288, "machine": "macOS-26.5-arm64-arm-64bit-Mach-O", "max_steps": 4096, "min_ms": 50, "operation": "jacobian_kangaroo_multi_small", "ops_per_sec": 16130.133842, "ops_per_sec_max": 16154.588213, "ops_per_sec_min": 14965.782507, "paired_baseline_ops_per_sec": 15694.258726, "paired_baseline_ref": "main", "paired_speedup": 1.027772902410351, "point_passing": "const_ref", "range_bits": 8, "range_context": "precomputed", "raw_status": "keep", "reason": "", "runner_sample_count": 3, "sample_count": 1, "scratch": "reused", "seconds": 0.050031, "single_target_ops_per_sec": 32283.239833, "skipped": false, "speedup_vs_single": 0.499644, "start_scalar": "0x2", "status": "keep", "tame_states": 1, "target_count": 16, "target_throughput_vs_single": 7.994307, "timestamp": "2026-06-23T17:12:23Z", "wild_states": 16}
{"affine_active_path": "all_active_fast", "affine_buffer": "resize_reuse", "affine_conversion": "batch", "affine_field_ops": "inplace", "affine_initial_conversion": "unit_z_copy", "affine_reverse_loop": "split_zero", "affine_tail_update": "skip_final", "affine_z_access": "const_ref", "affine_z_check": "infinity_flag", "architecture": "shared_tame", "avg_dp_count": 288.0, "backend": "macos_cpu", "budget_sec": 8, "candidate_verification": "full_point_collision", "commit": "cf82107-dirty", "confirmation_index": 2, "confirmation_runs": 3, "confirmation_status": "keep", "cooldown_sec": 0.0, "correctness": true, "description": "Apple Silicon CPU shared-tame tiny 16-target kangaroo benchmark", "dp_bits": 0, "dp_bucket_storage": "inline_first", "dp_capacity": "max_load_2of3", "dp_clear": "empty_guard", "dp_hash": "partial_limb_mix", "dp_key": "x_parity", "dp_lookup": "open_address_linear", "dp_reserve": "sqrt_range_estimate", "ecint_carry_impl": "clang_builtin", "ecint_mul_final_sub": "single_conditional", "expected_private_key": "0x7", "experiment": "jacobian_kangaroo_multi16_small", "field_rhs_passing": "const_ref", "found_private_key": "0x7", "found_target_index": 15, "iterations": 807, "jacobian_step_passing": "const_ref", "jump_count": 8, "jump_index": "power2_mask", "jump_table": "precomputed", "last_dp_count": 288, "machine": "macOS-26.5-arm64-arm-64bit-Mach-O", "max_steps": 4096, "min_ms": 50, "operation": "jacobian_kangaroo_multi_small", "ops_per_sec": 16128.414315, "ops_per_sec_max": 16136.073448, "ops_per_sec_min": 16122.560871, "paired_baseline_ops_per_sec": 15770.721454, "paired_baseline_ref": "main", "paired_speedup": 1.022680817871479, "point_passing": "const_ref", "range_bits": 8, "range_context": "precomputed", "raw_status": "keep", "reason": "", "runner_sample_count": 3, "sample_count": 1, "scratch": "reused", "seconds": 0.050036, "single_target_ops_per_sec": 31622.133495, "skipped": false, "speedup_vs_single": 0.510036, "start_scalar": "0x2", "status": "keep", "tame_states": 1, "target_count": 16, "target_throughput_vs_single": 8.16057, "timestamp": "2026-06-23T17:12:23Z", "wild_states": 16}
{"affine_active_path": "all_active_fast", "affine_buffer": "resize_reuse", "affine_conversion": "batch", "affine_field_ops": "inplace", "affine_initial_conversion": "unit_z_copy", "affine_reverse_loop": "split_zero", "affine_tail_update": "skip_final", "affine_z_access": "const_ref", "affine_z_check": "infinity_flag", "architecture": "shared_tame", "avg_dp_count": 288.0, "backend": "macos_cpu", "budget_sec": 8, "candidate_verification": "full_point_collision", "commit": "cf82107-dirty", "confirmation_index": 3, "confirmation_runs": 3, "confirmation_status": "keep", "cooldown_sec": 0.0, "correctness": true, "description": "Apple Silicon CPU shared-tame tiny 16-target kangaroo benchmark", "dp_bits": 0, "dp_bucket_storage": "inline_first", "dp_capacity": "max_load_2of3", "dp_clear": "empty_guard", "dp_hash": "partial_limb_mix", "dp_key": "x_parity", "dp_lookup": "open_address_linear", "dp_reserve": "sqrt_range_estimate", "ecint_carry_impl": "clang_builtin", "ecint_mul_final_sub": "single_conditional", "expected_private_key": "0x7", "experiment": "jacobian_kangaroo_multi16_small", "field_rhs_passing": "const_ref", "found_private_key": "0x7", "found_target_index": 15, "iterations": 807, "jacobian_step_passing": "const_ref", "jump_count": 8, "jump_index": "power2_mask", "jump_table": "precomputed", "last_dp_count": 288, "machine": "macOS-26.5-arm64-arm-64bit-Mach-O", "max_steps": 4096, "min_ms": 50, "operation": "jacobian_kangaroo_multi_small", "ops_per_sec": 16135.468515, "ops_per_sec_max": 16141.061047, "ops_per_sec_min": 16128.23961, "paired_baseline_ops_per_sec": 15768.725361, "paired_baseline_ref": "main", "paired_speedup": 1.0232576283500407, "point_passing": "const_ref", "range_bits": 8, "range_context": "precomputed", "raw_status": "keep", "reason": "", "runner_sample_count": 3, "sample_count": 1, "scratch": "reused", "seconds": 0.050014, "single_target_ops_per_sec": 31709.667722, "skipped": false, "speedup_vs_single": 0.50885, "start_scalar": "0x2", "status": "keep", "tame_states": 1, "target_count": 16, "target_throughput_vs_single": 8.141602, "timestamp": "2026-06-23T17:12:23Z", "wild_states": 16}
{"affine_active_path": "all_active_fast", "affine_buffer": "resize_reuse", "affine_conversion": "batch", "affine_field_ops": "inplace", "affine_initial_conversion": "unit_z_copy", "affine_reverse_loop": "split_zero", "affine_tail_update": "skip_final", "affine_z_access": "const_ref", "affine_z_check": "infinity_flag", "architecture": "shared_tame", "avg_dp_count": 84.0, "backend": "macos_cpu", "budget_sec": 8, "candidate_verification": "full_point_collision", "commit": "ac0a8a0-dirty", "confirmation_index": 1, "confirmation_runs": 3, "confirmation_status": "discard", "cooldown_sec": 0.0, "correctness": true, "description": "Apple Silicon CPU shared-tame tiny multi-target kangaroo benchmark", "dp_bits": 0, "dp_bucket_storage": "inline_first", "dp_capacity": "max_load_2of3", "dp_clear": "empty_guard", "dp_hash": "partial_limb_mix", "dp_key": "x_parity", "dp_lookup": "open_address_linear", "dp_reserve": "sqrt_range_estimate", "ecint_carry_impl": "clang_builtin", "ecint_mul_final_sub": "single_conditional", "expected_private_key": "0x7", "experiment": "jacobian_kangaroo_multi_small", "field_rhs_passing": "const_ref", "found_private_key": "0x7", "found_target_index": 3, "iterations": 1739, "jacobian_step_passing": "const_ref", "jump_count": 8, "jump_index": "power2_mask", "jump_table": "precomputed", "last_dp_count": 84, "machine": "macOS-26.5-arm64-arm-64bit-Mach-O", "max_steps": 4096, "min_ms": 50, "operation": "jacobian_kangaroo_multi_small", "ops_per_sec": 34765.543097, "ops_per_sec_max": 35580.816247, "ops_per_sec_min": 31944.66656, "paired_baseline_ops_per_sec": 33010.454037, "paired_baseline_ref": "main", "paired_speedup": 1.053167674035407, "point_passing": "const_ref", "range_bits": 8, "range_context": "precomputed", "raw_status": "keep", "reason": "", "runner_sample_count": 3, "sample_count": 1, "scratch": "reused", "seconds": 0.050021, "single_target_ops_per_sec": 27531.006721, "skipped": false, "speedup_vs_single": 1.262778, "start_scalar": "0x2", "status": "discard", "tame_states": 1, "target_count": 4, "target_throughput_vs_single": 5.051111, "timestamp": "2026-06-23T17:19:20Z", "wild_states": 4}
{"affine_active_path": "all_active_fast", "affine_buffer": "resize_reuse", "affine_conversion": "batch", "affine_field_ops": "inplace", "affine_initial_conversion": "unit_z_copy", "affine_reverse_loop": "split_zero", "affine_tail_update": "skip_final", "affine_z_access": "const_ref", "affine_z_check": "infinity_flag", "architecture": "shared_tame", "avg_dp_count": 84.0, "backend": "macos_cpu", "budget_sec": 8, "candidate_verification": "full_point_collision", "commit": "ac0a8a0-dirty", "confirmation_index": 2, "confirmation_runs": 3, "confirmation_status": "discard", "cooldown_sec": 0.0, "correctness": true, "description": "Apple Silicon CPU shared-tame tiny multi-target kangaroo benchmark", "dp_bits": 0, "dp_bucket_storage": "inline_first", "dp_capacity": "max_load_2of3", "dp_clear": "empty_guard", "dp_hash": "partial_limb_mix", "dp_key": "x_parity", "dp_lookup": "open_address_linear", "dp_reserve": "sqrt_range_estimate", "ecint_carry_impl": "clang_builtin", "ecint_mul_final_sub": "single_conditional", "expected_private_key": "0x7", "experiment": "jacobian_kangaroo_multi_small", "field_rhs_passing": "const_ref", "found_private_key": "0x7", "found_target_index": 3, "iterations": 1791, "jacobian_step_passing": "const_ref", "jump_count": 8, "jump_index": "power2_mask", "jump_table": "precomputed", "last_dp_count": 84, "machine": "macOS-26.5-arm64-arm-64bit-Mach-O", "max_steps": 4096, "min_ms": 50, "operation": "jacobian_kangaroo_multi_small", "ops_per_sec": 35805.558186, "ops_per_sec_max": 35814.926458, "ops_per_sec_min": 35758.24141, "paired_baseline_ops_per_sec": 35710.893722, "paired_baseline_ref": "main", "paired_speedup": 1.002650856759199, "point_passing": "const_ref", "range_bits": 8, "range_context": "precomputed", "raw_status": "discard", "reason": "", "runner_sample_count": 3, "sample_count": 1, "scratch": "reused", "seconds": 0.05002, "single_target_ops_per_sec": 31750.500885, "skipped": false, "speedup_vs_single": 1.127716, "start_scalar": "0x2", "status": "discard", "tame_states": 1, "target_count": 4, "target_throughput_vs_single": 4.510865, "timestamp": "2026-06-23T17:19:20Z", "wild_states": 4}
{"affine_active_path": "all_active_fast", "affine_buffer": "resize_reuse", "affine_conversion": "batch", "affine_field_ops": "inplace", "affine_initial_conversion": "unit_z_copy", "affine_reverse_loop": "split_zero", "affine_tail_update": "skip_final", "affine_z_access": "const_ref", "affine_z_check": "infinity_flag", "architecture": "shared_tame", "avg_dp_count": 84.0, "backend": "macos_cpu", "budget_sec": 8, "candidate_verification": "full_point_collision", "commit": "ac0a8a0-dirty", "confirmation_index": 3, "confirmation_runs": 3, "confirmation_status": "discard", "cooldown_sec": 0.0, "correctness": true, "description": "Apple Silicon CPU shared-tame tiny multi-target kangaroo benchmark", "dp_bits": 0, "dp_bucket_storage": "inline_first", "dp_capacity": "max_load_2of3", "dp_clear": "empty_guard", "dp_hash": "partial_limb_mix", "dp_key": "x_parity", "dp_lookup": "open_address_linear", "dp_reserve": "sqrt_range_estimate", "ecint_carry_impl": "clang_builtin", "ecint_mul_final_sub": "single_conditional", "expected_private_key": "0x7", "experiment": "jacobian_kangaroo_multi_small", "field_rhs_passing": "const_ref", "found_private_key": "0x7", "found_target_index": 3, "iterations": 1786, "jacobian_step_passing": "const_ref", "jump_count": 8, "jump_index": "power2_mask", "jump_table": "precomputed", "last_dp_count": 84, "machine": "macOS-26.5-arm64-arm-64bit-Mach-O", "max_steps": 4096, "min_ms": 50, "operation": "jacobian_kangaroo_multi_small", "ops_per_sec": 35711.548505, "ops_per_sec_max": 35797.523527, "ops_per_sec_min": 35540.393786, "paired_baseline_ops_per_sec": 35689.976827, "paired_baseline_ref": "main", "paired_speedup": 1.0006044183806722, "point_passing": "const_ref", "range_bits": 8, "range_context": "precomputed", "raw_status": "discard", "reason": "", "runner_sample_count": 3, "sample_count": 1, "scratch": "reused", "seconds": 0.050012, "single_target_ops_per_sec": 31722.948915, "skipped": false, "speedup_vs_single": 1.125732, "start_scalar": "0x2", "status": "discard", "tame_states": 1, "target_count": 4, "target_throughput_vs_single": 4.502929, "timestamp": "2026-06-23T17:19:20Z", "wild_states": 4}
{"backend": "metal", "budget_sec": 45, "commit": "ac0a8a0-dirty", "cooldown_sec": 0.0, "correctness": true, "description": "Metal XYZZ 512-step DP stream with two device-resident chained packets and cumulative uint64 distances", "distance_tracking": "dp_stream_cumulative_uint64", "dp_bits": 8, "dp_capacity": 524288, "dp_checksum": "0x23509000c8141686", "dp_count": 2016, "dp_distance_checksum": "0x7a221c62b92a5ed3", "dp_stream_overflow": false, "dp_tracking": "projective_x_limb0", "emitted_records": 2016, "experiment": "metal_jacobian_dynamic_dp_stream_xyzz_chain_steps512", "iterations": 268435456, "jump_count": 16, "jump_histogram_max_bucket": 16782744, "jump_histogram_max_deviation_ppm": 389, "jump_histogram_min_bucket": 16770687, "jump_index": "power2_mask", "jump_mixer": "avalanche64", "machine": "macOS-26.5-arm64-arm-64bit-Mach-O", "max_threads_per_threadgroup": 1024, "min_ms": 500, "operation": "jacobian_affine_walk_dynamic_dp_stream_xyzz_chain", "ops_per_sec": 119203306.658362, "ops_per_sec_max": 120890438.66974, "ops_per_sec_min": 106262781.708817, "output_bytes_per_record": 20, "output_bytes_total": 40320, "output_layout": "dp_stream", "packet_count": 2, "paired_baseline_ops_per_sec": 121753306.759494, "paired_baseline_ref": "main", "paired_speedup": 0.9790560094916423, "reason": "", "runner_sample_count": 3, "sample_count": 262144, "seconds": 2.251913, "skipped": false, "state_layout": "xyzz", "status": "discard", "steps_per_sample": 512, "stream_indexing": "packet_sample_u32", "thread_execution_width": 32, "threadgroup_limit": 128, "threads_per_threadgroup": 128, "timestamp": "2026-06-23T17:24:49Z", "validation_seconds": 7.904829, "validation_workers": 8}
