{"all_keys_found": true, "backend": "macos_cpu", "budget_sec": 240, "candidate_verification": "prehashed_serial_vs_parallel_semantic_find_all_keys", "commit": "d09c07b-dirty", "confirmation_index": 1, "confirmation_runs": 2, "confirmation_status": "keep", "cooldown_sec": 5.0, "correctness": true, "description": "Host setup benchmark measuring absolute parallel CAS tag32 insertion throughput with semantic find-all verification", "experiment": "target_lookup_tag32_parallel_insert", "injected_count": 64, "iterations": 1, "lookup_layout": "open_address_tag32_index_exact256", "machine": "macOS-26.5-arm64-arm-64bit-Mach-O", "min_ms": 0, "operation": "target_lookup_tag32_parallel_insert_probe", "ops_per_sec": 15828741.937858, "ops_per_sec_max": 18763291.715499, "ops_per_sec_min": 13246046.690349, "paired_baseline_ops_per_sec": 14350653.726053, "paired_baseline_ref": "main", "paired_order": "alternate", "paired_speedup": 1.1029979706862827, "parallel_checksum": "0x00267798754499e6", "parallel_seconds": 1.579721, "parallel_targets_per_sec": 15828741.937858, "parallel_targets_per_sec_max": 18763291.715499, "parallel_targets_per_sec_min": 13246046.690349, "raw_status": "keep", "reason": "", "runner_sample_count": 3, "sample_count": 25005000, "seconds": 1.579721, "serial_checksum": "0x0875f90b516f7503", "serial_seconds": 2.256835, "serial_targets_per_sec": 11079677.380319, "setup_phase": "host_tag32_parallel_insert_probe", "skipped": false, "speedup": 1.428628, "status": "keep", "target_bucket_bytes": 268435456, "target_count": 25005000, "target_key": "x256_y_parity", "target_key_bytes": 1000200000, "target_keys_equal": true, "target_table_buckets": 33554432, "target_table_bytes": 1268635456, "timestamp": "2026-06-29T13:33:41Z"}
{"all_keys_found": true, "backend": "macos_cpu", "budget_sec": 240, "candidate_verification": "prehashed_serial_vs_parallel_semantic_find_all_keys", "commit": "d09c07b-dirty", "confirmation_index": 2, "confirmation_runs": 2, "confirmation_status": "keep", "cooldown_sec": 5.0, "correctness": true, "description": "Host setup benchmark measuring absolute parallel CAS tag32 insertion throughput with semantic find-all verification", "experiment": "target_lookup_tag32_parallel_insert", "injected_count": 64, "iterations": 1, "lookup_layout": "open_address_tag32_index_exact256", "machine": "macOS-26.5-arm64-arm-64bit-Mach-O", "min_ms": 0, "operation": "target_lookup_tag32_parallel_insert_probe", "ops_per_sec": 23960212.926636, "ops_per_sec_max": 37643520.154639, "ops_per_sec_min": 21656542.94664, "paired_baseline_ops_per_sec": 20969760.948071, "paired_baseline_ref": "main", "paired_order": "alternate", "paired_speedup": 1.1426078239981123, "parallel_checksum": "0xc3ce28cf518e0edc", "parallel_seconds": 1.043605, "parallel_targets_per_sec": 23960212.926636, "parallel_targets_per_sec_max": 37643520.154639, "parallel_targets_per_sec_min": 21656542.94664, "raw_status": "keep", "reason": "", "runner_sample_count": 3, "sample_count": 25005000, "seconds": 1.043605, "serial_checksum": "0x0875f90b516f7503", "serial_seconds": 1.502186, "serial_targets_per_sec": 16645738.370245, "setup_phase": "host_tag32_parallel_insert_probe", "skipped": false, "speedup": 1.43942, "status": "keep", "target_bucket_bytes": 268435456, "target_count": 25005000, "target_key": "x256_y_parity", "target_key_bytes": 1000200000, "target_keys_equal": true, "target_table_buckets": 33554432, "target_table_bytes": 1268635456, "timestamp": "2026-06-29T13:33:41Z"}
{"all_keys_found": true, "backend": "macos_cpu", "budget_sec": 240, "candidate_verification": "prehashed_serial_vs_parallel_semantic_find_all_keys", "commit": "d78b747-dirty", "cooldown_sec": 5.0, "correctness": true, "description": "Host setup benchmark measuring absolute parallel CAS tag32 insertion throughput with semantic find-all verification", "experiment": "target_lookup_tag32_parallel_insert", "injected_count": 64, "iterations": 1, "lookup_layout": "open_address_tag32_index_exact256", "machine": "macOS-26.5-arm64-arm-64bit-Mach-O", "min_ms": 0, "operation": "target_lookup_tag32_parallel_insert_probe", "ops_per_sec": 25595577.431431, "ops_per_sec_max": 28189583.061941, "ops_per_sec_min": 24551320.229007, "paired_baseline_ops_per_sec": 28562957.937294, "paired_baseline_ref": "main", "paired_order": "alternate", "paired_speedup": 0.8961108820599929, "parallel_checksum": "0xba2519c642b9f491", "parallel_seconds": 0.976927, "parallel_targets_per_sec": 25595577.431431, "parallel_targets_per_sec_max": 28189583.061941, "parallel_targets_per_sec_min": 24551320.229007, "reason": "", "runner_sample_count": 3, "sample_count": 25005000, "seconds": 0.976927, "serial_checksum": "0x0875f90b516f7503", "serial_seconds": 1.202042, "serial_targets_per_sec": 20802107.519622, "setup_phase": "host_tag32_parallel_insert_probe", "skipped": false, "speedup": 1.230432, "status": "discard", "target_bucket_bytes": 268435456, "target_count": 25005000, "target_key": "x256_y_parity", "target_key_bytes": 1000200000, "target_keys_equal": true, "target_table_buckets": 33554432, "target_table_bytes": 1268635456, "timestamp": "2026-06-29T13:47:18Z"}
{"affine_scan_mode": "cpu_batch_prod_zz_zzz", "affine_scan_seconds": 0.006285, "backend": "metal", "budget_sec": 420, "bytes_per_target": 2.683818, "candidate_verification": "tag16_hash_filter_then_cpu_exact_key_equality", "commit": "e89d455-dirty", "cooldown_sec": 10.0, "correctness": true, "description": "Metal XYZZ 1024-step dp7 affine-scan target lookup versus accepted 512-step dp8 repeat path, scored with setup-inclusive throughput", "distance_tracking": "packet_distance_uint64", "dp_bits": 7, "dp_checksum": "0x08b06faea04109e6", "dp_count": 1999, "dp_distance_checksum": "0x33b34eda684bc0e5", "dp_query_count": 1999, "dp_tracking": "affine_x256_y_parity_cpu_batch", "exact_host_table_bytes": 1268635456, "experiment": "metal_jacobian_dynamic_dp_stream_xyzz_affine_scan_target_lookup_tag16_hash_filter25m_steps1024_dp7_setup", "filter_false_positive_count": 0, "filter_positive_count": 65536, "gpu_lookup_lookups_per_sec": 225830626.809245, "gpu_ops_per_sec": 123360583.211799, "hit_count": 65536, "injected_hits": 64, "iterations": 268435456, "jump_count": 16, "jump_histogram_max_bucket": 16782744, "jump_histogram_max_deviation_ppm": 389, "jump_histogram_min_bucket": 16770687, "jump_index": "power2_mask", "jump_mixer": "avalanche64", "jump_schedule": "power2", "lookup_engine": "gpu_filter16_hash_repeat", "lookup_engine_effective": "gpu_filter16_hash_repeat", "lookup_exact_seconds": 0.000591, "lookup_gpu_seconds": 0.009064, "lookup_hash_seconds": 1e-05, "lookup_layout": "open_address_tag16_hash_filter_exact256", "lookup_max_threads_per_threadgroup": 1024, "lookup_query_mode": "repeat", "lookup_repeat": 1024, "lookup_seconds": 0.009665, "lookup_thread_execution_width": 32, "lookup_threadgroup_limit": 512, "lookup_threads_per_threadgroup": 512, "lookups_per_sec": 211787175.706785, "machine": "macOS-26.5-arm64-arm-64bit-Mach-O", "max_threads_per_threadgroup": 1024, "min_ms": 500, "miss_count": 1981440, "operation": "jacobian_affine_scan_target_lookup_tag32", "ops_per_sec": 94764959.09538, "ops_per_sec_max": 98034857.326192, "ops_per_sec_min": 94574392.66253, "output_layout": "affine_dp_scan_target_lookup", "paired_baseline_ops_per_sec": 72165583.082525, "paired_baseline_ref": "main", "paired_order": "alternate", "paired_speedup": 1.313160027918176, "query_count": 2046976, "query_input": "hash64_repeat_indexed", "reason": "", "repeat_positive_index_encoding": "packed16_base_repeat", "requested_hits": 64, "runner_sample_count": 3, "sample_count": 262144, "seconds": 2.176023, "setup_inclusive_ops_per_sec": 94764959.09538, "setup_inclusive_ops_per_sec_max": 98034857.326192, "setup_inclusive_ops_per_sec_min": 94574392.66253, "setup_inclusive_seconds": 2.832645, "skipped": false, "state_layout": "xyzz", "status": "keep", "steps_per_sample": 1024, "target_bucket_bytes": 268435456, "target_build_seconds": 0.62065, "target_count": 25005000, "target_filter_bucket_bytes": 67108864, "target_filter_build_seconds": 0.020022, "target_key": "x256_y_parity", "target_key_bytes": 1000200000, "target_lookup_checksum": "0x4bfc0bfe896fe3ad", "target_query_hash_bytes": 15992, "target_table_buckets": 33554432, "target_table_bytes": 67108864, "thread_execution_width": 32, "threadgroup_limit": 128, "threads_per_threadgroup": 128, "timestamp": "2026-06-29T13:56:23Z", "validation_seconds": 8.977814, "validation_workers": 8}
{"affine_scan_mode": "cpu_batch_prod_zz_zzz", "affine_scan_seconds": 0.009186, "backend": "metal", "budget_sec": 420, "bytes_per_target": 2.683818, "candidate_verification": "tag16_hash_filter_then_cpu_exact_key_equality", "commit": "e89d455-dirty", "confirmation_index": 1, "confirmation_runs": 2, "confirmation_status": "keep", "cooldown_sec": 10.0, "correctness": true, "description": "Metal XYZZ 1024-step dp7 affine-scan target lookup versus accepted 512-step dp8 repeat path, scored with setup-inclusive throughput", "distance_tracking": "packet_distance_uint64", "dp_bits": 7, "dp_checksum": "0x08b06faea04109e6", "dp_count": 1999, "dp_distance_checksum": "0x33b34eda684bc0e5", "dp_query_count": 1999, "dp_tracking": "affine_x256_y_parity_cpu_batch", "exact_host_table_bytes": 1268635456, "experiment": "metal_jacobian_dynamic_dp_stream_xyzz_affine_scan_target_lookup_tag16_hash_filter25m_steps1024_dp7_setup", "filter_false_positive_count": 0, "filter_positive_count": 65536, "gpu_lookup_lookups_per_sec": 237662368.723962, "gpu_ops_per_sec": 121871380.250568, "hit_count": 65536, "injected_hits": 64, "iterations": 268435456, "jump_count": 16, "jump_histogram_max_bucket": 16782744, "jump_histogram_max_deviation_ppm": 389, "jump_histogram_min_bucket": 16770687, "jump_index": "power2_mask", "jump_mixer": "avalanche64", "jump_schedule": "power2", "lookup_engine": "gpu_filter16_hash_repeat", "lookup_engine_effective": "gpu_filter16_hash_repeat", "lookup_exact_seconds": 0.003604, "lookup_gpu_seconds": 0.008613, "lookup_hash_seconds": 1.1e-05, "lookup_layout": "open_address_tag16_hash_filter_exact256", "lookup_max_threads_per_threadgroup": 1024, "lookup_query_mode": "repeat", "lookup_repeat": 1024, "lookup_seconds": 0.012229, "lookup_thread_execution_width": 32, "lookup_threadgroup_limit": 512, "lookup_threads_per_threadgroup": 512, "lookups_per_sec": 167392738.798927, "machine": "macOS-26.5-arm64-arm-64bit-Mach-O", "max_threads_per_threadgroup": 1024, "min_ms": 500, "miss_count": 1981440, "operation": "jacobian_affine_scan_target_lookup_tag32", "ops_per_sec": 91131253.131533, "ops_per_sec_max": 95249683.567896, "ops_per_sec_min": 84962267.652723, "output_layout": "affine_dp_scan_target_lookup", "paired_baseline_ops_per_sec": 60597677.652709, "paired_baseline_ref": "main", "paired_order": "alternate", "paired_speedup": 1.5038736905697079, "query_count": 2046976, "query_input": "hash64_repeat_indexed", "raw_status": "keep", "reason": "", "repeat_positive_index_encoding": "packed16_base_repeat", "requested_hits": 64, "runner_sample_count": 3, "sample_count": 262144, "seconds": 2.202613, "setup_inclusive_ops_per_sec": 91131253.131533, "setup_inclusive_ops_per_sec_max": 95249683.567896, "setup_inclusive_ops_per_sec_min": 84962267.652723, "setup_inclusive_seconds": 2.945592, "skipped": false, "state_layout": "xyzz", "status": "keep", "steps_per_sample": 1024, "target_bucket_bytes": 268435456, "target_build_seconds": 0.699488, "target_count": 25005000, "target_filter_bucket_bytes": 67108864, "target_filter_build_seconds": 0.022076, "target_key": "x256_y_parity", "target_key_bytes": 1000200000, "target_lookup_checksum": "0x4bfc0bfe896fe3ad", "target_query_hash_bytes": 15992, "target_table_buckets": 33554432, "target_table_bytes": 67108864, "thread_execution_width": 32, "threadgroup_limit": 128, "threads_per_threadgroup": 128, "timestamp": "2026-06-29T13:59:53Z", "validation_seconds": 7.91316, "validation_workers": 8}
{"affine_scan_mode": "cpu_batch_prod_zz_zzz", "affine_scan_seconds": 0.004903, "backend": "metal", "budget_sec": 420, "bytes_per_target": 2.683818, "candidate_verification": "tag16_hash_filter_then_cpu_exact_key_equality", "commit": "e89d455-dirty", "confirmation_index": 2, "confirmation_runs": 2, "confirmation_status": "keep", "cooldown_sec": 10.0, "correctness": true, "description": "Metal XYZZ 1024-step dp7 affine-scan target lookup versus accepted 512-step dp8 repeat path, scored with setup-inclusive throughput", "distance_tracking": "packet_distance_uint64", "dp_bits": 7, "dp_checksum": "0x08b06faea04109e6", "dp_count": 1999, "dp_distance_checksum": "0x33b34eda684bc0e5", "dp_query_count": 1999, "dp_tracking": "affine_x256_y_parity_cpu_batch", "exact_host_table_bytes": 1268635456, "experiment": "metal_jacobian_dynamic_dp_stream_xyzz_affine_scan_target_lookup_tag16_hash_filter25m_steps1024_dp7_setup", "filter_false_positive_count": 0, "filter_positive_count": 65536, "gpu_lookup_lookups_per_sec": 222646637.153405, "gpu_ops_per_sec": 112694004.297466, "hit_count": 65536, "injected_hits": 64, "iterations": 268435456, "jump_count": 16, "jump_histogram_max_bucket": 16782744, "jump_histogram_max_deviation_ppm": 389, "jump_histogram_min_bucket": 16770687, "jump_index": "power2_mask", "jump_mixer": "avalanche64", "jump_schedule": "power2", "lookup_engine": "gpu_filter16_hash_repeat", "lookup_engine_effective": "gpu_filter16_hash_repeat", "lookup_exact_seconds": 0.004371, "lookup_gpu_seconds": 0.009194, "lookup_hash_seconds": 1.5e-05, "lookup_layout": "open_address_tag16_hash_filter_exact256", "lookup_max_threads_per_threadgroup": 1024, "lookup_query_mode": "repeat", "lookup_repeat": 1024, "lookup_seconds": 0.01358, "lookup_thread_execution_width": 32, "lookup_threadgroup_limit": 512, "lookup_threads_per_threadgroup": 512, "lookups_per_sec": 150735075.911133, "machine": "macOS-26.5-arm64-arm-64bit-Mach-O", "max_threads_per_threadgroup": 1024, "min_ms": 500, "miss_count": 1981440, "operation": "jacobian_affine_scan_target_lookup_tag32", "ops_per_sec": 83374247.889218, "ops_per_sec_max": 86404691.235883, "ops_per_sec_min": 82162660.452073, "output_layout": "affine_dp_scan_target_lookup", "paired_baseline_ops_per_sec": 63081803.186278, "paired_baseline_ref": "main", "paired_order": "alternate", "paired_speedup": 1.3216846012314714, "query_count": 2046976, "query_input": "hash64_repeat_indexed", "raw_status": "keep", "reason": "", "repeat_positive_index_encoding": "packed16_base_repeat", "requested_hits": 64, "runner_sample_count": 3, "sample_count": 262144, "seconds": 2.381985, "setup_inclusive_ops_per_sec": 83374247.889218, "setup_inclusive_ops_per_sec_max": 86404691.235883, "setup_inclusive_ops_per_sec_min": 82162660.452073, "setup_inclusive_seconds": 3.219645, "skipped": false, "state_layout": "xyzz", "status": "keep", "steps_per_sample": 1024, "target_bucket_bytes": 268435456, "target_build_seconds": 0.790682, "target_count": 25005000, "target_filter_bucket_bytes": 67108864, "target_filter_build_seconds": 0.028494, "target_key": "x256_y_parity", "target_key_bytes": 1000200000, "target_lookup_checksum": "0x4bfc0bfe896fe3ad", "target_query_hash_bytes": 15992, "target_table_buckets": 33554432, "target_table_bytes": 67108864, "thread_execution_width": 32, "threadgroup_limit": 128, "threads_per_threadgroup": 128, "timestamp": "2026-06-29T13:59:53Z", "validation_seconds": 9.896088, "validation_workers": 8}
{"affine_scan_mode": "cpu_batch_prod_zz_zzz", "affine_scan_seconds": 0.020734, "backend": "metal", "budget_sec": 420, "bytes_per_target": 2.683818, "candidate_verification": "tag16_hash_filter_then_cpu_exact_key_equality", "commit": "ceb4eef-dirty", "cooldown_sec": 10.0, "correctness": true, "description": "Metal XYZZ 1024-step dp6 repeat512 25M-target lookup density tradeoff versus accepted 1024-step dp7 repeat1024 setup gate", "distance_tracking": "packet_distance_uint64", "dp_bits": 6, "dp_checksum": "0xbc67ab38fa84d2de", "dp_count": 4005, "dp_distance_checksum": "0xf69a64423518f298", "dp_query_count": 4005, "dp_tracking": "affine_x256_y_parity_cpu_batch", "exact_host_table_bytes": 1268635456, "experiment": "metal_jacobian_dynamic_dp_stream_xyzz_affine_scan_target_lookup_tag16_hash_filter25m_steps1024_dp6_repeat512_setup", "filter_false_positive_count": 512, "filter_positive_count": 33280, "gpu_lookup_lookups_per_sec": 151945388.69798, "gpu_ops_per_sec": 123661823.366729, "hit_count": 32768, "injected_hits": 64, "iterations": 268435456, "jump_count": 16, "jump_histogram_max_bucket": 16782744, "jump_histogram_max_deviation_ppm": 389, "jump_histogram_min_bucket": 16770687, "jump_index": "power2_mask", "jump_mixer": "avalanche64", "jump_schedule": "power2", "lookup_engine": "gpu_filter16_hash_repeat", "lookup_engine_effective": "gpu_filter16_hash_repeat", "lookup_exact_seconds": 0.009655, "lookup_gpu_seconds": 0.013495, "lookup_hash_seconds": 5.5e-05, "lookup_layout": "open_address_tag16_hash_filter_exact256", "lookup_max_threads_per_threadgroup": 1024, "lookup_query_mode": "repeat", "lookup_repeat": 512, "lookup_seconds": 0.023205, "lookup_thread_execution_width": 32, "lookup_threadgroup_limit": 512, "lookup_threads_per_threadgroup": 512, "lookups_per_sec": 88365418.170156, "machine": "macOS-26.5-arm64-arm-64bit-Mach-O", "max_threads_per_threadgroup": 1024, "min_ms": 500, "miss_count": 2017792, "operation": "jacobian_affine_scan_target_lookup_tag32", "ops_per_sec": 84162048.224048, "ops_per_sec_max": 91833360.513592, "ops_per_sec_min": 67006772.180375, "output_layout": "affine_dp_scan_target_lookup", "paired_baseline_ops_per_sec": 85400915.406033, "paired_baseline_ref": "main", "paired_order": "alternate", "paired_speedup": 0.9854935140203723, "query_count": 2050560, "query_input": "hash64_repeat_indexed", "reason": "", "repeat_positive_index_encoding": "packed16_base_repeat", "requested_hits": 64, "runner_sample_count": 3, "sample_count": 262144, "seconds": 2.170722, "setup_inclusive_ops_per_sec": 84162048.224048, "setup_inclusive_ops_per_sec_max": 91833360.513592, "setup_inclusive_ops_per_sec_min": 67006772.180375, "setup_inclusive_seconds": 3.189507, "skipped": false, "state_layout": "xyzz", "status": "discard", "steps_per_sample": 1024, "target_bucket_bytes": 268435456, "target_build_seconds": 0.945225, "target_count": 25005000, "target_filter_bucket_bytes": 67108864, "target_filter_build_seconds": 0.02962, "target_key": "x256_y_parity", "target_key_bytes": 1000200000, "target_lookup_checksum": "0x23977ac85d5ac9f0", "target_query_hash_bytes": 32040, "target_table_buckets": 33554432, "target_table_bytes": 67108864, "thread_execution_width": 32, "threadgroup_limit": 128, "threads_per_threadgroup": 128, "timestamp": "2026-06-29T14:10:47Z", "validation_seconds": 13.386255, "validation_workers": 8}
{"all_keys_found": true, "backend": "macos_cpu", "budget_sec": 240, "candidate_verification": "prehashed_serial_vs_parallel_semantic_find_all_keys", "commit": "a9db816-dirty", "confirmation_index": 1, "confirmation_runs": 2, "confirmation_status": "keep", "cooldown_sec": 5.0, "correctness": true, "description": "Host setup benchmark testing RCK_VALIDATION_WORKERS=6 for 25M tag32 parallel insert on Apple Silicon", "experiment": "target_lookup_tag32_parallel_insert_workers6", "injected_count": 64, "iterations": 1, "lookup_layout": "open_address_tag32_index_exact256", "machine": "macOS-26.5-arm64-arm-64bit-Mach-O", "min_ms": 0, "operation": "target_lookup_tag32_parallel_insert_probe", "ops_per_sec": 39543696.391783, "ops_per_sec_max": 40402484.493141, "ops_per_sec_min": 29580944.031803, "paired_baseline_ops_per_sec": 29517720.814066, "paired_baseline_ref": "main", "paired_order": "alternate", "paired_speedup": 1.3396595435288265, "parallel_checksum": "0x820a9f8270c15c72", "parallel_seconds": 0.632338, "parallel_targets_per_sec": 39543696.391783, "parallel_targets_per_sec_max": 40402484.493141, "parallel_targets_per_sec_min": 29580944.031803, "raw_status": "keep", "reason": "", "runner_sample_count": 3, "sample_count": 25005000, "seconds": 0.632338, "serial_checksum": "0x0875f90b516f7503", "serial_seconds": 1.089221, "serial_targets_per_sec": 22956767.539943, "setup_phase": "host_tag32_parallel_insert_probe", "skipped": false, "speedup": 1.722529, "status": "keep", "target_bucket_bytes": 268435456, "target_count": 25005000, "target_key": "x256_y_parity", "target_key_bytes": 1000200000, "target_keys_equal": true, "target_table_buckets": 33554432, "target_table_bytes": 1268635456, "timestamp": "2026-06-29T14:28:45Z"}
