timestamp	commit	experiment	backend	operation	iterations	ops_per_sec	correctness	status	description
2026-07-07T17:58:35Z	ce7dc7b-dirty	metal_jacobian_dynamic_dp_stream_xyzz_affine_scan_target_lookup_tag16_hash_filter1m_rounds_distinct_misses_distance	metal	jacobian_affine_scan_target_lookup_tag32_rounds	134217728	487706720145.608276	true	keep	Medium fixed-round 1M target lookup with physical distinct-miss queries; fast falsifier for setup-inclusive wall-clock kangaroo distance/sec
2026-07-07T18:05:51Z	ce7dc7b-dirty	metal_jacobian_dynamic_dp_stream_xyzz_affine_scan_target_lookup_tag16_hash_filter25m_rounds_distinct_misses_distance	metal	jacobian_affine_scan_target_lookup_tag32_rounds	536870912	409115206575.597168	true	discard	Fixed-round 25M target lookup with physical distinct-miss queries; scores setup-inclusive wall-clock kangaroo distance/sec
2026-07-07T18:05:51Z	ce7dc7b-dirty	metal_jacobian_dynamic_dp_stream_xyzz_affine_scan_target_lookup_tag16_hash_filter25m_rounds_distinct_misses_distance	metal	jacobian_affine_scan_target_lookup_tag32_rounds	536870912	305030899028.506897	true	discard	Fixed-round 25M target lookup with physical distinct-miss queries; scores setup-inclusive wall-clock kangaroo distance/sec
2026-07-07T18:17:45Z	65b2c7f-dirty	metal_jacobian_dynamic_dp_stream_xyzz_affine_scan_target_lookup_tag16_hash_filter1m_rounds_distinct_misses_distance	metal	jacobian_affine_scan_target_lookup_tag32_rounds	134217728	108718060029.861649	true	discard	Medium fixed-round 1M target lookup with physical distinct-miss queries; fast falsifier for setup-inclusive wall-clock kangaroo distance/sec
2026-07-07T18:17:45Z	65b2c7f-dirty	metal_jacobian_dynamic_dp_stream_xyzz_affine_scan_target_lookup_tag16_hash_filter1m_rounds_distinct_misses_distance	metal	jacobian_affine_scan_target_lookup_tag32_rounds	134217728	157380676707.838654	true	discard	Medium fixed-round 1M target lookup with physical distinct-miss queries; fast falsifier for setup-inclusive wall-clock kangaroo distance/sec
2026-07-10T02:32:59Z	1850591-dirty	metal_jacobian_dynamic_xyzz_steps2048_dp6_walk_gate	metal	jacobian_affine_walk_dynamic_dp_stream_xyzz_affine_scan	67108864	73210957.638860	true	discard	Validated Metal XYZZ 2048-step dp6 walk gate for mechanism-level arithmetic and code-generation changes
2026-07-10T02:32:59Z	1850591-dirty	metal_jacobian_dynamic_xyzz_steps2048_dp6_walk_gate	metal	jacobian_affine_walk_dynamic_dp_stream_xyzz_affine_scan	67108864	83428146.449833	true	discard	Validated Metal XYZZ 2048-step dp6 walk gate for mechanism-level arithmetic and code-generation changes
2026-07-10T02:35:25Z	1850591-dirty	metal_jacobian_dynamic_xyzz_steps2048_dp6_walk_gate	metal	jacobian_affine_walk_dynamic_dp_stream_xyzz_affine_scan	67108864	57751745.689226	true	discard	Validated Metal XYZZ 2048-step dp6 walk gate for mechanism-level arithmetic and code-generation changes
2026-07-10T02:35:25Z	1850591-dirty	metal_jacobian_dynamic_xyzz_steps2048_dp6_walk_gate	metal	jacobian_affine_walk_dynamic_dp_stream_xyzz_affine_scan	67108864	48889523.178842	true	discard	Validated Metal XYZZ 2048-step dp6 walk gate for mechanism-level arithmetic and code-generation changes
2026-07-10T02:40:00Z	1850591-dirty	metal_jacobian_dynamic_xyzz_steps2048_dp6_walk_gate_131k	metal	jacobian_affine_walk_dynamic_dp_stream_xyzz_affine_scan	268435456	69645133.743211	true	discard	Large validated Metal XYZZ 2048-step dp6 walk gate matching the 25M fixed-round walker count
2026-07-10T02:47:02Z	1850591-dirty	metal_jacobian_dynamic_xyzz_steps2048_dp6_walk_gate	metal	jacobian_affine_walk_dynamic_dp_stream_xyzz_affine_scan	67108864	61412473.275719	true	discard	Validated Metal XYZZ 2048-step dp6 walk gate for mechanism-level arithmetic and code-generation changes
2026-07-10T02:47:03Z	1850591-dirty	metal_jacobian_dynamic_xyzz_steps2048_dp6_walk_gate	metal	jacobian_affine_walk_dynamic_dp_stream_xyzz_affine_scan	67108864	83424464.698190	true	discard	Validated Metal XYZZ 2048-step dp6 walk gate for mechanism-level arithmetic and code-generation changes
2026-07-10T02:53:52Z	1850591-dirty	metal_jacobian_dynamic_xyzz_steps2048_dp6_walk_gate_131k	metal	jacobian_affine_walk_dynamic_dp_stream_xyzz_affine_scan	268435456	73643730.147977	true	keep	Large validated Metal XYZZ 2048-step dp6 walk gate matching the 25M fixed-round walker count
2026-07-10T02:57:52Z	1850591-dirty	metal_jacobian_dynamic_dp_stream_xyzz_affine_scan_target_lookup_tag16_hash_filter1m_rounds_distinct_misses_distance	metal	jacobian_affine_scan_target_lookup_tag32_rounds	134217728	273503001340.472534	true	keep	Medium fixed-round 1M target lookup with physical distinct-miss queries; fast falsifier for setup-inclusive wall-clock kangaroo distance/sec
2026-07-10T03:16:21Z	6b2be7a	metal_jacobian_dynamic_dp_stream_xyzz_affine_scan_target_lookup_tag16_hash_filter25m_rounds_distinct_misses_distance	metal	jacobian_affine_scan_target_lookup_tag32_rounds	536870912	219466772397.490082	true	discard	Fixed-round 25M target lookup with physical distinct-miss queries; scores setup-inclusive wall-clock kangaroo distance/sec
2026-07-10T03:23:14Z	ccdc95f-dirty	metal_jacobian_dynamic_xyzz_steps2048_dp6_walk_gate_131k	metal	jacobian_affine_walk_dynamic_dp_stream_xyzz_affine_scan	268435456	122242153.217859	true	discard	Large validated Metal XYZZ 2048-step dp6 walk gate matching the 25M fixed-round walker count
2026-07-10T03:27:31Z	ccdc95f-dirty	metal_jacobian_dynamic_xyzz_steps2048_dp6_walk_gate_131k	metal	jacobian_affine_walk_dynamic_dp_stream_xyzz_affine_scan	268435456	125979259.226929	true	discard	Large validated Metal XYZZ 2048-step dp6 walk gate matching the 25M fixed-round walker count
2026-07-10T03:34:38Z	82ecf76-dirty	metal_jacobian_dynamic_xyzz_steps2048_dp6_walk_gate_131k	metal	jacobian_affine_walk_dynamic_dp_stream_xyzz_affine_scan	268435456	56257133.655341	true	discard	Large validated Metal XYZZ 2048-step dp6 walk gate matching the 25M fixed-round walker count
2026-07-10T03:41:34Z	07df136-dirty	metal_jacobian_dynamic_xyzz_steps2048_dp6_walk_gate_131k	metal	jacobian_affine_walk_dynamic_dp_stream_xyzz_affine_scan	268435456	52737488.982882	true	discard	Large validated Metal XYZZ 2048-step dp6 walk gate matching the 25M fixed-round walker count
2026-07-10T03:54:43Z	cf53c9d-dirty	metal_jacobian_dynamic_xyzz_steps2048_dp6_walk_gate_131k	metal	jacobian_affine_walk_dynamic_dp_stream_xyzz_affine_scan	268435456	55924386.840744	true	discard	Large validated Metal XYZZ 2048-step dp6 walk gate matching the 25M fixed-round walker count
2026-07-10T04:01:50Z	cf53c9d-dirty	metal_jacobian_dynamic_xyzz_steps2048_dp6_walk_gate_131k	metal	jacobian_affine_walk_dynamic_dp_stream_xyzz_affine_scan	268435456	63003375.676572	true	discard	Large validated Metal XYZZ 2048-step dp6 walk gate matching the 25M fixed-round walker count
2026-07-10T04:01:50Z	cf53c9d-dirty	metal_jacobian_dynamic_xyzz_steps2048_dp6_walk_gate_131k	metal	jacobian_affine_walk_dynamic_dp_stream_xyzz_affine_scan	268435456	52833534.625048	true	discard	Large validated Metal XYZZ 2048-step dp6 walk gate matching the 25M fixed-round walker count
2026-07-10T04:54:25Z	a1b7146-dirty	metal_jacobian_dynamic_dp_stream_xyzz_affine_scan_target_lookup_tag16_hash_filter1m_rounds_distinct_misses_distance	metal	jacobian_affine_scan_target_lookup_tag32_rounds	134217728	378593852048.759216	true	discard	Medium fixed-round 1M target lookup with physical distinct-miss queries; fast falsifier for setup-inclusive wall-clock kangaroo distance/sec
2026-07-10T04:54:25Z	a1b7146-dirty	metal_jacobian_dynamic_dp_stream_xyzz_affine_scan_target_lookup_tag16_hash_filter1m_rounds_distinct_misses_distance	metal	jacobian_affine_scan_target_lookup_tag32_rounds	134217728	213413293761.228821	true	discard	Medium fixed-round 1M target lookup with physical distinct-miss queries; fast falsifier for setup-inclusive wall-clock kangaroo distance/sec
