timestamp	commit	experiment	backend	operation	iterations	ops_per_sec	correctness	status	description
2026-06-22T20:25:47Z	9edcea1-dirty	metal_jacobian_dynamic_dp_stream_xyzz_chain_steps512	metal	jacobian_affine_walk_dynamic_dp_stream_xyzz_chain	268435456	52054794.687903	true	keep	Metal XYZZ 512-step DP stream with two device-resident chained packets and cumulative uint64 distances
2026-06-22T22:03:45Z	ebd6cb6	metal_jacobian_dynamic_dp_stream_xyzz_persistent_chain_steps512	metal	jacobian_affine_walk_dynamic_dp_stream_xyzz_persistent_chain	536870912	56698747.713128	true	discard	Metal XYZZ 512-step DP stream with persistent chained rounds, reused pipeline/buffers, and cumulative uint64 distances
2026-06-23T17:02:29Z	cf82107-dirty	jacobian_kangaroo_multi_small	macos_cpu	jacobian_kangaroo_multi_small	1787	35731.722389	true	keep	Apple Silicon CPU shared-tame tiny multi-target kangaroo benchmark
2026-06-23T17:02:29Z	cf82107-dirty	jacobian_kangaroo_multi_small	macos_cpu	jacobian_kangaroo_multi_small	1786	35707.591612	true	keep	Apple Silicon CPU shared-tame tiny multi-target kangaroo benchmark
2026-06-23T17:02:29Z	cf82107-dirty	jacobian_kangaroo_multi_small	macos_cpu	jacobian_kangaroo_multi_small	1787	35726.216111	true	keep	Apple Silicon CPU shared-tame tiny multi-target kangaroo benchmark
2026-06-23T17:04:07Z	cf82107-dirty	jacobian_kangaroo_multi16_small	macos_cpu	jacobian_kangaroo_multi_small	806	16112.776320	true	keep	Apple Silicon CPU shared-tame tiny 16-target kangaroo benchmark
2026-06-23T17:04:07Z	cf82107-dirty	jacobian_kangaroo_multi16_small	macos_cpu	jacobian_kangaroo_multi_small	805	16093.576088	true	keep	Apple Silicon CPU shared-tame tiny 16-target kangaroo benchmark
2026-06-23T17:04:07Z	cf82107-dirty	jacobian_kangaroo_multi16_small	macos_cpu	jacobian_kangaroo_multi_small	808	16147.902637	true	keep	Apple Silicon CPU shared-tame tiny 16-target kangaroo benchmark
2026-06-23T17:11:48Z	cf82107-dirty	jacobian_kangaroo_multi_small	macos_cpu	jacobian_kangaroo_multi_small	1785	35684.298908	true	keep	Apple Silicon CPU shared-tame tiny multi-target kangaroo benchmark
2026-06-23T17:11:48Z	cf82107-dirty	jacobian_kangaroo_multi_small	macos_cpu	jacobian_kangaroo_multi_small	1789	35763.786845	true	keep	Apple Silicon CPU shared-tame tiny multi-target kangaroo benchmark
2026-06-23T17:11:48Z	cf82107-dirty	jacobian_kangaroo_multi_small	macos_cpu	jacobian_kangaroo_multi_small	1788	35740.492125	true	keep	Apple Silicon CPU shared-tame tiny multi-target kangaroo benchmark
2026-06-23T17:12:23Z	cf82107-dirty	jacobian_kangaroo_multi16_small	macos_cpu	jacobian_kangaroo_multi_small	807	16130.133842	true	keep	Apple Silicon CPU shared-tame tiny 16-target kangaroo benchmark
2026-06-23T17:12:23Z	cf82107-dirty	jacobian_kangaroo_multi16_small	macos_cpu	jacobian_kangaroo_multi_small	807	16128.414315	true	keep	Apple Silicon CPU shared-tame tiny 16-target kangaroo benchmark
2026-06-23T17:12:23Z	cf82107-dirty	jacobian_kangaroo_multi16_small	macos_cpu	jacobian_kangaroo_multi_small	807	16135.468515	true	keep	Apple Silicon CPU shared-tame tiny 16-target kangaroo benchmark
2026-06-23T17:19:20Z	ac0a8a0-dirty	jacobian_kangaroo_multi_small	macos_cpu	jacobian_kangaroo_multi_small	1739	34765.543097	true	discard	Apple Silicon CPU shared-tame tiny multi-target kangaroo benchmark
2026-06-23T17:19:20Z	ac0a8a0-dirty	jacobian_kangaroo_multi_small	macos_cpu	jacobian_kangaroo_multi_small	1791	35805.558186	true	discard	Apple Silicon CPU shared-tame tiny multi-target kangaroo benchmark
2026-06-23T17:19:20Z	ac0a8a0-dirty	jacobian_kangaroo_multi_small	macos_cpu	jacobian_kangaroo_multi_small	1786	35711.548505	true	discard	Apple Silicon CPU shared-tame tiny multi-target kangaroo benchmark
2026-06-23T17:24:49Z	ac0a8a0-dirty	metal_jacobian_dynamic_dp_stream_xyzz_chain_steps512	metal	jacobian_affine_walk_dynamic_dp_stream_xyzz_chain	268435456	119203306.658362	true	discard	Metal XYZZ 512-step DP stream with two device-resident chained packets and cumulative uint64 distances
2026-06-23T17:26:22Z	ac0a8a0-dirty	jacobian_kangaroo_multi_small	macos_cpu	jacobian_kangaroo_multi_small	1788	35741.474479	true	discard	Apple Silicon CPU shared-tame tiny multi-target kangaroo benchmark
2026-06-23T17:26:22Z	ac0a8a0-dirty	jacobian_kangaroo_multi_small	macos_cpu	jacobian_kangaroo_multi_small	1789	35763.697476	true	discard	Apple Silicon CPU shared-tame tiny multi-target kangaroo benchmark
2026-06-23T17:26:22Z	ac0a8a0-dirty	jacobian_kangaroo_multi_small	macos_cpu	jacobian_kangaroo_multi_small	1784	35677.651697	true	discard	Apple Silicon CPU shared-tame tiny multi-target kangaroo benchmark
2026-06-23T17:31:33Z	3317804-dirty	jacobian_kangaroo_multi_small	macos_cpu	jacobian_kangaroo_multi_small	1791	35804.664146	true	discard	Apple Silicon CPU shared-tame tiny multi-target kangaroo benchmark
2026-06-23T17:31:33Z	3317804-dirty	jacobian_kangaroo_multi_small	macos_cpu	jacobian_kangaroo_multi_small	1789	35772.607233	true	discard	Apple Silicon CPU shared-tame tiny multi-target kangaroo benchmark
2026-06-23T17:31:33Z	3317804-dirty	jacobian_kangaroo_multi_small	macos_cpu	jacobian_kangaroo_multi_small	1792	35827.520558	true	discard	Apple Silicon CPU shared-tame tiny multi-target kangaroo benchmark
2026-06-23T17:35:49Z	3317804-dirty	jacobian_kangaroo_multi_small	macos_cpu	jacobian_kangaroo_multi_small	1780	35599.347108	true	discard	Apple Silicon CPU shared-tame tiny multi-target kangaroo benchmark
2026-06-23T17:35:49Z	3317804-dirty	jacobian_kangaroo_multi_small	macos_cpu	jacobian_kangaroo_multi_small	1781	35606.706592	true	discard	Apple Silicon CPU shared-tame tiny multi-target kangaroo benchmark
2026-06-23T17:35:49Z	3317804-dirty	jacobian_kangaroo_multi_small	macos_cpu	jacobian_kangaroo_multi_small	1777	35530.199350	true	discard	Apple Silicon CPU shared-tame tiny multi-target kangaroo benchmark
2026-06-23T18:49:26Z	2f23769-dirty	jacobian_kangaroo_multi16_scaled4_balanced	macos_cpu	jacobian_kangaroo_multi_small	2	31.011318	true	keep	Apple Silicon CPU shared-tame tiny 16-target kangaroo benchmark with the scaled4-balanced jump schedule
2026-06-23T18:50:17Z	2f23769-dirty	metal_jacobian_dynamic_dp_stream_xyzz_scaled4_balanced	metal	jacobian_affine_walk_dynamic_dp_stream_xyzz	268435456	123234598.455869	true	keep	Metal dynamic DP8 stream using XYZZ 512-step packets with the scaled4-balanced 4-jump schedule
2026-06-23T18:54:45Z	2f23769-dirty	jacobian_kangaroo_multi16_scaled4_balanced	macos_cpu	jacobian_kangaroo_multi_small	2	30.433391	true	discard	Apple Silicon CPU shared-tame tiny 16-target kangaroo benchmark with the scaled4-balanced jump schedule
2026-06-23T18:55:16Z	2f23769-dirty	metal_jacobian_dynamic_dp_stream_xyzz_scaled4_balanced	metal	jacobian_affine_walk_dynamic_dp_stream_xyzz	268435456	125874951.286111	true	keep	Metal dynamic DP8 stream using XYZZ 512-step packets with the scaled4-balanced 4-jump schedule
2026-06-23T22:34:06Z	7ceb57c	metal_jacobian_dynamic_dp_stream_xyzz_persistent_chain_dp12_steps512	metal	jacobian_affine_walk_dynamic_dp_stream_xyzz_persistent_chain	268435456	123851132.746183	true	keep	Metal XYZZ persistent 512-step chain with runtime ProjectiveDpMask(dp_bits=12)
2026-06-23T22:45:05Z	7ee5643	metal_jacobian_dynamic_dp_stream_xyzz_dp12_steps512	metal	jacobian_affine_walk_dynamic_dp_stream_xyzz	134217728	125987056.586718	true	keep	Metal XYZZ 512-step DP stream with hardcoded dp_bits=12 mask
2026-06-23T23:06:29Z	88816b7	metal_jacobian_dynamic_dp_stream_xyzz_persistent_chain_dp16_steps512	metal	jacobian_affine_walk_dynamic_dp_stream_xyzz_persistent_chain	268435456	123257579.364915	true	keep	Metal XYZZ persistent 512-step chain with hardcoded dp_bits=16 mask
2026-06-24T11:44:58Z	0b9a406	metal_jacobian_dynamic_dp_stream_xyzz_affine_scan_steps512	metal	jacobian_affine_walk_dynamic_dp_stream_xyzz_affine_scan	134217728	124390543.442828	true	keep	Metal XYZZ 512-step packet walk with GPU per-walker distances and CPU batched affine DP scan
2026-06-24T20:34:41Z	2fe9034	metal_target_lookup_exact256	metal	target_lookup_exact256	65011712	125616200.459179	true	keep	Metal exact x256+y-parity open-address target lookup gate for multi-target kangaroo DP joins
2026-06-24T21:34:41Z	de7323f	metal_target_lookup_compact_exact256	metal	target_lookup_compact_exact256	79691776	156975200.176937	true	keep	Metal compact hash64+index target lookup with exact x256+y-parity verification
2026-06-24T22:36:45Z	1d0e147	metal_target_lookup_tag32_exact256	metal	target_lookup_tag32_exact256	102760448	201502401.315374	true	keep	Metal tag32+index target lookup with exact x256+y-parity verification
2026-06-25T00:43:40Z	a48e913	metal_target_lookup_tag32_packed_exact256	metal	target_lookup_tag32_packed_exact256	68157440	135664964.776392	true	discard	Metal packed tag32+index target lookup with exact x256+y-parity verification
2026-06-25T00:51:11Z	f3527a5	metal_target_lookup_tag32_halfload_highload_exact256	metal	target_lookup_tag32_exact256	69206016	137879070.930129	true	discard	Metal tag32 target lookup with half-load buckets on a high-load non-power-of-two target shape
2026-06-25T00:56:14Z	768b93a	metal_target_lookup_tag32_sentinel_simplified_exact256	metal	target_lookup_tag32_exact256	126877696	245435616.929923	true	keep	Metal tag32 target lookup with redundant sentinel condition removed
2026-06-25T00:57:18Z	768b93a-dirty	metal_target_lookup_tag32_sentinel_simplified_exact256	metal	target_lookup_tag32_exact256	67108864	132157969.915871	true	discard	Metal tag32 target lookup with redundant sentinel condition removed
2026-06-25T00:57:18Z	768b93a-dirty	metal_target_lookup_tag32_sentinel_simplified_exact256	metal	target_lookup_tag32_exact256	80740352	159995387.777540	true	discard	Metal tag32 target lookup with redundant sentinel condition removed
2026-06-25T11:46:41Z	436d252	metal_jacobian_dynamic_dp_stream_xyzz_affine_scan_target_lookup_tag32	metal	jacobian_affine_scan_target_lookup_tag32	134217728	121827155.136391	true	keep	Metal XYZZ affine DP scan feeding exact tag32 multi-target lookup
2026-06-25T13:19:59Z	40b6387	metal_jacobian_dynamic_dp_stream_xyzz_affine_scan_target_lookup_tag32_bulk1024	metal	jacobian_affine_scan_target_lookup_tag32	134217728	338447087.311549	true	keep	Metal XYZZ affine DP scan feeding exact tag32 multi-target lookup with a repeated real-DP query batch
2026-06-25T13:56:14Z	49c539d	metal_jacobian_dynamic_dp_stream_xyzz_affine_scan_target_lookup_tag32_distinct_misses1024	metal	jacobian_affine_scan_target_lookup_tag32	134217728	332746255.341113	true	keep	Metal XYZZ affine DP scan feeding exact tag32 multi-target lookup with a distinct-miss bulk query batch
2026-06-25T14:42:53Z	0e045fe-dirty	metal_jacobian_dynamic_dp_stream_xyzz_affine_scan_target_lookup_tag32_hits_only_distinct_misses1024	metal	jacobian_affine_scan_target_lookup_tag32	134217728	265142720.522149	true	discard	Metal XYZZ affine DP scan feeding exact tag32 multi-target lookup with hits-only output on a distinct-miss bulk query batch
2026-06-25T19:55:01Z	f53621c	metal_jacobian_dynamic_dp_stream_xyzz_scaled4_balanced	metal	jacobian_affine_walk_dynamic_dp_stream_xyzz	268435456	117076522.598601	true	discard	Metal dynamic DP8 stream using XYZZ 512-step packets with the scaled4-balanced 4-jump schedule
2026-06-25T20:15:24Z	2cc50c2	metal_jacobian_dynamic_dp_stream_xyzz_persistent_chain_steps512	metal	jacobian_affine_walk_dynamic_dp_stream_xyzz_persistent_chain	536870912	124755147.554164	true	keep	Metal XYZZ 512-step DP stream with persistent chained rounds, reused pipeline/buffers, and cumulative uint64 distances
2026-06-25T20:20:28Z	d6a07ff	metal_jacobian_dynamic_dp_stream_xyzz_persistent_chain_steps512	metal	jacobian_affine_walk_dynamic_dp_stream_xyzz_persistent_chain	536870912	74788530.478310	true	discard	Metal XYZZ 512-step DP stream with persistent chained rounds, reused pipeline/buffers, and cumulative uint64 distances
2026-06-25T20:28:19Z	d4398d9	metal_jacobian_dynamic_dp_stream_xyzz_chain_packets4_steps512	metal	jacobian_affine_walk_dynamic_dp_stream_xyzz_chain	536870912	92484157.517172	true	keep	Metal XYZZ 512-step DP stream with four device-resident chained packets and cumulative uint64 distances
2026-06-26T16:06:55Z	c916f3a	metal_jacobian_dynamic_dp_stream_xyzz_affine_scan_target_lookup_tag32_lookup_tg512	metal	jacobian_affine_scan_target_lookup_tag32	134217728	263692100.648384	true	keep	Metal XYZZ affine DP scan feeding exact tag32 target lookup with a 512-thread lookup-only threadgroup cap
2026-06-26T16:34:12Z	5a27649	metal_target_lookup_tag32_persistent_tg1024	metal	target_lookup_tag32_persistent_exact256	178590720	193850878.038308	true	keep	Persistent Metal tag32 target lookup with the promoted 1024-thread large-table default against the old tg64 default
2026-06-26T16:34:12Z	5a27649	metal_target_lookup_tag32_persistent_tg1024	metal	target_lookup_tag32_persistent_exact256	158025728	175132519.820510	true	keep	Persistent Metal tag32 target lookup with the promoted 1024-thread large-table default against the old tg64 default
2026-06-26T17:32:42Z	9a88e7e	metal_jacobian_dynamic_dp_stream_xyzz_affine_scan_target_lookup_tag32_auto_filter25m	metal	jacobian_affine_scan_target_lookup_tag32	134217728	118192117.838356	true	discard	Metal XYZZ affine DP scan with auto routing to GPU tag32 filter on a 25M-target distinct-miss batch
2026-06-26T17:32:42Z	9a88e7e	metal_jacobian_dynamic_dp_stream_xyzz_affine_scan_target_lookup_tag32_auto_filter25m	metal	jacobian_affine_scan_target_lookup_tag32	134217728	64324197.141042	true	discard	Metal XYZZ affine DP scan with auto routing to GPU tag32 filter on a 25M-target distinct-miss batch
2026-06-26T17:41:04Z	feb9db3	metal_target_lookup_tag32_filter_exact256	metal	target_lookup_tag32_filter_exact256	45459456	81824789.519815	true	keep	Metal tag32-only target filter with CPU exact verification of compact positives
2026-06-26T17:41:04Z	feb9db3	metal_target_lookup_tag32_filter_exact256	metal	target_lookup_tag32_filter_exact256	48706560	90535388.113438	true	keep	Metal tag32-only target filter with CPU exact verification of compact positives
2026-06-26T17:56:15Z	bf01557	metal_target_lookup_tag32_filter_persistent	metal	target_lookup_tag32_filter_persistent_exact256	263015424	336974086.813292	true	keep	Persistent Metal tag32 filter lookup with CPU exact verification of compact positives
2026-06-26T17:56:15Z	bf01557	metal_target_lookup_tag32_filter_persistent	metal	target_lookup_tag32_filter_persistent_exact256	366922752	433107771.320567	true	keep	Persistent Metal tag32 filter lookup with CPU exact verification of compact positives
2026-06-26T18:18:11Z	209a31c	metal_target_lookup_tag16_filter_persistent	metal	target_lookup_tag16_filter_persistent_exact256	373416960	484056946.155764	true	keep	Persistent Metal tag16 filter lookup with CPU exact verification of compact positives
2026-06-26T18:18:11Z	209a31c	metal_target_lookup_tag16_filter_persistent	metal	target_lookup_tag16_filter_persistent_exact256	355016704	480486002.881186	true	keep	Persistent Metal tag16 filter lookup with CPU exact verification of compact positives
2026-06-26T20:23:30Z	1a29d64	metal_target_lookup_tag16_hash_filter_persistent	metal	target_lookup_tag16_hash_filter_persistent_exact256	456759296	587549574.555683	true	keep	Persistent Metal tag16 filter lookup using prehashed query input with CPU exact verification of compact positives
2026-06-26T20:23:30Z	1a29d64	metal_target_lookup_tag16_hash_filter_persistent	metal	target_lookup_tag16_hash_filter_persistent_exact256	501136384	679964381.462716	true	keep	Persistent Metal tag16 filter lookup using prehashed query input with CPU exact verification of compact positives
2026-06-26T20:39:21Z	5c64fd7	metal_target_lookup_tag16_hash_filter_persistent	metal	target_lookup_tag16_hash_filter_persistent_exact256	44377088	55694532.796569	true	discard	Persistent Metal tag16 filter lookup using prehashed query input with CPU exact verification of compact positives
2026-06-26T20:39:21Z	5c64fd7	metal_target_lookup_tag16_hash_filter_persistent	metal	target_lookup_tag16_hash_filter_persistent_exact256	40047616	52307280.624436	true	discard	Persistent Metal tag16 filter lookup using prehashed query input with CPU exact verification of compact positives
2026-06-26T20:44:43Z	43b5f4f	metal_target_lookup_tag16_hash_filter_entropy_remap	metal	target_lookup_tag16_hash_filter_persistent_exact256	35718144	45353378.397795	true	discard	Same prehashed persistent Metal tag16 lookup with zero-only sentinel remap instead of tag parity folding
2026-06-26T20:44:43Z	43b5f4f	metal_target_lookup_tag16_hash_filter_entropy_remap	metal	target_lookup_tag16_hash_filter_persistent_exact256	45459456	53724312.532616	true	discard	Same prehashed persistent Metal tag16 lookup with zero-only sentinel remap instead of tag parity folding
2026-06-26T20:52:55Z	95608d4	metal_target_lookup_tag16_hash_filter_entropy_remap	metal	target_lookup_tag16_hash_filter_persistent_exact256	490312704	648259973.315809	true	discard	Same prehashed persistent Metal tag16 lookup with zero-only sentinel remap instead of tag parity folding
2026-06-26T20:52:55Z	95608d4	metal_target_lookup_tag16_hash_filter_entropy_remap	metal	target_lookup_tag16_hash_filter_persistent_exact256	72518656	93387661.680901	true	discard	Same prehashed persistent Metal tag16 lookup with zero-only sentinel remap instead of tag parity folding
2026-06-26T21:10:53Z	f19bf60	metal_jacobian_dynamic_dp_stream_xyzz_affine_scan_target_lookup_tag16_hash_filter25m	metal	jacobian_affine_scan_target_lookup_tag32	134217728	110796227.320140	true	keep	Metal XYZZ affine DP scan with explicit tag16 hash filter on a 25M-target distinct-miss batch
2026-06-26T21:10:53Z	f19bf60	metal_jacobian_dynamic_dp_stream_xyzz_affine_scan_target_lookup_tag16_hash_filter25m	metal	jacobian_affine_scan_target_lookup_tag32	134217728	97927206.806094	true	keep	Metal XYZZ affine DP scan with explicit tag16 hash filter on a 25M-target distinct-miss batch
2026-06-26T21:21:50Z	1e2ca77	metal_jacobian_dynamic_dp_stream_xyzz_affine_scan_target_lookup_tag16_hash_filter25m_cpu_gate	metal	jacobian_affine_scan_target_lookup_tag32	134217728	118623733.699262	true	keep	Metal XYZZ affine DP scan tag16 hash filter versus CPU lookup on a 25M-target distinct-miss batch
2026-06-26T21:21:50Z	1e2ca77	metal_jacobian_dynamic_dp_stream_xyzz_affine_scan_target_lookup_tag16_hash_filter25m_cpu_gate	metal	jacobian_affine_scan_target_lookup_tag32	134217728	110765603.652636	true	keep	Metal XYZZ affine DP scan tag16 hash filter versus CPU lookup on a 25M-target distinct-miss batch
2026-06-26T21:31:47Z	43974c5	metal_jacobian_dynamic_dp_stream_xyzz_affine_scan_target_lookup_auto_tag16_hash25m	metal	jacobian_affine_scan_target_lookup_tag32	134217728	29413745.649620	true	discard	Auto lookup policy routing to tag16 hash filter on a 25M-target distinct-miss batch
2026-06-26T21:31:47Z	43974c5	metal_jacobian_dynamic_dp_stream_xyzz_affine_scan_target_lookup_auto_tag16_hash25m	metal	jacobian_affine_scan_target_lookup_tag32	134217728	32062314.332331	true	discard	Auto lookup policy routing to tag16 hash filter on a 25M-target distinct-miss batch
2026-06-26T21:47:17Z	87d8025	metal_jacobian_dynamic_dp_stream_xyzz_affine_scan_target_lookup_filter_sparse_validation25m	metal	jacobian_affine_scan_target_lookup_tag32	134217728	29442389.766506	true	discard	Sparse exact validation for integrated filter engines on a 25M-target tag16 hash lookup batch
2026-06-26T21:47:17Z	87d8025	metal_jacobian_dynamic_dp_stream_xyzz_affine_scan_target_lookup_filter_sparse_validation25m	metal	jacobian_affine_scan_target_lookup_tag32	134217728	26769370.789497	true	discard	Sparse exact validation for integrated filter engines on a 25M-target tag16 hash lookup batch
2026-06-26T21:59:38Z	314e461	metal_jacobian_dynamic_dp_stream_xyzz_affine_scan_target_lookup_tag16_hash_filter25m_tg128_default	metal	jacobian_affine_scan_target_lookup_tag32	134217728	29668582.042430	true	discard	Default 128-thread Metal tag16 hash lookup cap versus the old 512-thread cap on a 25M-target distinct-miss batch
2026-06-26T21:59:38Z	314e461	metal_jacobian_dynamic_dp_stream_xyzz_affine_scan_target_lookup_tag16_hash_filter25m_tg128_default	metal	jacobian_affine_scan_target_lookup_tag32	134217728	28114725.754939	true	discard	Default 128-thread Metal tag16 hash lookup cap versus the old 512-thread cap on a 25M-target distinct-miss batch
2026-06-26T22:22:12Z	d8f05f4	metal_jacobian_dynamic_dp_stream_xyzz_steps512_tg512_default	metal	jacobian_affine_walk_dynamic_dp_stream_xyzz	268435456	54922712.642899	true	discard	Default 512-thread Metal XYZZ 512-step packet cap versus the old 128-thread cap
2026-06-26T22:22:12Z	d8f05f4	metal_jacobian_dynamic_dp_stream_xyzz_steps512_tg512_default	metal	jacobian_affine_walk_dynamic_dp_stream_xyzz	268435456	41442869.888584	true	discard	Default 512-thread Metal XYZZ 512-step packet cap versus the old 128-thread cap
2026-06-26T22:35:39Z	ba4a706	metal_target_lookup_tag16_hash_filter_persistent_tg256_default	metal	target_lookup_tag16_hash_filter_persistent_exact256	303063040	384244831.768039	true	discard	Default 256-thread persistent Metal tag16 hash-filter lookup cap versus the old 512-thread cap on a 25M-target batch
2026-06-26T22:35:39Z	ba4a706	metal_target_lookup_tag16_hash_filter_persistent_tg256_default	metal	target_lookup_tag16_hash_filter_persistent_exact256	71436288	23582491.610644	true	discard	Default 256-thread persistent Metal tag16 hash-filter lookup cap versus the old 512-thread cap on a 25M-target batch
2026-06-26T22:50:17Z	3f502b5	metal_target_lookup_tag16_hash_filter_persistent_dispatch	metal	target_lookup_tag16_hash_filter_persistent_exact256	324710400	460269790.538310	true	discard	Dispatch-only persistent Metal tag16 hash-filter lookup using prehashed query input versus in-kernel query hashing
