timestamp	commit	experiment	backend	operation	iterations	ops_per_sec	correctness	status	description
2026-06-30T19:42:13Z	a5cb61a-dirty	metal_jacobian_dynamic_dp_stream_xyzz_affine_scan_target_lookup_tag16_hash_filter_m3_grouped_base_positive	metal	jacobian_affine_scan_target_lookup_tag32	4194304	30022289.683890	true	discard	M3 repeat-indexed tag16 hash filter grouped threadgroup compaction for base-index positives
2026-06-30T19:45:43Z	a5cb61a-dirty	metal_jacobian_dynamic_dp_stream_xyzz_affine_scan_target_lookup_tag16_hash_filter_m3_tg768_after_base_counts	metal	jacobian_affine_scan_target_lookup_tag32	8388608	42668710.167312	true	keep	M3 repeat-indexed tag16 hash filter lookup threadgroup 768 versus 512 after sparse base-count resolver
2026-06-30T19:45:43Z	a5cb61a-dirty	metal_jacobian_dynamic_dp_stream_xyzz_affine_scan_target_lookup_tag16_hash_filter_m3_tg768_after_base_counts	metal	jacobian_affine_scan_target_lookup_tag32	4194304	40558867.257664	true	keep	M3 repeat-indexed tag16 hash filter lookup threadgroup 768 versus 512 after sparse base-count resolver
2026-06-30T19:51:32Z	a5cb61a-dirty	metal_jacobian_dynamic_dp_stream_xyzz_affine_scan_target_lookup_tag16_hash_filter_m3_auto_tg768_default	metal	jacobian_affine_scan_target_lookup_tag32	8388608	48244424.750858	true	discard	M3 auto repeat-indexed tag16 hash filter default 768-thread lookup cap versus previous auto default
2026-06-30T19:51:32Z	a5cb61a-dirty	metal_jacobian_dynamic_dp_stream_xyzz_affine_scan_target_lookup_tag16_hash_filter_m3_auto_tg768_default	metal	jacobian_affine_scan_target_lookup_tag32	8388608	34205080.912293	true	discard	M3 auto repeat-indexed tag16 hash filter default 768-thread lookup cap versus previous auto default
2026-06-30T19:58:56Z	a5cb61a-dirty	metal_jacobian_dynamic_dp_stream_xyzz_affine_scan_target_lookup_tag16_hash_filter_m3_base_count_repeat	metal	jacobian_affine_scan_target_lookup_tag32	8388608	67353853.133572	true	keep	M3 repeat-indexed tag16 hash filter GPU base-count positives versus repeated base-index positives
2026-06-30T19:58:56Z	a5cb61a-dirty	metal_jacobian_dynamic_dp_stream_xyzz_affine_scan_target_lookup_tag16_hash_filter_m3_base_count_repeat	metal	jacobian_affine_scan_target_lookup_tag32	8388608	71787238.321406	true	keep	M3 repeat-indexed tag16 hash filter GPU base-count positives versus repeated base-index positives
2026-06-30T20:10:57Z	31518ad-dirty	metal_jacobian_dynamic_dp_stream_xyzz_affine_scan_target_lookup_tag16_hash_filter_m3_base_count_tg2d	metal	jacobian_affine_scan_target_lookup_tag32	8388608	75097791.714684	true	discard	M3 repeat-indexed tag16 hash filter base-count 2D threadgroup versus 1D threadgroup
2026-06-30T20:10:57Z	31518ad-dirty	metal_jacobian_dynamic_dp_stream_xyzz_affine_scan_target_lookup_tag16_hash_filter_m3_base_count_tg2d	metal	jacobian_affine_scan_target_lookup_tag32	8388608	72047891.025586	true	discard	M3 repeat-indexed tag16 hash filter base-count 2D threadgroup versus 1D threadgroup
2026-06-30T20:26:21Z	31518ad-dirty	metal_jacobian_dynamic_dp_stream_xyzz_affine_scan_target_lookup_tag16_mix_filter_m3_base_count_repeat	metal	jacobian_affine_scan_target_lookup_tag32	8388608	18925546.197068	true	discard	M3 repeat-indexed tag16-mix hash filter with fused setup and base-count positives versus standard tag16
2026-06-30T20:26:21Z	31518ad-dirty	metal_jacobian_dynamic_dp_stream_xyzz_affine_scan_target_lookup_tag16_mix_filter_m3_base_count_repeat	metal	jacobian_affine_scan_target_lookup_tag32	8388608	15462762.638213	true	discard	M3 repeat-indexed tag16-mix hash filter with fused setup and base-count positives versus standard tag16
2026-06-30T20:43:34Z	73adb7f-dirty	metal_jacobian_dynamic_dp_stream_xyzz_affine_scan_target_lookup_tag16_hash_filter_m3_base_count_by_base_reduce	metal	jacobian_affine_scan_target_lookup_tag32	8388608	75494801.824354	true	keep	M3 repeat-indexed tag16 hash filter base-count by-base threadgroup reduction versus per-positive global atomics
2026-06-30T20:43:34Z	73adb7f-dirty	metal_jacobian_dynamic_dp_stream_xyzz_affine_scan_target_lookup_tag16_hash_filter_m3_base_count_by_base_reduce	metal	jacobian_affine_scan_target_lookup_tag32	8388608	77881634.196628	true	keep	M3 repeat-indexed tag16 hash filter base-count by-base threadgroup reduction versus per-positive global atomics
2026-06-30T21:28:57Z	9399a02-dirty	metal_jacobian_dynamic_dp_stream_xyzz_affine_scan_target_lookup_tag16_hash_filter25m_rounds_base_count_repeat	metal	jacobian_affine_scan_target_lookup_tag32_rounds	536870912	55355964.432093	true	keep	Fixed-round 25M target tag16 repeat lookup with base-count positives versus expanded positive indices
2026-06-30T21:28:57Z	9399a02-dirty	metal_jacobian_dynamic_dp_stream_xyzz_affine_scan_target_lookup_tag16_hash_filter25m_rounds_base_count_repeat	metal	jacobian_affine_scan_target_lookup_tag32_rounds	536870912	64727322.948725	true	keep	Fixed-round 25M target tag16 repeat lookup with base-count positives versus expanded positive indices
2026-06-30T21:49:39Z	d06499f-dirty	metal_jacobian_dynamic_dp_stream_xyzz_affine_scan_target_lookup_tag16_hash_filter25m_rounds_batched_walk	metal	jacobian_affine_scan_target_lookup_tag32_rounds	536870912	109395855.173225	true	keep	Fixed-round 25M target lookup with distinct round starts batched into one Metal walk dispatch
2026-06-30T21:49:39Z	d06499f-dirty	metal_jacobian_dynamic_dp_stream_xyzz_affine_scan_target_lookup_tag16_hash_filter25m_rounds_batched_walk	metal	jacobian_affine_scan_target_lookup_tag32_rounds	536870912	59926669.794161	true	keep	Fixed-round 25M target lookup with distinct round starts batched into one Metal walk dispatch
2026-06-30T22:33:32Z	147f940-dirty	metal_jacobian_dynamic_dp_stream_xyzz_affine_scan_target_lookup_tag16_hash_filter25m_rounds_batched_walk	metal	jacobian_affine_scan_target_lookup_tag32_rounds	536870912	120293962.488858	true	keep	Fixed-round 25M target lookup with distinct round starts batched into one Metal walk dispatch
2026-06-30T22:33:32Z	147f940-dirty	metal_jacobian_dynamic_dp_stream_xyzz_affine_scan_target_lookup_tag16_hash_filter25m_rounds_batched_walk	metal	jacobian_affine_scan_target_lookup_tag32_rounds	536870912	59628720.520350	true	keep	Fixed-round 25M target lookup with distinct round starts batched into one Metal walk dispatch
2026-06-30T22:58:05Z	b5864aa-dirty	metal_jacobian_dynamic_dp_stream_xyzz_affine_scan_target_lookup_tag16_hash_filter25m_rounds_setup_inclusive	metal	jacobian_affine_scan_target_lookup_tag32_rounds	536870912	109975306.448799	true	keep	Fixed-round 25M target lookup setup-inclusive gate for compact target table build changes
2026-06-30T22:58:05Z	b5864aa-dirty	metal_jacobian_dynamic_dp_stream_xyzz_affine_scan_target_lookup_tag16_hash_filter25m_rounds_setup_inclusive	metal	jacobian_affine_scan_target_lookup_tag32_rounds	536870912	62857296.634462	true	keep	Fixed-round 25M target lookup setup-inclusive gate for compact target table build changes
2026-06-30T23:20:10Z	6e8f49f-dirty	metal_jacobian_dynamic_dp_stream_xyzz_affine_scan_target_lookup_tag16_hash_filter25m_rounds_setup_inclusive	metal	jacobian_affine_scan_target_lookup_tag32_rounds	536870912	104431906.564908	true	discard	Fixed-round 25M target lookup setup-inclusive gate for compact target table build changes
2026-06-30T23:20:10Z	6e8f49f-dirty	metal_jacobian_dynamic_dp_stream_xyzz_affine_scan_target_lookup_tag16_hash_filter25m_rounds_setup_inclusive	metal	jacobian_affine_scan_target_lookup_tag32_rounds	536870912	87372372.474576	true	discard	Fixed-round 25M target lookup setup-inclusive gate for compact target table build changes
2026-06-30T23:45:43Z	24c0458-dirty	metal_jacobian_dynamic_dp_stream_xyzz_affine_scan_target_lookup_tag16_hash_filter25m_rounds_setup_inclusive	metal	jacobian_affine_scan_target_lookup_tag32_rounds	536870912	108744283.313552	true	discard	Fixed-round 25M target lookup setup-inclusive gate for compact target table build changes
2026-06-30T23:45:43Z	24c0458-dirty	metal_jacobian_dynamic_dp_stream_xyzz_affine_scan_target_lookup_tag16_hash_filter25m_rounds_setup_inclusive	metal	jacobian_affine_scan_target_lookup_tag32_rounds	536870912	93872895.943423	true	discard	Fixed-round 25M target lookup setup-inclusive gate for compact target table build changes
2026-07-01T00:15:39Z	c86eef5-dirty	metal_jacobian_dynamic_dp_stream_xyzz_affine_scan_target_lookup_tag16_hash_filter25m_rounds_setup_wall	metal	jacobian_affine_scan_target_lookup_tag32_rounds	536870912	106910092.849915	true	discard	Fixed-round 25M target lookup setup-inclusive wall-clock gate including Metal walk and lookup buffer setup
2026-07-01T00:39:24Z	7b4423e-dirty	metal_jacobian_dynamic_dp_stream_xyzz_affine_scan_target_lookup_tag16_hash_filter25m_rounds_setup_wall	metal	jacobian_affine_scan_target_lookup_tag32_rounds	536870912	102762281.417187	true	keep	Fixed-round 25M target lookup setup-inclusive wall-clock gate including Metal walk and lookup buffer setup
2026-07-01T00:39:24Z	7b4423e-dirty	metal_jacobian_dynamic_dp_stream_xyzz_affine_scan_target_lookup_tag16_hash_filter25m_rounds_setup_wall	metal	jacobian_affine_scan_target_lookup_tag32_rounds	536870912	78462642.066908	true	keep	Fixed-round 25M target lookup setup-inclusive wall-clock gate including Metal walk and lookup buffer setup
2026-07-01T00:44:46Z	1a4e22a-dirty	target_lookup_tag32_parallel_insert	macos_cpu	target_lookup_tag32_parallel_insert_probe	1	32901579.175273	true	keep	Host setup benchmark measuring absolute parallel CAS tag32 insertion throughput with semantic find-all verification
2026-07-01T00:44:46Z	1a4e22a-dirty	target_lookup_tag32_parallel_insert	macos_cpu	target_lookup_tag32_parallel_insert_probe	1	57394495.386564	true	keep	Host setup benchmark measuring absolute parallel CAS tag32 insertion throughput with semantic find-all verification
2026-07-01T10:27:31Z	3fc7457-dirty	metal_jacobian_dynamic_dp_stream_xyzz_affine_scan_target_lookup_tag16_hash_filter25m_rounds_distinct_misses_distance	metal	jacobian_affine_scan_target_lookup_tag32_rounds	536870912	440854462579.940979	true	keep	Fixed-round 25M target lookup with physical distinct-miss queries; scores setup-inclusive wall-clock kangaroo distance/sec
2026-07-01T11:08:30Z	34b6c9e-dirty	metal_jacobian_dynamic_dp_stream_xyzz_affine_scan_target_lookup_tag16_hash_filter25m_rounds_distinct_misses_distance	metal	jacobian_affine_scan_target_lookup_tag32_rounds	536870912	419382208002.396973	true	discard	Fixed-round 25M target lookup with physical distinct-miss queries; scores setup-inclusive wall-clock kangaroo distance/sec
2026-07-01T11:31:06Z	4d17076-dirty	metal_jacobian_dynamic_dp_stream_xyzz_affine_scan_target_lookup_tag16_hash_filter25m_rounds_distinct_misses_distance	metal	jacobian_affine_scan_target_lookup_tag32_rounds	536870912	440858189444.951538	true	discard	Fixed-round 25M target lookup with physical distinct-miss queries; scores setup-inclusive wall-clock kangaroo distance/sec
2026-07-01T11:56:11Z	d636653-dirty	metal_jacobian_dynamic_dp_stream_xyzz_affine_scan_target_lookup_tag16_hash_filter25m_rounds_distinct_misses_distance	metal	jacobian_affine_scan_target_lookup_tag32_rounds	536870912	440817525593.280823	true	discard	Fixed-round 25M target lookup with physical distinct-miss queries; scores setup-inclusive wall-clock kangaroo distance/sec
2026-07-01T12:11:50Z	6d12de4-dirty	metal_jacobian_dynamic_dp_stream_xyzz_affine_scan_target_lookup_tag16_hash_filter25m_rounds_distinct_misses_distance	metal	jacobian_affine_scan_target_lookup_tag32_rounds	536870912	399396664598.785522	true	discard	Fixed-round 25M target lookup with physical distinct-miss queries; scores setup-inclusive wall-clock kangaroo distance/sec
2026-07-01T15:29:09Z	f3617d3-dirty	target_lookup_tag32_parity_parallel_insert	macos_cpu	target_lookup_tag32_parity_parallel_insert_probe	1	43189537.070119	true	keep	Host setup benchmark for the x-only parity tag32 builder used by fixed-round distinct-miss lookup
2026-07-01T15:33:05Z	79a93be-dirty	target_lookup_tag32_parity_parallel_insert	macos_cpu	target_lookup_tag32_parity_parallel_insert_probe	1	44031285.361388	true	keep	Host setup benchmark for the x-only parity tag32 builder used by fixed-round distinct-miss lookup
2026-07-01T15:35:16Z	79a93be-dirty	target_lookup_tag32_parity_parallel_insert	macos_cpu	target_lookup_tag32_parity_parallel_insert_probe	1	20102413.374918	true	keep	Host setup benchmark for the x-only parity tag32 builder used by fixed-round distinct-miss lookup
2026-07-01T16:04:25Z	79a93be-dirty	metal_jacobian_dynamic_dp_stream_xyzz_affine_scan_target_lookup_tag16_hash_filter25m_rounds_distinct_misses_distance	metal	jacobian_affine_scan_target_lookup_tag32_rounds	536870912	178099044881.708771	true	keep	Fixed-round 25M target lookup with physical distinct-miss queries; scores setup-inclusive wall-clock kangaroo distance/sec
2026-07-01T22:09:11Z	6799fb3-dirty	metal_jacobian_dynamic_dp_stream_xyzz_affine_scan_target_lookup_tag16_hash_filter25m_rounds_distinct_misses_distance	metal	jacobian_affine_scan_target_lookup_tag32_rounds	536870912	134904859680.919525	true	discard	Fixed-round 25M target lookup with physical distinct-miss queries; scores setup-inclusive wall-clock kangaroo distance/sec
2026-07-01T22:17:15Z	bf0633e-dirty	metal_jacobian_dynamic_dp_stream_xyzz_affine_scan_target_lookup_tag16_hash_filter25m_rounds_distinct_misses_distance	metal	jacobian_affine_scan_target_lookup_tag32_rounds	536870912	194258881234.917969	true	discard	Fixed-round 25M target lookup with physical distinct-miss queries; scores setup-inclusive wall-clock kangaroo distance/sec
2026-07-01T22:30:37Z	41f1aa0	metal_jacobian_dynamic_dp_stream_xyzz_affine_scan_target_lookup_tag16_hash_filter25m_rounds_distinct_misses_distance	metal	jacobian_affine_scan_target_lookup_tag32_rounds	536870912	104571563857.380615	true	discard	Fixed-round 25M target lookup with physical distinct-miss queries; scores setup-inclusive wall-clock kangaroo distance/sec
2026-07-02T22:30:01Z	c46140b-dirty	metal_jacobian_dynamic_dp_stream_xyzz_affine_scan_target_lookup_tag16_hash_filter25m_rounds_distinct_misses_distance	metal	jacobian_affine_scan_target_lookup_tag32_rounds	536870912	331146258782.565735	true	discard	Fixed-round 25M target lookup with physical distinct-miss queries; scores setup-inclusive wall-clock kangaroo distance/sec
2026-07-05T02:21:09Z	7abb6a4	metal_jacobian_dynamic_dp_stream_xyzz_affine_scan_target_lookup_tag16_hash_filter25m_rounds_distinct_misses_distance	metal	jacobian_affine_scan_target_lookup_tag32_rounds	536870912	403818789921.076172	true	discard	Fixed-round 25M target lookup with physical distinct-miss queries; scores setup-inclusive wall-clock kangaroo distance/sec
2026-07-05T10:36:38Z	40bcebf-dirty	metal_jacobian_dynamic_dp_stream_xyzz_affine_scan_target_lookup_tag16_hash_filter25m_rounds_distinct_misses_distance	metal	jacobian_affine_scan_target_lookup_tag32_rounds	536870912	226271435558.653534	true	discard	Fixed-round 25M target lookup with physical distinct-miss queries; scores setup-inclusive wall-clock kangaroo distance/sec
2026-07-07T15:17:11Z	1edced1-dirty	metal_jacobian_dynamic_dp_stream_xyzz_affine_scan_target_lookup_tag16_hash_filter1m_rounds_distinct_misses_distance	metal	jacobian_affine_scan_target_lookup_tag32_rounds	134217728	157315104425.454163	true	keep	Medium fixed-round 1M target lookup with physical distinct-miss queries; fast falsifier for setup-inclusive wall-clock kangaroo distance/sec
2026-07-07T15:19:56Z	1edced1-dirty	metal_jacobian_dynamic_dp_stream_xyzz_affine_scan_target_lookup_tag16_hash_filter1m_rounds_distinct_misses_distance	metal	jacobian_affine_scan_target_lookup_tag32_rounds	134217728	234743244634.231079	true	discard	Medium fixed-round 1M target lookup with physical distinct-miss queries; fast falsifier for setup-inclusive wall-clock kangaroo distance/sec
2026-07-07T16:25:27Z	7cf8dbf-dirty	metal_jacobian_dynamic_dp_stream_xyzz_affine_scan_target_lookup_tag16_hash_filter1m_rounds_distinct_misses_distance	metal	jacobian_affine_scan_target_lookup_tag32_rounds	134217728	197339550125.079773	true	discard	Medium fixed-round 1M target lookup with physical distinct-miss queries; fast falsifier for setup-inclusive wall-clock kangaroo distance/sec
2026-07-07T16:25:27Z	7cf8dbf-dirty	metal_jacobian_dynamic_dp_stream_xyzz_affine_scan_target_lookup_tag16_hash_filter1m_rounds_distinct_misses_distance	metal	jacobian_affine_scan_target_lookup_tag32_rounds	134217728	201497410371.192719	true	discard	Medium fixed-round 1M target lookup with physical distinct-miss queries; fast falsifier for setup-inclusive wall-clock kangaroo distance/sec
2026-07-07T16:34:10Z	7cf8dbf-dirty	metal_jacobian_dynamic_dp_stream_xyzz_affine_scan_target_lookup_tag16_hash_filter25m_rounds_distinct_misses_distance	metal	jacobian_affine_scan_target_lookup_tag32_rounds	536870912	174531285283.435028	true	keep	Fixed-round 25M target lookup with physical distinct-miss queries; scores setup-inclusive wall-clock kangaroo distance/sec
2026-07-07T17:11:44Z	5e033a3-dirty	metal_jacobian_dynamic_dp_stream_xyzz_affine_scan_target_lookup_tag16_hash_filter1m_rounds_persistent_distinct_misses_distance	metal	jacobian_affine_scan_target_lookup_tag32_rounds	134217728	454793026992.796143	true	discard	Medium fixed-round 1M target lookup A/B for persistent round walking versus independent round walking; scores setup-inclusive wall-clock kangaroo distance/sec
2026-07-07T17:11:44Z	5e033a3-dirty	metal_jacobian_dynamic_dp_stream_xyzz_affine_scan_target_lookup_tag16_hash_filter1m_rounds_persistent_distinct_misses_distance	metal	jacobian_affine_scan_target_lookup_tag32_rounds	134217728	448823710354.973206	true	discard	Medium fixed-round 1M target lookup A/B for persistent round walking versus independent round walking; scores setup-inclusive wall-clock kangaroo distance/sec
2026-07-07T17:19:07Z	56f4646-dirty	metal_jacobian_dynamic_dp_stream_xyzz_affine_scan_target_lookup_tag16_hash_filter1m_rounds_distinct_misses_distance	metal	jacobian_affine_scan_target_lookup_tag32_rounds	134217728	466874249977.017334	true	discard	Medium fixed-round 1M target lookup with physical distinct-miss queries; fast falsifier for setup-inclusive wall-clock kangaroo distance/sec
2026-07-07T17:19:07Z	56f4646-dirty	metal_jacobian_dynamic_dp_stream_xyzz_affine_scan_target_lookup_tag16_hash_filter1m_rounds_distinct_misses_distance	metal	jacobian_affine_scan_target_lookup_tag32_rounds	134217728	463031178204.484436	true	discard	Medium fixed-round 1M target lookup with physical distinct-miss queries; fast falsifier for setup-inclusive wall-clock kangaroo distance/sec
2026-07-07T17:24:52Z	858355f-dirty	metal_jacobian_dynamic_dp_stream_xyzz_affine_scan_target_lookup_bloom64_hash_filter1m_rounds_distinct_misses_distance	metal	jacobian_affine_scan_target_lookup_tag32_rounds	134217728	459491148585.177246	true	discard	Medium fixed-round 1M physical distinct-miss A/B for Bloom64 hash filtering versus tag16; scores setup-inclusive wall-clock kangaroo distance/sec
2026-07-07T17:24:52Z	858355f-dirty	metal_jacobian_dynamic_dp_stream_xyzz_affine_scan_target_lookup_bloom64_hash_filter1m_rounds_distinct_misses_distance	metal	jacobian_affine_scan_target_lookup_tag32_rounds	134217728	467648911837.260681	true	discard	Medium fixed-round 1M physical distinct-miss A/B for Bloom64 hash filtering versus tag16; scores setup-inclusive wall-clock kangaroo distance/sec
2026-07-07T17:33:06Z	60873d8-dirty	metal_jacobian_dynamic_dp_stream_xyzz_affine_scan_target_lookup_bloom64_hash_filter1m_rounds_distinct_misses_distance	metal	jacobian_affine_scan_target_lookup_tag32_rounds	134217728	461315284181.527527	true	discard	Medium fixed-round 1M physical distinct-miss A/B for Bloom64 hash filtering versus tag16; scores setup-inclusive wall-clock kangaroo distance/sec
2026-07-07T17:33:06Z	60873d8-dirty	metal_jacobian_dynamic_dp_stream_xyzz_affine_scan_target_lookup_bloom64_hash_filter1m_rounds_distinct_misses_distance	metal	jacobian_affine_scan_target_lookup_tag32_rounds	134217728	466302611631.635559	true	discard	Medium fixed-round 1M physical distinct-miss A/B for Bloom64 hash filtering versus tag16; scores setup-inclusive wall-clock kangaroo distance/sec
2026-07-07T17:45:55Z	3005cb4-dirty	metal_jacobian_dynamic_dp_stream_xyzz_affine_scan_target_lookup_tag16_hash_filter1m_rounds_distinct_misses_distance	metal	jacobian_affine_scan_target_lookup_tag32_rounds	134217728	470474223199.067688	true	discard	Medium fixed-round 1M target lookup with physical distinct-miss queries; fast falsifier for setup-inclusive wall-clock kangaroo distance/sec
2026-07-07T17:53:15Z	123ddfe-dirty	metal_jacobian_dynamic_dp_stream_xyzz_affine_scan_target_lookup_tag16_hash_filter1m_rounds_distinct_misses_distance	metal	jacobian_affine_scan_target_lookup_tag32_rounds	134217728	466419436267.362427	true	discard	Medium fixed-round 1M target lookup with physical distinct-miss queries; fast falsifier for setup-inclusive wall-clock kangaroo distance/sec
2026-07-07T17:53:15Z	123ddfe-dirty	metal_jacobian_dynamic_dp_stream_xyzz_affine_scan_target_lookup_tag16_hash_filter1m_rounds_distinct_misses_distance	metal	jacobian_affine_scan_target_lookup_tag32_rounds	134217728	466927220846.680420	true	discard	Medium fixed-round 1M target lookup with physical distinct-miss queries; fast falsifier for setup-inclusive wall-clock kangaroo distance/sec
2026-07-07T17:58:34Z	ce7dc7b-dirty	metal_jacobian_dynamic_dp_stream_xyzz_affine_scan_target_lookup_tag16_hash_filter1m_rounds_distinct_misses_distance	metal	jacobian_affine_scan_target_lookup_tag32_rounds	134217728	497866217610.336304	true	keep	Medium fixed-round 1M target lookup with physical distinct-miss queries; fast falsifier for setup-inclusive wall-clock kangaroo distance/sec
