timestamp	commit	experiment	backend	operation	iterations	ops_per_sec	correctness	status	description
2026-06-28T21:23:12Z	8781d6a-dirty	metal_jacobian_dynamic_dp_stream_xyzz_affine_scan_target_lookup_tag16_hash_filter25m_repeat_lazy_index2048	metal	jacobian_affine_scan_target_lookup_tag32	134217728	115218567.003350	true	discard	Metal XYZZ affine DP scan tag16 repeat-indexed lookup with lazy logical-index materialization in the positive path
2026-06-28T21:23:12Z	8781d6a-dirty	metal_jacobian_dynamic_dp_stream_xyzz_affine_scan_target_lookup_tag16_hash_filter25m_repeat_lazy_index2048	metal	jacobian_affine_scan_target_lookup_tag32	134217728	89733396.716742	true	discard	Metal XYZZ affine DP scan tag16 repeat-indexed lookup with lazy logical-index materialization in the positive path
2026-06-28T21:34:25Z	f15e34d-dirty	metal_jacobian_dynamic_dp_stream_xyzz_affine_scan_target_lookup_tag16_hash_filter25m_repeat_nobounds2048	metal	jacobian_affine_scan_target_lookup_tag32	134217728	48365567.273739	true	discard	Metal XYZZ affine DP scan tag16 repeat-indexed lookup with exact-grid bounds removed from the repeat 2D kernel
2026-06-28T21:34:25Z	f15e34d-dirty	metal_jacobian_dynamic_dp_stream_xyzz_affine_scan_target_lookup_tag16_hash_filter25m_repeat_nobounds2048	metal	jacobian_affine_scan_target_lookup_tag32	134217728	102910335.958366	true	discard	Metal XYZZ affine DP scan tag16 repeat-indexed lookup with exact-grid bounds removed from the repeat 2D kernel
2026-06-28T21:49:53Z	77a0000-dirty	metal_jacobian_dynamic_dp_stream_xyzz_affine_scan_target_lookup_tag16_hash_filter25m_repeat_packed_positive2048	metal	jacobian_affine_scan_target_lookup_tag32	134217728	83647823.749505	true	keep	Metal XYZZ affine DP scan tag16 repeat-indexed lookup with packed positive base/repeat indices for exact resolution
2026-06-28T21:49:53Z	77a0000-dirty	metal_jacobian_dynamic_dp_stream_xyzz_affine_scan_target_lookup_tag16_hash_filter25m_repeat_packed_positive2048	metal	jacobian_affine_scan_target_lookup_tag32	134217728	185840186.793453	true	keep	Metal XYZZ affine DP scan tag16 repeat-indexed lookup with packed positive base/repeat indices for exact resolution
2026-06-28T22:11:38Z	3c18962-dirty	metal_jacobian_dynamic_dp_stream_xyzz_affine_scan_target_lookup_tag16_hash_filter25m_repeat_base_once2048	metal	jacobian_affine_scan_target_lookup_tag32	134217728	79812067.404552	true	discard	Metal XYZZ affine DP scan tag16 repeat-indexed lookup with base-once GPU filtering and logical positive expansion
2026-06-28T22:11:38Z	3c18962-dirty	metal_jacobian_dynamic_dp_stream_xyzz_affine_scan_target_lookup_tag16_hash_filter25m_repeat_base_once2048	metal	jacobian_affine_scan_target_lookup_tag32	134217728	127166925.799653	true	discard	Metal XYZZ affine DP scan tag16 repeat-indexed lookup with base-once GPU filtering and logical positive expansion
2026-06-28T22:26:40Z	f42ce81-dirty	metal_jacobian_dynamic_dp_stream_xyzz_persistent_chain_dp14_steps512	metal	jacobian_affine_walk_dynamic_dp_stream_xyzz_persistent_chain	268435456	51417088.435783	true	discard	Metal XYZZ persistent 512-step chain with hardcoded dp_bits=14 mask
2026-06-28T22:26:40Z	f42ce81-dirty	metal_jacobian_dynamic_dp_stream_xyzz_persistent_chain_dp14_steps512	metal	jacobian_affine_walk_dynamic_dp_stream_xyzz_persistent_chain	268435456	52570949.918239	true	discard	Metal XYZZ persistent 512-step chain with hardcoded dp_bits=14 mask
2026-06-28T22:33:31Z	d6eb307-dirty	target_lookup_filter_build_from_tag32_buckets	macos_cpu	target_lookup_filter_build_from_tag32_buckets	1	38.214781	true	keep	Host setup benchmark comparing legacy rehash/probe filter construction against deriving tag32/tag16 filters from the already-built exact tag32 table
2026-06-28T22:33:31Z	d6eb307-dirty	target_lookup_filter_build_from_tag32_buckets	macos_cpu	target_lookup_filter_build_from_tag32_buckets	1	32.164942	true	keep	Host setup benchmark comparing legacy rehash/probe filter construction against deriving tag32/tag16 filters from the already-built exact tag32 table
2026-06-29T01:06:21Z	c064502-dirty	metal_jacobian_dynamic_dp_stream_xyzz_affine_scan_steps1024_dp7_split512	metal	jacobian_affine_walk_dynamic_dp_stream_xyzz_affine_scan	268435456	108854143.391471	true	discard	Metal XYZZ 1024-step affine-scan packet implemented as two 512-step GPU loop segments
2026-06-29T01:06:21Z	c064502-dirty	metal_jacobian_dynamic_dp_stream_xyzz_affine_scan_steps1024_dp7_split512	metal	jacobian_affine_walk_dynamic_dp_stream_xyzz_affine_scan	268435456	99513137.154800	true	discard	Metal XYZZ 1024-step affine-scan packet implemented as two 512-step GPU loop segments
2026-06-29T01:20:04Z	c72e85d-dirty	metal_jacobian_dynamic_dp_stream_xyzz_affine_scan_steps512	metal	jacobian_affine_walk_dynamic_dp_stream_xyzz_affine_scan	134217728	86880043.232946	true	discard	Metal XYZZ 512-step packet walk with GPU per-walker distances and CPU batched affine DP scan
2026-06-29T01:20:05Z	c72e85d-dirty	metal_jacobian_dynamic_dp_stream_xyzz_affine_scan_steps512	metal	jacobian_affine_walk_dynamic_dp_stream_xyzz_affine_scan	134217728	87343594.418012	true	discard	Metal XYZZ 512-step packet walk with GPU per-walker distances and CPU batched affine DP scan
2026-06-29T01:32:36Z	c72e85d-dirty	target_lookup_tag32_build_from_keys	macos_cpu	target_lookup_tag32_build_from_injected_keys	1	1.722704	true	keep	Host setup benchmark comparing legacy injected-key tag32 table construction against prehashed duplicate checks and prehashed table insertion
2026-06-29T01:33:09Z	c72e85d-dirty	target_lookup_tag32_build_from_keys	macos_cpu	target_lookup_tag32_build_from_injected_keys	1	1.435882	true	keep	Host setup benchmark comparing legacy injected-key tag32 table construction against prehashed duplicate checks and prehashed table insertion
2026-06-29T01:41:35Z	334b4c9-dirty	target_lookup_tag32_parallel_insert	macos_cpu	target_lookup_tag32_parallel_insert_probe	1	0.928064	true	keep	Host setup benchmark comparing prehashed serial tag32 insertion against parallel CAS insertion with semantic find-all verification
2026-06-29T01:42:03Z	334b4c9-dirty	target_lookup_tag32_parallel_insert	macos_cpu	target_lookup_tag32_parallel_insert_probe	1	1.883752	true	keep	Host setup benchmark comparing prehashed serial tag32 insertion against parallel CAS insertion with semantic find-all verification
2026-06-29T13:29:59Z	d09c07b-dirty	target_lookup_tag32_parallel_insert	macos_cpu	target_lookup_tag32_parallel_insert_probe	1	1.543172	true	discard	Host setup benchmark comparing prehashed serial tag32 insertion against parallel CAS insertion with semantic find-all verification
2026-06-29T13:29:59Z	d09c07b-dirty	target_lookup_tag32_parallel_insert	macos_cpu	target_lookup_tag32_parallel_insert_probe	1	1.355487	true	discard	Host setup benchmark comparing prehashed serial tag32 insertion against parallel CAS insertion with semantic find-all verification
2026-06-29T13:33:41Z	d09c07b-dirty	target_lookup_tag32_parallel_insert	macos_cpu	target_lookup_tag32_parallel_insert_probe	1	15828741.937858	true	keep	Host setup benchmark measuring absolute parallel CAS tag32 insertion throughput with semantic find-all verification
2026-06-29T13:33:41Z	d09c07b-dirty	target_lookup_tag32_parallel_insert	macos_cpu	target_lookup_tag32_parallel_insert_probe	1	23960212.926636	true	keep	Host setup benchmark measuring absolute parallel CAS tag32 insertion throughput with semantic find-all verification
2026-06-29T13:47:18Z	d78b747-dirty	target_lookup_tag32_parallel_insert	macos_cpu	target_lookup_tag32_parallel_insert_probe	1	25595577.431431	true	discard	Host setup benchmark measuring absolute parallel CAS tag32 insertion throughput with semantic find-all verification
2026-06-29T13:56:23Z	e89d455-dirty	metal_jacobian_dynamic_dp_stream_xyzz_affine_scan_target_lookup_tag16_hash_filter25m_steps1024_dp7_setup	metal	jacobian_affine_scan_target_lookup_tag32	268435456	94764959.095380	true	keep	Metal XYZZ 1024-step dp7 affine-scan target lookup versus accepted 512-step dp8 repeat path, scored with setup-inclusive throughput
2026-06-29T13:59:53Z	e89d455-dirty	metal_jacobian_dynamic_dp_stream_xyzz_affine_scan_target_lookup_tag16_hash_filter25m_steps1024_dp7_setup	metal	jacobian_affine_scan_target_lookup_tag32	268435456	91131253.131533	true	keep	Metal XYZZ 1024-step dp7 affine-scan target lookup versus accepted 512-step dp8 repeat path, scored with setup-inclusive throughput
2026-06-29T13:59:53Z	e89d455-dirty	metal_jacobian_dynamic_dp_stream_xyzz_affine_scan_target_lookup_tag16_hash_filter25m_steps1024_dp7_setup	metal	jacobian_affine_scan_target_lookup_tag32	268435456	83374247.889218	true	keep	Metal XYZZ 1024-step dp7 affine-scan target lookup versus accepted 512-step dp8 repeat path, scored with setup-inclusive throughput
2026-06-29T14:10:47Z	ceb4eef-dirty	metal_jacobian_dynamic_dp_stream_xyzz_affine_scan_target_lookup_tag16_hash_filter25m_steps1024_dp6_repeat512_setup	metal	jacobian_affine_scan_target_lookup_tag32	268435456	84162048.224048	true	discard	Metal XYZZ 1024-step dp6 repeat512 25M-target lookup density tradeoff versus accepted 1024-step dp7 repeat1024 setup gate
2026-06-29T14:28:45Z	a9db816-dirty	target_lookup_tag32_parallel_insert_workers6	macos_cpu	target_lookup_tag32_parallel_insert_probe	1	39543696.391783	true	keep	Host setup benchmark testing RCK_VALIDATION_WORKERS=6 for 25M tag32 parallel insert on Apple Silicon
2026-06-29T14:28:45Z	a9db816-dirty	target_lookup_tag32_parallel_insert_workers6	macos_cpu	target_lookup_tag32_parallel_insert_probe	1	26108366.758003	true	keep	Host setup benchmark testing RCK_VALIDATION_WORKERS=6 for 25M tag32 parallel insert on Apple Silicon
2026-06-29T14:39:46Z	ffad75f-dirty	metal_jacobian_dynamic_dp_stream_xyzz_affine_scan_target_lookup_tag16_hash_filter25m_steps1024_dp7_setup_workers6	metal	jacobian_affine_scan_target_lookup_tag32	268435456	25890541.312106	true	discard	Metal XYZZ 1024-step dp7 25M-target setup gate with RCK_VALIDATION_WORKERS=6 versus default worker count
2026-06-29T14:39:46Z	ffad75f-dirty	metal_jacobian_dynamic_dp_stream_xyzz_affine_scan_target_lookup_tag16_hash_filter25m_steps1024_dp7_setup_workers6	metal	jacobian_affine_scan_target_lookup_tag32	268435456	74730044.051988	true	discard	Metal XYZZ 1024-step dp7 25M-target setup gate with RCK_VALIDATION_WORKERS=6 versus default worker count
2026-06-29T14:49:12Z	1e00829-dirty	metal_jacobian_dynamic_dp_stream_xyzz_affine_scan_target_lookup_tag16_hash_filter25m_steps2048_dp6_setup	metal	jacobian_affine_scan_target_lookup_tag32	268435456	89036615.161581	true	keep	Metal XYZZ 2048-step dp6 affine-scan target lookup versus accepted 1024-step dp7 setup gate
2026-06-29T14:53:40Z	1e00829-dirty	metal_jacobian_dynamic_dp_stream_xyzz_affine_scan_target_lookup_tag16_hash_filter25m_steps2048_dp6_setup	metal	jacobian_affine_scan_target_lookup_tag32	268435456	75814186.065546	true	keep	Metal XYZZ 2048-step dp6 affine-scan target lookup versus accepted 1024-step dp7 setup gate
2026-06-29T14:53:41Z	1e00829-dirty	metal_jacobian_dynamic_dp_stream_xyzz_affine_scan_target_lookup_tag16_hash_filter25m_steps2048_dp6_setup	metal	jacobian_affine_scan_target_lookup_tag32	268435456	70379199.180135	true	keep	Metal XYZZ 2048-step dp6 affine-scan target lookup versus accepted 1024-step dp7 setup gate
2026-06-29T15:06:19Z	1e2ab9a-dirty	metal_jacobian_dynamic_dp_stream_xyzz_affine_scan_target_lookup_tag16_hash_filter25m_steps4096_dp5_setup	metal	jacobian_affine_scan_target_lookup_tag32	268435456	75314077.842822	true	discard	Metal XYZZ 4096-step dp5 affine-scan target lookup versus accepted 2048-step dp6 setup gate
2026-06-29T15:06:19Z	1e2ab9a-dirty	metal_jacobian_dynamic_dp_stream_xyzz_affine_scan_target_lookup_tag16_hash_filter25m_steps4096_dp5_setup	metal	jacobian_affine_scan_target_lookup_tag32	268435456	64790787.951621	true	discard	Metal XYZZ 4096-step dp5 affine-scan target lookup versus accepted 2048-step dp6 setup gate
2026-06-29T15:22:18Z	6c6f1f3-dirty	metal_jacobian_dynamic_dp_stream_xyzz_affine_scan_target_lookup_tag16_hash_filter25m_repeat_resolver_cache	metal	jacobian_affine_scan_target_lookup_tag32	268435456	118709682.938361	true	discard	Metal XYZZ 2048-step dp6 repeat-mode target lookup with cached exact resolver versus same command on the paired baseline
2026-06-29T15:22:18Z	6c6f1f3-dirty	metal_jacobian_dynamic_dp_stream_xyzz_affine_scan_target_lookup_tag16_hash_filter25m_repeat_resolver_cache	metal	jacobian_affine_scan_target_lookup_tag32	268435456	43137775.235818	true	discard	Metal XYZZ 2048-step dp6 repeat-mode target lookup with cached exact resolver versus same command on the paired baseline
2026-06-29T15:26:27Z	6c6f1f3-dirty	metal_jacobian_dynamic_dp_stream_xyzz_affine_scan_target_lookup_tag16_hash_filter25m_repeat4096_resolver_cache	metal	jacobian_affine_scan_target_lookup_tag32	268435456	207220633.884313	true	keep	Metal XYZZ 2048-step dp6 repeat4096 target lookup with cached exact resolver versus same command on the paired baseline
2026-06-29T15:32:46Z	6c6f1f3-dirty	metal_jacobian_dynamic_dp_stream_xyzz_affine_scan_target_lookup_tag16_hash_filter25m_repeat4096_resolver_cache	metal	jacobian_affine_scan_target_lookup_tag32	268435456	227899576.779546	true	discard	Metal XYZZ 2048-step dp6 repeat4096 target lookup with cached exact resolver versus same command on the paired baseline
2026-06-29T15:32:46Z	6c6f1f3-dirty	metal_jacobian_dynamic_dp_stream_xyzz_affine_scan_target_lookup_tag16_hash_filter25m_repeat4096_resolver_cache	metal	jacobian_affine_scan_target_lookup_tag32	268435456	126730884.616311	true	discard	Metal XYZZ 2048-step dp6 repeat4096 target lookup with cached exact resolver versus same command on the paired baseline
2026-06-29T15:54:40Z	2c49c90-dirty	metal_jacobian_dynamic_dp_stream_xyzz_affine_scan_target_lookup_tag16_hash_filter25m_scaled4_j4_setup	metal	jacobian_affine_scan_target_lookup_tag32	268435456	93508028.064667	true	keep	Metal XYZZ 2048-step dp6 scaled4-balanced 4-jump affine-scan target lookup versus accepted 16-jump power2 setup gate
2026-06-29T15:54:40Z	2c49c90-dirty	metal_jacobian_dynamic_dp_stream_xyzz_affine_scan_target_lookup_tag16_hash_filter25m_scaled4_j4_setup	metal	jacobian_affine_scan_target_lookup_tag32	268435456	57402367.574511	true	keep	Metal XYZZ 2048-step dp6 scaled4-balanced 4-jump affine-scan target lookup versus accepted 16-jump power2 setup gate
2026-06-29T16:07:23Z	f8dceeb-dirty	metal_jacobian_dynamic_dp_stream_xyzz_affine_scan_target_lookup_tag16_hash_filter25m_scaled4_vs_power2_j4_setup	metal	jacobian_affine_scan_target_lookup_tag32	268435456	89145487.327852	true	discard	Metal XYZZ 2048-step dp6 25M-target setup gate isolating scaled4-balanced distances versus 4-jump power2 distances
2026-06-29T16:07:23Z	f8dceeb-dirty	metal_jacobian_dynamic_dp_stream_xyzz_affine_scan_target_lookup_tag16_hash_filter25m_scaled4_vs_power2_j4_setup	metal	jacobian_affine_scan_target_lookup_tag32	268435456	55752350.612289	true	discard	Metal XYZZ 2048-step dp6 25M-target setup gate isolating scaled4-balanced distances versus 4-jump power2 distances
2026-06-29T16:13:48Z	f8dceeb-dirty	metal_jacobian_dynamic_dp_stream_xyzz_affine_scan_target_lookup_tag16_hash_filter25m_power2_j4_setup	metal	jacobian_affine_scan_target_lookup_tag32	268435456	63460011.180716	true	discard	Metal XYZZ 2048-step dp6 25M-target setup gate isolating 4-jump power2 against the accepted 16-jump power2 baseline
2026-06-29T16:13:48Z	f8dceeb-dirty	metal_jacobian_dynamic_dp_stream_xyzz_affine_scan_target_lookup_tag16_hash_filter25m_power2_j4_setup	metal	jacobian_affine_scan_target_lookup_tag32	268435456	44460373.620674	true	discard	Metal XYZZ 2048-step dp6 25M-target setup gate isolating 4-jump power2 against the accepted 16-jump power2 baseline
2026-06-29T16:23:17Z	f8dceeb-dirty	metal_jacobian_dynamic_dp_stream_xyzz_affine_scan_target_lookup_tag16_hash_filter25m_scaled8_j8_setup	metal	jacobian_affine_scan_target_lookup_tag32	268435456	83880983.784617	true	discard	Metal XYZZ 2048-step dp6 25M-target setup gate testing an 8-jump balanced-distance schedule against the accepted 16-jump power2 baseline
2026-06-29T16:23:17Z	f8dceeb-dirty	metal_jacobian_dynamic_dp_stream_xyzz_affine_scan_target_lookup_tag16_hash_filter25m_scaled8_j8_setup	metal	jacobian_affine_scan_target_lookup_tag32	268435456	41081001.458294	true	discard	Metal XYZZ 2048-step dp6 25M-target setup gate testing an 8-jump balanced-distance schedule against the accepted 16-jump power2 baseline
2026-06-29T16:39:13Z	444dec5-dirty	metal_jacobian_dynamic_dp_stream_xyzz_affine_scan_target_lookup_tag16_hash_filter25m_scaled4_j4_steady5000_setup	metal	jacobian_affine_scan_target_lookup_tag32	805306368	103992785.327127	true	discard	Metal XYZZ 2048-step dp6 scaled4-balanced 4-jump 25M-target steady-state setup-amortized gate with min_ms=5000 versus 16-jump power2
2026-06-29T16:39:13Z	444dec5-dirty	metal_jacobian_dynamic_dp_stream_xyzz_affine_scan_target_lookup_tag16_hash_filter25m_scaled4_j4_steady5000_setup	metal	jacobian_affine_scan_target_lookup_tag32	536870912	56480003.605877	true	discard	Metal XYZZ 2048-step dp6 scaled4-balanced 4-jump 25M-target steady-state setup-amortized gate with min_ms=5000 versus 16-jump power2
2026-06-30T17:41:34Z	e01d29c-dirty	metal_jacobian_dynamic_dp_stream_xyzz_affine_scan_target_lookup_tag16_hash_filter_m3_auto_repeat	metal	jacobian_affine_scan_target_lookup_tag32	8388608	59126178.560367	true	keep	M3 large-target repeat-mode auto lookup routing versus explicit CPU lookup
2026-06-30T17:43:03Z	e01d29c-dirty	metal_jacobian_dynamic_dp_stream_xyzz_affine_scan_target_lookup_tag16_hash_filter_m3_auto_repeat	metal	jacobian_affine_scan_target_lookup_tag32	8388608	55107844.798467	true	discard	M3 large-target repeat-mode auto lookup routing versus explicit CPU lookup
2026-06-30T17:49:11Z	e01d29c-dirty	metal_jacobian_dynamic_dp_stream_xyzz_affine_scan_target_lookup_tag16_hash_filter_m3_auto_repeat	metal	jacobian_affine_scan_target_lookup_tag32	8388608	45756095.881506	true	keep	M3 large-target repeat-mode auto lookup routing versus explicit CPU lookup at 16M logical queries
2026-06-30T18:19:21Z	25a76bc-dirty	metal_jacobian_dynamic_dp_stream_xyzz_affine_scan_target_lookup_tag16_hash_filter_m3_sparse_repeat_exact	metal	jacobian_affine_scan_target_lookup_tag32	8388608	52838131.057009	true	keep	M3 repeat-indexed tag16 hash filter sparse exact resolver versus full logical output materialization
2026-06-30T18:34:05Z	95ac546-dirty	metal_jacobian_dynamic_dp_stream_xyzz_affine_scan_target_lookup_tag16_hash_filter_m3_sparse_repeat_exact	metal	jacobian_affine_scan_target_lookup_tag32	8388608	59464996.026491	true	keep	M3 repeat-indexed tag16 hash filter sparse exact resolver versus full logical output materialization
2026-06-30T18:34:05Z	95ac546-dirty	metal_jacobian_dynamic_dp_stream_xyzz_affine_scan_target_lookup_tag16_hash_filter_m3_sparse_repeat_exact	metal	jacobian_affine_scan_target_lookup_tag32	8388608	65898116.327166	true	keep	M3 repeat-indexed tag16 hash filter sparse exact resolver versus full logical output materialization
2026-06-30T18:54:44Z	e5892e2-dirty	metal_jacobian_dynamic_dp_stream_xyzz_affine_scan_target_lookup_tag16_hash_filter_m3_auto_repeat_tg768	metal	jacobian_affine_scan_target_lookup_tag32	8388608	56327326.574853	true	discard	M3 large-repeat auto lookup threadgroup 768 policy versus prior 512 default
2026-06-30T18:54:44Z	e5892e2-dirty	metal_jacobian_dynamic_dp_stream_xyzz_affine_scan_target_lookup_tag16_hash_filter_m3_auto_repeat_tg768	metal	jacobian_affine_scan_target_lookup_tag32	8388608	56615931.341812	true	discard	M3 large-repeat auto lookup threadgroup 768 policy versus prior 512 default
2026-06-30T19:02:24Z	e5892e2-dirty	metal_jacobian_dynamic_dp_stream_xyzz_affine_scan_target_lookup_tag16_hash_filter_m3_sparse_repeat_base_index	metal	jacobian_affine_scan_target_lookup_tag32	8388608	53328905.600368	true	keep	M3 repeat-indexed tag16 hash filter sparse base-index positive encoding versus logical positive indices
2026-06-30T19:02:25Z	e5892e2-dirty	metal_jacobian_dynamic_dp_stream_xyzz_affine_scan_target_lookup_tag16_hash_filter_m3_sparse_repeat_base_index	metal	jacobian_affine_scan_target_lookup_tag32	4194304	41034435.022514	true	keep	M3 repeat-indexed tag16 hash filter sparse base-index positive encoding versus logical positive indices
2026-06-30T19:17:01Z	d16d3fd-dirty	metal_jacobian_dynamic_dp_stream_xyzz_affine_scan_target_lookup_tag16_hash_filter_m3_fused_filter_setup	metal	jacobian_affine_scan_target_lookup_tag32	4194304	5059542.988443	true	keep	M3 repeat-indexed tag16 hash filter fused target-filter setup versus post-build filter derivation
2026-06-30T19:17:01Z	d16d3fd-dirty	metal_jacobian_dynamic_dp_stream_xyzz_affine_scan_target_lookup_tag16_hash_filter_m3_fused_filter_setup	metal	jacobian_affine_scan_target_lookup_tag32	4194304	5103671.503285	true	keep	M3 repeat-indexed tag16 hash filter fused target-filter setup versus post-build filter derivation
2026-06-30T19:32:41Z	99581a8-dirty	metal_jacobian_dynamic_dp_stream_xyzz_affine_scan_target_lookup_tag16_hash_filter_m3_sparse_repeat_base_counts	metal	jacobian_affine_scan_target_lookup_tag32	8388608	41317942.907647	true	keep	M3 repeat-indexed tag16 hash filter sparse exact resolver with per-base positive counts
2026-06-30T19:32:41Z	99581a8-dirty	metal_jacobian_dynamic_dp_stream_xyzz_affine_scan_target_lookup_tag16_hash_filter_m3_sparse_repeat_base_counts	metal	jacobian_affine_scan_target_lookup_tag32	8388608	51789496.856066	true	keep	M3 repeat-indexed tag16 hash filter sparse exact resolver with per-base positive counts
2026-06-30T19:42:13Z	a5cb61a-dirty	metal_jacobian_dynamic_dp_stream_xyzz_affine_scan_target_lookup_tag16_hash_filter_m3_grouped_base_positive	metal	jacobian_affine_scan_target_lookup_tag32	4194304	34769942.745748	true	discard	M3 repeat-indexed tag16 hash filter grouped threadgroup compaction for base-index positives
